,CASE_ENQUIRY_ID,OPEN_DT,TARGET_DT,CLOSED_DT,OnTime_Status,CASE_STATUS,CLOSURE_REASON,CASE_TITLE,SUBJECT,REASON,TYPE,QUEUE,Department,SubmittedPhoto,ClosedPhoto,Location,fire_district,pwd_district,city_council_district,police_district,neighborhood,neighborhood_services_district,ward,precinct,land_usage,LOCATION_STREET_NAME,LOCATION_ZIPCODE,Property_Type,Property_ID,LATITUDE,LONGITUDE,Source,Geocoded_Location,lon_wm,lat_wm,wm_x,wm_y
500440,101001883069,08/15/2016 12:56:20 PM,08/15/2017 12:56:19 PM,12/02/2016 10:29:55 PM,ONTIME,Closed,Case Closed. Closed date : 2016-12-02 22:29:55.3 Case Resolved Missing bricks were replaced and additional bricks were reset.,Sidewalk Repair/Red Brick/South End,Public Works Department,Highway Maintenance,Sidewalk Repair,PWDx_Highway Construction,PWDx,,,INTERSECTION of Dartmouth Pl & Dartmouth St  Boston  MA,4.0,1C,2.0,D4,South End,6.0,4,0401,,INTERSECTION Dartmouth Pl & Dartmouth St,,Intersection,10123.0,42.3594,-71.0587,Employee Generated,"(0, 0)",-7910218.300431989,5214968.784796895,-7910218.300431989,5214968.784796895
847029,101001039835,03/03/2014 03:04:56 PM,,03/03/2014 03:04:57 PM,ONTIME,Closed,Case Closed Internal Case Performed by Highway Maintenance crew.,Pothole Repair (Internal),Public Works Department,Highway Maintenance,Pothole Repair (Internal),PWDx_District 02: Jamaica Plain,PWDx,,,10 Boynton St  Jamaica Plain  MA  02130,9.0,02,6.0,E13,Jamaica Plain,11.0,Ward 11,1110,R3,10 Boynton St,2130.0,Address,18653.0,42.3056,-71.1141,Employee Generated,"(42.3056, -71.1141)",-7916385.4002219355,5206867.336714857,-7916385.4002219355,5206867.336714857
312899,101001842096,06/22/2016 12:00:00 PM,06/22/2017 12:00:31 PM,12/05/2016 08:00:45 AM,ONTIME,Closed,Case Closed. Closed date : 2016-12-05 08:00:45.717 Case Resolved Tree was removed by North-Eastern Tree Service. A new tree request case will be made for this location. If you have any questions please call the Park Line at 617-635-7275.,Tree Maintenance Requests,Parks & Recreation Department,Trees,Tree Maintenance Requests,PARK_Tree Maintenance Request,PARK,,,43 Arborough Rd  Roslindale  MA  02131,9.0,06,5.0,E5,Roslindale,10.0,Ward 20,2004,R1,43 Arborough Rd,2131.0,Address,4282.0,42.2902,-71.1275,Constituent Call,"(42.2902, -71.1275)",-7917877.081398566,5204549.609657571,-7917877.081398566,5204549.609657571
52067,101001803477,05/31/2016 05:48:00 PM,06/15/2016 08:30:00 AM,06/01/2016 12:16:26 PM,ONTIME,Closed,Case Closed. Closed date : 2016-06-01 12:16:26.337 Case Resolved reset clock 702L,PRINTED : susan,Public Works Department,Street Lights,Street Light Outages,PWDx_Street Light Outages,PWDx,https://mayors24.cityofboston.gov/media/boston/report/photos/574e06b7696391ab14c8241b/report.jpg,,INTERSECTION of Center Plz & Tremont St  Boston  MA,3.0,1B,2.0,A1,Downtown / Financial District,3.0,3,0306,,INTERSECTION Center Plz & Tremont St,,Intersection,14619.0,42.3594,-71.0587,Citizens Connect App,"(0, 0)",-7910218.300431989,5214968.784796895,-7910218.300431989,5214968.784796895
479488,101000829204,04/28/2013 12:47:19 PM,,04/30/2013 09:50:32 PM,ONTIME,Closed,Case Closed Bulk Item Automation,Schedule a Bulk Item Pickup,Public Works Department,Sanitation,Schedule a Bulk Item Pickup,PWDx_Schedule a Bulk Item Pickup,PWDx,,,14 Hillside St  Mission Hill  MA  02120,9.0,10A,8.0,B2,Mission Hill,14.0,Ward 10,1005,R3,14 Hillside St,2120.0,Address,74174.0,42.3296,-71.1003,Constituent Call,"(42.3296, -71.1003)",-7914849.19124899,5210480.509474907,-7914849.19124899,5210480.509474907
296605,101001262328,01/29/2015 03:16:08 PM,02/02/2015 03:16:08 PM,01/31/2015 12:25:05 PM,ONTIME,Closed,Case Closed Case Noted,Request for Snow Plowing,Public Works Department,Street Cleaning,Request for Snow Plowing,PWDx_District 1B: North End,PWDx,https://mayors24.cityofboston.gov/media/boston/report/photos/54ca94ec6963753f0d6c9bc1/report.jpg,,40-42 Cedar Lane Way  Boston  MA  02114,3.0,1B,8.0,A1,Beacon Hill,14.0,Ward 5,0511,R2,40-42 Cedar Lane Way,2114.0,Address,27117.0,42.3583,-71.0702,Citizens Connect App,"(42.3583, -71.0702)",-7911498.474576111,5214803.07238003,-7911498.474576111,5214803.07238003
890733,101001381754,05/20/2015 02:01:00 PM,05/21/2015 02:01:41 PM,05/20/2015 08:59:28 PM,ONTIME,Closed,Case Closed. Closed date : 2015-05-20 20:59:28.517 Case Resolved clear at this time,Parking Enforcement,Transportation - Traffic Division,Enforcement & Abandoned Vehicles,Parking Enforcement,BTDT_Parking Enforcement,BTDT,,,13 Appleton St  Boston  MA  02116,4.0,1C,2.0,D4,South End,6.0,Ward 5,0501,R1,13 Appleton St,2116.0,Address,3871.0,42.3462,-71.0712,Constituent Call,"(42.3462, -71.0712)",-7911609.794066905,5212980.427211153,-7911609.794066905,5212980.427211153
512516,101001361404,04/22/2015 12:38:07 PM,04/23/2015 12:38:06 PM,,OVERDUE,Open,,Request for Pothole Repair,Public Works Department,Highway Maintenance,Request for Pothole Repair,INFO01_GenericeFormforOtherServiceRequestTypes,INFO,,,INTERSECTION of Bremen St & Curtis St  East Boston  MA,1.0,09,1.0,A7,East Boston,1.0,Ward 1,0110,,INTERSECTION Bremen St & Curtis St,,Intersection,1917.0,42.3836,-71.02199999999999,Constituent Call,"(42.3836, -71.022)",-7906132.875119874,5218615.192198251,-7906132.875119874,5218615.192198251
482865,101001394571,05/26/2015 09:26:00 AM,05/29/2015 09:26:23 AM,08/04/2015 09:24:01 AM,OVERDUE,Closed,Case Closed. Closed date : 2015-08-04 09:24:01.133 PERMIS: Permit Issued,Building Inspection Request,Inspectional Services,Building,Building Inspection Request,ISD_Building (INTERNAL),ISD,,,77-81 Broadway St  Boston  MA  02116,4.0,1C,2.0,A1,Back Bay,6.0,Ward 5,0501,RC,77-81 Broadway St,2116.0,Address,162595.0,42.35,-71.0675,Constituent Call,"(42.35, -71.0675)",-7911197.911950969,5213552.790380158,-7911197.911950969,5213552.790380158
350522,101001693632,01/14/2016 01:24:52 PM,,01/14/2016 01:24:53 PM,ONTIME,Closed,Case Closed. Closed date : 2016-01-14 13:24:53.617 Internal Case Performed by Highway Maintenance crew.,Pothole Repair (Internal),Public Works Department,Highway Maintenance,Pothole Repair (Internal),PWDx_District 02: Jamaica Plain,PWDx,,,INTERSECTION of Harding Rd & Stella Rd  Roslindale  MA,12.0,02,5.0,E18,Roslindale,10.0,Ward 18,1807,,INTERSECTION Harding Rd & Stella Rd,,Intersection,5637.0,42.2813,-71.1178,Employee Generated,"(42.2813, -71.1178)",-7916797.282337871,5203210.402388626,-7916797.282337871,5203210.402388626
553954,101001322882,03/03/2015 02:55:35 PM,,,ONTIME,Open,,Animal Generic Request,Animal Control,Animal Issues,Animal Generic Request,INFO01_GenericeFormforOtherServiceRequestTypes,INFO,,,15 Washington St  Brighton  MA  02135,11.0,04,9.0,D14,Allston / Brighton,15.0,Ward 21,2110,C,15 Washington St,2135.0,Address,143471.0,42.3428,-71.1404,Constituent Call,"(42.3428, -71.1404)",-7919313.1028298,5212468.342122461,-7919313.1028298,5212468.342122461
548952,101000857638,06/11/2013 12:06:24 PM,06/25/2013 12:06:23 PM,07/09/2013 10:04:20 AM,OVERDUE,Closed,Case Closed Case Resolved,Street Light Outages,Public Works Department,Street Lights,Street Light Outages,PWDx_Street Light_Pending_Contractor (Internal),PWDx,,,1 Greenwood Cir  Hyde Park  MA  02136,12.0,08,5.0,E18,Hyde Park,10.0,Ward 18,1814,R1,1 Greenwood Cir,2136.0,Address,66939.0,42.2649,-71.1202,Constituent Call,"(42.2649, -71.1202)",-7917064.449115774,5200743.145012188,-7917064.449115774,5200743.145012188
343328,101001213204,11/07/2014 10:46:49 AM,02/05/2015 10:46:49 AM,,OVERDUE,Open,,Chronic Dampness/Mold,Inspectional Services,Housing,Chronic Dampness/Mold,ISD_Housing (INTERNAL),ISD,,,1 Cliffmont St  Roslindale  MA  02131,12.0,08,5.0,E18,Roslindale,10.0,18,1809,E,1 Cliffmont St,2131.0,Address,209043.0,42.2776,-71.1208,Constituent Call,"(42.2776, -71.1208)",-7917131.240810251,5202653.708967634,-7917131.240810251,5202653.708967634
411785,101001916660,09/23/2016 05:26:38 PM,09/29/2016 08:30:00 AM,09/25/2016 09:16:04 AM,ONTIME,Closed,Case Closed. Closed date : 2016-09-25 09:16:04.513 Case Noted barrel emptied,Poor Conditions of Property,Public Works Department,Code Enforcement,Poor Conditions of Property,PWDx_Code Enforcement,PWDx,https://mayors24.cityofboston.gov/media/boston/report/photos/57e59e096963aae66f367ef7/report.jpg,https://cityworker.cityofboston.gov:8443/attachments/report/57e59e4ed052a2900813b882/closed_photo/Report.jpg,INTERSECTION of Burrell St & Dudley St  Roxbury  MA,7.0,03,9.0,B2,Roxbury,13.0,8,0806,,INTERSECTION Burrell St & Dudley St,,Intersection,9543.0,42.3594,-71.0587,Citizens Connect App,"(0, 0)",-7910218.300431989,5214968.784796895,-7910218.300431989,5214968.784796895
293040,101001524389,08/18/2015 02:09:07 PM,,08/18/2015 02:09:06 PM,ONTIME,Closed,Case Closed. Closed date : 2015-08-18 14:09:06.53 Internal Case Performed by Highway Maintenance crew.,Pothole Repair (Internal),Public Works Department,Highway Maintenance,Pothole Repair (Internal),PWDx_District 07: South Dorchester,PWDx,,,8 Ogden St  Dorchester  MA  02124,8.0,07,3.0,B3,Dorchester,7.0,Ward 17,1704,R3,8 Ogden St,2124.0,Address,286451.0,42.2809,-71.0712,Employee Generated,"(42.2809, -71.0712)",-7911609.794066905,5203150.21774014,-7911609.794066905,5203150.21774014
357375,101001618180,10/22/2015 02:37:00 PM,,,ONTIME,Open,,Sidewalk Cover / Manhole,Boston Water & Sewer Commission,Sidewalk Cover / Manhole,Sidewalk Cover / Manhole,INFO01_GenericeFormforOtherServiceRequestTypes,INFO,,,INTERSECTION of Braddock Park & Public Alley No 539  Boston  MA,4.0,1C,2.0,D4,South End,6.0,Ward 4,0403,,INTERSECTION Braddock Park & Public Alley No 539,,Intersection,1810.0,42.343999999999994,-71.0783,Constituent Call,"(42.344, -71.0783)",-7912400.162451537,5212649.074873866,-7912400.162451537,5212649.074873866
255148,101001966075,12/07/2016 11:50:00 AM,12/21/2016 11:50:01 AM,12/07/2016 08:57:16 PM,ONTIME,Closed,"Case Closed. Closed date : 2016-12-07 20:57:16.803 Case Noted Cannot locate....no. ""no stopping "" sign found missing on Beacon @ Clarendon....have previously asked for some clarification as to the exact location being referred to.",Missing Sign,Transportation - Traffic Division,Signs & Signals,Missing Sign,BTDT_District 06,BTDT,,,INTERSECTION of Clarendon St & Beacon St  Boston  MA,4.0,1C,7.0,D4,Back Bay,14.0,5,0507,,INTERSECTION Clarendon St & Beacon St,,Intersection,16488.0,42.3594,-71.0587,Constituent Call,"(0, 0)",-7910218.300431989,5214968.784796895,-7910218.300431989,5214968.784796895
497790,101000793146,02/28/2013 08:39:14 AM,03/04/2013 08:39:14 AM,02/28/2013 02:10:52 PM,ONTIME,Closed,Case Closed VIOISS: Violation Filed,Food Alert - Unconfirmed,Inspectional Services,Health,Food Alert - Unconfirmed,ISD_Health (INTERNAL),ISD,,,669 Centre St  Jamaica Plain  MA  02130,9.0,02,6.0,E13,Jamaica Plain,11.0,Ward 19,1905,C,669 Centre St,2130.0,Address,158077.0,42.3125,-71.1144,Constituent Call,"(42.3125, -71.1144)",-7916418.796069175,5207905.982756919,-7916418.796069175,5207905.982756919
212603,101001958821,11/26/2016 11:13:00 AM,12/12/2016 08:30:00 AM,11/28/2016 11:27:17 AM,ONTIME,Closed,Case Closed. Closed date : 2016-11-28 11:27:17.35 Case Resolved This Location has been made safe and referred to Park Improvement division. See case #101001959740 for status of the request.,Equipment Repair: Boston Common - BPRD,Transportation - Traffic Division,Signs & Signals,Sign Repair,PARK_Administration,PARK,https://mayors24.cityofboston.gov/media/boston/report/photos/5839b49604859c3a5caeb6d1/photo_20161126_111201.jpg,,1A Charles St  Boston  MA  02108,3.0,1C,8.0,A1,Boston,14.0,05,0503,,1A Charles St,2108.0,Address,342808.0,42.3548,-71.0681,Citizens Connect App,"(42.3548, -71.0681)",-7911264.703645445,5214275.824896976,-7911264.703645445,5214275.824896976
742438,101001781999,05/04/2016 08:02:00 AM,,07/05/2016 11:16:21 AM,ONTIME,Closed,Case Closed. Closed date : 2016-07-05 11:16:21.097 Case Resolved This bike was removed and taken to the Boston Transportation Department Tow lot. If you have any questions  please feel free to contact us through BOS:311.,Abandoned Bicycle,Mayor's 24 Hour Hotline,Abandoned Bicycle,Abandoned Bicycle,BTDT_Abandoned Bicycle,BTDT,https://mayors24.cityofboston.gov/media/boston/report/photos/5729e4d604859952566ffa6a/report.jpg,,12 Oswald St  Mission Hill  MA  02120,9.0,10A,8.0,B2,Mission Hill,14.0,Ward 10,1003,CM,12 Oswald St,2120.0,Address,106065.0,42.3311,-71.104,Citizens Connect App,"(42.3311, -71.104)",-7915261.073364923,5210706.37853724,-7915261.073364923,5210706.37853724
51864,101001010353,01/22/2014 02:30:21 PM,,01/27/2014 04:35:00 PM,ONTIME,Closed,Case Closed Bulk Item Automation,Schedule Bulk Item Pickup,Public Works Department,Sanitation,Schedule a Bulk Item Pickup SS,PWDx_Schedule a Bulk Item Pickup,PWDx,,,69 Ruthven St  Dorchester  MA  02121,9.0,10B,7.0,B2,Roxbury,13.0,Ward 12,1209,R4,69 Ruthven St,2121.0,Address,302589.0,42.3133,-71.0917,Self Service,"(42.3133, -71.0917)",-7913891.843628168,5208026.412852298,-7913891.843628168,5208026.412852298
429083,101000893027,08/02/2013 12:47:18 PM,09/16/2013 12:47:18 PM,08/02/2013 12:48:32 PM,ONTIME,Closed,Case Closed Case Resolved,General Lighting Request,Public Works Department,Street Lights,General Lighting Request,PWDx_Street Light_General Lighting Request,PWDx,,,293 K St  South Boston  MA  02127,6.0,05,2.0,C6,South Boston / South Boston Waterfront,5.0,Ward 6,0606,CM,293 K St,2127.0,Address,80547.0,42.3335,-71.0376,Maximo Integration,"(42.3335, -71.0376)",-7907869.45917625,5211067.780241204,-7907869.45917625,5211067.780241204
753982,101000825118,04/21/2013 09:08:45 AM,04/11/2015 09:08:44 AM,05/22/2013 12:37:04 PM,ONTIME,Closed,Case Closed Case Noted residents of this condo building do not want a new tree planted.  Pit is slated to be filled.,New Tree Requests,Parks & Recreation Department,Trees,New Tree Requests,PARK_New Tree Requests,PARK,,,28 Dwight St  Roxbury  MA  02118,4.0,1C,2.0,D4,South End,4.0,Ward 3,0307,CD,28 Dwight St,2118.0,Address,50358.0,42.3442,-71.0689,Self Service,"(42.3442, -71.0689)",-7911353.759238079,5212679.19733448,-7911353.759238079,5212679.19733448
39524,101000454846,07/25/2012 08:29:55 AM,08/22/2012 08:29:54 AM,07/25/2012 10:06:28 AM,ONTIME,Closed,Case Closed Case Resolved looked at cart at 59 rutland sq nothing wrong with it at 10:06.,Request for Recycling Cart,Public Works Department,Recycling,Request for Recycling Cart,PWDx_Recycling,PWDx,,,59 Rutland Sq  Roxbury  MA  02118,4.0,1C,7.0,D4,South End,6.0,Ward 4,0404,CM,59 Rutland Sq,2118.0,Address,120150.0,42.3426,-71.0787,Constituent Call,"(42.3426, -71.0787)",-7912444.690247853,5212438.2203325955,-7912444.690247853,5212438.2203325955
268681,101000829896,04/29/2013 01:17:56 PM,05/01/2013 01:17:56 PM,04/29/2013 03:17:05 PM,ONTIME,Closed,Case Closed Case Resolved picked up,Requests for Street Cleaning,Public Works Department,Street Cleaning,Requests for Street Cleaning,PWDx_District 08: Hyde Park,PWDx,,,29 Pierce St  Hyde Park  MA  02136,12.0,08,5.0,E18,Hyde Park,10.0,Ward 18,1813,R2,29 Pierce St,2136.0,Address,110272.0,42.2555,-71.1188,City Worker App,"(42.2555, -71.1188)",-7916908.601828664,5199329.27465352,-7916908.601828664,5199329.27465352
757815,101000403843,04/03/2012 01:38:56 PM,04/17/2012 01:38:56 PM,,OVERDUE,Open,,General Comments For a Program or Policy,Mayor's 24 Hour Hotline,Employee & General Comments,General Comments For a Program or Policy,INFO_General Comments Complaints Compliments,INFO,,,,,,,,,,,,,,,,,42.3594,-71.0587,Constituent Call,"(0, 0)",-7910218.300431989,5214968.784796895,-7910218.300431989,5214968.784796895
691251,101001541087,08/26/2015 12:52:44 PM,,09/04/2015 01:17:59 PM,ONTIME,Closed,Case Closed. Closed date : 2015-09-04 13:17:59.95 Bulk Item Automation,Schedule Bulk Item Pickup,Public Works Department,Sanitation,Schedule a Bulk Item Pickup SS,PWDx_Schedule a Bulk Item Pickup,PWDx,,,80 Florida St  Dorchester  MA  02124,8.0,07,3.0,C11,Dorchester,7.0,Ward 16,1606,CD,80 Florida St,2124.0,Address,59002.0,42.2894,-71.0588,Self Service,"(42.2894, -71.0588)",-7910229.432381068,5204429.223736858,-7910229.432381068,5204429.223736858
522042,101001436576,07/25/2015 11:40:00 AM,,07/25/2015 12:14:37 PM,ONTIME,Closed,Case Closed. Closed date : 2015-07-25 12:14:37.413 Case Resolved bird has left balconey,Animal Generic Request,Animal Control,Animal Issues,Animal Generic Request,INFO01_GenericeFormforOtherServiceRequestTypes,INFO,,,52 Haynes St  East Boston  MA  02128,1.0,09,1.0,A7,East Boston,1.0,Ward 1,0103,R1,52 Haynes St,2128.0,Address,72201.0,42.3664,-71.0371,Constituent Call,"(42.3664, -71.0371)",-7907813.799430853,5216023.386334294,-7907813.799430853,5216023.386334294
884439,101000345993,10/24/2011 01:16:22 AM,11/07/2011 01:16:22 AM,10/24/2011 01:30:23 AM,ONTIME,Closed,Case Closed Duplicate of Existing Case,Street Light Outages,Public Works Department,Street Lights,Street Light Outages,PWDx_Street Light Outages,PWDx,,,30-44 Wareham St  Roxbury  MA  02118,4.0,1C,2.0,D4,Roxbury,6.0,08,0801,C,30-44 Wareham St,2118.0,Address,142776.0,42.3395,-71.0675,Constituent Call,"(42.3395, -71.0675)",-7911197.911950969,5211971.344841737,-7911197.911950969,5211971.344841737
666543,101000808283,03/21/2013 08:24:44 AM,,03/21/2013 08:24:45 AM,ONTIME,Closed,Case Closed Internal Case Performed by Highway Maintenance crew.,Pothole Repair (Internal),Public Works Department,Highway Maintenance,Pothole Repair (Internal),PWDx_District 07: South Dorchester,PWDx,,,112 Beaumont St  Dorchester  MA  02122,8.0,07,3.0,C11,Dorchester,7.0,Ward 16,1608.0,R1,112 Beaumont St,2122.0,Address,12932.0,42.2857,-71.0558,Employee Generated,"(42.2857, -71.0558)",-7909895.473908688,5203872.458740576,-7909895.473908688,5203872.458740576
580,101001770216,04/16/2016 11:51:00 PM,05/10/2016 08:30:00 AM,04/28/2016 02:52:00 PM,ONTIME,Closed,Case Closed. Closed date : 2016-04-28 14:52:00.47 Case Resolved cart requested filled new cart # 416316756 04/27/2016,Request for Recycling Cart,Public Works Department,Recycling,Request for Recycling Cart,PWDx_Recycling Sent to Contractor,PWDx,,,15 Stanley St  Dorchester  MA  02125,7.0,03,3.0,C11,Dorchester,8.0,Ward 15,1501,R2,15 Stanley St,2125.0,Address,313944.0,42.3113,-71.0685,Self Service,"(42.3113, -71.0685)",-7911309.231441763,5207725.340483947,-7911309.231441763,5207725.340483947
767958,101000361902,12/08/2011 02:43:11 PM,04/06/2012 02:43:11 PM,12/21/2011 11:38:29 AM,ONTIME,Closed,Case Closed TFA: Tenant Failed Apt\Was Not Home,Unsatisfactory Living Conditions,Inspectional Services,Housing,Unsatisfactory Living Conditions,ISD_Housing (INTERNAL),ISD,,,272 Bowdoin St  Dorchester  MA  02125,7.0,03,3.0,C11,Dorchester,8.0,Ward 15,1503,R3,272 Bowdoin St,2125.0,Address,192129.0,42.3071,-71.0664,Constituent Call,"(42.3071, -71.0664)",-7911075.460511098,5207093.119648082,-7911075.460511098,5207093.119648082
344718,101000472678,08/31/2012 02:36:11 PM,09/04/2012 02:36:11 PM,09/06/2012 11:52:25 AM,OVERDUE,Closed,Case Closed Case Resolved patched,Request for Pothole Repair,Public Works Department,Highway Maintenance,Request for Pothole Repair,PWDx_District 03: North Dorchester,PWDx,,,INTERSECTION of Dudley St & Shirley St  Roxbury  MA,7.0,03,7.0,B2,Roxbury,13.0,Ward 8,0805,,INTERSECTION Dudley St & Shirley St,,Intersection,4281.0,42.3231,-71.0733,Citizens Connect App,"(42.3231, -71.0733)",-7911843.564997571,5209501.805772859,-7911843.564997571,5209501.805772859
531425,101001234130,12/16/2014 01:52:08 PM,,12/16/2014 01:52:09 PM,ONTIME,Closed,Case Closed Internal Case Performed by Highway Maintenance crew.,Pothole Repair (Internal),Public Works Department,Highway Maintenance,Pothole Repair (Internal),PWDx_District 06: West Roxbury and Roslindale,PWDx,,,INTERSECTION of Lagrange St & VFW Pkwy  West Roxbury  MA,12.0,06,6.0,E5,West Roxbury,12.0,Ward 20,2017,,INTERSECTION Lagrange St & VFW Pkwy,,Intersection,6701.0,42.2905,-71.1681,Employee Generated,"(42.2905, -71.1681)",-7922396.652724772,5204594.754772028,-7922396.652724772,5204594.754772028
521021,101001039531,03/03/2014 11:13:08 AM,03/05/2014 11:13:08 AM,03/03/2014 11:13:09 AM,ONTIME,Closed,Case Closed Case Resolved Marked completed at case creation,Request for Pothole Repair,Public Works Department,Highway Maintenance,Request for Pothole Repair,PWDx_District 04: Allston/Brighton,PWDx,,,109 Brighton Ave  Allston  MA  02134,11.0,04,9.0,D14,Allston / Brighton,15.0,Ward 21,2104,C,109 Brighton Ave,2134.0,Address,195980.0,42.353,-71.1305,City Worker App,"(42.353, -71.1305)",-7918211.039870945,5214004.680482203,-7918211.039870945,5214004.680482203
530261,101001965581,12/06/2016 04:34:00 PM,12/07/2016 04:34:39 PM,12/07/2016 08:13:27 AM,ONTIME,Closed,Case Closed. Closed date : 2016-12-07 08:13:27.5 Case Noted Please contact City of Boston permit dept. at 617-635-4909,Sidewalk Repair (Make Safe),Public Works Department,Highway Maintenance,Sidewalk Repair (Make Safe),PWDx_District 03: North Dorchester,PWDx,,,25 Bellevue St  Dorchester  MA  02125,7.0,03,3.0,C11,Dorchester,8.0,Ward 15,1501,R2,25 Bellevue St,2125.0,Address,13848.0,42.3111,-71.0678,Constituent Call,"(42.3111, -71.0678)",-7911231.307798209,5207695.233773285,-7911231.307798209,5207695.233773285
312093,101001785231,05/09/2016 09:53:00 AM,09/06/2016 09:53:24 AM,05/31/2016 09:58:17 AM,ONTIME,Closed,Case Closed. Closed date : 2016-05-31 09:58:17.867 :,Unsatisfactory Living Conditions,Inspectional Services,Housing,Unsatisfactory Living Conditions,ISD_Housing (INTERNAL),ISD,,,24 Rockvale Cir  Jamaica Plain  MA  02130,9.0,02,6.0,E13,Jamaica Plain,11.0,Ward 11,1107,C,24 Rockvale Cir,2130.0,Address,300743.0,42.3077,-71.1057,Constituent Call,"(42.3077, -71.1057)",-7915450.316499272,5207183.434327747,-7915450.316499272,5207183.434327747
507415,101001655156,11/30/2015 04:30:00 PM,12/01/2015 04:30:37 PM,12/01/2015 12:26:21 PM,ONTIME,Closed,Case Closed. Closed date : 2015-12-01 12:26:21.02 Case Noted Materials Serviced,Missed Leaf or Yard Trash: District 1B,Public Works Department,Sanitation,Missed Trash/Recycling/Yard Waste/Bulk Item,PWDx_Missed Trash\Recycling\Yard Waste\Bulk Item,PWDx,,https://cityworker.cityofboston.gov:8443/attachments/report/565cc044d052fa972b39c11c/closed_photo/Report.jpg,47-49 Hancock St  Boston  MA  02114,3.0,1B,1.0,A1,Beacon Hill,3.0,Ward 3,0306,CM,47-49 Hancock St,2114.0,Address,68777.0,42.3598,-71.0646,Constituent Call,"(42.3598, -71.0646)",-7910875.085427669,5215029.0445768135,-7910875.085427669,5215029.0445768135
78049,101001251028,01/21/2015 11:02:48 AM,02/04/2015 11:02:48 AM,03/11/2015 02:31:12 PM,OVERDUE,Closed,Case Closed Case Resolved Work completed 3/11/15.,Sign Repair,Transportation - Traffic Division,Signs & Signals,Sign Repair,BTDT_Sign Shop_Sign Installation,BTDT,https://cityworker.cityofboston.gov:8443/attachments/report/54bfcda5d052fe3c4d00fc46/photo/Report.jpg,,INTERSECTION of Washington St & Pheasant St  Hyde Park  MA,12.0,06,6.0,E18,West Roxbury,10.0,Ward 20,2003,,INTERSECTION Washington St & Pheasant St,,Intersection,5989.0,42.2723,-71.1445,City Worker App,"(42.2723, -71.1445)",-7919769.512742051,5201856.340197138,-7919769.512742051,5201856.340197138
41636,101000827302,04/24/2013 08:28:00 PM,04/29/2013 08:30:00 AM,04/25/2013 08:07:51 AM,ONTIME,Closed,Case Closed Case Invalid Caller put in case online  then realized she was trying to schedule a bulk item  not report it was missed,Missed Bulk Item Pickup: District 04,Public Works Department,Sanitation,Missed Trash/Recycling/Yard Waste/Bulk Item,PWDx_Missed Trash\Recycling\Yard Waste\Bulk Item,PWDx,,,15 Bellvista Rd  Brighton  MA  02135,11.0,04,9.0,D14,Allston / Brighton,15.0,Ward 21,2108,CM,15 Bellvista Rd,2135.0,Address,14051.0,42.3463,-71.1383,Self Service,"(42.3463, -71.1383)",-7919079.331899133,5212995.488956545,-7919079.331899133,5212995.488956545
641557,101001746402,03/14/2016 04:06:52 PM,03/15/2016 04:06:51 PM,03/15/2016 11:33:49 AM,ONTIME,Closed,Case Closed. Closed date : 2016-03-15 11:33:49.797 Case Resolved Two vehicles ticketed.,Parking Enforcement,Transportation - Traffic Division,Enforcement & Abandoned Vehicles,Parking Enforcement,BTDT_Parking Enforcement,BTDT,,,34 Frankfort St  East Boston  MA  02128,1.0,09,1.0,A7,East Boston,1.0,Ward 1,0102,R3,34 Frankfort St,2128.0,Address,60517.0,42.3698,-71.0355,Citizens Connect App,"(42.3698, -71.0355)",-7907635.688245585,5216535.663766815,-7907635.688245585,5216535.663766815
96470,101001749178,03/18/2016 09:18:00 AM,04/17/2016 09:18:00 AM,03/23/2016 07:46:47 AM,ONTIME,Closed,Case Closed. Closed date : 2016-03-23 07:46:47.567 NOVIO: No Violation Found/No Cause,Rodent Activity,Inspectional Services,Environmental Services,Rodent Activity,ISD_Environmental Services (INTERNAL),ISD,,,25 Charles St  Boston  MA  02114,3.0,1B,8.0,A1,Beacon Hill,14.0,Ward 5,0503,C,25 Charles St,2114.0,Address,364451.0,42.3569,-71.0697,Constituent Call,"(42.3569, -71.0697)",-7911442.814830715,5214592.169862997,-7911442.814830715,5214592.169862997
287023,101001664099,12/13/2015 10:50:53 AM,12/15/2015 08:30:00 AM,12/13/2015 05:58:18 PM,ONTIME,Closed,Case Closed. Closed date : 2015-12-13 17:58:18.703 Case Resolved Pick up and clean trash,Requests for Street Cleaning,Public Works Department,Street Cleaning,Requests for Street Cleaning,PWDx_District 05: South Boston,PWDx,,https://cityworker.cityofboston.gov:8443/attachments/report/566d941ed052bf0ef15b550b/closed_photo/Report.jpg,211 W Eighth St  South Boston  MA  02127,6.0,05,2.0,C6,South Boston / South Boston Waterfront,5.0,Ward 7,0705,R3,211 W Eighth St,2127.0,Address,52557.0,42.333,-71.0516,Citizens Connect App,"(42.333, -71.0516)",-7909427.932047356,5210992.487082298,-7909427.932047356,5210992.487082298
901598,101001961641,11/30/2016 04:29:00 PM,03/30/2017 04:29:36 PM,01/11/2017 08:50:36 AM,ONTIME,Closed,Case Closed. Closed date : 2017-01-11 08:50:36.097 :,Unsatisfactory Living Conditions,Inspectional Services,Housing,Unsatisfactory Living Conditions,ISD_Housing (INTERNAL),ISD,,,25 Polk St  Charlestown  MA  02129,3.0,1A,1.0,A15,Charlestown,2.0,Ward 2,0204,E,25 Polk St,2129.0,Address,294363.0,42.3793,-71.061,Constituent Call,"(42.3793, -71.061)",-7910474.335260814,5217967.174180252,-7910474.335260814,5217967.174180252
868535,101001228405,12/04/2014 08:07:44 PM,,12/10/2014 04:36:39 PM,ONTIME,Closed,Case Closed Bulk Item Automation,Schedule Bulk Item Pickup,Public Works Department,Sanitation,Schedule a Bulk Item Pickup SS,PWDx_Schedule a Bulk Item Pickup,PWDx,,,9 Adams St  Hyde Park  MA  02136,12.0,08,5.0,E18,Hyde Park,10.0,Ward 18,1819,R2,9 Adams St,2136.0,Address,345.0,42.2525,-71.1296,Self Service,"(42.2525, -71.1296)",-7918110.852329232,5198878.083795288,-7918110.852329232,5198878.083795288
739944,101000394486,03/13/2012 08:59:45 PM,,03/19/2012 09:42:52 PM,ONTIME,Closed,Case Closed Bulk Item Automation,Schedule a Bulk Item Pickup,Public Works Department,Sanitation,Schedule a Bulk Item Pickup,PWDx_Schedule a Bulk Item Pickup,PWDx,,,6-8 Westmore Rd  Mattapan  MA  02126,8.0,07,4.0,B3,Greater Mattapan,9.0,Ward 14,1408,R2,6-8 Westmore Rd,2126.0,Address,148726.0,42.2849,-71.0956,Self Service,"(42.2849, -71.0956)",-7914325.9896422615,5203752.081419269,-7914325.9896422615,5203752.081419269
622992,101000806798,03/19/2013 10:11:40 AM,03/21/2013 10:11:40 AM,03/19/2013 12:54:43 PM,ONTIME,Closed,Case Closed Case Resolved plowed,Request for Snow Plowing,Public Works Department,Street Cleaning,Request for Snow Plowing,PWDx_District 06: West Roxbury and Roslindale,PWDx,,,10 Knoll St  Roslindale  MA  02131,9.0,06,5.0,E5,Roslindale,10.0,Ward 20,2001,R1,10 Knoll St,2131.0,Address,82327.0,42.2909,-71.133,Constituent Call,"(42.2909, -71.133)",-7918489.338597928,5204654.948592442,-7918489.338597928,5204654.948592442
205732,101001055173,03/27/2014 09:06:32 AM,07/25/2014 09:06:32 AM,,OVERDUE,Open,,Unsatisfactory Living Conditions,Inspectional Services,Housing,Unsatisfactory Living Conditions,ISD_Housing (INTERNAL),ISD,,,52 Deering Rd  Mattapan  MA  02126,8.0,07,4.0,B3,Greater Mattapan,9.0,Ward 14,1414,R3,52 Deering Rd,2126.0,Address,223192.0,42.2843,-71.0939,Constituent Call,"(42.2843, -71.0939)",-7914136.746507913,5203661.79943142,-7914136.746507913,5203661.79943142
670260,101000977055,12/05/2013 11:23:08 AM,01/19/2014 11:23:08 AM,12/05/2013 11:39:49 AM,ONTIME,Closed,Case Closed Case Resolved There is two (2) existing signalized crosswalks in the vicinity of the commuter rail station - One at Belgrade & W. Roxbury Parkway and one at Belgrade at Iona/McCraw St (at pedestrian tunnel to station) Anawan would be an unsignalized crossing in a heavy traffic area that would not be a safe place to cross. Folks should use the signalized crossings annotated above.,New Sign  Crosswalk or Pavement Marking,Transportation - Traffic Division,Signs & Signals,New Sign  Crosswalk or Pavement Marking,BTDT_Engineering_New Sign and Pavement Marking Requests,BTDT,,,INTERSECTION of Anawan Ave & Belgrade Ave  Roslindale  MA,9.0,06,5.0,E5,Roslindale,10.0,Ward 20,2008.0,,INTERSECTION Anawan Ave & Belgrade Ave,,Intersection,429.0,42.286,-71.1465,Constituent Call,"(42.286, -71.1465)",-7919992.151723638,5203917.600630165,-7919992.151723638,5203917.600630165
2580,101001638722,11/19/2015 11:55:00 AM,01/03/2016 11:55:00 AM,12/10/2015 07:23:59 AM,ONTIME,Closed,Case Closed. Closed date : 2015-12-10 07:23:59.177 Case Resolved Lowered lights and replaced broken lamps. Plugged in feed and checked out tree. Outlet seemed to be loose. They will have to get it replaced for next years lighting.  Lit tree for ceremony.  Webb/Doyle  EP 12-9-15,PRINTED,Public Works Department,Street Lights,General Lighting Request,PWDx_Street Light_General Lighting Request,PWDx,,,0 W Dedham St  Roxbury  MA  02118,4.0,1C,2.0,D4,South End,6.0,Ward 9,0901,E,0 W Dedham St,2118.0,Address,46907.0,42.3594,-71.0587,Employee Generated,"(0, 0)",-7910218.300431989,5214968.784796895,-7910218.300431989,5214968.784796895
364377,101001717265,02/15/2016 05:48:51 PM,02/17/2016 08:30:00 AM,02/15/2016 10:52:50 PM,ONTIME,Closed,Case Closed. Closed date : 2016-02-15 22:52:50.4 Case Resolved clear at this time,Parking Enforcement,Transportation - Traffic Division,Enforcement & Abandoned Vehicles,Parking Enforcement,BTDT_Parking Enforcement,BTDT,,,INTERSECTION of W Springfield St & Shawmut Ave  Roxbury  MA,4.0,1C,9.0,D4,South End,6.0,9,0902,,INTERSECTION W Springfield St & Shawmut Ave,,Intersection,16212.0,42.3594,-71.0587,Citizens Connect App,"(0, 0)",-7910218.300431989,5214968.784796895,-7910218.300431989,5214968.784796895
1135,101001786667,05/10/2016 02:56:00 PM,05/11/2016 02:56:12 PM,05/10/2016 03:50:13 PM,ONTIME,Closed,Case Closed. Closed date : 2016-05-10 15:50:13.307 Case Resolved Picked up metal frame around tree pit,Requests for Street Cleaning,Public Works Department,Street Cleaning,Requests for Street Cleaning,PWDx_District 05: South Boston,PWDx,,https://cityworker.cityofboston.gov:8443/attachments/report/57322f2ad05243d389fbcca6/closed_photo/Report.jpg,21 Thomas Park  South Boston  MA  02127,6.0,05,2.0,C6,South Boston / South Boston Waterfront,5.0,Ward 7,0704,CM,21 Thomas Park,2127.0,Address,135613.0,42.3337,-71.0461,Constituent Call,"(42.3337, -71.0461)",-7908815.674847993,5211097.897672368,-7908815.674847993,5211097.897672368
387570,101001418356,06/26/2015 03:36:00 PM,07/10/2015 03:36:42 PM,07/13/2015 10:19:59 AM,OVERDUE,Closed,Case Closed. Closed date : 2015-07-13 10:19:59.42 Case Resolved Dear Constituent     This City of Boston apologizes for the inconvenience the paving of Market St caused.      I will speak to the engineers to make sure there are enough police details  cones  and detours etc.. when needed  to minimize traffic inconveniences.            For any questions or concerns  please contact the number listed below    Sincerely      Mark Cardarelli  Supervisor of Utility Coordination and Compliance  Boston Public Works Department  617-635-4951 Office,PublicWorks: Complaint,Mayor's 24 Hour Hotline,Employee & General Comments,General Comments For a Program or Policy,PWDx_Contractor Complaints,PWDx,,,,,,,,,,,,,,,,,42.3594,-71.0587,Constituent Call,"(0, 0)",-7910218.300431989,5214968.784796895,-7910218.300431989,5214968.784796895
535576,101001423042,07/05/2015 09:09:03 AM,07/07/2015 08:30:00 AM,07/05/2015 09:09:06 AM,ONTIME,Closed,Case Closed. Closed date : 2015-07-05 09:09:06.077 Case Resolved Marked completed at case creation,Requests for Street Cleaning,Public Works Department,Street Cleaning,Requests for Street Cleaning,PWDx_District 06: West Roxbury and Roslindale,PWDx,https://cityworker.cityofboston.gov:8443/attachments/report/55992c8ad0528e43ce38e6a1/photo/Report.jpg,,233 Cummins Hwy  Roslindale  MA  02131,12.0,06,5.0,E5,Roslindale,10.0,Ward 19,1910,R1,233 Cummins Hwy,2131.0,Address,44847.0,42.2808,-71.1212,City Worker App,"(42.2808, -71.1212)",-7917175.768606569,5203135.171637715,-7917175.768606569,5203135.171637715
223199,101001024356,02/11/2014 08:40:58 PM,,02/12/2014 08:40:48 AM,ONTIME,Closed,Case Closed Case Resolved this sidewalk does not beling to parks dept,Ground Maintenance: East Boston Greenway,Parks & Recreation Department,Park Maintenance & Safety,Ground Maintenance,PARK_Maintenance_Region 1,PARK,,,,,,,,,,,,,,,,,42.3594,-71.0587,Constituent Call,"(0, 0)",-7910218.300431989,5214968.784796895,-7910218.300431989,5214968.784796895
187084,101001302932,02/17/2015 11:07:09 PM,03/04/2015 08:30:00 AM,03/06/2015 01:09:13 PM,OVERDUE,Closed,Case Closed Case Resolved,BTDT: Complaint,Mayor's 24 Hour Hotline,Employee & General Comments,General Comments For a Program or Policy,BTDT_General Comments,BTDT,,,,,,,,,,,,,,,,,42.3594,-71.0587,Constituent Call,"(0, 0)",-7910218.300431989,5214968.784796895,-7910218.300431989,5214968.784796895
746483,101001850168,07/02/2016 03:42:58 PM,,07/04/2016 04:05:16 PM,ONTIME,Closed,Case Closed. Closed date : 2016-07-04 16:05:16.39 Case Resolved 1 syringe recovered on 7/2 from the intersection of Atherton Street and Mozart Street  Jamaica Plain.�,Needle Pickup,Mayor's 24 Hour Hotline,Needle Program,Needle Pickup,GEN_Needle_Pickup,GEN_,,,INTERSECTION of Mozart St & Atherton St  Jamaica Plain  MA,9.0,10A,6.0,E13,Jamaica Plain,11.0,11,1007,,INTERSECTION Mozart St & Atherton St,,Intersection,15446.0,42.3594,-71.0587,Citizens Connect App,"(0, 0)",-7910218.300431989,5214968.784796895,-7910218.300431989,5214968.784796895
501756,101000429429,05/30/2012 11:37:05 AM,06/01/2012 11:37:05 AM,05/31/2012 12:49:31 PM,ONTIME,Closed,Case Closed Case Resolved patched,Request for Pothole Repair,Public Works Department,Highway Maintenance,Request for Pothole Repair,PWDx_District 1C: Downtown,PWDx,,,INTERSECTION of Massachusetts Ave & Commonwealth Ave. Underpass  Boston  MA,4.0,1C,8.0,D4,Back Bay,14.0,Ward 5,0509,,INTERSECTION Massachusetts Ave & Commonwealth Ave. Underpass,,Intersection,7134.0,42.3491,-71.0886,City Worker App,"(42.3491, -71.0886)",-7913546.753206708,5213417.227555266,-7913546.753206708,5213417.227555266
497956,101001766582,04/12/2016 10:10:00 AM,05/27/2016 10:10:00 AM,04/21/2016 02:17:27 PM,ONTIME,Closed,Case Closed. Closed date : 2016-04-21 14:17:27.65 Case Resolved removed sneakers from wires BG KH DP 301L 702L,PRINTED : //MD //,Public Works Department,Street Lights,General Lighting Request,PWDx_Street Light_General Lighting Request,PWDx,,,105 Cornell St  Roslindale  MA  02131,12.0,06,5.0,E5,Roslindale,10.0,Ward 18,1810,R2,105 Cornell St,2131.0,Address,400929.0,42.2772,-71.1318,Constituent Call,"(42.2772, -71.1318)",-7918355.755208977,5202593.5278529655,-7918355.755208977,5202593.5278529655
832711,101001111787,06/19/2014 12:38:38 PM,06/23/2014 12:38:38 PM,06/20/2014 06:21:51 AM,ONTIME,Closed,Case Closed Case Resolved Case resolved. Yard waste collected 6/20.,Missed Leaf or Yard Trash: District 07,Public Works Department,Sanitation,Missed Trash/Recycling/Yard Waste/Bulk Item,PWDx_Missed Trash\Recycling\Yard Waste\Bulk Item,PWDx,,,7 Fairfax St  Dorchester  MA  02124,8.0,07,3.0,C11,Dorchester,7.0,Ward 16,1608,R1,7 Fairfax St,2124.0,Address,55561.0,42.2839,-71.0597,Constituent Call,"(42.2839, -71.0597)",-7910329.619922782,5203601.611917187,-7910329.619922782,5203601.611917187
359539,101001731177,03/07/2016 09:43:24 AM,03/08/2016 09:43:24 AM,03/07/2016 11:51:43 AM,ONTIME,Closed,Case Closed. Closed date : 2016-03-07 11:51:43.483 Case Resolved,Requests for Street Cleaning,Public Works Department,Street Cleaning,Requests for Street Cleaning,PWDx_District 1C: Downtown,PWDx,https://mayors24.cityofboston.gov/media/boston/report/photos/56dd9389696312f319ccce4a/report.jpg,https://cityworker.cityofboston.gov:8443/attachments/report/56dd93d3d052649456b717b4/closed_photo/Report.jpg,88 Berkeley St  Boston  MA  02116,4.0,1C,2.0,D4,South End,6.0,Ward 5,0501,CM,88 Berkeley St,2116.0,Address,15064.0,42.3473,-71.0714,Citizens Connect App,"(42.3473, -71.0714)",-7911632.057965063,5213146.107728223,-7911632.057965063,5213146.107728223
664585,101001082290,05/05/2014 03:26:05 PM,05/05/2015 03:26:05 PM,05/05/2014 03:26:06 PM,ONTIME,Closed,Case Closed Internal Case Performed by Highway Maintenance crew.,Sidewalk Repair (Internal),Public Works Department,Highway Maintenance,Sidewalk Repair (Internal),PWDx_District 02: Jamaica Plain,PWDx,,,INTERSECTION of Forest Hills St & Washington St  Jamaica Plain  MA,9.0,02,7.0,E13,Jamaica Plain,11.0,Ward 11,1105.0,,INTERSECTION Forest Hills St & Washington St,,Intersection,5002.0,42.3123,-71.1017,Employee Generated,"(42.3123, -71.1017)",-7915005.038536099,5207875.875472253,-7915005.038536099,5207875.875472253
107816,101001768067,04/14/2016 06:41:00 AM,04/20/2016 08:30:00 AM,04/21/2016 12:17:08 PM,OVERDUE,Closed,Case Closed. Closed date : 2016-04-21 12:17:08.1 CORR: Corrected,Building Inspection Request,Inspectional Services,Building,Building Inspection Request,ISD_Building (INTERNAL),ISD,,,40 Carruth St  Dorchester  MA  02124,8.0,07,3.0,C11,Dorchester,7.0,Ward 16,1608,R1,40 Carruth St,2124.0,Address,26115.0,42.2836,-71.0604,Self Service,"(42.2836, -71.0604)",-7910407.543566337,5203556.471532283,-7910407.543566337,5203556.471532283
32742,101000813081,03/28/2013 01:55:51 PM,,03/28/2013 02:07:49 PM,ONTIME,Closed,Case Closed Case Resolved Water will be restored this afternoon.,Billing Complaint,Boston Water & Sewer Commission,Billing,Billing Complaint,BWSC_All Cases,BWSC,,,11 O St  South Boston  MA  02127,6.0,05,2.0,C6,South Boston / South Boston Waterfront,5.0,Ward 6,0607,R3,11 O St,2127.0,Address,104310.0,42.3379,-71.0295,Constituent Call,"(42.3379, -71.0295)",-7906967.771300825,5211730.38585209,-7906967.771300825,5211730.38585209
877136,101000489423,10/08/2012 08:19:24 AM,10/22/2012 08:19:24 AM,10/09/2012 07:34:49 AM,ONTIME,Closed,Case Closed Duplicate of Existing Case Case #489424 being processed.,Sign Repair,Transportation - Traffic Division,Signs & Signals,Sign Repair,BTDT_District 01,BTDT,,,28 Orient Ave  East Boston  MA  02128,1.0,09,1.0,A7,East Boston,1.0,Ward 1,0113,R2,28 Orient Ave,2128.0,Address,105617.0,42.3898,-71.0003,City Worker App,"(42.3898, -71.0003)",-7903717.242169661,5219549.621896081,-7903717.242169661,5219549.621896081
463632,101000322027,08/30/2011 07:58:05 AM,09/01/2011 07:58:05 AM,08/30/2011 08:10:22 AM,ONTIME,Closed,Case Closed Case Scheduled Items have been scheduled for pickup.,Schedule a Bulk Item Pickup,Public Works Department,Sanitation,Schedule a Bulk Item Pickup,PWDx_Schedule a Bulk Item Pickup,PWDx,,,1 Sentry Hill Pl  Boston  MA  02114,3.0,1B,8.0,A1,Beacon Hill,14.0,Ward 5,0504,R1,1 Sentry Hill Pl,2114.0,Address,125224.0,42.3597,-71.0693,Self Service,"(42.3597, -71.0693)",-7911398.287034397,5215013.979595871,-7911398.287034397,5215013.979595871
100811,101001583364,09/20/2015 11:24:58 AM,09/22/2015 08:30:00 AM,09/20/2015 11:25:04 AM,ONTIME,Closed,Case Closed. Closed date : 2015-09-20 11:25:04.477 Case Resolved Marked completed at case creation,Pick up Dead Animal,Public Works Department,Street Cleaning,Pick up Dead Animal,PWDx_District 07: South Dorchester,PWDx,https://cityworker.cityofboston.gov:8443/attachments/report/55fecfd0d052f8c25f1ef428/photo/Report.jpg,,927 Adams St  Dorchester  MA  02124,8.0,07,3.0,C11,Dorchester,7.0,Ward 16,1611,R2,927 Adams St,2124.0,Address,1011.0,42.2797,-71.0594,City Worker App,"(42.2797, -71.0594)",-7910296.224075544,5202969.666087048,-7910296.224075544,5202969.666087048
80869,101001643557,11/27/2015 01:41:45 PM,11/30/2015 01:41:45 PM,11/27/2015 03:56:38 PM,ONTIME,Closed,Case Closed. Closed date : 2015-11-27 15:56:38.02 Case Resolved Pick up glass,Requests for Street Cleaning,Public Works Department,Street Cleaning,Requests for Street Cleaning,PWDx_District 10A: Roxbury,PWDx,https://mayors24.cityofboston.gov/media/boston/report/photos/5658a3e60485bf432c10d30f/report.jpg,https://cityworker.cityofboston.gov:8443/attachments/report/5658a428d052e91ed75c9cc2/closed_photo/Report.jpg,151 Terrace St  Mission Hill  MA  02120,9.0,10A,8.0,B2,Mission Hill,14.0,Ward 10,1005,R3,151 Terrace St,2120.0,Address,134508.0,42.3274,-71.0987,Citizens Connect App,"(42.3274, -71.0987)",-7914671.080063718,5210149.244592991,-7914671.080063718,5210149.244592991
572412,101001194256,10/10/2014 01:46:43 PM,10/15/2014 01:46:43 PM,10/17/2014 02:29:55 PM,OVERDUE,Closed,Case Closed Case Resolved made safe,Sidewalk Repair (Make Safe),Public Works Department,Highway Maintenance,Sidewalk Repair (Make Safe),PWDx_District 07: South Dorchester,PWDx,https://cityworker.cityofboston.gov:8443/attachments/report/54381b80d052f1b1cd5bd120/photo/Report.jpg,,66 Alban St  Dorchester  MA  02124,8.0,07,4.0,C11,Dorchester,8.0,Ward 17,1709,R1,66 Alban St,2124.0,Address,1457.0,42.2872,-71.0666,City Worker App,"(42.2872, -71.0666)",-7911097.724409255,5204098.170338239,-7911097.724409255,5204098.170338239
411781,101000412412,04/24/2012 03:30:02 PM,04/26/2012 03:30:01 PM,04/25/2012 11:15:34 AM,ONTIME,Closed,Case Closed Case Resolved,Request for Pothole Repair,Public Works Department,Highway Maintenance,Request for Pothole Repair,PWDx_District 08: Hyde Park,PWDx,,,26 Garfield Ave  Hyde Park  MA  02136,12.0,08,5.0,E18,Hyde Park,10.0,Ward 18,1818,R3,26 Garfield Ave,2136.0,Address,62723.0,42.2483,-71.1219,Constituent Call,"(42.2483, -71.1219)",-7917253.692250123,5198246.452646118,-7917253.692250123,5198246.452646118
900625,101001985287,01/09/2017 09:43:30 PM,01/11/2017 09:43:31 PM,01/10/2017 07:15:46 AM,ONTIME,Closed,Case Closed. Closed date : 2017-01-10 07:15:46.727 Case Resolved cited for unshoveled sidewalk,Unshoveled Sidewalk,Public Works Department,Code Enforcement,Unshoveled Sidewalk,PWDx_Code Enforcement,PWDx,,,442 E Fifth St  South Boston  MA  02127,6.0,05,2.0,C6,South Boston / South Boston Waterfront,5.0,Ward 7,0703,CM,442 E Fifth St,2127.0,Address,57808.0,42.333999999999996,-71.0418,Citizens Connect App,"(42.334, -71.0418)",-7908337.001037583,5211143.0739986915,-7908337.001037583,5211143.0739986915
895418,101001790792,05/16/2016 08:57:00 AM,05/16/2017 08:57:15 AM,01/03/2017 10:42:27 AM,ONTIME,Closed,Case Closed. Closed date : 2017-01-03 10:42:27.09 Case Noted The new tree has been planted at this location by Lahey Landscaping. It is under warranty until the fall of 2018.,New Tree Requests,Parks & Recreation Department,Trees,New Tree Requests,PARK_New Tree Requests,PARK,,,786-788 E Sixth St  South Boston  MA  02127,6.0,05,2.0,C6,South Boston / South Boston Waterfront,5.0,Ward 6,0609,R3,786-788 E Sixth St,2127.0,Address,127867.0,42.3334,-71.0288,Employee Generated,"(42.3334, -71.0288)",-7906889.847657271,5211052.721561536,-7906889.847657271,5211052.721561536
609575,101001815888,06/15/2016 08:58:00 AM,06/16/2016 08:58:40 AM,06/15/2016 09:47:34 AM,ONTIME,Closed,Case Closed. Closed date : 2016-06-15 09:47:34.407 Case Resolved Ticket issued and put on tow list.,Parking Enforcement,Transportation - Traffic Division,Enforcement & Abandoned Vehicles,Parking Enforcement,BTDT_Parking Enforcement,BTDT,,,INTERSECTION of Manley St & Victory Rd  Dorchester  MA,8.0,07,3.0,C11,Dorchester,7.0,16,1602,,INTERSECTION Manley St & Victory Rd,,Intersection,11770.0,42.3594,-71.0587,Constituent Call,"(0, 0)",-7910218.300431989,5214968.784796895,-7910218.300431989,5214968.784796895
912699,101001983689,01/07/2017 04:51:00 PM,01/26/2017 08:30:00 AM,,OVERDUE,Open,,Abandoned Vehicles,Transportation - Traffic Division,Enforcement & Abandoned Vehicles,Abandoned Vehicles,BTDT_AVRS Interface Queue,BTDT,,,60 Brunswick St  Dorchester  MA  02121,9.0,10B,7.0,B2,Roxbury,13.0,Ward 12,1202,A,60 Brunswick St,2121.0,Address,198896.0,42.3119,-71.0818,Citizens Connect App,"(42.3119, -71.0818)",-7912789.780669313,5207815.66118993,-7912789.780669313,5207815.66118993
921490,101002006102,02/09/2017 03:32:00 PM,02/10/2017 03:32:45 PM,02/09/2017 04:42:15 PM,ONTIME,Closed,Case Closed. Closed date : 2017-02-09 16:42:15.547 Case Resolved after snow emergency we will check,Parking Enforcement,Transportation - Traffic Division,Enforcement & Abandoned Vehicles,Parking Enforcement,BTDT_Parking Enforcement,BTDT,,,44 Auckland St  Dorchester  MA  02125,7.0,03,3.0,C11,Dorchester,7.0,Ward 13,1309,R1,44 Auckland St,2125.0,Address,6523.0,42.3132,-71.0557,Constituent Call,"(42.3132, -71.0557)",-7909884.341959609,5208011.359006662,-7909884.341959609,5208011.359006662
24778,101000387284,02/23/2012 10:34:30 AM,02/27/2012 10:34:29 AM,02/23/2012 10:34:37 AM,ONTIME,Closed,Case Closed,Request for Pothole Repair,Public Works Department,Highway Maintenance,Request for Pothole Repair,PWDx_District 04: Allston/Brighton,PWDx,,,INTERSECTION of Chestnut Hill Ave & Sutherland Rd  Brighton  MA,11.0,04,9.0,D14,Allston / Brighton,15.0,Ward 21,2116,,INTERSECTION Chestnut Hill Ave & Sutherland Rd,,Intersection,2963.0,42.3359,-71.1509,City Worker App,"(42.3359, -71.1509)",-7920481.957483128,5211429.195736468,-7920481.957483128,5211429.195736468
284220,101001439432,07/29/2015 01:01:00 PM,,07/31/2015 04:45:01 PM,ONTIME,Closed,Case Closed. Closed date : 2015-07-31 16:45:01.05 Bulk Item Automation,Schedule a Bulk Item Pickup,Public Works Department,Sanitation,Schedule a Bulk Item Pickup,PWDx_Schedule a Bulk Item Pickup,PWDx,,,14 Lafield St  Dorchester  MA  02122,7.0,07,3.0,C11,Dorchester,7.0,Ward 16,1604,R3,14 Lafield St,2122.0,Address,82970.0,42.295,-71.0592,Constituent Call,"(42.295, -71.0592)",-7910273.960177385,5205271.957292819,-7910273.960177385,5205271.957292819
302388,101001729087,03/03/2016 09:37:36 AM,03/24/2016 09:37:36 AM,03/10/2016 02:20:52 PM,ONTIME,Closed,Case Closed. Closed date : 2016-03-10 14:20:52.41 Case Resolved Damaged cart replaced new cart #5150060061 03/10/2016,Request for Recycling Cart,Public Works Department,Recycling,Request for Recycling Cart,PWDx_IPL Damaged Cart Replacement,PWDx,,,632 Dorchester Ave  South Boston  MA  02127,6.0,05,2.0,C6,South Boston / South Boston Waterfront,5.0,Ward 7,0707,RC,632 Dorchester Ave,2127.0,Address,48668.0,42.3283,-71.0567,City Worker App,"(42.3283, -71.0567)",-7909995.661450404,5210284.760644366,-7909995.661450404,5210284.760644366
818550,101001349702,04/06/2015 05:20:55 AM,,04/10/2015 04:39:49 PM,ONTIME,Closed,Case Closed Bulk Item Automation,Schedule Bulk Item Pickup,Public Works Department,Sanitation,Schedule a Bulk Item Pickup SS,PWDx_Schedule a Bulk Item Pickup,PWDx,,,15 Grampian Way  Dorchester  MA  02125,7.0,03,3.0,C11,Dorchester,7.0,Ward 13,1310,R1,15 Grampian Way,2125.0,Address,65664.0,42.31100000000001,-71.0513,Self Service,"(42.311, -71.0513)",-7909394.536200118,5207680.180453827,-7909394.536200118,5207680.180453827
57306,101001286058,02/10/2015 03:29:02 PM,,05/04/2015 11:40:40 AM,ONTIME,Closed,Case Closed. Closed date : 2015-05-04 11:40:40.013 Case Noted Thank you for your request. This service request is now considered closed due to the recent arrival of Spring. The City worked around the clock this winter to address the record-breaking snowfall and we hope that many of your concerns were resolved. We encourage you to let us know of any additional issues and thank you for working with us to make the City a better place. Thank you for your patience and we apologize for any requests that we were not able to get to.,Public Works General Request,Public Works Department,Administrative & General Requests,Public Works General Request,INFO_Reallocation From Dept,INFO,,,55 Copeland St  Roxbury  MA  02119,7.0,10B,7.0,B2,Roxbury,13.0,Ward 12,1204,R2,55 Copeland St,2119.0,Address,42468.0,42.3228,-71.0796,Constituent Call,"(42.3228, -71.0796)",-7912544.877789568,5209456.637273938,-7912544.877789568,5209456.637273938
10875,101001416680,06/24/2015 02:18:00 PM,07/24/2015 02:18:29 PM,09/14/2015 09:56:23 AM,OVERDUE,Closed,Case Closed. Closed date : 2015-09-14 09:56:23.983 NOVIO: No Violation Found/No Cause,Mosquitoes (West Nile),Inspectional Services,Environmental Services,Mosquitoes (West Nile),ISD_Environmental Services (INTERNAL),ISD,,,82 Topliff St  Dorchester  MA  02122,7.0,03,3.0,C11,Dorchester,8.0,Ward 15,1507,R3,82 Topliff St,2122.0,Address,136259.0,42.302,-71.0676,Constituent Call,"(42.302, -71.0676)",-7911209.043900048,5206325.479622989,-7911209.043900048,5206325.479622989
824683,101001021891,02/08/2014 08:54:35 AM,03/10/2014 08:54:35 AM,03/11/2014 11:03:57 AM,OVERDUE,Closed,Case Closed :,Heat - Excessive  Insufficient,Inspectional Services,Housing,Heat - Excessive  Insufficient,ISD_Housing (INTERNAL),ISD,,,118 Howland St  Dorchester  MA  02121,9.0,10B,7.0,B2,Roxbury,13.0,Ward 12,1208,R3,118 Howland St,2121.0,Address,253849.0,42.3144,-71.0905,Constituent Call,"(42.3144, -71.0905)",-7913758.260239216,5208192.00673295,-7913758.260239216,5208192.00673295
306498,101000369819,01/03/2012 09:27:31 AM,,01/03/2012 09:27:32 AM,ONTIME,Closed,Case Closed Internal Case Performed by Highway Maintenance crew.,Pothole Repair (Internal),Public Works Department,Highway Maintenance,Pothole Repair (Internal),PWDx_District 08: Hyde Park,PWDx,,,77 Cliffmont St  Roslindale  MA  02131,12.0,08,5.0,E18,Roslindale,10.0,Ward 18,1809,R1,77 Cliffmont St,2131.0,Address,33892.0,42.2758,-71.1211,Employee Generated,"(42.2758, -71.1211)",-7917164.636657489,5202382.896959779,-7917164.636657489,5202382.896959779
512102,101001857578,07/13/2016 08:59:00 AM,,07/20/2016 04:30:41 PM,ONTIME,Closed,Case Closed. Closed date : 2016-07-20 16:30:41.417 Bulk Item Automation,Schedule a Bulk Item Pickup,Public Works Department,Sanitation,Schedule a Bulk Item Pickup,PWDx_Schedule a Bulk Item Pickup,PWDx,,,149 Delhi St  Mattapan  MA  02126,8.0,07,4.0,B3,Greater Mattapan,9.0,Ward 18,1802,R1,149 Delhi St,2126.0,Address,47128.0,42.2766,-71.0894,Constituent Call,"(42.2766, -71.0894)",-7913635.808799342,5202503.256897198,-7913635.808799342,5202503.256897198
180186,101001154423,08/20/2014 06:43:28 PM,08/22/2014 08:30:00 AM,08/20/2014 08:27:45 PM,ONTIME,Closed,Case Closed Case Resolved picked up and removed 24' concrete pole and removed stump. cut in box,Street Light Knock Downs,Public Works Department,Street Lights,Street Light Knock Downs,PWDx_Street Light Knock Downs,PWDx,,,INTERSECTION of Adams St & Hillsdale St  Dorchester  MA,8.0,07,3.0,C11,Dorchester,7.0,Ward 16,1611,,INTERSECTION Adams St & Hillsdale St,,Intersection,84.0,42.278,-71.0599,Constituent Call,"(42.278, -71.0599)",-7910351.883820941,5202713.890464305,-7910351.883820941,5202713.890464305
126240,101001957510,11/23/2016 07:51:45 AM,11/25/2016 08:30:00 AM,11/23/2016 08:50:44 AM,ONTIME,Closed,Case Closed. Closed date : 2016-11-23 08:50:44.627 Case Resolved Recycle removed,Missed Recycling: District 1C,Public Works Department,Sanitation,Missed Trash/Recycling/Yard Waste/Bulk Item,PWDx_Missed Trash\Recycling\Yard Waste\Bulk Item,PWDx,,https://cityworker.cityofboston.gov:8443/attachments/report/58359121d0521e12073a9572/closed_photo/Report.jpg,7 Concord Sq  Roxbury  MA  02118,4.0,1C,7.0,D4,South End,6.0,Ward 4,0404,CM,7 Concord Sq,2118.0,Address,41698.0,42.3411,-71.0784,Self Service,"(42.3411, -71.0784)",-7912411.294400617,5212212.309962723,-7912411.294400617,5212212.309962723
644103,101001412299,06/18/2015 09:51:00 AM,07/18/2015 09:51:54 AM,06/18/2015 03:36:41 PM,ONTIME,Closed,Case Closed. Closed date : 2015-06-18 15:36:41.56 :,No Utilities Residential - Water,Inspectional Services,Housing,No Utilities Residential - Water,ISD_Housing (INTERNAL),ISD,,,94-96 Itasca St  Mattapan  MA  02126,8.0,07,5.0,B3,Greater Mattapan,9.0,Ward 18,1803,A,94-96 Itasca St,2126.0,Address,79163.0,42.2763,-71.0994,Constituent Call,"(42.2763, -71.0994)",-7914749.003707275,5202458.121741614,-7914749.003707275,5202458.121741614
920921,101002005877,02/09/2017 11:42:05 AM,02/10/2017 11:42:05 AM,02/09/2017 11:57:19 AM,ONTIME,Closed,Case Closed. Closed date : 2017-02-09 11:57:19.157 Case Resolved Ticket issued and put on tow list.,Parking Enforcement,Transportation - Traffic Division,Enforcement & Abandoned Vehicles,Parking Enforcement,BTDT_Parking Enforcement,BTDT,,,INTERSECTION of Corey Rd & Mount Hood Rd  Brighton  MA,11.0,04,8.0,D14,Allston / Brighton,15.0,21,2112,,INTERSECTION Corey Rd & Mount Hood Rd,,Intersection,9962.0,42.3594,-71.0587,Citizens Connect App,"(0, 0)",-7910218.300431989,5214968.784796895,-7910218.300431989,5214968.784796895
50020,101001905710,09/11/2016 05:35:00 PM,09/13/2016 08:30:00 AM,09/11/2016 06:35:19 PM,ONTIME,Closed,Case Closed. Closed date : 2016-09-11 18:35:19.52 Case Resolved picked up dead animal,Pick up Dead Animal,Public Works Department,Street Cleaning,Pick up Dead Animal,PWDx_District 03: North Dorchester,PWDx,,https://cityworker.cityofboston.gov:8443/attachments/report/57d5ce2ad052978fa3d4f013/closed_photo/Report.jpg,39 Lindsey St  Dorchester  MA  02124,7.0,03,4.0,C11,Dorchester,8.0,Ward 17,1702,R2,39 Lindsey St,2124.0,Address,86544.0,42.2975,-71.0698,Constituent Call,"(42.2975, -71.0698)",-7911453.946779794,5205648.201824039,-7911453.946779794,5205648.201824039
50501,101000974617,12/02/2013 10:54:06 AM,12/02/2014 10:54:06 AM,12/06/2013 08:56:52 AM,ONTIME,Closed,Case Closed Case Resolved The CIU has identified the sidewalk left in asphalt as belonging to National Grid.     Utility companies are required to restore the sidewalk to original condition within 60 days of completion of their temporary work.     Because we are in the winter moratorium season of concrete/brick work (November 15-April 15)  the restoration work will be held off until next spring.     The utility company has been notified that the repairs must take place next April.      The location has been entered into the CIU data base that tracks repairs to be made by utility companies or private contractors.    The CIU will remind the utility companies next April about their obligation to restore the sidewalks within 2 weeks of the 2014 construction season.    Mark Cardarelli  Supervisor of Utility Coordination and Compliance  Boston Public Works Department  617-635-4951 Office  617-438-8517 Cell,Sidewalk Repair,Public Works Department,Highway Maintenance,Sidewalk Repair,PWDx_Contractor Complaints,PWDx,,,INTERSECTION of Linden St & Pratt St  Allston  MA,11.0,04,9.0,D14,Allston / Brighton,15.0,Ward 21,2104,,INTERSECTION Linden St & Pratt St,,Intersection,6883.0,42.3548,-71.1305,Employee Generated,"(42.3548, -71.1305)",-7918211.039870945,5214275.824896976,-7918211.039870945,5214275.824896976
230972,101000465858,08/17/2012 08:30:02 AM,12/15/2012 08:30:02 AM,08/25/2012 08:45:04 AM,ONTIME,Closed,Case Closed :,Unsatisfactory Living Conditions,Inspectional Services,Housing,Unsatisfactory Living Conditions,ISD_Housing (INTERNAL),ISD,,,755 Tremont St  Roxbury  MA  02118,4.0,1C,7.0,D4,South End,6.0,Ward 4,0404,E,755 Tremont St,2118.0,Address,322471.0,42.3401,-71.0794,Constituent Call,"(42.3401, -71.0794)",-7912522.613891411,5212061.706043563,-7912522.613891411,5212061.706043563
619636,101001577497,09/14/2015 09:16:03 AM,10/14/2015 09:16:03 AM,11/17/2015 04:26:30 PM,OVERDUE,Closed,Case Closed. Closed date : 2015-11-17 16:26:30.633 VIOCOR: Violation Corrected,Rodent Activity,Inspectional Services,Environmental Services,Rodent Activity,ISD_Environmental Services (INTERNAL),ISD,,,37 Long Ave  Allston  MA  02134,11.0,04,9.0,D14,Allston / Brighton,15.0,Ward 21,2107,R2,37 Long Ave,2134.0,Address,87086.0,42.3502,-71.1358,Constituent Call,"(42.3502, -71.1358)",-7918801.033172151,5213582.91571595,-7918801.033172151,5213582.91571595
262371,101001609660,10/10/2015 05:58:45 PM,10/14/2015 08:30:00 AM,10/11/2015 05:10:26 AM,ONTIME,Closed,Case Closed. Closed date : 2015-10-11 05:10:26.543 Case Resolved pick 2 ac up,CE Collection,Public Works Department,Street Cleaning,CE Collection,PWDx_District 1B: North End,PWDx,https://cityworker.cityofboston.gov:8443/attachments/report/56198a4ad052f4d9a9fedd7a/photo/Report.jpg,https://cityworker.cityofboston.gov:8443/attachments/report/56198a4ad052f4d9a9fedd7a/closed_photo/Report.jpg,79 Prince St  Boston  MA  02113,3.0,1B,1.0,A1,Downtown / Financial District,3.0,Ward 3,0303,RC,79 Prince St,2113.0,Address,112999.0,42.3655,-71.0557,City Worker App,"(42.3655, -71.0557)",-7909884.341959609,5215887.788125495,-7909884.341959609,5215887.788125495
227340,101001298830,02/16/2015 03:39:50 PM,02/19/2015 08:30:00 AM,03/11/2015 08:28:42 AM,OVERDUE,Closed,Case Closed Case Resolved,Request for Snow Plowing,Public Works Department,Street Cleaning,Request for Snow Plowing,PWDx_District 05: South Boston,PWDx,,,61 Bolton St  South Boston  MA  02127,6.0,05,2.0,C6,South Boston / South Boston Waterfront,5.0,Ward 6,0601,CD,61 Bolton St,2127.0,Address,16887.0,42.3416,-71.0524,Self Service,"(42.3416, -71.0524)",-7909516.987639992,5212287.612820516,-7909516.987639992,5212287.612820516
634766,101001232858,12/14/2014 12:18:57 PM,12/17/2014 08:30:00 AM,12/15/2014 11:14:29 AM,ONTIME,Closed,Case Closed Case Resolved couch and matresses picked up,Requests for Street Cleaning,Public Works Department,Street Cleaning,Requests for Street Cleaning,PWDx_District 1C: Downtown,PWDx,,,143 W Brookline St  Roxbury  MA  02118,4.0,1C,2.0,D4,South End,6.0,Ward 9,0901,CM,143 W Brookline St,2118.0,Address,22229.0,42.3419,-71.0748,Constituent Call,"(42.3419, -71.0748)",-7912010.544233759,5212332.794822628,-7912010.544233759,5212332.794822628
832948,101000937820,10/01/2013 09:05:46 AM,,10/08/2013 09:46:00 PM,ONTIME,Closed,Case Closed Bulk Item Automation,Schedule a Bulk Item Pickup,Public Works Department,Sanitation,Schedule a Bulk Item Pickup,PWDx_Schedule a Bulk Item Pickup,PWDx,,,43 Tennyson St  West Roxbury  MA  02132,12.0,06,6.0,E5,West Roxbury,12.0,Ward 20,2010,R1,43 Tennyson St,2132.0,Address,134436.0,42.2771,-71.1491,Constituent Call,"(42.2771, -71.1491)",-7920281.582399701,5202578.482633986,-7920281.582399701,5202578.482633986
428571,101001703285,01/27/2016 05:58:02 PM,01/29/2016 08:30:00 AM,01/27/2016 06:19:33 PM,ONTIME,Closed,Case Closed. Closed date : 2016-01-27 18:19:33.9 Case Resolved Officer dispatched to location this private property,Parking Enforcement,Transportation - Traffic Division,Enforcement & Abandoned Vehicles,Parking Enforcement,BTDT_Parking Enforcement,BTDT,,,207 F St  South Boston  MA  02127,6.0,05,2.0,C6,South Boston / South Boston Waterfront,5.0,Ward 6,0604,C,207 F St,2127.0,Address,55430.0,42.3382,-71.0457,Citizens Connect App,"(42.3382, -71.0457)",-7908771.147051676,5211775.565195636,-7908771.147051676,5211775.565195636
926961,101002005414,02/08/2017 04:20:00 PM,02/27/2017 04:20:18 PM,02/14/2017 12:02:55 PM,ONTIME,Closed,Case Closed. Closed date : 2017-02-14 12:02:55.187 Case Noted police officer from d4 spoke with owner and they will move vehicle 2/13/17.,Abandoned Vehicles,Transportation - Traffic Division,Enforcement & Abandoned Vehicles,Abandoned Vehicles,BTDT_AVRS Interface Queue,BTDT,,,9 Blackwood St  Boston  MA  02115,4.0,1C,7.0,D4,Back Bay,14.0,Ward 4,0405,A,9 Blackwood St,2115.0,Address,365804.0,42.3427,-71.0825,Constituent Call,"(42.3427, -71.0825)",-7912867.7043128675,5212453.281215551,-7912867.7043128675,5212453.281215551
875372,101000942835,10/08/2013 01:40:37 PM,12/10/2013 01:40:37 PM,,OVERDUE,Open,Case Closed Case Resolved Referred to external agency.  Verizon's jurisdiction  forwarded details to the appropriate department.,PWD Graffiti,Public Works Department,Highway Maintenance,PWD Graffiti,INFO01_GenericeFormforOtherServiceRequestTypes,INFO,,,0 Westville St  Dorchester  MA  02124,7.0,03,4.0,C11,Dorchester,8.0,Ward 15,1505,RL,0 Westville St,2124.0,Address,148874.0,42.3594,-71.0587,City Worker App,"(0, 0)",-7910218.300431989,5214968.784796895,-7910218.300431989,5214968.784796895
868753,101000449284,07/13/2012 10:51:34 AM,,07/13/2012 10:51:35 AM,ONTIME,Closed,Case Closed Internal Case Performed by Highway Maintenance crew.,Pothole Repair (Internal),Public Works Department,Highway Maintenance,Pothole Repair (Internal),PWDx_District 02: Jamaica Plain,PWDx,,,49 Morton St  Jamaica Plain  MA  02130,12.0,02,6.0,E13,Jamaica Plain,11.0,Ward 11,1108,E,49 Morton St,2130.0,Address,97724.0,42.2998,-71.1102,Employee Generated,"(42.2998, -71.1102)",-7915951.254207843,5205994.359985157,-7915951.254207843,5205994.359985157
865492,101001095911,05/22/2014 07:48:56 PM,06/09/2014 08:30:00 AM,06/04/2014 08:33:42 AM,ONTIME,Closed,Case Closed Case Resolved,Sign Repair,Transportation - Traffic Division,Signs & Signals,Sign Repair,BTDT_Sign Shop_Sign Installation,BTDT,,,64 Downer Ave  Dorchester  MA  02125,7.0,03,3.0,C11,Dorchester,7.0,Ward 13,1306,CM,64 Downer Ave,2125.0,Address,49293.0,42.3123,-71.0626,Citizens Connect App,"(42.3123, -71.0626)",-7910652.4464460835,5207875.875472253,-7910652.4464460835,5207875.875472253
202366,101001810852,06/09/2016 08:16:00 AM,06/13/2016 08:30:00 AM,06/09/2016 09:59:13 AM,ONTIME,Closed,Case Closed. Closed date : 2016-06-09 09:59:13.883 Case Noted Ticket was issued  Sent in for collection.,Improper Storage of Trash (Barrels),Public Works Department,Code Enforcement,Improper Storage of Trash (Barrels),PWDx_Code Enforcement,PWDx,,https://cityworker.cityofboston.gov:8443/attachments/report/57595e9cd0527c86c93256c3/closed_photo/Report.jpg,55 E Springfield St  Roxbury  MA  02118,4.0,1C,2.0,D4,South End,6.0,Ward 8,0802,R4,55 E Springfield St,2118.0,Address,129902.0,42.3355,-71.0749,Constituent Call,"(42.3355, -71.0749)",-7912021.67618284,5211368.95886279,-7912021.67618284,5211368.95886279
287470,101001090481,05/15/2014 03:08:24 PM,,05/15/2014 03:08:24 PM,ONTIME,Closed,Case Closed Internal Case Performed by Highway Maintenance crew.,Pothole Repair (Internal),Public Works Department,Highway Maintenance,Pothole Repair (Internal),PWDx_District 06: West Roxbury and Roslindale,PWDx,,,740 W Roxbury Pkwy  Roslindale  MA  02131,12.0,06,5.0,E5,Roslindale,10.0,Ward 20,2009,R1,740 W Roxbury Pkwy,2131.0,Address,119263.0,42.2806,-71.143,Employee Generated,"(42.2806, -71.143)",-7919602.533505863,5203105.079504507,-7919602.533505863,5203105.079504507
260943,101000937770,10/01/2013 08:24:06 AM,10/03/2013 08:30:00 AM,10/01/2013 08:54:13 AM,ONTIME,Closed,Case Closed Case Resolved  Case assigned to CIu,Utility Call-In,Public Works Department,Highway Maintenance,Utility Call-In,PWDx_Utility Call-In,PWDx,,,9 New Haven St  West Roxbury  MA  02132,12.0,06,6.0,E5,West Roxbury,12.0,Ward 20,2015,R1,9 New Haven St,2132.0,Address,101167.0,42.2684,-71.166,Constituent Call,"(42.2684, -71.166)",-7922162.881794106,5201269.6399610555,-7922162.881794106,5201269.6399610555
693123,101001294255,02/13/2015 06:50:50 PM,,02/17/2015 07:06:59 AM,ONTIME,Closed,Case Closed Case Resolved  hydrant been plowed,Request for Snow Plowing (Emergency Responder),Public Works Department,Street Cleaning,Request for Snow Plowing (Emergency Responder),PWDx_District 04: Allston/Brighton,PWDx,,,10 Egan Way  Brighton  MA  02135,11.0,04,9.0,D14,Allston / Brighton,15.0,Ward 22,2210,CD,10 Egan Way,2135.0,Address,51440.0,42.35,-71.1585,Constituent Call,"(42.35, -71.1585)",-7921327.985613157,5213552.790380158,-7921327.985613157,5213552.790380158
372442,101001103550,06/04/2014 09:54:20 PM,,09/02/2014 02:08:43 PM,ONTIME,Closed,Case Closed Case Resolved RETRIEVED KEYS GAVE BACK TO OFFICER 6/4,Catchbasin,Boston Water & Sewer Commission,Catchbasin,Catchbasin,BWSC_All Cases,BWSC,,,INTERSECTION of Marie St & Mount Ida Rd  Dorchester  MA,7.0,03,3.0,C11,Dorchester,8.0,Ward 15,1507,,INTERSECTION Marie St & Mount Ida Rd,,Intersection,7084.0,42.3054,-71.0646,Constituent Call,"(42.3054, -71.0646)",-7910875.085427669,5206837.232730226,-7910875.085427669,5206837.232730226
203421,101000959941,11/04/2013 03:18:25 PM,11/06/2013 03:18:25 PM,11/05/2013 06:59:19 AM,ONTIME,Closed,Case Closed Case Resolved,Requests for Street Cleaning,Public Works Department,Street Cleaning,Requests for Street Cleaning,PWDx_District 03: North Dorchester,PWDx,,,41 Cushing Ave  Dorchester  MA  02125,7.0,03,7.0,C11,Dorchester,13.0,Ward 13,1305,CM,41 Cushing Ave,2125.0,Address,45172.0,42.3152,-71.0648,City Worker App,"(42.3152, -71.0648)",-7910897.349325828,5208312.440464055,-7910897.349325828,5208312.440464055
255627,101000476182,09/09/2012 10:16:14 AM,09/11/2012 10:16:14 AM,09/09/2012 10:46:38 AM,ONTIME,Closed,Case Closed Case Resolved job complete,Pick up Dead Animal,Public Works Department,Street Cleaning,Pick up Dead Animal,PWDx_District 09: East Boston,PWDx,,,27 Beachview Rd  East Boston  MA  02128,1.0,09,1.0,A7,East Boston,1.0,Ward 1,0114,R2,27 Beachview Rd,2128.0,Address,9433.0,42.3907,-71.0028,Constituent Call,"(42.3907, -71.0028)",-7903995.540896643,5219685.272587888,-7903995.540896643,5219685.272587888
540806,101000846384,05/24/2013 02:14:14 PM,,05/24/2013 02:31:41 PM,ONTIME,Closed,Case Closed Case Invalid MADE IN ERROR,Catchbasin,Boston Water & Sewer Commission,Catchbasin,Catchbasin,BWSC_All Cases,BWSC,,,INTERSECTION of Dennis St & Dudley St  Roxbury  MA,7.0,03,7.0,B2,Roxbury,13.0,Ward 8,0805,,INTERSECTION Dennis St & Dudley St,,Intersection,4022.0,42.3238,-71.0739,City Worker App,"(42.3238, -71.0739)",-7911910.356692046,5209607.199774586,-7911910.356692046,5209607.199774586
919260,101002001395,02/02/2017 08:42:20 AM,06/02/2017 08:42:20 AM,02/02/2017 08:42:41 AM,ONTIME,Closed,Case Closed. Closed date : 2017-02-02 08:42:41.217 :,Unsatisfactory Living Conditions,Inspectional Services,Housing,Unsatisfactory Living Conditions,ISD_Housing (INTERNAL),ISD,,,24 Heath St  Jamaica Plain  MA  02130,9.0,10A,6.0,E13,Jamaica Plain,11.0,Ward 10,1007,E,24 Heath St,2130.0,Address,250081.0,42.3249,-71.0994,Constituent Call,"(42.3249, -71.0994)",-7914749.003707275,5209772.82128938,-7914749.003707275,5209772.82128938
834775,101001421750,07/01/2015 07:10:02 PM,07/03/2015 08:30:00 AM,07/01/2015 09:41:38 PM,ONTIME,Closed,Case Closed. Closed date : 2015-07-01 21:41:38.207 Case Resolved pick up,CE Collection,Public Works Department,Street Cleaning,CE Collection,PWDx_District 1C: Downtown,PWDx,https://cityworker.cityofboston.gov:8443/attachments/report/5594735dd0528e43ce38d357/photo/Report.jpg,,42 Grove St  Boston  MA  02114,3.0,1B,8.0,A1,Beacon Hill,14.0,Ward 5,0504,CM,42 Grove St,2114.0,Address,67553.0,42.3598,-71.0685,City Worker App,"(42.3598, -71.0685)",-7911309.231441763,5215029.0445768135,-7911309.231441763,5215029.0445768135
302194,101001570981,09/05/2015 05:45:00 PM,09/22/2015 08:30:00 AM,09/17/2015 08:06:19 AM,ONTIME,Closed,Case Closed. Closed date : 2015-09-17 08:06:19.32 Case Noted no issue at this location street cleaning signs posted,Sign Repair,Transportation - Traffic Division,Signs & Signals,Sign Repair,BTDT_District 04,BTDT,https://mayors24.cityofboston.gov/media/boston/report/photos/55eb62916963c98f05b58574/report.jpg,,19 Chase St  Dorchester  MA  02125,7.0,03,3.0,C11,Dorchester,7.0,Ward 13,1306,R3,19 Chase St,2125.0,Address,30066.0,42.3186,-71.0595,Citizens Connect App,"(42.3186, -71.0595)",-7910307.356024624,5208824.300901545,-7910307.356024624,5208824.300901545
483312,101001084373,05/08/2014 08:32:44 AM,,05/15/2014 04:36:12 PM,ONTIME,Closed,Case Closed Bulk Item Automation,Schedule a Bulk Item Pickup,Public Works Department,Sanitation,Schedule a Bulk Item Pickup,PWDx_Schedule a Bulk Item Pickup,PWDx,,,99 Albano St  Roslindale  MA  02131,12.0,06,5.0,E5,Roslindale,10.0,Ward 20,2002,R2,99 Albano St,2131.0,Address,1504.0,42.2847,-71.1331,Constituent Call,"(42.2847, -71.1331)",-7918500.470547007,5203721.987327784,-7918500.470547007,5203721.987327784
532279,101000424066,05/18/2012 10:30:34 AM,,05/22/2012 09:45:10 PM,ONTIME,Closed,Case Closed Bulk Item Automation,Schedule a Bulk Item Pickup,Public Works Department,Sanitation,Schedule a Bulk Item Pickup,PWDx_Schedule a Bulk Item Pickup,PWDx,,,78 Englewood Ave  Brighton  MA  02135,11.0,04,9.0,D14,Allston / Brighton,15.0,Ward 21,2114,R1,78 Englewood Ave,2135.0,Address,54102.0,42.3377,-71.149,Employee Generated,"(42.3377, -71.149)",-7920270.450450622,5211700.266409468,-7920270.450450622,5211700.266409468
406158,101001916117,09/23/2016 08:56:00 AM,10/07/2016 08:56:28 AM,11/09/2016 01:09:38 PM,OVERDUE,Closed,Case Closed. Closed date : 2016-11-09 13:09:38.077 Case Resolved,Sign Repair,Transportation - Traffic Division,Signs & Signals,Sign Repair,BTDT_Sign Shop_Sign Installation,BTDT,,,INTERSECTION of Devonshire St & Water St  Boston  MA,3.0,1C,2.0,A1,Downtown / Financial District,3.0,3,0306,,INTERSECTION Devonshire St & Water St,,Intersection,16043.0,42.3594,-71.0587,Constituent Call,"(0, 0)",-7910218.300431989,5214968.784796895,-7910218.300431989,5214968.784796895
814233,101001879439,08/09/2016 07:49:07 PM,08/11/2016 08:30:00 AM,08/09/2016 09:40:52 PM,ONTIME,Closed,Case Closed. Closed date : 2016-08-09 21:40:52.757 Case Resolved Trash bags picked up,CE Collection,Public Works Department,Street Cleaning,CE Collection,PWDx_District 1B: North End,PWDx,https://cityworker.cityofboston.gov:8443/attachments/report/57aa6bf370b4fc1c6fbd6195/photo/Report.jpg,https://cityworker.cityofboston.gov:8443/attachments/report/57aa6bf370b4fc1c6fbd6195/closed_photo/Report.jpg,58 Prince St  Boston  MA  02113,3.0,1B,1.0,A1,Downtown / Financial District,3.0,Ward 3,0303,R4,58 Prince St,2113.0,Address,295559.0,42.3649,-71.0551,City Worker App,"(42.3649, -71.0551)",-7909817.550265132,5215797.3903988395,-7909817.550265132,5215797.3903988395
777684,101001136210,07/24/2014 11:58:56 AM,08/05/2014 11:58:00 AM,08/04/2014 12:19:27 PM,ONTIME,Closed,Case Closed Case Resolved box is at district yard due to noncompliance.,News Boxes - Reinspect Wed Jul 30,Public Works Department,Highway Maintenance,News Boxes,PWDx_District 10A: Roxbury,PWDx,,,INTERSECTION of Beacon St & Commonwealth Ave  Boston  MA,4.0,10A,8.0,D4,Fenway / Kenmore / Audubon Circle / Longwood,14.0,Ward 5,0510,,INTERSECTION Beacon St & Commonwealth Ave,,Intersection,1088.0,42.3488,-71.0971,City Worker App,"(42.3488, -71.0971)",-7914492.968878451,5213372.040378293,-7914492.968878451,5213372.040378293
57594,101001896157,08/31/2016 02:28:00 PM,08/21/2018 02:28:01 PM,08/31/2016 03:36:31 PM,ONTIME,Closed,Case Closed. Closed date : 2016-08-31 15:36:31.187 ROA: Refer to Other Agency/Division,Contractors Complaint,Inspectional Services,Building,Contractors Complaint,ISD_Building (INTERNAL),ISD,,,174 L St  South Boston  MA  02127,6.0,05,2.0,C6,South Boston / South Boston Waterfront,5.0,Ward 7,0701,R3,174 L St,2127.0,Address,82487.0,42.3321,-71.0351,Constituent Call,"(42.3321, -71.0351)",-7907591.160449267,5210856.96090464,-7907591.160449267,5210856.96090464
620443,101001717079,02/15/2016 12:09:41 PM,02/23/2016 08:30:00 AM,02/16/2016 11:36:23 AM,ONTIME,Closed,Case Closed. Closed date : 2016-02-16 11:36:23.58 Case Resolved no cep voilation found,Unshoveled Sidewalk,Public Works Department,Code Enforcement,Unshoveled Sidewalk,PWDx_Code Enforcement,PWDx,https://mayors24.cityofboston.gov/media/boston/report/photos/56c2064f04852e480794f66b/report.jpg,https://cityworker.cityofboston.gov:8443/attachments/report/56c20697d0523dfc52f60cdd/closed_photo/Report.jpg,107 Stoughton St  Dorchester  MA  02125,7.0,03,3.0,C11,Dorchester,7.0,Ward 13,1306,R3,107 Stoughton St,2125.0,Address,131091.0,42.3154,-71.062,Citizens Connect App,"(42.3154, -71.062)",-7910585.654751606,5208342.549136039,-7910585.654751606,5208342.549136039
444167,101001005764,01/15/2014 09:09:21 AM,01/17/2014 09:09:21 AM,01/15/2014 10:25:29 AM,ONTIME,Closed,Case Closed Case Resolved picked up,Requests for Street Cleaning,Public Works Department,Street Cleaning,Requests for Street Cleaning,PWDx_District 09: East Boston,PWDx,,,60 Princeton St  East Boston  MA  02128,1.0,09,1.0,A7,East Boston,1.0,Ward 1,0107,R2,60 Princeton St,2128.0,Address,113352.0,42.3773,-71.03699999999999,City Worker App,"(42.3773, -71.037)",-7907802.6674817735,5217665.785571025,-7907802.6674817735,5217665.785571025
393474,101001221462,11/21/2014 11:13:15 AM,12/22/2014 11:13:15 AM,11/21/2014 11:24:07 AM,ONTIME,Closed,Case Closed Case Resolved Caller called back to report that the car has been removed.,Abandoned Vehicles,Transportation - Traffic Division,Enforcement & Abandoned Vehicles,Abandoned Vehicles,BTDT_AVRS Interface Queue,BTDT,,,97 Evans St  Dorchester  MA  02124,8.0,07,4.0,B3,Dorchester,9.0,Ward 17,1710,R1,97 Evans St,2124.0,Address,54847.0,42.2822,-71.0818,Constituent Call,"(42.2822, -71.0818)",-7912789.780669313,5203345.819244688,-7912789.780669313,5203345.819244688
5974,101001586838,09/24/2015 09:12:03 AM,12/23/2015 09:12:03 AM,04/27/2016 08:03:31 AM,OVERDUE,Closed,Case Closed. Closed date : 2016-04-27 08:03:31.423 Case Resolved,Pavement Marking Maintenance,Transportation - Traffic Division,Operations,Pavement Marking Maintenance,BTDT_Pavement Marking_Maintenance,BTDT,,,15-17 Brimmer St  Boston  MA  02108,3.0,1B,8.0,A1,Back Bay,14.0,Ward 5,0511,CM,15-17 Brimmer St,2108.0,Address,20225.0,42.3583,-71.072,Constituent Call,"(42.3583, -71.072)",-7911698.849659539,5214803.07238003,-7911698.849659539,5214803.07238003
871404,101001667270,12/17/2015 09:00:21 AM,12/18/2015 09:00:20 AM,12/17/2015 09:40:42 AM,ONTIME,Closed,Case Closed. Closed date : 2015-12-17 09:40:42.917 Case Resolved Removed all set,CE Collection,Public Works Department,Street Cleaning,CE Collection,PWDx_District 10A: Roxbury,PWDx,https://cityworker.cityofboston.gov:8443/attachments/report/5672bff3d05237c5e7018848/photo/Report.jpg,https://cityworker.cityofboston.gov:8443/attachments/report/5672bff3d05237c5e7018848/closed_photo/Report.jpg,43-45 S Huntington Ave  Jamaica Plain  MA  02130,9.0,10A,8.0,E13,Jamaica Plain,11.0,10,1008,C,43-45 S Huntington Ave,2130.0,Address,76815.0,42.3594,-71.0587,City Worker App,"(0, 0)",-7910218.300431989,5214968.784796895,-7910218.300431989,5214968.784796895
711385,101001429585,07/14/2015 08:31:00 PM,07/20/2015 08:30:00 AM,07/15/2015 01:03:21 PM,ONTIME,Closed,Case Closed. Closed date : 2015-07-15 13:03:21.71 NOVIO: No Violation Found/No Cause,Illegal Auto Body Shop,Inspectional Services,Environmental Services,Illegal Auto Body Shop,ISD_Environmental Services (INTERNAL),ISD,,,INTERSECTION of Circuit St & Fountain St  Roxbury  MA,7.0,10B,7.0,B2,Roxbury,13.0,Ward 12,1201,,INTERSECTION Circuit St & Fountain St,,Intersection,3040.0,42.3237,-71.0848,Constituent Call,"(42.3237, -71.0848)",-7913123.739141693,5209592.143416831,-7913123.739141693,5209592.143416831
142597,101001527407,08/21/2015 01:35:00 PM,08/24/2015 01:35:58 PM,08/21/2015 01:58:20 PM,ONTIME,Closed,Case Closed. Closed date : 2015-08-21 13:58:20.12 Case Noted Sorry! We do not take yard waste in plastic bags. The next yard waste collection is September 18.,Missed Trash: District 02,Public Works Department,Sanitation,Missed Trash/Recycling/Yard Waste/Bulk Item,PWDx_Missed Trash\Recycling\Yard Waste\Bulk Item,PWDx,,https://cityworker.cityofboston.gov:8443/attachments/report/55d761bfd052ea4bf6ab01e1/closed_photo/Report.jpg,5 Glines Ave  Jamaica Plain  MA  02130,9.0,02,7.0,E13,Jamaica Plain,11.0,Ward 11,1105,R2,5 Glines Ave,2130.0,Address,64866.0,42.3136,-71.0988,Constituent Call,"(42.3136, -71.0988)",-7914682.212012798,5208071.574532718,-7914682.212012798,5208071.574532718
455836,101001238862,12/28/2014 07:08:07 PM,02/11/2015 07:08:07 PM,12/30/2014 12:17:29 PM,ONTIME,Closed,Case Closed Case Resolved There was a broken button which has been replaced.,New Sign  Crosswalk or Pavement Marking,Transportation - Traffic Division,Signs & Signals,New Sign  Crosswalk or Pavement Marking,BTDT_Engineering_Request for Traffic Signal Study or Review,BTDT,,,460 Cambridge St  Allston  MA  02134,11.0,04,9.0,D14,Allston,15.0,21,2104,E,460 Cambridge St,2134.0,Address,25139.0,42.3538,-71.1361,Self Service,"(42.3538, -71.1361)",-7918834.429019388,5214125.188152268,-7918834.429019388,5214125.188152268
405877,101000451543,07/18/2012 01:15:57 PM,07/19/2012 01:15:57 PM,07/18/2012 01:16:01 PM,ONTIME,Closed,Case Closed,Pick up Dead Animal,Public Works Department,Street Cleaning,Pick up Dead Animal,PWDx_District 06: West Roxbury and Roslindale,PWDx,,,202 Baker St  West Roxbury  MA  02132,12.0,06,6.0,E5,West Roxbury,12.0,Ward 20,2005,R4,202 Baker St,2132.0,Address,7660.0,42.2765,-71.1672,City Worker App,"(42.2765, -71.1672)",-7922296.465183059,5202488.211821465,-7922296.465183059,5202488.211821465
301164,101000941716,10/07/2013 12:16:52 PM,,10/10/2013 09:48:42 PM,ONTIME,Closed,Case Closed Bulk Item Automation,Schedule a Bulk Item Pickup,Public Works Department,Sanitation,Schedule a Bulk Item Pickup,PWDx_Schedule a Bulk Item Pickup,PWDx,,,25 Perrin St  Roxbury  MA  02119,7.0,10B,7.0,B2,Roxbury,13.0,Ward 12,1204,R3,25 Perrin St,2119.0,Address,292391.0,42.3226,-71.0786,Constituent Call,"(42.3226, -71.0786)",-7912433.558298774,5209426.525060974,-7912433.558298774,5209426.525060974
203427,101001959554,11/28/2016 09:01:00 AM,12/05/2016 09:01:38 AM,,OVERDUE,Open,,Litter / Ground Maintenance - Rotch Playground (BPRD),Parks & Recreation Department,Park Maintenance & Safety,Ground Maintenance,INFO_Mass DOT,INFO,https://mayors24.cityofboston.gov/media/boston/report/photos/583c38be04852d4ae2f2af86/report.jpg,,INTERSECTION of W Fourth St & Frontage Rd  Boston  MA,4.0,05,2.0,C6,South Boston / South Boston Waterfront,0.0,0,0801,,INTERSECTION W Fourth St & Frontage Rd,,Intersection,15662.0,42.3594,-71.0587,Citizens Connect App,"(0, 0)",-7910218.300431989,5214968.784796895,-7910218.300431989,5214968.784796895
91093,101001724444,02/25/2016 11:55:00 AM,04/29/2016 11:55:05 AM,05/04/2016 11:06:29 AM,OVERDUE,Closed,Case Closed. Closed date : 2016-05-04 11:06:29.88 Case Resolved,Graffiti Removal,Property Management,Graffiti,Graffiti Removal,PROP_GRAF_GraffitiRemoval,PROP,https://mayors24.cityofboston.gov/media/boston/report/photos/56cf31e36963e6bebc40a2fc/report.jpg,https://cityworker.cityofboston.gov:8443/attachments/report/56cf322ad0524d3d7c0f788d/closed_photo/Report.jpg,9-11 Knapp St  Boston  MA  02111,4.0,1C,2.0,A1,Downtown / Financial District,4.0,03,0308,,9-11 Knapp St,2111.0,Address,166794.0,42.3511,-71.062,Citizens Connect App,"(42.3511, -71.062)",-7910585.654751606,5213718.480913229,-7910585.654751606,5213718.480913229
542742,101001723404,02/24/2016 10:25:00 AM,02/25/2016 10:25:06 AM,02/24/2016 11:37:01 AM,ONTIME,Closed,Case Closed. Closed date : 2016-02-24 11:37:01.343 Case Resolved Case Resolved. Trash was picked up 2/24.,Missed Trash: District 1B,Public Works Department,Sanitation,Missed Trash/Recycling/Yard Waste/Bulk Item,PWDx_Missed Trash\Recycling\Yard Waste\Bulk Item,PWDx,,,37 Fleet St  Boston  MA  02113,3.0,1B,1.0,A1,Downtown / Financial District,3.0,Ward 3,0303,CM,37 Fleet St,2113.0,Address,58659.0,42.3642,-71.0522,Constituent Call,"(42.3642, -71.0522)",-7909494.723741833,5215691.927475566,-7909494.723741833,5215691.927475566
152286,101001397536,05/29/2015 07:26:00 AM,,,ONTIME,Open,,Animal Generic Request,Animal Control,Animal Issues,Animal Generic Request,INFO01_GenericeFormforOtherServiceRequestTypes,INFO,,,154-156 Quincy St  Dorchester  MA  02125,7.0,03,7.0,B2,Roxbury,13.0,Ward 13,1301,CM,154-156 Quincy St,2125.0,Address,114011.0,42.3136,-71.0763,Constituent Call,"(42.3136, -71.0763)",-7912177.523469951,5208071.574532718,-7912177.523469951,5208071.574532718
599823,101001781656,05/03/2016 02:46:00 PM,,07/26/2016 04:07:52 PM,ONTIME,Closed,Case Closed. Closed date : 2016-07-26 16:07:52.35 Case Resolved After a thorough search of that area of Southampton Street we were unable to locate a syringe,Needle Pickup,Mayor's 24 Hour Hotline,Needle Program,Needle Pickup,GEN_Needle_Pickup,GEN_,,,INTERSECTION of Southampton St & Frontage Rd  South Boston  MA,6.0,05,3.0,C6,South Boston / South Boston Waterfront,5.0,7,0705,,INTERSECTION Southampton St & Frontage Rd,,Intersection,17298.0,42.3594,-71.0587,Constituent Call,"(0, 0)",-7910218.300431989,5214968.784796895,-7910218.300431989,5214968.784796895
703403,101001947164,11/07/2016 12:37:07 PM,11/08/2016 12:37:07 PM,11/08/2016 10:03:12 AM,ONTIME,Closed,Case Closed. Closed date : 2016-11-08 10:03:12.267 Case Noted Trash collected at 10:02 a.m. on 11/8/16.,Missed Trash: District 02,Public Works Department,Sanitation,Missed Trash/Recycling/Yard Waste/Bulk Item,PWDx_Missed Trash\Recycling\Yard Waste\Bulk Item,PWDx,,https://cityworker.cityofboston.gov:8443/attachments/report/5820bc03d0526e981e636b2b/closed_photo/Report.jpg,24 Saint Peter St  Jamaica Plain  MA  02130,9.0,02,6.0,E13,Jamaica Plain,11.0,19,1901,R4,24 Saint Peter St,2130.0,Address,304676.0,42.3183,-71.1079,Self Service,"(42.3183, -71.1079)",-7915695.219379019,5208779.13563285,-7915695.219379019,5208779.13563285
153690,101001810592,06/08/2016 05:46:00 PM,06/10/2016 08:30:00 AM,06/08/2016 11:12:03 PM,ONTIME,Closed,Case Closed. Closed date : 2016-06-08 23:12:03.207 Case Resolved area checked all clear,Parking Enforcement,Transportation - Traffic Division,Enforcement & Abandoned Vehicles,Parking Enforcement,BTDT_Parking Enforcement,BTDT,,,INTERSECTION of Woodlawn St & Hyde Park Ave  Jamaica Plain  MA,12.0,02,6.0,E13,Jamaica Plain,10.0,19,1907,,INTERSECTION Woodlawn St & Hyde Park Ave,,Intersection,13616.0,42.3594,-71.0587,Constituent Call,"(0, 0)",-7910218.300431989,5214968.784796895,-7910218.300431989,5214968.784796895
832639,101000889773,07/30/2013 07:46:10 AM,08/29/2013 07:46:10 AM,09/30/2013 10:16:34 AM,OVERDUE,Closed,Case Closed VIOCOR: Violation Corrected,Rodent Activity,Inspectional Services,Environmental Services,Rodent Activity,ISD_Environmental Services (INTERNAL),ISD,,,52 Humphreys St  Dorchester  MA  02125,7.0,03,7.0,B2,Dorchester,13.0,Ward 7,0710,R2,52 Humphreys St,2125.0,Address,76087.0,42.3188,-71.0673,Constituent Call,"(42.3188, -71.0673)",-7911175.648052812,5208854.4112003,-7911175.648052812,5208854.4112003
73988,101001352102,04/08/2015 12:54:55 PM,04/23/2015 12:54:54 PM,04/09/2015 02:11:10 PM,ONTIME,Closed,Case Closed Case Resolved Work completed 4/9/15.,Sign Repair,Transportation - Traffic Division,Signs & Signals,Sign Repair,BTDT_Sign Shop_Sign Installation,BTDT,https://cityworker.cityofboston.gov:8443/attachments/report/55255d5a70b47681496b9b25/photo/Report.jpg,,632-636B Warren St  Dorchester  MA  02121,9.0,10B,7.0,B2,Roxbury,13.0,Ward 12,1202,C,632-636B Warren St,2121.0,Address,143325.0,42.3102,-71.0828,City Worker App,"(42.3102, -71.0828)",-7912901.100160107,5207559.754759122,-7912901.100160107,5207559.754759122
920599,101002005204,02/08/2017 11:50:21 AM,02/09/2017 11:50:21 AM,02/08/2017 12:42:09 PM,ONTIME,Closed,Case Closed. Closed date : 2017-02-08 12:42:09.767 Duplicate of Existing Case,Parking Enforcement,Transportation - Traffic Division,Enforcement & Abandoned Vehicles,Parking Enforcement,BTDT_Parking Enforcement,BTDT,https://mayors24.cityofboston.gov/media/boston/report/photos/589b4c470485807683d271ab/report.jpg,,INTERSECTION of Massachusetts Ave & Proctor St  Roxbury  MA,7.0,03,3.0,C6,South Boston / South Boston Waterfront,13.0,8,0806,,INTERSECTION Massachusetts Ave & Proctor St,,Intersection,14794.0,42.3594,-71.0587,Citizens Connect App,"(0, 0)",-7910218.300431989,5214968.784796895,-7910218.300431989,5214968.784796895
614074,101000371594,01/06/2012 03:17:45 PM,03/09/2012 03:17:45 PM,01/09/2012 07:57:06 AM,ONTIME,Closed,Case Closed Case Noted,Graffiti Removal,Property Management,Graffiti,Graffiti Removal,BTDT_Traffic Signal_Repair,BTDT,,,3720 Washington St  Jamaica Plain  MA  02130,12.0,02,6.0,E13,Jamaica Plain,11.0,Ward 11,1108,CL,3720 Washington St,2130.0,Address,144979.0,42.3,-71.1133,Citizens Connect App,"(42.3, -71.1133)",-7916296.344629301,5206024.461292352,-7916296.344629301,5206024.461292352
799667,101000449612,07/14/2012 05:51:30 AM,07/18/2012 05:51:30 AM,07/16/2012 01:55:29 PM,ONTIME,Closed,Case Closed Case Resolved work completed by highway district 2,Request for Pothole Repair,Public Works Department,Highway Maintenance,Request for Pothole Repair,PWDx_District 02: Jamaica Plain,PWDx,,,INTERSECTION of Hyde Park Ave & Ukraine Way  Jamaica Plain  MA,12.0,02,6.0,E13,Jamaica Plain,10.0,Ward 19,1907,,INTERSECTION Hyde Park Ave & Ukraine Way,,Intersection,6476.0,42.298,-71.1149,Self Service,"(42.298, -71.1149)",-7916474.455814571,5205723.452522673,-7916474.455814571,5205723.452522673
578385,101001195905,10/14/2014 01:42:55 PM,10/16/2014 01:42:55 PM,10/15/2014 10:25:04 AM,ONTIME,Closed,Case Closed Case Resolved Dropped stickers off to above address at 10:24am,Sticker Request,Public Works Department,Recycling,Sticker Request,PWDx_Sticker Request,PWDx,,,101 Lagrange St  West Roxbury  MA  02132,12.0,06,6.0,E5,West Roxbury,12.0,Ward 20,2010,R1,101 Lagrange St,2132.0,Address,82627.0,42.2758,-71.1466,Self Service,"(42.2758, -71.1466)",-7920003.283672718,5202382.896959779,-7920003.283672718,5202382.896959779
833773,101000417021,05/04/2012 09:27:22 AM,,05/04/2012 09:27:23 AM,ONTIME,Closed,Case Closed Internal Case Performed by Highway Maintenance crew.,Pothole Repair (Internal),Public Works Department,Highway Maintenance,Pothole Repair (Internal),PWDx_District 06: West Roxbury and Roslindale,PWDx,,,716 W Roxbury Pkwy  Roslindale  MA  02131,12.0,06,5.0,E5,Roslindale,10.0,Ward 20,2008,R1,716 W Roxbury Pkwy,2131.0,Address,119255.0,42.2815,-71.1442,Employee Generated,"(42.2815, -71.1442)",-7919736.116894812,5203240.494856145,-7919736.116894812,5203240.494856145
89013,101000432809,06/06/2012 11:03:43 AM,06/06/2013 11:03:43 AM,12/07/2012 09:01:46 AM,ONTIME,Closed,Case Closed Case Resolved Sidewalk repaired 11/2012    Michael Somers  Senior Civil Engineer  Construction Management Division  Boston Public Works  617-635-3831,Sidewalk Repair/Concrete/Dist 8,Public Works Department,Highway Maintenance,Sidewalk Repair,PWDx_Highway Construction,PWDx,,,881 Hyde Park Ave  Hyde Park  MA  02136,12.0,08,5.0,E18,Hyde Park,10.0,Ward 18,1814,R1,881 Hyde Park Ave,2136.0,Address,77675.0,42.2698,-71.12100000000001,City Worker App,"(42.2698, -71.121)",-7917153.504708411,5201480.246125644,-7917153.504708411,5201480.246125644
358748,101001335807,03/18/2015 08:21:18 AM,,03/18/2015 08:21:18 AM,ONTIME,Closed,Case Closed Internal Case Performed by Highway Maintenance crew.,Pothole Repair (Internal),Public Works Department,Highway Maintenance,Pothole Repair (Internal),PWDx_District 06: West Roxbury and Roslindale,PWDx,,,335 Corey St  West Roxbury  MA  02132,12.0,06,6.0,E5,West Roxbury,12.0,Ward 20,2020,RC,335 Corey St,2132.0,Address,42808.0,42.2938,-71.1629,Employee Generated,"(42.2938, -71.1629)",-7921817.791372647,5205091.365222931,-7921817.791372647,5205091.365222931
561787,101000419867,05/10/2012 02:38:54 PM,,05/10/2012 02:39:00 PM,ONTIME,Closed,Case Closed Internal Case,Highway Maintenance,Public Works Department,Highway Maintenance,Highway Maintenance,PWDx_District 03: North Dorchester,PWDx,,,INTERSECTION of Dewolf St & Hancock St  Dorchester  MA,7.0,03,3.0,C11,Dorchester,7.0,Ward 13,1306,,INTERSECTION Dewolf St & Hancock St,,Intersection,4070.0,42.3103,-71.0609,Employee Generated,"(42.3103, -71.0609)",-7910463.203311734,5207574.807887256,-7910463.203311734,5207574.807887256
430626,101001374313,05/11/2015 08:22:54 AM,05/12/2015 08:30:00 AM,05/11/2015 09:04:33 AM,ONTIME,Closed,Case Closed. Closed date : 2015-05-11 09:04:33.06 Case Resolved sweeper on leftside street  done twice.,Requests for Street Cleaning,Public Works Department,Street Cleaning,Requests for Street Cleaning,PWDx_District 09: East Boston,PWDx,,https://cityworker.cityofboston.gov:8443/attachments/report/55509f2dd052df0e552d7e88/closed_photo/Report.jpg,24 Montmorenci Ave  East Boston  MA  02128,1.0,09,1.0,A7,East Boston,1.0,Ward 1,0114,R1,24 Montmorenci Ave,2128.0,Address,96728.0,42.3916,-71.0087,Citizens Connect App,"(42.3916, -71.0087)",-7904652.325892326,5219820.925224759,-7904652.325892326,5219820.925224759
289746,101001809929,06/08/2016 09:25:00 AM,06/24/2016 09:26:00 AM,06/16/2016 06:54:39 AM,ONTIME,Closed,Case Closed. Closed date : 2016-06-16 06:54:39.337 Case Resolved t971 reports vehicle not at location 6/16.,Abandoned Vehicles,Transportation - Traffic Division,Enforcement & Abandoned Vehicles,Abandoned Vehicles,BTDT_AVRS Interface Queue,BTDT,,,26 Conway St  Roslindale  MA  02131,9.0,06,5.0,E5,Roslindale,10.0,Ward 20,2004,R1,26 Conway St,2131.0,Address,42298.0,42.2891,-71.1298,Constituent Call,"(42.2891, -71.1298)",-7918133.11622739,5204384.079410768,-7918133.11622739,5204384.079410768
940565,101002027334,02/28/2017 01:37:32 PM,03/03/2017 01:37:32 PM,02/28/2017 02:35:41 PM,ONTIME,Closed,Case Closed. Closed date : 2017-02-28 14:35:41.103 Case Noted,Poor Conditions of Property,Public Works Department,Code Enforcement,Poor Conditions of Property,PWDx_Code Enforcement,PWDx,https://mayors24.cityofboston.gov/media/boston/report/photos/58b5c3690485380cc1770a9d/report.jpg,https://cityworker.cityofboston.gov:8443/attachments/report/58b5c3e5d052c51cc8fcef82/closed_photo/Report.jpg,315 A St  Boston  MA  02210,6.0,05,2.0,C6,South Boston / South Boston Waterfront,5.0,06,0601,,315 A St,2210.0,Address,344360.0,42.3487,-71.0484,Citizens Connect App,"(42.3487, -71.0484)",-7909071.709676818,5213356.978033894,-7909071.709676818,5213356.978033894
357593,101001342010,03/25/2015 03:37:32 PM,05/29/2015 03:37:32 PM,03/30/2015 01:29:29 PM,ONTIME,Closed,Case Closed Case Resolved,Graffiti Removal,Property Management,Graffiti,Graffiti Removal,PWDx_District 10A: Roxbury,PWDx,https://mayors24.cityofboston.gov/media/boston/report/photos/55130e730485b083536d15e3/report.jpg,,10 Huntington Ave  Boston  MA  02116,4.0,1C,2.0,D4,Back Bay,6.0,Ward 4,0402,E,10 Huntington Ave,2116.0,Address,254510.0,42.3486,-71.0773,Citizens Connect App,"(42.3486, -71.0773)",-7912288.842960742,5213341.9157134555,-7912288.842960742,5213341.9157134555
841794,101000724278,12/20/2012 07:43:59 AM,12/21/2012 08:30:00 AM,12/21/2012 01:15:05 PM,OVERDUE,Closed,Case Closed Case Resolved replaced RBO,Traffic Signal Repair,Transportation - Traffic Division,Signs & Signals,Traffic Signal Repair,BTDT_Traffic Signal_Repair,BTDT,,,INTERSECTION of N Beacon St & Cambridge St  Allston  MA,11.0,04,9.0,D14,Allston / Brighton,15.0,Ward 21,2106,,INTERSECTION N Beacon St & Cambridge St,,Intersection,1141.0,42.3536,-71.1375,Constituent Call,"(42.3536, -71.1375)",-7918990.276306499,5214095.061090947,-7918990.276306499,5214095.061090947
329224,101001920192,09/29/2016 08:06:00 AM,10/14/2016 08:30:00 AM,09/29/2016 02:29:42 PM,ONTIME,Closed,Case Closed. Closed date : 2016-09-29 14:29:42.363 Case Resolved RE-SECURED FIXTURE DOOR   W.LYNCH /J.FELDER /J.PETERSOM /CTHOMPSON,PRINTED :,Public Works Department,Street Lights,Street Light Outages,PWDx_Street Light Outages,PWDx,https://mayors24.cityofboston.gov/media/boston/report/photos/57ed03df6963a1cc488b9979/report.jpg,,INTERSECTION of Father Anthony Songin Way & Boston St  South Boston  MA,6.0,05,2.0,C6,South Boston / South Boston Waterfront,5.0,7,0706,,INTERSECTION Father Anthony Songin Way & Boston St,,Intersection,10621.0,42.3594,-71.0587,Citizens Connect App,"(0, 0)",-7910218.300431989,5214968.784796895,-7910218.300431989,5214968.784796895
469320,101001935718,10/21/2016 08:44:40 AM,10/24/2016 08:44:39 AM,10/21/2016 10:09:40 AM,ONTIME,Closed,Case Closed. Closed date : 2016-10-21 10:09:40.313 Case Noted Clear now.,Parking Enforcement,Transportation - Traffic Division,Enforcement & Abandoned Vehicles,Parking Enforcement,BTDT_Parking Enforcement,BTDT,https://mayors24.cityofboston.gov/media/boston/report/photos/580a0daa696338e4faae7271/photo_20161021_084357.jpg,,190 Warren Ave  Roxbury  MA  02118,4.0,1C,2.0,D4,South End,6.0,04,0401,,190 Warren Ave,2118.0,Address,347141.0,42.3436,-71.0764,Citizens Connect App,"(42.3436, -71.0764)",-7912188.65541903,5212588.830240113,-7912188.65541903,5212588.830240113
110794,101001725390,02/26/2016 01:07:00 PM,02/29/2016 01:07:19 PM,02/26/2016 10:32:00 PM,ONTIME,Closed,Case Closed. Closed date : 2016-02-26 22:32:00.483 Case Noted Duplicate of 1725575,Tree Emergencies,Parks & Recreation Department,Trees,Tree Emergencies,PARK_Tree Emergencies,PARK,,,86 Dacia St  Dorchester  MA  02125,7.0,03,7.0,B2,Roxbury,13.0,Ward 13,1301,A,86 Dacia St,2125.0,Address,164102.0,42.317,-71.0768,Constituent Call,"(42.317, -71.0768)",-7912233.183215348,5208583.421956635,-7912233.183215348,5208583.421956635
461053,101000903364,08/16/2013 10:43:49 AM,08/20/2013 10:43:49 AM,08/16/2013 02:50:49 PM,ONTIME,Closed,Case Closed Case Noted  We are in receipt of you call  unfortunately we have no trucks in this area today  the inspector has the address on his list for Monday to make sure the container is serviced.,Missed Trash: District 10B,Public Works Department,Sanitation,Missed Trash/Recycling/Yard Waste/Bulk Item,PWDx_Missed Trash\Recycling\Yard Waste\Bulk Item,PWDx,,,51 Elm Hill Ave  Dorchester  MA  02121,9.0,10B,7.0,B2,Roxbury,13.0,Ward 12,1209,R3,51 Elm Hill Ave,2121.0,Address,53225.0,42.3114,-71.0864,Constituent Call,"(42.3114, -71.0864)",-7913301.850326962,5207740.393875153,-7913301.850326962,5207740.393875153
583591,101001069395,04/16/2014 10:10:52 AM,05/01/2014 10:10:52 AM,04/18/2014 11:16:17 AM,ONTIME,Closed,Case Closed Case Noted It is unclear who's the tenant. The manager stated that there is only one tenant that has come to the office regarding harassment. Both parties we're Private Conference and they had also gone through the Grievance Panel and the panel  did not vote in her favor.  EMELY,Other: Complaint,Mayor's 24 Hour Hotline,Employee & General Comments,General Comments For a Program or Policy,INFO_General Comments Complaints Compliments,INFO,,,,,,,,,,,,,,,,,42.3594,-71.0587,Constituent Call,"(0, 0)",-7910218.300431989,5214968.784796895,-7910218.300431989,5214968.784796895
304355,101001404125,06/07/2015 01:30:00 PM,06/15/2015 08:30:00 AM,06/15/2015 02:06:38 PM,OVERDUE,Closed,Case Closed. Closed date : 2015-06-15 14:06:38.56 Case Resolved done,Ground Maintenance: George Wright Golf Course,Parks & Recreation Department,Park Maintenance & Safety,Ground Maintenance,PARK_Maintenance_Trades,PARK,,,INTERSECTION of Poplar St & West St  Hyde Park  MA,12.0,08,5.0,E18,Hyde Park,10.0,Ward 18,1812,,INTERSECTION Poplar St & West St,,Intersection,7937.0,42.2687,-71.1316,Constituent Call,"(42.2687, -71.1316)",-7918333.491310819,5201314.769459701,-7918333.491310819,5201314.769459701
265935,101000390096,03/02/2012 08:14:44 AM,03/05/2012 08:14:41 AM,03/02/2012 08:25:26 AM,ONTIME,Closed,Case Closed Case Resolved sent pick up to pick up animal,Pick up Dead Animal,Public Works Department,Street Cleaning,Pick up Dead Animal,PWDx_District 1C: Downtown,PWDx,,,281-283 Franklin St  Boston  MA  02110,3.0,1C,1.0,A1,Downtown / Financial District,3.0,Ward 3,0306,C,281-283 Franklin St,2110.0,Address,60666.0,42.3569,-71.0531,Employee Generated,"(42.3569, -71.0531)",-7909594.911283546,5214592.169862997,-7909594.911283546,5214592.169862997
492374,101000994333,01/02/2014 08:10:45 AM,02/16/2014 08:10:45 AM,01/22/2014 01:28:34 AM,ONTIME,Closed,Case Closed Case Resolved CASE RESOLVED,General Lighting Request,Public Works Department,Street Lights,General Lighting Request,PWDx_Street Light_General Lighting Request,PWDx,,,18-22 Batchelder St  Roxbury  MA  02119,7.0,03,7.0,B2,Roxbury,13.0,Ward 8,0805,CM,18-22 Batchelder St,2119.0,Address,340794.0,42.3217,-71.0694,Constituent Call,"(42.3217, -71.0694)",-7911409.418983476,5209291.021287154,-7911409.418983476,5209291.021287154
853617,101001603115,10/01/2015 10:07:00 PM,,10/06/2015 04:31:24 PM,ONTIME,Closed,Case Closed. Closed date : 2015-10-06 16:31:24.38 Bulk Item Automation,Schedule a Bulk Item Pickup,Public Works Department,Sanitation,Schedule a Bulk Item Pickup,PWDx_Schedule a Bulk Item Pickup,PWDx,,,25-31 Maverick Sq  East Boston  MA  02128,1.0,09,1.0,A7,East Boston,1.0,Ward 1,0103,CM,25-31 Maverick Sq,2128.0,Address,92870.0,42.3692,-71.0391,Constituent Call,"(42.3692, -71.0391)",-7908036.438412442,5216445.259852141,-7908036.438412442,5216445.259852141
413767,101001924878,10/05/2016 04:41:00 PM,10/05/2017 04:41:30 PM,10/27/2016 01:25:21 PM,ONTIME,Closed,Case Closed. Closed date : 2016-10-27 13:25:21.93 Case Noted This is a duplicate of case ref: 1935368,Tree Maintenance Requests,Parks & Recreation Department,Trees,Tree Maintenance Requests,PARK_Tree Maintenance Request,PARK,,,35 Dennison St  Roxbury  MA  02119,9.0,10B,7.0,B2,Roxbury,13.0,Ward 11,1103,R2,35 Dennison St,2119.0,Address,47299.0,42.3181,-71.0932,Constituent Call,"(42.3181, -71.0932)",-7914058.822864356,5208749.025573346,-7914058.822864356,5208749.025573346
725941,101001851543,07/05/2016 03:11:00 PM,07/08/2016 03:11:54 PM,12/15/2016 08:38:54 AM,OVERDUE,Closed,Case Closed. Closed date : 2016-12-15 08:38:54.513 ADCLSD: Administratively Closed,Building Inspection Request,Inspectional Services,Building,Building Inspection Request,ISD_Building (INTERNAL),ISD,,,10 Dunbar Ave  Dorchester  MA  02124,8.0,07,4.0,B3,Dorchester,9.0,Ward 17,1708,E,10 Dunbar Ave,2124.0,Address,49879.0,42.2863,-71.0718,Constituent Call,"(42.2863, -71.0718)",-7911676.58576138,5203962.742734722,-7911676.58576138,5203962.742734722
330113,101001805762,06/03/2016 06:51:34 AM,06/06/2016 08:30:00 AM,06/03/2016 09:12:31 AM,ONTIME,Closed,Case Closed. Closed date : 2016-06-03 09:12:31.61 Case Noted Delivered,Sticker Request,Public Works Department,Recycling,Sticker Request,PWDx_Sticker Request,PWDx,,,309 Chelsea St  East Boston  MA  02128,1.0,09,1.0,A7,East Boston,1.0,Ward 1,0110,R3,309 Chelsea St,2128.0,Address,30488.0,42.3772,-71.03,Self Service,"(42.3772, -71.03)",-7907023.431046221,5217650.7163925385,-7907023.431046221,5217650.7163925385
315004,101001881480,08/12/2016 12:38:00 PM,08/26/2016 12:38:41 PM,09/08/2016 02:07:27 PM,OVERDUE,Closed,Case Closed. Closed date : 2016-09-08 14:07:27.34 Case Noted,BTDT: Compliment,Mayor's 24 Hour Hotline,Employee & General Comments,General Comments For a Program or Policy,BTDT_General Comments,BTDT,,,,,,,,,,,,,,,,,42.3594,-71.0587,Constituent Call,"(0, 0)",-7910218.300431989,5214968.784796895,-7910218.300431989,5214968.784796895
38918,101001716654,02/14/2016 09:59:00 AM,02/17/2016 08:30:00 AM,02/14/2016 11:48:26 AM,ONTIME,Closed,Case Closed. Closed date : 2016-02-14 11:48:26.753 Case Resolved,Pick up Dead Animal,Public Works Department,Street Cleaning,Pick up Dead Animal,PWDx_District 07: South Dorchester,PWDx,,,51 Rexford St  Mattapan  MA  02126,8.0,07,5.0,B3,Greater Mattapan,9.0,Ward 18,1821,R2,51 Rexford St,2126.0,Address,115552.0,42.2699,-71.0956,Constituent Call,"(42.2699, -71.0956)",-7914325.9896422615,5201495.2896021055,-7914325.9896422615,5201495.2896021055
633881,101001188316,10/03/2014 10:57:48 AM,,01/02/2015 08:39:32 AM,ONTIME,Closed,Case Closed Case Resolved CHECKED  MANHOLES IN THE AREA FOUND NO SINKHOLE  FOUND AN OLD PATCH IN GOOD CONDITION NEAR MANHOLE 12/31,Utility Casting Repair,Public Works Department,Highway Maintenance,Utility Casting Repair,BWSC_All Cases,BWSC,https://cityworker.cityofboston.gov:8443/attachments/report/542eb96ad052f1b1cd5b5323/photo/Report.jpg,,INTERSECTION of Central Ave & Metropolitan Ave  Hyde Park  MA,12.0,08,5.0,E18,Hyde Park,10.0,Ward 18,1808,,INTERSECTION Central Ave & Metropolitan Ave,,Intersection,2597.0,42.263999999999996,-71.1179,City Worker App,"(42.264, -71.1179)",-7916808.414286952,5200607.765321191,-7916808.414286952,5200607.765321191
751294,101001805334,06/02/2016 01:27:36 PM,06/09/2016 01:27:38 PM,06/02/2016 01:27:44 PM,ONTIME,Closed,Case Closed. Closed date : 2016-06-02 13:27:44.337 Case Resolved Created Request for Recycling Bin,Recycling Cart Return,Public Works Department,Recycling,Recycling Cart Return,PWDx_IPL Damaged Cart Replacement,PWDx,https://cityworker.cityofboston.gov:8443/attachments/report/57506c87d05203d28ce89aa9/photo/Report.jpg,,607 Poplar St  Hyde Park  MA  02136,12.0,08,5.0,E18,Roslindale,10.0,Ward 18,1812,R1,607 Poplar St,2136.0,Address,111959.0,42.2697,-71.1323,City Worker App,"(42.2697, -71.1323)",-7918411.414954374,5201465.2026730515,-7918411.414954374,5201465.2026730515
14873,101000499420,10/29/2012 09:26:30 PM,,10/30/2012 12:59:32 PM,ONTIME,Closed,Case Closed Case Resolved No flood on arrival crew cleaned 2 CB?s 10/30.,Roadway Flooding,Boston Water & Sewer Commission,Catchbasin,Roadway Flooding,BWSC_All Cases,BWSC,,,73A-73B Hano St  Allston  MA  02134,11.0,04,9.0,D14,Allston / Brighton,15.0,Ward 22,2202,R2,73A-73B Hano St,2134.0,Address,69016.0,42.3549,-71.1376,Constituent Call,"(42.3549, -71.1376)",-7919001.408255578,5214290.888703277,-7919001.408255578,5214290.888703277
50550,101001863889,07/20/2016 02:52:00 PM,07/21/2016 02:52:37 PM,07/20/2016 05:08:47 PM,ONTIME,Closed,Case Closed. Closed date : 2016-07-20 17:08:47.493 Case Noted given to the abandoned officer to check this out,Parking Enforcement,Transportation - Traffic Division,Enforcement & Abandoned Vehicles,Parking Enforcement,BTDT_Parking Enforcement,BTDT,,,104 Greenwood St  Dorchester  MA  02121,7.0,03,4.0,B3,Greater Mattapan,8.0,Ward 14,1402,R2,104 Greenwood St,2121.0,Address,66952.0,42.2984,-71.0795,Constituent Call,"(42.2984, -71.0795)",-7912533.745840489,5205783.653511779,-7912533.745840489,5205783.653511779
55833,101000335256,09/27/2011 06:08:44 PM,09/30/2011 08:30:00 AM,09/28/2011 11:33:10 AM,ONTIME,Closed,Case Closed Case Resolved  this has been collected.,Missed Recycling: District 06,Public Works Department,Sanitation,Missed Trash/Recycling/Yard Waste/Bulk Item,PWDx_Missed Trash\Recycling\Yard Waste\Bulk Item,PWDx,,,14 Aldrich St  Roslindale  MA  02131,12.0,06,5.0,E5,Roslindale,10.0,Ward 20,2002,R3,14 Aldrich St,2131.0,Address,1825.0,42.2858,-71.1394,Constituent Call,"(42.2858, -71.1394)",-7919201.783339005,5203887.506013222,-7919201.783339005,5203887.506013222
915667,101002000366,01/31/2017 12:57:00 PM,02/14/2017 12:57:09 PM,02/03/2017 02:56:27 AM,ONTIME,Closed,Case Closed. Closed date : 2017-02-03 02:56:27.567 Case Resolved Straightened  & Resecured Fixture  Partially Re-Glazed,Street Light Outages damaged glass RT,Public Works Department,Street Lights,Street Light Outages,PWDx_Street Light Outages,PWDx,https://mayors24.cityofboston.gov/media/boston/report/photos/5890cfeb04856990cd1b2fad/IMG_1215.JPG,,380 Commonwealth Ave  Boston  MA  02215,4.0,10A,8.0,D4,Boston,14.0,05,0510,,380 Commonwealth Ave,2215.0,Address,419703.0,42.3487,-71.0894,Citizens Connect App,"(42.3487, -71.0894)",-7913635.808799342,5213356.978033894,-7913635.808799342,5213356.978033894
588076,101001269612,02/03/2015 10:03:32 AM,02/05/2015 10:03:32 AM,02/12/2015 05:39:55 PM,OVERDUE,Closed,Case Closed Case Noted Snow has been removed.,Request for Snow Plowing,Public Works Department,Street Cleaning,Request for Snow Plowing,PWDx_District 09: East Boston,PWDx,,,17 Lamson Ct  East Boston  MA  02128,1.0,09,1.0,A7,East Boston,1.0,Ward 1,0101,R1,17 Lamson Ct,2128.0,Address,83672.0,42.3666,-71.0333,Citizens Connect App,"(42.3666, -71.0333)",-7907390.7853658395,5216053.519533397,-7907390.7853658395,5216053.519533397
796184,101000982425,12/15/2013 03:40:16 PM,12/18/2013 08:30:00 AM,12/16/2013 09:46:31 AM,ONTIME,Closed,Case Closed Case Resolved Complaint addressed,Request for Snow Plowing,Public Works Department,Street Cleaning,Request for Snow Plowing,PWDx_District 07: South Dorchester,PWDx,,,36 Violet St  Mattapan  MA  02126,8.0,07,4.0,B3,Greater Mattapan,9.0,Ward 18,1802,R1,36 Violet St,2126.0,Address,140874.0,42.2746,-71.0893,Constituent Call,"(42.2746, -71.0893)",-7913624.676850262,5202202.359918384,-7913624.676850262,5202202.359918384
153152,101001957909,11/23/2016 03:25:48 PM,11/25/2016 03:25:47 PM,11/23/2016 05:23:49 PM,ONTIME,Closed,Case Closed. Closed date : 2016-11-23 17:23:49.037 Case Resolved Picked up trash bags,CE Collection,Public Works Department,Street Cleaning,CE Collection,PWDx_District 1C: Downtown,PWDx,https://cityworker.cityofboston.gov:8443/attachments/report/5835fb4ad05202fe6713cb05/photo/Report.jpg,https://cityworker.cityofboston.gov:8443/attachments/report/5835fb4ad05202fe6713cb05/closed_photo/Report.jpg,162 W Newton St  Roxbury  MA  02118,4.0,1C,7.0,D4,South End,6.0,Ward 4,0404,R1,162 W Newton St,2118.0,Address,102434.0,42.3426,-71.078,City Worker App,"(42.3426, -71.078)",-7912366.766604299,5212438.2203325955,-7912366.766604299,5212438.2203325955
488214,101000486495,10/01/2012 10:57:53 AM,10/03/2012 10:57:53 AM,10/02/2012 02:10:36 PM,ONTIME,Closed,Case Closed Case Resolved Location has been made safe. This sidewalk will be referred for permanent repair. See case #101000487346 for status of the permanent repair.,Sidewalk Repair (Make Safe),Public Works Department,Highway Maintenance,Sidewalk Repair (Make Safe),PWDx_District 03: North Dorchester,PWDx,,,45 Dorset St  Dorchester  MA  02125,6.0,03,2.0,C6,Dorchester,5.0,Ward 7,0708,R1,45 Dorset St,2125.0,Address,49193.0,42.3242,-71.0592,Citizens Connect App,"(42.3242, -71.0592)",-7910273.960177385,5209667.425444918,-7910273.960177385,5209667.425444918
568239,101001763509,04/07/2016 06:15:00 PM,04/11/2016 08:30:00 AM,04/08/2016 11:42:21 AM,ONTIME,Closed,Case Closed. Closed date : 2016-04-08 11:42:21.967 Case Noted Everyweek issue with this vehicle. Car is legally parked. They are blocking access point to driveway so we can service container. Contractor will try to service today. However if car doesn't move container will not be able to be serviced. On location at 11:42 a.m. on 4/8/16.,Missed Trash: District 07,Public Works Department,Sanitation,Missed Trash/Recycling/Yard Waste/Bulk Item,PWDx_Missed Trash\Recycling\Yard Waste\Bulk Item,PWDx,,https://cityworker.cityofboston.gov:8443/attachments/report/5706dc8ad052f1f6cc330ecc/closed_photo/Report.jpg,80 Beaumont St  Dorchester  MA  02124,8.0,07,3.0,C11,Dorchester,7.0,Ward 16,1608,CM,80 Beaumont St,2124.0,Address,12969.0,42.2856,-71.0575,Constituent Call,"(42.2856, -71.0575)",-7910084.7170430375,5203857.411491817,-7910084.7170430375,5203857.411491817
147163,101001258246,01/28/2015 12:51:59 PM,01/30/2015 12:51:59 PM,01/28/2015 01:53:37 PM,ONTIME,Closed,Case Closed Case Noted Materials were removed thank you.,Missed Trash: District 1A,Public Works Department,Sanitation,Missed Trash/Recycling/Yard Waste/Bulk Item,PWDx_Missed Trash\Recycling\Yard Waste\Bulk Item,PWDx,,,16 Prospect St  Charlestown  MA  02129,3.0,1A,1.0,A15,Charlestown,2.0,Ward 2,0203,R3,16 Prospect St,2129.0,Address,113444.0,42.3751,-71.0579,Constituent Call,"(42.3751, -71.0579)",-7910129.2448393535,5217334.269187332,-7910129.2448393535,5217334.269187332
503375,101000952936,10/24/2013 06:28:15 AM,10/28/2013 08:30:00 AM,10/24/2013 06:28:16 AM,ONTIME,Closed,Case Closed Case Resolved Marked completed at case creation,Requests for Street Cleaning,Public Works Department,Street Cleaning,Requests for Street Cleaning,PWDx_District 08: Hyde Park,PWDx,,,INTERSECTION of Dell Ave & Hyde Park Ave  Hyde Park  MA,12.0,08,5.0,E18,Hyde Park,10.0,Ward 18,1813,,INTERSECTION Dell Ave & Hyde Park Ave,,Intersection,4008.0,42.2608,-71.1227,City Worker App,"(42.2608, -71.1227)",-7917342.747842757,5200126.4309594035,-7917342.747842757,5200126.4309594035
216035,101001358139,04/16/2015 01:35:05 PM,05/01/2015 01:35:05 PM,04/23/2015 12:39:05 PM,ONTIME,Closed,Case Closed Case Resolved Work completed 4/23/15.,Missing Sign,Transportation - Traffic Division,Signs & Signals,Missing Sign,BTDT_Sign Shop_Sign Installation,BTDT,https://cityworker.cityofboston.gov:8443/attachments/report/552ff2c770b47681496bfbdd/photo/Report.jpg,,61 Old Morton St  Mattapan  MA  02126,8.0,07,3.0,B3,Dorchester,7.0,Ward 17,1714,CD,61 Old Morton St,2126.0,Address,105200.0,42.2723,-71.0715,City Worker App,"(42.2723, -71.0715)",-7911643.189914142,5201856.340197138,-7911643.189914142,5201856.340197138
823637,101001938389,10/25/2016 09:12:46 AM,10/26/2016 09:12:45 AM,10/25/2016 10:03:07 AM,ONTIME,Closed,Case Closed. Closed date : 2016-10-25 10:03:07.753 Case Resolved Duplicate dead animal picked up,Pick up Dead Animal,Public Works Department,Street Cleaning,Pick up Dead Animal,PWDx_District 02: Jamaica Plain,PWDx,https://mayors24.cityofboston.gov/media/boston/report/photos/580f5a47696338e4faaeba5c/report.jpg,,7 Everett St  Jamaica Plain  MA  02130,9.0,02,6.0,E13,Jamaica Plain,11.0,Ward 19,1906,CM,7 Everett St,2130.0,Address,55227.0,42.31,-71.1093,Citizens Connect App,"(42.31, -71.1093)",-7915851.066666129,5207529.648574596,-7915851.066666129,5207529.648574596
742745,101000451893,07/19/2012 08:13:05 AM,07/23/2012 08:13:05 AM,07/19/2012 08:13:09 AM,ONTIME,Closed,Case Closed,Requests for Street Cleaning,Public Works Department,Street Cleaning,Requests for Street Cleaning,PWDx_District 06: West Roxbury and Roslindale,PWDx,,,135 Russett Rd  West Roxbury  MA  02132,9.0,06,6.0,E5,West Roxbury,12.0,Ward 20,2019,R2,135 Russett Rd,2132.0,Address,119826.0,42.2925,-71.1516,City Worker App,"(42.2925, -71.1516)",-7920559.881126684,5204895.7276967885,-7920559.881126684,5204895.7276967885
425586,101001155805,08/22/2014 04:22:57 PM,11/20/2014 04:22:57 PM,08/25/2014 12:35:24 PM,ONTIME,Closed,Case Closed Case Noted The Boston Transportation Department did some maintenance to it's computer system over the past weekend.  We appoligize for any delay tht you have have experienced.,Requests for Traffic Signal Studies or Reviews,Transportation - Traffic Division,Traffic Management & Engineering,Requests for Traffic Signal Studies or Reviews,BTDT_Engineering_Request for Traffic Signal Study or Review,BTDT,,,INTERSECTION of Centre St & Heath St  Jamaica Plain  MA,9.0,10B,7.0,E13,Jamaica Plain,13.0,Ward 11,1101,,INTERSECTION Centre St & Heath St,,Intersection,2708.0,42.3249,-71.0984,Constituent Call,"(42.3249, -71.0984)",-7914637.684216482,5209772.82128938,-7914637.684216482,5209772.82128938
88695,101001750742,03/21/2016 02:29:36 PM,03/23/2016 02:29:36 PM,03/23/2016 09:18:52 AM,ONTIME,Closed,Case Closed. Closed date : 2016-03-23 09:18:52.327 VIOISS: Violation Filed,Food Alert - Confirmed,Inspectional Services,Health,Food Alert - Confirmed,ISD_Health (INTERNAL),ISD,,,344 Washington St  Brighton  MA  02135,11.0,04,9.0,D14,Allston / Brighton,15.0,Ward 22,2203,C,344 Washington St,2135.0,Address,171314.0,42.3489,-71.1529,Constituent Call,"(42.3489, -71.1529)",-7920704.596464716,5213387.102746655,-7920704.596464716,5213387.102746655
369555,101001892272,08/27/2016 02:45:54 PM,08/30/2016 08:30:00 AM,08/27/2016 03:56:58 PM,ONTIME,Closed,Case Closed. Closed date : 2016-08-27 15:56:58.38 Case Resolved area checked violators cited,Parking Enforcement,Transportation - Traffic Division,Enforcement & Abandoned Vehicles,Parking Enforcement,BTDT_Parking Enforcement,BTDT,,,17 Cummings Rd  Brighton  MA  02135,11.0,04,9.0,D14,Allston / Brighton,15.0,Ward 21,2112,A,17 Cummings Rd,2135.0,Address,220935.0,42.3406,-71.1437,Citizens Connect App,"(42.3406, -71.1437)",-7919680.457149417,5212137.007703746,-7919680.457149417,5212137.007703746
422555,101000989933,12/22/2013 02:00:30 PM,12/25/2013 08:30:00 AM,12/24/2013 10:26:44 AM,ONTIME,Closed,Case Closed Case Resolved at that location roadway patch and made safe by DIST#4 PATCH CREW,Request for Pothole Repair,Public Works Department,Highway Maintenance,Request for Pothole Repair,PWDx_District 04: Allston/Brighton,PWDx,,,INTERSECTION of Commonwealth Ave & Harry Agganis Way  Boston  MA,11.0,04,8.0,D14,Allston / Brighton,14.0,Ward 21,2102,,INTERSECTION Commonwealth Ave & Harry Agganis Way,,Intersection,3379.0,42.3515,-71.1185,Citizens Connect App,"(42.3515, -71.1185)",-7916875.205981427,5213778.7327350965,-7916875.205981427,5213778.7327350965
274896,101001287025,02/10/2015 11:27:33 PM,02/13/2015 08:30:00 AM,02/11/2015 06:11:55 AM,ONTIME,Closed,Case Closed Case Noted Trash was collected on Mission Hill yesterday - not all containers of trash and recycling was accessible or out - Please make trash/recycling is out by 7am and a clear path is made to  trash/recycing barrels or contains  We cannot promise to make back today day however will make an attempt. If not we will return on 2/13 your next scheduled day,Missed Trash: District 10A,Public Works Department,Sanitation,Missed Trash/Recycling/Yard Waste/Bulk Item,PWDx_Missed Trash\Recycling\Yard Waste\Bulk Item,PWDx,,,43 Iroquois St  Mission Hill  MA  02120,9.0,10A,8.0,B2,Mission Hill,14.0,Ward 10,1005,R2,43 Iroquois St,2120.0,Address,78889.0,42.3304,-71.1048,Constituent Call,"(42.3304, -71.1048)",-7915350.128957558,5210600.972304514,-7915350.128957558,5210600.972304514
690625,101001633743,11/12/2015 03:52:10 PM,11/13/2015 03:52:09 PM,11/12/2015 05:17:02 PM,ONTIME,Closed,Case Closed. Closed date : 2015-11-12 17:17:02.49 Case Resolved It's all set,Requests for Street Cleaning,Public Works Department,Street Cleaning,Requests for Street Cleaning,PWDx_District 1C: Downtown,PWDx,https://mayors24.cityofboston.gov/media/boston/report/photos/5644fbf655a5723671edd014/report.jpg,https://cityworker.cityofboston.gov:8443/attachments/report/5644fc3ad052932be1db0e8b/closed_photo/Report.jpg,66 Appleton St  Boston  MA  02116,4.0,1C,2.0,D4,South End,6.0,Ward 5,0501,CM,66 Appleton St,2116.0,Address,4085.0,42.3456,-71.0723,Citizens Connect App,"(42.3456, -71.0723)",-7911732.245506777,5212890.057241928,-7911732.245506777,5212890.057241928
784769,101001641295,11/23/2015 02:48:39 PM,12/10/2015 02:48:39 PM,11/23/2015 05:03:09 PM,ONTIME,Closed,Case Closed. Closed date : 2015-11-23 17:03:09.033 Case Noted This case has been redirected to our Parking Enforcement Department.  A new case reference number: 101001641437  has been created.  Please use the new Case Reference for further enquiry.  Sincerely  Boston 311 Team,Abandoned Vehicles,Transportation - Traffic Division,Enforcement & Abandoned Vehicles,Abandoned Vehicles,BTDT_AVRS Interface Queue,BTDT,https://mayors24.cityofboston.gov/media/boston/report/photos/56536d9104858c01fa6919ba/report.jpg,,38-44 Newbury St  Boston  MA  02116,4.0,1C,8.0,D4,Back Bay,14.0,Ward 5,0506,C,38-44 Newbury St,2116.0,Address,101636.0,42.3519,-71.0729,Citizens Connect App,"(42.3519, -71.0729)",-7911799.037201255,5213838.984940407,-7911799.037201255,5213838.984940407
288441,101001115759,06/25/2014 10:27:41 AM,07/02/2014 10:27:40 AM,,OVERDUE,Open,,Protection of Adjoining Property,Inspectional Services,Building,Protection of Adjoining Property,ISD_Building (INTERNAL),ISD,,,51 Halifax St  Jamaica Plain  MA  02130,9.0,02,6.0,E13,Jamaica Plain,11.0,Ward 19,1903,R2,51 Halifax St,2130.0,Address,68097.0,42.3207,-71.1144,Constituent Call,"(42.3207, -71.1144)",-7916418.796069175,5209140.463811702,-7916418.796069175,5209140.463811702
693198,101001029659,02/18/2014 04:14:15 PM,02/20/2014 04:14:15 PM,02/19/2014 09:07:32 AM,ONTIME,Closed,Case Closed Case Resolved,Request for Snow Plowing,Public Works Department,Street Cleaning,Request for Snow Plowing,PWDx_District 1C: Downtown,PWDx,,,INTERSECTION of Hereford St & Marlborough St  Boston  MA,4.0,1C,8.0,D4,Back Bay,14.0,Ward 5,0509,,INTERSECTION Hereford St & Marlborough St,,Intersection,5884.0,42.3507,-71.0866,Constituent Call,"(42.3507, -71.0866)",-7913324.114225122,5213658.229474797,-7913324.114225122,5213658.229474797
214598,101000989555,12/21/2013 09:52:20 AM,12/30/2013 08:30:00 AM,03/17/2014 09:11:08 AM,OVERDUE,Closed,Case Closed ADCLSD: Administratively Closed,Electrical,Inspectional Services,Building,Electrical,ISD_Building (INTERNAL),ISD,,,65 Burbank St  Boston  MA  02115,4.0,10A,8.0,D4,Fenway / Kenmore / Audubon Circle / Longwood,14.0,Ward 4,0406,CD,65 Burbank St,2115.0,Address,23770.0,42.3447,-71.0889,Constituent Call,"(42.3447, -71.0889)",-7913580.149053945,5212754.503905248,-7913580.149053945,5212754.503905248
169899,101000836984,05/10/2013 07:57:44 AM,05/13/2013 08:30:00 AM,05/10/2013 02:26:44 PM,ONTIME,Closed,Case Closed Case Resolved KD there made safe tempory post putn up for M/A kd,Traffic Signal Repair,Transportation - Traffic Division,Signs & Signals,Traffic Signal Repair,BTDT_Traffic Signal_Repair,BTDT,,,INTERSECTION of Blue Hill Ave & Woodrow Ave  Dorchester  MA,8.0,07,4.0,B3,Greater Mattapan,9.0,Ward 14,1412,,INTERSECTION Blue Hill Ave & Woodrow Ave,,Intersection,1537.0,42.2856,-71.0909,Constituent Call,"(42.2856, -71.0909)",-7913802.788035532,5203857.411491817,-7913802.788035532,5203857.411491817
458999,101001814621,06/14/2016 07:34:19 AM,06/15/2016 08:30:00 AM,06/14/2016 08:24:21 AM,ONTIME,Closed,Case Closed. Closed date : 2016-06-14 08:24:21.867 Case Resolved Ticket issued and put on tow list.,Parking Enforcement,Transportation - Traffic Division,Enforcement & Abandoned Vehicles,Parking Enforcement,BTDT_Parking Enforcement,BTDT,https://mayors24.cityofboston.gov/media/boston/report/photos/575febb76963421113f1a446/report.jpg,,INTERSECTION of Dubois St & Orchard Park St  Roxbury  MA,7.0,10B,9.0,B2,Roxbury,13.0,8,0803,,INTERSECTION Dubois St & Orchard Park St,,Intersection,14279.0,42.3594,-71.0587,Citizens Connect App,"(0, 0)",-7910218.300431989,5214968.784796895,-7910218.300431989,5214968.784796895
512343,101001278615,02/05/2015 04:30:12 PM,02/09/2015 04:30:12 PM,02/12/2015 05:58:42 PM,OVERDUE,Closed,Case Closed Case Noted Snow has been removed.,Request for Snow Plowing,Public Works Department,Street Cleaning,Request for Snow Plowing,PWDx_District 07: South Dorchester,PWDx,,,1 Queen St  Dorchester  MA  02122,8.0,07,3.0,C11,Dorchester,7.0,Ward 16,1605,R2,1 Queen St,2122.0,Address,113710.0,42.2939,-71.0534,Self Service,"(42.2939, -71.0534)",-7909628.307130783,5205106.414430664,-7909628.307130783,5205106.414430664
110760,101000922825,09/10/2013 10:40:26 AM,,09/12/2013 09:55:20 PM,ONTIME,Closed,Case Closed Bulk Item Automation,Schedule a Bulk Item Pickup,Public Works Department,Sanitation,Schedule a Bulk Item Pickup,PWDx_Schedule a Bulk Item Pickup,PWDx,,,31 Tower St  Jamaica Plain  MA  02130,12.0,02,6.0,E13,Jamaica Plain,11.0,Ward 11,1108,R2,31 Tower St,2130.0,Address,136346.0,42.2992,-71.1123,Constituent Call,"(42.2992, -71.1123)",-7916185.0251385085,5205904.05663722,-7916185.0251385085,5205904.05663722
872,101000923083,09/10/2013 01:36:19 PM,,09/10/2013 01:36:20 PM,ONTIME,Closed,Case Closed Internal Case Performed by Highway Maintenance crew.,Pothole Repair (Internal),Public Works Department,Highway Maintenance,Pothole Repair (Internal),PWDx_District 03: North Dorchester,PWDx,,,749 Dorchester Ave  Dorchester  MA  02125,6.0,03,2.0,C6,Dorchester,5.0,Ward 7,0708,R3,749 Dorchester Ave,2125.0,Address,48692.0,42.3248,-71.0571,Employee Generated,"(42.3248, -71.0571)",-7910040.18924672,5209757.764668375,-7910040.18924672,5209757.764668375
397932,101000883975,07/21/2013 05:51:19 PM,07/24/2013 08:30:00 AM,07/22/2013 06:17:01 AM,ONTIME,Closed,Case Closed Case Noted Good monring  trucks will not be working in the today will return on your regular trash day (Wednesday 7/24) material must be curbside by 7 a.m. thank you,Missed Bulk Item Pickup: District 06,Public Works Department,Sanitation,Missed Trash/Recycling/Yard Waste/Bulk Item,PWDx_Missed Trash\Recycling\Yard Waste\Bulk Item,PWDx,,,52 Hollywood Rd  West Roxbury  MA  02132,9.0,06,6.0,E5,West Roxbury,12.0,Ward 20,2019,R1,52 Hollywood Rd,2132.0,Address,74757.0,42.2962,-71.1475,Self Service,"(42.2962, -71.1475)",-7920103.47121443,5205452.552803776,-7920103.47121443,5205452.552803776
202976,101001728598,03/02/2016 01:58:38 PM,03/03/2016 01:58:38 PM,03/03/2016 07:14:25 AM,ONTIME,Closed,Case Closed. Closed date : 2016-03-03 07:14:25.547 Case Resolved one bag of trash picked up,CE Collection,Public Works Department,Street Cleaning,CE Collection,PWDx_District 1B: North End,PWDx,https://cityworker.cityofboston.gov:8443/attachments/report/56d737dad052c399f662d702/photo/Report.jpg,https://cityworker.cityofboston.gov:8443/attachments/report/56d737dad052c399f662d702/closed_photo/Report.jpg,72 Revere St  Boston  MA  02114,3.0,1B,8.0,A1,Beacon Hill,14.0,Ward 5,0504,A,72 Revere St,2114.0,Address,298146.0,42.3594,-71.0691,City Worker App,"(42.3594, -71.0691)",-7911376.0231362395,5214968.784796895,-7911376.0231362395,5214968.784796895
105156,101001813825,06/13/2016 11:07:38 AM,06/14/2016 11:07:38 AM,06/13/2016 11:21:14 AM,ONTIME,Closed,Case Closed. Closed date : 2016-06-13 11:21:14.363 Case Noted Will have officer assigned to area check it as often as possible in the AM.,Parking Enforcement,Transportation - Traffic Division,Enforcement & Abandoned Vehicles,Parking Enforcement,BTDT_Parking Enforcement,BTDT,https://mayors24.cityofboston.gov/media/boston/report/photos/575ecc33696394ec1646d6cc/report.jpg,,245 Summer St  Boston  MA  02111,4.0,1C,2.0,A1,Downtown / Financial District,4.0,Ward 3,0308,EA,245 Summer St,2111.0,Address,131985.0,42.3514,-71.0539,Citizens Connect App,"(42.3514, -71.0539)",-7909683.966876181,5213763.669743681,-7909683.966876181,5213763.669743681
554532,101000723771,12/19/2012 09:25:38 AM,02/20/2013 09:25:38 AM,12/19/2012 09:33:16 AM,ONTIME,Closed,Case Closed Case Referred to External Agency USPS jurisdiction. Information forwarded to USPS.,Graffiti Removal,Property Management,Graffiti,Graffiti Removal,INFO_Reallocation From Dept,INFO,,,111 Huntington Ave  Boston  MA  02199,4.0,1C,2.0,D4,Back Bay,6.0,Ward 4,0402,C,111 Huntington Ave,2199.0,Address,254557.0,42.3465,-71.0815,Citizens Connect App,"(42.3465, -71.0815)",-7912756.384822076,5213025.6125192065,-7912756.384822076,5213025.6125192065
656356,101001422328,07/02/2015 02:47:00 PM,07/16/2015 02:47:54 PM,07/24/2015 08:43:23 AM,OVERDUE,Closed,Case Closed. Closed date : 2015-07-24 08:43:23.487 Case Noted,Parking Meter Repairs,Transportation - Traffic Division,Operations,Parking Meter Repairs,BTDT_Broken Meter Complaints,BTDT,,,118 South St  Boston  MA  02111,4.0,1C,2.0,A1,Downtown / Financial District,4.0,Ward 3,308.0,RC,118 South St,2111.0,Address,128512.0,42.3509,-71.0572,Constituent Call,"(42.3509, -71.0572)",-7910051.321195798,5213688.355146083,-7910051.321195798,5213688.355146083
444782,101000387306,02/23/2012 11:01:26 AM,03/08/2012 11:01:25 AM,02/28/2012 09:32:21 AM,ONTIME,Closed,Case Closed Case Resolved Work completed 2/28/12.,Sign Repair,Transportation - Traffic Division,Signs & Signals,Sign Repair,BTDT_Sign Shop_Sign Installation,BTDT,,,INTERSECTION of Arch St & Milk St  Boston  MA,3.0,1C,1.0,A1,Downtown / Financial District,3.0,Ward 3,0306,,INTERSECTION Arch St & Milk St,,Intersection,537.0,42.3567,-71.0578,Self Service,"(42.3567, -71.0578)",-7910118.112890274,5214562.041315547,-7910118.112890274,5214562.041315547
558498,101001705623,02/01/2016 10:33:17 AM,,02/01/2016 10:33:16 AM,ONTIME,Closed,Case Closed. Closed date : 2016-02-01 10:33:16.55 Internal Case Performed by Highway Maintenance crew.,Pothole Repair (Internal),Public Works Department,Highway Maintenance,Pothole Repair (Internal),PWDx_District 06: West Roxbury and Roslindale,PWDx,,,106 Lagrange St  West Roxbury  MA  02132,12.0,06,6.0,E5,West Roxbury,12.0,Ward 20,2010,R1,106 Lagrange St,2132.0,Address,82630.0,42.2756,-71.1472,Employee Generated,"(42.2756, -71.1472)",-7920070.075367193,5202352.807214156,-7920070.075367193,5202352.807214156
82813,101001406553,06/10/2015 10:51:00 AM,,06/12/2015 04:40:48 PM,ONTIME,Closed,Case Closed. Closed date : 2015-06-12 16:40:48.423 Bulk Item Automation,Schedule a Bulk Item Pickup,Public Works Department,Sanitation,Schedule a Bulk Item Pickup,PWDx_Schedule a Bulk Item Pickup,PWDx,,,10 Shepton St  Dorchester  MA  02124,8.0,07,3.0,C11,Dorchester,7.0,Ward 16,1606,R3,10 Shepton St,2124.0,Address,126724.0,42.2896,-71.0629,Constituent Call,"(42.2896, -71.0629)",-7910685.84229332,5204459.320073695,-7910685.84229332,5204459.320073695
615500,101000962417,11/08/2013 10:02:13 AM,01/10/2014 10:02:13 AM,11/22/2013 09:54:17 AM,ONTIME,Closed,Case Closed Case Resolved   This request has been completed.,Graffiti Removal,Property Management,Graffiti,Graffiti Removal,PROP_GRAF_GraffitiRemoval,PROP,,,602 Saratoga St  East Boston  MA  02128,1.0,09,1.0,A7,East Boston,1.0,Ward 1,0111,R1,602 Saratoga St,2128.0,Address,169460.0,42.382,-71.0224,Citizens Connect App,"(42.382, -71.0224)",-7906177.402916194,5218374.064030368,-7906177.402916194,5218374.064030368
915116,101001705759,02/01/2016 11:11:00 AM,01/31/2017 11:11:51 AM,,OVERDUE,Open,,Tree Maintenance Requests,Parks & Recreation Department,Trees,Tree Maintenance Requests,INFO01_GenericeFormforOtherServiceRequestTypes,INFO,https://mayors24.cityofboston.gov/media/boston/report/photos/56af83c50485cd229efc770f/photo_20160201_111033.jpg,,INTERSECTION of Dedham Pkwy & Enneking Pkwy  Hyde Park  MA,12.0,08,6.0,E18,Hyde Park,10.0,20,1823,,INTERSECTION Dedham Pkwy & Enneking Pkwy,,Intersection,17732.0,42.3594,-71.0587,Citizens Connect App,"(0, 0)",-7910218.300431989,5214968.784796895,-7910218.300431989,5214968.784796895
870723,101001541790,08/27/2015 09:18:22 AM,08/28/2015 09:18:22 AM,08/27/2015 11:55:48 AM,ONTIME,Closed,Case Closed. Closed date : 2015-08-27 11:55:48.18 Case Resolved removed trash,CE Collection,Public Works Department,Street Cleaning,CE Collection,PWDx_District 10A: Roxbury,PWDx,https://cityworker.cityofboston.gov:8443/attachments/report/55df0e2ed052f8c25f1d4140/photo/Report.jpg,https://cityworker.cityofboston.gov:8443/attachments/report/55df0e2ed052f8c25f1d4140/closed_photo/Report.jpg,INTERSECTION of Forsyth St & Hemenway St  Boston  MA,4.0,10A,7.0,D4,Fenway / Kenmore / Audubon Circle / Longwood,13.0,Ward 4,0409,,INTERSECTION Forsyth St & Hemenway St,,Intersection,5006.0,42.3408,-71.0912,City Worker App,"(42.3408, -71.0912)",-7913836.18388277,5212167.128535481,-7913836.18388277,5212167.128535481
218764,101000944557,10/10/2013 12:45:50 PM,,10/10/2013 12:45:51 PM,ONTIME,Closed,Case Closed Internal Case Performed by Highway Maintenance crew.,Pothole Repair (Internal),Public Works Department,Highway Maintenance,Pothole Repair (Internal),PWDx_District 06: West Roxbury and Roslindale,PWDx,,,INTERSECTION of Hobson St & W Roxbury Pkwy  Roslindale  MA,12.0,06,5.0,E5,Roslindale,10.0,Ward 20,2009,,INTERSECTION Hobson St & W Roxbury Pkwy,,Intersection,6320.0,42.2797,-71.1422,Employee Generated,"(42.2797, -71.1422)",-7919513.477913227,5202969.666087048,-7919513.477913227,5202969.666087048
63186,101001111597,06/19/2014 10:17:21 AM,07/03/2014 10:17:21 AM,06/24/2014 09:59:32 AM,ONTIME,Closed,Case Closed Case Resolved installed barrel,Request for Litter Basket Installation,Public Works Department,Street Cleaning,Request for Litter Basket Installation,PWDx_Request for Litter Basket Installation,PWDx,,,2214 Dorchester Ave  Dorchester  MA  02124,8.0,07,3.0,C11,Dorchester,7.0,16,1611,E,2214 Dorchester Ave,2124.0,Address,156640.0,42.2746,-71.0665,Constituent Call,"(42.2746, -71.0665)",-7911086.592460177,5202202.359918384,-7911086.592460177,5202202.359918384
849701,101001347528,04/02/2015 09:05:06 AM,04/03/2015 09:05:06 AM,04/03/2015 10:26:48 AM,OVERDUE,Closed,Case Closed Case Resolved completed,CE Collection,Public Works Department,Street Cleaning,CE Collection,PWDx_District 1C: Downtown,PWDx,https://cityworker.cityofboston.gov:8443/attachments/report/551d3e7d70b47681496b54d5/photo/Report.jpg,https://cityworker.cityofboston.gov:8443/attachments/report/551d3e7d70b47681496b54d5/closed_photo/Report.jpg,4 Champney Pl  Boston  MA  02114,3.0,1B,8.0,A1,Beacon Hill,14.0,05,0504,,4 Champney Pl,2114.0,Address,344864.0,42.3598,-71.0682,City Worker App,"(42.3598, -71.0682)",-7911275.835594525,5215029.0445768135,-7911275.835594525,5215029.0445768135
383541,101001108561,06/13/2014 01:51:44 PM,,06/13/2014 01:51:45 PM,ONTIME,Closed,Case Closed Internal Case Performed by Highway Maintenance crew.,Pothole Repair (Internal),Public Works Department,Highway Maintenance,Pothole Repair (Internal),PWDx_District 09: East Boston,PWDx,,,230 Sumner St  East Boston  MA  02128,1.0,09,1.0,A7,East Boston,1.0,Ward 1,0103,RC,230 Sumner St,2128.0,Address,316109.0,42.3594,-71.0587,Employee Generated,"(0, 0)",-7910218.300431989,5214968.784796895,-7910218.300431989,5214968.784796895
713004,101001230632,12/09/2014 05:08:53 PM,,05/11/2015 04:29:06 PM,ONTIME,Closed,Case Closed. Closed date : 2015-05-11 16:29:06.383 Case Noted area cleared on arrival,General Request,Boston Water & Sewer Commission,Administrative & General Requests,BWSC General Request,BWSC_All Cases,BWSC,,,INTERSECTION of Commonwealth Ave & Harvard Ave  Allston  MA,11.0,04,9.0,D14,Allston / Brighton,14.0,Ward 21,2103,,INTERSECTION Commonwealth Ave & Harvard Ave,,Intersection,3370.0,42.3501,-71.1309,Constituent Call,"(42.3501, -71.1309)",-7918255.567667263,5213567.853036073,-7918255.567667263,5213567.853036073
279740,101000328375,09/13/2011 05:45:37 AM,,09/13/2011 09:16:34 AM,ONTIME,Closed,Case Closed Case Resolved,Highway Maintenance,Public Works Department,Highway Maintenance,Highway Maintenance,PWDx_District 03: North Dorchester,PWDx,,,INTERSECTION of Dorchester Ave & Hecla St  Dorchester  MA,7.0,03,3.0,C11,Dorchester,8.0,Ward 15,1506,,INTERSECTION Dorchester Ave & Hecla St,,Intersection,4151.0,42.306999999999995,-71.0586,Constituent Call,"(42.307, -71.0586)",-7910207.16848291,5207078.067285161,-7910207.16848291,5207078.067285161
337682,101001743844,03/10/2016 11:27:00 AM,05/13/2016 11:27:53 AM,03/24/2016 01:40:41 PM,ONTIME,Closed,Case Closed. Closed date : 2016-03-24 13:40:41.56 Case Resolved graffiti removed. Three black poles done.,Graffiti Removal,Property Management,Graffiti,Graffiti Removal,PROP_GRAF_GraffitiRemoval,PROP,https://mayors24.cityofboston.gov/media/boston/report/photos/56e1a0856963f4e2fc3672d2/report.jpg,https://cityworker.cityofboston.gov:8443/attachments/report/56e1a0cdd052649456b7d29b/closed_photo/Report.jpg,111-115 W Dedham St  Roxbury  MA  02118,4.0,1C,2.0,D4,South End,6.0,Ward 9,0901,CM,111-115 W Dedham St,2118.0,Address,46909.0,42.3426,-71.0734,Citizens Connect App,"(42.3426, -71.0734)",-7911854.69694665,5212438.2203325955,-7911854.69694665,5212438.2203325955
94439,101001400159,06/01/2015 10:14:00 PM,06/03/2015 08:30:00 AM,06/02/2015 07:56:07 AM,ONTIME,Closed,Case Closed. Closed date : 2015-06-02 07:56:07.9 Duplicate of Existing Case duplicate of case 1400157,Request for Pothole Repair,Public Works Department,Highway Maintenance,Request for Pothole Repair,PWDx_District 04: Allston/Brighton,PWDx,,,INTERSECTION of Claymoss Rd & Euston Rd  Brighton  MA,11.0,04,9.0,D14,Allston / Brighton,15.0,Ward 21,2111,,INTERSECTION Claymoss Rd & Euston Rd,,Intersection,3102.0,42.3441,-71.1451,Self Service,"(42.3441, -71.1451)",-7919836.304436528,5212664.136092194,-7919836.304436528,5212664.136092194
913448,101001998087,01/27/2017 02:09:25 PM,01/30/2017 02:09:25 PM,01/27/2017 02:41:48 PM,ONTIME,Closed,Case Closed. Closed date : 2017-01-27 14:41:48.7 Case Resolved At said location debris picked up,Requests for Street Cleaning,Public Works Department,Street Cleaning,Requests for Street Cleaning,PWDx_District 05: South Boston,PWDx,,https://cityworker.cityofboston.gov:8443/attachments/report/588b9b2bd052e81b93e23406/closed_photo/Report.jpg,451-455A W Broadway  South Boston  MA  02127,6.0,05,2.0,C6,South Boston / South Boston Waterfront,5.0,Ward 6,0604,C,451-455A W Broadway,2127.0,Address,21549.0,42.3359,-71.0467,Citizens Connect App,"(42.3359, -71.0467)",-7908882.466542469,5211429.195736468,-7908882.466542469,5211429.195736468
918217,101001907061,09/13/2016 08:39:41 AM,09/20/2016 08:39:41 AM,02/01/2017 01:49:34 PM,OVERDUE,Closed,Case Closed. Closed date : 2017-02-01 13:49:34.473 NOACC: Closed-No Access,Electrical,Inspectional Services,Building,Electrical,ISD_Building (INTERNAL),ISD,,,50 Park Plz  Boston  MA  02116,4.0,1C,2.0,A1,Downtown / Financial District,6.0,05,0501,C,50 Park Plz,2116.0,Address,157315.0,42.3513,-71.0694,Constituent Call,"(42.3513, -71.0694)",-7911409.418983476,5213748.606776233,-7911409.418983476,5213748.606776233
9033,101000483522,09/24/2012 01:28:18 PM,,09/28/2012 09:43:14 PM,ONTIME,Closed,Case Closed Bulk Item Automation,Schedule a Bulk Item Pickup,Public Works Department,Sanitation,Schedule a Bulk Item Pickup,PWDx_Schedule a Bulk Item Pickup,PWDx,,,260 Ruggles St  Mission Hill  MA  02120,9.0,10A,7.0,B2,Mission Hill,13.0,Ward 4,0409,E,260 Ruggles St,2120.0,Address,302170.0,42.3357,-71.0915,Constituent Call,"(42.3357, -71.0915)",-7913869.579730008,5211399.077251736,-7913869.579730008,5211399.077251736
124133,101001894963,08/30/2016 04:07:00 PM,09/02/2016 04:07:33 PM,08/30/2016 05:29:11 PM,ONTIME,Closed,Case Closed. Closed date : 2016-08-30 17:29:11.52 Case Noted  No violation found at this time,Poor Conditions of Property,Public Works Department,Code Enforcement,Poor Conditions of Property,PWDx_Code Enforcement,PWDx,,https://cityworker.cityofboston.gov:8443/attachments/report/57c5e7ccd052c054f29fa99b/closed_photo/Report.jpg,14 Temple St  Boston  MA  02114,3.0,1B,1.0,A1,Beacon Hill,3.0,03,0306,A,14 Temple St,2114.0,Address,134091.0,42.361000000000004,-71.0636,Constituent Call,"(42.361, -71.0636)",-7910763.765936875,5215209.826218224,-7910763.765936875,5215209.826218224
679777,101001356824,04/15/2015 09:47:21 AM,04/16/2015 09:47:21 AM,04/15/2015 10:53:25 AM,ONTIME,Closed,Case Closed Case Resolved Picked up all set,Requests for Street Cleaning,Public Works Department,Street Cleaning,Requests for Street Cleaning,PWDx_District 07: South Dorchester,PWDx,https://cityworker.cityofboston.gov:8443/attachments/report/552e6be670b47681496be14f/photo/Report.jpg,,INTERSECTION of Mallard Ave & New England Ave  Dorchester  MA,8.0,07,4.0,B3,Greater Mattapan,9.0,Ward 17,1705,,INTERSECTION Mallard Ave & New England Ave,,Intersection,7010.0,42.2908,-71.0779,City Worker App,"(42.2908, -71.0779)",-7912355.6346552195,5204639.900101502,-7912355.6346552195,5204639.900101502
89182,101001762167,04/06/2016 10:06:00 AM,04/06/2017 10:06:38 AM,05/03/2016 07:08:25 AM,ONTIME,Closed,Case Closed. Closed date : 2016-05-03 07:08:25.217 Case Noted Tree was removed by North-Eastern Tree Service. A new tree request case will be made for this location. If you have any questions please call the Park Line at 617-635-7275.,Tree Maintenance Requests,Parks & Recreation Department,Trees,Tree Maintenance Requests,PARK_Tree Maintenance Request,PARK,,,82 Greenbrier St  Dorchester  MA  02124,7.0,03,4.0,C11,Dorchester,8.0,Ward 17,1702,R2,82 Greenbrier St,2124.0,Address,66477.0,42.2974,-71.0704,Constituent Call,"(42.2974, -71.0704)",-7911520.738474271,5205633.15175601,-7911520.738474271,5205633.15175601
232109,101001142499,08/03/2014 08:24:01 PM,,,ONTIME,Open,,Animal Found,Animal Control,Animal Issues,Animal Found,ANML02_LostFound,ANML,,,74 Elmira St  Brighton  MA  02135,11.0,04,9.0,D14,Allston / Brighton,15.0,Ward 22,2206,R2,74 Elmira St,2135.0,Address,53359.0,42.3526,-71.1474,Constituent Call,"(42.3526, -71.1474)",-7920092.339265352,5213944.427222384,-7920092.339265352,5213944.427222384
186921,101001347858,04/02/2015 12:52:26 PM,04/01/2016 12:52:23 PM,09/11/2015 09:27:25 AM,ONTIME,Closed,Case Closed. Closed date : 2015-09-11 09:27:25.593 Case Resolved The new tree was planted by Leahy Landscaping in the Spring of 2015. The tree is under warranty until Spring 2017.,New Tree Requests,Parks & Recreation Department,Trees,New Tree Requests,PARK_New Tree Requests,PARK,,,300 Columbus Ave  Boston  MA  02116,4.0,1C,2.0,D4,South End,6.0,Ward 4,0401,CM,300 Columbus Ave,2116.0,Address,35598.0,42.3465,-71.0741,Employee Generated,"(42.3465, -71.0741)",-7911932.620590204,5213025.6125192065,-7911932.620590204,5213025.6125192065
841484,101001408088,06/12/2015 07:58:50 AM,06/15/2015 08:30:00 AM,06/12/2015 11:22:56 AM,ONTIME,Closed,Case Closed. Closed date : 2015-06-12 11:22:56.417 Case Resolved Cigarette butts on sidewalk picked up by Hokeyman.,Requests for Street Cleaning,Public Works Department,Street Cleaning,Requests for Street Cleaning,PWDx_District 02: Jamaica Plain,PWDx,,,INTERSECTION of Centre St & Thomas St  Jamaica Plain  MA,9.0,02,6.0,E13,Jamaica Plain,11.0,Ward 19,1908,,INTERSECTION Centre St & Thomas St,,Intersection,2670.0,42.3104,-71.1149,Citizens Connect App,"(42.3104, -71.1149)",-7916474.455814571,5207589.861039305,-7916474.455814571,5207589.861039305
907559,101001914179,09/21/2016 09:07:00 AM,01/19/2017 09:07:18 AM,,OVERDUE,Open,,Unsatisfactory Living Conditions,Inspectional Services,Housing,Unsatisfactory Living Conditions,ISD_Housing (INTERNAL),ISD,,,507 Talbot Ave  Dorchester  MA  02124,8.0,07,4.0,C11,Dorchester,8.0,Ward 17,1709,R4,507 Talbot Ave,2124.0,Address,317808.0,42.2877,-71.0656,Constituent Call,"(42.2877, -71.0656)",-7910986.404918462,5204173.408731778,-7910986.404918462,5204173.408731778
834042,101001794399,05/19/2016 03:07:16 PM,05/23/2016 03:07:16 PM,06/24/2016 08:23:32 AM,OVERDUE,Closed,Case Closed. Closed date : 2016-06-24 08:23:32.53 NOVIO: No Violation Found/No Cause,Unsanitary Conditions - Establishment,Inspectional Services,Health,Unsanitary Conditions - Establishment,ISD_Health (INTERNAL),ISD,,,135 Causeway St  Boston  MA  02114,3.0,1B,1.0,A1,Boston,3.0,03,0306,,135 Causeway St,2114.0,Address,354507.0,42.3648,-71.0601,Constituent Call,"(42.3648, -71.0601)",-7910374.1477191,5215782.324194999,-7910374.1477191,5215782.324194999
392148,101001715958,02/12/2016 10:53:47 AM,02/16/2016 10:53:45 AM,02/12/2016 11:22:20 AM,ONTIME,Closed,Case Closed. Closed date : 2016-02-12 11:22:20.82 Case Invalid Clear now.,Parking Enforcement,Transportation - Traffic Division,Enforcement & Abandoned Vehicles,Parking Enforcement,BTDT_Parking Enforcement,BTDT,https://mayors24.cityofboston.gov/media/boston/report/photos/56be000304852e480794d506/report.jpg,,209 Columbus Ave  Boston  MA  02116,4.0,1C,2.0,D4,Back Bay,6.0,Ward 4,0402,C,209 Columbus Ave,2116.0,Address,156406.0,42.3486,-71.0724,Citizens Connect App,"(42.3486, -71.0724)",-7911743.377455857,5213341.9157134555,-7911743.377455857,5213341.9157134555
154033,101001685206,12/30/2015 08:24:17 PM,01/04/2016 08:30:00 AM,12/31/2015 01:02:03 AM,ONTIME,Closed,Case Closed. Closed date : 2015-12-31 01:02:03.63 Case Resolved area checked all clear,Parking Enforcement,Transportation - Traffic Division,Enforcement & Abandoned Vehicles,Parking Enforcement,BTDT_Parking Enforcement,BTDT,,,567-573 Talbot Ave  Dorchester  MA  02124,8.0,07,4.0,C11,Dorchester,8.0,Ward 17,1709,CM,567-573 Talbot Ave,2124.0,Address,133772.0,42.2858,-71.0646,Citizens Connect App,"(42.2858, -71.0646)",-7910875.085427669,5203887.506013222,-7910875.085427669,5203887.506013222
27792,101000712077,11/26/2012 03:58:15 PM,,11/29/2012 09:47:02 PM,ONTIME,Closed,Case Closed Bulk Item Automation,Schedule a Bulk Item Pickup,Public Works Department,Sanitation,Schedule a Bulk Item Pickup,PWDx_Schedule a Bulk Item Pickup,PWDx,,,35 Waumbeck St  Dorchester  MA  02121,9.0,10B,7.0,B2,Roxbury,13.0,Ward 12,1202,A,35 Waumbeck St,2121.0,Address,146389.0,42.3144,-71.0869,Constituent Call,"(42.3144, -71.0869)",-7913357.510072359,5208192.00673295,-7913357.510072359,5208192.00673295
248663,101001627671,11/04/2015 11:27:00 AM,11/10/2015 11:27:00 AM,11/08/2015 11:45:20 AM,ONTIME,Closed,Case Closed. Closed date : 2015-11-08 11:45:20.773 Case Resolved PWD Maint Crew has performed a permenant repair on your section of sidewalk  using cement (Dragon type 1 type 2) on the deteriorated sections of sidewalk. Job is complete.,Sidewalk Repair (Make Safe),Public Works Department,Highway Maintenance,Sidewalk Repair (Make Safe),PWDx_District 06: West Roxbury and Roslindale,PWDx,,https://cityworker.cityofboston.gov:8443/attachments/report/563a325bd052cda8c3972622/closed_photo/Report.jpg,3 Greaton Rd  West Roxbury  MA  02132,9.0,06,6.0,E5,West Roxbury,10.0,Ward 20,2007,R1,3 Greaton Rd,2132.0,Address,66185.0,42.2883,-71.1489,Constituent Call,"(42.2883, -71.1489)",-7920259.318501542,5204263.695592314,-7920259.318501542,5204263.695592314
917833,101001990978,01/18/2017 09:38:00 AM,02/01/2017 09:38:37 AM,02/03/2017 03:13:01 PM,OVERDUE,Closed,Case Closed. Closed date : 2017-02-03 15:13:01.43 Case Resolved repaired neutral conductor at pole. kevin/john,PRINTED : Streetlight out RT,Public Works Department,Street Lights,Street Light Outages,PWDx_Street Light Outages,PWDx,,,45 Magdala St  Dorchester  MA  02124,8.0,07,3.0,C11,Dorchester,7.0,Ward 16,1611,R2,45 Magdala St,2124.0,Address,383005.0,42.2809,-71.0638,Constituent Call,"(42.2809, -71.0638)",-7910786.029835035,5203150.21774014,-7910786.029835035,5203150.21774014
206247,101000966512,11/16/2013 07:04:22 AM,,11/19/2013 03:37:48 PM,ONTIME,Closed,Case Closed Case Invalid No longer needs pick up,Schedule Bulk Item Pickup,Public Works Department,Sanitation,Schedule a Bulk Item Pickup SS,PWDx_Schedule a Bulk Item Pickup,PWDx,,,156 Porter St  East Boston  MA  02128,1.0,09,1.0,A7,East Boston,1.0,Ward 1,0105,CD,156 Porter St,2128.0,Address,112127.0,42.3713,-71.0325,Self Service,"(42.3713, -71.0325)",-7907301.729773205,5216761.677331604,-7907301.729773205,5216761.677331604
585264,101000953793,10/25/2013 09:04:45 AM,11/22/2013 09:04:45 AM,12/03/2013 01:48:32 PM,OVERDUE,Closed,Case Closed Case Resolved cart 513-0046720 delivered,Request for Recycling Cart,Public Works Department,Recycling,Request for Recycling Cart,PWDx_Recycling,PWDx,,,6 Dorset St  Dorchester  MA  02125,6.0,03,2.0,C6,Dorchester,5.0,Ward 7,0708,CM,6 Dorset St,2125.0,Address,49203.0,42.3234,-71.0573,City Worker App,"(42.3234, -71.0573)",-7910062.453144878,5209546.974487156,-7910062.453144878,5209546.974487156
561729,101001636671,11/17/2015 10:11:43 AM,11/18/2015 10:11:43 AM,11/17/2015 10:40:30 AM,ONTIME,Closed,Case Closed. Closed date : 2015-11-17 10:40:30.61 Case Resolved,Request for Pothole Repair,Public Works Department,Highway Maintenance,Request for Pothole Repair,PWDx_District 10B: Roxbury,PWDx,https://cityworker.cityofboston.gov:8443/attachments/report/564b43aed052f4d9aa00ad4b/photo/Report.jpg,,INTERSECTION of Columbus Ave & New Heath St  Roxbury  MA,9.0,10B,7.0,B2,Roxbury,13.0,Ward 11,1101,,INTERSECTION Columbus Ave & New Heath St,,Intersection,3278.0,42.3263,-71.0978,City Worker App,"(42.3263, -71.0978)",-7914570.892522006,5209983.61649646,-7914570.892522006,5209983.61649646
215637,101001954495,11/18/2016 09:29:07 AM,,11/18/2016 09:30:24 AM,ONTIME,Closed,Case Closed. Closed date : 2016-11-18 09:30:24.1 Duplicate of Existing Case 1954498,Schedule a Bulk Item Pickup,Public Works Department,Sanitation,Schedule a Bulk Item Pickup,PWDx_Schedule a Bulk Item Pickup,PWDx,,,77 Victoria Heights Rd  Hyde Park  MA  02136,12.0,08,5.0,E18,Hyde Park,10.0,18,1808,,77 Victoria Heights Rd,2136.0,Address,355150.0,42.2715,-71.113,Constituent Call,"(42.2715, -71.113)",-7916262.948782063,5201735.988471283,-7916262.948782063,5201735.988471283
292606,101001712722,02/09/2016 01:46:00 AM,04/13/2016 08:30:00 AM,02/22/2016 07:05:15 AM,ONTIME,Closed,Case Closed. Closed date : 2016-02-22 07:05:15.373 Case Resolved The graffiti tag at this location has been removed by the City of Boston Property Management Department.   This case number has been resolved and is closed.,Graffiti Removal,Property Management,Graffiti,Graffiti Removal,PROP_GRAF_GraffitiRemoval,PROP,https://mayors24.cityofboston.gov/media/boston/report/photos/56b98b4104854dcc01108b36/photo_20160209_014603.jpg,,INTERSECTION of Sudan St & Dorchester Ave  Dorchester  MA,7.0,03,3.0,C11,Dorchester,7.0,13,1308,,INTERSECTION Sudan St & Dorchester Ave,,Intersection,13130.0,42.3594,-71.0587,Citizens Connect App,"(0, 0)",-7910218.300431989,5214968.784796895,-7910218.300431989,5214968.784796895
801831,101001070048,04/16/2014 08:05:07 PM,04/05/2016 08:05:06 PM,08/13/2014 10:35:41 AM,ONTIME,Closed,Case Closed Case Resolved The New Tree was planted by Leahy Landscaping in the Spring of 2014 and is under Warranty until the Spring of 2016.,New Tree Requests,Parks & Recreation Department,Trees,New Tree Requests,PARK_New Tree Requests,PARK,,,19 Edgemont St  Roslindale  MA  02131,9.0,06,6.0,E5,Roslindale,10.0,Ward 20,2007,R1,19 Edgemont St,2131.0,Address,51155.0,42.2883,-71.1412,Employee Generated,"(42.2883, -71.1412)",-7919402.158422434,5204263.695592314,-7919402.158422434,5204263.695592314
427527,101001894078,08/30/2016 02:20:35 AM,08/31/2016 08:30:00 AM,08/30/2016 03:56:06 AM,ONTIME,Closed,Case Closed. Closed date : 2016-08-30 03:56:06.227 Case Resolved pick up debris,CE Collection,Public Works Department,Street Cleaning,CE Collection,PWDx_District 1A: Charlestown,PWDx,https://cityworker.cityofboston.gov:8443/attachments/report/57c525afd052aa2125627449/photo/Report.jpg,,INTERSECTION of Bunker Hill St & Trenton St  Charlestown  MA,3.0,1A,1.0,A15,Charlestown,2.0,2,0204,,INTERSECTION Bunker Hill St & Trenton St,,Intersection,15841.0,42.3594,-71.0587,City Worker App,"(0, 0)",-7910218.300431989,5214968.784796895,-7910218.300431989,5214968.784796895
97706,101000848307,05/29/2013 08:11:10 AM,,05/30/2013 09:51:31 PM,ONTIME,Closed,Case Closed Bulk Item Automation,Schedule Bulk Item Pickup,Public Works Department,Sanitation,Schedule a Bulk Item Pickup SS,PWDx_Schedule a Bulk Item Pickup,PWDx,,,615 E Third St  South Boston  MA  02127,6.0,05,2.0,C6,South Boston / South Boston Waterfront,5.0,Ward 6,0607,R2,615 E Third St,2127.0,Address,318935.0,42.3364,-71.0351,Self Service,"(42.3364, -71.0351)",-7907591.160449267,5211504.492367354,-7907591.160449267,5211504.492367354
19533,101001857031,07/12/2016 02:54:00 PM,,07/20/2016 04:30:20 PM,ONTIME,Closed,Case Closed. Closed date : 2016-07-20 16:30:20.02 Bulk Item Automation,Schedule a Bulk Item Pickup,Public Works Department,Sanitation,Schedule a Bulk Item Pickup,PWDx_Schedule a Bulk Item Pickup,PWDx,,,23 Grew Hill Rd  Roslindale  MA  02131,12.0,08,5.0,E18,Hyde Park,10.0,Ward 18,1822,R2,23 Grew Hill Rd,2131.0,Address,67171.0,42.2719,-71.1301,Constituent Call,"(42.2719, -71.1301)",-7918166.512074629,5201796.164143264,-7918166.512074629,5201796.164143264
202190,101001929714,10/13/2016 07:24:00 AM,10/14/2016 07:24:55 AM,10/13/2016 08:23:08 AM,ONTIME,Closed,Case Closed. Closed date : 2016-10-13 08:23:08.927 Case Resolved Refaced housing,Traffic Signal Inspection,Transportation - Traffic Division,Signs & Signals,Traffic Signal Inspection,BTDT_Traffic Signal_Repair,BTDT,,,INTERSECTION of Norfolk Ave & Shirley St  Roxbury  MA,7.0,03,3.0,B2,Roxbury,13.0,8,0806,,INTERSECTION Norfolk Ave & Shirley St,,Intersection,18372.0,42.3594,-71.0587,Constituent Call,"(0, 0)",-7910218.300431989,5214968.784796895,-7910218.300431989,5214968.784796895
441810,101001040984,03/05/2014 09:58:48 AM,,03/07/2014 04:34:51 PM,ONTIME,Closed,Case Closed Bulk Item Automation,Schedule a Bulk Item Pickup,Public Works Department,Sanitation,Schedule a Bulk Item Pickup,PWDx_Schedule a Bulk Item Pickup,PWDx,,,14 Monsignor Patrick J Lydon Way  Dorchester  MA  02124,8.0,07,3.0,C11,Dorchester,7.0,16,1606,A,14 Monsignor Patrick J Lydon Way,2124.0,Address,279842.0,42.2883,-71.0631,Constituent Call,"(42.2883, -71.0631)",-7910708.1061914805,5204263.695592314,-7910708.1061914805,5204263.695592314
785000,101001917181,09/24/2016 05:41:00 PM,,09/26/2016 12:41:47 PM,ONTIME,Closed,Case Closed. Closed date : 2016-09-26 12:41:47.957 Case Resolved Hydrant investigated  hydrant ok it is operable 9/24/2016,Fire Hydrant,Boston Water & Sewer Commission,Fire Hydrant,Fire Hydrant,BWSC_All Cases,BWSC,,,INTERSECTION of Avery St & Mason St  Boston  MA,3.0,1C,2.0,A1,Downtown / Financial District,4.0,3,0308,,INTERSECTION Avery St & Mason St,,Intersection,14629.0,42.3594,-71.0587,Constituent Call,"(0, 0)",-7910218.300431989,5214968.784796895,-7910218.300431989,5214968.784796895
486023,101001905029,09/10/2016 11:58:00 AM,09/13/2016 08:30:00 AM,,OVERDUE,Open,,Sidewalk Repair (Make Safe),Public Works Department,Highway Maintenance,Sidewalk Repair (Make Safe),INFO_Mass DCR,INFO,,,INTERSECTION of Perkins St & Jamaicaway  Jamaica Plain  MA,9.0,02,6.0,E13,Jamaica Plain,11.0,19,1903,,INTERSECTION Perkins St & Jamaicaway,,Intersection,17277.0,42.3594,-71.0587,Constituent Call,"(0, 0)",-7910218.300431989,5214968.784796895,-7910218.300431989,5214968.784796895
727149,101001758692,04/01/2016 09:45:00 AM,04/15/2016 09:45:00 AM,04/01/2016 09:47:03 AM,ONTIME,Closed,Case Closed. Closed date : 2016-04-01 09:47:03.547 Case Resolved,Sign Repair,Transportation - Traffic Division,Signs & Signals,Sign Repair,BTDT_Sign Shop_Sign Installation,BTDT,,,INTERSECTION of Milton St & Adams St  Dorchester  MA,8.0,07,3.0,C11,Dorchester,7.0,16,1611,,INTERSECTION Milton St & Adams St,,Intersection,17588.0,42.3594,-71.0587,Employee Generated,"(0, 0)",-7910218.300431989,5214968.784796895,-7910218.300431989,5214968.784796895
357459,101000758511,02/09/2013 07:57:57 PM,02/13/2013 08:30:00 AM,02/20/2013 12:20:27 PM,OVERDUE,Closed,Case Closed Case Noted,Request for Snow Plowing,Public Works Department,Street Cleaning,Request for Snow Plowing,PWDx_District 02: Jamaica Plain,PWDx,,,44 Robinwood Ave  Jamaica Plain  MA  02130,9.0,02,6.0,E13,Jamaica Plain,11.0,Ward 19,1904,R4,44 Robinwood Ave,2130.0,Address,117458.0,42.3164,-71.1114,Constituent Call,"(42.3164, -71.1114)",-7916084.837596795,5208493.093931247,-7916084.837596795,5208493.093931247
697608,101000923545,09/11/2013 08:42:08 AM,09/12/2013 08:42:08 AM,09/11/2013 01:33:06 PM,ONTIME,Closed,Case Closed Case Resolved CASE RESOLVED,Street Light Knock Downs,Public Works Department,Street Lights,Street Light Knock Downs,PWDx_Street Light Knock Downs,PWDx,,,333 Longwood Ave  Boston  MA  02115,4.0,10A,8.0,B2,Fenway / Kenmore / Audubon Circle / Longwood,14.0,Ward 4,0410,C,333 Longwood Ave,2115.0,Address,87177.0,42.3385,-71.1054,Maximo Integration,"(42.3385, -71.1054)",-7915416.920652036,5211820.744754723,-7915416.920652036,5211820.744754723
268,101000907965,08/22/2013 08:48:11 AM,08/26/2013 08:48:11 AM,08/22/2013 08:48:16 AM,ONTIME,Closed,Case Closed Case Resolved Marked completed at case creation,Requests for Street Cleaning,Public Works Department,Street Cleaning,Requests for Street Cleaning,PWDx_District 08: Hyde Park,PWDx,,,54 Meadowview Rd  Hyde Park  MA  02136,12.0,08,5.0,E18,Hyde Park,10.0,Ward 18,1820,R1,54 Meadowview Rd,2136.0,Address,93661.0,42.2321,-71.1296,City Worker App,"(42.2321, -71.1296)",-7918110.852329232,5195810.554915042,-7918110.852329232,5195810.554915042
171582,101001686720,01/04/2016 10:58:00 AM,01/21/2016 10:58:23 AM,02/03/2016 11:10:13 AM,OVERDUE,Closed,Case Closed Case Noted  spoke w vehicle owner--not an abandoned vehicle.,Abandoned Vehicles,Transportation - Traffic Division,Enforcement & Abandoned Vehicles,Abandoned Vehicles,BTDT_AVRS Interface Queue,BTDT,,,159 Ruthven St  Dorchester  MA  02121,9.0,10B,7.0,B2,Roxbury,13.0,Ward 12,1209,R2,159 Ruthven St,2121.0,Address,119990.0,42.3116,-71.0883,Constituent Call,"(42.3116, -71.0883)",-7913513.35735947,5207770.500729313,-7913513.35735947,5207770.500729313
823776,101000382617,02/09/2012 09:36:27 AM,02/08/2013 09:36:25 AM,02/09/2012 09:36:33 AM,ONTIME,Closed,Case Closed Internal Case Performed by Highway Maintenance crew.,Sidewalk Repair (Internal),Public Works Department,Highway Maintenance,Sidewalk Repair (Internal),PWDx_District 06: West Roxbury and Roslindale,PWDx,,,33 Schiller Rd  West Roxbury  MA  02132,12.0,06,6.0,E5,West Roxbury,12.0,Ward 20,2015,R1,33 Schiller Rd,2132.0,Address,123744.0,42.2572,-71.16,Employee Generated,"(42.2572, -71.16)",-7921494.964849347,5199584.959000361,-7921494.964849347,5199584.959000361
621394,101000305515,07/24/2011 02:32:36 PM,07/26/2011 02:32:36 PM,07/25/2011 02:44:50 PM,ONTIME,Closed,Case Closed Case Noted  The site was inspected by the BPRD tree crew.The COB tree at this location is not leaning on the house or in need of pruning. There is a private tree in the rear that is on private property that is leaning though.,Tree Emergencies,Parks & Recreation Department,Trees,Tree Emergencies,PARK_Tree Emergencies,PARK,,,134 Hancock St  Dorchester  MA  02125,7.0,03,3.0,C11,Dorchester,7.0,Ward 13,1306,R3,134 Hancock St,2125.0,Address,68884.0,42.3117,-71.0629,Constituent Call,"(42.3117, -71.0629)",-7910685.84229332,5207785.554192268,-7910685.84229332,5207785.554192268
252393,101001947097,11/07/2016 11:48:23 AM,,11/10/2016 04:31:18 PM,ONTIME,Closed,Case Closed. Closed date : 2016-11-10 16:31:18.93 Bulk Item Automation,Schedule Bulk Item Pickup,Public Works Department,Sanitation,Schedule a Bulk Item Pickup SS,PWDx_Schedule a Bulk Item Pickup,PWDx,,,295 Commonwealth Ave  Boston  MA  02115,4.0,1C,8.0,D4,Back Bay,14.0,Ward 5,0509,CM,295 Commonwealth Ave,2115.0,Address,364822.0,42.3503,-71.0856,Self Service,"(42.3503, -71.0856)",-7913212.794734327,5213597.978419791,-7913212.794734327,5213597.978419791
664021,101001363443,04/24/2015 03:26:33 PM,,04/30/2015 02:24:34 PM,ONTIME,Closed,Case Closed Case Resolved,Ground Maintenance: Mozart St. Playground  Mozart Street Playground,Parks & Recreation Department,Administrative & General Requests,Parks General Request,PARK_Maintenance_Ground Maintenance,PARK,,,10 Mozart St  Jamaica Plain  MA  02130,9.0,10A,6.0,E13,Jamaica Plain,11.0,10,1007.0,E,10 Mozart St,2130.0,Address,341941.0,42.3224,-71.1045,Constituent Call,"(42.3224, -71.1045)",-7915316.733110321,5209396.412943729,-7915316.733110321,5209396.412943729
317101,101001019165,02/05/2014 01:51:06 PM,02/07/2014 01:51:05 PM,02/05/2014 02:10:56 PM,ONTIME,Closed,Case Closed Case Noted The district yard has dispatched a plow to this location as of 2:15 PM on 2/5/2014.,Request for Snow Plowing,Public Works Department,Street Cleaning,Request for Snow Plowing,PWDx_District 07: South Dorchester,PWDx,,,16 Neponset Ave  Dorchester  MA  02122,7.0,07,3.0,C11,Dorchester,7.0,Ward 16,1602,R3,16 Neponset Ave,2122.0,Address,100782.0,42.2969,-71.0554,Constituent Call,"(42.2969, -71.0554)",-7909850.946112372,5205557.901774354,-7909850.946112372,5205557.901774354
110294,101001584952,09/22/2015 09:58:00 AM,09/23/2015 09:58:07 AM,09/22/2015 10:08:44 AM,ONTIME,Closed,Case Closed. Closed date : 2015-09-22 10:08:44.1 Case Noted Nothing out at location at 10:08 a.m. on 9/22/15. We will return on next scheduled trash day.,Missed Trash: District 07,Public Works Department,Sanitation,Missed Trash/Recycling/Yard Waste/Bulk Item,PWDx_Missed Trash\Recycling\Yard Waste\Bulk Item,PWDx,,https://cityworker.cityofboston.gov:8443/attachments/report/56015ea2d052ce85e342e382/closed_photo/Report.jpg,130 Lucerne St  Dorchester  MA  02124,8.0,07,4.0,B3,Greater Mattapan,9.0,14,1412,,130 Lucerne St,2124.0,Address,350626.0,42.285,-71.0889,Constituent Call,"(42.285, -71.0889)",-7913580.149053945,5203767.128500836,-7913580.149053945,5203767.128500836
676698,101001602498,10/01/2015 09:40:00 AM,12/30/2015 09:40:54 AM,,OVERDUE,Open,,Maintenance Complaint - Residential,Inspectional Services,Housing,Maintenance Complaint - Residential,ISD_Housing (INTERNAL),ISD,,,34 Robeson St  Jamaica Plain  MA  02130,9.0,02,6.0,E13,Jamaica Plain,11.0,Ward 11,1107,R3,34 Robeson St,2130.0,Address,117267.0,42.3099,-71.1007,Constituent Call,"(42.3099, -71.1007)",-7914893.719045306,5207514.595518204,-7914893.719045306,5207514.595518204
64278,101001730582,03/05/2016 09:13:00 PM,07/03/2016 09:13:41 PM,03/08/2016 11:46:25 AM,ONTIME,Closed,Case Closed. Closed date : 2016-03-08 11:46:25.7 NOVIO: No Violation Found/No Cause,Pest Infestation - Residential,Inspectional Services,Housing,Pest Infestation - Residential,ISD_Housing (INTERNAL),ISD,,,1518 Columbia Rd  South Boston  MA  02127,6.0,05,2.0,C6,South Boston / South Boston Waterfront,5.0,Ward 7,0702,R3,1518 Columbia Rd,2127.0,Address,35082.0,42.3307,-71.0401,Citizens Connect App,"(42.3307, -71.0401)",-7908147.757903233,5210646.146260614,-7908147.757903233,5210646.146260614
295421,101001306822,02/19/2015 01:22:23 PM,02/20/2015 01:22:23 PM,03/24/2015 12:05:50 PM,OVERDUE,Closed,Case Closed Case Resolved,Empty Litter Basket,Public Works Department,Highway Maintenance,Empty Litter Basket,PWDx_District 10B: Roxbury,PWDx,,,INTERSECTION of Dudley St & Warren St  Roxbury  MA,7.0,10B,7.0,B2,Roxbury,13.0,Ward 8,0804,,INTERSECTION Dudley St & Warren St,,Intersection,4267.0,42.3287,-71.0835,Self Service,"(42.3287, -71.0835)",-7912979.0238036625,5210344.990622886,-7912979.0238036625,5210344.990622886
236580,101001232648,12/13/2014 10:04:15 AM,12/16/2014 08:30:00 AM,12/15/2014 08:06:33 AM,ONTIME,Closed,Case Closed Case Resolved,Traffic Signal Repair,Transportation - Traffic Division,Signs & Signals,Traffic Signal Repair,BTDT_Traffic Signal_Repair,BTDT,,,INTERSECTION of Lomasney Way & Nashua St  Boston  MA,3.0,1B,8.0,A1,Downtown / Financial District,3.0,Ward 3,0305,,INTERSECTION Lomasney Way & Nashua St,,Intersection,6916.0,42.3673,-71.0672,Constituent Call,"(42.3673, -71.0672)",-7911164.5161037315,5216158.986485749,-7911164.5161037315,5216158.986485749
665750,101000322152,08/30/2011 10:34:25 AM,08/29/2012 10:34:25 AM,09/01/2011 01:30:26 PM,ONTIME,Closed,Case Closed Case Noted This is an illegal driveway.  Constituent needs to get a permit for a legal driveway.,Sidewalk Repair,Public Works Department,Highway Maintenance,Sidewalk Repair,PWDx_Sidewalk Repair,PWDx,,,75 Saint Andrew Rd  East Boston  MA  02128,1.0,09,1.0,A7,East Boston,1.0,Ward 1,112.0,R3,75 Saint Andrew Rd,2128.0,Address,120594.0,42.38399999999999,-71.0018,Constituent Call,"(42.384, -71.0018)",-7903884.221405852,5218675.475200378,-7903884.221405852,5218675.475200378
715128,101000378779,01/30/2012 07:09:15 AM,02/29/2012 07:09:15 AM,02/13/2012 10:02:10 AM,ONTIME,Closed,Case Closed NOVIO: No Violation Found/No Cause,Rodent Activity,Inspectional Services,Environmental Services,Rodent Activity,ISD_Environmental Services (INTERNAL),ISD,,,67-73 Harvard Ave  Allston  MA  02134,11.0,04,9.0,D14,Allston / Brighton,15.0,21,2104,A,67-73 Harvard Ave,2134.0,Address,70394.0,42.3539,-71.1325,Constituent Call,"(42.3539, -71.1325)",-7918433.678852531,5214140.2517188825,-7918433.678852531,5214140.2517188825
580844,101000463036,08/10/2012 01:15:39 PM,08/14/2012 01:15:33 PM,08/10/2012 01:17:28 PM,ONTIME,Closed,Case Closed Case Invalid,Missed Trash/Recycling/Yard Waste/Bulk Item,Public Works Department,Sanitation,Missed Trash/Recycling/Yard Waste/Bulk Item,PWDx_Missed Trash\Recycling\Yard Waste\Bulk Item,PWDx,,,,,,,,,,,,,,,,,42.3594,-71.0587,Employee Generated,"(0, 0)",-7910218.300431989,5214968.784796895,-7910218.300431989,5214968.784796895
913093,101001997596,01/27/2017 07:28:10 AM,,01/27/2017 09:35:16 AM,ONTIME,Closed,Case Closed. Closed date : 2017-01-27 09:35:16.72 Case Resolved Reported to this location and found two syringes.,Needle Pickup,Mayor's 24 Hour Hotline,Needle Program,Needle Pickup,GEN_Needle_Pickup,GEN_,https://mayors24.cityofboston.gov/media/boston/report/photos/588b3cd604856990cd1adcb5/report.jpg,,10 Saint George St  Roxbury  MA  02118,4.0,1C,3.0,D4,Roxbury,6.0,08,0802,,10 Saint George St,2118.0,Address,157530.0,42.3384,-71.072,Citizens Connect App,"(42.3384, -71.072)",-7911698.849659539,5211805.684877746,-7911698.849659539,5211805.684877746
293223,101000442120,06/27/2012 11:25:44 AM,,06/27/2012 11:25:44 AM,ONTIME,Closed,Case Closed Internal Case Performed by Highway Maintenance crew.,Pothole Repair (Internal),Public Works Department,Highway Maintenance,Pothole Repair (Internal),PWDx_District 10B: Roxbury,PWDx,,,10-75 Ritchie St  Roxbury  MA  02119,9.0,10B,7.0,B2,Roxbury,13.0,11,1102,A,10-75 Ritchie St,2119.0,Address,116141.0,42.3218,-71.096,Employee Generated,"(42.3218, -71.096)",-7914370.5174385775,5209306.077166308,-7914370.5174385775,5209306.077166308
598404,101000794533,03/02/2013 06:13:18 AM,03/06/2013 08:30:00 AM,03/04/2013 02:52:10 PM,ONTIME,Closed,Case Closed Case Resolved pothole patched,Request for Pothole Repair,Public Works Department,Highway Maintenance,Request for Pothole Repair,PWDx_District 10A: Roxbury,PWDx,,,56 Queensberry St  Boston  MA  02215,4.0,10A,8.0,D4,Fenway / Kenmore / Audubon Circle / Longwood,14.0,Ward 5,0502,CD,56 Queensberry St,2215.0,Address,113795.0,42.3425,-71.0975,Citizens Connect App,"(42.3425, -71.0975)",-7914537.496674767,5212423.159473596,-7914537.496674767,5212423.159473596
518478,101000317672,08/23/2011 08:43:48 AM,08/25/2011 08:43:45 AM,08/23/2011 08:45:15 AM,ONTIME,Closed,Case Closed Case Scheduled Items have been scheduled for pickup.,Schedule a Bulk Item Pickup,Public Works Department,Sanitation,Schedule a Bulk Item Pickup,PWDx_Schedule a Bulk Item Pickup,PWDx,,,544 Massachusetts Ave  Roxbury  MA  02118,4.0,1C,7.0,D4,South End,6.0,Ward 9,0902,A,544 Massachusetts Ave,2118.0,Address,92362.0,42.3386,-71.0787,Employee Generated,"(42.3386, -71.0787)",-7912444.690247853,5211835.80465565,-7912444.690247853,5211835.80465565
844263,101000950665,10/21/2013 02:55:28 PM,,10/23/2013 09:50:53 PM,ONTIME,Closed,Case Closed Bulk Item Automation,Schedule a Bulk Item Pickup,Public Works Department,Sanitation,Schedule a Bulk Item Pickup,PWDx_Schedule a Bulk Item Pickup,PWDx,,,70-72 Mount Vernon St  Boston  MA  02108,3.0,1B,8.0,A1,Beacon Hill,14.0,Ward 5,0503,CM,70-72 Mount Vernon St,2108.0,Address,98679.0,42.358000000000004,-71.0677,Constituent Call,"(42.358, -71.0677)",-7911220.175849129,5214757.878587972,-7911220.175849129,5214757.878587972
540233,101000804025,03/14/2013 10:50:50 AM,,03/20/2013 09:43:51 PM,ONTIME,Closed,Case Closed Bulk Item Automation,Schedule a Bulk Item Pickup,Public Works Department,Sanitation,Schedule a Bulk Item Pickup,PWDx_Schedule a Bulk Item Pickup,PWDx,,,221 Everett St  East Boston  MA  02128,1.0,09,1.0,A7,East Boston,1.0,Ward 1,0101,R3,221 Everett St,2128.0,Address,55095.0,42.3656,-71.0308,Constituent Call,"(42.3656, -71.0308)",-7907112.486638857,5215902.854497209,-7907112.486638857,5215902.854497209
120236,101000483956,09/25/2012 09:23:28 AM,09/27/2012 09:23:28 AM,09/25/2012 11:53:55 AM,ONTIME,Closed,Case Closed Case Resolved Delivered on 9/25 by MB.,Sticker Request,Public Works Department,Recycling,Sticker Request,PWDx_Sticker Request,PWDx,,,0 W First St  South Boston  MA  02127,6.0,05,2.0,C6,South Boston / South Boston Waterfront,5.0,Ward 6,0601,CL,0 W First St,2127.0,Address,58435.0,42.3594,-71.0587,Constituent Call,"(0, 0)",-7910218.300431989,5214968.784796895,-7910218.300431989,5214968.784796895
723452,101000900214,08/13/2013 08:57:51 AM,08/15/2013 08:57:51 AM,08/13/2013 08:57:52 AM,ONTIME,Closed,Case Closed Case Resolved Marked completed at case creation,Requests for Street Cleaning,Public Works Department,Street Cleaning,Requests for Street Cleaning,PWDx_District 08: Hyde Park,PWDx,,,124 Dale St  Roslindale  MA  02131,12.0,08,5.0,E18,Hyde Park,10.0,Ward 18,1809,R1,124 Dale St,2131.0,Address,45669.0,42.2715,-71.1232,City Worker App,"(42.2715, -71.1232)",-7917398.407588154,5201735.988471283,-7917398.407588154,5201735.988471283
186673,101001729176,03/03/2016 10:48:00 AM,03/17/2016 10:48:00 AM,03/03/2016 10:50:20 AM,ONTIME,Closed,Case Closed. Closed date : 2016-03-03 10:50:20.697 Case Resolved,Sign Repair,Transportation - Traffic Division,Signs & Signals,Sign Repair,BTDT_Sign Shop_Sign Installation,BTDT,,,INTERSECTION of Old Colony Ave & C St  South Boston  MA,6.0,05,2.0,C6,South Boston / South Boston Waterfront,5.0,7,0705,,INTERSECTION Old Colony Ave & C St,,Intersection,14329.0,42.3594,-71.0587,Employee Generated,"(0, 0)",-7910218.300431989,5214968.784796895,-7910218.300431989,5214968.784796895
363668,101000370398,01/04/2012 10:14:31 AM,01/05/2012 10:14:30 AM,01/04/2012 01:58:54 PM,ONTIME,Closed,Case Closed Duplicate of Existing Case CRM # 370415,Major System Failure,Public Works Department,Street Lights,Major System Failure,PWDx_Major System Failure,PWDx,,,INTERSECTION of Gloucester St & Newbury St  Boston  MA,4.0,1C,8.0,D4,Back Bay,14.0,Ward 5,0509,,INTERSECTION Gloucester St & Newbury St,,Intersection,5369.0,42.3492,-71.0841,Constituent Call,"(42.3492, -71.0841)",-7913045.815498139,5213432.289995516,-7913045.815498139,5213432.289995516
211586,101001250025,01/20/2015 09:13:21 AM,01/22/2015 09:13:21 AM,01/20/2015 03:03:20 PM,ONTIME,Closed,Case Closed Case Resolved Location has been made safe. This sidewalk will be referred for permanent repair. See case #101001250553 for status of the permanent repair.,Sidewalk Repair (Make Safe),Public Works Department,Highway Maintenance,Sidewalk Repair (Make Safe),PWDx_District 09: East Boston,PWDx,,,2 Horace St  East Boston  MA  02128,1.0,09,1.0,A7,East Boston,1.0,Ward 1,0111,R3,2 Horace St,2128.0,Address,75323.0,42.3814,-71.0201,Constituent Call,"(42.3814, -71.0201)",-7905921.368087368,5218283.642551604,-7905921.368087368,5218283.642551604
405111,101001272491,02/03/2015 10:12:29 PM,02/06/2015 08:30:00 AM,02/12/2015 05:43:25 PM,OVERDUE,Closed,Case Closed Case Noted Snow has been removed.,Request for Snow Plowing,Public Works Department,Street Cleaning,Request for Snow Plowing,PWDx_District 09: East Boston,PWDx,,,126 Coleridge St  East Boston  MA  02128,1.0,09,1.0,A7,East Boston,1.0,Ward 1,0111,R1,126 Coleridge St,2128.0,Address,34720.0,42.3808,-71.0153,Self Service,"(42.3808, -71.0153)",-7905387.034531561,5218193.221936902,-7905387.034531561,5218193.221936902
504597,101001123699,07/08/2014 10:59:35 AM,07/22/2014 10:59:34 AM,07/15/2014 07:19:48 AM,ONTIME,Closed,Case Closed Case Resolved Work completed 7/11/14.,Sign Repair,Transportation - Traffic Division,Signs & Signals,Sign Repair,BTDT_Sign Shop_Sign Installation,BTDT,,,INTERSECTION of Dent St & Sherbrook St  West Roxbury  MA,12.0,06,6.0,E5,West Roxbury,12.0,Ward 20,2012,,INTERSECTION Dent St & Sherbrook St,,Intersection,4030.0,42.2843,-71.1645,Constituent Call,"(42.2843, -71.1645)",-7921995.902557918,5203661.79943142,-7921995.902557918,5203661.79943142
207838,101001921774,10/01/2016 07:09:29 AM,10/04/2016 08:30:00 AM,10/01/2016 09:28:43 AM,ONTIME,Closed,Case Closed. Closed date : 2016-10-01 09:28:43.977 Case Noted vehicle tagged,Parking Enforcement,Transportation - Traffic Division,Enforcement & Abandoned Vehicles,Parking Enforcement,BTDT_Parking Enforcement,BTDT,https://mayors24.cityofboston.gov/media/boston/report/photos/57ef99656963a1cc488bc1a1/report.jpg,,90 O St  South Boston  MA  02127,6.0,05,2.0,C6,South Boston / South Boston Waterfront,5.0,Ward 6,0609,R1,90 O St,2127.0,Address,104465.0,42.3351,-71.029,Citizens Connect App,"(42.3351, -71.029)",-7906912.111555428,5211308.722372242,-7906912.111555428,5211308.722372242
660200,101000394974,03/14/2012 02:43:54 PM,07/12/2012 02:43:54 PM,03/14/2012 02:44:34 PM,ONTIME,Closed,Case Closed :,Unsatisfactory Living Conditions,Inspectional Services,Housing,Unsatisfactory Living Conditions,ISD_Housing (INTERNAL),ISD,,,21 Wildwood St  Dorchester  MA  02124,8.0,07,4.0,B3,Greater Mattapan,9.0,Ward 14,1405.0,R3,21 Wildwood St,2124.0,Address,149725.0,42.2838,-71.0875,Constituent Call,"(42.2838, -71.0875)",-7913424.301766835,5203586.565098337,-7913424.301766835,5203586.565098337
644502,101001720401,02/19/2016 10:56:00 AM,02/22/2016 10:56:04 AM,02/19/2016 12:04:36 PM,ONTIME,Closed,Case Closed. Closed date : 2016-02-19 12:04:36.827 Case Noted no violation trash had been picked up. Spoke with Richie he will monitor for next trash day,Illegal Dumping,Public Works Department,Code Enforcement,Illegal Dumping,PWDx_Code Enforcement,PWDx,,https://cityworker.cityofboston.gov:8443/attachments/report/56c73b52d0528f73f527f1e8/closed_photo/Report.jpg,11 Thacher Ct  Boston  MA  02113,3.0,1B,1.0,A1,Downtown / Financial District,3.0,Ward 3,0304,R2,11 Thacher Ct,2113.0,Address,134536.0,42.3657,-71.0578,Constituent Call,"(42.3657, -71.0578)",-7910118.112890274,5215917.920892905,-7910118.112890274,5215917.920892905
885910,101001043689,03/10/2014 08:39:55 AM,03/24/2014 08:39:55 AM,,OVERDUE,Open,,Other: Comment,Mayor's 24 Hour Hotline,Employee & General Comments,General Comments For a Program or Policy,INFO_General Comments Complaints Compliments,INFO,,,,,,,,,,,,,,,,,42.3594,-71.0587,Constituent Call,"(0, 0)",-7910218.300431989,5214968.784796895,-7910218.300431989,5214968.784796895
485860,101001405942,06/09/2015 02:48:00 PM,06/10/2015 02:48:15 PM,06/10/2015 08:00:02 AM,ONTIME,Closed,Case Closed. Closed date : 2015-06-10 08:00:02.9 Case Resolved Case resolved. Trash collected 6/9. A large branch left behind.,Missed Trash: District 02,Public Works Department,Sanitation,Missed Trash/Recycling/Yard Waste/Bulk Item,PWDx_Missed Trash\Recycling\Yard Waste\Bulk Item,PWDx,,,416 S Huntington Ave  Jamaica Plain  MA  02130,9.0,02,6.0,E13,Jamaica Plain,11.0,Ward 19,1903,R3,416 S Huntington Ave,2130.0,Address,76794.0,42.3205,-71.1116,Constituent Call,"(42.3205, -71.1116)",-7916107.101494952,5209110.3526037475,-7916107.101494952,5209110.3526037475
59600,101001702860,01/27/2016 09:42:33 AM,01/28/2016 09:42:33 AM,01/27/2016 01:32:42 PM,ONTIME,Closed,Case Closed. Closed date : 2016-01-27 13:32:42.197 Case Resolved tv picked up,Requests for Street Cleaning,Public Works Department,Street Cleaning,Requests for Street Cleaning,PWDx_District 07: South Dorchester,PWDx,https://cityworker.cityofboston.gov:8443/attachments/report/56a8d759d052af2717aded54/photo/Report.jpg,https://cityworker.cityofboston.gov:8443/attachments/report/56a8d759d052af2717aded54/closed_photo/Report.jpg,1220 Blue Hill Ave  Mattapan  MA  02126,8.0,07,4.0,B3,Greater Mattapan,9.0,Ward 14,1405,CM,1220 Blue Hill Ave,2126.0,Address,16198.0,42.2826,-71.0916,City Worker App,"(42.2826, -71.0916)",-7913880.711679087,5203406.005134944,-7913880.711679087,5203406.005134944
352396,101001402380,06/04/2015 10:43:00 AM,06/09/2015 10:43:05 AM,06/17/2015 08:41:09 AM,OVERDUE,Closed,Case Closed. Closed date : 2015-06-17 08:41:09.293 NOBASE: No Basis,Building Inspection Request,Inspectional Services,Building,Building Inspection Request,ISD_Building (INTERNAL),ISD,,,753 South St  Roslindale  MA  02131,9.0,02,5.0,E5,Roslindale,10.0,Ward 20,2002,C,753 South St,2131.0,Address,155983.0,42.2872,-71.1292,Constituent Call,"(42.2872, -71.1292)",-7918066.324532914,5204098.170338239,-7918066.324532914,5204098.170338239
917624,101002001589,02/02/2017 10:45:44 AM,02/03/2017 10:45:44 AM,02/02/2017 10:47:59 AM,ONTIME,Closed,Case Closed. Closed date : 2017-02-02 10:47:59.617 Case Resolved Pothole filled,Request for Pothole Repair,Public Works Department,Highway Maintenance,Request for Pothole Repair,PWDx_District 04: Allston/Brighton,PWDx,https://cityworker.cityofboston.gov:8443/attachments/report/58935423d05264983c8abc13/photo/Report.jpg,https://cityworker.cityofboston.gov:8443/attachments/report/58935423d05264983c8abc13/closed_photo/Report.jpg,INTERSECTION of Hichborn St & Dustin St  Allston  MA,11.0,04,8.0,D14,Allston / Brighton,15.0,21,2106,,INTERSECTION Hichborn St & Dustin St,,Intersection,11164.0,42.3594,-71.0587,City Worker App,"(0, 0)",-7910218.300431989,5214968.784796895,-7910218.300431989,5214968.784796895
667806,101001082669,05/06/2014 08:53:43 AM,05/08/2014 08:53:43 AM,05/06/2014 11:42:50 AM,ONTIME,Closed,Case Closed Case Resolved,Requests for Street Cleaning,Public Works Department,Street Cleaning,Requests for Street Cleaning,PWDx_District 03: North Dorchester,PWDx,,,88 Blue Hill Ave  Roxbury  MA  02119,7.0,03,7.0,B2,Roxbury,13.0,Ward 8,807.0,R3,88 Blue Hill Ave,2119.0,Address,190261.0,42.3221,-71.077,City Worker App,"(42.3221, -71.077)",-7912255.447113506,5209351.244947336,-7912255.447113506,5209351.244947336
937146,101002022816,02/23/2017 07:09:24 AM,02/28/2017 08:30:00 AM,02/23/2017 09:18:31 AM,ONTIME,Closed,Case Closed. Closed date : 2017-02-23 09:18:31.133 Case Resolved cited,Poor Conditions of Property,Public Works Department,Code Enforcement,Poor Conditions of Property,PWDx_Code Enforcement,PWDx,https://mayors24.cityofboston.gov/media/boston/report/photos/58aed0ee0485bf1c66168fd1/report.jpg,,10 Hendry St  Dorchester  MA  02125,7.0,03,3.0,C11,Dorchester,8.0,Ward 15,1504,R3,10 Hendry St,2125.0,Address,72881.0,42.309,-71.0649,Citizens Connect App,"(42.309, -71.0649)",-7910908.481274907,5207379.1190868225,-7910908.481274907,5207379.1190868225
367359,101001301059,02/17/2015 11:59:48 AM,02/19/2015 11:59:48 AM,02/25/2015 09:30:02 AM,OVERDUE,Closed,Case Closed Case Resolved plowed sanded,Request for Snow Plowing,Public Works Department,Street Cleaning,Request for Snow Plowing,PWDx_District 03: North Dorchester,PWDx,,,19 Dromey St  Dorchester  MA  02125,7.0,03,7.0,B2,Roxbury,13.0,Ward 13,1301,R3,19 Dromey St,2125.0,Address,49562.0,42.3187,-71.0753,Constituent Call,"(42.3187, -71.0753)",-7912066.203979157,5208839.35603896,-7912066.203979157,5208839.35603896
83977,101000357341,11/26/2011 07:42:02 AM,11/30/2011 07:41:59 AM,11/26/2011 10:55:05 AM,ONTIME,Closed,Case Closed Case Resolved  PICKED UP   AM,Missed Trash: District 02,Public Works Department,Sanitation,Missed Trash/Recycling/Yard Waste/Bulk Item,PWDx_Missed Trash\Recycling\Yard Waste\Bulk Item,PWDx,,,25 Danforth St  Jamaica Plain  MA  02130,9.0,02,6.0,E13,Jamaica Plain,11.0,Ward 19,1901,CD,25 Danforth St,2130.0,Address,46106.0,42.3184,-71.105,Self Service,"(42.3184, -71.105)",-7915372.392855718,5208794.1906984905,-7915372.392855718,5208794.1906984905
300561,101001397944,05/29/2015 10:17:55 AM,05/28/2016 10:17:55 AM,05/29/2015 10:17:57 AM,ONTIME,Closed,Case Closed. Closed date : 2015-05-29 10:17:57.59 Internal Case Performed by Highway Maintenance crew.,Sidewalk Repair (Internal),Public Works Department,Highway Maintenance,Sidewalk Repair (Internal),PWDx_District 09: East Boston,PWDx,,,87 Ashley St  East Boston  MA  02128,1.0,09,1.0,A7,East Boston,1.0,Ward 1,0113,R2,87 Ashley St,2128.0,Address,5277.0,42.3886,-71.0085,Employee Generated,"(42.3886, -71.0085)",-7904630.061994166,5219368.757332506,-7904630.061994166,5219368.757332506
700231,101000984082,12/16/2013 03:55:10 PM,12/18/2013 03:55:10 PM,12/17/2013 07:10:03 AM,ONTIME,Closed,Case Closed Case Resolved,Request for Snow Plowing,Public Works Department,Street Cleaning,Request for Snow Plowing,PWDx_District 03: North Dorchester,PWDx,,,71 Woodcliff St  Dorchester  MA  02125,7.0,03,7.0,B2,Roxbury,13.0,Ward 13,1304,R1,71 Woodcliff St,2125.0,Address,151486.0,42.3154,-71.075,Constituent Call,"(42.3154, -71.075)",-7912032.808131919,5208342.549136039,-7912032.808131919,5208342.549136039
241943,101001413680,06/19/2015 07:16:00 PM,06/18/2016 07:16:08 PM,07/27/2015 12:49:56 PM,ONTIME,Closed,Case Closed. Closed date : 2015-07-27 12:49:56.31 Case Noted The tree in question meets the city of Boston tree planting specifications. The tree is planted in front of 31 not 35. the site was dig Safe prior to planting and was not flagged as to be a hazard for digging. The sidewalk is ADA compliant and the tree will not be removed,Tree Maintenance Requests,Parks & Recreation Department,Trees,Tree Maintenance Requests,PARK_Tree Maintenance Request,PARK,,,35 Lorraine St  Roslindale  MA  02131,12.0,06,5.0,E5,Roslindale,10.0,Ward 20,2008,R1,35 Lorraine St,2131.0,Address,87459.0,42.2839,-71.1449,Self Service,"(42.2839, -71.1449)",-7919814.040538371,5203601.611917187,-7919814.040538371,5203601.611917187
838320,101001165287,09/05/2014 10:40:45 AM,09/19/2014 10:40:44 AM,09/05/2014 11:44:26 AM,ONTIME,Closed,Case Closed Case Noted,PublicWorks: Complaint,Mayor's 24 Hour Hotline,Employee & General Comments,General Comments For a Program or Policy,PWDx_General Comments,PWDx,,,,,,,,,,,,,,,,,42.3594,-71.0587,Constituent Call,"(0, 0)",-7910218.300431989,5214968.784796895,-7910218.300431989,5214968.784796895
4429,101001772241,04/20/2016 10:06:00 AM,04/21/2016 10:06:53 AM,04/21/2016 05:18:14 PM,OVERDUE,Closed,Case Closed. Closed date : 2016-04-21 17:18:14.963 VIOISS: Violation Filed,Unsafe/Dangerous Conditions,Inspectional Services,Building,Unsafe Dangerous Conditions,ISD_Building (INTERNAL),ISD,,,554 Massachusetts Ave  Roxbury  MA  02118,4.0,1C,7.0,D4,South End,6.0,Ward 9,0902,E,554 Massachusetts Ave,2118.0,Address,92384.0,42.3383,-71.0784,Constituent Call,"(42.3383, -71.0784)",-7912411.294400617,5211790.6250247145,-7912411.294400617,5211790.6250247145
499710,101001398367,05/29/2015 03:49:56 PM,06/01/2015 03:49:56 PM,05/29/2015 03:55:18 PM,ONTIME,Closed,Case Closed. Closed date : 2015-05-29 15:55:18.143 Case Noted Yardwaste truck still working south dorchester. Please leave material out for collection. Contractor is aware of street.,Missed Leaf or Yard Trash: District 03,Public Works Department,Sanitation,Missed Trash/Recycling/Yard Waste/Bulk Item,PWDx_Missed Trash\Recycling\Yard Waste\Bulk Item,PWDx,,,14-16 Jerome St  Dorchester  MA  02125,7.0,03,7.0,C11,Dorchester,13.0,Ward 13,1305,R3,14-16 Jerome St,2125.0,Address,79638.0,42.3149,-71.0641,Self Service,"(42.3149, -71.0641)",-7910819.425682272,5208267.277635488,-7910819.425682272,5208267.277635488
433612,101001600152,09/28/2015 09:42:00 PM,10/14/2015 08:30:00 AM,09/29/2015 06:05:09 AM,ONTIME,Closed,Case Closed. Closed date : 2015-09-29 06:05:09.557 Case Resolved Replaced LED,outage////printed,Public Works Department,Street Lights,Street Light Outages,PWDx_Street Light Outages,PWDx,,,41 Yawkey Way  Boston  MA  02215,4.0,10A,8.0,D4,Boston,14.0,05,,,41 Yawkey Way,2215.0,Address,352364.0,42.3455,-71.0987,Citizens Connect App,"(42.3455, -71.0987)",-7914671.080063718,5212874.9956642445,-7914671.080063718,5212874.9956642445
298081,101001439189,07/29/2015 09:57:11 AM,07/30/2015 09:57:11 AM,07/29/2015 12:03:21 PM,ONTIME,Closed,Case Closed. Closed date : 2015-07-29 12:03:21.023 Case Resolved removed tv.,Requests for Street Cleaning,Public Works Department,Street Cleaning,Requests for Street Cleaning,PWDx_District 10B: Roxbury,PWDx,https://cityworker.cityofboston.gov:8443/attachments/report/55b8dbd5d05214099915a517/photo/Report.jpg,https://cityworker.cityofboston.gov:8443/attachments/report/55b8dbd5d05214099915a517/closed_photo/Report.jpg,7-9 Wardman Rd  Roxbury  MA  02119,9.0,10B,7.0,E13,Roxbury,13.0,Ward 11,1103,A,7-9 Wardman Rd,2119.0,Address,142734.0,42.3156,-71.0949,City Worker App,"(42.3156, -71.0949)",-7914248.065998704,5208372.6579037085,-7914248.065998704,5208372.6579037085
547138,101001012069,01/25/2014 01:42:36 PM,01/28/2014 08:30:00 AM,01/25/2014 05:23:21 PM,ONTIME,Closed,Case Closed Case Resolved pick up,Empty Litter Basket,Public Works Department,Highway Maintenance,Empty Litter Basket,PWDx_District 02: Jamaica Plain,PWDx,,,282-294 Hyde Park Ave  Jamaica Plain  MA  02130,12.0,02,6.0,E13,Jamaica Plain,10.0,Ward 19,1907,C,282-294 Hyde Park Ave,2130.0,Address,77292.0,42.2918,-71.1176,Constituent Call,"(42.2918, -71.1176)",-7916775.018439711,5204790.38608603,-7916775.018439711,5204790.38608603
422681,101001341416,03/25/2015 09:52:28 AM,04/08/2015 09:52:28 AM,03/26/2015 07:42:18 AM,ONTIME,Closed,Case Closed Duplicate of Existing Case Duplicate CRM,Sign Repair,Transportation - Traffic Division,Signs & Signals,Sign Repair,BTDT_District 01,BTDT,,,INTERSECTION of S Waverly St & School St  Brighton  MA,11.0,04,9.0,D14,Allston / Brighton,15.0,Ward 22,2205,,INTERSECTION S Waverly St & School St,,Intersection,6151.0,42.36,-71.1419,Self Service,"(42.36, -71.1419)",-7919480.08206599,5215059.174610621,-7919480.08206599,5215059.174610621
709420,101001009446,01/21/2014 10:10:23 AM,01/23/2014 10:10:23 AM,01/21/2014 10:29:03 AM,ONTIME,Closed,Case Closed Case Resolved patched,Request for Pothole Repair,Public Works Department,Highway Maintenance,Request for Pothole Repair,PWDx_District 06: West Roxbury and Roslindale,PWDx,,,929 Lagrange St  West Roxbury  MA  02132,12.0,06,6.0,E5,West Roxbury,12.0,20,2017,CD,929 Lagrange St,2132.0,Address,82940.0,42.3594,-71.0587,City Worker App,"(0, 0)",-7910218.300431989,5214968.784796895,-7910218.300431989,5214968.784796895
324650,101001892872,08/28/2016 10:38:43 PM,08/31/2016 08:30:00 AM,08/29/2016 03:27:23 AM,ONTIME,Closed,Case Closed. Closed date : 2016-08-29 03:27:23.753 Case Resolved Your case has been inspected by Code Enforcement and sent to Public Works Highway for collection of materials. Please refer to new case number #101001892903.,Improper Storage of Trash (Barrels),Public Works Department,Code Enforcement,Improper Storage of Trash (Barrels),PWDx_Code Enforcement,PWDx,,https://cityworker.cityofboston.gov:8443/attachments/report/57c3a079d052c054f29f0fa0/closed_photo/Report.jpg,69-81 Kilmarnock St  Boston  MA  02215,4.0,10A,8.0,D4,Fenway / Kenmore / Audubon Circle / Longwood,14.0,Ward 21,2101,C,69-81 Kilmarnock St,2215.0,Address,81581.0,42.3426,-71.0995,Citizens Connect App,"(42.3426, -71.0995)",-7914760.135656356,5212438.2203325955,-7914760.135656356,5212438.2203325955
116965,101001133530,07/21/2014 12:02:13 PM,07/23/2014 12:01:26 PM,08/06/2014 09:24:39 AM,OVERDUE,Closed,Case Closed ADCLSD: Administratively Closed,Work w/out Permit,Inspectional Services,Building,Work w/out Permit,ISD_Building (INTERNAL),ISD,,,213 Commonwealth Ave  Boston  MA  02116,4.0,1C,8.0,D4,Back Bay,14.0,Ward 5,0508,A,213 Commonwealth Ave,2116.0,Address,39648.0,42.3514,-71.0815,Constituent Call,"(42.3514, -71.0815)",-7912756.384822076,5213763.669743681,-7912756.384822076,5213763.669743681
925163,101002010616,02/13/2017 05:11:19 AM,02/15/2017 08:30:00 AM,02/13/2017 04:27:23 PM,ONTIME,Closed,Case Closed. Closed date : 2017-02-13 16:27:23.01 Case Resolved Completed,Request for Snow Plowing,Public Works Department,Street Cleaning,Request for Snow Plowing,PWDx_District 1B: North End,PWDx,,https://cityworker.cityofboston.gov:8443/attachments/report/58a1868dd052e81b93e5535e/closed_photo/Report.jpg,50 Battery St  Boston  MA  02109,3.0,1B,1.0,A1,Boston,3.0,03,0302,CD,50 Battery St,2109.0,Address,8765.0,42.3666,-71.0498,Citizens Connect App,"(42.3666, -71.0498)",-7909227.556963929,5216053.519533397,-7909227.556963929,5216053.519533397
811501,101001927855,10/11/2016 08:19:00 AM,10/25/2016 08:30:00 AM,10/11/2016 08:22:37 AM,ONTIME,Closed,Case Closed. Closed date : 2016-10-11 08:22:37.667 Case Resolved replaced 4 top glass 3 sides 1 door glass 3 mantles,Street Light Outages,Public Works Department,Street Lights,Street Light Outages,PWDx_Street Light Outages,PWDx,,,45 Chestnut St  Boston  MA  02108,3.0,1B,8.0,A1,Beacon Hill,14.0,Ward 5,0503,R1,45 Chestnut St,2108.0,Address,31427.0,42.3574,-71.0686,Employee Generated,"(42.3574, -71.0686)",-7911320.363390842,5214667.491651126,-7911320.363390842,5214667.491651126
472852,101001760068,04/03/2016 07:06:57 PM,04/05/2016 08:30:00 AM,04/03/2016 10:53:33 PM,ONTIME,Closed,Case Closed. Closed date : 2016-04-03 22:53:33.757 Case Resolved area checked vehicle not at location,Parking Enforcement,Transportation - Traffic Division,Enforcement & Abandoned Vehicles,Parking Enforcement,BTDT_Parking Enforcement,BTDT,,,94 Appleton St  Boston  MA  02116,4.0,1C,2.0,D4,South End,6.0,Ward 4,0401,R4,94 Appleton St,2116.0,Address,4195.0,42.3453,-71.0736,Citizens Connect App,"(42.3453, -71.0736)",-7911876.960844809,5212844.872580751,-7911876.960844809,5212844.872580751
674335,101000465204,08/15/2012 02:22:15 PM,12/13/2012 02:22:14 PM,12/10/2012 09:12:32 AM,ONTIME,Closed,Case Closed VIOCOR: Violation Corrected,Unsatisfactory Living Conditions,Inspectional Services,Housing,Unsatisfactory Living Conditions,ISD_Housing (INTERNAL),ISD,,,15 Mclellan St  Dorchester  MA  02121,7.0,03,4.0,B3,Greater Mattapan,8.0,Ward 14,1407,R3,15 Mclellan St,2121.0,Address,273424.0,42.3006,-71.0852,Constituent Call,"(42.3006, -71.0852)",-7913168.266938011,5206114.765787599,-7913168.266938011,5206114.765787599
645814,101000931032,09/20/2013 11:11:54 AM,,09/20/2013 11:11:54 AM,ONTIME,Closed,Case Closed Internal Case Performed by Highway Maintenance crew.,Pothole Repair (Internal),Public Works Department,Highway Maintenance,Pothole Repair (Internal),PWDx_District 02: Jamaica Plain,PWDx,,,4113 Washington St  Roslindale  MA  02131,12.0,02,5.0,E5,Roslindale,10.0,Ward 19,1911,R3,4113 Washington St,2131.0,Address,145124.0,42.2897,-71.125,Employee Generated,"(42.2897, -71.125)",-7917598.782671583,5204474.36827795,-7917598.782671583,5204474.36827795
264853,101001768327,04/14/2016 10:25:42 AM,04/15/2016 10:25:42 AM,04/14/2016 12:19:01 PM,ONTIME,Closed,Case Closed. Closed date : 2016-04-14 12:19:01.187 Case Invalid One vehicle ticketed.,Parking Enforcement,Transportation - Traffic Division,Enforcement & Abandoned Vehicles,Parking Enforcement,BTDT_Parking Enforcement,BTDT,https://mayors24.cityofboston.gov/media/boston/report/photos/570fa86104857580849fad1c/report.jpg,,35 Hefferan St  Allston  MA  02134,11.0,04,9.0,D14,Allston / Brighton,15.0,Ward 22,2201,EA,35 Hefferan St,2134.0,Address,250237.0,42.3637,-71.1273,Citizens Connect App,"(42.3637, -71.1273)",-7917854.817500407,5215616.5975355115,-7917854.817500407,5215616.5975355115
701115,101001870015,07/28/2016 09:28:13 AM,07/29/2016 09:28:13 AM,07/28/2016 09:34:24 AM,ONTIME,Closed,Case Closed. Closed date : 2016-07-28 09:34:24.437 Case Resolved Pothole & Cracks filled,Request for Pothole Repair,Public Works Department,Highway Maintenance,Request for Pothole Repair,PWDx_District 04: Allston/Brighton,PWDx,https://cityworker.cityofboston.gov:8443/attachments/report/579a086970b4fc1c6fbca656/photo/Report.jpg,https://cityworker.cityofboston.gov:8443/attachments/report/579a086970b4fc1c6fbca656/closed_photo/Report.jpg,INTERSECTION of Chestnut Hill Drwy & Beacon St  Brighton  MA,,04,0.0,D14,Allston / Brighton,15.0,21,2116,,INTERSECTION Chestnut Hill Drwy & Beacon St,,Intersection,9776.0,42.3594,-71.0587,City Worker App,"(0, 0)",-7910218.300431989,5214968.784796895,-7910218.300431989,5214968.784796895
197414,101001701429,01/25/2016 04:43:00 PM,02/08/2016 04:43:00 PM,01/25/2016 07:44:08 PM,ONTIME,Closed,Case Closed. Closed date : 2016-01-25 19:44:08.273 Case Resolved replaced lamp starter refractor. john/kevin/joubert/mxol,PRINTED,Public Works Department,Street Lights,Street Light Outages,PWDx_Street Light Outages,PWDx,,,INTERSECTION of Massachusetts Ave & Tremont St  Roxbury  MA,9.0,1C,7.0,D4,Roxbury,13.0,Ward 9,0903,,INTERSECTION Massachusetts Ave & Tremont St,,Intersection,7142.0,42.3393,-71.0804,Employee Generated,"(42.3393, -71.0804)",-7912633.933382202,5211941.224632733,-7912633.933382202,5211941.224632733
530952,101001021081,02/07/2014 08:20:32 AM,,02/07/2014 08:20:33 AM,ONTIME,Closed,Case Closed Internal Case Performed by Highway Maintenance crew.,Pothole Repair (Internal),Public Works Department,Highway Maintenance,Pothole Repair (Internal),PWDx_District 02: Jamaica Plain,PWDx,,,27 Dixwell St  Roxbury  MA  02119,9.0,02,7.0,E13,Jamaica Plain,11.0,Ward 11,1105,I,27 Dixwell St,2119.0,Address,47980.0,42.3143,-71.0982,Employee Generated,"(42.3143, -71.0982)",-7914615.420318324,5208176.952624203,-7914615.420318324,5208176.952624203
684541,101001546892,09/01/2015 03:30:07 PM,09/02/2015 03:30:07 PM,09/02/2015 08:59:54 AM,ONTIME,Closed,Case Closed. Closed date : 2015-09-02 08:59:54.99 Case Resolved sidewalk cleaned,Requests for Street Cleaning,Public Works Department,Street Cleaning,Requests for Street Cleaning,PWDx_District 10A: Roxbury,PWDx,https://mayors24.cityofboston.gov/media/boston/report/photos/55e5fcde048529bde61686ae/report.jpg,https://cityworker.cityofboston.gov:8443/attachments/report/55e5fd10d05220b9f82c2b2b/closed_photo/Report.jpg,1575 Tremont St  Mission Hill  MA  02120,9.0,10A,8.0,B2,Mission Hill,14.0,Ward 10,1002,RC,1575 Tremont St,2120.0,Address,320977.0,42.3335,-71.1017,Citizens Connect App,"(42.3335, -71.1017)",-7915005.038536099,5211067.780241204,-7915005.038536099,5211067.780241204
457260,101001065952,04/11/2014 09:07:58 AM,,04/11/2014 09:07:59 AM,ONTIME,Closed,Case Closed Internal Case Performed by Highway Maintenance crew.,Pothole Repair (Internal),Public Works Department,Highway Maintenance,Pothole Repair (Internal),PWDx_District 03: North Dorchester,PWDx,,,22 Norton St  Dorchester  MA  02125,7.0,03,4.0,C11,Dorchester,8.0,Ward 15,1502,R3,22 Norton St,2125.0,Address,103945.0,42.3068,-71.0692,Employee Generated,"(42.3068, -71.0692)",-7911387.155085318,5207047.962631052,-7911387.155085318,5207047.962631052
566785,101001230042,12/08/2014 08:08:24 PM,12/11/2014 08:30:00 AM,12/09/2014 08:54:47 AM,ONTIME,Closed,Case Closed Case Resolved Vehicle ticketed.,Parking Enforcement,Transportation - Traffic Division,Enforcement & Abandoned Vehicles,Parking Enforcement,BTDT_Parking Enforcement,BTDT,,,14 Welles Ave  Dorchester  MA  02124,8.0,07,4.0,C11,Dorchester,8.0,Ward 17,1706,R2,14 Welles Ave,2124.0,Address,147312.0,42.2883,-71.0705,Constituent Call,"(42.2883, -71.0705)",-7911531.870423349,5204263.695592314,-7911531.870423349,5204263.695592314
738986,101001267736,02/02/2015 03:01:10 PM,02/04/2015 03:01:09 PM,02/03/2015 08:58:46 AM,ONTIME,Closed,Case Closed Case Noted Multiple vehicles ticketed for less than a ten foot lane and put on tow list.,Parking Enforcement,Transportation - Traffic Division,Enforcement & Abandoned Vehicles,Parking Enforcement,BTDT_Parking Enforcement,BTDT,,,200 Warren Ave  Roxbury  MA  02118,4.0,1C,2.0,D4,South End,6.0,Ward 4,0403,A,200 Warren Ave,2118.0,Address,328366.0,42.3435,-71.077,Self Service,"(42.3435, -71.077)",-7912255.447113506,5212573.769141562,-7912255.447113506,5212573.769141562
924982,101002010147,02/12/2017 12:08:00 PM,02/13/2017 12:08:54 PM,02/13/2017 06:34:09 AM,ONTIME,Closed,Case Closed. Closed date : 2017-02-13 06:34:09.75 Duplicate of Existing Case Repaired problem,Traffic Signal Inspection,Transportation - Traffic Division,Signs & Signals,Traffic Signal Inspection,BTDT_Traffic Signal_Repair,BTDT,,,INTERSECTION of Boston St & Massachusetts Ave  Dorchester  MA,7.0,03,3.0,C6,Dorchester,5.0,7,0709,,INTERSECTION Boston St & Massachusetts Ave,,Intersection,14731.0,42.3594,-71.0587,Constituent Call,"(0, 0)",-7910218.300431989,5214968.784796895,-7910218.300431989,5214968.784796895
29357,101001911271,09/17/2016 05:25:18 PM,09/21/2016 08:30:00 AM,09/18/2016 10:30:33 AM,ONTIME,Closed,Case Closed. Closed date : 2016-09-18 10:30:33.397 Case Noted Ticket has been issued for trash out early,Improper Storage of Trash (Barrels),Public Works Department,Code Enforcement,Improper Storage of Trash (Barrels),PWDx_Code Enforcement,PWDx,,,INTERSECTION of Public Alley No. 301 & Mount Vernon Sq  Boston  MA,3.0,1B,7.0,A1,Back Bay,14.0,5,0511,,INTERSECTION Public Alley No. 301 & Mount Vernon Sq,,Intersection,14137.0,42.3594,-71.0587,Citizens Connect App,"(0, 0)",-7910218.300431989,5214968.784796895,-7910218.300431989,5214968.784796895
365562,101000342121,10/13/2011 10:48:11 PM,10/28/2011 08:30:00 AM,10/13/2011 11:07:08 PM,ONTIME,Closed,Case Closed Duplicate of Existing Case,Street Light Outages,Public Works Department,Street Lights,Street Light Outages,PWDx_Street Light Outages,PWDx,,,7 Lincoln St  Dorchester  MA  02122,7.0,07,3.0,C11,Dorchester,7.0,Ward 16,1601,R2,7 Lincoln St,2122.0,Address,86226.0,42.2995,-71.0598,Constituent Call,"(42.2995, -71.0598)",-7910340.751871861,5205949.2082036305,-7910340.751871861,5205949.2082036305
566987,101000492827,10/16/2012 11:55:39 AM,10/30/2012 11:55:38 AM,10/17/2012 01:50:54 PM,ONTIME,Closed,Case Closed Case Resolved installed barrel at 867 Blue Hill Ave. it is a adopt a barrel Zeke Perkins is the contact,Request for Litter Basket Installation,Public Works Department,Street Cleaning,Request for Litter Basket Installation,PWDx_Request for Litter Basket Installation,PWDx,,,861-869 Blue Hill Ave  Dorchester  MA  02124,8.0,07,4.0,B3,Greater Mattapan,9.0,Ward 14,1409,C,861-869 Blue Hill Ave,2124.0,Address,16580.0,42.2958,-71.0879,Constituent Call,"(42.2958, -71.0879)",-7913468.829563153,5205392.353917768,-7913468.829563153,5205392.353917768
427985,101000338956,10/06/2011 10:18:50 AM,,10/06/2011 10:18:51 AM,ONTIME,Closed,Case Closed Internal Case Performed by Highway Maintenance crew.,Pothole Repair (Internal),Public Works Department,Highway Maintenance,Pothole Repair (Internal),PWDx_District 09: East Boston,PWDx,,,175 Coleridge St  East Boston  MA  02128,1.0,09,1.0,A7,East Boston,1.0,Ward 1,0112,R1,175 Coleridge St,2128.0,Address,34740.0,42.3813,-71.013,Employee Generated,"(42.3813, -71.013)",-7905130.999702736,5218268.57238915,-7905130.999702736,5218268.57238915
949750,101002034839,03/10/2017 04:38:00 PM,02/28/2019 04:38:40 PM,,ONTIME,Open,,Working Beyond Hours,Inspectional Services,Building,Working Beyond Hours,ISD_Building (INTERNAL),ISD,,,325 Sumner St  East Boston  MA  02128,1.0,09,1.0,A7,East Boston,1.0,Ward 1,0103,R2,325 Sumner St,2128.0,Address,392635.0,42.3672,-71.0362,Constituent Call,"(42.3672, -71.0362)",-7907713.61188914,5216143.919706318,-7907713.61188914,5216143.919706318
898774,101002000945,02/01/2017 11:42:54 AM,02/02/2017 11:42:53 AM,02/01/2017 12:07:48 PM,ONTIME,Closed,Case Closed. Closed date : 2017-02-01 12:07:48.427 Case Resolved,CE Collection,Public Works Department,Street Cleaning,CE Collection,PWDx_District 1B: North End,PWDx,https://cityworker.cityofboston.gov:8443/attachments/report/5892100ad05264983c8aa6ce/photo/Report.jpg,https://cityworker.cityofboston.gov:8443/attachments/report/5892100ad05264983c8aa6ce/closed_photo/Report.jpg,26-28 Margaret St  Boston  MA  02113,3.0,1B,1.0,A1,Downtown / Financial District,3.0,Ward 3,0303,A,26-28 Margaret St,2113.0,Address,89664.0,42.3661,-71.0556,City Worker App,"(42.3661, -71.0556)",-7909873.2100105295,5215978.186715516,-7909873.2100105295,5215978.186715516
551771,101001700377,01/25/2016 06:59:15 AM,02/01/2016 08:30:00 AM,01/25/2016 07:46:33 AM,ONTIME,Closed,Case Closed. Closed date : 2016-01-25 07:46:33.187 Case Noted cited for failure to remove ice from sidewalk,Unshoveled Sidewalk,Public Works Department,Code Enforcement,Unshoveled Sidewalk,PWDx_Code Enforcement,PWDx,https://mayors24.cityofboston.gov/media/boston/report/photos/56a60e0b0485cd229efc01ca/photo_20160125_065857.jpg,,265 Minot St  Dorchester  MA  02124,8.0,07,3.0,C11,Dorchester,7.0,Ward 16,1608,R1,265 Minot St,2124.0,Address,96128.0,42.2837,-71.0585,Citizens Connect App,"(42.2837, -71.0585)",-7910196.036533829,5203571.51830337,-7910196.036533829,5203571.51830337
841236,101000948210,10/17/2013 12:36:52 PM,,10/21/2013 09:47:07 PM,ONTIME,Closed,Case Closed Bulk Item Automation,Schedule a Bulk Item Pickup,Public Works Department,Sanitation,Schedule a Bulk Item Pickup,PWDx_Schedule a Bulk Item Pickup,PWDx,,,130 Faraday St  Hyde Park  MA  02136,12.0,08,5.0,E18,Hyde Park,10.0,Ward 18,1817,R2,130 Faraday St,2136.0,Address,56333.0,42.242,-71.1214,Constituent Call,"(42.242, -71.1214)",-7917198.032504726,5197299.084768822,-7917198.032504726,5197299.084768822
600126,101001135937,07/24/2014 07:42:38 AM,08/21/2014 08:30:00 AM,07/24/2014 08:25:47 AM,ONTIME,Closed,Case Closed Duplicate of Existing Case  Cart will be delivered.,Request for Recycling Cart,Public Works Department,Recycling,Request for Recycling Cart,PWDx_Recycling,PWDx,,,58-60 Elm St  Jamaica Plain  MA  02130,9.0,02,6.0,E13,Jamaica Plain,11.0,Ward 19,1906,CM,58-60 Elm St,2130.0,Address,53178.0,42.3096,-71.1107,Self Service,"(42.3096, -71.1107)",-7916006.913953238,5207469.436492519,-7916006.913953238,5207469.436492519
900592,101001985304,01/09/2017 10:43:08 PM,01/11/2017 08:30:00 AM,01/10/2017 01:56:29 AM,ONTIME,Closed,Case Closed. Closed date : 2017-01-10 01:56:29.52 Case Resolved vehicle over timed and tagged,Parking Enforcement,Transportation - Traffic Division,Enforcement & Abandoned Vehicles,Parking Enforcement,BTDT_Parking Enforcement,BTDT,,,41 M St  South Boston  MA  02127,6.0,05,2.0,C6,South Boston / South Boston Waterfront,5.0,Ward 6,0607,R1,41 M St,2127.0,Address,88089.0,42.3368,-71.0336,Citizens Connect App,"(42.3368, -71.0336)",-7907424.181213078,5211564.730103104,-7907424.181213078,5211564.730103104
260295,101001254231,01/26/2015 12:29:46 PM,02/09/2015 12:29:46 PM,02/24/2015 08:18:27 AM,OVERDUE,Closed,Case Closed Case Resolved,Sign Repair,Transportation - Traffic Division,Signs & Signals,Sign Repair,BTDT_Sign Shop_Sign Installation,BTDT,,,INTERSECTION of Canterbury St & Hyde Park Ave  Roslindale  MA,12.0,08,5.0,E18,Roslindale,10.0,Ward 18,1808,,INTERSECTION Canterbury St & Hyde Park Ave,,Intersection,2410.0,42.2786,-71.1192,City Worker App,"(42.2786, -71.1192)",-7916953.129624982,5202804.163425581,-7916953.129624982,5202804.163425581
740954,101001319063,02/27/2015 11:50:46 AM,,02/27/2015 11:55:20 AM,ONTIME,Closed,Case Closed Case Resolved  - Client directed to website to do intake,Front Desk Interactions,Civil Rights,Call Inquiry,OCR Front Desk Interactions,HS_OCR_FrontDesk_Interactions,HS_O,,,,,,,,,,,,,,,,,42.3594,-71.0587,Constituent Call,"(0, 0)",-7910218.300431989,5214968.784796895,-7910218.300431989,5214968.784796895
8571,101001901139,09/06/2016 10:29:47 AM,,09/13/2016 04:30:41 PM,ONTIME,Closed,Case Closed. Closed date : 2016-09-13 16:30:41.147 Bulk Item Automation,Schedule Bulk Item Pickup,Public Works Department,Sanitation,Schedule a Bulk Item Pickup SS,PWDx_Schedule a Bulk Item Pickup,PWDx,,,1875 Dorchester Ave  Dorchester  MA  02124,8.0,07,3.0,C11,Dorchester,8.0,Ward 16,1603,E,1875 Dorchester Ave,2124.0,Address,224937.0,42.287,-71.0642,Self Service,"(42.287, -71.0642)",-7910830.557631351,5204068.075148029,-7910830.557631351,5204068.075148029
255321,101001972518,12/18/2016 02:00:47 PM,12/20/2016 08:30:00 AM,12/19/2016 01:50:06 AM,ONTIME,Closed,Case Closed. Closed date : 2016-12-19 01:50:06.817 Case Resolved vehicle not at location,Parking Enforcement,Transportation - Traffic Division,Enforcement & Abandoned Vehicles,Parking Enforcement,BTDT_Parking Enforcement,BTDT,https://mayors24.cityofboston.gov/media/boston/report/photos/5856dcdc0485b8e8d3453bf9/report.jpg,,51-53 Cooper St  Boston  MA  02113,3.0,1B,1.0,A1,Downtown / Financial District,3.0,Ward 3,0304,RC,51-53 Cooper St,2113.0,Address,42421.0,42.3645,-71.0578,Citizens Connect App,"(42.3645, -71.0578)",-7910118.112890274,5215737.125727368,-7910118.112890274,5215737.125727368
745062,101001638304,11/19/2015 06:33:48 AM,11/20/2015 08:30:00 AM,11/19/2015 09:52:21 AM,ONTIME,Closed,Case Closed. Closed date : 2015-11-19 09:52:21.383 Case Noted Officer found no vehicle in violation,Parking Enforcement,Transportation - Traffic Division,Enforcement & Abandoned Vehicles,Parking Enforcement,BTDT_Parking Enforcement,BTDT,https://mayors24.cityofboston.gov/media/boston/report/photos/564db39455a5723671ee215e/photo_20151119_063303.jpg,,9 Roxton St  Dorchester  MA  02121,7.0,03,4.0,B3,Greater Mattapan,8.0,Ward 14,1402,R2,9 Roxton St,2121.0,Address,119290.0,42.2981,-71.0805,Citizens Connect App,"(42.2981, -71.0805)",-7912645.065331282,5205738.502734099,-7912645.065331282,5205738.502734099
555668,101000734464,01/10/2013 08:51:23 AM,,01/10/2013 08:51:23 AM,ONTIME,Closed,Case Closed Internal Case Performed by Highway Maintenance crew.,Pothole Repair (Internal),Public Works Department,Highway Maintenance,Pothole Repair (Internal),PWDx_District 06: West Roxbury and Roslindale,PWDx,,,INTERSECTION of Washington St & Pheasant St  Hyde Park  MA,12.0,06,6.0,E18,West Roxbury,10.0,Ward 20,2003,,INTERSECTION Washington St & Pheasant St,,Intersection,5989.0,42.2723,-71.1445,Employee Generated,"(42.2723, -71.1445)",-7919769.512742051,5201856.340197138,-7919769.512742051,5201856.340197138
180257,101001655517,12/01/2015 08:59:00 AM,01/30/2016 08:59:00 AM,12/10/2015 12:38:26 PM,ONTIME,Closed,Case Closed. Closed date : 2015-12-10 12:38:26.5 Case Resolved POLE AND FIXTURE INSTALLED AND TIED IN              G.MC CARTHY /J.FELDER / P.LEDBETTWR,PRINTED,Public Works Department,Street Lights,Knockdown Replacement,PWDx_Street Light Knockdown Replacement,PWDx,,,231 Highland St  Roxbury  MA  02119,9.0,10B,7.0,B2,Roxbury,13.0,Ward 11,1101,R3,231 Highland St,2119.0,Address,73739.0,42.3233,-71.095,Employee Generated,"(42.3233, -71.095)",-7914259.197947785,5209531.918225126,-7914259.197947785,5209531.918225126
74511,101001119319,07/01/2014 10:35:45 AM,,07/25/2014 10:22:11 AM,ONTIME,Closed,Case Closed Case Resolved  The Director of Community Affairs has contacted the constituent and has discussed the issue. I am closing the case but have informed the constituent to contact me if they wish to discuss the issue further.,BTDT: Complaint,Mayor's 24 Hour Hotline,Employee & General Comments,General Comments For An Employee,BTDT_General Comments,BTDT,,,164 Newbury St  Boston  MA  02116,4.0,1C,8.0,D4,Back Bay,14.0,Ward 5,0507,C,164 Newbury St,2116.0,Address,101370.0,42.3504,-71.0786,Constituent Call,"(42.3504, -71.0786)",-7912433.558298774,5213613.041147598,-7912433.558298774,5213613.041147598
931057,101002017297,02/16/2017 07:06:00 PM,02/21/2017 08:30:00 AM,02/17/2017 12:37:41 AM,ONTIME,Closed,Case Closed. Closed date : 2017-02-17 00:37:41.06 Case Resolved Big Belly emptied,Empty Litter Basket,Public Works Department,Highway Maintenance,Empty Litter Basket,PWDx_District 1C: Downtown,PWDx,https://mayors24.cityofboston.gov/media/boston/report/photos/58a63e7a0485450aec7b090c/report.jpg,,554 Tremont St  Roxbury  MA  02118,4.0,1C,2.0,D4,South End,4.0,03,0307,,554 Tremont St,2118.0,Address,347739.0,42.3438,-71.0716,Citizens Connect App,"(42.3438, -71.0716)",-7911654.321863223,5212618.952509077,-7911654.321863223,5212618.952509077
542153,101000932177,09/23/2013 08:40:12 AM,09/25/2013 08:40:12 AM,09/23/2013 08:40:14 AM,ONTIME,Closed,Case Closed Case Resolved Marked completed at case creation,Requests for Street Cleaning,Public Works Department,Street Cleaning,Requests for Street Cleaning,PWDx_District 06: West Roxbury and Roslindale,PWDx,,,5095 Washington St  West Roxbury  MA  02132,12.0,06,6.0,E5,West Roxbury,12.0,Ward 20,2005,R1,5095 Washington St,2132.0,Address,145589.0,42.2642,-71.1544,City Worker App,"(42.2642, -71.1544)",-7920871.575700904,5200637.8495299565,-7920871.575700904,5200637.8495299565
814494,101000917319,09/03/2013 04:54:51 PM,,09/06/2013 09:55:23 PM,ONTIME,Closed,Case Closed Bulk Item Automation,Schedule Bulk Item Pickup,Public Works Department,Sanitation,Schedule a Bulk Item Pickup SS,PWDx_Schedule a Bulk Item Pickup,PWDx,,,28 Victoria Heights Rd  Hyde Park  MA  02136,12.0,08,5.0,E18,Hyde Park,10.0,18,1808,CD,28 Victoria Heights Rd,2136.0,Address,140496.0,42.3594,-71.0587,Self Service,"(0, 0)",-7910218.300431989,5214968.784796895,-7910218.300431989,5214968.784796895
443479,101000869109,06/27/2013 06:36:54 PM,07/02/2013 08:30:00 AM,06/28/2013 12:16:13 PM,ONTIME,Closed,Case Closed Case Resolved Location has been made safe. This sidewalk will be referred for permanent repair. See case #101000869605 for status of the permanent repair.,Sidewalk Repair (Make Safe),Public Works Department,Highway Maintenance,Sidewalk Repair (Make Safe),PWDx_District 04: Allston/Brighton,PWDx,,,INTERSECTION of Brackett St & Washington St  Brighton  MA,11.0,04,9.0,D14,Allston / Brighton,15.0,Ward 22,2207,,INTERSECTION Brackett St & Washington St,,Intersection,1806.0,42.3502,-71.1654,Citizens Connect App,"(42.3502, -71.1654)",-7922096.090099632,5213582.91571595,-7922096.090099632,5213582.91571595
545311,101001267637,02/02/2015 02:21:54 PM,02/04/2015 02:21:54 PM,02/08/2015 03:18:52 PM,OVERDUE,Closed,Case Closed Case Noted street passable,Request for Snow Plowing,Public Works Department,Street Cleaning,Request for Snow Plowing,PWDx_District 03: North Dorchester,PWDx,,,218 Norwell St  Dorchester  MA  02124,8.0,03,4.0,B3,Dorchester,9.0,Ward 17,1701,R3,218 Norwell St,2124.0,Address,104088.0,42.295,-71.078,Self Service,"(42.295, -71.078)",-7912366.766604299,5205271.957292819,-7912366.766604299,5205271.957292819
665092,101000817038,04/04/2013 03:16:55 PM,,04/04/2013 03:16:55 PM,ONTIME,Closed,Case Closed Internal Case Performed by Highway Maintenance crew.,Pothole Repair (Internal),Public Works Department,Highway Maintenance,Pothole Repair (Internal),PWDx_District 03: North Dorchester,PWDx,,,INTERSECTION of Bullard St & Rosseter St  Dorchester  MA,7.0,03,4.0,C11,Dorchester,8.0,Ward 14,1404.0,,INTERSECTION Bullard St & Rosseter St,,Intersection,2169.0,42.3024,-71.0732,Employee Generated,"(42.3024, -71.0732)",-7911832.433048491,5206385.684436517,-7911832.433048491,5206385.684436517
759351,101001298076,02/16/2015 12:28:29 PM,02/19/2015 08:30:00 AM,04/13/2015 05:16:09 PM,OVERDUE,Closed,Case Closed Case Noted Thank you for your request. This service request is now considered closed due to the recent arrival of Spring. The City worked around the clock this winter to address the record-breaking snowfall and we hope that many of your concerns were resolved. We encourage you to let us know of any additional issues and thank you for working with us to make the City a better place. Thank you for your patience and we apologize for any requests that we were not able to get to.,Request for Snow Plowing,Public Works Department,Street Cleaning,Request for Snow Plowing,PWDx_District 04: Allston/Brighton,PWDx,,,1 Larose Pl  Brighton  MA  02135,11.0,04,9.0,D14,Allston / Brighton,15.0,21,2111,R1,1 Larose Pl,2135.0,Address,84121.0,42.3456,-71.1472,Citizens Connect App,"(42.3456, -71.1472)",-7920070.075367193,5212890.057241928,-7920070.075367193,5212890.057241928
460357,101001341827,03/25/2015 01:23:12 PM,06/23/2015 01:23:12 PM,05/04/2015 11:18:41 AM,ONTIME,Closed,Case Closed. Closed date : 2015-05-04 11:18:41.443 :,Breathe Easy,Inspectional Services,Housing,Breathe Easy,ISD_Housing (INTERNAL),ISD,,,40 Ames St  Dorchester  MA  02124,8.0,07,4.0,B3,Greater Mattapan,9.0,14,1410,,40 Ames St,2124.0,Address,350414.0,42.2901,-71.086,Constituent Call,"(42.2901, -71.086)",-7913257.322530645,5204534.561333866,-7913257.322530645,5204534.561333866
448858,101000478064,09/12/2012 01:44:36 PM,09/26/2012 01:44:36 PM,09/20/2012 12:40:57 PM,ONTIME,Closed,Case Closed Case Resolved Work completed 9/20/12.,Sign Repair,Transportation - Traffic Division,Signs & Signals,Sign Repair,BTDT_Sign Shop_Sign Installation,BTDT,,,15-21 Stoughton St  Dorchester  MA  02125,7.0,03,7.0,C11,Dorchester,13.0,Ward 13,1305,C,15-21 Stoughton St,2125.0,Address,131113.0,42.3167,-71.0647,City Worker App,"(42.3167, -71.0647)",-7910886.217376749,5208538.257836288,-7910886.217376749,5208538.257836288
387483,101000443891,07/02/2012 09:21:51 AM,07/04/2012 09:21:49 AM,07/03/2012 02:01:36 PM,ONTIME,Closed,Case Closed Case Resolved area has been repaired.,Request for Pothole Repair,Public Works Department,Highway Maintenance,Request for Pothole Repair,PWDx_Highway Construction,PWDx,,,10 Causeway St  Boston  MA  02114,3.0,1B,8.0,A1,Downtown / Financial District,3.0,Ward 3,0305,C,10 Causeway St,2114.0,Address,26494.0,42.3652,-71.0631,Constituent Call,"(42.3652, -71.0631)",-7910708.1061914805,5215842.589154249,-7910708.1061914805,5215842.589154249
760319,101000486173,09/30/2012 10:48:09 AM,10/02/2012 10:48:08 AM,10/01/2012 06:57:11 AM,ONTIME,Closed,Case Closed Case Resolved,Traffic Signal Repair,Transportation - Traffic Division,Signs & Signals,Traffic Signal Repair,BTDT_Traffic Signal_Repair,BTDT,,,INTERSECTION of Cambridge St & Charles St  Boston  MA,3.0,1B,8.0,A1,Beacon Hill,14.0,Ward 5,0511,,INTERSECTION Cambridge St & Charles St,,Intersection,2367.0,42.3609,-71.0706,Constituent Call,"(42.3609, -71.0706)",-7911543.002372429,5215194.760949571,-7911543.002372429,5215194.760949571
582886,101000389975,03/01/2012 03:58:40 PM,03/05/2012 03:58:40 PM,03/02/2012 10:13:48 AM,ONTIME,Closed,Case Closed Case Noted  unfortunately  Tuesday is the pick up day here so it was scheduled for the wrong day and we cannot send the truck back to Tuesday's work today  I have rescheduled this tv to be collected on Tuesday  March 6  we are sorry for any inconvenience.,Missed Bulk Item Pickup: District 07,Public Works Department,Sanitation,Missed Trash/Recycling/Yard Waste/Bulk Item,PWDx_Missed Trash\Recycling\Yard Waste\Bulk Item,PWDx,,,101 Evans St  Dorchester  MA  02124,8.0,07,4.0,B3,Dorchester,9.0,Ward 17,1710,R2,101 Evans St,2124.0,Address,54785.0,42.2821,-71.0822,Constituent Call,"(42.2821, -71.0822)",-7912834.308465631,5203330.7728318265,-7912834.308465631,5203330.7728318265
642805,101001687351,01/05/2016 09:28:46 AM,01/06/2016 09:28:45 AM,01/05/2016 09:34:54 AM,ONTIME,Closed,Case Closed. Closed date : 2016-01-05 09:34:54.723 Case Noted Officer was around the corner and it was clear when she checked it.,Parking Enforcement,Transportation - Traffic Division,Enforcement & Abandoned Vehicles,Parking Enforcement,BTDT_Parking Enforcement,BTDT,https://mayors24.cityofboston.gov/media/boston/report/photos/568bd3196963635e6ba020b0/photo_20160105_092832.jpg,,INTERSECTION of Washington St & Kenwood St  Dorchester  MA,8.0,07,4.0,C11,Dorchester,8.0,Ward 17,1706,,INTERSECTION Washington St & Kenwood St,,Intersection,6107.0,42.2917,-71.0717,Citizens Connect App,"(42.2917, -71.0717)",-7911665.453812302,5204775.337380063,-7911665.453812302,5204775.337380063
424763,101000484330,09/25/2012 04:19:33 PM,11/27/2012 04:19:33 PM,10/04/2012 09:57:48 AM,ONTIME,Closed,Case Closed Case Resolved   This request has been completed and 235 Dudley Street was done.,Graffiti: Ward 8  0804  Other,Property Management,Graffiti,Graffiti Removal,PROP_GRAF_GraffitiRemoval,PROP,,,237 Dudley St  Roxbury  MA  02119,7.0,10B,7.0,B2,Roxbury,13.0,Ward 8,0804,RC,237 Dudley St,2119.0,Address,226517.0,42.3284,-71.0798,Constituent Call,"(42.3284, -71.0798)",-7912567.141687727,5210299.818103092,-7912567.141687727,5210299.818103092
563682,101001699634,01/23/2016 11:17:53 PM,,01/23/2016 11:21:01 PM,ONTIME,Closed,Case Closed. Closed date : 2016-01-23 23:21:01.51 Case Invalid Lagan error,Request for Snow Plowing (Emergency Responder),Public Works Department,Street Cleaning,Request for Snow Plowing (Emergency Responder),PWDx_Requests for Snow Plowing (Emergency Responder),PWDx,,,INTERSECTION of Fargo St & E St  Boston  MA,6.0,05,2.0,C6,South Boston / South Boston Waterfront,5.0,6,0604,,INTERSECTION Fargo St & E St,,Intersection,16617.0,42.3594,-71.0587,Constituent Call,"(0, 0)",-7910218.300431989,5214968.784796895,-7910218.300431989,5214968.784796895
727983,101001292646,02/13/2015 07:51:12 AM,02/17/2015 08:30:00 AM,02/18/2015 03:00:33 PM,OVERDUE,Closed,Case Closed Case Resolved This case has been referred to BTD Engineering as a Request for Traffic Signal Study. See case #101001304630 for status of the request.,Traffic Signal Repair,Transportation - Traffic Division,Signs & Signals,Traffic Signal Repair,BTDT_Engineering_Request for Traffic Signal Study or Review,BTDT,,,INTERSECTION of Gurney St & Tremont St  Mission Hill  MA,9.0,10A,7.0,B2,Mission Hill,13.0,Ward 9,0904,,INTERSECTION Gurney St & Tremont St,,Intersection,5527.0,42.3316,-71.0961,Self Service,"(42.3316, -71.0961)",-7914381.649387658,5210781.669421678,-7914381.649387658,5210781.669421678
631952,101001297316,02/16/2015 08:59:27 AM,02/19/2015 08:30:00 AM,02/18/2015 07:36:00 PM,ONTIME,Closed,Case Closed Case Resolved plowed,Request for Snow Plowing,Public Works Department,Street Cleaning,Request for Snow Plowing,PWDx_District 06: West Roxbury and Roslindale,PWDx,,,10 Zeller St  Roslindale  MA  02131,9.0,06,5.0,E5,Roslindale,10.0,Ward 20,2001,R1,10 Zeller St,2131.0,Address,153339.0,42.2913,-71.1359,Constituent Call,"(42.2913, -71.1359)",-7918812.16512123,5204715.142795119,-7918812.16512123,5204715.142795119
93799,101000786748,02/19/2013 01:30:26 PM,03/05/2013 01:30:26 PM,04/30/2013 12:47:58 PM,OVERDUE,Closed,Case Closed Case Resolved,Street Light Outages,Public Works Department,Street Lights,Street Light Outages,PWDx_Street Light Outages,PWDx,,,6A Appleton St  Boston  MA  02116,4.0,1C,2.0,D4,South End,6.0,Ward 5,0501,R4,6A Appleton St,2116.0,Address,161586.0,42.3463,-71.0699,Self Service,"(42.3463, -71.0699)",-7911465.078728874,5212995.488956545,-7911465.078728874,5212995.488956545
470560,101001627794,11/04/2015 01:05:03 PM,11/03/2016 01:05:03 PM,11/04/2015 01:05:05 PM,ONTIME,Closed,Case Closed. Closed date : 2015-11-04 13:05:05.913 Internal Case Performed by Highway Maintenance crew.,Sidewalk Repair (Internal),Public Works Department,Highway Maintenance,Sidewalk Repair (Internal),PWDx_District 06: West Roxbury and Roslindale,PWDx,,,45 Hemman St  Roslindale  MA  02131,12.0,06,5.0,E5,Roslindale,10.0,Ward 18,1810,R2,45 Hemman St,2131.0,Address,250998.0,42.2775,-71.1312,Employee Generated,"(42.2775, -71.1312)",-7918288.963514501,5202638.663653155,-7918288.963514501,5202638.663653155
614335,101001584721,09/22/2015 08:18:08 AM,09/23/2015 08:30:00 AM,09/22/2015 09:46:38 AM,ONTIME,Closed,Case Closed. Closed date : 2015-09-22 09:46:38.337 Case Noted Vehicle ticketed by police and person moved vehicle as officer was calling for tow.,Parking Enforcement,Transportation - Traffic Division,Enforcement & Abandoned Vehicles,Parking Enforcement,BTDT_Parking Enforcement,BTDT,https://mayors24.cityofboston.gov/media/boston/report/photos/560147056963bd8dda8b2f68/report.jpg,,INTERSECTION of Emerson St & K St  South Boston  MA,6.0,05,2.0,C6,South Boston / South Boston Waterfront,5.0,Ward 6,0605,,INTERSECTION Emerson St & K St,,Intersection,4568.0,42.3348,-71.0374,Citizens Connect App,"(42.3348, -71.0374)",-7907847.195278092,5211263.545255757,-7907847.195278092,5211263.545255757
579566,101001841081,06/21/2016 12:12:19 PM,06/22/2016 12:12:19 PM,06/21/2016 12:12:21 PM,ONTIME,Closed,Case Closed. Closed date : 2016-06-21 12:12:21.41 Case Resolved Marked completed at case creation,CE Collection,Public Works Department,Street Cleaning,CE Collection,PWDx_District 1B: North End,PWDx,https://cityworker.cityofboston.gov:8443/attachments/report/5769675fd05203d28ce9daa5/photo/Report.jpg,,1 City Hall Plz  Boston  MA  02108,3.0,1B,1.0,A1,Downtown / Financial District,3.0,03,0306,E,1 City Hall Plz,2108.0,Address,32856.0,42.3603,-71.0583,City Worker App,"(42.3603, -71.0583)",-7910173.772635671,5215104.369841154,-7910173.772635671,5215104.369841154
810504,101001969735,12/13/2016 05:25:00 PM,01/12/2017 05:25:56 PM,12/14/2016 03:26:18 PM,ONTIME,Closed,Case Closed. Closed date : 2016-12-14 15:26:18.65 Case Noted Thank you for contacting the Boston Transportation Department. MassDOT is currently reconstructing this intersection and is actively working to ensure that pedestrians are accommodated both during  and after construction.,New Sign  Crosswalk or Pavement Marking,Transportation - Traffic Division,Signs & Signals,New Sign  Crosswalk or Pavement Marking,BTDT_Engineering_New Sign and Pavement Marking Requests,BTDT,,,INTERSECTION of New Washington St & Washington St  Jamaica Plain  MA,9.0,02,6.0,E13,Jamaica Plain,11.0,11,1108,,INTERSECTION New Washington St & Washington St,,Intersection,14405.0,42.3594,-71.0587,Constituent Call,"(0, 0)",-7910218.300431989,5214968.784796895,-7910218.300431989,5214968.784796895
114285,101001794609,05/19/2016 07:58:34 PM,05/23/2016 08:30:00 AM,05/20/2016 04:03:01 AM,ONTIME,Closed,Case Closed. Closed date : 2016-05-20 04:03:01.17 Case Resolved vehicle over timed and cited  this vehicle has been tagged on multiple occasions,Parking Enforcement,Transportation - Traffic Division,Enforcement & Abandoned Vehicles,Parking Enforcement,BTDT_Parking Enforcement,BTDT,,,INTERSECTION of G St & E Seventh St  South Boston  MA,6.0,05,2.0,C6,South Boston / South Boston Waterfront,5.0,7,0703,,INTERSECTION G St & E Seventh St,,Intersection,15364.0,42.3594,-71.0587,Citizens Connect App,"(0, 0)",-7910218.300431989,5214968.784796895,-7910218.300431989,5214968.784796895
732295,101000335859,09/28/2011 11:10:23 PM,10/13/2011 08:30:00 AM,09/28/2011 11:11:17 PM,ONTIME,Closed,Case Closed Case Resolved Lamp and refractor replaced,Street Light Outages,Public Works Department,Street Lights,Street Light Outages,PWDx_Street Light Outages,PWDx,,,973-975 Adams St  Dorchester  MA  02124,8.0,07,3.0,C11,Dorchester,7.0,Ward 16,1611,R2,973-975 Adams St,2124.0,Address,1019.0,42.2776,-71.0604,Constituent Call,"(42.2776, -71.0604)",-7910407.543566337,5202653.708967634,-7910407.543566337,5202653.708967634
170407,101001090296,05/15/2014 01:10:31 PM,,05/22/2014 04:36:57 PM,ONTIME,Closed,Case Closed Bulk Item Automation,Schedule Bulk Item Pickup,Public Works Department,Sanitation,Schedule a Bulk Item Pickup SS,PWDx_Schedule a Bulk Item Pickup,PWDx,,,81 Fuller St  Dorchester  MA  02124,8.0,07,4.0,C11,Dorchester,8.0,Ward 17,1711,R3,81 Fuller St,2124.0,Address,61242.0,42.2827,-71.0696,Self Service,"(42.2827, -71.0696)",-7911431.682881634,5203421.051667211,-7911431.682881634,5203421.051667211
331266,101001217763,11/15/2014 09:52:58 AM,11/19/2014 08:30:00 AM,11/15/2014 11:03:16 AM,ONTIME,Closed,Case Closed Case Resolved Dropped stickers off to above address at 11:03am,Sticker Request,Public Works Department,Recycling,Sticker Request,PWDx_Sticker Request,PWDx,,,8 Caton St  Mattapan  MA  02126,8.0,08,5.0,E18,Hyde Park,9.0,Ward 18,1805,R2,8 Caton St,2126.0,Address,26487.0,42.2651,-71.1005,Self Service,"(42.2651, -71.1005)",-7914871.455147147,5200773.229650417,-7914871.455147147,5200773.229650417
607863,101001794298,05/19/2016 01:48:15 PM,06/10/2016 01:48:15 PM,05/26/2016 02:29:20 PM,ONTIME,Closed,Case Closed. Closed date : 2016-05-26 14:29:20.397 Case Resolved Damaged cart replaced new cart # 5150030120 05/26/2016,Request for Recycling Cart,Public Works Department,Recycling,Request for Recycling Cart,PWDx_IPL Damaged Cart Replacement,PWDx,https://cityworker.cityofboston.gov:8443/attachments/report/573dfc60d0524e36626fc55b/photo/Report.jpg,,22 Maynard St  Roslindale  MA  02131,12.0,08,5.0,E18,Roslindale,10.0,Ward 18,1809,R2,22 Maynard St,2131.0,Address,400966.0,42.2759,-71.1239,City Worker App,"(42.2759, -71.1239)",-7917476.3312317105,5202397.941868401,-7917476.3312317105,5202397.941868401
647337,101001084503,05/08/2014 10:10:38 AM,09/05/2014 10:10:38 AM,03/23/2015 01:50:50 PM,OVERDUE,Closed,Case Closed CORR: Corrected,Unsatisfactory Living Conditions,Inspectional Services,Housing,Unsatisfactory Living Conditions,ISD_Housing (INTERNAL),ISD,,,150 Walnut Ave  Roxbury  MA  02119,9.0,10B,7.0,B2,Roxbury,13.0,Ward 12,1205,R4,150 Walnut Ave,2119.0,Address,327249.0,42.3202,-71.087,Constituent Call,"(42.3202, -71.087)",-7913368.642021438,5209065.185971268,-7913368.642021438,5209065.185971268
227449,101001502335,08/03/2015 02:08:00 PM,,08/07/2015 04:38:19 PM,ONTIME,Closed,Case Closed. Closed date : 2015-08-07 16:38:19.263 Bulk Item Automation,Schedule a Bulk Item Pickup,Public Works Department,Sanitation,Schedule a Bulk Item Pickup,PWDx_Schedule a Bulk Item Pickup,PWDx,,,49 Crescent Ave  Dorchester  MA  02125,7.0,03,3.0,C11,Dorchester,7.0,Ward 13,1307,R3,49 Crescent Ave,2125.0,Address,44205.0,42.3188,-71.0543,Constituent Call,"(42.3188, -71.0543)",-7909728.494672498,5208854.4112003,-7909728.494672498,5208854.4112003
337425,101001931675,10/15/2016 04:27:18 PM,10/18/2016 08:30:00 AM,10/15/2016 05:10:47 PM,ONTIME,Closed,Case Closed. Closed date : 2016-10-15 17:10:47.91 Case Resolved Picked up trash bags,Requests for Street Cleaning,Public Works Department,Street Cleaning,Requests for Street Cleaning,PWDx_District 1C: Downtown,PWDx,,https://cityworker.cityofboston.gov:8443/attachments/report/5802916ed0528f87d12ebd9f/closed_photo/Report.jpg,437-437A Columbus Ave  Boston  MA  02116,4.0,1C,2.0,D4,South End,6.0,Ward 4,0403,CM,437-437A Columbus Ave,2116.0,Address,35717.0,42.3439,-71.078,Citizens Connect App,"(42.3439, -71.078)",-7912366.766604299,5212634.013679493,-7912366.766604299,5212634.013679493
391598,101001574949,09/10/2015 12:01:00 PM,09/17/2015 12:01:18 PM,09/11/2015 07:54:30 PM,ONTIME,Closed,Case Closed. Closed date : 2015-09-11 19:54:30.793 Case Resolved All full trash barrels were removed from ringgold park.,Ground Maintenance: Ringgold Park  Ringgold Park,Parks & Recreation Department,Park Maintenance & Safety,Ground Maintenance,PARK_Maintenance_Region 5,PARK,https://mayors24.cityofboston.gov/media/boston/report/photos/55f1a94c6963c98f05b5cecc/report.jpg,,10 Ringgold St  Roxbury  MA  02118,4.0,1C,2.0,D4,Roxbury,4.0,3,0307,,10 Ringgold St,2118.0,Address,342013.0,42.3432,-71.0701,Citizens Connect App,"(42.3432, -71.0701)",-7911487.342627032,5212528.585989647,-7911487.342627032,5212528.585989647
191842,101001290580,02/12/2015 09:30:47 AM,02/17/2015 09:30:47 AM,02/17/2015 08:54:27 AM,ONTIME,Closed,Case Closed Case Resolved  plowed and cleared,Request for Snow Plowing,Public Works Department,Street Cleaning,Request for Snow Plowing,PWDx_District 04: Allston/Brighton,PWDx,,,INTERSECTION of Commonwealth Ave & Sutherland Rd  Brighton  MA,11.0,04,9.0,D14,Allston / Brighton,15.0,Ward 21,2112,,INTERSECTION Commonwealth Ave & Sutherland Rd,,Intersection,3348.0,42.3414,-71.1468,Self Service,"(42.3414, -71.1468)",-7920025.547570875,5212257.49160554,-7920025.547570875,5212257.49160554
44055,101000910366,08/26/2013 12:06:31 PM,08/28/2013 12:06:31 PM,08/27/2013 10:19:23 AM,ONTIME,Closed,Case Closed Case Resolved case resolved. stickers delivered 8/27,Sticker Request,Public Works Department,Recycling,Sticker Request,PWDx_Sticker Request,PWDx,,,14 Abbot St  Dorchester  MA  02124,7.0,03,4.0,B3,Greater Mattapan,8.0,Ward 14,1407,R2,14 Abbot St,2124.0,Address,174942.0,42.2973,-71.0859,Self Service,"(42.2973, -71.0859)",-7913246.190581566,5205618.101711881,-7913246.190581566,5205618.101711881
409702,101001397346,05/28/2015 05:52:00 PM,06/19/2015 08:30:00 AM,06/19/2015 02:56:57 PM,OVERDUE,Closed,Case Closed. Closed date : 2015-06-19 14:56:57.473 Case Resolved cart requested filled new cart#0415313526 06/18/2015,Request for Recycling Cart,Public Works Department,Recycling,Request for Recycling Cart,PWDx_Recycling,PWDx,,,51 Sumner St  Dorchester  MA  02125,7.0,03,7.0,C11,Dorchester,13.0,Ward 7,0710,CM,51 Sumner St,2125.0,Address,172362.0,42.318000000000005,-71.0622,Constituent Call,"(42.318, -71.0622)",-7910607.918649766,5208733.970579479,-7910607.918649766,5208733.970579479
294873,101001784116,05/06/2016 04:39:00 PM,05/09/2016 04:39:58 PM,05/09/2016 08:54:53 AM,ONTIME,Closed,Case Closed. Closed date : 2016-05-09 08:54:53.53 Case Resolved completed,Request for Pothole Repair,Public Works Department,Highway Maintenance,Request for Pothole Repair,PWDx_District 05: South Boston,PWDx,https://mayors24.cityofboston.gov/media/boston/report/photos/572d011a0485995256701fdc/photo_20160506_163952.jpg,https://cityworker.cityofboston.gov:8443/attachments/report/572d015dd05243d389fb2779/closed_photo/Report.jpg,77-91 Seaport Blvd  Boston  MA  02210,6.0,05,2.0,C6,Boston,5.0,06,0601,,77-91 Seaport Blvd,2210.0,Address,350786.0,42.3517,-71.0462,Citizens Connect App,"(42.3517, -71.0462)",-7908826.806797072,5213808.858789821,-7908826.806797072,5213808.858789821
84571,101001876624,08/05/2016 01:11:00 PM,08/05/2017 01:11:42 PM,09/19/2016 09:24:40 AM,ONTIME,Closed,Case Closed. Closed date : 2016-09-19 09:24:40.587 Case Resolved The tree was pruned by Northern Tree Service  to the City of Boston tree pruning specifications.,Tree Maintenance Requests,Parks & Recreation Department,Trees,Tree Maintenance Requests,PARK_Tree Maintenance Request,PARK,,,114 Milton St  Dorchester  MA  02124,8.0,07,3.0,C11,Dorchester,7.0,Ward 16,1612,R2,114 Milton St,2124.0,Address,95788.0,42.2805,-71.0546,Constituent Call,"(42.2805, -71.0546)",-7909761.890519735,5203090.033473719,-7909761.890519735,5203090.033473719
781396,101000416984,05/04/2012 09:20:08 AM,,05/04/2012 09:20:08 AM,ONTIME,Closed,Case Closed Internal Case Performed by Highway Maintenance crew.,Pothole Repair (Internal),Public Works Department,Highway Maintenance,Pothole Repair (Internal),PWDx_District 07: South Dorchester,PWDx,,,INTERSECTION of Cragmere Ter & Gladeside Ave  Mattapan  MA,8.0,07,4.0,B3,Greater Mattapan,9.0,Ward 18,1801,,INTERSECTION Cragmere Ter & Gladeside Ave,,Intersection,3628.0,42.2741,-71.0862,Employee Generated,"(42.2741, -71.0862)",-7913279.586428804,5202127.137165686,-7913279.586428804,5202127.137165686
468198,101000395794,03/15/2012 10:32:23 PM,05/18/2012 08:30:00 AM,05/22/2012 07:36:03 AM,OVERDUE,Closed,Case Closed Case Resolved graffiti removed,Graffiti Removal/power washing - s/w - Dist 5,Property Management,Graffiti,Graffiti Removal,PWDx_District 05: South Boston,PWDx,,,412-414 W Broadway  South Boston  MA  02127,6.0,05,2.0,C6,South Boston / South Boston Waterfront,5.0,Ward 6,0603,C,412-414 W Broadway,2127.0,Address,156328.0,42.336999999999996,-71.0477,Citizens Connect App,"(42.337, -71.0477)",-7908993.786033263,5211594.849114661,-7908993.786033263,5211594.849114661
59711,101001058299,04/01/2014 09:15:43 AM,04/15/2014 09:15:42 AM,04/03/2014 06:17:31 PM,ONTIME,Closed,Case Closed Case Resolved jumped burned nstar feed.,Street Light Outages,Public Works Department,Street Lights,Street Light Outages,PWDx_Street Light Outages,PWDx,,,INTERSECTION of Buick St & Commonwealth Ave  Boston  MA,11.0,04,8.0,D14,Allston / Brighton,14.0,Ward 21,2102,,INTERSECTION Buick St & Commonwealth Ave,,Intersection,2165.0,42.3512,-71.1158,Citizens Connect App,"(42.3512, -71.1158)",-7916574.643356284,5213733.543832747,-7916574.643356284,5213733.543832747
35118,101001321783,03/02/2015 04:46:02 PM,03/04/2015 04:46:01 PM,04/13/2015 05:14:02 PM,OVERDUE,Closed,Case Closed Case Noted Thank you for your request. This service request is now considered closed due to the recent arrival of Spring. The City worked around the clock this winter to address the record-breaking snowfall and we hope that many of your concerns were resolved. We encourage you to let us know of any additional issues and thank you for working with us to make the City a better place. Thank you for your patience and we apologize for any requests that we were not able to get to.,Request for Snow Plowing,Public Works Department,Street Cleaning,Request for Snow Plowing,PWDx_District 03: North Dorchester,PWDx,,,53-63 Norwell St  Dorchester  MA  02121,7.0,03,4.0,B3,Dorchester,8.0,Ward 14,1402,A,53-63 Norwell St,2121.0,Address,104135.0,42.3007,-71.079,Constituent Call,"(42.3007, -71.079)",-7912478.086095092,5206129.816620465,-7912478.086095092,5206129.816620465
757666,101001869057,07/27/2016 09:50:00 AM,07/28/2016 09:50:00 AM,07/27/2016 10:48:09 AM,ONTIME,Closed,Case Closed. Closed date : 2016-07-27 10:48:09.54 Case Resolved area cleared of branches and debri,Requests for Street Cleaning,Public Works Department,Street Cleaning,Requests for Street Cleaning,PWDx_District 03: North Dorchester,PWDx,https://mayors24.cityofboston.gov/media/boston/report/photos/5798bc04696375c5c850b814/photo_20160727_094834.jpg,https://cityworker.cityofboston.gov:8443/attachments/report/5798bc4870b477fe9e361327/closed_photo/Report.jpg,9 Standish St  Dorchester  MA  02124,8.0,03,4.0,B3,Greater Mattapan,8.0,Ward 14,1402,R2,9 Standish St,2124.0,Address,313908.0,42.2957,-71.0795,Citizens Connect App,"(42.2957, -71.0795)",-7912533.745840489,5205377.304256011,-7912533.745840489,5205377.304256011
41719,101001718570,02/17/2016 09:10:25 AM,02/18/2016 09:10:35 AM,02/17/2016 09:13:01 AM,ONTIME,Closed,Case Closed. Closed date : 2016-02-17 09:13:01.907 Case Resolved patched,Request for Pothole Repair,Public Works Department,Highway Maintenance,Request for Pothole Repair,PWDx_District 1B: North End,PWDx,https://cityworker.cityofboston.gov:8443/attachments/report/56c47f56d052af2717af15ff/photo/Report.jpg,https://cityworker.cityofboston.gov:8443/attachments/report/56c47f56d052af2717af15ff/closed_photo/Report.jpg,13 Bowdoin St  Boston  MA  02114,3.0,1B,1.0,A1,Beacon Hill,3.0,Ward 3,0306,CC,13 Bowdoin St,2114.0,Address,17539.0,42.3608,-71.0631,City Worker App,"(42.3608, -71.0631)",-7910708.1061914805,5215179.695704893,-7910708.1061914805,5215179.695704893
383754,101001071431,04/18/2014 03:29:07 PM,04/22/2014 03:29:07 PM,04/18/2014 08:02:08 PM,ONTIME,Closed,Case Closed Case Resolved emptied,Empty Litter Basket,Public Works Department,Highway Maintenance,Empty Litter Basket,PWDx_District 1C: Downtown,PWDx,,,1 Milk St  Boston  MA  02110,3.0,1C,1.0,A1,Downtown / Financial District,3.0,03,0306,C,1 Milk St,2110.0,Address,95424.0,42.3568,-71.0586,Constituent Call,"(42.3568, -71.0586)",-7910207.16848291,5214577.105577286,-7910207.16848291,5214577.105577286
794823,101001251963,01/22/2015 01:36:37 PM,01/26/2015 01:36:36 PM,01/22/2015 10:58:21 PM,ONTIME,Closed,Case Closed Case Resolved litter picked up,Requests for Street Cleaning,Public Works Department,Street Cleaning,Requests for Street Cleaning,PWDx_District 10B: Roxbury,PWDx,https://cityworker.cityofboston.gov:8443/attachments/report/54c14331d0522e4ef0e3349e/photo/Report.jpg,,154 Dudley St  Roxbury  MA  02119,7.0,10B,7.0,B2,Roxbury,13.0,Ward 8,0804,C,154 Dudley St,2119.0,Address,155867.0,42.3288,-71.0832,City Worker App,"(42.3288, -71.0832)",-7912945.627956424,5210360.04817736,-7912945.627956424,5210360.04817736
265448,101001907210,09/13/2016 10:09:00 AM,09/14/2016 10:09:18 AM,09/14/2016 02:34:07 PM,OVERDUE,Closed,Case Closed. Closed date : 2016-09-14 14:34:07.747 Case Resolved INSTALLED 2 NEW CONTACTORS HAD TO REWIRE ALMOST ENTIRE PANEL BOARD INSTALLED NEW CABINET OLD ONE WAS BROKEN AT BASE AND COULD EASILY FALL OVER BG MD DP 301L 702L,PRINTED : All of the lights from Chelsea and Terminal to Chelsea and Medford-printed RT,Public Works Department,Street Lights,Major System Failure,PWDx_Major System Failure,PWDx,,,INTERSECTION of Chelsea St & Terminal St  Boston  MA,3.0,,0.0,,,0.0,0,,,INTERSECTION Chelsea St & Terminal St,,Intersection,18040.0,42.3594,-71.0587,Constituent Call,"(0, 0)",-7910218.300431989,5214968.784796895,-7910218.300431989,5214968.784796895
370360,101001948547,11/09/2016 10:05:07 AM,11/10/2016 10:05:07 AM,11/09/2016 10:55:29 AM,ONTIME,Closed,Case Closed. Closed date : 2016-11-09 10:55:29.663 Case Noted Material serviced,Missed Recycling: District 1A,Public Works Department,Sanitation,Missed Trash/Recycling/Yard Waste/Bulk Item,PWDx_Missed Trash\Recycling\Yard Waste\Bulk Item,PWDx,,https://cityworker.cityofboston.gov:8443/attachments/report/58233b64d052fb55f546cfa8/closed_photo/Report.jpg,2 Lawnwood Pl  Charlestown  MA  02129,3.0,1A,1.0,A15,Charlestown,2.0,Ward 2,0206,CD,2 Lawnwood Pl,2129.0,Address,84483.0,42.3771,-71.0658,Self Service,"(42.3771, -71.0658)",-7911008.668816621,5217635.647238048,-7911008.668816621,5217635.647238048
360348,101000771256,02/10/2013 07:30:00 PM,02/13/2013 08:30:00 AM,02/17/2013 01:37:40 PM,OVERDUE,Closed,Case Closed Case Resolved  ADDRESSED,Request for Snow Plowing,Public Works Department,Street Cleaning,Request for Snow Plowing,PWDx_District 1B: North End,PWDx,,,19 Salutation St  Boston  MA  02109,3.0,1B,1.0,A1,Downtown / Financial District,3.0,Ward 3,0301,CD,19 Salutation St,2109.0,Address,122084.0,42.36600000000001,-71.0523,Self Service,"(42.366, -71.0523)",-7909505.855690912,5215963.12022389,-7909505.855690912,5215963.12022389
640917,101001800440,05/26/2016 06:20:32 PM,05/31/2016 08:30:00 AM,05/27/2016 10:09:28 AM,ONTIME,Closed,Case Closed. Closed date : 2016-05-27 10:09:28.483 Case Resolved pickwd up,Missed Recycling: District 05,Public Works Department,Sanitation,Missed Trash/Recycling/Yard Waste/Bulk Item,PWDx_Missed Trash\Recycling\Yard Waste\Bulk Item,PWDx,,https://cityworker.cityofboston.gov:8443/attachments/report/574776f9d052e5e0f4d83877/closed_photo/Report.jpg,15 Ward St  South Boston  MA  02127,6.0,05,2.0,C6,South Boston / South Boston Waterfront,5.0,07,0706,,15 Ward St,2127.0,Address,344634.0,42.3299,-71.0551,Self Service,"(42.3299, -71.0551)",-7909817.550265132,5210525.682856468,-7909817.550265132,5210525.682856468
458194,101000729595,01/01/2013 04:21:27 PM,,01/08/2013 09:49:25 PM,ONTIME,Closed,Case Closed Bulk Item Automation,Schedule Bulk Item Pickup,Public Works Department,Sanitation,Schedule a Bulk Item Pickup SS,PWDx_Schedule a Bulk Item Pickup,PWDx,,,77 W Milton St  Hyde Park  MA  02136,12.0,08,5.0,E18,Hyde Park,10.0,Ward 18,1820,R1,77 W Milton St,2136.0,Address,95931.0,42.2389,-71.1382,Self Service,"(42.2389, -71.1382)",-7919068.199950053,5196832.954347801,-7919068.199950053,5196832.954347801
214749,101001921301,09/30/2016 10:38:00 AM,10/03/2016 10:38:46 AM,,OVERDUE,Open,,Sidewalk Repair (Make Safe),Public Works Department,Highway Maintenance,Sidewalk Repair (Make Safe),PWDx_Roadway Repair_Reconstruction,PWDx,,,46 Neponset Ave  Roslindale  MA  02131,12.0,02,6.0,E18,Jamaica Plain,10.0,Ward 19,1912,R2,46 Neponset Ave,2131.0,Address,281314.0,42.2866,-71.1165,Constituent Call,"(42.2866, -71.1165)",-7916652.566999841,5204007.885054252,-7916652.566999841,5204007.885054252
175155,101001839214,06/19/2016 09:56:00 AM,08/03/2016 09:56:41 AM,06/20/2016 08:29:38 AM,ONTIME,Closed,Case Closed. Closed date : 2016-06-20 08:29:38.997 Case Resolved installed new pole door 301L 803L,PRINTED : //md//,Public Works Department,Street Lights,General Lighting Request,PWDx_Street Light_General Lighting Request,PWDx,https://cityworker.cityofboston.gov:8443/attachments/report/5766a493d05203d28ce9b3aa/photo/Report.jpg,https://cityworker.cityofboston.gov:8443/attachments/report/5766a493d05203d28ce9b3aa/closed_photo/Report.jpg,55 Roxbury St  Mission Hill  MA  02120,9.0,10B,7.0,B2,Mission Hill,13.0,09,0905,,55 Roxbury St,2120.0,Address,347575.0,42.3303,-71.0861,City Worker App,"(42.3303, -71.0861)",-7913268.454479725,5210585.914367027,-7913268.454479725,5210585.914367027
865221,101001601193,09/30/2015 07:14:35 AM,10/01/2015 07:14:35 AM,09/30/2015 11:27:06 AM,ONTIME,Closed,Case Closed. Closed date : 2015-09-30 11:27:06.427 Case Resolved,Traffic Signal Inspection,Transportation - Traffic Division,Signs & Signals,Traffic Signal Inspection,BTDT_Traffic Signal_Repair,BTDT,,,INTERSECTION of Parker St & Ruggles St  Boston  MA,9.0,10A,7.0,B2,Fenway / Kenmore / Audubon Circle / Longwood,13.0,Ward 4,0409,,INTERSECTION Parker St & Ruggles St,,Intersection,7811.0,42.336999999999996,-71.0937,Citizens Connect App,"(42.337, -71.0937)",-7914114.4826097535,5211594.849114661,-7914114.4826097535,5211594.849114661
496325,101000459977,08/03/2012 01:14:32 PM,,08/03/2012 01:14:32 PM,ONTIME,Closed,Case Closed Internal Case Performed by Highway Maintenance crew.,Pothole Repair (Internal),Public Works Department,Highway Maintenance,Pothole Repair (Internal),PWDx_District 10B: Roxbury,PWDx,,,INTERSECTION of Saint Richards St & Walnut Ave  Roxbury  MA,7.0,10B,7.0,B2,Roxbury,13.0,Ward 12,1201,,INTERSECTION Saint Richards St & Walnut Ave,,Intersection,8258.0,42.3236,-71.0841,Employee Generated,"(42.3236, -71.0841)",-7913045.815498139,5209577.087083008,-7913045.815498139,5209577.087083008
262413,101001912085,09/19/2016 08:39:21 AM,09/20/2016 08:39:19 AM,09/19/2016 09:08:45 AM,ONTIME,Closed,Case Closed. Closed date : 2016-09-19 09:08:45.387 Case Resolved brought back to store,Requests for Street Cleaning,Public Works Department,Street Cleaning,Requests for Street Cleaning,PWDx_District 08: Hyde Park,PWDx,https://cityworker.cityofboston.gov:8443/attachments/report/57dfdc75d0521ab3892333e6/photo/Report.jpg,,INTERSECTION of Edgewater Dr & Tesla St  Mattapan  MA,8.0,08,5.0,B3,Greater Mattapan,9.0,18,1804,,INTERSECTION Edgewater Dr & Tesla St,,Intersection,10367.0,42.3594,-71.0587,City Worker App,"(0, 0)",-7910218.300431989,5214968.784796895,-7910218.300431989,5214968.784796895
669926,101001371868,05/06/2015 05:16:00 PM,05/08/2015 08:30:00 AM,05/08/2015 06:49:36 AM,ONTIME,Closed,Case Closed. Closed date : 2015-05-08 06:49:36.727 Case Resolved potholes filled,Request for Pothole Repair,Public Works Department,Highway Maintenance,Request for Pothole Repair,PWDx_District 1C: Downtown,PWDx,https://mayors24.cityofboston.gov/media/boston/report/photos/554a8488048526fa202caa4b/report.jpg,,INTERSECTION of Atlantic Ave & State St  Boston  MA,3.0,1C,1.0,A1,Downtown / Financial District,3.0,Ward 3,301.0,,INTERSECTION Atlantic Ave & State St,,Intersection,737.0,42.3596,-71.0518,Citizens Connect App,"(42.3596, -71.0518)",-7909450.195945515,5214998.914638905,-7909450.195945515,5214998.914638905
350939,101001586652,09/23/2015 11:59:41 PM,10/08/2015 08:30:00 AM,09/24/2015 07:07:30 AM,ONTIME,Closed,Case Closed. Closed date : 2015-09-24 07:07:30.133 Case Noted blue leg has a derict shot (car parking on the pole box) we ll come back tonight,Street Light Outages,Public Works Department,Street Lights,Street Light Outages,PWDx_Street Light Outages,PWDx,,,47 E Concord St  Roxbury  MA  02118,4.0,1C,2.0,D4,South End,6.0,Ward 8,0802,R4,47 E Concord St,2118.0,Address,41832.0,42.3368,-71.0739,Citizens Connect App,"(42.3368, -71.0739)",-7911910.356692046,5211564.730103104,-7911910.356692046,5211564.730103104
224657,101001610286,10/12/2015 07:28:00 PM,10/14/2015 08:30:00 AM,10/12/2015 09:47:44 PM,ONTIME,Closed,Case Closed. Closed date : 2015-10-12 21:47:44.867 Case Resolved pick up dead animal.,Pick up Dead Animal,Public Works Department,Street Cleaning,Pick up Dead Animal,PWDx_District 10A: Roxbury,PWDx,,https://cityworker.cityofboston.gov:8443/attachments/report/561c4327d052ad6c08016d6c/closed_photo/Report.jpg,465 Huntington Ave  Boston  MA  02115,4.0,10A,7.0,D4,Boston,13.0,04,0409,E,465 Huntington Ave,2115.0,Address,76373.0,42.3396,-71.0942,Constituent Call,"(42.3396, -71.0942)",-7914170.14235515,5211986.4049821645,-7914170.14235515,5211986.4049821645
401229,101001135568,07/23/2014 01:52:27 PM,,07/28/2014 04:38:11 PM,ONTIME,Closed,Case Closed Bulk Item Automation,Schedule Bulk Item Pickup,Public Works Department,Sanitation,Schedule a Bulk Item Pickup SS,PWDx_Schedule a Bulk Item Pickup,PWDx,,,229 Vermont St  West Roxbury  MA  02132,12.0,06,6.0,E5,West Roxbury,12.0,Ward 20,2017,R1,229 Vermont St,2132.0,Address,139986.0,42.288000000000004,-71.1648,Self Service,"(42.288, -71.1648)",-7922029.298405155,5204218.552054551,-7922029.298405155,5204218.552054551
23618,101000385673,02/17/2012 02:11:03 PM,,02/17/2012 02:11:43 PM,ONTIME,Closed,Case Closed Internal Case,Highway Maintenance,Public Works Department,Highway Maintenance,Highway Maintenance,PWDx_District 04: Allston/Brighton,PWDx,,,121 Brayton Rd  Brighton  MA  02135,11.0,04,9.0,D14,Allston / Brighton,15.0,Ward 22,2204,R1,121 Brayton Rd,2135.0,Address,19609.0,42.3495,-71.1724,Employee Generated,"(42.3495, -71.1724)",-7922875.326535184,5213477.477460036,-7922875.326535184,5213477.477460036
801989,101001335815,03/18/2015 08:22:28 AM,,03/18/2015 08:22:29 AM,ONTIME,Closed,Case Closed Internal Case Performed by Highway Maintenance crew.,Pothole Repair (Internal),Public Works Department,Highway Maintenance,Pothole Repair (Internal),PWDx_District 06: West Roxbury and Roslindale,PWDx,,,71 Manthorne Rd  West Roxbury  MA  02132,9.0,06,6.0,E5,West Roxbury,10.0,Ward 20,2007,R2,71 Manthorne Rd,2132.0,Address,89176.0,42.2894,-71.1512,Employee Generated,"(42.2894, -71.1512)",-7920515.353330366,5204429.223736858,-7920515.353330366,5204429.223736858
571725,101000458488,08/01/2012 08:30:22 AM,08/31/2012 08:30:22 AM,08/29/2012 12:08:34 PM,ONTIME,Closed,Case Closed VIOISS: Violation Filed,Rodent Activity,Inspectional Services,Environmental Services,Rodent Activity,ISD_Environmental Services (INTERNAL),ISD,,,15-17 Alcott St  Allston  MA  02134,11.0,04,9.0,D14,Allston / Brighton,15.0,Ward 22,2202,R2,15-17 Alcott St,2134.0,Address,1738.0,42.3579,-71.1327,Constituent Call,"(42.3579, -71.1327)",-7918455.942750691,5214742.814038565,-7918455.942750691,5214742.814038565
4171,101001338738,03/20/2015 05:50:39 PM,04/08/2015 08:30:00 AM,04/06/2015 02:44:39 PM,ONTIME,Closed,Case Closed Case Resolved passed inspection 3/30/2015.,Abandoned Vehicles,Transportation - Traffic Division,Enforcement & Abandoned Vehicles,Abandoned Vehicles,BTDT_AVRS Interface Queue,BTDT,,,18 Monponset St  Mattapan  MA  02126,8.0,08,5.0,E18,Hyde Park,9.0,Ward 18,1805,R1,18 Monponset St,2126.0,Address,96422.0,42.2639,-71.0996,Constituent Call,"(42.2639, -71.0996)",-7914771.267605433,5200592.723252599,-7914771.267605433,5200592.723252599
745212,101000404969,04/05/2012 01:50:34 PM,05/20/2012 01:50:34 PM,04/06/2012 10:56:50 AM,ONTIME,Closed,Case Closed Case Resolved this location is in design and should start construction by Spring of 2013.,New Sign  Crosswalk or Pavement Marking,Transportation - Traffic Division,Signs & Signals,New Sign  Crosswalk or Pavement Marking,BTDT_Engineering_Request for Traffic Signal Study or Review,BTDT,,,INTERSECTION of New England Ave & Norwell St  Dorchester  MA,8.0,07,4.0,B3,Dorchester,9.0,Ward 17,1705,,INTERSECTION New England Ave & Norwell St,,Intersection,7540.0,42.2917,-71.0772,Self Service,"(42.2917, -71.0772)",-7912277.711011664,5204775.337380063,-7912277.711011664,5204775.337380063
345504,101001439441,07/29/2015 01:06:00 PM,08/12/2015 01:06:00 PM,07/29/2015 01:11:09 PM,ONTIME,Closed,Case Closed. Closed date : 2015-07-29 13:11:09.99 Case Resolved REPLACED MANTLES AND TOP    D.WEBB / M.DOYLE,Street Light Outages,Public Works Department,Street Lights,Street Light Outages,PWDx_Street Light Outages,PWDx,,,0 Havre St  East Boston  MA  02128,1.0,09,1.0,A7,East Boston,1.0,Ward 1,0104,E,0 Havre St,2128.0,Address,71367.0,42.3594,-71.0587,Employee Generated,"(0, 0)",-7910218.300431989,5214968.784796895,-7910218.300431989,5214968.784796895
530200,101001579131,09/15/2015 01:07:00 PM,09/29/2015 01:07:00 PM,10/21/2015 03:31:02 PM,OVERDUE,Closed,Case Closed. Closed date : 2015-10-21 15:31:02.087 Case Resolved lights on at location,Street Light Outages//sent to contractor,Public Works Department,Street Lights,Street Light Outages,PWDx_Street Light_Pending_Contractor (Internal),PWDx,,,270 Commonwealth Ave  Boston  MA  02116,4.0,1C,8.0,D4,Back Bay,14.0,05,0508,,270 Commonwealth Ave,2116.0,Address,348072.0,42.35,-71.0837,Employee Generated,"(42.35, -71.0837)",-7913001.287701819,5213552.790380158,-7913001.287701819,5213552.790380158
787689,101001581294,09/17/2015 11:15:00 AM,09/22/2015 11:15:14 AM,09/21/2015 03:35:08 PM,ONTIME,Closed,Case Closed. Closed date : 2015-09-21 15:35:08.397 ADCLSD: Administratively Closed,Building Inspection Request,Inspectional Services,Building,Building Inspection Request,ISD_Building (INTERNAL),ISD,,,200 State St  Boston  MA  02109,3.0,1B,1.0,A1,Downtown / Financial District,3.0,Ward 3,0306,CM,200 State St,2109.0,Address,130418.0,42.36,-71.0532,Constituent Call,"(42.36, -71.0532)",-7909606.043232625,5215059.174610621,-7909606.043232625,5215059.174610621
561808,101001215605,11/12/2014 09:49:09 AM,12/12/2014 09:49:09 AM,11/26/2014 08:50:20 AM,ONTIME,Closed,Case Closed CORR: Corrected,Rodent Activity,Inspectional Services,Environmental Services,Rodent Activity,ISD_Environmental Services (INTERNAL),ISD,,,44 Boylston St  Jamaica Plain  MA  02130,9.0,02,6.0,E13,Jamaica Plain,11.0,Ward 19,1901,R3,44 Boylston St,2130.0,Address,18574.0,42.3181,-71.1082,Constituent Call,"(42.3181, -71.1082)",-7915728.615226256,5208749.025573346,-7915728.615226256,5208749.025573346
134338,101000912502,08/28/2013 01:45:10 PM,09/25/2013 01:45:09 PM,09/06/2013 11:10:38 AM,ONTIME,Closed,Case Closed Case Resolved Case resolved. New cart delivered 9/06. Ser: 513# 9003637,Request for Recycling Cart,Public Works Department,Recycling,Request for Recycling Cart,PWDx_Recycling,PWDx,,,20 Temple St  Mattapan  MA  02126,8.0,07,3.0,B3,Dorchester,7.0,Ward 17,1714,R1,20 Temple St,2126.0,Address,134202.0,42.2726,-71.0725,Constituent Call,"(42.2726, -71.0725)",-7911754.509404937,5201901.472488165,-7911754.509404937,5201901.472488165
940374,101001981902,01/04/2017 08:56:00 PM,01/04/2018 08:56:50 PM,02/27/2017 10:27:59 AM,ONTIME,Closed,Case Closed. Closed date : 2017-02-27 10:27:59.663 Case Noted Duplicate of case ref 2003689,Tree Maintenance Requests,Parks & Recreation Department,Trees,Tree Maintenance Requests,PARK_New Tree Requests,PARK,https://mayors24.cityofboston.gov/media/boston/report/photos/586da7e304852b784b71cd71/report.jpg,,INTERSECTION of Cottage St & Cottage Street Pl  East Boston  MA,1.0,09,1.0,A7,East Boston,1.0,1,0103,,INTERSECTION Cottage St & Cottage Street Pl,,Intersection,18627.0,42.3594,-71.0587,Citizens Connect App,"(0, 0)",-7910218.300431989,5214968.784796895,-7910218.300431989,5214968.784796895
57382,101000384737,02/15/2012 02:39:40 PM,,02/15/2012 02:41:02 PM,ONTIME,Closed,Case Closed Case Invalid test case,Abandoned Bicycle,Mayor's 24 Hour Hotline,Abandoned Bicycle,Abandoned Bicycle,BTDT_Abandoned Bicycle,BTDT,,,142 Wordsworth St  East Boston  MA  02128,1.0,09,1.0,A7,East Boston,1.0,Ward 1,0112,R1,142 Wordsworth St,2128.0,Address,152606.0,42.3831,-71.0144,Constituent Call,"(42.3831, -71.0144)",-7905286.846989846,5218539.838985689,-7905286.846989846,5218539.838985689
138388,101000704700,11/12/2012 03:05:52 PM,,11/13/2012 06:11:39 AM,ONTIME,Closed,Case Closed Case Noted Replaced with CRM SR # 704872. Thank you for using the system.,Schedule a Bulk Item Pickup,Public Works Department,Sanitation,Schedule a Bulk Item Pickup,PWDx_Schedule a Bulk Item Pickup,PWDx,,,100 City Hall Plz  Boston  MA  02108,3.0,1B,1.0,A1,Downtown / Financial District,3.0,Ward 3,0306,C,100 City Hall Plz,2108.0,Address,158266.0,42.3595,-71.0588,Self Service,"(42.3595, -71.0588)",-7910229.432381068,5214983.849705914,-7910229.432381068,5214983.849705914
693575,101001167530,09/09/2014 06:50:06 AM,09/10/2014 08:30:00 AM,09/10/2014 08:41:06 AM,OVERDUE,Closed,Case Closed Case Resolved Picked up by Paul Boyd,Pick up Dead Animal,Public Works Department,Street Cleaning,Pick up Dead Animal,PWDx_District 1B: North End,PWDx,,,71 Chestnut St  Boston  MA  02108,3.0,1B,8.0,A1,Beacon Hill,14.0,Ward 5,0505,CM,71 Chestnut St,2108.0,Address,31464.0,42.3569,-71.0708,Constituent Call,"(42.3569, -71.0708)",-7911565.266270587,5214592.169862997,-7911565.266270587,5214592.169862997
604515,101000435026,06/11/2012 12:03:31 PM,,06/11/2012 12:03:32 PM,ONTIME,Closed,Case Closed Internal Case Performed by Highway Maintenance crew.,Pothole Repair (Internal),Public Works Department,Highway Maintenance,Pothole Repair (Internal),PWDx_District 06: West Roxbury and Roslindale,PWDx,,,165 Hackensack Rd  Chestnut Hill  MA  02467,9.0,06,6.0,E5,West Roxbury,12.0,Ward 20,2006,R1,165 Hackensack Rd,2467.0,Address,67970.0,42.2984,-71.1448,Employee Generated,"(42.2984, -71.1448)",-7919802.9085892895,5205783.653511779,-7919802.9085892895,5205783.653511779
410776,101000886494,07/24/2013 02:04:26 PM,10/22/2013 02:04:25 PM,07/09/2014 09:25:34 AM,OVERDUE,Closed,Case Closed Case Resolved,Pavement Marking Maintenance,Transportation - Traffic Division,Operations,Pavement Marking Maintenance,BTDT_Pavement Marking_Maintenance,BTDT,,,INTERSECTION of Congress St & State St  Boston  MA,3.0,1C,1.0,A1,Downtown / Financial District,3.0,Ward 3,0306,,INTERSECTION Congress St & State St,,Intersection,3431.0,42.3589,-71.0568,Constituent Call,"(42.3589, -71.0568)",-7910006.793399481,5214893.460611436,-7910006.793399481,5214893.460611436
264483,101001619136,10/23/2015 01:11:00 PM,10/26/2015 01:11:13 PM,10/23/2015 02:27:46 PM,ONTIME,Closed,Case Closed. Closed date : 2015-10-23 14:27:46.333 Case Resolved THE car was overtimed  will go  back in 2 hours,Parking Enforcement,Transportation - Traffic Division,Enforcement & Abandoned Vehicles,Parking Enforcement,BTDT_Parking Enforcement,BTDT,,,16 Gladstone St  East Boston  MA  02128,1.0,09,1.0,A7,East Boston,1.0,Ward 1,0113,R1,16 Gladstone St,2128.0,Address,63822.0,42.388999999999996,-71.0004,Constituent Call,"(42.389, -71.0004)",-7903728.374118741,5219429.045136185,-7903728.374118741,5219429.045136185
513432,101001791295,05/16/2016 03:25:00 PM,,05/19/2016 04:33:56 PM,ONTIME,Closed,Case Closed. Closed date : 2016-05-19 16:33:56.02 Bulk Item Automation,Schedule a Bulk Item Pickup,Public Works Department,Sanitation,Schedule a Bulk Item Pickup,PWDx_Schedule a Bulk Item Pickup,PWDx,,,46 Catawba St  Roxbury  MA  02119,9.0,10B,7.0,B2,Roxbury,13.0,Ward 12,1205,R2,46 Catawba St,2119.0,Address,373989.0,42.32,-71.0844,Constituent Call,"(42.32, -71.0844)",-7913079.2113453755,5209035.075002586,-7913079.2113453755,5209035.075002586
416389,101001177559,09/21/2014 01:00:53 PM,09/10/2016 01:00:53 PM,03/31/2015 08:27:24 AM,ONTIME,Closed,Case Closed Case Resolved Case was never closed. Tree was planted by Leahy Landscaping in the fall of 2014.,New Tree Requests,Parks & Recreation Department,Trees,New Tree Requests,PARK_New Tree Requests,PARK,,,15 Calvin Rd  Jamaica Plain  MA  02130,9.0,02,6.0,E13,Jamaica Plain,11.0,Ward 19,1902,R1,15 Calvin Rd,2130.0,Address,25024.0,42.3052,-71.1304,Self Service,"(42.3052, -71.1304)",-7918199.907921866,5206807.12884123,-7918199.907921866,5206807.12884123
646208,101000489697,10/09/2012 08:53:41 AM,02/06/2013 08:53:41 AM,,OVERDUE,Open,,Unsatisfactory Living Conditions,Inspectional Services,Housing,Unsatisfactory Living Conditions,ISD_Housing (INTERNAL),ISD,,,62 Williams St  Jamaica Plain  MA  02130,9.0,02,6.0,E13,Jamaica Plain,11.0,Ward 11,1107,R3,62 Williams St,2130.0,Address,337100.0,42.3061,-71.1068,Constituent Call,"(42.3061, -71.1068)",-7915572.767939146,5206942.597094849,-7915572.767939146,5206942.597094849
585382,101001500302,07/30/2015 02:44:00 PM,08/06/2015 02:44:33 PM,09/22/2015 03:06:45 PM,OVERDUE,Closed,Case Closed. Closed date : 2015-09-22 15:06:45.23 Case Resolved,Equipment Repair,Parks & Recreation Department,Park Maintenance & Safety,Equipment Repair,PARK_Maintenance_Trades,PARK,,,,,,,,,,,,,,,,,42.3594,-71.0587,Employee Generated,"(0, 0)",-7910218.300431989,5214968.784796895,-7910218.300431989,5214968.784796895
567361,101001719443,02/18/2016 09:09:00 AM,02/19/2016 09:09:31 AM,,OVERDUE,Open,,Unsafe/Dangerous Conditions,Inspectional Services,Building,Unsafe Dangerous Conditions,ISD_Building (INTERNAL),ISD,,,20 Linden St  Allston  MA  02134,11.0,04,9.0,D14,Allston / Brighton,15.0,Ward 21,2104,RC,20 Linden St,2134.0,Address,167091.0,42.3555,-71.1307,Constituent Call,"(42.3555, -71.1307)",-7918233.303769105,5214381.272044434,-7918233.303769105,5214381.272044434
168974,101001631577,11/09/2015 05:52:00 PM,11/25/2015 08:30:00 AM,,OVERDUE,Open,,Street Light Outages,Public Works Department,Street Lights,Street Light Outages,INFO01_GenericeFormforOtherServiceRequestTypes,INFO,https://mayors24.cityofboston.gov/media/boston/report/photos/564123b355a56d4e49dd5b00/report.jpg,,INTERSECTION of Minden St & Schiller St  Jamaica Plain  MA,9.0,10A,6.0,E13,Jamaica Plain,11.0,Ward 10,1006,,INTERSECTION Minden St & Schiller St,,Intersection,7337.0,42.3252,-71.1055,Citizens Connect App,"(42.3252, -71.1055)",-7915428.052601115,5209817.991295996,-7915428.052601115,5209817.991295996
502823,101001746969,03/15/2016 12:34:00 PM,05/18/2016 12:34:52 PM,03/18/2016 07:05:13 AM,ONTIME,Closed,Case Closed. Closed date : 2016-03-18 07:05:13.803 Case Resolved The graffiti tag at this location has been removed by the City of Boston Property Management Department.   This case number has been resolved and is closed.,Graffiti Removal,Property Management,Graffiti,Graffiti Removal,PROP_GRAF_GraffitiRemoval,PROP,https://mayors24.cityofboston.gov/media/boston/report/photos/56e839a56963bb640e5244cf/report.jpg,,20 Kneeland St  Boston  MA  02111,4.0,1C,2.0,A1,Downtown / Financial District,4.0,Ward 3,0308,C,20 Kneeland St,2111.0,Address,358725.0,42.3509,-71.0621,Citizens Connect App,"(42.3509, -71.0621)",-7910596.786700686,5213688.355146083,-7910596.786700686,5213688.355146083
492526,101000848241,05/28/2013 10:57:21 PM,05/30/2013 08:30:00 AM,05/30/2013 07:18:12 AM,ONTIME,Closed,Case Closed Case Resolved,Traffic Signal Repair,Transportation - Traffic Division,Signs & Signals,Traffic Signal Repair,BTDT_Traffic Signal_Repair,BTDT,,,INTERSECTION of Washington St & Lagrange St  Boston  MA,4.0,1C,2.0,A1,Downtown / Financial District,4.0,Ward 3,0308,,INTERSECTION Washington St & Lagrange St,,Intersection,6068.0,42.3515,-71.0628,Constituent Call,"(42.3515, -71.0628)",-7910674.710344241,5213778.7327350965,-7910674.710344241,5213778.7327350965
840188,101001969860,12/13/2016 10:47:41 PM,12/15/2016 08:30:00 AM,12/14/2016 06:09:23 AM,ONTIME,Closed,Case Closed. Closed date : 2016-12-14 06:09:23.743 Case Resolved Location has been made safe. This sidewalk will be referred for permanent repair. See case #101001969900 for status of the permanent repair.,Sidewalk Repair (Make Safe),Public Works Department,Highway Maintenance,Sidewalk Repair (Make Safe),PWDx_District 1B: North End,PWDx,https://mayors24.cityofboston.gov/media/boston/report/photos/5850c0d60485b8e8d344ed10/report.jpg,,INTERSECTION of Somerset St & Beacon St  Boston  MA,3.0,1B,2.0,A1,Downtown / Financial District,3.0,3,0306,,INTERSECTION Somerset St & Beacon St,,Intersection,17596.0,42.3594,-71.0587,Citizens Connect App,"(0, 0)",-7910218.300431989,5214968.784796895,-7910218.300431989,5214968.784796895
279941,101001697466,01/20/2016 04:52:00 PM,,01/25/2016 04:32:10 PM,ONTIME,Closed,Case Closed. Closed date : 2016-01-25 16:32:10.69 Bulk Item Automation,Schedule a Bulk Item Pickup,Public Works Department,Sanitation,Schedule a Bulk Item Pickup,PWDx_Schedule a Bulk Item Pickup,PWDx,,,32 Brookledge St  Dorchester  MA  02121,9.0,10B,7.0,B2,Roxbury,13.0,Ward 12,1207,R3,32 Brookledge St,2121.0,Address,197299.0,42.3099,-71.09,Constituent Call,"(42.3099, -71.09)",-7913702.6004938185,5207514.595518204,-7913702.6004938185,5207514.595518204
627978,101001762795,04/06/2016 07:21:06 PM,04/08/2016 08:30:00 AM,04/06/2016 08:01:40 PM,ONTIME,Closed,Case Closed. Closed date : 2016-04-06 20:01:40.18 Case Resolved officers said this vehicle was not at this location at this time they will monitor.,Parking Enforcement,Transportation - Traffic Division,Enforcement & Abandoned Vehicles,Parking Enforcement,BTDT_Parking Enforcement,BTDT,,,115 Old Harbor St  South Boston  MA  02127,6.0,05,2.0,C6,South Boston / South Boston Waterfront,5.0,07,0704,E,115 Old Harbor St,2127.0,Address,286732.0,42.331,-71.0476,Citizens Connect App,"(42.331, -71.0476)",-7908982.654084184,5210691.320432174,-7908982.654084184,5210691.320432174
72066,101001403979,06/06/2015 08:08:00 PM,06/09/2015 08:30:00 AM,06/08/2015 11:26:33 AM,ONTIME,Closed,Case Closed Case Noted  Please contact the PWD Commissioner's Office at 617-635-4900 regarding your concern. *no constituent information provided for call back*,Request for Pothole Repair,Public Works Department,Highway Maintenance,Request for Pothole Repair,PWDx_Administration,PWDx,,,12 Stimson St  West Roxbury  MA  02132,12.0,06,6.0,E5,West Roxbury,12.0,Ward 20,2015,R1,12 Stimson St,2132.0,Address,130656.0,42.2596,-71.1573,Citizens Connect App,"(42.2596, -71.1573)",-7921194.402224206,5199945.936871589,-7921194.402224206,5199945.936871589
674622,101000361269,12/07/2011 10:46:16 AM,,,ONTIME,Open,,Other: Compliment,Mayor's 24 Hour Hotline,Employee & General Comments,General Comments For An Employee,INFO_General Comments Complaints Compliments,INFO,,,,,,,,,,,,,,,,,42.3594,-71.0587,Constituent Call,"(0, 0)",-7910218.300431989,5214968.784796895,-7910218.300431989,5214968.784796895
738122,101001428144,07/13/2015 11:35:00 AM,07/12/2016 11:35:03 AM,11/01/2016 08:13:45 AM,OVERDUE,Closed,Case Closed. Closed date : 2016-11-01 08:13:45.66 Case Resolved Sidewalk repaired 10/2016    If you have any further questions  or feel that this case was closed in error  please do not hesitate to contact me.    Michael Somers  Senior Civil Engineer  Construction Management Division  Boston Public Works  617-635-3831	  Michael.Somers@Boston.gov,Sidewalk Repair,Public Works Department,Highway Maintenance,Sidewalk Repair,PWDx_Highway Construction,PWDx,,,19 Stock St  Dorchester  MA  02122,8.0,07,3.0,C11,Dorchester,7.0,16,1609,CD,19 Stock St,2122.0,Address,130729.0,42.3594,-71.0587,Employee Generated,"(0, 0)",-7910218.300431989,5214968.784796895,-7910218.300431989,5214968.784796895
800626,101000869037,06/27/2013 04:09:01 PM,07/01/2013 04:09:01 PM,06/28/2013 08:45:41 AM,ONTIME,Closed,Case Closed Case Noted During my inspection  I did not notice any recycling carts our on curbside 6/28. Please have out next week on time for collection,Missed Recycling: District 07,Public Works Department,Sanitation,Missed Trash/Recycling/Yard Waste/Bulk Item,PWDx_Missed Trash\Recycling\Yard Waste\Bulk Item,PWDx,,,1884-1896 Dorchester Ave  Dorchester  MA  02124,8.0,07,3.0,C11,Dorchester,7.0,Ward 16,1606,C,1884-1896 Dorchester Ave,2124.0,Address,48445.0,42.2864,-71.0639,Constituent Call,"(42.2864, -71.0639)",-7910797.161784114,5203977.790150681,-7910797.161784114,5203977.790150681
723901,101001014363,01/29/2014 12:33:57 PM,01/31/2014 12:33:56 PM,01/29/2014 02:41:13 PM,ONTIME,Closed,Case Closed Case Resolved,Request for Pothole Repair,Public Works Department,Highway Maintenance,Request for Pothole Repair,PWDx_District 08: Hyde Park,PWDx,,,INTERSECTION of Milton Ave & Summit St  Hyde Park  MA,12.0,08,5.0,E18,Hyde Park,10.0,Ward 18,1816,,INTERSECTION Milton Ave & Summit St,,Intersection,7312.0,42.2508,-71.1117,City Worker App,"(42.2508, -71.1117)",-7916118.233444031,5198622.418501765,-7916118.233444031,5198622.418501765
466932,101001308189,02/20/2015 09:21:38 AM,02/24/2015 09:21:38 AM,04/13/2015 05:21:30 PM,OVERDUE,Closed,Case Closed Case Noted Thank you for your request. This service request is now considered closed due to the recent arrival of Spring. The City worked around the clock this winter to address the record-breaking snowfall and we hope that many of your concerns were resolved. We encourage you to let us know of any additional issues and thank you for working with us to make the City a better place. Thank you for your patience and we apologize for any requests that we were not able to get to.,Request for Snow Plowing,Public Works Department,Street Cleaning,Request for Snow Plowing,PWDx_District 07: South Dorchester,PWDx,,,23 Becket St  Dorchester  MA  02124,8.0,07,3.0,C11,Dorchester,7.0,Ward 16,1611,R1,23 Becket St,2124.0,Address,13055.0,42.2808,-71.0646,Constituent Call,"(42.2808, -71.0646)",-7910875.085427669,5203135.171637715,-7910875.085427669,5203135.171637715
8435,101000937988,10/01/2013 10:43:49 AM,10/03/2013 10:43:49 AM,10/01/2013 03:00:14 PM,ONTIME,Closed,Case Closed Case Resolved,sidewalk make safe,Public Works Department,Highway Maintenance,Request for Pothole Repair,PWDx_District 03: North Dorchester,PWDx,,,12 Nottingham St  Dorchester  MA  02121,7.0,03,4.0,C11,Dorchester,8.0,Ward 14,1404,R2,12 Nottingham St,2121.0,Address,104201.0,42.3013,-71.0738,City Worker App,"(42.3013, -71.0738)",-7911899.224742968,5206220.122119645,-7911899.224742968,5206220.122119645
322718,101001713543,02/09/2016 02:54:00 PM,02/17/2016 02:54:09 PM,02/09/2016 05:09:03 PM,ONTIME,Closed,Case Closed. Closed date : 2016-02-09 17:09:03.313 Case Resolved No violation. Sidewalk has been cleared.,Unshoveled Sidewalk,Public Works Department,Code Enforcement,Unshoveled Sidewalk,PWDx_Code Enforcement,PWDx,,https://cityworker.cityofboston.gov:8443/attachments/report/56ba4431d0523dfc52f5246a/closed_photo/Report.jpg,INTERSECTION of Gove St & Meridian St  East Boston  MA,1.0,09,1.0,A7,East Boston,1.0,1,0104,,INTERSECTION Gove St & Meridian St,,Intersection,16668.0,42.3594,-71.0587,Constituent Call,"(0, 0)",-7910218.300431989,5214968.784796895,-7910218.300431989,5214968.784796895
226692,101001299337,02/16/2015 06:11:19 PM,02/18/2015 08:30:00 AM,02/17/2015 09:21:32 AM,ONTIME,Closed,Case Closed Case Noted  Trash collection resumes on a holiday schedule.  Please make sure your trash and recycling are out for collection by 7 am and is accessible  do not put BEHIND  snowpiles.   Thank you for your patience as we make every effort to service your area.,Missed Trash: District 10A,Public Works Department,Sanitation,Missed Trash/Recycling/Yard Waste/Bulk Item,PWDx_Missed Trash\Recycling\Yard Waste\Bulk Item,PWDx,,,19-21 Priesing St  Jamaica Plain  MA  02130,9.0,10A,6.0,E13,Jamaica Plain,11.0,Ward 10,1007,R2,19-21 Priesing St,2130.0,Address,112746.0,42.3217,-71.1037,Self Service,"(42.3217, -71.1037)",-7915227.677517686,5209291.021287154,-7915227.677517686,5209291.021287154
123820,101001234957,12/17/2014 04:54:13 PM,12/19/2014 04:54:13 PM,12/18/2014 09:43:45 AM,ONTIME,Closed,Case Closed Case Resolved deliver recycle sticker on .12/18/14.,Sticker Request,Public Works Department,Recycling,Sticker Request,PWDx_Sticker Request,PWDx,,,673-675 Washington St  Brighton  MA  02135,11.0,04,9.0,D14,Allston / Brighton,15.0,Ward 22,2213,R2,673-675 Washington St,2135.0,Address,143672.0,42.3519,-71.1706,Self Service,"(42.3519, -71.1706)",-7922674.951451755,5213838.984940407,-7922674.951451755,5213838.984940407
749321,101001397851,05/29/2015 09:51:00 AM,05/18/2017 09:51:46 AM,06/02/2015 02:34:56 PM,ONTIME,Closed,Case Closed. Closed date : 2015-06-02 14:34:56.09 NOVIO: No Violation Found/No Cause,Contractors Complaint,Inspectional Services,Building,Contractors Complaint,ISD_Building (INTERNAL),ISD,,,103 Ninth St  Charlestown  MA  02129,3.0,1A,1.0,A15,Charlestown,2.0,02,0202,,103 Ninth St,2129.0,Address,343904.0,42.3756,-71.0517,Constituent Call,"(42.3756, -71.0517)",-7909439.063996435,5217409.612800196,-7909439.063996435,5217409.612800196
603015,101001376925,05/13/2015 03:55:00 PM,05/18/2015 03:55:56 PM,05/28/2015 08:58:58 AM,OVERDUE,Closed,Case Closed. Closed date : 2015-05-28 08:58:58.03 ADCLSD: Administratively Closed,Building Inspection Request,Inspectional Services,Building,Building Inspection Request,ISD_Building (INTERNAL),ISD,,,251 Lamartine St  Jamaica Plain  MA  02130,9.0,02,6.0,E13,Jamaica Plain,11.0,Ward 19,1904,R2,251 Lamartine St,2130.0,Address,83540.0,42.3147,-71.1064,Constituent Call,"(42.3147, -71.1064)",-7915528.240142827,5208237.169202712,-7915528.240142827,5208237.169202712
261258,101001847687,06/29/2016 10:47:00 AM,06/29/2017 10:47:58 AM,07/25/2016 09:48:35 AM,ONTIME,Closed,Case Closed. Closed date : 2016-07-25 09:48:35.923 Case Resolved The tree was pruned by Northern Tree Service  to the City of Boston tree pruning specifications.,Tree Maintenance Requests,Parks & Recreation Department,Trees,Tree Maintenance Requests,PARK_Tree Maintenance Request,PARK,,,15 Becket St  Dorchester  MA  02124,8.0,07,3.0,C11,Dorchester,7.0,Ward 16,1611,R1,15 Becket St,2124.0,Address,13049.0,42.2812,-71.0648,Citizens Connect App,"(42.2812, -71.0648)",-7910897.349325828,5203195.356190682,-7910897.349325828,5203195.356190682
583295,101000402413,03/30/2012 10:07:11 AM,04/03/2012 10:07:11 AM,03/30/2012 02:34:49 PM,ONTIME,Closed,Case Closed Case Resolved One vehicle ticketed.,Parking Enforcement,Transportation - Traffic Division,Enforcement & Abandoned Vehicles,Parking Enforcement,BTDT_Parking Enforcement,BTDT,,,15 Brookfield St  Roslindale  MA  02131,9.0,06,5.0,E5,Roslindale,10.0,Ward 20,2004,R2,15 Brookfield St,2131.0,Address,21967.0,42.2877,-71.133,Constituent Call,"(42.2877, -71.133)",-7918489.338597928,5204173.408731778,-7918489.338597928,5204173.408731778
925603,101002008126,02/10/2017 03:23:00 PM,02/13/2017 03:23:21 PM,02/13/2017 08:50:53 AM,ONTIME,Closed,Case Closed. Closed date : 2017-02-13 08:50:53.373 Case Noted Sorry! During the inspection at 8:49AM on 2/13/2017  I did not notice any trash material out on curbside. We will return back to service your material on your next scheduled collection day.,Requests for Street Cleaning,Public Works Department,Street Cleaning,Requests for Street Cleaning,PWDx_Missed Trash\Recycling\Yard Waste\Bulk Item,PWDx,,https://cityworker.cityofboston.gov:8443/attachments/report/589e2186d052e81b93e4d092/closed_photo/Report.jpg,561 Massachusetts Ave  Roxbury  MA  02118,7.0,10B,7.0,D4,Roxbury,13.0,Ward 9,0903,CM,561 Massachusetts Ave,2118.0,Address,92402.0,42.3376,-71.0791,Citizens Connect App,"(42.3376, -71.0791)",-7912489.218044171,5211685.206724081,-7912489.218044171,5211685.206724081
870501,101001785226,05/09/2016 09:53:00 AM,05/09/2017 09:53:05 AM,08/18/2016 08:54:31 AM,ONTIME,Closed,Case Closed. Closed date : 2016-08-18 08:54:31.773 Case Noted Resident does not want a new tree planted.,New Tree Requests,Parks & Recreation Department,Trees,New Tree Requests,PARK_New Tree Requests,PARK,,,321 Sumner St  East Boston  MA  02128,1.0,09,1.0,A7,East Boston,1.0,Ward 1,0103,R3,321 Sumner St,2128.0,Address,392634.0,42.3672,-71.0362,Constituent Call,"(42.3672, -71.0362)",-7907713.61188914,5216143.919706318,-7907713.61188914,5216143.919706318
504241,101000796838,03/06/2013 08:00:46 AM,03/07/2013 08:30:00 AM,03/06/2013 10:26:07 AM,ONTIME,Closed,Case Closed Case Resolved work completed by dist 3,Pick up Dead Animal,Public Works Department,Street Cleaning,Pick up Dead Animal,PWDx_District 03: North Dorchester,PWDx,,,16 Rosseter St  Dorchester  MA  02121,7.0,03,4.0,C11,Dorchester,8.0,Ward 14,1404,R3,16 Rosseter St,2121.0,Address,118766.0,42.3044,-71.0763,Constituent Call,"(42.3044, -71.0763)",-7912177.523469951,5206686.7142415885,-7912177.523469951,5206686.7142415885
903306,101001939456,10/26/2016 01:58:00 PM,02/23/2017 01:58:12 PM,01/12/2017 03:44:31 PM,ONTIME,Closed,Case Closed. Closed date : 2017-01-12 15:44:31.153 :,Pest Infestation - Residential,Inspectional Services,Housing,Pest Infestation - Residential,ISD_Housing (INTERNAL),ISD,,,29 Esmond St  Dorchester  MA  02121,7.0,03,4.0,B3,Greater Mattapan,8.0,Ward 14,1407,R4,29 Esmond St,2121.0,Address,230847.0,42.2986,-71.0854,Constituent Call,"(42.2986, -71.0854)",-7913190.53083617,5205813.754149735,-7913190.53083617,5205813.754149735
615217,101000731265,01/04/2013 02:11:12 AM,,01/04/2013 09:32:23 AM,ONTIME,Closed,Case Closed Case Noted,Notification,Mayor's 24 Hour Hotline,Notification,Notification,INFO09_Current Events,INFO,,,354 Weld St  West Roxbury  MA  02132,9.0,06,6.0,E5,West Roxbury,12.0,Ward 20,2019,R1,354 Weld St,2132.0,Address,147128.0,42.2935,-71.1478,Constituent Call,"(42.2935, -71.1478)",-7920136.86706167,5205046.2177431015,-7920136.86706167,5205046.2177431015
663575,101001333870,03/16/2015 10:10:38 AM,03/17/2015 10:10:38 AM,03/16/2015 10:14:13 AM,ONTIME,Closed,Case Closed Case Resolved,Request for Pothole Repair,Public Works Department,Highway Maintenance,Request for Pothole Repair,PWDx_District 10A: Roxbury,PWDx,https://mayors24.cityofboston.gov/media/boston/report/photos/5506e457048559f3ab3c3b07/photo_20150316_101037.jpg,https://cityworker.cityofboston.gov:8443/attachments/report/5506e45fd052a8008ccfac02/closed_photo/Report.jpg,170 Brookline Ave  Boston  MA  02215,4.0,10A,8.0,D4,Fenway / Kenmore / Audubon Circle / Longwood,14.0,Ward 21,2101.0,A,170 Brookline Ave,2215.0,Address,340435.0,42.3441,-71.1014,Citizens Connect App,"(42.3441, -71.1014)",-7914971.64268886,5212664.136092194,-7914971.64268886,5212664.136092194
96241,101001528548,08/24/2015 09:12:28 AM,08/25/2015 09:12:37 AM,08/24/2015 10:58:01 AM,ONTIME,Closed,Case Closed. Closed date : 2015-08-24 10:58:01.363 Case Resolved,Requests for Street Cleaning,Public Works Department,Street Cleaning,Requests for Street Cleaning,PWDx_District 08: Hyde Park,PWDx,https://cityworker.cityofboston.gov:8443/attachments/report/55db1840d052f8c25f1d028c/photo/Report.jpg,https://cityworker.cityofboston.gov:8443/attachments/report/55db1840d052f8c25f1d028c/closed_photo/Report.jpg,19-21 Edgewater Dr  Mattapan  MA  02126,8.0,08,4.0,B3,Greater Mattapan,9.0,Ward 18,1804,CL,19-21 Edgewater Dr,2126.0,Address,51197.0,42.2665,-71.0956,City Worker App,"(42.2665, -71.0956)",-7914325.9896422615,5200983.824790396,-7914325.9896422615,5200983.824790396
35375,101001924321,10/05/2016 08:30:00 AM,02/02/2017 08:30:29 AM,10/12/2016 11:49:45 AM,ONTIME,Closed,Case Closed. Closed date : 2016-10-12 11:49:45.57 VIOCOR: Violation Corrected,Pest Infestation - Residential,Inspectional Services,Housing,Pest Infestation - Residential,ISD_Housing (INTERNAL),ISD,https://mayors24.cityofboston.gov/media/boston/report/photos/57f4f25c696338e4faad5b9c/report.jpg,,5 Monsignor Reynolds Way  Roxbury  MA  02118,4.0,1C,2.0,D4,Roxbury,6.0,08,0801,,5 Monsignor Reynolds Way,2118.0,Address,342528.0,42.3405,-71.0706,Citizens Connect App,"(42.3405, -71.0706)",-7911543.002372429,5212121.947323806,-7911543.002372429,5212121.947323806
770208,101000831485,05/01/2013 11:09:26 AM,,05/03/2013 09:48:19 PM,ONTIME,Closed,Case Closed Bulk Item Automation,Schedule a Bulk Item Pickup,Public Works Department,Sanitation,Schedule a Bulk Item Pickup,PWDx_Schedule a Bulk Item Pickup,PWDx,,,58 Dorset St  Dorchester  MA  02125,6.0,03,2.0,C6,Dorchester,5.0,Ward 7,0708,R2,58 Dorset St,2125.0,Address,49202.0,42.3241,-71.0596,Constituent Call,"(42.3241, -71.0596)",-7910318.487973703,5209652.368991437,-7910318.487973703,5209652.368991437
468380,101001903273,09/08/2016 11:58:04 AM,09/09/2016 11:58:04 AM,09/08/2016 06:17:21 PM,ONTIME,Closed,Case Closed. Closed date : 2016-09-08 18:17:21.463 Case Resolved officer responded and said he tagged anything in violation at this location.,Parking Enforcement,Transportation - Traffic Division,Enforcement & Abandoned Vehicles,Parking Enforcement,BTDT_Parking Enforcement,BTDT,,,85 Centre St  Roxbury  MA  02119,7.0,10B,7.0,B2,Roxbury,13.0,Ward 11,1101,C,85 Centre St,2119.0,Address,28285.0,42.3285,-71.0954,Citizens Connect App,"(42.3285, -71.0954)",-7914303.725744101,5210314.875585753,-7914303.725744101,5210314.875585753
445842,101000972477,11/26/2013 02:46:12 PM,11/28/2013 02:46:12 PM,11/26/2013 06:46:47 PM,ONTIME,Closed,Case Closed Case Resolved,Requests for Street Cleaning,Public Works Department,Street Cleaning,Requests for Street Cleaning,PWDx_District 07: South Dorchester,PWDx,,,INTERSECTION of Babson St & Crossman St  Mattapan  MA,8.0,07,4.0,B3,Greater Mattapan,9.0,Ward 18,1802,,INTERSECTION Babson St & Crossman St,,Intersection,856.0,42.273999999999994,-71.092,Constituent Call,"(42.274, -71.092)",-7913925.239475405,5202112.092686759,-7913925.239475405,5202112.092686759
42688,101001714946,02/11/2016 07:26:53 AM,02/19/2016 08:30:00 AM,02/11/2016 12:36:54 PM,ONTIME,Closed,Case Closed. Closed date : 2016-02-11 12:36:54.143 Case Resolved no cep voilation found,Unshoveled Sidewalk,Public Works Department,Code Enforcement,Unshoveled Sidewalk,PWDx_Code Enforcement,PWDx,https://mayors24.cityofboston.gov/media/boston/report/photos/56bc7e0804852e480794c02b/report.jpg,https://cityworker.cityofboston.gov:8443/attachments/report/56bc7e4bd0523dfc52f580e7/closed_photo/Report.jpg,INTERSECTION of Napa St & Massachusetts Ave  Roxbury  MA,7.0,03,3.0,C6,South Boston / South Boston Waterfront,13.0,8,0806,,INTERSECTION Napa St & Massachusetts Ave,,Intersection,14572.0,42.3594,-71.0587,Citizens Connect App,"(0, 0)",-7910218.300431989,5214968.784796895,-7910218.300431989,5214968.784796895
127230,101000771671,02/10/2013 08:28:04 PM,02/13/2013 08:30:00 AM,02/14/2013 03:40:49 AM,OVERDUE,Closed,Case Closed Case Resolved  all roads have been treated with salt and pushed back with a plow. Any existing snow mounds that are a safety issue will be scheduled for removal.,Request for Snow Plowing,Public Works Department,Street Cleaning,Request for Snow Plowing,PWDx_District 03: North Dorchester,PWDx,,,46 Lyon St  Dorchester  MA  02122,7.0,03,3.0,C11,Dorchester,8.0,Ward 15,1509,CM,46 Lyon St,2122.0,Address,87948.0,42.306000000000004,-71.0611,Constituent Call,"(42.306, -71.0611)",-7910485.467209891,5206927.544971032,-7910485.467209891,5206927.544971032
318133,101000964760,11/13/2013 12:20:21 PM,11/15/2013 12:20:21 PM,12/04/2013 09:22:06 AM,OVERDUE,Closed,Case Closed VIOCOR: Violation Corrected,Overflowing or Un-kept Dumpster,Inspectional Services,Environmental Services,Overflowing or Un-kept Dumpster,ISD_Environmental Services (INTERNAL),ISD,,,135 Neponset Ave  Dorchester  MA  02122,8.0,07,3.0,C11,Dorchester,7.0,Ward 16,1605,CM,135 Neponset Ave,2122.0,Address,100740.0,42.2938,-71.05199999999999,Constituent Call,"(42.2938, -71.052)",-7909472.459843673,5205091.365222931,-7909472.459843673,5205091.365222931
566805,101000753114,02/09/2013 02:13:23 PM,02/13/2013 08:30:00 AM,02/14/2013 04:29:14 AM,OVERDUE,Closed,Case Closed Case Resolved  plowed and salted,Request for Snow Plowing,Public Works Department,Street Cleaning,Request for Snow Plowing,PWDx_District 06: West Roxbury and Roslindale,PWDx,,,55 Hilburn St  Roslindale  MA  02131,12.0,06,5.0,E5,Roslindale,10.0,Ward 18,1809,R1,55 Hilburn St,2131.0,Address,73892.0,42.2782,-71.1263,Constituent Call,"(42.2782, -71.1263)",-7917743.498009615,5202743.9813558925,-7917743.498009615,5202743.9813558925
333810,101001333962,03/16/2015 11:22:07 AM,,03/17/2015 04:36:12 PM,ONTIME,Closed,Case Closed Bulk Item Automation,Schedule a Bulk Item Pickup,Public Works Department,Sanitation,Schedule a Bulk Item Pickup,PWDx_Schedule a Bulk Item Pickup,PWDx,,,127 Marion St  East Boston  MA  02128,1.0,09,1.0,A7,East Boston,1.0,01,0106,,127 Marion St,2128.0,Address,352537.0,42.3768,-71.0368,Constituent Call,"(42.3768, -71.0368)",-7907780.403583616,5217590.439918553,-7907780.403583616,5217590.439918553
427995,101001419505,06/29/2015 12:05:28 PM,06/30/2015 12:05:28 PM,06/29/2015 02:13:37 PM,ONTIME,Closed,Case Closed. Closed date : 2015-06-29 14:13:37.18 Case Resolved completed,Requests for Street Cleaning,Public Works Department,Street Cleaning,Requests for Street Cleaning,PWDx_District 1C: Downtown,PWDx,,,96 South St  Boston  MA  02111,4.0,1C,2.0,A1,Downtown / Financial District,4.0,Ward 3,0308,CD,96 South St,2111.0,Address,128626.0,42.3512,-71.0572,Citizens Connect App,"(42.3512, -71.0572)",-7910051.321195798,5213733.543832747,-7910051.321195798,5213733.543832747
5660,101001401886,06/03/2015 03:57:00 PM,06/04/2015 03:57:44 PM,06/03/2015 08:09:29 PM,ONTIME,Closed,Case Closed. Closed date : 2015-06-03 20:09:29.003 Case Resolved THIS VEHICLE HAS BEEN TAGGED AND GIVEN TO THE ABANDONED VEHICLE MAN,Parking Enforcement,Transportation - Traffic Division,Enforcement & Abandoned Vehicles,Parking Enforcement,BTDT_Parking Enforcement,BTDT,,,32 Antwerp St  Brighton  MA  02135,11.0,04,9.0,D14,Allston / Brighton,15.0,Ward 22,2205,R3,32 Antwerp St,2135.0,Address,178596.0,42.3591,-71.1404,Constituent Call,"(42.3591, -71.1404)",-7919313.1028298,5214923.590213696,-7919313.1028298,5214923.590213696
801867,101001643921,11/28/2015 02:10:32 PM,12/01/2015 08:30:00 AM,11/28/2015 02:12:13 PM,ONTIME,Closed,Case Closed Case Noted  Case already in the system for location. Contractor has been given location.,Missed Leaf or Yard Trash: District 06,Public Works Department,Sanitation,Missed Trash/Recycling/Yard Waste/Bulk Item,PWDx_Missed Trash\Recycling\Yard Waste\Bulk Item,PWDx,,,8 Stimson St  West Roxbury  MA  02132,12.0,06,6.0,E5,West Roxbury,12.0,Ward 20,2015,R1,8 Stimson St,2132.0,Address,130711.0,42.2595,-71.1571,Self Service,"(42.2595, -71.1571)",-7921172.138326046,5199930.895852654,-7921172.138326046,5199930.895852654
151919,101001071908,04/20/2014 12:13:08 PM,04/24/2014 08:30:00 AM,04/20/2014 12:56:54 PM,ONTIME,Closed,Case Closed Case Resolved Caller reports the car has moved and they were able to exit the lot.,Parking Enforcement,Transportation - Traffic Division,Enforcement & Abandoned Vehicles,Parking Enforcement,BTDT_Parking Enforcement,BTDT,,,INTERSECTION of Dudley St & Vine St  Roxbury  MA,7.0,10B,7.0,B2,Roxbury,13.0,Ward 8,0807,,INTERSECTION Dudley St & Vine St,,Intersection,4275.0,42.3271,-71.0766,Constituent Call,"(42.3271, -71.0766)",-7912210.919317188,5210104.073006714,-7912210.919317188,5210104.073006714
658594,101001236609,12/21/2014 04:27:54 PM,01/07/2015 08:30:00 AM,01/05/2015 01:38:49 PM,ONTIME,Closed,Case Closed Duplicate of Existing Case %1240827,Sign Repair,Transportation - Traffic Division,Signs & Signals,Sign Repair,BTDT_District 02,BTDT,,,INTERSECTION of Belmore Ter & Boylston St  Jamaica Plain  MA,9.0,02,6.0,E13,Jamaica Plain,11.0,Ward 19,1903.0,,INTERSECTION Belmore Ter & Boylston St,,Intersection,1281.0,42.3188,-71.1104,Self Service,"(42.3188, -71.1104)",-7915973.5181060005,5208854.4112003,-7915973.5181060005,5208854.4112003
127762,101001070525,04/17/2014 01:51:20 PM,04/22/2014 01:51:20 PM,04/22/2014 12:43:45 PM,ONTIME,Closed,Case Closed Case Resolved Dropped off stickers at above address at 12:43pm,Sticker Request,Public Works Department,Recycling,Sticker Request,PWDx_Sticker Request,PWDx,,,5 Eastland Rd  Jamaica Plain  MA  02130,12.0,02,6.0,E13,Jamaica Plain,10.0,Ward 19,1907,R1,5 Eastland Rd,2130.0,Address,50904.0,42.2922,-71.1136,Constituent Call,"(42.2922, -71.1136)",-7916329.740476539,5204850.581148822,-7916329.740476539,5204850.581148822
721236,101001702647,01/27/2016 06:49:30 AM,01/26/2017 06:49:29 AM,01/27/2016 07:21:40 AM,ONTIME,Closed,Case Closed. Closed date : 2016-01-27 07:21:40.147 Duplicate of Existing Case Duplicate of existing case.    If you have any further questions  or feel that this case was closed in error  please do not hesitate to contact me.    Michael Somers  Senior Civil Engineer  Construction Management Division  Boston Public Works  617-635-3831	  Michael.Somers@Boston.gov,Sidewalk Repair,Public Works Department,Highway Maintenance,Sidewalk Repair,PWDx_Sidewalk Repair,PWDx,,,INTERSECTION of Dartmouth St & Stuart St  Boston  MA,4.0,1C,2.0,D4,Back Bay,6.0,4,0402,,INTERSECTION Dartmouth St & Stuart St,,Intersection,16555.0,42.3594,-71.0587,Employee Generated,"(0, 0)",-7910218.300431989,5214968.784796895,-7910218.300431989,5214968.784796895
791755,101001049322,03/18/2014 02:17:59 PM,04/15/2014 02:17:59 PM,03/19/2014 09:18:48 AM,ONTIME,Closed,Case Closed Case Noted commerical property - call requestor and informed them of such,Request for Recycling Cart,Public Works Department,Recycling,Request for Recycling Cart,PWDx_Recycling,PWDx,,,1552 Tremont St  Mission Hill  MA  02120,9.0,10A,8.0,B2,Mission Hill,14.0,Ward 10,1002,E,1552 Tremont St,2120.0,Address,170521.0,42.3322,-71.0999,Self Service,"(42.3322, -71.0999)",-7914804.663452672,5210872.019273057,-7914804.663452672,5210872.019273057
39285,101001785271,05/09/2016 10:04:00 AM,,05/10/2016 04:34:11 PM,ONTIME,Closed,Case Closed. Closed date : 2016-05-10 16:34:11.417 Bulk Item Automation,Schedule a Bulk Item Pickup,Public Works Department,Sanitation,Schedule a Bulk Item Pickup,PWDx_Schedule a Bulk Item Pickup,PWDx,,,9 Roseland St  Dorchester  MA  02124,8.0,07,3.0,C11,Dorchester,8.0,Ward 16,1603,R1,9 Roseland St,2124.0,Address,118404.0,42.2908,-71.0641,Constituent Call,"(42.2908, -71.0641)",-7910819.425682272,5204639.900101502,-7910819.425682272,5204639.900101502
645421,101001703097,01/27/2016 01:38:00 PM,,02/03/2016 04:30:39 PM,ONTIME,Closed,Case Closed. Closed date : 2016-02-03 16:30:39.023 Bulk Item Automation,Schedule a Bulk Item Pickup,Public Works Department,Sanitation,Schedule a Bulk Item Pickup,PWDx_Schedule a Bulk Item Pickup,PWDx,,,14 Stafford St  Roxbury  MA  02119,7.0,03,7.0,B2,Roxbury,13.0,Ward 8,0807,R3,14 Stafford St,2119.0,Address,130075.0,42.3221,-71.0761,Constituent Call,"(42.3221, -71.0761)",-7912155.259571791,5209351.244947336,-7912155.259571791,5209351.244947336
305739,101001866347,07/24/2016 07:57:00 AM,08/23/2016 07:57:45 AM,07/25/2016 10:49:10 AM,ONTIME,Closed,Case Closed. Closed date : 2016-07-25 10:49:10.527 ADCLSD: Administratively Closed,Rodent Activity,Inspectional Services,Environmental Services,Rodent Activity,ISD_Environmental Services (INTERNAL),ISD,https://mayors24.cityofboston.gov/media/boston/report/photos/5794ad3e6963ff6bd2b5929f/report.jpg,,5A-5 Phillips St  Boston  MA  02114,3.0,1B,8.0,A1,Beacon Hill,14.0,Ward 5,0504,R4,5A-5 Phillips St,2114.0,Address,168721.0,42.3605,-71.0667,Citizens Connect App,"(42.3605, -71.0667)",-7911108.856358334,5215134.500114721,-7911108.856358334,5215134.500114721
612912,101001321868,03/02/2015 05:47:10 PM,03/04/2015 08:30:00 AM,04/08/2015 04:51:36 PM,OVERDUE,Closed,Case Closed Case Resolved Completed a long time ago.,Requests for Street Cleaning,Public Works Department,Street Cleaning,Requests for Street Cleaning,PWDx_District 1B: North End,PWDx,https://mayors24.cityofboston.gov/media/boston/report/photos/54f4e72204854301ed490b5d/report.jpg,,1 A Acorn St  Boston  MA  02108,3.0,1B,8.0,A1,Beacon Hill,14.0,Ward 5,0503,RC,1 A Acorn St,2108.0,Address,275.0,42.3576,-71.0685,Citizens Connect App,"(42.3576, -71.0685)",-7911309.231441763,5214697.620534184,-7911309.231441763,5214697.620534184
223252,101001937336,10/23/2016 10:54:05 PM,10/25/2016 08:30:00 AM,10/24/2016 09:46:41 AM,ONTIME,Closed,Case Closed. Closed date : 2016-10-24 09:46:41.63 Case Resolved,Requests for Street Cleaning,Public Works Department,Street Cleaning,Requests for Street Cleaning,PWDx_District 1B: North End,PWDx,https://mayors24.cityofboston.gov/media/boston/report/photos/580d77cc696338e4faaea3cb/report.jpg,https://cityworker.cityofboston.gov:8443/attachments/report/580d7814d052e4313f7b9975/closed_photo/Report.jpg,152 Salem St  Boston  MA  02113,3.0,1B,1.0,A1,Downtown / Financial District,3.0,Ward 3,0303,A,152 Salem St,2113.0,Address,121768.0,42.3657,-71.0553,Citizens Connect App,"(42.3657, -71.0553)",-7909839.814163291,5215917.920892905,-7909839.814163291,5215917.920892905
95539,101000966344,11/15/2013 03:23:19 PM,11/19/2013 03:23:18 PM,11/15/2013 03:25:34 PM,ONTIME,Closed,Case Closed Case Invalid,Missed Trash/Recycling/Yard Waste/Bulk Item,Public Works Department,Sanitation,Missed Trash/Recycling/Yard Waste/Bulk Item,PWDx_Missed Trash\Recycling\Yard Waste\Bulk Item,PWDx,,,52 Wachusett St  Mattapan  MA  02126,8.0,08,5.0,E18,Mattapan,9.0,18,1805,R1,52 Wachusett St,2126.0,Address,141101.0,42.2619,-71.1011,Constituent Call,"(42.2619, -71.1011)",-7914938.246841623,5200291.886890846,-7914938.246841623,5200291.886890846
113252,101001530942,08/26/2015 11:02:00 AM,,09/04/2015 01:17:45 PM,ONTIME,Closed,Case Closed. Closed date : 2015-09-04 13:17:45.21 Bulk Item Automation,Schedule a Bulk Item Pickup,Public Works Department,Sanitation,Schedule a Bulk Item Pickup,PWDx_Schedule a Bulk Item Pickup,PWDx,,,46 Carolina Ave  Jamaica Plain  MA  02130,9.0,02,6.0,E13,Jamaica Plain,11.0,Ward 19,1906,CM,46 Carolina Ave,2130.0,Address,162895.0,42.308,-71.1136,Constituent Call,"(42.308, -71.1136)",-7916329.740476539,5207228.591990385,-7916329.740476539,5207228.591990385
474321,101001344745,03/30/2015 10:26:10 AM,03/31/2015 10:26:10 AM,03/30/2015 02:59:31 PM,ONTIME,Closed,Case Closed Case Noted will call gas company,Request for Pothole Repair,Public Works Department,Highway Maintenance,Request for Pothole Repair,PWDx_District 06: West Roxbury and Roslindale,PWDx,,,41 Bertson Ave  West Roxbury  MA  02132,12.0,06,6.0,E5,West Roxbury,12.0,Ward 20,2017,R1,41 Bertson Ave,2132.0,Address,15198.0,42.2863,-71.1663,Constituent Call,"(42.2863, -71.1663)",-7922196.277641347,5203962.742734722,-7922196.277641347,5203962.742734722
699793,101001224742,11/28/2014 10:37:21 AM,12/02/2014 10:37:21 AM,12/03/2014 07:16:06 AM,OVERDUE,Closed,Case Closed Case Noted its not a sefetey issue at this time,Sidewalk Repair (Make Safe),Public Works Department,Highway Maintenance,Sidewalk Repair (Make Safe),PWDx_District 05: South Boston,PWDx,https://cityworker.cityofboston.gov:8443/attachments/report/547896afd05216ee8809aa76/photo/Report.jpg,,INTERSECTION of Woodward St & Woodward Pl  South Boston  MA,6.0,05,2.0,C6,South Boston / South Boston Waterfront,5.0,Ward 7,0705,,INTERSECTION Woodward St & Woodward Pl,,Intersection,8679.0,42.3317,-71.0566,City Worker App,"(42.3317, -71.0566)",-7909984.529501323,5210796.727670389,-7909984.529501323,5210796.727670389
777447,101001815516,06/14/2016 06:45:24 PM,06/17/2016 08:30:00 AM,06/14/2016 08:25:11 PM,ONTIME,Closed,Case Closed. Closed date : 2016-06-14 20:25:11.973 Case Noted no violation found,Improper Storage of Trash (Barrels),Public Works Department,Code Enforcement,Improper Storage of Trash (Barrels),PWDx_Code Enforcement,PWDx,https://mayors24.cityofboston.gov/media/boston/report/photos/576088fe6963421113f1b24a/report.jpg,https://cityworker.cityofboston.gov:8443/attachments/report/57608944d0525fb31f98d161/closed_photo/Report.jpg,20 Monadnock St  Dorchester  MA  02125,7.0,03,7.0,B2,Dorchester,13.0,Ward 13,1305,R2,20 Monadnock St,2125.0,Address,276255.0,42.3169,-71.068,Citizens Connect App,"(42.3169, -71.068)",-7911253.571696366,5208568.367225929,-7911253.571696366,5208568.367225929
769015,101000435187,06/11/2012 05:26:32 PM,,06/14/2012 09:45:22 PM,ONTIME,Closed,Case Closed Bulk Item Automation,Schedule a Bulk Item Pickup,Public Works Department,Sanitation,Schedule a Bulk Item Pickup,PWDx_Schedule a Bulk Item Pickup,PWDx,,,33 Howland St  Dorchester  MA  02121,9.0,10B,7.0,B2,Roxbury,13.0,Ward 12,1209,R2,33 Howland St,2121.0,Address,253887.0,42.313,-71.086,Constituent Call,"(42.313, -71.086)",-7913257.322530645,5207981.251387145,-7913257.322530645,5207981.251387145
348334,101000954653,10/27/2013 01:03:17 AM,,10/28/2013 06:41:08 AM,ONTIME,Closed,Case Closed Duplicate of Existing Case,Schedule Bulk Item Pickup,Public Works Department,Sanitation,Schedule a Bulk Item Pickup SS,PWDx_Schedule a Bulk Item Pickup,PWDx,,,6-8 Chestnut St  Boston  MA  02108,3.0,1B,8.0,A1,Beacon Hill,14.0,Ward 5,0503,A,6-8 Chestnut St,2108.0,Address,163303.0,42.3594,-71.0587,Self Service,"(0, 0)",-7910218.300431989,5214968.784796895,-7910218.300431989,5214968.784796895
760779,101001687091,01/04/2016 04:52:21 PM,01/05/2016 04:52:21 PM,01/04/2016 09:06:01 PM,ONTIME,Closed,Case Closed. Closed date : 2016-01-04 21:06:01.373 Case Resolved Picked yp,Requests for Street Cleaning,Public Works Department,Street Cleaning,Requests for Street Cleaning,PWDx_District 10A: Roxbury,PWDx,https://mayors24.cityofboston.gov/media/boston/report/photos/568ae9936963635e6ba01a9a/photo_20160104_165126.jpg,https://cityworker.cityofboston.gov:8443/attachments/report/568ae9d670b4ba757c4f295e/closed_photo/Report.jpg,INTERSECTION of Boylston St & Yawkey Way  Boston  MA,4.0,10A,8.0,D4,Fenway / Kenmore / Audubon Circle / Longwood,14.0,Ward 5,0502,,INTERSECTION Boylston St & Yawkey Way,,Intersection,1764.0,42.3446,-71.0978,Citizens Connect App,"(42.3446, -71.0978)",-7914570.892522006,5212739.442543181,-7914570.892522006,5212739.442543181
818873,101001042584,03/07/2014 10:31:15 AM,03/11/2014 10:31:15 AM,03/07/2014 10:31:17 AM,ONTIME,Closed,Case Closed Case Resolved Marked completed at case creation,Request for Pothole Repair,Public Works Department,Highway Maintenance,Request for Pothole Repair,PWDx_District 04: Allston/Brighton,PWDx,,,228 Corey Rd  Brighton  MA  02135,11.0,04,9.0,D14,Allston / Brighton,15.0,Ward 21,2108,R3,228 Corey Rd,2135.0,Address,42609.0,42.3445,-71.1381,City Worker App,"(42.3445, -71.1381)",-7919057.068000974,5212724.38120507,-7919057.068000974,5212724.38120507
388496,101001958194,11/25/2016 03:12:00 AM,12/09/2016 08:30:00 AM,12/01/2016 10:55:37 AM,ONTIME,Closed,Case Closed. Closed date : 2016-12-01 10:55:37.753 Case Resolved,Sign Repair,Transportation - Traffic Division,Signs & Signals,Sign Repair,BTDT_Sign Shop_Sign Installation,BTDT,,,INTERSECTION of Capen St & Norfolk St  Dorchester  MA,8.0,07,4.0,B3,Greater Mattapan,9.0,17,1707,,INTERSECTION Capen St & Norfolk St,,Intersection,17179.0,42.3594,-71.0587,Citizens Connect App,"(0, 0)",-7910218.300431989,5214968.784796895,-7910218.300431989,5214968.784796895
697386,101000926592,09/13/2013 11:56:13 AM,09/17/2013 11:56:13 AM,09/13/2013 11:56:18 AM,ONTIME,Closed,Case Closed Case Resolved Marked completed at case creation,Requests for Street Cleaning,Public Works Department,Street Cleaning,Requests for Street Cleaning,PWDx_District 08: Hyde Park,PWDx,,,INTERSECTION of Canterbury St & Navarre St  Roslindale  MA,12.0,08,5.0,E18,Roslindale,10.0,Ward 18,1808,,INTERSECTION Canterbury St & Navarre St,,Intersection,2411.0,42.2785,-71.1181,City Worker App,"(42.2785, -71.1181)",-7916830.678185109,5202789.117872346,-7916830.678185109,5202789.117872346
560045,101001031239,02/20/2014 08:51:23 AM,,02/20/2014 08:51:24 AM,ONTIME,Closed,Case Closed Internal Case Performed by Highway Maintenance crew.,Pothole Repair (Internal),Public Works Department,Highway Maintenance,Pothole Repair (Internal),PWDx_District 09: East Boston,PWDx,,,406 Meridian St  East Boston  MA  02128,1.0,09,1.0,A7,East Boston,1.0,01,0107,A,406 Meridian St,2128.0,Address,94575.0,42.3803,-71.0395,Employee Generated,"(42.3803, -71.0395)",-7908080.966208758,5218117.872084681,-7908080.966208758,5218117.872084681
680065,101001682142,12/26/2015 07:55:00 PM,12/29/2015 08:30:00 AM,12/26/2015 09:56:00 PM,ONTIME,Closed,Case Closed. Closed date : 2015-12-26 21:56:00.22 Case Resolved Put horses around house,Requests for Street Cleaning,Public Works Department,Street Cleaning,Requests for Street Cleaning,PWDx_District 07: South Dorchester,PWDx,,,29 Alpha Rd  Dorchester  MA  02124,8.0,07,4.0,C11,Dorchester,9.0,Ward 17,1703,R3,29 Alpha Rd,2124.0,Address,2835.0,42.29600000000001,-71.0685,Constituent Call,"(42.296, -71.0685)",-7911309.231441763,5205422.453312978,-7911309.231441763,5205422.453312978
922810,101002008388,02/10/2017 05:10:00 PM,02/12/2017 05:10:11 PM,02/11/2017 11:53:51 AM,ONTIME,Closed,Case Closed. Closed date : 2017-02-11 11:53:51.947 Case Noted Ticket was issued for sidewalk not shoveled,Unshoveled Sidewalk,Public Works Department,Code Enforcement,Unshoveled Sidewalk,PWDx_Code Enforcement,PWDx,,,1590 Dorchester Ave  Dorchester  MA  02122,7.0,07,4.0,C11,Dorchester,7.0,Ward 16,1601,C,1590 Dorchester Ave,2122.0,Address,378337.0,42.2963,-71.0611,Constituent Call,"(42.2963, -71.0611)",-7910485.467209891,5205467.602585022,-7910485.467209891,5205467.602585022
7722,101001904478,09/09/2016 03:29:00 PM,09/09/2017 03:29:10 PM,,ONTIME,Open,,Tree Maintenance Requests,Parks & Recreation Department,Trees,Tree Maintenance Requests,PARK_Tree Maintenance Request,PARK,,,1251-1263 Commonwealth Ave  Allston  MA  02134,11.0,04,9.0,D14,Allston / Brighton,15.0,Ward 21,2105,CM,1251-1263 Commonwealth Ave,2134.0,Address,37135.0,42.3502,-71.1323,Constituent Call,"(42.3502, -71.1323)",-7918411.414954374,5213582.91571595,-7918411.414954374,5213582.91571595
825627,101000334717,09/27/2011 06:48:54 AM,,04/12/2013 02:10:31 PM,ONTIME,Closed,Case Closed Case Resolved Sidewalk repaired 2012    Michael Somers  Senior Civil Engineer  Construction Management Division  Boston Public Works  617-635-3831,Highway Maintenance,Public Works Department,Highway Maintenance,Highway Maintenance,PWDx_Sidewalk Repair,PWDx,,,45 Harvard St  Dorchester  MA  02121,7.0,03,4.0,B3,Dorchester,8.0,Ward 14,1402,CD,45 Harvard St,2121.0,Address,70882.0,42.2984,-71.07600000000001,Employee Generated,"(42.2984, -71.076)",-7912144.127622712,5205783.653511779,-7912144.127622712,5205783.653511779
44696,101001154572,08/21/2014 08:22:49 AM,08/25/2014 08:30:00 AM,08/21/2014 09:11:07 AM,ONTIME,Closed,Case Closed Case Resolved delivered,Sticker Request,Public Works Department,Recycling,Sticker Request,PWDx_Sticker Request,PWDx,,https://cityworker.cityofboston.gov:8443/attachments/report/53f5e49a70b4f935a142e1d2/closed_photo/Report.jpg,491 E Third St  South Boston  MA  02127,6.0,05,2.0,C6,South Boston / South Boston Waterfront,5.0,Ward 6,0605,R4,491 E Third St,2127.0,Address,318841.0,42.3363,-71.0404,Self Service,"(42.3363, -71.0404)",-7908181.153750473,5211489.432993284,-7908181.153750473,5211489.432993284
938836,101002023654,02/23/2017 05:12:06 PM,02/27/2017 08:30:00 AM,02/24/2017 08:55:15 AM,ONTIME,Closed,Case Closed. Closed date : 2017-02-24 08:55:15.65 Case Resolved area hand and mechanically swept,Requests for Street Cleaning,Public Works Department,Street Cleaning,Requests for Street Cleaning,PWDx_District 03: North Dorchester,PWDx,,https://cityworker.cityofboston.gov:8443/attachments/report/58af5e90d052c51cc8fc0661/closed_photo/Report.jpg,380 Washington St  Dorchester  MA  02124,7.0,03,4.0,C11,Dorchester,9.0,Ward 17,1701,E,380 Washington St,2124.0,Address,146055.0,42.2982,-71.0725,Citizens Connect App,"(42.2982, -71.0725)",-7911754.509404937,5205753.552969426,-7911754.509404937,5205753.552969426
144500,101000417718,05/06/2012 08:49:31 PM,06/05/2012 08:30:00 AM,05/17/2012 03:02:22 PM,ONTIME,Closed,Case Closed Case Resolved  alex delivered serial #0512411211,Request for Recycling Cart,Public Works Department,Recycling,Request for Recycling Cart,PWDx_Recycling,PWDx,,,12 Cheever Ct  East Boston  MA  02128,1.0,09,1.0,A7,East Boston,1.0,Ward 1,0101,R3,12 Cheever Ct,2128.0,Address,205543.0,42.3664,-71.0351,Self Service,"(42.3664, -71.0351)",-7907591.160449267,5216023.386334294,-7907591.160449267,5216023.386334294
767556,101001885144,08/17/2016 03:57:00 PM,08/18/2016 03:57:24 PM,08/24/2016 04:34:47 PM,OVERDUE,Closed,Case Closed. Closed date : 2016-08-24 16:34:47.687 Duplicate of Existing Case case entered in ISD for inspecion 101001889871,Sidewalk Repair (Make Safe),Public Works Department,Highway Maintenance,Sidewalk Repair (Make Safe),ISD_Administrative,ISD,,,168 Cambridge St  Boston  MA  02114,3.0,1B,1.0,A1,Boston,3.0,03,0306,,168 Cambridge St,2114.0,Address,352484.0,42.361000000000004,-71.0647,Constituent Call,"(42.361, -71.0647)",-7910886.217376749,5215209.826218224,-7910886.217376749,5215209.826218224
905267,101001988791,01/14/2017 10:30:00 AM,01/16/2017 10:30:57 AM,01/17/2017 03:33:10 PM,OVERDUE,Closed,Case Closed. Closed date : 2017-01-17 15:33:10.42 ADCLSD: Administratively Closed,Work w/out Permit,Inspectional Services,Building,Work w/out Permit,ISD_Building (INTERNAL),ISD,,,621 E First St  South Boston  MA  02127,6.0,05,2.0,C6,South Boston / South Boston Waterfront,5.0,Ward 6,0607,I,621 E First St,2127.0,Address,58382.0,42.3379,-71.0346,Constituent Call,"(42.3379, -71.0346)",-7907535.500703871,5211730.38585209,-7907535.500703871,5211730.38585209
385235,101000462258,08/09/2012 09:32:37 AM,08/13/2012 09:32:34 AM,08/09/2012 12:19:41 PM,ONTIME,Closed,Case Closed Case Resolved picked up.,Missed Trash: District 10A,Public Works Department,Sanitation,Missed Trash/Recycling/Yard Waste/Bulk Item,PWDx_Missed Trash\Recycling\Yard Waste\Bulk Item,PWDx,,,4-6 Nira Ave  Jamaica Plain  MA  02130,9.0,10A,8.0,E13,Jamaica Plain,11.0,Ward 10,1008,R3,4-6 Nira Ave,2130.0,Address,158681.0,42.3248,-71.1082,Employee Generated,"(42.3248, -71.1082)",-7915728.615226256,5209757.764668375,-7915728.615226256,5209757.764668375
286015,101001687657,01/05/2016 01:34:04 PM,01/06/2016 01:34:04 PM,01/05/2016 01:41:25 PM,ONTIME,Closed,Case Closed. Closed date : 2016-01-05 13:41:25.193 Case Resolved hand swept. Completed.,Requests for Street Cleaning,Public Works Department,Street Cleaning,Requests for Street Cleaning,PWDx_District 05: South Boston,PWDx,https://mayors24.cityofboston.gov/media/boston/report/photos/568c0c976963635e6ba02411/photo_20160105_133234.jpg,https://cityworker.cityofboston.gov:8443/attachments/report/568c0cdc70b4c4f343fdec30/closed_photo/Report.jpg,202 M St  South Boston  MA  02127,6.0,05,2.0,C6,South Boston / South Boston Waterfront,5.0,Ward 7,0701,R1,202 M St,2127.0,Address,88060.0,42.3308,-71.033,Citizens Connect App,"(42.3308, -71.033)",-7907357.389518602,5210661.204293861,-7907357.389518602,5210661.204293861
316444,101001781808,05/03/2016 05:43:00 PM,05/05/2016 08:30:00 AM,05/04/2016 09:38:13 AM,ONTIME,Closed,Case Closed. Closed date : 2016-05-04 09:38:13.87 Case Resolved recycle pick up three barrels .5/4/16,Missed Recycling: District 02,Public Works Department,Sanitation,Missed Trash/Recycling/Yard Waste/Bulk Item,PWDx_Missed Trash\Recycling\Yard Waste\Bulk Item,PWDx,,,20 Atwood Sq  Jamaica Plain  MA  02130,9.0,02,6.0,E13,Jamaica Plain,11.0,Ward 11,1109,CM,20 Atwood Sq,2130.0,Address,397707.0,42.306999999999995,-71.1165,Constituent Call,"(42.307, -71.1165)",-7916652.566999841,5207078.067285161,-7916652.566999841,5207078.067285161
128658,101001837227,06/16/2016 11:30:00 AM,,06/20/2016 04:31:37 PM,ONTIME,Closed,Case Closed. Closed date : 2016-06-20 16:31:37.837 Bulk Item Automation,Schedule a Bulk Item Pickup,Public Works Department,Sanitation,Schedule a Bulk Item Pickup,PWDx_Schedule a Bulk Item Pickup,PWDx,,,22 Winthrop St  Roxbury  MA  02119,7.0,10B,7.0,B2,Roxbury,13.0,Ward 12,1201,R4,22 Winthrop St,2119.0,Address,151020.0,42.3265,-71.0818,Constituent Call,"(42.3265, -71.0818)",-7912789.780669313,5210013.730480414,-7912789.780669313,5210013.730480414
840361,101001292060,02/12/2015 05:41:48 PM,,03/12/2015 10:17:54 AM,ONTIME,Closed,Case Closed Case Noted plate/ticket number not given to investigate complaint.  Phone number not provided,BTDT: Complaint,Mayor's 24 Hour Hotline,Employee & General Comments,General Comments For An Employee,BTDT_OPC_Phone Bank Service,BTDT,,,120 Norway St  Boston  MA  02115,4.0,10A,8.0,D4,Fenway / Kenmore / Audubon Circle / Longwood,14.0,Ward 4,0406,CM,120 Norway St,2115.0,Address,103998.0,42.345,-71.0889,Constituent Call,"(42.345, -71.0889)",-7913580.149053945,5212799.688135192,-7913580.149053945,5212799.688135192
919053,101002000872,02/01/2017 10:47:07 AM,02/02/2017 10:47:07 AM,02/01/2017 11:11:35 AM,ONTIME,Closed,Case Closed. Closed date : 2017-02-01 11:11:35.023 Case Noted Officer found nothing in violation.,Parking Enforcement,Transportation - Traffic Division,Enforcement & Abandoned Vehicles,Parking Enforcement,BTDT_Parking Enforcement,BTDT,https://mayors24.cityofboston.gov/media/boston/report/photos/589202f70485943e707e104f/report.jpg,,INTERSECTION of Greenwood Ave & Westminster St  Hyde Park  MA,12.0,08,5.0,E18,Hyde Park,10.0,18,1814,,INTERSECTION Greenwood Ave & Westminster St,,Intersection,15225.0,42.3594,-71.0587,Citizens Connect App,"(0, 0)",-7910218.300431989,5214968.784796895,-7910218.300431989,5214968.784796895
453250,101001362448,04/23/2015 12:35:43 PM,04/24/2015 12:35:43 PM,04/23/2015 12:35:44 PM,ONTIME,Closed,Case Closed Case Resolved Marked completed at case creation,CE Collection,Public Works Department,Street Cleaning,CE Collection,PWDx_District 1C: Downtown,PWDx,https://cityworker.cityofboston.gov:8443/attachments/report/55391f5d70b4ba4e84f4c446/photo/Report.jpg,,25 Joy St  Boston  MA  02114,3.0,1B,8.0,A1,Beacon Hill,14.0,Ward 5,0503,R1,25 Joy St,2114.0,Address,80120.0,42.3593,-71.0649,City Worker App,"(42.3593, -71.0649)",-7910908.481274907,5214953.719911855,-7910908.481274907,5214953.719911855
387112,101001248484,01/16/2015 12:01:56 PM,,01/16/2015 12:01:56 PM,ONTIME,Closed,Case Closed Internal Case Performed by Highway Maintenance crew.,Pothole Repair (Internal),Public Works Department,Highway Maintenance,Pothole Repair (Internal),PWDx_District 02: Jamaica Plain,PWDx,,,INTERSECTION of Bussey St & South St  Jamaica Plain  MA,12.0,02,6.0,E13,Jamaica Plain,11.0,Ward 19,1902,,INTERSECTION Bussey St & South St,,Intersection,2256.0,42.2956,-71.122,Employee Generated,"(42.2956, -71.122)",-7917264.8241992025,5205362.254618151,-7917264.8241992025,5205362.254618151
111782,101001932732,10/17/2016 01:18:00 PM,,10/17/2016 05:39:30 PM,ONTIME,Closed,Case Closed. Closed date : 2016-10-17 17:39:30.717 Case Resolved After a thorough search of the area we were unable to locate a syringe at the Intersection Of Columbia Rd & Dudley St  Dorchester,Needle Pickup,Mayor's 24 Hour Hotline,Needle Program,Needle Pickup,GEN_Needle_Pickup,GEN_,,,INTERSECTION of Columbia Rd & Dudley St  Dorchester  MA,7.0,03,3.0,B2,Dorchester,13.0,7,0710,,INTERSECTION Columbia Rd & Dudley St,,Intersection,14895.0,42.3594,-71.0587,Constituent Call,"(0, 0)",-7910218.300431989,5214968.784796895,-7910218.300431989,5214968.784796895
498676,101000416212,05/03/2012 08:03:48 AM,07/05/2012 08:03:48 AM,05/03/2012 09:50:36 AM,ONTIME,Closed,Case Closed Case Resolved   This is a duplicate and refer to cn#101000416211.,Graffiti Removal,Property Management,Graffiti,Graffiti Removal,PROP_GRAF_GraffitiRemoval,PROP,,,452 Hyde Park Ave  Roslindale  MA  02131,12.0,02,5.0,E18,Roslindale,10.0,Ward 18,1807,C,452 Hyde Park Ave,2131.0,Address,77370.0,42.2851,-71.1187,Citizens Connect App,"(42.2851, -71.1187)",-7916897.469879585,5203782.175606289,-7916897.469879585,5203782.175606289
563259,101001335179,03/17/2015 02:14:50 PM,05/20/2015 02:14:50 PM,04/02/2015 08:31:12 AM,ONTIME,Closed,Case Closed Case Resolved This request has been completed.  Graffiti has been removed.  Case Closed.,Graffiti: Ward 21  2105  Other,Property Management,Graffiti,Graffiti Removal,PROP_GRAF_GraffitiRemoval,PROP,,,169 Harvard Ave  Allston  MA  02134,11.0,04,9.0,D14,Allston / Brighton,15.0,Ward 21,2105,C,169 Harvard Ave,2134.0,Address,157013.0,42.3513,-71.1318,Self Service,"(42.3513, -71.1318)",-7918355.755208977,5213748.606776233,-7918355.755208977,5213748.606776233
183101,101001005135,01/14/2014 12:15:02 PM,,01/14/2014 10:10:22 PM,ONTIME,Closed,Case Closed Case Resolved,Pothole Repair (Internal),Public Works Department,Highway Maintenance,Pothole Repair (Internal),PWDx_District 06: West Roxbury and Roslindale,PWDx,,,4925 Washington St  West Roxbury  MA  02132,12.0,06,6.0,E5,West Roxbury,12.0,Ward 20,2005,CM,4925 Washington St,2132.0,Address,145357.0,42.2689,-71.1492,Employee Generated,"(42.2689, -71.1492)",-7920292.714348779,5201344.855911453,-7920292.714348779,5201344.855911453
358500,101000407813,04/12/2012 02:21:28 PM,,04/12/2012 02:24:35 PM,ONTIME,Closed,Case Closed Case Invalid,Schedule a Bulk Item Pickup,Public Works Department,Sanitation,Schedule a Bulk Item Pickup,PWDx_Schedule a Bulk Item Pickup,PWDx,,,25 Sargent St  Dorchester  MA  02125,7.0,03,7.0,B2,Roxbury,13.0,Ward 13,1304,R1,25 Sargent St,2125.0,Address,122940.0,42.3159,-71.0741,Employee Generated,"(42.3159, -71.0741)",-7911932.620590204,5208417.82123462,-7911932.620590204,5208417.82123462
291438,101001523167,08/17/2015 01:26:34 PM,08/18/2015 01:26:30 PM,08/17/2015 01:56:15 PM,ONTIME,Closed,Case Closed. Closed date : 2015-08-17 13:56:15.073 Case Resolved Chair pick up,Requests for Street Cleaning,Public Works Department,Street Cleaning,Requests for Street Cleaning,PWDx_District 02: Jamaica Plain,PWDx,https://cityworker.cityofboston.gov:8443/attachments/report/55d21946d05203ad74b070e5/photo/Report.jpg,https://cityworker.cityofboston.gov:8443/attachments/report/55d21946d05203ad74b070e5/closed_photo/Report.jpg,914 Canterbury St  Roslindale  MA  02131,12.0,02,5.0,E18,Roslindale,10.0,Ward 18,1807,R2,914 Canterbury St,2131.0,Address,25535.0,42.2792,-71.1158,City Worker App,"(42.2792, -71.1158)",-7916574.643356284,5202894.437246407,-7916574.643356284,5202894.437246407
792196,101000988440,12/19/2013 03:49:55 PM,,12/23/2013 06:36:42 AM,ONTIME,Closed,Case Closed Case Noted will look into and informed mike glennon,PublicWorks: Complaint,Mayor's 24 Hour Hotline,Employee & General Comments,General Comments For An Employee,PWDx_District 1C: Downtown,PWDx,,,,,,,,,,,,,,,,,42.3594,-71.0587,Constituent Call,"(0, 0)",-7910218.300431989,5214968.784796895,-7910218.300431989,5214968.784796895
746952,101000301035,07/13/2011 09:33:49 AM,07/14/2011 09:33:49 AM,07/13/2011 09:33:54 AM,ONTIME,Closed,Case Closed Internal Case,Pick up Dead Animal,Public Works Department,Street Cleaning,Pick up Dead Animal,PWDx_District 1B: North End,PWDx,,,2 Walnut St  Boston  MA  02108,3.0,1B,8.0,A1,Beacon Hill,14.0,Ward 5,0503,A,2 Walnut St,2108.0,Address,142049.0,42.3575,-71.0658,Employee Generated,"(42.3575, -71.0658)",-7911008.668816621,5214682.556080669,-7911008.668816621,5214682.556080669
238272,101001378868,05/16/2015 12:11:00 PM,06/02/2015 08:30:00 AM,05/18/2015 11:31:14 AM,ONTIME,Closed,Case Closed. Closed date : 2015-05-18 11:31:14.82 Case Resolved Stop sign has been rebolted back to upright position.,Sign Repair,Transportation - Traffic Division,Signs & Signals,Sign Repair,BTDT_District 05,BTDT,https://mayors24.cityofboston.gov/media/boston/report/photos/55576c1504852d0a76238f48/report.jpg,https://cityworker.cityofboston.gov:8443/attachments/report/55576c30d05219eb392459cb/closed_photo/Report.jpg,INTERSECTION of Romsey St & Sagamore St  Dorchester  MA,7.0,03,3.0,C11,Dorchester,7.0,Ward 13,1308,,INTERSECTION Romsey St & Sagamore St,,Intersection,8160.0,42.3159,-71.0543,Citizens Connect App,"(42.3159, -71.0543)",-7909728.494672498,5208417.82123462,-7909728.494672498,5208417.82123462
42018,101001880705,08/11/2016 12:49:00 PM,08/12/2016 12:50:23 PM,08/12/2016 12:11:05 PM,ONTIME,Closed,Case Closed. Closed date : 2016-08-12 12:11:05.153 Case Resolved Swept,Requests for Street Cleaning,Public Works Department,Street Cleaning,Requests for Street Cleaning,PWDx_District 1B: North End,PWDx,,https://cityworker.cityofboston.gov:8443/attachments/report/57acad4e70b47b799fd9942c/closed_photo/Report.jpg,40 Cedar Lane Way  Boston  MA  02114,3.0,1B,8.0,A1,Beacon Hill,14.0,Ward 5,0511,R2,40 Cedar Lane Way,2114.0,Address,162936.0,42.3583,-71.0702,Employee Generated,"(42.3583, -71.0702)",-7911498.474576111,5214803.07238003,-7911498.474576111,5214803.07238003
376685,101001708382,02/04/2016 08:45:00 AM,02/19/2016 08:45:02 AM,,OVERDUE,Open,,Other: Compliment,Mayor's 24 Hour Hotline,Employee & General Comments,General Comments For a Program or Policy,INFO_General Comments Complaints Compliments,INFO,,,,,,,,,,,,,,,,,42.3594,-71.0587,Constituent Call,"(0, 0)",-7910218.300431989,5214968.784796895,-7910218.300431989,5214968.784796895
219783,101001183748,09/28/2014 10:49:08 AM,09/30/2014 08:30:00 AM,09/28/2014 01:04:53 PM,ONTIME,Closed,Case Closed Case Resolved,Empty Litter Basket,Public Works Department,Highway Maintenance,Empty Litter Basket,PWDx_District 1B: North End,PWDx,,,INTERSECTION of Charles St & Pinckney St  Boston  MA,3.0,1B,8.0,A1,Back Bay,14.0,Ward 5,0511,,INTERSECTION Charles St & Pinckney St,,Intersection,2783.0,42.3588,-71.0707,Citizens Connect App,"(42.3588, -71.0707)",-7911554.134321508,5214878.395846266,-7911554.134321508,5214878.395846266
840797,101001749224,03/18/2016 10:05:00 AM,05/02/2016 10:05:00 AM,03/21/2016 07:53:54 AM,ONTIME,Closed,Case Closed. Closed date : 2016-03-21 07:53:54.847 Case Resolved changed glass mantles and burner,PRINTED//Susan R.,Public Works Department,Street Lights,General Lighting Request,PWDx_Street Light_General Lighting Request,PWDx,,,28-28H Myrtle St  Boston  MA  02114,3.0,1B,8.0,A1,Beacon Hill,14.0,Ward 5,0503,RC,28-28H Myrtle St,2114.0,Address,167954.0,42.3592,-71.0656,Employee Generated,"(42.3592, -71.0656)",-7910986.404918462,5214938.655050789,-7910986.404918462,5214938.655050789
357345,101000456081,07/26/2012 02:48:22 PM,,08/03/2012 09:42:16 PM,ONTIME,Closed,Case Closed Bulk Item Automation,Schedule a Bulk Item Pickup,Public Works Department,Sanitation,Schedule a Bulk Item Pickup,PWDx_Schedule a Bulk Item Pickup,PWDx,,,21 Schiller Rd  West Roxbury  MA  02132,12.0,06,6.0,E5,West Roxbury,12.0,Ward 20,2015,R1,21 Schiller Rd,2132.0,Address,123739.0,42.2575,-71.1596,Employee Generated,"(42.2575, -71.1596)",-7921450.437053029,5199630.080482945,-7921450.437053029,5199630.080482945
479540,101001802040,05/29/2016 04:47:00 PM,06/07/2016 08:30:00 AM,,OVERDUE,Open,,Equipment Repair,Parks & Recreation Department,Park Maintenance & Safety,Equipment Repair,INFO_Mass DCR,INFO,https://mayors24.cityofboston.gov/media/boston/report/photos/574b5563696391ab14c80302/report.jpg,,111-121 Green St  Jamaica Plain  MA  02130,9.0,02,6.0,E13,Jamaica Plain,11.0,Ward 19,1906,A,111-121 Green St,2130.0,Address,158495.0,42.3108,-71.108,Citizens Connect App,"(42.3108, -71.108)",-7915706.351328098,5207650.073886657,-7915706.351328098,5207650.073886657
366749,101001572381,09/08/2015 12:26:00 PM,09/22/2015 12:26:05 PM,09/14/2015 07:20:03 AM,ONTIME,Closed,Case Closed. Closed date : 2015-09-14 07:20:03.133 Case Resolved Work completed 9/11/15.,Sign Repair,Transportation - Traffic Division,Signs & Signals,Sign Repair,BTDT_Sign Shop_Sign Installation,BTDT,https://cityworker.cityofboston.gov:8443/attachments/report/55ef0c57d052f8c25f1e4163/photo/Report.jpg,,INTERSECTION of Litchfield St & Western Ave  Brighton  MA,11.0,04,9.0,D14,Allston / Brighton,15.0,Ward 22,2205,,INTERSECTION Litchfield St & Western Ave,,Intersection,6895.0,42.3626,-71.1396,City Worker App,"(42.3626, -71.1396)",-7919224.047237164,5215450.873777614,-7919224.047237164,5215450.873777614
217477,101000492413,10/15/2012 03:27:14 PM,02/12/2013 03:27:14 PM,,OVERDUE,Open,,Unsatisfactory Living Conditions,Inspectional Services,Housing,Unsatisfactory Living Conditions,ISD_Housing (INTERNAL),ISD,,,722 Saratoga St  East Boston  MA  02128,1.0,09,1.0,A7,East Boston,1.0,Ward 1,0111,R3,722 Saratoga St,2128.0,Address,306232.0,42.3834,-71.0186,Constituent Call,"(42.3834, -71.0186)",-7905754.388851179,5218585.050841213,-7905754.388851179,5218585.050841213
593392,101001894034,08/29/2016 09:34:42 PM,08/31/2016 08:30:00 AM,08/30/2016 01:13:24 AM,ONTIME,Closed,Case Closed. Closed date : 2016-08-30 01:13:24.997 Case Resolved vehicle tagged,Parking Enforcement,Transportation - Traffic Division,Enforcement & Abandoned Vehicles,Parking Enforcement,BTDT_Parking Enforcement,BTDT,https://mayors24.cityofboston.gov/media/boston/report/photos/57c4e2ac0485e52e8aaf84ca/report.jpg,,43 M St  South Boston  MA  02127,6.0,05,2.0,C6,South Boston / South Boston Waterfront,5.0,Ward 6,0607,R1,43 M St,2127.0,Address,88090.0,42.3367,-71.0336,Citizens Connect App,"(42.3367, -71.0336)",-7907424.181213078,5211549.670633245,-7907424.181213078,5211549.670633245
627072,101000395670,03/15/2012 02:29:51 PM,04/29/2012 02:29:50 PM,03/15/2012 03:02:20 PM,ONTIME,Closed,Case Closed Case Noted this is an overhead connection between 2 units,General Lighting Request,Public Works Department,Street Lights,General Lighting Request,PWDx_Street Light_General Lighting Request,PWDx,,,INTERSECTION of Congress St & High St  Boston  MA,6.0,1C,1.0,A1,Downtown / Financial District,3.0,Ward 3,0306,,INTERSECTION Congress St & High St,,Intersection,3439.0,42.3546,-71.0546,Constituent Call,"(42.3546, -71.0546)",-7909761.890519735,5214245.697356286,-7909761.890519735,5214245.697356286
474128,101001972990,12/19/2016 11:57:15 AM,12/20/2016 11:57:15 AM,12/19/2016 11:58:51 AM,ONTIME,Closed,Case Closed. Closed date : 2016-12-19 11:58:51.47 Case Resolved debris picked up,Requests for Street Cleaning,Public Works Department,Street Cleaning,Requests for Street Cleaning,PWDx_District 07: South Dorchester,PWDx,https://cityworker.cityofboston.gov:8443/attachments/report/5858116bd05202fe6715180f/photo/Report.jpg,https://cityworker.cityofboston.gov:8443/attachments/report/5858116bd05202fe6715180f/closed_photo/Report.jpg,321 Adams St  Dorchester  MA  02122,7.0,07,3.0,C11,Dorchester,7.0,Ward 16,1601,C,321 Adams St,2122.0,Address,161319.0,42.2983,-71.0575,City Worker App,"(42.2983, -71.0575)",-7910084.7170430375,5205768.603228651,-7910084.7170430375,5205768.603228651
503835,101000983743,12/16/2013 01:22:15 PM,12/17/2013 01:22:15 PM,12/18/2013 08:47:06 AM,OVERDUE,Closed,Case Closed Case Resolved,Space Savers,Public Works Department,Sanitation,Space Savers,PWDx_District 05: South Boston,PWDx,,,98 F St  South Boston  MA  02127,6.0,05,2.0,C6,South Boston / South Boston Waterfront,5.0,Ward 6,0603,R1,98 F St,2127.0,Address,55474.0,42.3358,-71.0492,Constituent Call,"(42.3358, -71.0492)",-7909160.765269453,5211414.136482129,-7909160.765269453,5211414.136482129
807544,101001132112,07/18/2014 12:54:05 PM,08/17/2014 12:54:05 PM,08/04/2014 08:57:07 AM,ONTIME,Closed,Case Closed CLOSED: Closed/No Permit,Rodent Activity,Inspectional Services,Environmental Services,Rodent Activity,ISD_Environmental Services (INTERNAL),ISD,,,2 Meehan Pl  Jamaica Plain  MA  02130,9.0,02,6.0,E13,Jamaica Plain,11.0,Ward 11,1107,R2,2 Meehan Pl,2130.0,Address,93810.0,42.3098,-71.1063,Self Service,"(42.3098, -71.1063)",-7915517.108193749,5207499.54248573,-7915517.108193749,5207499.54248573
409641,101001844617,06/25/2016 07:29:57 AM,06/29/2016 08:30:00 AM,06/26/2016 07:38:12 AM,ONTIME,Closed,Case Closed. Closed date : 2016-06-26 07:38:12.497 Case Noted no violation found,Improper Storage of Trash (Barrels),Public Works Department,Code Enforcement,Improper Storage of Trash (Barrels),PWDx_Code Enforcement,PWDx,https://mayors24.cityofboston.gov/media/boston/report/photos/576e6b2d69633b454a1da2ce/report.jpg,https://cityworker.cityofboston.gov:8443/attachments/report/576e6b7ad05250cfcde3377d/closed_photo/Report.jpg,933 E Second St  South Boston  MA  02127,6.0,05,2.0,C6,South Boston,5.0,06,0609,I,933 E Second St,2127.0,Address,124545.0,42.3374,-71.0259,Citizens Connect App,"(42.3374, -71.0259)",-7906567.021133969,5211655.08742515,-7906567.021133969,5211655.08742515
504064,101000458308,07/31/2012 03:04:24 PM,11/28/2012 03:04:24 PM,08/07/2012 03:32:10 PM,ONTIME,Closed,Case Closed :,Unsatisfactory Living Conditions,Inspectional Services,Housing,Unsatisfactory Living Conditions,ISD_Housing (INTERNAL),ISD,,,2 S Walter St  Roslindale  MA  02131,9.0,06,5.0,E5,Roslindale,10.0,Ward 20,2004,RC,2 S Walter St,2131.0,Address,327977.0,42.2885,-71.1343,Constituent Call,"(42.2885, -71.1343)",-7918634.05393596,5204293.791403597,-7918634.05393596,5204293.791403597
5126,101000402960,04/01/2012 03:02:37 PM,04/09/2012 03:02:37 PM,01/09/2013 03:05:06 PM,OVERDUE,Closed,Case Closed ADCLSD: Administratively Closed,Zoning,Inspectional Services,Building,Zoning,ISD_Building (INTERNAL),ISD,,,216 Calumet St  Mission Hill  MA  02120,9.0,10A,8.0,B2,Mission Hill,14.0,10,1005,,216 Calumet St,2120.0,Address,343868.0,42.3287,-71.1004,Self Service,"(42.3287, -71.1004)",-7914860.323198068,5210344.990622886,-7914860.323198068,5210344.990622886
294615,101001788533,05/12/2016 11:40:45 AM,05/13/2016 11:40:45 AM,05/12/2016 11:43:55 AM,ONTIME,Closed,Case Closed. Closed date : 2016-05-12 11:43:55.23 Case Resolved,Request for Pothole Repair,Public Works Department,Highway Maintenance,Request for Pothole Repair,PWDx_District 04: Allston/Brighton,PWDx,https://cityworker.cityofboston.gov:8443/attachments/report/5734a3fbd052753db4ca3b8b/photo/Report.jpg,https://cityworker.cityofboston.gov:8443/attachments/report/5734a3fbd052753db4ca3b8b/closed_photo/Report.jpg,53 Cambridge St  Allston  MA  02134,11.0,04,9.0,D14,Allston,15.0,22,2201,,53 Cambridge St,2134.0,Address,419288.0,42.3613,-71.1199,City Worker App,"(42.3613, -71.1199)",-7917031.053268537,5215255.022168046,-7917031.053268537,5215255.022168046
648402,101000430126,05/31/2012 11:58:10 AM,,05/31/2012 12:01:22 PM,ONTIME,Closed,Case Closed Case Invalid,Schedule a Bulk Item Pickup,Public Works Department,Sanitation,Schedule a Bulk Item Pickup,PWDx_Schedule a Bulk Item Pickup,PWDx,,,58 Oak Rd  West Roxbury  MA  02132,12.0,06,6.0,E5,West Roxbury,12.0,Ward 20,2015,R1,58 Oak Rd,2132.0,Address,104567.0,42.2629,-71.1599,Employee Generated,"(42.2629, -71.1599)",-7921483.832900268,5200442.30387886,-7921483.832900268,5200442.30387886
588806,101001720748,02/19/2016 05:15:00 PM,02/23/2016 08:30:00 AM,02/20/2016 08:03:38 AM,ONTIME,Closed,Case Closed. Closed date : 2016-02-20 08:03:38.04 Case Noted Capitol serviced above address at 8 am,Missed Trash: District 08,Public Works Department,Sanitation,Missed Trash/Recycling/Yard Waste/Bulk Item,PWDx_Missed Trash\Recycling\Yard Waste\Bulk Item,PWDx,,https://cityworker.cityofboston.gov:8443/attachments/report/56c7940cd0528f73f52809e2/closed_photo/Report.jpg,807 Hyde Park Ave  Roslindale  MA  02131,12.0,08,5.0,E18,Hyde Park,10.0,Ward 18,1808,R3,807 Hyde Park Ave,2131.0,Address,77647.0,42.2727,-71.1204,Constituent Call,"(42.2727, -71.1204)",-7917086.713013934,5201916.516632912,-7917086.713013934,5201916.516632912
413431,101000968843,11/20/2013 09:51:39 AM,,11/21/2013 07:08:05 AM,ONTIME,Closed,Case Closed Case Invalid caller cancelled it.,Schedule a Bulk Item Pickup,Public Works Department,Sanitation,Schedule a Bulk Item Pickup,PWDx_Schedule a Bulk Item Pickup,PWDx,,,7 Helena Rd  Dorchester  MA  02122,8.0,07,3.0,C11,Dorchester,7.0,Ward 16,1608,R1,7 Helena Rd,2122.0,Address,72572.0,42.2868,-71.0553,Constituent Call,"(42.2868, -71.0553)",-7909839.814163291,5204037.980053368,-7909839.814163291,5204037.980053368
559181,101001322043,03/03/2015 07:47:09 AM,03/04/2015 08:30:00 AM,03/03/2015 05:28:11 PM,ONTIME,Closed,Case Closed Case Noted  Space savers will be collected this week during regular trash collection.,Space Savers,Public Works Department,Sanitation,Space Savers,PWDx_District 1A: Charlestown,PWDx,,,21 Trenton St  Charlestown  MA  02129,3.0,1A,1.0,A15,Charlestown,2.0,Ward 2,0204,R2,21 Trenton St,2129.0,Address,138225.0,42.3781,-71.0614,Constituent Call,"(42.3781, -71.0614)",-7910518.863057131,5217786.339862818,-7910518.863057131,5217786.339862818
880448,101000972468,11/26/2013 02:38:31 PM,,12/02/2013 09:45:28 PM,ONTIME,Closed,Case Closed Bulk Item Automation,Schedule a Bulk Item Pickup,Public Works Department,Sanitation,Schedule a Bulk Item Pickup,PWDx_Schedule a Bulk Item Pickup,PWDx,,,34 Jamaica St  Jamaica Plain  MA  02130,9.0,02,6.0,E13,Jamaica Plain,11.0,Ward 11,1109,R1,34 Jamaica St,2130.0,Address,79270.0,42.3059,-71.1175,Constituent Call,"(42.3059, -71.1175)",-7916763.886490634,5206912.492871123,-7916763.886490634,5206912.492871123
59528,101001748691,03/17/2016 12:58:00 PM,04/16/2016 12:58:00 PM,,OVERDUE,Open,,No Utilities Residential - Gas,Inspectional Services,Housing,No Utilities Residential - Gas,ISD_Housing (INTERNAL),ISD,,,27 Hallowell St  Mattapan  MA  02126,8.0,07,5.0,B3,Greater Mattapan,9.0,Ward 18,1821,R2,27 Hallowell St,2126.0,Address,245261.0,42.2717,-71.1004,Constituent Call,"(42.2717, -71.1004)",-7914860.323198068,5201766.076259537,-7914860.323198068,5201766.076259537
347622,101000838280,05/13/2013 09:09:33 AM,05/15/2013 09:09:33 AM,05/13/2013 03:04:18 PM,ONTIME,Closed,Case Closed Case Resolved,Requests for Street Cleaning,Public Works Department,Street Cleaning,Requests for Street Cleaning,PWDx_District 08: Hyde Park,PWDx,,,56 Bradlee St  Hyde Park  MA  02136,12.0,08,5.0,E18,Hyde Park,10.0,Ward 18,1808,R2,56 Bradlee St,2136.0,Address,194937.0,42.2689,-71.1171,City Worker App,"(42.2689, -71.1171)",-7916719.358694316,5201344.855911453,-7916719.358694316,5201344.855911453
821237,101000363744,12/13/2011 12:21:22 PM,12/12/2012 12:21:22 PM,04/08/2013 10:24:03 AM,OVERDUE,Closed,Case Closed Case Resolved This location has been inspected and all repairs have been completed.     Michael Somers   Senior Civil Engineer   Construction Management Division   Boston Public Works   617-635-3831,Sidewalk Repair/Concrete/Dist 2,Public Works Department,Highway Maintenance,Sidewalk Repair,PWDx_Highway Construction,PWDx,,,47 Mossdale Rd  Jamaica Plain  MA  02130,9.0,02,6.0,E13,Jamaica Plain,11.0,Ward 19,1902,R1,47 Mossdale Rd,2130.0,Address,98018.0,42.3096,-71.1264,Employee Generated,"(42.3096, -71.1264)",-7917754.629958694,5207469.436492519,-7917754.629958694,5207469.436492519
613121,101001605595,10/06/2015 07:18:00 AM,10/05/2016 07:18:50 AM,10/06/2015 07:20:45 AM,ONTIME,Closed,Case Closed Case Resolved  The tree was pruned by Northern Tree Service  to the City of Boston tree pruning specifications.,Tree Maintenance Requests,Parks & Recreation Department,Trees,Tree Maintenance Requests,PARK_Tree Maintenance Request,PARK,,,503 Shawmut Ave  Roxbury  MA  02118,4.0,1C,7.0,D4,South End,6.0,Ward 9,0902,R2,503 Shawmut Ave,2118.0,Address,126407.0,42.3382,-71.0771,Employee Generated,"(42.3382, -71.0771)",-7912266.579062585,5211775.565195636,-7912266.579062585,5211775.565195636
821763,101000438589,06/19/2012 10:55:31 AM,,06/20/2012 07:58:01 AM,ONTIME,Closed,Case Closed Case Invalid,Schedule a Bulk Item Pickup,Public Works Department,Sanitation,Schedule a Bulk Item Pickup,PWDx_Schedule a Bulk Item Pickup,PWDx,,,,,,,,,,,,,,,,,42.3594,-71.0587,Employee Generated,"(0, 0)",-7910218.300431989,5214968.784796895,-7910218.300431989,5214968.784796895
839339,101001134854,07/22/2014 04:10:31 PM,11/19/2014 04:10:31 PM,08/04/2014 09:53:35 AM,ONTIME,Closed,Case Closed :,Bed Bugs,Inspectional Services,Housing,Bed Bugs,ISD_Housing (INTERNAL),ISD,,,440 Tremont St  Roxbury  MA  02118,4.0,1C,2.0,D4,Roxbury,6.0,05,0501,,440 Tremont St,2118.0,Address,174238.0,42.3463,-71.0689,Constituent Call,"(42.3463, -71.0689)",-7911353.759238079,5212995.488956545,-7911353.759238079,5212995.488956545
409991,101001543689,08/29/2015 08:51:44 AM,09/01/2015 08:30:00 AM,08/29/2015 03:19:25 PM,ONTIME,Closed,Case Closed. Closed date : 2015-08-29 15:19:25.443 Case Resolved removed mattress,CE Collection,Public Works Department,Street Cleaning,CE Collection,PWDx_District 10A: Roxbury,PWDx,https://cityworker.cityofboston.gov:8443/attachments/report/55e1aaf4d052f8c25f1d69d6/photo/Report.jpg,https://cityworker.cityofboston.gov:8443/attachments/report/55e1aaf4d052f8c25f1d69d6/closed_photo/Report.jpg,211 Park Dr  Boston  MA  02215,4.0,10A,8.0,D4,Fenway / Kenmore / Audubon Circle / Longwood,14.0,Ward 21,2101,A,211 Park Dr,2215.0,Address,106780.0,42.3417,-71.1006,City Worker App,"(42.3417, -71.1006)",-7914882.587096226,5212302.673463934,-7914882.587096226,5212302.673463934
315300,101001963817,12/04/2016 07:12:22 AM,12/06/2016 08:30:00 AM,12/05/2016 02:27:28 AM,ONTIME,Closed,Case Closed. Closed date : 2016-12-05 02:27:28.183 Case Resolved clear at this time,Parking Enforcement,Transportation - Traffic Division,Enforcement & Abandoned Vehicles,Parking Enforcement,BTDT_Parking Enforcement,BTDT,,,24 Dustin St  Brighton  MA  02135,11.0,04,9.0,D14,Allston / Brighton,15.0,Ward 22,2206,R2,24 Dustin St,2135.0,Address,50270.0,42.3516,-71.1462,Citizens Connect App,"(42.3516, -71.1462)",-7919958.755876399,5213793.795750475,-7919958.755876399,5213793.795750475
310775,101000344700,10/19/2011 09:24:58 PM,10/24/2011 08:30:00 AM,10/20/2011 05:42:09 AM,ONTIME,Closed,Case Closed Case Scheduled Items have been scheduled for pickup.,Schedule a Bulk Item Pickup,Public Works Department,Sanitation,Schedule a Bulk Item Pickup,PWDx_Schedule a Bulk Item Pickup,PWDx,,,25 Boardman St  East Boston  MA  02128,1.0,09,1.0,A7,East Boston,1.0,Ward 1,0113,R1,25 Boardman St,2128.0,Address,16681.0,42.388000000000005,-71.0089,Constituent Call,"(42.388, -71.0089)",-7904674.589790483,5219278.326347304,-7904674.589790483,5219278.326347304
937693,101002023166,02/23/2017 09:54:08 AM,02/24/2017 09:54:05 AM,02/23/2017 09:54:07 AM,ONTIME,Closed,Case Closed. Closed date : 2017-02-23 09:54:07.17 Case Resolved Marked completed at case creation,Request for Pothole Repair,Public Works Department,Highway Maintenance,Request for Pothole Repair,PWDx_District 1B: North End,PWDx,https://cityworker.cityofboston.gov:8443/attachments/report/58aef78fd052b69d23cd7184/photo/Report.jpg,,INTERSECTION of Atlantic Ave & Commercial Whf E  Boston  MA,3.0,1B,1.0,A1,Downtown / Financial District,3.0,3,0301,,INTERSECTION Atlantic Ave & Commercial Whf E,,Intersection,18593.0,42.3594,-71.0587,City Worker App,"(0, 0)",-7910218.300431989,5214968.784796895,-7910218.300431989,5214968.784796895
457452,101001297026,02/16/2015 02:09:43 AM,02/19/2015 08:30:00 AM,03/10/2015 01:55:53 PM,OVERDUE,Closed,Case Closed Case Resolved,Request for Snow Plowing,Public Works Department,Street Cleaning,Request for Snow Plowing,PWDx_District 1B: North End,PWDx,,,27 Ridgeway Ln  Boston  MA  02114,3.0,1B,1.0,A1,Beacon Hill,3.0,Ward 3,0306,CD,27 Ridgeway Ln,2114.0,Address,115989.0,42.3604,-71.0638,Constituent Call,"(42.3604, -71.0638)",-7910786.029835035,5215119.434965949,-7910786.029835035,5215119.434965949
863718,101000990396,12/23/2013 01:36:08 PM,02/24/2014 01:36:08 PM,12/30/2013 11:41:19 AM,ONTIME,Closed,Case Closed Case Resolved groffiti removed,Graffiti Removal,Property Management,Graffiti,Graffiti Removal,PWDx_District 1C: Downtown,PWDx,,,INTERSECTION of Massachusetts Ave & Newbury St  Boston  MA,4.0,1C,8.0,D4,Back Bay,14.0,Ward 5,0509,,INTERSECTION Massachusetts Ave & Newbury St,,Intersection,7136.0,42.3481,-71.0881,Citizens Connect App,"(42.3481, -71.0881)",-7913491.0934613105,5213266.604470687,-7913491.0934613105,5213266.604470687
773287,101000352746,11/10/2011 10:11:36 AM,11/14/2011 10:11:36 AM,11/12/2011 10:52:10 AM,ONTIME,Closed,Case Closed Case Invalid THIS WAS A TEST CASE.,Schedule a Bulk Item Pickup,Public Works Department,Sanitation,Schedule a Bulk Item Pickup,PWDx_Schedule a Bulk Item Pickup,PWDx,,,690 Truman Hwy  Hyde Park  MA  02136,12.0,08,5.0,E18,Hyde Park,10.0,18,1816,A,690 Truman Hwy,2136.0,Address,154864.0,42.3594,-71.0587,Constituent Call,"(0, 0)",-7910218.300431989,5214968.784796895,-7910218.300431989,5214968.784796895
734025,101001404955,06/08/2015 03:03:00 PM,06/11/2015 03:03:45 PM,07/01/2015 07:54:41 AM,OVERDUE,Closed,Case Closed. Closed date : 2015-07-01 07:54:41.64 ADCLSD: Administratively Closed,Building Inspection Request,Inspectional Services,Building,Building Inspection Request,ISD_Building (INTERNAL),ISD,,,14 Kensington St  Roxbury  MA  02119,9.0,10B,7.0,B2,Roxbury,13.0,Ward 12,1203,R3,14 Kensington St,2119.0,Address,81357.0,42.3206,-71.0909,Constituent Call,"(42.3206, -71.0909)",-7913802.788035532,5209125.40819576,-7913802.788035532,5209125.40819576
732412,101000848331,05/29/2013 08:46:29 AM,05/31/2013 08:46:29 AM,05/29/2013 10:09:47 AM,ONTIME,Closed,Case Closed Case Resolved,Requests for Street Cleaning,Public Works Department,Street Cleaning,Requests for Street Cleaning,PWDx_District 08: Hyde Park,PWDx,,,30 Prescott St  Hyde Park  MA  02136,12.0,08,5.0,E18,Hyde Park,10.0,Ward 18,1820,R2,30 Prescott St,2136.0,Address,112647.0,42.236000000000004,-71.1332,City Worker App,"(42.236, -71.1332)",-7918511.602496088,5196396.9175877115,-7918511.602496088,5196396.9175877115
403554,101001721659,02/22/2016 07:50:00 AM,,03/24/2016 02:11:32 PM,ONTIME,Closed,Case Closed. Closed date : 2016-03-24 14:11:32.54 Case Resolved This request has been approved. Request for Recycling Cart has been created. See case #101001753300 for status of the request.,Recycling Cart Inquiry,Public Works Department,Recycling,Recycling Cart Inquiry,PWDx_Recycling Cart Inquiry,PWDx,,,15 Dorset St  Dorchester  MA  02125,6.0,03,2.0,C6,Dorchester,5.0,Ward 7,0708,R2,15 Dorset St,2125.0,Address,49178.0,42.3239,-71.058,Constituent Call,"(42.3239, -71.058)",-7910140.376788435,5209622.256156272,-7910140.376788435,5209622.256156272
326526,101001577195,09/13/2015 04:39:15 PM,09/15/2015 08:30:00 AM,09/13/2015 09:00:53 PM,ONTIME,Closed,Case Closed. Closed date : 2015-09-13 21:00:53.01 Case Invalid duplicate,Requests for Street Cleaning,Public Works Department,Street Cleaning,Requests for Street Cleaning,PWDx_District 1B: North End,PWDx,https://mayors24.cityofboston.gov/media/boston/report/photos/55f5defc6963ab4b36351193/report.jpg,,42 Phillips St  Boston  MA  02114,3.0,1B,8.0,A1,Beacon Hill,14.0,Ward 5,0504,R4,42 Phillips St,2114.0,Address,293495.0,42.3602,-71.0682,Citizens Connect App,"(42.3602, -71.0682)",-7911275.835594525,5215089.304740333,-7911275.835594525,5215089.304740333
163872,101001726727,02/29/2016 01:33:05 PM,03/01/2016 01:33:04 PM,03/01/2016 12:07:37 PM,ONTIME,Closed,Case Closed. Closed date : 2016-03-01 12:07:37.95 Case Resolved Location has been made safe. This sidewalk will be referred for permanent repair. See case #101001727513 for status of the permanent repair.,Sidewalk Repair (Make Safe),Public Works Department,Highway Maintenance,Sidewalk Repair (Make Safe),PWDx_District 04: Allston/Brighton,PWDx,https://mayors24.cityofboston.gov/media/boston/report/photos/56d48edc6963e6bebc40d789/report.jpg,,899-925 Commonwealth Ave  Boston  MA  02215,11.0,04,8.0,D14,Allston / Brighton,14.0,21,2102,E,899-925 Commonwealth Ave,2215.0,Address,41281.0,42.3516,-71.117,Citizens Connect App,"(42.3516, -71.117)",-7916708.226745238,5213793.795750475,-7916708.226745238,5213793.795750475
341103,101001129388,07/15/2014 01:52:11 PM,07/18/2014 01:52:11 PM,07/17/2014 08:16:00 AM,ONTIME,Closed,Case Closed Case Resolved The PWD Roadway Repair Contractor is working on your street performing patch paving.    It is an important city service for your neighborhood to provide the best permanent repairs of previous utility excavations or potholes.    The construction process is to dig out 6.5 inches of material and place 5 inches of dense binder hot mix asphalt in 2 lifts. The dense binder gives the patch its strength but is has large stones and is not conducive to providing a smooth ride  the contractor usually within a week comes back and places 1.5 inches of the top course. The top course is hot mix asphalt that provides the smooth ride.    The street is leafleted before the work begins where it explains that it is a mufti phase construction operation and you should look at the dates since they will change as each construction phases progresses.    Our goal is to allow parking between phases and not post the street for the entire time the work takes place. This is why the contractor repeatedly changes the dates.    We spoke to the contractor about his need to be totally accurate when posting for upcoming work.    Since this is a patching contract  the contractor may only be on your street for only a short period of time; giving the appearance of not showing up.    Sometimes poor weather  plant breakdowns  or equipment failure occurs which results in the delay of the upcoming work.    The CIU spoke to the contractor about his need to do a better job on changing the dates when those situations arise.    The street will be topped today.    The city apologizes for the inconvenience this necessary work has caused.    Sincerely      Mark Cardarelli  Supervisor of Utility Coordination and Compliance  Boston Public Works Department  617-635-4951 Office,Work Hours-Loud Noise Complaints,Public Works Department,Highway Maintenance,Work Hours-Loud Noise Complaints,PWDx_Work Hours-Loud Noise Complaints,PWDx,,,772 E Sixth St  South Boston  MA  02127,6.0,05,2.0,C6,South Boston / South Boston Waterfront,5.0,Ward 6,0608,R1,772 E Sixth St,2127.0,Address,127851.0,42.3333,-71.0295,Constituent Call,"(42.3333, -71.0295)",-7906967.771300825,5211037.662905813,-7906967.771300825,5211037.662905813
416992,101001111799,06/19/2014 12:57:53 PM,,06/24/2014 04:38:33 PM,ONTIME,Closed,Case Closed Bulk Item Automation,Schedule a Bulk Item Pickup,Public Works Department,Sanitation,Schedule a Bulk Item Pickup,PWDx_Schedule a Bulk Item Pickup,PWDx,,,68-70 L St  South Boston  MA  02127,6.0,05,2.0,C6,South Boston / South Boston Waterfront,5.0,Ward 6,0607,R3,68-70 L St,2127.0,Address,82581.0,42.3353,-71.0352,Constituent Call,"(42.3353, -71.0352)",-7907602.2923983475,5211338.840569625,-7907602.2923983475,5211338.840569625
352106,101001273327,02/04/2015 08:54:04 AM,02/06/2015 08:54:04 AM,02/12/2015 05:44:18 PM,OVERDUE,Closed,Case Closed Case Noted Snow has been removed.,Request for Snow Plowing,Public Works Department,Street Cleaning,Request for Snow Plowing,PWDx_District 1C: Downtown,PWDx,,,INTERSECTION of Public Alley No. 405 & Public Alley No. 404  Boston  MA,4.0,1C,7.0,D4,Back Bay,14.0,Ward 4,0405,,INTERSECTION Public Alley No. 405 & Public Alley No. 404,,Intersection,8690.0,42.3427,-71.0841,Constituent Call,"(42.3427, -71.0841)",-7913045.815498139,5212453.281215551,-7913045.815498139,5212453.281215551
117175,101001271463,02/03/2015 04:41:57 PM,02/05/2015 04:41:57 PM,02/05/2015 10:32:54 AM,ONTIME,Closed,Case Closed Case Noted  case closed trash will be picked up have trash out before 7am for Monday pick up,Missed Recycling: District 04,Public Works Department,Sanitation,Missed Trash/Recycling/Yard Waste/Bulk Item,PWDx_Missed Trash\Recycling\Yard Waste\Bulk Item,PWDx,,,8-12 Seager Ct  Brighton  MA  02135,11.0,04,9.0,D14,Allston / Brighton,15.0,Ward 22,2212,R2,8-12 Seager Ct,2135.0,Address,124044.0,42.3545,-71.1508,Constituent Call,"(42.3545, -71.1508)",-7920470.82553405,5214230.633621893,-7920470.82553405,5214230.633621893
30232,101001146634,08/08/2014 03:53:56 PM,,08/16/2014 06:18:25 AM,ONTIME,Closed,Case Closed Case Resolved Assigned CIU,Roadway Repair,Public Works Department,Highway Maintenance,Roadway Repair,PWDx_Utility Call-In,PWDx,,,44 Centre Ter  West Roxbury  MA  02132,12.0,06,6.0,E5,West Roxbury,12.0,Ward 20,2005,R1,44 Centre Ter,2132.0,Address,28480.0,42.2725,-71.1594,Constituent Call,"(42.2725, -71.1594)",-7921428.173154872,5201886.428367288,-7921428.173154872,5201886.428367288
314585,101000310962,08/05/2011 03:36:40 PM,01/31/2013 03:36:07 PM,08/09/2011 01:32:32 PM,ONTIME,Closed,Case Closed Case Noted The traffic light at this location was not blocked at the time of inspection.,Tree Maintenance Requests,Parks & Recreation Department,Trees,Tree Maintenance Requests,PARK_Tree Maintenance Request,PARK,,,INTERSECTION of Adams St & Parkman St  Dorchester  MA,7.0,07,3.0,C11,Dorchester,7.0,Ward 16,1601,,INTERSECTION Adams St & Parkman St,,Intersection,103.0,42.2973,-71.0567,Employee Generated,"(42.2973, -71.0567)",-7909995.661450404,5205618.101711881,-7909995.661450404,5205618.101711881
864606,101001638732,11/19/2015 12:05:00 PM,11/20/2015 12:05:24 PM,11/19/2015 12:29:05 PM,ONTIME,Closed,Case Closed. Closed date : 2015-11-19 12:29:05.407 Case Resolved Picked up all set,Requests for Street Cleaning,Public Works Department,Street Cleaning,Requests for Street Cleaning,PWDx_District 10A: Roxbury,PWDx,,https://cityworker.cityofboston.gov:8443/attachments/report/564e01ccd052932be1dc4103/closed_photo/Report.jpg,15 Frawley St  Boston  MA  02115,9.0,10A,8.0,B2,Mission Hill,14.0,Ward 10,1004,A,15 Frawley St,2115.0,Address,165445.0,42.3324,-71.1081,Constituent Call,"(42.3324, -71.1081)",-7915717.483277176,5210902.136081715,-7915717.483277176,5210902.136081715
15674,101001157403,08/26/2014 09:26:14 AM,,08/27/2014 04:42:31 PM,ONTIME,Closed,Case Closed Bulk Item Automation,Schedule a Bulk Item Pickup,Public Works Department,Sanitation,Schedule a Bulk Item Pickup,PWDx_Schedule a Bulk Item Pickup,PWDx,,,23-25 Pleasant Hill Ave  Mattapan  MA  02126,8.0,07,3.0,B3,Dorchester,7.0,Ward 17,1712,R2,23-25 Pleasant Hill Ave,2126.0,Address,111287.0,42.2773,-71.0727,Constituent Call,"(42.2773, -71.0727)",-7911776.773303094,5202608.573095818,-7911776.773303094,5202608.573095818
356818,101001354621,04/13/2015 08:25:38 AM,04/14/2015 08:30:00 AM,04/23/2015 04:37:05 PM,OVERDUE,Closed,Case Closed Case Resolved Completed all full trash barrels were removed from peters park .,Ground Maintenance: Chester Park,Public Works Department,Highway Maintenance,Empty Litter Basket,PARK_Maintenance_Region 5,PARK,,,527 Massachusetts Ave  Roxbury  MA  02118,7.0,10B,7.0,D4,Roxbury,13.0,Ward 9,0903,R4,527 Massachusetts Ave,2118.0,Address,92309.0,42.3386,-71.08,Citizens Connect App,"(42.3386, -71.08)",-7912589.405585884,5211835.80465565,-7912589.405585884,5211835.80465565
632014,101001944779,11/03/2016 11:21:00 AM,11/04/2016 11:21:32 AM,11/03/2016 11:43:38 AM,ONTIME,Closed,Case Closed. Closed date : 2016-11-03 11:43:38.737 Case Noted Material serviced  Note: Upon  inspection material was 95% recyclable! Please consider asking for a recycle toter or keep recycle separated from house hold trash.  By using clear plastics bags. The City would appreciate any help with our Recycle campaign. Thank you,Missed Trash: District 10A,Public Works Department,Sanitation,Missed Trash/Recycling/Yard Waste/Bulk Item,PWDx_Missed Trash\Recycling\Yard Waste\Bulk Item,PWDx,,https://cityworker.cityofboston.gov:8443/attachments/report/581b5673d0526e981e62b2db/closed_photo/Report.jpg,433 Marlborough St  Boston  MA  02215,4.0,10A,8.0,D4,Back Bay,14.0,Ward 5,0509,RC,433 Marlborough St,2215.0,Address,91432.0,42.35,-71.0899,Constituent Call,"(42.35, -71.0899)",-7913691.468544739,5213552.790380158,-7913691.468544739,5213552.790380158
946990,101002031660,03/07/2017 12:18:00 AM,03/08/2017 12:18:39 AM,03/07/2017 06:28:10 AM,ONTIME,Closed,Case Closed. Closed date : 2017-03-07 06:28:10.147 Case Resolved Online running normal operation,Traffic Signal Inspection,Transportation - Traffic Division,Signs & Signals,Traffic Signal Inspection,BTDT_Traffic Signal_Repair,BTDT,,,INTERSECTION of New Sudbury St & Congress St  Boston  MA,3.0,1B,2.0,A1,Downtown / Financial District,3.0,3,0306,,INTERSECTION New Sudbury St & Congress St,,Intersection,16834.0,42.3594,-71.0587,Constituent Call,"(0, 0)",-7910218.300431989,5214968.784796895,-7910218.300431989,5214968.784796895
700649,101001942718,10/31/2016 05:28:00 PM,11/16/2016 08:30:00 AM,12/20/2016 11:55:06 AM,OVERDUE,Closed,Case Closed. Closed date : 2016-12-20 11:55:06.433 Case Resolved,Sign Repair,Transportation - Traffic Division,Signs & Signals,Sign Repair,BTDT_Sign Shop_Sign Installation,BTDT,https://mayors24.cityofboston.gov/media/boston/report/photos/5817b7730485a54f848a9101/photo_20161031_172803.jpg,,INTERSECTION of Pratt St & Wadsworth St  Allston  MA,11.0,04,8.0,D14,Allston / Brighton,15.0,21,2104,,INTERSECTION Pratt St & Wadsworth St,,Intersection,12487.0,42.3594,-71.0587,Citizens Connect App,"(0, 0)",-7910218.300431989,5214968.784796895,-7910218.300431989,5214968.784796895
17079,101000918450,09/04/2013 04:08:23 PM,09/18/2013 04:08:23 PM,09/05/2013 09:19:35 AM,ONTIME,Closed,Case Closed Case Resolved Sticker on backside of sign in question has been removed by SD-6 on 9-5-13,Sign Repair,Transportation - Traffic Division,Signs & Signals,Sign Repair,BTDT_District 03,BTDT,,,200 Brookline Ave  Boston  MA  02215,4.0,10A,8.0,D4,Boston,14.0,21,2101,C,200 Brookline Ave,2215.0,Address,157892.0,42.3594,-71.0587,Citizens Connect App,"(0, 0)",-7910218.300431989,5214968.784796895,-7910218.300431989,5214968.784796895
172855,101001548265,09/02/2015 03:06:00 PM,,09/04/2015 01:32:59 PM,ONTIME,Closed,Case Closed. Closed date : 2015-09-04 13:32:59.28 Bulk Item Automation,Schedule a Bulk Item Pickup,Public Works Department,Sanitation,Schedule a Bulk Item Pickup,PWDx_Schedule a Bulk Item Pickup,PWDx,,,6 Ruxton Rd  Mattapan  MA  02126,8.0,08,5.0,E18,Greater Mattapan,10.0,Ward 18,1806,R2,6 Ruxton Rd,2126.0,Address,120315.0,42.2704,-71.1045,Constituent Call,"(42.2704, -71.1045)",-7915316.733110321,5201570.507342391,-7915316.733110321,5201570.507342391
14111,101001771375,04/19/2016 10:31:37 AM,07/18/2016 10:31:35 AM,10/11/2016 02:51:57 PM,OVERDUE,Closed,Case Closed. Closed date : 2016-10-11 14:51:57.217 :,Breathe Easy,Inspectional Services,Housing,Breathe Easy,ISD_Housing (INTERNAL),ISD,,,60 Vallar Rd  East Boston  MA  02128,1.0,09,1.0,A7,East Boston,1.0,Ward 1,0113,E,60 Vallar Rd,2128.0,Address,324258.0,42.3927,-71.0097,Constituent Call,"(42.3927, -71.0097)",-7904763.645383118,5219986.72553362,-7904763.645383118,5219986.72553362
608405,101001877331,08/07/2016 09:05:00 AM,08/07/2017 09:05:16 AM,,ONTIME,Open,,Tree Maintenance Requests,Parks & Recreation Department,Trees,Tree Maintenance Requests,PARK_Tree Maintenance Request,PARK,,,21 Park St  Charlestown  MA  02129,3.0,1A,1.0,A15,Charlestown,2.0,Ward 2,0201,R1,21 Park St,2129.0,Address,107220.0,42.3725,-71.0611,Constituent Call,"(42.3725, -71.0611)",-7910485.467209891,5216942.492069696,-7910485.467209891,5216942.492069696
434851,101000314212,08/15/2011 08:21:04 AM,08/14/2012 08:21:04 AM,09/01/2011 07:36:16 AM,ONTIME,Closed,Case Closed Case Resolved Thre are new flags at this location.,Sidewalk Repair/Concrete/Dist 7,Public Works Department,Highway Maintenance,Sidewalk Repair,PWDx_Highway Construction,PWDx,,,2-4 Ledgebrook Rd  Mattapan  MA  02126,8.0,07,4.0,B3,Greater Mattapan,9.0,Ward 18,1801,R2,2-4 Ledgebrook Rd,2126.0,Address,84803.0,42.2711,-71.0835,Constituent Call,"(42.2711, -71.0835)",-7912979.0238036625,5201675.8131811805,-7912979.0238036625,5201675.8131811805
642119,101001161485,09/01/2014 12:45:39 PM,11/30/2014 12:45:39 PM,,OVERDUE,Open,,Rental Unit Delivery Conditions,Inspectional Services,Housing,Rental Unit Delivery Conditions,ISD_Housing (INTERNAL),ISD,,,161 Endicott St  Boston  MA  02113,3.0,1B,1.0,A1,Downtown / Financial District,3.0,Ward 3,0304,RC,161 Endicott St,2113.0,Address,230524.0,42.3655,-71.0573,Constituent Call,"(42.3655, -71.0573)",-7910062.453144878,5215887.788125495,-7910062.453144878,5215887.788125495
487916,101001746804,03/15/2016 10:32:00 AM,03/29/2016 10:32:00 AM,03/15/2016 10:33:26 AM,ONTIME,Closed,Case Closed. Closed date : 2016-03-15 10:33:26.083 Case Resolved,Sign Repair,Transportation - Traffic Division,Signs & Signals,Sign Repair,BTDT_Sign Shop_Sign Installation,BTDT,,,INTERSECTION of Hillside St & Sachem St  Mission Hill  MA,9.0,10A,7.0,B2,Mission Hill,14.0,10,1003,,INTERSECTION Hillside St & Sachem St,,Intersection,16721.0,42.3594,-71.0587,Employee Generated,"(0, 0)",-7910218.300431989,5214968.784796895,-7910218.300431989,5214968.784796895
523519,101001678830,12/19/2015 03:54:31 PM,12/22/2015 08:30:00 AM,12/20/2015 08:48:25 AM,ONTIME,Closed,Case Closed. Closed date : 2015-12-20 08:48:25.907 Case Resolved Please refer to case #678831,Requests for Street Cleaning,Public Works Department,Street Cleaning,Requests for Street Cleaning,PWDx_District 10B: Roxbury,PWDx,https://mayors24.cityofboston.gov/media/boston/report/photos/5675c402696313a175afb32a/report.jpg,,874-904 Harrison Ave  Roxbury  MA  02118,7.0,10B,7.0,D4,Roxbury,13.0,08,0803,I,874-904 Harrison Ave,2118.0,Address,166052.0,42.3338,-71.0762,Citizens Connect App,"(42.3338, -71.0762)",-7912166.391520872,5211112.956423865,-7912166.391520872,5211112.956423865
392378,101001128274,07/14/2014 01:11:09 PM,,07/17/2014 04:41:16 PM,ONTIME,Closed,Case Closed Bulk Item Automation,Schedule a Bulk Item Pickup,Public Works Department,Sanitation,Schedule a Bulk Item Pickup,PWDx_Schedule a Bulk Item Pickup,PWDx,,,9 Greenwood Ave  Hyde Park  MA  02136,12.0,08,5.0,E18,Hyde Park,10.0,Ward 18,1814,R3,9 Greenwood Ave,2136.0,Address,66938.0,42.2647,-71.1186,Constituent Call,"(42.2647, -71.1186)",-7916886.337930506,5200713.0604693955,-7916886.337930506,5200713.0604693955
439329,101001912696,09/19/2016 04:37:00 PM,09/20/2016 04:37:39 PM,09/20/2016 09:03:43 AM,ONTIME,Closed,Case Closed. Closed date : 2016-09-20 09:03:43.407 Case Resolved during my inspection no trash or recycle on curb.9/20/16,Missed Recycling: District 02,Public Works Department,Sanitation,Missed Trash/Recycling/Yard Waste/Bulk Item,PWDx_Missed Trash\Recycling\Yard Waste\Bulk Item,PWDx,,https://cityworker.cityofboston.gov:8443/attachments/report/57e04cb1d052a290081284ee/closed_photo/Report.jpg,3 Greenough Park  Jamaica Plain  MA  02130,9.0,02,6.0,E13,Jamaica Plain,11.0,Ward 19,1906,CM,3 Greenough Park,2130.0,Address,66693.0,42.3104,-71.1133,Constituent Call,"(42.3104, -71.1133)",-7916296.344629301,5207589.861039305,-7916296.344629301,5207589.861039305
658312,101001612640,10/15/2015 09:53:00 AM,10/04/2017 09:53:43 AM,10/19/2015 08:57:07 AM,ONTIME,Closed,Case Closed. Closed date : 2015-10-19 08:57:07.043 NOVIO: No Violation Found/No Cause,Contractors Complaint,Inspectional Services,Building,Contractors Complaint,ISD_Building (INTERNAL),ISD,,,49 Burbank St  Boston  MA  02115,4.0,10A,8.0,D4,Fenway / Kenmore / Audubon Circle / Longwood,14.0,Ward 4,406.0,A,49 Burbank St,2115.0,Address,23719.0,42.3446,-71.0882,Constituent Call,"(42.3446, -71.0882)",-7913502.22541039,5212739.442543181,-7913502.22541039,5212739.442543181
838581,101001954370,11/18/2016 06:41:00 AM,12/07/2016 08:30:00 AM,11/21/2016 07:21:29 AM,ONTIME,Closed,Case Closed. Closed date : 2016-11-21 07:21:29.563 Duplicate of Existing Case 101001949021,Abandoned Vehicles,Transportation - Traffic Division,Enforcement & Abandoned Vehicles,Abandoned Vehicles,BTDT_AVRS Interface Queue,BTDT,https://mayors24.cityofboston.gov/media/boston/report/photos/582ee8d9048502e58ff299c3/photo_20161118_063927.jpg,,70-72 Congreve St  Roslindale  MA  02131,9.0,06,6.0,E5,Roslindale,10.0,Ward 20,2007,R2,70-72 Congreve St,2131.0,Address,42161.0,42.2898,-71.1392,Citizens Connect App,"(42.2898, -71.1392)",-7919179.519440847,5204489.416506094,-7919179.519440847,5204489.416506094
258434,101001119413,07/01/2014 11:29:18 AM,,07/01/2014 11:30:07 AM,ONTIME,Closed,Case Closed Case Resolved Case resolved  information provided.,Call Log,Disability Department,Disability,Call Log,DISB_General_Request,DISB,,,,,,,,,,,,,,,,,42.3594,-71.0587,Constituent Call,"(0, 0)",-7910218.300431989,5214968.784796895,-7910218.300431989,5214968.784796895
316667,101001309595,02/20/2015 11:46:41 PM,02/25/2015 08:30:00 AM,04/13/2015 05:12:04 PM,OVERDUE,Closed,Case Closed Case Noted Thank you for your request. This service request is now considered closed due to the recent arrival of Spring. The City worked around the clock this winter to address the record-breaking snowfall and we hope that many of your concerns were resolved. We encourage you to let us know of any additional issues and thank you for working with us to make the City a better place. Thank you for your patience and we apologize for any requests that we were not able to get to.,Request for Snow Plowing,Public Works Department,Street Cleaning,Request for Snow Plowing,PWDx_District 09: East Boston,PWDx,,,223 Maverick St  East Boston  MA  02128,1.0,09,1.0,A7,East Boston,1.0,Ward 1,0102,R3,223 Maverick St,2128.0,Address,92999.0,42.3685,-71.0355,Constituent Call,"(42.3685, -71.0355)",-7907635.688245585,5216339.789709751,-7907635.688245585,5216339.789709751
7238,101001743634,03/10/2016 09:15:00 AM,03/24/2016 09:15:00 AM,03/10/2016 09:16:12 AM,ONTIME,Closed,Case Closed. Closed date : 2016-03-10 09:16:12.14 Case Resolved,Sign Repair,Transportation - Traffic Division,Signs & Signals,Sign Repair,BTDT_Sign Shop_Sign Installation,BTDT,,,INTERSECTION of Emerson St & E Fourth St  South Boston  MA,6.0,05,2.0,C6,South Boston / South Boston Waterfront,5.0,6,0606,,INTERSECTION Emerson St & E Fourth St,,Intersection,16582.0,42.3594,-71.0587,Employee Generated,"(0, 0)",-7910218.300431989,5214968.784796895,-7910218.300431989,5214968.784796895
49180,101001781806,05/03/2016 05:40:00 PM,07/08/2016 08:30:00 AM,05/31/2016 01:05:16 PM,ONTIME,Closed,Case Closed. Closed date : 2016-05-31 13:05:16.543 Case Resolved Done,Graffiti Removal,Property Management,Graffiti,Graffiti Removal,PROP_GRAF_GraffitiRemoval,PROP,,https://cityworker.cityofboston.gov:8443/attachments/report/57291b20d05243d389fa8753/closed_photo/Report.jpg,9 East St  Boston  MA  02111,4.0,1C,2.0,A1,Downtown / Financial District,4.0,Ward 3,0308,C,9 East St,2111.0,Address,227738.0,42.3514,-71.0569,Citizens Connect App,"(42.3514, -71.0569)",-7910017.925348561,5213763.669743681,-7910017.925348561,5213763.669743681
309700,101000782244,02/14/2013 09:15:16 AM,06/14/2013 09:15:15 AM,,OVERDUE,Open,,Mice Infestation - Residential,Inspectional Services,Housing,Mice Infestation - Residential,ISD_Housing (INTERNAL),ISD,,,9 Ruggles St  Roxbury  MA  02119,7.0,10B,7.0,B2,Roxbury,13.0,09,0904,A,9 Ruggles St,2119.0,Address,302221.0,42.3315,-71.083,Constituent Call,"(42.3315, -71.083)",-7912923.3640582645,5210766.611196908,-7912923.3640582645,5210766.611196908
874906,101000724626,12/20/2012 01:59:55 PM,01/03/2013 01:59:55 PM,01/31/2013 08:56:22 AM,OVERDUE,Closed,Case Closed Case Resolved Replaced Globe  Burner & Mantles,Street Light Outages,Public Works Department,Street Lights,Street Light Outages,PWDx_Street Light Outages,PWDx,,,1 Saint James Pl  Roxbury  MA  02119,7.0,10B,7.0,B2,Roxbury,13.0,Ward 12,1201,R1,1 Saint James Pl,2119.0,Address,121213.0,42.3267,-71.0865,Constituent Call,"(42.3267, -71.0865)",-7913312.982276042,5210043.844560107,-7913312.982276042,5210043.844560107
357907,101001416749,06/24/2015 03:36:00 PM,06/25/2015 03:36:48 PM,06/25/2015 08:10:18 AM,ONTIME,Closed,Case Closed. Closed date : 2015-06-25 08:10:18.86 Case Noted Trash bag collected on 6/25/15.,Missed Trash: District 06,Public Works Department,Sanitation,Missed Trash/Recycling/Yard Waste/Bulk Item,PWDx_Missed Trash\Recycling\Yard Waste\Bulk Item,PWDx,,,45 Selwyn St  Roslindale  MA  02131,9.0,06,5.0,E5,Roslindale,10.0,Ward 20,2001,R1,45 Selwyn St,2131.0,Address,125103.0,42.2928,-71.1337,Constituent Call,"(42.2928, -71.1337)",-7918567.262241485,5204940.874459799,-7918567.262241485,5204940.874459799
164998,101000478564,09/13/2012 12:00:14 PM,,09/17/2012 09:46:38 PM,ONTIME,Closed,Case Closed Bulk Item Automation,Schedule a Bulk Item Pickup,Public Works Department,Sanitation,Schedule a Bulk Item Pickup,PWDx_Schedule a Bulk Item Pickup,PWDx,,,35 Holborn St  Dorchester  MA  02121,9.0,10B,7.0,B2,Roxbury,13.0,Ward 12,1206,R1,35 Holborn St,2121.0,Address,74475.0,42.3143,-71.0808,Constituent Call,"(42.3143, -71.0808)",-7912678.46117852,5208176.952624203,-7912678.46117852,5208176.952624203
413593,101001439276,07/29/2015 11:02:00 AM,11/26/2015 11:02:58 AM,08/11/2015 03:43:59 PM,ONTIME,Closed,Case Closed. Closed date : 2015-08-11 15:43:59.03 :,Unsatisfactory Living Conditions,Inspectional Services,Housing,Unsatisfactory Living Conditions,ISD_Housing (INTERNAL),ISD,,,247 Walnut Ave  Roxbury  MA  02119,9.0,10B,7.0,B2,Roxbury,13.0,Ward 11,1103,A,247 Walnut Ave,2119.0,Address,141916.0,42.3181,-71.0913,Constituent Call,"(42.3181, -71.0913)",-7913847.31583185,5208749.025573346,-7913847.31583185,5208749.025573346
812890,101001891148,08/25/2016 06:30:56 PM,08/29/2016 08:30:00 AM,08/25/2016 07:33:53 PM,ONTIME,Closed,Case Closed. Closed date : 2016-08-25 19:33:53.26 Case Resolved it is all set,Pick up Dead Animal,Public Works Department,Street Cleaning,Pick up Dead Animal,PWDx_District 02: Jamaica Plain,PWDx,https://mayors24.cityofboston.gov/media/boston/report/photos/57bf719804850eae554ad974/photo_20160825_182813.jpg,https://cityworker.cityofboston.gov:8443/attachments/report/57bf71e0d052c054f29ea12e/closed_photo/Report.jpg,45 Cornwall St  Jamaica Plain  MA  02130,9.0,02,6.0,E13,Jamaica Plain,11.0,Ward 11,1106,E,45 Cornwall St,2130.0,Address,43095.0,42.3122,-71.104,Citizens Connect App,"(42.3122, -71.104)",-7915261.073364923,5207860.821865797,-7915261.073364923,5207860.821865797
733774,101001028195,02/16/2014 11:18:20 AM,,02/24/2014 04:32:23 PM,ONTIME,Closed,Case Closed Bulk Item Automation,Schedule Bulk Item Pickup,Public Works Department,Sanitation,Schedule a Bulk Item Pickup SS,PWDx_Schedule a Bulk Item Pickup,PWDx,,,7 Rustlewood Rd  West Roxbury  MA  02132,12.0,06,6.0,E5,West Roxbury,12.0,Ward 20,2012,R1,7 Rustlewood Rd,2132.0,Address,119884.0,42.2897,-71.1595,Self Service,"(42.2897, -71.1595)",-7921439.30510395,5204474.36827795,-7921439.30510395,5204474.36827795
893901,101001977582,12/28/2016 01:10:00 PM,12/29/2016 01:10:24 PM,12/29/2016 08:04:36 AM,ONTIME,Closed,Case Closed. Closed date : 2016-12-29 08:04:36.613 Case Resolved no code voilation found,Illegal Posting of Signs,Public Works Department,Code Enforcement,Illegal Posting of Signs,PWDx_Code Enforcement,PWDx,,https://cityworker.cityofboston.gov:8443/attachments/report/58640067d052a88adb37f36d/closed_photo/Report.jpg,INTERSECTION of Centre St & Greaton Rd  West Roxbury  MA,9.0,06,6.0,E5,West Roxbury,10.0,20,2007,,INTERSECTION Centre St & Greaton Rd,,Intersection,15145.0,42.3594,-71.0587,Constituent Call,"(0, 0)",-7910218.300431989,5214968.784796895,-7910218.300431989,5214968.784796895
274768,101001542059,08/27/2015 12:07:30 PM,08/28/2015 12:07:30 PM,08/28/2015 01:49:38 PM,OVERDUE,Closed,Case Closed. Closed date : 2015-08-28 13:49:38.187 Case Resolved mattresses an cabinet have ben remove,CE Collection,Public Works Department,Street Cleaning,CE Collection,PWDx_District 04: Allston/Brighton,PWDx,https://cityworker.cityofboston.gov:8443/attachments/report/55df35d1d052f8c25f1d4873/photo/Report.jpg,https://cityworker.cityofboston.gov:8443/attachments/report/55df35d1d052f8c25f1d4873/closed_photo/Report.jpg,69 Coolidge Rd  Allston  MA  02134,11.0,04,9.0,D14,Allston / Brighton,15.0,Ward 22,2201,R4,69 Coolidge Rd,2134.0,Address,42381.0,42.3589,-71.1313,City Worker App,"(42.3589, -71.1313)",-7918300.09546358,5214893.460611436,-7918300.09546358,5214893.460611436
763423,101000314868,08/16/2011 12:23:25 PM,09/13/2011 12:23:22 PM,08/17/2011 02:43:23 PM,ONTIME,Closed,Case Closed Case Noted cart delivered 8/17/2011 serial #43519 #43518 #55276,Request for Recycling Cart,Public Works Department,Recycling,Request for Recycling Cart,PWDx_Recycling,PWDx,,,12 Parsons St  Brighton  MA  02135,11.0,04,9.0,D14,Allston / Brighton,15.0,Ward 22,2203,R3,12 Parsons St,2135.0,Address,108294.0,42.3501,-71.1557,Employee Generated,"(42.3501, -71.1557)",-7921016.291038936,5213567.853036073,-7921016.291038936,5213567.853036073
815417,101001363324,04/24/2015 02:46:20 PM,,04/24/2015 02:46:38 PM,ONTIME,Closed,Case Closed Case Resolved  -,Front Desk Interactions,Civil Rights,Call Inquiry,OCR Front Desk Interactions,HS_OCR_FrontDesk_Interactions,HS_O,,,,,,,,,,,,,,,,,42.3594,-71.0587,Constituent Call,"(0, 0)",-7910218.300431989,5214968.784796895,-7910218.300431989,5214968.784796895
571921,101001269071,02/03/2015 07:54:15 AM,,02/17/2015 07:20:04 AM,ONTIME,Closed,Case Closed Case Noted,Misc. Snow Complaint,Public Works Department,Administrative & General Requests,Misc. Snow Complaint,PWDx_District 07: South Dorchester,PWDx,,,6 Ashmont Park  Dorchester  MA  02124,8.0,07,3.0,C11,Dorchester,7.0,Ward 16,1606,R1,6 Ashmont Park,2124.0,Address,5305.0,42.2867,-71.0633,Constituent Call,"(42.2867, -71.0633)",-7910730.370089638,5204022.932541867,-7910730.370089638,5204022.932541867
351567,101001025152,02/12/2014 06:32:59 PM,02/28/2014 08:30:00 AM,02/23/2014 04:32:04 AM,ONTIME,Closed,Case Closed Case Resolved Replaced Ballast & Lamp,Street Light Outages,Public Works Department,Street Lights,Street Light Outages,PWDx_Street Light Outages,PWDx,,,INTERSECTION of Hereford St & Newbury St  Boston  MA,4.0,1C,8.0,D4,Back Bay,14.0,Ward 5,0509,,INTERSECTION Hereford St & Newbury St,,Intersection,5887.0,42.3488,-71.0856,Citizens Connect App,"(42.3488, -71.0856)",-7913212.794734327,5213372.040378293,-7913212.794734327,5213372.040378293
55842,101001875841,08/04/2016 02:17:08 PM,08/05/2016 02:17:08 PM,08/04/2016 03:05:38 PM,ONTIME,Closed,Case Closed. Closed date : 2016-08-04 15:05:38.837 Case Resolved car tagged,Parking Enforcement,Transportation - Traffic Division,Enforcement & Abandoned Vehicles,Parking Enforcement,BTDT_Parking Enforcement,BTDT,https://mayors24.cityofboston.gov/media/boston/report/photos/57a386a26963517fcb77e8e3/report.jpg,,319 Hyde Park Ave  Jamaica Plain  MA  02130,12.0,02,6.0,E13,Jamaica Plain,10.0,Ward 19,1907,R3,319 Hyde Park Ave,2130.0,Address,77300.0,42.2905,-71.1184,Citizens Connect App,"(42.2905, -71.1184)",-7916864.074032347,5204594.754772028,-7916864.074032347,5204594.754772028
405354,101001723422,02/24/2016 10:39:13 AM,03/02/2016 10:39:13 AM,02/24/2016 10:39:19 AM,ONTIME,Closed,Case Closed. Closed date : 2016-02-24 10:39:19.17 Case Resolved Created Request for Recycling Bin,Recycling Cart Return,Public Works Department,Recycling,Recycling Cart Return,PWDx_IPL Damaged Cart Replacement,PWDx,https://cityworker.cityofboston.gov:8443/attachments/report/56cdcea2d052c399f6625ecc/photo/Report.jpg,,25 Caryll St  Mattapan  MA  02126,8.0,07,3.0,B3,Dorchester,7.0,Ward 17,1714,R1,25 Caryll St,2126.0,Address,26197.0,42.2758,-71.077,City Worker App,"(42.2758, -71.077)",-7912255.447113506,5202382.896959779,-7912255.447113506,5202382.896959779
455250,101001575275,09/10/2015 03:58:01 PM,09/11/2015 03:58:01 PM,09/11/2015 02:00:52 PM,ONTIME,Closed,Case Closed. Closed date : 2015-09-11 14:00:52.97 Case Resolved picked up,CE Collection,Public Works Department,Street Cleaning,CE Collection,PWDx_District 09: East Boston,PWDx,https://cityworker.cityofboston.gov:8443/attachments/report/55f1e0cbd052f8c25f1e7430/photo/Report.jpg,https://cityworker.cityofboston.gov:8443/attachments/report/55f1e0cbd052f8c25f1e7430/closed_photo/Report.jpg,351 Chelsea St  East Boston  MA  02128,1.0,09,1.0,A7,East Boston,1.0,Ward 1,0110,RC,351 Chelsea St,2128.0,Address,30520.0,42.3782,-71.0288,City Worker App,"(42.3782, -71.0288)",-7906889.847657271,5217801.409257281,-7906889.847657271,5217801.409257281
450023,101001358451,04/16/2015 06:38:20 PM,04/21/2015 08:30:00 AM,04/21/2015 11:50:02 AM,OVERDUE,Closed,Case Closed Case Resolved during my inspection no trash or yard waste on the curb  .4/21/15.,Missed Leaf or Yard Trash: District 03,Public Works Department,Sanitation,Missed Trash/Recycling/Yard Waste/Bulk Item,PWDx_Missed Trash\Recycling\Yard Waste\Bulk Item,PWDx,,https://cityworker.cityofboston.gov:8443/attachments/report/553039e570b4685d4efeb148/closed_photo/Report.jpg,16 Windermere Rd  Dorchester  MA  02125,7.0,03,3.0,C11,Dorchester,7.0,Ward 13,1306,R1,16 Windermere Rd,2125.0,Address,150624.0,42.3145,-71.0622,Self Service,"(42.3145, -71.0622)",-7910607.918649766,5208207.060865616,-7910607.918649766,5208207.060865616
81111,101001656817,12/02/2015 01:17:00 PM,12/16/2015 01:17:05 PM,12/09/2015 01:00:31 PM,ONTIME,Closed,Case Closed. Closed date : 2015-12-09 13:00:31.83 Case Resolved Work completed 12/9/15.,Sign Repair,Transportation - Traffic Division,Signs & Signals,Sign Repair,BTDT_Sign Shop_Sign Installation,BTDT,,,69 Pierce St  Hyde Park  MA  02136,12.0,08,5.0,E18,Hyde Park,10.0,Ward 18,1813,R1,69 Pierce St,2136.0,Address,110290.0,42.2567,-71.1175,Citizens Connect App,"(42.2567, -71.1175)",-7916763.886490634,5199509.757006396,-7916763.886490634,5199509.757006396
914382,101001968311,12/11/2016 01:31:00 PM,12/19/2016 08:30:00 AM,01/30/2017 11:11:45 AM,OVERDUE,Closed,Case Closed. Closed date : 2017-01-30 11:11:45.95 Case Resolved done,PWD Graffiti,Public Works Department,Highway Maintenance,PWD Graffiti,PROP_GRAF_GraffitiRemoval,PROP,https://mayors24.cityofboston.gov/media/boston/report/photos/584d9b7c04859247212f64f6/report.jpg,https://cityworker.cityofboston.gov:8443/attachments/report/584d9bbfd0521e12073d850b/closed_photo/Report.jpg,733 Tremont St  Roxbury  MA  02118,4.0,1C,7.0,D4,South End,6.0,Ward 4,0404,EA,733 Tremont St,2118.0,Address,372260.0,42.3405,-71.0787,Citizens Connect App,"(42.3405, -71.0787)",-7912444.690247853,5212121.947323806,-7912444.690247853,5212121.947323806
795465,101000395129,03/14/2012 08:14:10 PM,03/29/2012 08:30:00 AM,03/20/2012 09:55:25 AM,ONTIME,Closed,Case Closed Case Resolved,Street Light Outages,Public Works Department,Street Lights,Street Light Outages,PWDx_Street Light_Pending_Contractor (Internal),PWDx,,,INTERSECTION of La Fayette Ave & N Margin St  Boston  MA,3.0,1B,1.0,A1,Downtown / Financial District,3.0,Ward 3,0304,,INTERSECTION La Fayette Ave & N Margin St,,Intersection,6697.0,42.3663,-71.0576,Constituent Call,"(42.3663, -71.0576)",-7910095.848992116,5216008.31977072,-7910095.848992116,5216008.31977072
166588,101000856253,06/10/2013 05:48:41 AM,,06/11/2013 09:38:41 AM,ONTIME,Closed,Case Closed Case Noted,Notification,Mayor's 24 Hour Hotline,Notification,Notification,INFO09_Current Events,INFO,,,560 Shawmut Ave  Roxbury  MA  02118,4.0,10B,7.0,D4,Roxbury,13.0,09,0903,,560 Shawmut Ave,2118.0,Address,347505.0,42.3366,-71.0789,Constituent Call,"(42.3366, -71.0789)",-7912466.954146014,5211534.611187336,-7912466.954146014,5211534.611187336
478441,101000797104,03/06/2013 11:38:35 AM,07/04/2013 11:38:35 AM,,OVERDUE,Open,,Unsatisfactory Living Conditions,Inspectional Services,Housing,Unsatisfactory Living Conditions,ISD_Housing (INTERNAL),ISD,,,1325 Blue Hill Ave  Mattapan  MA  02126,8.0,07,4.0,B3,Greater Mattapan,9.0,Ward 14,1408,A,1325 Blue Hill Ave,2126.0,Address,172122.0,42.2792,-71.0935,Constituent Call,"(42.2792, -71.0935)",-7914092.218711595,5202894.437246407,-7914092.218711595,5202894.437246407
431194,101001148592,08/12/2014 11:48:11 AM,,08/13/2014 04:38:42 PM,ONTIME,Closed,Case Closed Bulk Item Automation,Schedule a Bulk Item Pickup,Public Works Department,Sanitation,Schedule a Bulk Item Pickup,PWDx_Schedule a Bulk Item Pickup,PWDx,,,21 Lorna Rd  Mattapan  MA  02126,8.0,07,4.0,B3,Greater Mattapan,9.0,Ward 18,1801,R2,21 Lorna Rd,2126.0,Address,266357.0,42.2796,-71.0829,Constituent Call,"(42.2796, -71.0829)",-7912912.232109185,5202954.620271166,-7912912.232109185,5202954.620271166
316477,101000296465,07/05/2011 08:05:50 AM,12/31/2012 08:05:49 AM,10/19/2012 07:34:40 AM,ONTIME,Closed,Case Closed Case Resolved Case was never closed. Trees were removed by MFD of the BPRD tree maintenance division over the summer.,Tree Maintenance Requests,Parks & Recreation Department,Trees,Tree Maintenance Requests,PARK_Tree Maintenance Request,PARK,,,499 Huntington Ave  Boston  MA  02115,4.0,10A,7.0,D4,Fenway / Kenmore / Audubon Circle / Longwood,13.0,Ward 4,0409,EA,499 Huntington Ave,2115.0,Address,76379.0,42.3379,-71.0957,Employee Generated,"(42.3379, -71.0957)",-7914337.12159134,5211730.38585209,-7914337.12159134,5211730.38585209
213230,101001630547,11/08/2015 11:01:13 AM,11/10/2015 08:30:00 AM,11/09/2015 05:34:53 AM,ONTIME,Closed,Case Closed. Closed date : 2015-11-09 05:34:53.483 Case Noted the Boston Transportation Dept does not work on Sundays the Boston Police handle all parking issues during that time period call 911,Parking Enforcement,Transportation - Traffic Division,Enforcement & Abandoned Vehicles,Parking Enforcement,BTDT_Parking Enforcement,BTDT,https://mayors24.cityofboston.gov/media/boston/report/photos/563f71c255a56d4e49dd4adc/report.jpg,,INTERSECTION of W Roxbury Pkwy & Clement Ave  West Roxbury  MA,12.0,06,6.0,E5,West Roxbury,12.0,Ward 20,2011,,INTERSECTION W Roxbury Pkwy & Clement Ave,,Intersection,8193.0,42.2839,-71.1477,Citizens Connect App,"(42.2839, -71.1477)",-7920125.735112591,5203601.611917187,-7920125.735112591,5203601.611917187
526469,101001746142,03/14/2016 12:17:13 PM,03/16/2016 12:17:13 PM,03/16/2016 09:02:23 AM,ONTIME,Closed,Case Closed. Closed date : 2016-03-16 09:02:23.82 VIOISS: Violation Filed,Food Alert - Unconfirmed,Inspectional Services,Health,Food Alert - Unconfirmed,ISD_Health (INTERNAL),ISD,,,1116 Boylston St  Boston  MA  02215,4.0,10A,8.0,D4,Back Bay,14.0,04,0406,,1116 Boylston St,2215.0,Address,351728.0,42.3468,-71.0887,Constituent Call,"(42.3468, -71.0887)",-7913557.885155788,5213070.7980428925,-7913557.885155788,5213070.7980428925
527537,101001913277,09/20/2016 10:11:33 AM,09/21/2016 10:11:33 AM,,OVERDUE,Open,,Unsafe/Dangerous Conditions,Inspectional Services,Building,Unsafe Dangerous Conditions,ISD_Building (INTERNAL),ISD,,,105 Forest Hills St  Jamaica Plain  MA  02130,9.0,02,6.0,E13,Jamaica Plain,11.0,Ward 11,1107,CM,105 Forest Hills St,2130.0,Address,397841.0,42.3085,-71.1028,Constituent Call,"(42.3085, -71.1028)",-7915127.489975973,5207303.855239696,-7915127.489975973,5207303.855239696
516439,101001361962,04/23/2015 07:01:35 AM,10/20/2015 07:01:35 AM,04/23/2015 09:17:21 AM,ONTIME,Closed,Case Closed Case Resolved,Traffic Signal Repair,Transportation - Traffic Division,Signs & Signals,Traffic Signal Repair,BTDT_Traffic Signal_Repair,BTDT,,,INTERSECTION of W Broadway & D St  South Boston  MA,6.0,05,2.0,C6,South Boston / South Boston Waterfront,5.0,Ward 6,0601,,INTERSECTION W Broadway & D St,,Intersection,1999.0,42.3388,-71.0508,Constituent Call,"(42.3388, -71.0508)",-7909338.87645472,5211865.924529353,-7909338.87645472,5211865.924529353
855410,101001608213,10/08/2015 01:18:00 PM,,,ONTIME,Open,,Animal Generic Request,Animal Control,Animal Issues,Animal Generic Request,INFO01_GenericeFormforOtherServiceRequestTypes,INFO,,,204 Delhi St  Mattapan  MA  02126,8.0,07,4.0,B3,Greater Mattapan,9.0,Ward 18,1802,R3,204 Delhi St,2126.0,Address,47143.0,42.275,-71.0905,Constituent Call,"(42.275, -71.0905)",-7913758.260239216,5202262.538550228,-7913758.260239216,5202262.538550228
806306,101001354854,04/13/2015 11:06:59 AM,04/21/2015 11:06:57 AM,04/15/2015 11:58:41 AM,ONTIME,Closed,Case Closed Case Resolved the crew did the field today.,Ground Maintenance: Jefferson Playground  Jefferson Playground,Parks & Recreation Department,Park Maintenance & Safety,Ground Maintenance,PARK_Maintenance_Region 2,PARK,,,10 Grotto Glen Rd  Jamaica Plain  MA  02130,9.0,10A,8.0,E13,Jamaica Plain,11.0,10,1008,,10 Grotto Glen Rd,2130.0,Address,342483.0,42.326,-71.1085,Constituent Call,"(42.326, -71.1085)",-7915762.011073493,5209938.445700035,-7915762.011073493,5209938.445700035
540111,101000414988,04/30/2012 03:39:34 PM,,09/18/2013 02:15:46 PM,ONTIME,Closed,Case Closed Case Resolved Sidewalk repair August 2013     Michael Somers   Senior Civil Engineer   Construction Management Division   Boston Public Works   617-635-3831   Michael.Somers@CityofBoston.gov,Sidewalk Repair/Concrete/Dist 6,Public Works Department,Highway Maintenance,Highway Maintenance,PWDx_Sidewalk Repair,PWDx,,,63 Lorraine St  Roslindale  MA  02131,12.0,06,5.0,E5,Roslindale,10.0,Ward 20,2008,R1,63 Lorraine St,2131.0,Address,87473.0,42.2833,-71.1439,Constituent Call,"(42.2833, -71.1439)",-7919702.721047576,5203511.331362321,-7919702.721047576,5203511.331362321
739379,101000759173,02/09/2013 08:46:01 PM,02/13/2013 08:30:00 AM,02/16/2013 11:16:43 AM,OVERDUE,Closed,Case Closed Case Resolved done,Request for Snow Plowing,Public Works Department,Street Cleaning,Request for Snow Plowing,PWDx_District 07: South Dorchester,PWDx,,,INTERSECTION of Arbroth St & Train St  Dorchester  MA,8.0,07,3.0,C11,Dorchester,7.0,Ward 16,1607,,INTERSECTION Arbroth St & Train St,,Intersection,518.0,42.2903,-71.0528,Constituent Call,"(42.2903, -71.0528)",-7909561.515436309,5204564.658005166,-7909561.515436309,5204564.658005166
887025,101001634700,11/13/2015 07:56:00 PM,11/17/2015 08:30:00 AM,01/06/2016 03:00:02 PM,OVERDUE,Closed,Case Closed. Closed date : 2016-01-06 15:00:02.267 Case Resolved,Sidewalk Repair (Make Safe),Public Works Department,Highway Maintenance,Sidewalk Repair (Make Safe),BTDT_Traffic Signal_Repair,BTDT,https://mayors24.cityofboston.gov/media/boston/report/photos/564686a755a5723671ede191/report.jpg,,INTERSECTION of Beach St & Washington St  Boston  MA,4.0,1C,2.0,A1,Downtown / Financial District,4.0,Ward 3,0308,,INTERSECTION Beach St & Washington St,,Intersection,1054.0,42.3516,-71.0628,Citizens Connect App,"(42.3516, -71.0628)",-7910674.710344241,5213793.795750475,-7910674.710344241,5213793.795750475
230299,101000334546,09/26/2011 03:59:43 PM,10/24/2011 03:59:42 PM,10/04/2011 07:56:16 AM,ONTIME,Closed,Case Closed Case Resolved not at location 10/3.,Abandoned Vehicles,Transportation - Traffic Division,Enforcement & Abandoned Vehicles,Abandoned Vehicles,BTDT_AVRS Interface Queue,BTDT,,,INTERSECTION of Aldrich St & Cornell St  Roslindale  MA,12.0,06,5.0,E5,Roslindale,10.0,Ward 20,2008,,INTERSECTION Aldrich St & Cornell St,,Intersection,252.0,42.2838,-71.142,Employee Generated,"(42.2838, -71.142)",-7919491.214015068,5203586.565098337,-7919491.214015068,5203586.565098337
349555,101001788110,05/12/2016 06:32:00 AM,06/11/2016 06:32:54 AM,06/06/2016 02:07:57 PM,ONTIME,Closed,Case Closed. Closed date : 2016-06-06 14:07:57.013 VIOCOR: Violation Corrected,Rodent Activity,Inspectional Services,Environmental Services,Rodent Activity,ISD_Environmental Services (INTERNAL),ISD,https://mayors24.cityofboston.gov/media/boston/report/photos/57345bd204856e85b659154c/report.jpg,,26 Rutland St  Roxbury  MA  02118,4.0,1C,7.0,D4,Roxbury,6.0,09,0902,EA,26 Rutland St,2118.0,Address,302692.0,42.3392,-71.0755,Citizens Connect App,"(42.3392, -71.0755)",-7912088.467877317,5211926.164564157,-7912088.467877317,5211926.164564157
790826,101000399946,03/25/2012 03:54:14 PM,03/27/2012 03:00:00 PM,03/26/2012 03:03:06 PM,ONTIME,Closed,Case Closed Case Resolved This intersection was recently upgraded and it was determined that the left arrow should be taken out of the phasing sequence.,Traffic Signal Repair,Transportation - Traffic Division,Signs & Signals,Traffic Signal Repair,BTDT_Engineering_Request for Traffic Signal Study or Review,BTDT,,,INTERSECTION of W Broadway & Dorchester St  South Boston  MA,6.0,05,2.0,C6,South Boston / South Boston Waterfront,5.0,Ward 6,0604,,INTERSECTION W Broadway & Dorchester St,,Intersection,2006.0,42.3354,-71.0457,Self Service,"(42.3354, -71.0457)",-7908771.147051676,5211353.899704235,-7908771.147051676,5211353.899704235
123298,101001135527,07/23/2014 01:15:28 PM,,07/23/2014 01:17:46 PM,ONTIME,Closed,Case Closed Case Resolved Case resolved  information provided.,Call Log,Disability Department,Disability,Call Log,DISB_General_Request,DISB,,,,,,,,,,,,,,,,,42.3594,-71.0587,Constituent Call,"(0, 0)",-7910218.300431989,5214968.784796895,-7910218.300431989,5214968.784796895
25202,101001133497,07/21/2014 11:41:33 AM,,07/21/2014 11:45:51 AM,ONTIME,Closed,Case Closed Case Invalid,Schedule a Bulk Item Pickup,Public Works Department,Sanitation,Schedule a Bulk Item Pickup,PWDx_Schedule a Bulk Item Pickup,PWDx,,,11-19 Bakersfield St  Dorchester  MA  02125,7.0,03,3.0,C11,Dorchester,7.0,Ward 13,1306,E,11-19 Bakersfield St,2125.0,Address,7813.0,42.3594,-71.0587,Constituent Call,"(0, 0)",-7910218.300431989,5214968.784796895,-7910218.300431989,5214968.784796895
683282,101000776125,02/11/2013 04:09:13 PM,02/13/2013 04:09:13 PM,02/20/2013 11:05:24 AM,OVERDUE,Closed,Case Closed Case Noted,Request for Snow Plowing,Public Works Department,Street Cleaning,Request for Snow Plowing,PWDx_District 1C: Downtown,PWDx,,,INTERSECTION of Concord Sq & Public Alley No. 503  Roxbury  MA,4.0,1C,7.0,D4,South End,6.0,Ward 4,0404,,INTERSECTION Concord Sq & Public Alley No. 503,,Intersection,3408.0,42.3419,-71.0793,Constituent Call,"(42.3419, -71.0793)",-7912511.48194233,5212332.794822628,-7912511.48194233,5212332.794822628
129400,101001720510,02/19/2016 12:15:00 PM,02/23/2016 12:15:00 PM,02/19/2016 12:58:42 PM,ONTIME,Closed,Case Closed. Closed date : 2016-02-19 12:58:42.09 Case Noted cited 19 perrin for very large pile of debris on property,Improper Storage of Trash (Barrels),Public Works Department,Code Enforcement,Improper Storage of Trash (Barrels),PWDx_Code Enforcement,PWDx,,https://cityworker.cityofboston.gov:8443/attachments/report/56c74dddd0528f73f527f7ff/closed_photo/Report.jpg,19 Perrin St  Roxbury  MA  02119,7.0,10B,7.0,B2,Roxbury,13.0,Ward 12,1204,R4,19 Perrin St,2119.0,Address,109581.0,42.3229,-71.0785,Constituent Call,"(42.3229, -71.0785)",-7912422.426349696,5209471.693416313,-7912422.426349696,5209471.693416313
192576,101001281836,02/07/2015 02:59:56 PM,02/11/2015 08:30:00 AM,02/12/2015 06:01:36 PM,OVERDUE,Closed,Case Closed Case Noted Snow has been removed.,Request for Snow Plowing,Public Works Department,Street Cleaning,Request for Snow Plowing,PWDx_District 10B: Roxbury,PWDx,,,68 Homestead St  Dorchester  MA  02121,9.0,10B,7.0,B2,Roxbury,13.0,Ward 12,1209,R2,68 Homestead St,2121.0,Address,75134.0,42.3126,-71.0914,Constituent Call,"(42.3126, -71.0914)",-7913858.447780928,5207921.03643513,-7913858.447780928,5207921.03643513
27537,101000349591,11/01/2011 09:10:38 PM,11/16/2011 08:30:00 AM,11/02/2011 11:43:13 PM,ONTIME,Closed,Case Closed Case Resolved CREW REPLACED 100AMP FUSE ALL LIGHTS WORKING NOW,Street Light Outages,Public Works Department,Street Lights,Street Light Outages,PWDx_Street Light Outages,PWDx,,,INTERSECTION of Dix St & Dorchester Ave  Dorchester  MA,8.0,07,3.0,C11,Dorchester,7.0,Ward 16,1601,,INTERSECTION Dix St & Dorchester Ave,,Intersection,4093.0,42.295,-71.0617,Employee Generated,"(42.295, -71.0617)",-7910552.258904369,5205271.957292819,-7910552.258904369,5205271.957292819
526984,101000760526,02/09/2013 10:45:14 PM,02/13/2013 08:30:00 AM,02/20/2013 10:23:19 AM,OVERDUE,Closed,Case Closed Case Resolved,Request for Snow Plowing,Public Works Department,Street Cleaning,Request for Snow Plowing,PWDx_District 1C: Downtown,PWDx,,,50 Fayette St  Boston  MA  02116,4.0,1C,2.0,A1,Back Bay,6.0,Ward 5,0501,R1,50 Fayette St,2116.0,Address,57024.0,42.3483,-71.0682,Self Service,"(42.3483, -71.0682)",-7911275.835594525,5213296.72889591,-7911275.835594525,5213296.72889591
502095,101000341025,10/11/2011 10:02:44 PM,09/30/2013 10:02:43 PM,02/09/2012 05:30:30 PM,ONTIME,Closed,Case Closed NOVIO: No Violation Found/No Cause,Working Beyond Hours,Inspectional Services,Building,Working Beyond Hours,ISD_Building (INTERNAL),ISD,,,883 Harrison Ave  Roxbury  MA  02118,7.0,10B,7.0,D4,Roxbury,13.0,Ward 8,0803,CM,883 Harrison Ave,2118.0,Address,70088.0,42.3342,-71.0765,Constituent Call,"(42.3342, -71.0765)",-7912199.7873681085,5211173.191669293,-7912199.7873681085,5211173.191669293
805374,101001625925,11/02/2015 02:34:00 PM,11/03/2015 02:34:20 PM,11/03/2015 07:33:58 AM,ONTIME,Closed,Case Closed. Closed date : 2015-11-03 07:33:58.04 Case Resolved Case Resolved. Stickers delivered 11/03.,Sticker Request,Public Works Department,Recycling,Sticker Request,PWDx_Sticker Request,PWDx,,https://cityworker.cityofboston.gov:8443/attachments/report/5637bb03d052cda8c396b91a/closed_photo/Report.jpg,146 Cedar St  Roxbury  MA  02119,9.0,10B,7.0,B2,Roxbury,13.0,Ward 11,1101,R2,146 Cedar St,2119.0,Address,26783.0,42.3273,-71.0952,Constituent Call,"(42.3273, -71.0952)",-7914281.461845944,5210134.187373629,-7914281.461845944,5210134.187373629
394242,101001577221,09/13/2015 05:59:00 PM,,,ONTIME,Open,,Animal Generic Request,Animal Control,Animal Issues,Animal Generic Request,INFO01_GenericeFormforOtherServiceRequestTypes,INFO,,,30-32 Howe St  Dorchester  MA  02125,7.0,03,3.0,C11,Dorchester,8.0,Ward 15,1504,R3,30-32 Howe St,2125.0,Address,75600.0,42.3109,-71.0649,Constituent Call,"(42.3109, -71.0649)",-7910908.481274907,5207665.127158283,-7910908.481274907,5207665.127158283
807878,101001186572,10/01/2014 10:13:30 AM,10/23/2014 10:13:30 AM,10/15/2014 09:44:24 AM,ONTIME,Closed,Case Closed Case Invalid,Parking Meter Repairs,Transportation - Traffic Division,Operations,Parking Meter Repairs,BTDT_Broken Meter Complaints,BTDT,,,133 Newbury St  Boston  MA  02116,4.0,1C,8.0,D4,Back Bay,14.0,Ward 5,0507,RC,133 Newbury St,2116.0,Address,101342.0,42.3513,-71.077,Constituent Call,"(42.3513, -71.077)",-7912255.447113506,5213748.606776233,-7912255.447113506,5213748.606776233
312598,101001187170,10/02/2014 08:37:17 AM,09/21/2016 08:37:16 AM,09/09/2015 02:55:17 PM,ONTIME,Closed,Case Closed. Closed date : 2015-09-09 14:55:17.633 Case Resolved The new tree was planted by Leahy Landscaping in the Spring of 2015. The tree is under warranty until Spring 2017.,New Tree Requests,Parks & Recreation Department,Trees,New Tree Requests,PARK_New Tree Requests,PARK,,,123 Whitcomb Ave  Jamaica Plain  MA  02130,9.0,02,6.0,E13,Jamaica Plain,11.0,Ward 19,1902,R1,123 Whitcomb Ave,2130.0,Address,149187.0,42.303999999999995,-71.1317,Employee Generated,"(42.304, -71.1317)",-7918344.623259897,5206626.507515556,-7918344.623259897,5206626.507515556
548280,101001503854,08/05/2015 09:22:54 AM,08/06/2015 09:22:54 AM,08/05/2015 10:29:14 AM,ONTIME,Closed,Case Closed. Closed date : 2015-08-05 10:29:14.57 Case Resolved picked up all set,Requests for Street Cleaning,Public Works Department,Street Cleaning,Requests for Street Cleaning,PWDx_District 10B: Roxbury,PWDx,https://mayors24.cityofboston.gov/media/boston/report/photos/55c20e5d6963856559d320ad/report.jpg,https://cityworker.cityofboston.gov:8443/attachments/report/55c20e70d0529bfa9703f4bc/closed_photo/Report.jpg,5 Codman Park  Roxbury  MA  02119,9.0,10B,7.0,B2,Roxbury,13.0,Ward 11,1103,R4,5 Codman Park,2119.0,Address,34109.0,42.3203,-71.093,Citizens Connect App,"(42.3203, -71.093)",-7914036.558966199,5209080.2414915,-7914036.558966199,5209080.2414915
435025,101001889677,08/24/2016 09:05:40 AM,,08/24/2016 09:05:52 AM,ONTIME,Closed,Case Closed. Closed date : 2016-08-24 09:05:52.323 Case Resolved  -,Front Desk Interactions,Civil Rights,Call Inquiry,OCR Front Desk Interactions,HS_OCR_FrontDesk_Interactions,HS_O,,,,,,,,,,,,,,,,,42.3594,-71.0587,Constituent Call,"(0, 0)",-7910218.300431989,5214968.784796895,-7910218.300431989,5214968.784796895
465181,101001901215,09/06/2016 11:28:54 AM,09/07/2016 11:28:53 AM,09/06/2016 02:42:35 PM,ONTIME,Closed,Case Closed. Closed date : 2016-09-06 14:42:35.67 Case Resolved van left the area  will be on the look out for it,Parking Enforcement,Transportation - Traffic Division,Enforcement & Abandoned Vehicles,Parking Enforcement,BTDT_Parking Enforcement,BTDT,,,INTERSECTION of Beach St & Hudson St  Boston  MA,4.0,1C,2.0,A1,Downtown / Financial District,4.0,3,0308,,INTERSECTION Beach St & Hudson St,,Intersection,16330.0,42.3594,-71.0587,Citizens Connect App,"(0, 0)",-7910218.300431989,5214968.784796895,-7910218.300431989,5214968.784796895
145040,101000728983,12/31/2012 11:12:20 AM,01/01/2013 11:12:20 AM,12/31/2012 01:16:30 PM,ONTIME,Closed,Case Closed Case Resolved N-STAR BUTT BASE JUST LEANING POLE O.K. AND SOLID NO DAMAGE AT THIS TIME  --  REPLACED POLE DOOR,Street Light Knock Downs,Public Works Department,Street Lights,Street Light Knock Downs,PWDx_Street Light Knock Downs,PWDx,,,32 Union Park  Roxbury  MA  02118,4.0,1C,2.0,D4,South End,4.0,Ward 3,0307,CM,32 Union Park,2118.0,Address,139154.0,42.3428,-71.0718,Constituent Call,"(42.3428, -71.0718)",-7911676.58576138,5212468.342122461,-7911676.58576138,5212468.342122461
19885,101001268168,02/02/2015 05:40:47 PM,02/05/2015 08:30:00 AM,02/12/2015 05:37:49 PM,OVERDUE,Closed,Case Closed Case Noted Snow has been removed.,Request for Snow Plowing,Public Works Department,Street Cleaning,Request for Snow Plowing,PWDx_District 08: Hyde Park,PWDx,,,,,,,,,,,,,,,,,42.3594,-71.0587,Self Service,"(0, 0)",-7910218.300431989,5214968.784796895,-7910218.300431989,5214968.784796895
47406,101000959121,11/03/2013 01:48:00 AM,,11/05/2013 03:22:53 PM,ONTIME,Closed,Case Closed Case Resolved const reports items already removed by pickers,Schedule Bulk Item Pickup,Public Works Department,Sanitation,Schedule a Bulk Item Pickup SS,PWDx_Schedule a Bulk Item Pickup,PWDx,,,146 Arlington St  Brighton  MA  02135,11.0,04,9.0,D14,Allston / Brighton,15.0,Ward 22,2210,R1,146 Arlington St,2135.0,Address,4769.0,42.3524,-71.1591,Self Service,"(42.3524, -71.1591)",-7921394.777307632,5213914.300736275,-7921394.777307632,5213914.300736275
726157,101000336143,09/29/2011 02:05:21 PM,01/27/2012 02:05:21 PM,,OVERDUE,Open,,Unsatisfactory Living Conditions,Inspectional Services,Housing,Unsatisfactory Living Conditions,ISD_Housing (INTERNAL),ISD,,,25 Dunlap St  Dorchester  MA  02124,8.0,07,4.0,B3,Dorchester,9.0,Ward 17,1703,R3,25 Dunlap St,2124.0,Address,227012.0,42.2929,-71.0734,Constituent Call,"(42.2929, -71.0734)",-7911854.69694665,5204955.923428589,-7911854.69694665,5204955.923428589
194991,101001004027,01/13/2014 01:11:55 PM,,01/22/2014 04:33:42 PM,ONTIME,Closed,Case Closed Bulk Item Automation,Schedule a Bulk Item Pickup,Public Works Department,Sanitation,Schedule a Bulk Item Pickup,PWDx_Schedule a Bulk Item Pickup,PWDx,,,5-43 Highcrest Rd  Roslindale  MA  02131,12.0,06,5.0,E5,Roslindale,10.0,18,1811,,5-43 Highcrest Rd,2131.0,Address,342084.0,42.2753,-71.1377,Constituent Call,"(42.2753, -71.1377)",-7919012.540204656,5202307.6727747675,-7919012.540204656,5202307.6727747675
1773,101001293162,02/13/2015 10:38:15 AM,02/18/2015 10:38:15 AM,02/17/2015 06:17:28 AM,ONTIME,Closed,Case Closed Case Noted,Request for Snow Plowing,Public Works Department,Street Cleaning,Request for Snow Plowing,PWDx_District 07: South Dorchester,PWDx,https://mayors24.cityofboston.gov/media/boston/report/photos/54de1a5d04853bb77fd30c43/report.jpg,,1203-1205 Adams St  Dorchester  MA  02124,8.0,07,3.0,C11,Dorchester,7.0,Ward 17,1713,RC,1203-1205 Adams St,2124.0,Address,473.0,42.2725,-71.0673,Citizens Connect App,"(42.2725, -71.0673)",-7911175.648052812,5201886.428367288,-7911175.648052812,5201886.428367288
757698,101001748309,03/17/2016 06:43:00 AM,03/18/2016 06:43:08 AM,03/17/2016 09:10:46 AM,ONTIME,Closed,Case Closed. Closed date : 2016-03-17 09:10:46.037 Case Resolved Is flasher there and working,Traffic Signal Inspection,Transportation - Traffic Division,Signs & Signals,Traffic Signal Inspection,BTDT_Traffic Signal_Repair,BTDT,,,INTERSECTION of Mountfort St & Beacon St  Boston  MA,4.0,10A,7.0,D4,Fenway / Kenmore / Audubon Circle / Longwood,14.0,21,2102,,INTERSECTION Mountfort St & Beacon St,,Intersection,17262.0,42.3594,-71.0587,Constituent Call,"(0, 0)",-7910218.300431989,5214968.784796895,-7910218.300431989,5214968.784796895
457049,101001195635,10/14/2014 10:50:05 AM,11/28/2014 10:50:05 AM,01/20/2015 03:14:08 PM,OVERDUE,Closed,Case Closed Case Noted This is a main arterial for trucks.. Can't post,New Sign  Crosswalk or Pavement Marking,Transportation - Traffic Division,Signs & Signals,New Sign  Crosswalk or Pavement Marking,BTDT_Engineering_New Sign and Pavement Marking Requests,BTDT,,,INTERSECTION of Ernest Ave & W Milton St  Hyde Park  MA,,08,5.0,E18,Hyde Park,10.0,Ward 18,1820,,INTERSECTION Ernest Ave & W Milton St,,Intersection,4623.0,42.2408,-71.1436,Constituent Call,"(42.2408, -71.1436)",-7919669.325200339,5197118.6444698535,-7919669.325200339,5197118.6444698535
499681,101001297548,02/16/2015 10:12:23 AM,02/19/2015 08:30:00 AM,02/24/2015 08:28:56 AM,OVERDUE,Closed,Case Closed Case Resolved,Request for Snow Plowing,Public Works Department,Street Cleaning,Request for Snow Plowing,PWDx_District 03: North Dorchester,PWDx,,,368 Bowdoin St  Dorchester  MA  02122,7.0,03,3.0,C11,Dorchester,8.0,15,1504,R2,368 Bowdoin St,2122.0,Address,17734.0,42.309,-71.0644,Constituent Call,"(42.309, -71.0644)",-7910852.821529511,5207379.1190868225,-7910852.821529511,5207379.1190868225
604384,101001064114,04/09/2014 08:49:42 AM,04/11/2014 08:49:42 AM,04/09/2014 01:56:38 PM,ONTIME,Closed,Case Closed Case Resolved,Requests for Street Cleaning,Public Works Department,Street Cleaning,Requests for Street Cleaning,PWDx_District 08: Hyde Park,PWDx,,,INTERSECTION of Belnel Rd & Poydras St  Mattapan  MA,8.0,08,5.0,E18,Hyde Park,9.0,Ward 18,1805,,INTERSECTION Belnel Rd & Poydras St,,Intersection,1285.0,42.2633,-71.1045,City Worker App,"(42.2633, -71.1045)",-7915316.733110321,5200502.471342062,-7915316.733110321,5200502.471342062
96650,101000436620,06/14/2012 11:04:32 AM,,06/22/2012 09:07:10 AM,ONTIME,Closed,Case Closed Bulk Item Automation,Schedule a Bulk Item Pickup,Public Works Department,Sanitation,Schedule a Bulk Item Pickup,PWDx_Schedule a Bulk Item Pickup,PWDx,,,11 Chase St  Dorchester  MA  02125,7.0,03,3.0,C11,Dorchester,7.0,Ward 13,1306,R3,11 Chase St,2125.0,Address,30060.0,42.3183,-71.0596,Self Service,"(42.3183, -71.0596)",-7910318.487973703,5208779.13563285,-7910318.487973703,5208779.13563285
115165,101000850771,06/01/2013 11:43:39 AM,07/01/2013 11:43:39 AM,,OVERDUE,Open,,No Utilities Residential - Electricity,Inspectional Services,Housing,No Utilities Residential - Electricity,ISD_Housing (INTERNAL),ISD,,,608 Park St  Dorchester  MA  02124,8.0,07,4.0,B3,Dorchester,9.0,Ward 17,1703,R3,608 Park St,2124.0,Address,289985.0,42.2944,-71.0777,Constituent Call,"(42.2944, -71.0777)",-7912333.37075706,5205181.660827755,-7912333.37075706,5205181.660827755
319759,101001091230,05/16/2014 11:27:02 AM,,05/20/2014 04:37:36 PM,ONTIME,Closed,Case Closed Bulk Item Automation,Schedule a Bulk Item Pickup,Public Works Department,Sanitation,Schedule a Bulk Item Pickup,PWDx_Schedule a Bulk Item Pickup,PWDx,,,26 Appleton St  Boston  MA  02116,4.0,1C,2.0,D4,South End,6.0,Ward 5,0501,R4,26 Appleton St,2116.0,Address,3967.0,42.3459,-71.0714,Constituent Call,"(42.3459, -71.0714)",-7911632.057965063,5212935.242118729,-7911632.057965063,5212935.242118729
634409,101000342181,10/14/2011 08:26:40 AM,10/15/2011 08:26:40 AM,02/09/2012 06:06:01 PM,OVERDUE,Closed,Case Closed VIOCOR: Violation Corrected,Unsafe/Dangerous Conditions,Inspectional Services,Building,Unsafe Dangerous Conditions,ISD_Building (INTERNAL),ISD,,,70 Pleasant St  Dorchester  MA  02125,7.0,03,3.0,C11,Dorchester,7.0,Ward 13,1309,R2,70 Pleasant St,2125.0,Address,111248.0,42.3137,-71.059,Constituent Call,"(42.3137, -71.059)",-7910251.696279226,5208086.628474029,-7910251.696279226,5208086.628474029
427345,101001229757,12/08/2014 11:05:43 AM,,12/09/2014 04:41:04 PM,ONTIME,Closed,Case Closed Bulk Item Automation,Schedule a Bulk Item Pickup,Public Works Department,Sanitation,Schedule a Bulk Item Pickup,PWDx_Schedule a Bulk Item Pickup,PWDx,,,122 Aldrich St  Roslindale  MA  02131,12.0,06,5.0,E5,Roslindale,10.0,Ward 20,2008,R2,122 Aldrich St,2131.0,Address,1820.0,42.2829,-71.1427,Constituent Call,"(42.2829, -71.1427)",-7919569.137658624,5203451.144803386,-7919569.137658624,5203451.144803386
603197,101001135954,07/24/2014 08:03:59 AM,07/28/2014 08:30:00 AM,07/24/2014 09:31:40 AM,ONTIME,Closed,Case Closed Case Noted delivered,Sticker Request,Public Works Department,Recycling,Sticker Request,PWDx_Sticker Request,PWDx,,,32 Montgomery St  Roxbury  MA  02118,4.0,1C,2.0,D4,South End,6.0,Ward 4,0401,R2,32 Montgomery St,2118.0,Address,96677.0,42.3437,-71.0731,Constituent Call,"(42.3437, -71.0731)",-7911821.301099411,5212603.891362616,-7911821.301099411,5212603.891362616
520390,101000456254,07/26/2012 08:26:19 PM,,07/30/2012 09:47:02 PM,ONTIME,Closed,Case Closed Bulk Item Automation,Schedule a Bulk Item Pickup,Public Works Department,Sanitation,Schedule a Bulk Item Pickup,PWDx_Schedule a Bulk Item Pickup,PWDx,,,94 Beechcroft St  Brighton  MA  02135,11.0,04,9.0,D14,Allston / Brighton,15.0,Ward 22,2210,R3,94 Beechcroft St,2135.0,Address,186056.0,42.352,-71.1614,Self Service,"(42.352, -71.1614)",-7921650.812136458,5213854.048051648,-7921650.812136458,5213854.048051648
772184,101001852278,07/06/2016 10:37:00 AM,07/07/2016 10:37:30 AM,07/07/2016 07:21:48 AM,ONTIME,Closed,Case Closed. Closed date : 2016-07-07 07:21:48.54 Case Noted I serviced above address at 7:20am,Missed Bulk Item Pickup: District 04,Public Works Department,Sanitation,Missed Trash/Recycling/Yard Waste/Bulk Item,PWDx_Missed Trash\Recycling\Yard Waste\Bulk Item,PWDx,,https://cityworker.cityofboston.gov:8443/attachments/report/577d17dad052f42207ec5670/closed_photo/Report.jpg,22 Beechcroft St  Brighton  MA  02135,11.0,04,9.0,D14,Allston / Brighton,15.0,Ward 22,2210,R4,22 Beechcroft St,2135.0,Address,13370.0,42.35,-71.1614,Constituent Call,"(42.35, -71.1614)",-7921650.812136458,5213552.790380158,-7921650.812136458,5213552.790380158
40689,101000478366,09/13/2012 09:08:54 AM,,09/13/2012 09:56:59 AM,ONTIME,Closed,Case Closed Case Invalid,Schedule a Bulk Item Pickup,Public Works Department,Sanitation,Schedule a Bulk Item Pickup,PWDx_Schedule a Bulk Item Pickup,PWDx,,,,,,,,,,,,,,,,,42.3594,-71.0587,Employee Generated,"(0, 0)",-7910218.300431989,5214968.784796895,-7910218.300431989,5214968.784796895
514107,101001869668,07/27/2016 06:12:00 PM,09/30/2016 08:30:00 AM,07/28/2016 02:36:35 PM,ONTIME,Closed,Case Closed. Closed date : 2016-07-28 14:36:35.68 Case Resolved done,Graffiti Removal,Property Management,Graffiti,Graffiti Removal,PROP_GRAF_GraffitiRemoval,PROP,,https://cityworker.cityofboston.gov:8443/attachments/report/5799322d70b477fe9e36479b/closed_photo/Report.jpg,257-259 Cambridge St  Allston  MA  02134,11.0,04,9.0,D14,Allston / Brighton,15.0,Ward 22,2201,C,257-259 Cambridge St,2134.0,Address,25105.0,42.3576,-71.128,Citizens Connect App,"(42.3576, -71.128)",-7917932.741143961,5214697.620534184,-7917932.741143961,5214697.620534184
72311,101001885802,08/18/2016 01:19:00 PM,08/19/2016 01:19:05 PM,08/18/2016 01:23:14 PM,ONTIME,Closed,Case Closed. Closed date : 2016-08-18 13:23:14.78 Case Invalid Constituent reports they came back for the trash.,Missed Trash: District 10B,Public Works Department,Sanitation,Missed Trash/Recycling/Yard Waste/Bulk Item,PWDx_Missed Trash\Recycling\Yard Waste\Bulk Item,PWDx,,,55 Saint James St  Roxbury  MA  02119,7.0,10B,7.0,B2,Roxbury,13.0,Ward 12,1201,R2,55 Saint James St,2119.0,Address,121179.0,42.327,-71.086,Constituent Call,"(42.327, -71.086)",-7913257.322530645,5210089.01585916,-7913257.322530645,5210089.01585916
104039,101001257219,01/28/2015 09:17:47 AM,01/30/2015 09:17:47 AM,01/31/2015 08:22:13 AM,OVERDUE,Closed,Case Closed Case Resolved,Request for Snow Plowing,Public Works Department,Street Cleaning,Request for Snow Plowing,PWDx_District 10B: Roxbury,PWDx,,,4 Fountain St  Roxbury  MA  02119,7.0,10B,7.0,B2,Roxbury,13.0,Ward 12,1201,R3,4 Fountain St,2119.0,Address,59749.0,42.3249,-71.0846,Constituent Call,"(42.3249, -71.0846)",-7913101.475243535,5209772.82128938,-7913101.475243535,5209772.82128938
497226,101001882921,08/15/2016 10:53:00 AM,08/29/2016 10:53:48 AM,08/24/2016 10:56:41 AM,ONTIME,Closed,Case Closed. Closed date : 2016-08-24 10:56:41.903 Case Resolved,Sign Repair,Transportation - Traffic Division,Signs & Signals,Sign Repair,BTDT_Sign Shop_Sign Installation,BTDT,,,330-338 Belgrade Ave  Roslindale  MA  02131,12.0,06,5.0,E5,Roslindale,10.0,Ward 20,2008,C,330-338 Belgrade Ave,2131.0,Address,13657.0,42.2859,-71.1451,City Worker App,"(42.2859, -71.1451)",-7919836.304436528,5203902.553309751,-7919836.304436528,5203902.553309751
511819,101001571779,09/08/2015 07:19:29 AM,09/22/2015 08:30:00 AM,09/08/2015 08:10:27 AM,ONTIME,Closed,Case Closed. Closed date : 2015-09-08 08:10:27.767 Duplicate of Existing Case Duplicate CRM,Sign Repair,Transportation - Traffic Division,Signs & Signals,Sign Repair,BTDT_District 01,BTDT,,,94-98 Chester St  Allston  MA  02134,11.0,04,9.0,D14,Allston / Brighton,15.0,Ward 21,2104,EA,94-98 Chester St,2134.0,Address,163293.0,42.354,-71.1282,Citizens Connect App,"(42.354, -71.1282)",-7917955.005042122,5214155.315309461,-7917955.005042122,5214155.315309461
151703,101001006376,01/15/2014 03:23:40 PM,01/17/2014 03:23:39 PM,01/16/2014 11:23:47 AM,ONTIME,Closed,Case Closed Case Noted pothole patched,Request for Pothole Repair,Public Works Department,Highway Maintenance,Request for Pothole Repair,PWDx_District 02: Jamaica Plain,PWDx,,,INTERSECTION of Bussey St & South St  Jamaica Plain  MA,12.0,02,6.0,E13,Jamaica Plain,11.0,Ward 19,1902,,INTERSECTION Bussey St & South St,,Intersection,2256.0,42.2956,-71.122,Constituent Call,"(42.2956, -71.122)",-7917264.8241992025,5205362.254618151,-7917264.8241992025,5205362.254618151
900561,101001975375,12/22/2016 06:37:00 PM,01/10/2017 08:30:00 AM,,OVERDUE,Open,,PRINTED : robert,Public Works Department,Street Lights,Street Light Outages,PWDx_Street Light Outages,PWDx,,,94 Saint Rose St  Jamaica Plain  MA  02130,9.0,02,6.0,E13,Jamaica Plain,11.0,Ward 11,1110,R2,94 Saint Rose St,2130.0,Address,121552.0,42.3047,-71.1184,Citizens Connect App,"(42.3047, -71.1184)",-7916864.074032347,5206731.869537142,-7916864.074032347,5206731.869537142
774515,101001682013,12/26/2015 10:32:02 AM,12/29/2015 08:30:00 AM,12/26/2015 10:44:30 AM,ONTIME,Closed,Case Closed. Closed date : 2015-12-26 10:44:30.253 Case Resolved Trash bags picked up,CE Collection,Public Works Department,Street Cleaning,CE Collection,PWDx_District 1C: Downtown,PWDx,https://cityworker.cityofboston.gov:8443/attachments/report/567eb2f070b480b2278e3ecf/photo/Report.jpg,https://cityworker.cityofboston.gov:8443/attachments/report/567eb2f070b480b2278e3ecf/closed_photo/Report.jpg,111 Chandler St  Boston  MA  02116,4.0,1C,2.0,D4,South End,6.0,Ward 4,0401,R3,111 Chandler St,2116.0,Address,28633.0,42.3464,-71.0737,City Worker App,"(42.3464, -71.0737)",-7911888.092793888,5213010.550725897,-7911888.092793888,5213010.550725897
698965,101001198182,10/16/2014 05:35:47 PM,10/05/2016 05:35:47 PM,10/22/2014 02:45:03 PM,ONTIME,Closed,Case Closed VIOISS: Violation Filed,Working Beyond Hours,Inspectional Services,Building,Working Beyond Hours,ISD_Building (INTERNAL),ISD,,,91 Waldeck St  Dorchester  MA  02124,7.0,03,4.0,C11,Dorchester,8.0,Ward 17,1702,R3,91 Waldeck St,2124.0,Address,141452.0,42.299,-71.0652,Self Service,"(42.299, -71.0652)",-7910941.877122146,5205873.955712453,-7910941.877122146,5205873.955712453
531203,101001867256,07/25/2016 11:56:00 AM,,07/25/2016 12:57:08 PM,ONTIME,Closed,Case Closed. Closed date : 2016-07-25 12:57:08.78 Case Resolved 1 syringe recovered from 1 Nashua Street  West End.,Needle Pickup,Mayor's 24 Hour Hotline,Needle Program,Needle Pickup,GEN_Needle_Pickup,GEN_,,,1 Nashua St  Boston  MA  02114,3.0,1B,8.0,A1,Boston,3.0,03,,,1 Nashua St,2114.0,Address,347406.0,42.3659,-71.0633,Constituent Call,"(42.3659, -71.0633)",-7910730.370089638,5215948.053756246,-7910730.370089638,5215948.053756246
416789,101000333073,09/23/2011 08:18:43 AM,10/07/2011 08:18:42 AM,01/04/2012 10:29:18 AM,OVERDUE,Closed,Case Closed Case Resolved completed,Street Light Outages,Public Works Department,Street Lights,Street Light Outages,PWDx_Street Light_Pending_Contractor (Internal),PWDx,,,59 Mattapan St  Mattapan  MA  02126,8.0,07,5.0,B3,Greater Mattapan,9.0,Ward 18,1803,R1,59 Mattapan St,2126.0,Address,92849.0,42.2781,-71.0956,Constituent Call,"(42.2781, -71.0956)",-7914325.9896422615,5202728.935898161,-7914325.9896422615,5202728.935898161
512792,101001519142,08/12/2015 09:57:00 AM,08/11/2016 09:57:49 AM,11/09/2015 10:57:21 AM,ONTIME,Closed,Case Closed. Closed date : 2015-11-09 10:57:21.81 Case Noted Tree was replaced.,Tree Maintenance Requests,Parks & Recreation Department,Trees,Tree Maintenance Requests,PARK_Tree Maintenance Request,PARK,,,55 Revere St  Boston  MA  02114,3.0,1B,8.0,A1,Beacon Hill,14.0,Ward 5,0504,A,55 Revere St,2114.0,Address,115417.0,42.3597,-71.0684,Constituent Call,"(42.3597, -71.0684)",-7911298.099492684,5215013.979595871,-7911298.099492684,5215013.979595871
461247,101001970172,12/14/2016 11:28:00 AM,12/15/2016 11:28:51 AM,12/19/2016 01:50:22 PM,OVERDUE,Closed,Case Closed. Closed date : 2016-12-19 13:50:22.92 Case Resolved,Sidewalk Repair (Make Safe),Public Works Department,Highway Maintenance,Sidewalk Repair (Make Safe),PWDx_Highway Construction,PWDx,https://mayors24.cityofboston.gov/media/boston/report/photos/5851733c0485b8e8d344f667/report.jpg,,2 Alveston St  Jamaica Plain  MA  02130,9.0,02,6.0,E13,Jamaica Plain,11.0,Ward 19,1906,CD,2 Alveston St,2130.0,Address,3027.0,42.3118,-71.1119,Citizens Connect App,"(42.3118, -71.1119)",-7916140.497342192,5207800.607679141,-7916140.497342192,5207800.607679141
13557,101000338178,10/04/2011 03:50:10 PM,10/06/2011 03:50:10 PM,10/05/2011 03:13:26 PM,ONTIME,Closed,Case Closed Case Resolved  delivered  pb,Sticker Request,Public Works Department,Recycling,Sticker Request,PWDx_Sticker Request,PWDx,,,88 Orient Ave  East Boston  MA  02128,1.0,09,1.0,A7,East Boston,1.0,Ward 1,0113,R2,88 Orient Ave,2128.0,Address,105644.0,42.39,-71.0032,Constituent Call,"(42.39, -71.0032)",-7904040.068692963,5219579.766326172,-7904040.068692963,5219579.766326172
925470,101002011080,02/13/2017 11:52:00 AM,02/15/2017 11:52:26 AM,02/13/2017 01:01:51 PM,ONTIME,Closed,Case Closed. Closed date : 2017-02-13 13:01:51.09 Case Noted cited for nonshovel,Unshoveled Sidewalk,Public Works Department,Code Enforcement,Unshoveled Sidewalk,PWDx_Code Enforcement,PWDx,,,85 Allston St  Allston  MA  02134,11.0,04,9.0,D14,Allston,15.0,21,2106,,85 Allston St,2134.0,Address,342014.0,42.3505,-71.1367,Constituent Call,"(42.3505, -71.1367)",-7918901.220713865,5213628.103899366,-7918901.220713865,5213628.103899366
677865,101001335341,03/17/2015 03:29:00 PM,,03/20/2015 04:37:30 PM,ONTIME,Closed,Case Closed Bulk Item Automation,Schedule Bulk Item Pickup,Public Works Department,Sanitation,Schedule a Bulk Item Pickup SS,PWDx_Schedule a Bulk Item Pickup,PWDx,,,115-119 Chauncy St  Boston  MA  02111,3.0,1C,2.0,A1,Downtown / Financial District,4.0,Ward 3,0308,EA,115-119 Chauncy St,2111.0,Address,30103.0,42.3527,-71.0612,Self Service,"(42.3527, -71.0612)",-7910496.5991589725,5213959.490501389,-7910496.5991589725,5213959.490501389
200443,101000359111,12/01/2011 08:01:32 AM,12/15/2011 08:01:31 AM,,OVERDUE,Open,,Other: Comment,Mayor's 24 Hour Hotline,Employee & General Comments,General Comments For a Program or Policy,INFO_General Comments Complaints Compliments,INFO,,,,,,,,,,,,,,,,,42.3594,-71.0587,Constituent Call,"(0, 0)",-7910218.300431989,5214968.784796895,-7910218.300431989,5214968.784796895
299033,101000449126,07/13/2012 07:23:41 AM,07/16/2012 07:23:35 AM,07/13/2012 11:03:40 AM,ONTIME,Closed,Case Closed Case Resolved cat. pick up at. location..,Pick up Dead Animal,Public Works Department,Street Cleaning,Pick up Dead Animal,PWDx_District 07: South Dorchester,PWDx,,,19 Oakridge St  Mattapan  MA  02126,8.0,07,3.0,B3,Dorchester,7.0,Ward 17,1712,R1,19 Oakridge St,2126.0,Address,104862.0,42.2775,-71.0747,Employee Generated,"(42.2775, -71.0747)",-7911999.412284682,5202638.663653155,-7911999.412284682,5202638.663653155
261585,101000767264,02/10/2013 01:46:39 PM,02/13/2013 08:30:00 AM,02/20/2013 04:17:50 PM,OVERDUE,Closed,Case Closed Case Noted  Thank you for contacting us.  The district yard did receive your request when submitted.  We apologize for the lateness of this response.,Request for Snow Plowing,Public Works Department,Street Cleaning,Request for Snow Plowing,PWDx_District 1A: Charlestown,PWDx,,,62 Sullivan St  Charlestown  MA  02129,3.0,1A,1.0,A15,Charlestown,2.0,Ward 2,0206,CM,62 Sullivan St,2129.0,Address,131846.0,42.3791,-71.0652,Constituent Call,"(42.3791, -71.0652)",-7910941.877122146,5217937.0348873595,-7910941.877122146,5217937.0348873595
116112,101001287387,02/11/2015 08:16:27 AM,02/13/2015 08:30:00 AM,04/13/2015 05:19:13 PM,OVERDUE,Closed,Case Closed Case Noted Thank you for your request. This service request is now considered closed due to the recent arrival of Spring. The City worked around the clock this winter to address the record-breaking snowfall and we hope that many of your concerns were resolved. We encourage you to let us know of any additional issues and thank you for working with us to make the City a better place. Thank you for your patience and we apologize for any requests that we were not able to get to.,Request for Snow Plowing,Public Works Department,Street Cleaning,Request for Snow Plowing,PWDx_District 10B: Roxbury,PWDx,,,155 Northampton St  Roxbury  MA  02118,7.0,10B,7.0,D4,Roxbury,13.0,Ward 9,0903,E,155 Northampton St,2118.0,Address,103687.0,42.3367,-71.0782,Constituent Call,"(42.3367, -71.0782)",-7912389.030502457,5211549.670633245,-7912389.030502457,5211549.670633245
692462,101001108303,06/13/2014 09:21:41 AM,06/16/2014 09:21:40 AM,06/19/2014 12:37:15 PM,OVERDUE,Closed,Case Closed Case Resolved,Traffic Signal Repair,Transportation - Traffic Division,Signs & Signals,Traffic Signal Repair,BTDT_Traffic Signal_Repair,BTDT,,,INTERSECTION of North St & Surface Rd  Boston  MA,3.0,1B,1.0,A1,Downtown / Financial District,3.0,Ward 3,0303,,INTERSECTION North St & Surface Rd,,Intersection,7618.0,42.3616,-71.0552,Constituent Call,"(42.3616, -71.0552)",-7909828.682214212,5215300.218333665,-7909828.682214212,5215300.218333665
732186,101001400157,06/01/2015 10:06:00 PM,06/03/2015 08:30:00 AM,06/02/2015 01:10:55 PM,ONTIME,Closed,Case Closed. Closed date : 2015-06-02 13:10:55.56 Case Resolved done,Request for Pothole Repair,Public Works Department,Highway Maintenance,Request for Pothole Repair,PWDx_District 04: Allston/Brighton,PWDx,,https://cityworker.cityofboston.gov:8443/attachments/report/556d0fd5d052e132f653241d/closed_photo/Report.jpg,INTERSECTION of Claymoss Rd & Euston Rd  Brighton  MA,11.0,04,9.0,D14,Allston / Brighton,15.0,Ward 21,2111,,INTERSECTION Claymoss Rd & Euston Rd,,Intersection,3102.0,42.3441,-71.1451,Self Service,"(42.3441, -71.1451)",-7919836.304436528,5212664.136092194,-7919836.304436528,5212664.136092194
358244,101001751619,03/22/2016 05:19:00 PM,03/25/2016 08:30:00 AM,03/22/2016 08:26:53 PM,ONTIME,Closed,Case Closed. Closed date : 2016-03-22 20:26:53.89 Case Noted Ticket has been issued and sent in for collection.,Improper Storage of Trash (Barrels),Public Works Department,Code Enforcement,Improper Storage of Trash (Barrels),PWDx_Code Enforcement,PWDx,,,6 Dartmouth Pl  Boston  MA  02116,4.0,1C,2.0,D4,South End,6.0,Ward 4,0401,R2,6 Dartmouth Pl,2116.0,Address,46292.0,42.3449,-71.074,Constituent Call,"(42.3449, -71.074)",-7911921.488641125,5212784.626701254,-7911921.488641125,5212784.626701254
873893,101001872879,08/01/2016 02:15:39 PM,,08/09/2016 04:30:27 PM,ONTIME,Closed,Case Closed. Closed date : 2016-08-09 16:30:27.693 Bulk Item Automation,Schedule Bulk Item Pickup,Public Works Department,Sanitation,Schedule a Bulk Item Pickup SS,PWDx_Schedule a Bulk Item Pickup,PWDx,,,8 Chesterfield St  Hyde Park  MA  02136,12.0,08,5.0,E18,Hyde Park,10.0,Ward 18,1820,R1,8 Chesterfield St,2136.0,Address,30977.0,42.2405,-71.1339,Self Service,"(42.2405, -71.1339)",-7918589.526139643,5197073.534931305,-7918589.526139643,5197073.534931305
267309,101001938005,10/24/2016 04:08:00 PM,,10/25/2016 01:50:27 PM,ONTIME,Closed,Case Closed. Closed date : 2016-10-25 13:50:27.44 Case Noted,Fire: Other,Mayor's 24 Hour Hotline,Notification,Notification,INFO09_Current Events,INFO,,,703 Gallivan Blvd  Dorchester  MA  02124,8.0,07,3.0,C11,Dorchester,7.0,Ward 16,1612,CM,703 Gallivan Blvd,2124.0,Address,62391.0,42.2833,-71.0476,Constituent Call,"(42.2833, -71.0476)",-7908982.654084184,5203511.331362321,-7908982.654084184,5203511.331362321
377762,101001423746,07/06/2015 01:31:00 PM,07/22/2015 01:31:27 PM,07/15/2015 08:58:29 AM,ONTIME,Closed,Case Closed Case Resolved  t976 reports vehicle not at location 7/14.,Abandoned Vehicles,Transportation - Traffic Division,Enforcement & Abandoned Vehicles,Abandoned Vehicles,BTDT_AVRS Interface Queue,BTDT,,,180 Sycamore St  Roslindale  MA  02131,12.0,02,5.0,E5,Roslindale,10.0,19,1913,,180 Sycamore St,2131.0,Address,345466.0,42.2867,-71.1228,Constituent Call,"(42.2867, -71.1228)",-7917353.879791836,5204022.932541867,-7917353.879791836,5204022.932541867
835453,101000859575,06/13/2013 06:44:48 PM,06/18/2013 08:30:00 AM,06/14/2013 07:55:49 AM,ONTIME,Closed,Case Closed Case Resolved 55 gal barrel with loose trash  too heavy. trash must be properly bagged.,Missed Trash: District 08,Public Works Department,Sanitation,Missed Trash/Recycling/Yard Waste/Bulk Item,PWDx_Missed Trash\Recycling\Yard Waste\Bulk Item,PWDx,,,230-232 Huntington Ave  Hyde Park  MA  02136,12.0,08,5.0,E18,Hyde Park,10.0,Ward 18,1808,R2,230-232 Huntington Ave,2136.0,Address,76505.0,42.2701,-71.1185,Constituent Call,"(42.2701, -71.1185)",-7916875.205981427,5201525.37662662,-7916875.205981427,5201525.37662662
130131,101001961802,11/30/2016 10:47:54 PM,,12/06/2016 04:31:44 PM,ONTIME,Closed,Case Closed. Closed date : 2016-12-06 16:31:44.037 Bulk Item Automation,Schedule Bulk Item Pickup,Public Works Department,Sanitation,Schedule a Bulk Item Pickup SS,PWDx_Schedule a Bulk Item Pickup,PWDx,,,124 Washington St  Brighton  MA  02135,11.0,04,9.0,D14,Allston / Brighton,15.0,Ward 21,2111,R2,124 Washington St,2135.0,Address,329042.0,42.3448,-71.1452,Self Service,"(42.3448, -71.1452)",-7919847.436385607,5212769.5652912725,-7919847.436385607,5212769.5652912725
346566,101001950221,11/12/2016 10:13:07 AM,11/15/2016 08:30:00 AM,11/12/2016 10:37:07 AM,ONTIME,Closed,Case Closed. Closed date : 2016-11-12 10:37:07.94 Case Resolved,CE Collection,Public Works Department,Street Cleaning,CE Collection,PWDx_District 1A: Charlestown,PWDx,https://cityworker.cityofboston.gov:8443/attachments/report/5827317fd052f94a0fbcdaab/photo/Report.jpg,,209 Main St  Charlestown  MA  02129,3.0,1A,1.0,A15,Charlestown,2.0,Ward 2,0201,RC,209 Main St,2129.0,Address,267356.0,42.3764,-71.0652,City Worker App,"(42.3764, -71.0652)",-7910941.877122146,5217530.163828506,-7910941.877122146,5217530.163828506
282666,101000320113,08/28/2011 12:21:47 PM,08/30/2011 12:21:45 PM,08/29/2011 08:43:22 PM,ONTIME,Closed,Case Closed Case Resolved WHOLE CITY TREE WAS REMOVED BY NORTHERN TREE SERVICE AND TREE TECH.,Tree Emergencies,Parks & Recreation Department,Trees,Tree Emergencies,PARK_Tree Emergencies,PARK,,,143 Kenrick St  Brighton  MA  02135,11.0,04,9.0,D14,Allston / Brighton,15.0,Ward 22,2204,R1,143 Kenrick St,2135.0,Address,81283.0,42.3468,-71.1683,Employee Generated,"(42.3468, -71.1683)",-7922418.916622932,5213070.7980428925,-7922418.916622932,5213070.7980428925
659372,101001106070,06/09/2014 04:05:02 PM,,06/12/2014 04:38:27 PM,ONTIME,Closed,Case Closed Bulk Item Automation,Schedule a Bulk Item Pickup,Public Works Department,Sanitation,Schedule a Bulk Item Pickup,PWDx_Schedule a Bulk Item Pickup,PWDx,,,86-94 Crispus Attucks Pl  Roxbury  MA  02119,9.0,10B,7.0,B2,Roxbury,13.0,09,905.0,,86-94 Crispus Attucks Pl,2119.0,Address,163981.0,42.3241,-71.0883,Constituent Call,"(42.3241, -71.0883)",-7913513.35735947,5209652.368991437,-7913513.35735947,5209652.368991437
784034,101000731815,01/04/2013 06:57:06 PM,01/21/2013 08:30:00 AM,01/14/2013 03:04:47 PM,ONTIME,Closed,Case Closed Case Resolved Repaired on w/o 270288,Street Light Outages,Public Works Department,Street Lights,Street Light Outages,PWDx_Street Light Outages,PWDx,,,115 Dale St  Roxbury  MA  02119,7.0,10B,7.0,B2,Roxbury,13.0,Ward 9,0905,A,115 Dale St,2119.0,Address,45718.0,42.3227,-71.0885,Constituent Call,"(42.3227, -71.0885)",-7913535.621257628,5209441.581155489,-7913535.621257628,5209441.581155489
172232,101001335028,03/17/2015 12:38:10 PM,03/18/2015 12:38:10 PM,03/17/2015 03:12:28 PM,ONTIME,Closed,Case Closed Case Resolved picked up tv,Requests for Street Cleaning,Public Works Department,Street Cleaning,Requests for Street Cleaning,PWDx_District 05: South Boston,PWDx,https://cityworker.cityofboston.gov:8443/attachments/report/5508586dd052dab9f2a8a393/photo/Report.jpg,,INTERSECTION of Boston St & Father A Songin Way  South Boston  MA,6.0,05,2.0,C6,South Boston / South Boston Waterfront,5.0,Ward 7,0706,,INTERSECTION Boston St & Father A Songin Way,,Intersection,1671.0,42.3281,-71.0579,City Worker App,"(42.3281, -71.0579)",-7910129.2448393535,5210254.645798727,-7910129.2448393535,5210254.645798727
933963,101002021665,02/21/2017 08:45:05 PM,02/23/2017 08:30:00 AM,02/21/2017 09:41:13 PM,ONTIME,Closed,Case Closed. Closed date : 2017-02-21 21:41:13.657 Case Noted all bus stops are clear at this time.,Parking Enforcement,Transportation - Traffic Division,Enforcement & Abandoned Vehicles,Parking Enforcement,BTDT_Parking Enforcement,BTDT,https://mayors24.cityofboston.gov/media/boston/report/photos/58aced1b0485bf1c66167591/report.jpg,,237 Boston St  Dorchester  MA  02125,6.0,03,2.0,C6,Dorchester,5.0,Ward 7,0709,R3,237 Boston St,2125.0,Address,17143.0,42.3218,-71.0615,Citizens Connect App,"(42.3218, -71.0615)",-7910529.995006209,5209306.077166308,-7910529.995006209,5209306.077166308
674162,101000452531,07/19/2012 08:59:18 PM,07/23/2012 08:30:00 AM,07/20/2012 02:49:01 PM,ONTIME,Closed,Case Closed Case Resolved,Traffic Signal Repair,Transportation - Traffic Division,Signs & Signals,Traffic Signal Repair,BTDT_Traffic Signal_Repair,BTDT,,,INTERSECTION of Arlington St & Beacon St  Boston  MA,4.0,1C,8.0,D4,Back Bay,14.0,Ward 5,0505,,INTERSECTION Arlington St & Beacon St,,Intersection,575.0,42.3554,-71.0726,Constituent Call,"(42.3554, -71.0726)",-7911765.641354014,5214366.208094318,-7911765.641354014,5214366.208094318
700946,101000344992,10/20/2011 01:33:19 PM,10/24/2011 01:33:15 PM,10/20/2011 01:33:56 PM,ONTIME,Closed,Case Closed Case Scheduled Items have been scheduled for pickup.,Schedule a Bulk Item Pickup,Public Works Department,Sanitation,Schedule a Bulk Item Pickup,PWDx_Schedule a Bulk Item Pickup,PWDx,,,11 Frost Ave  Dorchester  MA  02122,8.0,07,3.0,C11,Dorchester,7.0,Ward 16,1607,R2,11 Frost Ave,2122.0,Address,61035.0,42.291000000000004,-71.0508,Employee Generated,"(42.291, -71.0508)",-7909338.87645472,5204669.997107275,-7909338.87645472,5204669.997107275
677085,101001912136,09/19/2016 09:10:00 AM,10/03/2016 09:10:46 AM,09/23/2016 12:48:59 PM,ONTIME,Closed,Case Closed. Closed date : 2016-09-23 12:48:59.013 Case Resolved,Sign Repair,Transportation - Traffic Division,Signs & Signals,Sign Repair,BTDT_Sign Shop_Sign Installation,BTDT,,,46 Hopedale St  Allston  MA  02134,11.0,04,9.0,D14,Allston / Brighton,15.0,Ward 22,2201,R1,46 Hopedale St,2134.0,Address,75226.0,42.3606,-71.1255,Citizens Connect App,"(42.3606, -71.1255)",-7917654.44241698,5215149.565287469,-7917654.44241698,5215149.565287469
581618,101001061008,04/04/2014 11:51:20 AM,04/07/2014 11:51:20 AM,04/04/2014 11:23:56 PM,ONTIME,Closed,Case Closed Case Resolved repaired 3 lights in area,Major System Failure,Public Works Department,Street Lights,Major System Failure,PWDx_Major System Failure,PWDx,,,201 Chelsea St  East Boston  MA  02128,1.0,09,1.0,A7,East Boston,1.0,Ward 1,0105,R3,201 Chelsea St,2128.0,Address,30388.0,42.3746,-71.033,Constituent Call,"(42.3746, -71.033)",-7907357.389518602,5217258.926174319,-7907357.389518602,5217258.926174319
233549,101000496556,10/24/2012 10:47:11 AM,,10/29/2012 09:44:05 PM,ONTIME,Closed,Case Closed Bulk Item Automation,Schedule a Bulk Item Pickup,Public Works Department,Sanitation,Schedule a Bulk Item Pickup,PWDx_Schedule a Bulk Item Pickup,PWDx,,,236-238 Meridian St  East Boston  MA  02128,1.0,09,1.0,A7,East Boston,1.0,01,0106,RC,236-238 Meridian St,2128.0,Address,167619.0,42.3758,-71.0393,Employee Generated,"(42.3758, -71.0393)",-7908058.702310599,5217439.750413303,-7908058.702310599,5217439.750413303
434008,101001726909,02/29/2016 04:04:00 PM,,03/04/2016 04:32:12 PM,ONTIME,Closed,Case Closed. Closed date : 2016-03-04 16:32:12.897 Bulk Item Automation,Schedule a Bulk Item Pickup,Public Works Department,Sanitation,Schedule a Bulk Item Pickup,PWDx_Schedule a Bulk Item Pickup,PWDx,,,31 Raven St  Dorchester  MA  02125,7.0,03,3.0,C11,Dorchester,7.0,Ward 13,1307,R3,31 Raven St,2125.0,Address,114748.0,42.3179,-71.055,Constituent Call,"(42.3179, -71.055)",-7909806.418316054,5208718.915609538,-7909806.418316054,5208718.915609538
431151,101001660704,12/08/2015 11:16:00 AM,,12/09/2015 04:34:01 PM,ONTIME,Closed,Case Closed. Closed date : 2015-12-09 16:34:01.46 Bulk Item Automation,Schedule a Bulk Item Pickup,Public Works Department,Sanitation,Schedule a Bulk Item Pickup,PWDx_Schedule a Bulk Item Pickup,PWDx,,,65 Dennis St  Roxbury  MA  02119,7.0,03,7.0,B2,Roxbury,13.0,Ward 8,0807,R3,65 Dennis St,2119.0,Address,47291.0,42.3217,-71.0763,Employee Generated,"(42.3217, -71.0763)",-7912177.523469951,5209291.021287154,-7912177.523469951,5209291.021287154
30201,101001241957,01/04/2015 04:31:12 PM,01/07/2015 08:30:00 AM,01/04/2015 05:03:22 PM,ONTIME,Closed,Case Closed Case Resolved it is all set,Requests for Street Cleaning,Public Works Department,Street Cleaning,Requests for Street Cleaning,PWDx_Request for Street Cleaning,PWDx,https://mayors24.cityofboston.gov/media/boston/report/photos/54a9b10a04855a39b2f89b95/photo_20150104_162959.jpg,https://cityworker.cityofboston.gov:8443/attachments/report/54a9b129d052affa7e494cf6/closed_photo/Report.jpg,51 Eutaw St  East Boston  MA  02128,1.0,09,1.0,A7,East Boston,1.0,Ward 1,0107,R1,51 Eutaw St,2128.0,Address,54715.0,42.3791,-71.0375,Citizens Connect App,"(42.3791, -71.0375)",-7907858.327227171,5217937.0348873595,-7907858.327227171,5217937.0348873595
345242,101001295161,02/14/2015 03:47:19 PM,02/19/2015 08:30:00 AM,02/15/2015 01:19:12 PM,ONTIME,Closed,Case Closed Case Noted  Collection will retun on the next scheduled collection day  please make sure all refuse is out before 7am and that there is a clear path and accessibility.,Missed Trash: District 05,Public Works Department,Sanitation,Missed Trash/Recycling/Yard Waste/Bulk Item,PWDx_Missed Trash\Recycling\Yard Waste\Bulk Item,PWDx,,,599-601 E Third St  South Boston  MA  02127,6.0,05,2.0,C6,South Boston / South Boston Waterfront,5.0,Ward 6,0605,R2,599-601 E Third St,2127.0,Address,135039.0,42.3363,-71.036,Constituent Call,"(42.3363, -71.036)",-7907691.347990982,5211489.432993284,-7907691.347990982,5211489.432993284
387971,101001601028,09/29/2015 05:44:45 PM,10/01/2015 08:30:00 AM,09/29/2015 10:17:00 PM,ONTIME,Closed,Case Closed. Closed date : 2015-09-29 22:17:00.84 Case Resolved dead animal.picked up,Pick up Dead Animal,Public Works Department,Street Cleaning,Pick up Dead Animal,PWDx_District 1B: North End,PWDx,https://mayors24.cityofboston.gov/media/boston/report/photos/560b065a04856838df93b4ab/report.jpg,https://cityworker.cityofboston.gov:8443/attachments/report/560b069fd052f50f59b86937/closed_photo/Report.jpg,90 W Cedar St  Boston  MA  02114,3.0,1B,8.0,A1,Beacon Hill,14.0,Ward 5,0511,A,90 W Cedar St,2114.0,Address,27075.0,42.3605,-71.0702,Citizens Connect App,"(42.3605, -71.0702)",-7911498.474576111,5215134.500114721,-7911498.474576111,5215134.500114721
217578,101001857857,07/13/2016 12:08:00 PM,07/13/2017 12:08:24 PM,08/18/2016 09:37:10 AM,ONTIME,Closed,Case Closed. Closed date : 2016-08-18 09:37:10.727 Case Noted The tree was pruned by Northern Tree Service  to the City of Boston tree pruning specifications.,Tree Maintenance Requests,Parks & Recreation Department,Trees,Tree Maintenance Requests,PARK_Tree Maintenance Request,PARK,,,126 Putnam St  East Boston  MA  02128,1.0,09,1.0,A7,East Boston,1.0,Ward 1,0110,R3,126 Putnam St,2128.0,Address,113617.0,42.3787,-71.032,Constituent Call,"(42.3787, -71.032)",-7907246.070027809,5217876.756589564,-7907246.070027809,5217876.756589564
436007,101001909366,09/15/2016 09:29:00 AM,09/16/2016 09:29:37 AM,09/15/2016 09:44:11 AM,ONTIME,Closed,Case Closed. Closed date : 2016-09-15 09:44:11.12 Case Resolved Your case has been inspected by Code Enforcement and sent to Public Works Highway for collection of materials. Please refer to new case number #101001909389.,Illegal Dumping,Public Works Department,Code Enforcement,Illegal Dumping,PWDx_Code Enforcement,PWDx,,https://cityworker.cityofboston.gov:8443/attachments/report/57daa2a9d052a2900811a80b/closed_photo/Report.jpg,INTERSECTION of Frederick St & Lark St  South Boston  MA,6.0,05,2.0,C6,South Boston / South Boston Waterfront,5.0,7,0705,,INTERSECTION Frederick St & Lark St,,Intersection,18207.0,42.3594,-71.0587,Constituent Call,"(0, 0)",-7910218.300431989,5214968.784796895,-7910218.300431989,5214968.784796895
446355,101001909191,09/15/2016 07:25:00 AM,11/14/2016 07:25:00 AM,09/16/2016 02:44:37 PM,ONTIME,Closed,Case Closed. Closed date : 2016-09-16 14:44:37.617 Case Resolved REPLACED 24'POLEW/TWIN ARM AND 2 - 110/w L.E.D. STANDARD LUMINEARS  AND TIED IN         G.Mc CARTHY / J.FELDER / J.PETERSON / C.THOMPSON,PRINTED :   NM,Public Works Department,Street Lights,Knockdown Replacement,PWDx_Street Light Knockdown Replacement,PWDx,,,INTERSECTION of Martin Luther King Jr Blvd & Walnut Ave  Roxbury  MA,9.0,10B,9.0,B2,Roxbury,13.0,12,1203,,INTERSECTION Martin Luther King Jr Blvd & Walnut Ave,,Intersection,16795.0,42.3594,-71.0587,Employee Generated,"(0, 0)",-7910218.300431989,5214968.784796895,-7910218.300431989,5214968.784796895
4336,101001245205,01/09/2015 08:22:37 PM,01/14/2015 08:30:00 AM,01/12/2015 07:52:23 AM,ONTIME,Closed,Case Closed Case Resolved Above address has been serviced (PWD).,Missed Leaf or Yard Trash: District 1C,Public Works Department,Sanitation,Missed Trash/Recycling/Yard Waste/Bulk Item,PWDx_Missed Trash\Recycling\Yard Waste\Bulk Item,PWDx,,https://cityworker.cityofboston.gov:8443/attachments/report/54b07ee5d052affa7e49e282/closed_photo/Report.jpg,31 Appleton St  Boston  MA  02116,4.0,1C,2.0,D4,South End,6.0,Ward 5,0501,R1,31 Appleton St,2116.0,Address,4000.0,42.3461,-71.0717,Constituent Call,"(42.3461, -71.0717)",-7911665.453812302,5212965.3654897185,-7911665.453812302,5212965.3654897185
110980,101000826370,04/23/2013 12:36:00 PM,04/25/2013 12:36:00 PM,05/03/2013 10:06:58 AM,OVERDUE,Closed,Case Closed Duplicate of Existing Case,Sticker Request,Public Works Department,Recycling,Sticker Request,PWDx_Sticker Request,PWDx,,,4 Mount Vernon St  Charlestown  MA  02129,3.0,1A,1.0,A15,Charlestown,2.0,Ward 2,0203,R2,4 Mount Vernon St,2129.0,Address,279049.0,42.3761,-71.0589,Self Service,"(42.3761, -71.0589)",-7910240.564330147,5217484.957012926,-7910240.564330147,5217484.957012926
37461,101001853093,07/07/2016 08:49:00 AM,07/07/2017 08:49:03 AM,07/08/2016 08:20:35 AM,ONTIME,Closed,Case Closed Case Resolved  The tree was pruned by Northern Tree Service  to the City of Boston tree pruning specifications.,Tree Maintenance Requests,Parks & Recreation Department,Trees,Tree Maintenance Requests,PARK_Tree Maintenance Request,PARK,,,32 Tyndale St  Roslindale  MA  02131,9.0,06,5.0,E5,Roslindale,10.0,Ward 20,2002,R1,32 Tyndale St,2131.0,Address,138928.0,42.287,-71.1384,Employee Generated,"(42.287, -71.1384)",-7919090.463848214,5204068.075148029,-7919090.463848214,5204068.075148029
430148,101001309520,02/20/2015 08:56:33 PM,03/02/2015 08:30:00 AM,02/25/2015 10:36:55 AM,ONTIME,Closed,Case Closed Case Resolved the seaver st sidewalk was done today.,Ground Maintenance: Puddingstone Park  Puddingstone Park,Parks & Recreation Department,Park Maintenance & Safety,Ground Maintenance,PARK_Maintenance_Region 2,PARK,,,330 Seaver St  Dorchester  MA  02121,7.0,3,4.0,B2,Dorchester,13.0,14,1403,,330 Seaver St,2121.0,Address,342579.0,42.3052,-71.0838,Constituent Call,"(42.3052, -71.0838)",-7913012.419650899,5206807.12884123,-7913012.419650899,5206807.12884123
552488,101001625715,11/02/2015 12:09:00 PM,11/03/2015 12:09:31 PM,11/02/2015 02:58:53 PM,ONTIME,Closed,Case Closed. Closed date : 2015-11-02 14:58:53.103 ADCLSD: Administratively Closed,Unsafe/Dangerous Conditions,Inspectional Services,Building,Unsafe Dangerous Conditions,ISD_Building (INTERNAL),ISD,,,INTERSECTION of Fleet St & North St  Boston  MA,3.0,1B,1.0,A1,Downtown / Financial District,3.0,Ward 3,0301,,INTERSECTION Fleet St & North St,,Intersection,4947.0,42.3642,-71.0518,Constituent Call,"(42.3642, -71.0518)",-7909450.195945515,5215691.927475566,-7909450.195945515,5215691.927475566
794293,101000958469,11/01/2013 12:59:25 PM,,11/18/2013 11:44:54 AM,ONTIME,Closed,Case Closed Case Resolved The fallen trees were not part of the city's property but a property abutters'.  Nevertheless they were removed and disposed of,Transportation General Request,Transportation - Traffic Division,Administrative & General Requests,Transportation General Request,BTDT_Parking Lot_Municipal Parking Lot Complaints,BTDT,,,350-356 Centre St  Jamaica Plain  MA  02130,9.0,02,6.0,E13,Jamaica Plain,11.0,Ward 10,1009,E,350-356 Centre St,2130.0,Address,27996.0,42.3594,-71.0587,Constituent Call,"(0, 0)",-7910218.300431989,5214968.784796895,-7910218.300431989,5214968.784796895
642896,101001887977,08/22/2016 10:45:00 AM,10/26/2016 10:45:23 AM,09/12/2016 10:48:46 AM,ONTIME,Closed,Case Closed. Closed date : 2016-09-12 10:48:46.19 Case Noted not  griffiti pipe line construction,Graffiti: 18  1805  Other,Property Management,Graffiti,Graffiti Removal,PROP_GRAF_GraffitiRemoval,PROP,,,INTERSECTION of Edgewater Dr & Mattakeeset St  Mattapan  MA,8.0,08,5.0,E18,Hyde Park,9.0,18,1805,,INTERSECTION Edgewater Dr & Mattakeeset St,,Intersection,10366.0,42.3594,-71.0587,Constituent Call,"(0, 0)",-7910218.300431989,5214968.784796895,-7910218.300431989,5214968.784796895
721915,101001433606,07/20/2015 07:39:00 PM,09/23/2015 08:30:00 AM,08/20/2015 07:09:48 AM,ONTIME,Closed,Case Closed. Closed date : 2015-08-20 07:09:48.083 Case Resolved The graffiti tag at this location has been removed by the City of Boston Property Management Department.  This case number has been resolved and is closed.,Graffiti Removal,Property Management,Graffiti,Graffiti Removal,PROP_GRAF_GraffitiRemoval,PROP,https://mayors24.cityofboston.gov/media/boston/report/photos/55ad86d16963f60aeaf737ef/photo_20150720_193937.jpg,,2665 Washington St  Roxbury  MA  02119,9.0,10B,7.0,B2,Roxbury,13.0,Ward 9,0905,C,2665 Washington St,2119.0,Address,144519.0,42.3242,-71.0891,Citizens Connect App,"(42.3242, -71.0891)",-7913602.4129521055,5209667.425444918,-7913602.4129521055,5209667.425444918
240966,101000432821,06/06/2012 11:25:06 AM,06/06/2013 11:25:06 AM,10/11/2012 03:05:03 PM,ONTIME,Closed,Case Closed Case Resolved The CIU inspector investigated the concrete section.    When he arrived at the location  the open section had been made safe and placed to grade in HMA.    The CIU will monitor the location.    Mark Cardarelli  Supervisor of Utility Coordination and Compliance  Boston Public Works Department  617-635-4951 Office  617-438-8517 Cell,Sidewalk Repair/Concrete/Dist 7,Public Works Department,Highway Maintenance,Sidewalk Repair,PWDx_Contractor Complaints,PWDx,,,115 Hollingsworth St  Mattapan  MA  02126,8.0,08,4.0,E18,Greater Mattapan,9.0,Ward 18,1804,R1,115 Hollingsworth St,2126.0,Address,74665.0,42.2669,-71.1007,City Worker App,"(42.2669, -71.1007)",-7914893.719045306,5201043.995689394,-7914893.719045306,5201043.995689394
78380,101001372777,05/07/2015 03:29:00 PM,05/06/2016 03:29:56 PM,07/23/2015 03:02:01 PM,ONTIME,Closed,Case Closed. Closed date : 2015-07-23 15:02:01.657 Case Resolved The tree was pruned by Northern Tree Service  to the City of Boston tree pruning specifications.,Tree Maintenance Requests,Parks & Recreation Department,Trees,Tree Maintenance Requests,PARK_Tree Maintenance Request,PARK,,,31 Joan Rd  Hyde Park  MA  02136,12.0,08,5.0,E18,Hyde Park,10.0,Ward 18,1819,R1,31 Joan Rd,2136.0,Address,79812.0,42.2532,-71.1439,Constituent Call,"(42.2532, -71.1439)",-7919702.721047576,5198983.359742595,-7919702.721047576,5198983.359742595
205038,101001725279,02/26/2016 11:30:00 AM,02/29/2016 11:30:54 AM,02/26/2016 12:12:30 PM,ONTIME,Closed,Case Closed. Closed date : 2016-02-26 12:12:30.26 Case Resolved Above address has been serviced (PWD).,Missed Recycling: District 03,Public Works Department,Sanitation,Missed Trash/Recycling/Yard Waste/Bulk Item,PWDx_Missed Trash\Recycling\Yard Waste\Bulk Item,PWDx,,https://cityworker.cityofboston.gov:8443/attachments/report/56d07de8d0524d3d7c0faed0/closed_photo/Report.jpg,1280 Massachusetts Ave  Dorchester  MA  02125,6.0,03,2.0,C6,Dorchester,5.0,Ward 7,0709,R3,1280 Massachusetts Ave,2125.0,Address,91958.0,42.3212,-71.0618,Constituent Call,"(42.3212, -71.0618)",-7910563.390853449,5209215.742250325,-7910563.390853449,5209215.742250325
211212,101001129590,07/15/2014 05:07:29 PM,07/18/2014 08:30:00 AM,,OVERDUE,Open,,Request for Pothole Repair,Public Works Department,Highway Maintenance,Request for Pothole Repair,INFO_Areaway,INFO,,,170-170A Tremont St  Boston  MA  02111,3.0,1C,2.0,A1,Downtown / Financial District,4.0,Ward 3,0308,CM,170-170A Tremont St,2111.0,Address,170414.0,42.3537,-71.0639,Constituent Call,"(42.3537, -71.0639)",-7910797.161784114,5214110.124609624,-7910797.161784114,5214110.124609624
824873,101000448425,07/11/2012 03:07:11 PM,11/08/2012 03:07:11 PM,07/24/2012 10:57:42 AM,ONTIME,Closed,Case Closed :,Unsatisfactory Living Conditions,Inspectional Services,Housing,Unsatisfactory Living Conditions,ISD_Housing (INTERNAL),ISD,,,50 Floyd St  Dorchester  MA  02124,8.0,07,4.0,B3,Greater Mattapan,9.0,Ward 14,1412,R2,50 Floyd St,2124.0,Address,236303.0,42.2893,-71.0878,Constituent Call,"(42.2893, -71.0878)",-7913457.697614074,5204414.175604271,-7913457.697614074,5204414.175604271
352244,101001260904,01/29/2015 09:22:38 AM,02/02/2015 09:22:38 AM,02/12/2015 05:33:45 PM,OVERDUE,Closed,Case Closed Case Noted Snow has been removed.,Request for Snow Plowing,Public Works Department,Street Cleaning,Request for Snow Plowing,PWDx_District 1B: North End,PWDx,,,,,,,,,,,,,,,,,42.3594,-71.0587,Self Service,"(0, 0)",-7910218.300431989,5214968.784796895,-7910218.300431989,5214968.784796895
515925,101001607466,10/07/2015 03:58:08 PM,10/08/2015 03:58:07 PM,10/07/2015 09:04:09 PM,ONTIME,Closed,Case Closed. Closed date : 2015-10-07 21:04:09.79 Case Resolved tv picked up,CE Collection,Public Works Department,Street Cleaning,CE Collection,PWDx_District 03: North Dorchester,PWDx,https://cityworker.cityofboston.gov:8443/attachments/report/5615797bd052f4d9a9feb9ad/photo/Report.jpg,https://cityworker.cityofboston.gov:8443/attachments/report/5615797bd052f4d9a9feb9ad/closed_photo/Report.jpg,69 Bird St  Dorchester  MA  02125,7.0,03,7.0,B2,Dorchester,13.0,Ward 13,1305,R3,69 Bird St,2125.0,Address,15740.0,42.31399999999999,-71.0697,City Worker App,"(42.314, -71.0697)",-7911442.814830715,5208131.790441477,-7911442.814830715,5208131.790441477
852303,101001803968,06/01/2016 09:40:00 AM,06/01/2017 09:41:43 AM,09/23/2016 10:43:12 AM,ONTIME,Closed,Case Closed. Closed date : 2016-09-23 10:43:12.93 Case Resolved Tree has been planted,New Tree Requests,Parks & Recreation Department,Trees,New Tree Requests,PARK_New Tree Requests,PARK,,,60 Constitution Rd  Charlestown  MA  02129,3.0,1A,1.0,A15,Charlestown,2.0,Ward 2,0201,E,60 Constitution Rd,2129.0,Address,394423.0,42.3722,-71.0595,Employee Generated,"(42.3722, -71.0595)",-7910307.356024624,5216897.288061305,-7910307.356024624,5216897.288061305
714196,101001687277,01/05/2016 08:31:00 AM,01/06/2016 08:31:07 AM,01/05/2016 09:20:05 AM,ONTIME,Closed,Case Closed. Closed date : 2016-01-05 09:20:05.423 Case Resolved m broken glass picked up,Requests for Street Cleaning,Public Works Department,Street Cleaning,Requests for Street Cleaning,PWDx_District 1C: Downtown,PWDx,,https://cityworker.cityofboston.gov:8443/attachments/report/568bc5db70b4c4f343fdd3ef/closed_photo/Report.jpg,523 Massachusetts Ave  Roxbury  MA  02118,7.0,10B,7.0,D4,Roxbury,13.0,Ward 9,0903,A,523 Massachusetts Ave,2118.0,Address,271992.0,42.3387,-71.0801,Citizens Connect App,"(42.3387, -71.0801)",-7912600.537534965,5211850.864580528,-7912600.537534965,5211850.864580528
721020,101000441012,06/25/2012 02:44:40 PM,,07/02/2012 09:44:15 PM,ONTIME,Closed,Case Closed Bulk Item Automation,Schedule a Bulk Item Pickup,Public Works Department,Sanitation,Schedule a Bulk Item Pickup,PWDx_Schedule a Bulk Item Pickup,PWDx,,,137 Dana Ave  Hyde Park  MA  02136,12.0,08,5.0,E18,Hyde Park,10.0,Ward 18,1818,R1,137 Dana Ave,2136.0,Address,45892.0,42.2483,-71.12100000000001,Constituent Call,"(42.2483, -71.121)",-7917153.504708411,5198246.452646118,-7917153.504708411,5198246.452646118
628531,101001905332,09/10/2016 10:50:23 PM,09/13/2016 08:30:00 AM,09/12/2016 02:44:32 AM,ONTIME,Closed,Case Closed. Closed date : 2016-09-12 02:44:32.88 Case Resolved all clear,Parking Enforcement,Transportation - Traffic Division,Enforcement & Abandoned Vehicles,Parking Enforcement,BTDT_Parking Enforcement,BTDT,https://mayors24.cityofboston.gov/media/boston/report/photos/57d4c66869635ac1c4225c5c/report.jpg,,454-460 Huntington Ave  Boston  MA  02115,9.0,10A,7.0,D4,Mission Hill,13.0,Ward 4,0409,A,454-460 Huntington Ave,2115.0,Address,76370.0,42.3385,-71.093,Citizens Connect App,"(42.3385, -71.093)",-7914036.558966199,5211820.744754723,-7914036.558966199,5211820.744754723
237724,101000894669,08/05/2013 01:37:37 PM,08/07/2013 01:37:37 PM,08/05/2013 02:49:00 PM,ONTIME,Closed,Case Closed Case Resolved trash under tree removed,Requests for Street Cleaning,Public Works Department,Street Cleaning,Requests for Street Cleaning,PWDx_District 10B: Roxbury,PWDx,,,1 Thorndike St  Roxbury  MA  02118,7.0,10B,7.0,D4,Roxbury,13.0,Ward 8,0803,C,1 Thorndike St,2118.0,Address,170346.0,42.3338,-71.0799,Constituent Call,"(42.3338, -71.0799)",-7912578.273636805,5211112.956423865,-7912578.273636805,5211112.956423865
528349,101001764836,04/09/2016 06:49:59 PM,04/12/2016 08:30:00 AM,04/11/2016 07:17:49 AM,ONTIME,Closed,Case Closed. Closed date : 2016-04-11 07:17:49.73 Case Noted Clear now.,Parking Enforcement,Transportation - Traffic Division,Enforcement & Abandoned Vehicles,Parking Enforcement,BTDT_Parking Enforcement,BTDT,https://mayors24.cityofboston.gov/media/boston/report/photos/570987110485c52e7782d2a3/report.jpg,,INTERSECTION of Marion St & Havre St  East Boston  MA,1.0,09,1.0,A7,East Boston,1.0,1,0105,,INTERSECTION Marion St & Havre St,,Intersection,11799.0,42.3594,-71.0587,Citizens Connect App,"(0, 0)",-7910218.300431989,5214968.784796895,-7910218.300431989,5214968.784796895
218690,101000710280,11/21/2012 02:07:57 PM,,11/28/2012 08:15:15 AM,ONTIME,Closed,Case Closed Case Resolved NSTAR Electric is reroofing the damaged manhole.    The work is currently active.    The CIU inspector states that the cover is no longer banging.    The CIU will monitor the progress of the repair.    Mark Cardarelli  Supervisor of Utility Coordination and Compliance  Boston Public Works Department  617-635-4951 Office  617-438-8517 Cell,Highway Maintenance,Public Works Department,Highway Maintenance,Highway Maintenance,PWDx_Contractor Complaints,PWDx,,,59 Marcella St  Roxbury  MA  02119,9.0,10B,7.0,B2,Roxbury,13.0,Ward 11,1102,R1,59 Marcella St,2119.0,Address,89582.0,42.3229,-71.0952,Employee Generated,"(42.3229, -71.0952)",-7914281.461845944,5209471.693416313,-7914281.461845944,5209471.693416313
42067,101000375933,01/20/2012 10:43:41 AM,02/03/2012 10:43:41 AM,05/15/2012 01:50:21 PM,OVERDUE,Closed,Case Closed Case Resolved Checked area and found no outage,Street Light Outages,Public Works Department,Street Lights,Street Light Outages,PWDx_Street Light Outages,PWDx,,,127 Milton Ave  Dorchester  MA  02124,8.0,07,3.0,B3,Dorchester,7.0,Ward 17,1712,R2,127 Milton Ave,2124.0,Address,95694.0,42.2809,-71.0759,Constituent Call,"(42.2809, -71.0759)",-7912132.995673633,5203150.21774014,-7912132.995673633,5203150.21774014
377430,101001901865,09/07/2016 07:09:00 AM,,,ONTIME,Open,,Transportation General Request,Transportation - Traffic Division,Administrative & General Requests,Transportation General Request,BPD_Districts,BPD_,,,6 Summer St  Hyde Park  MA  02136,12.0,08,5.0,E18,Hyde Park,10.0,Ward 18,1812,R2,6 Summer St,2136.0,Address,131931.0,42.2567,-71.1259,Constituent Call,"(42.2567, -71.1259)",-7917698.970213297,5199509.757006396,-7917698.970213297,5199509.757006396
63119,101001762421,04/06/2016 12:57:21 PM,04/07/2016 12:57:21 PM,04/06/2016 12:57:23 PM,ONTIME,Closed,Case Closed. Closed date : 2016-04-06 12:57:23.31 Case Resolved Marked completed at case creation,Request for Pothole Repair,Public Works Department,Highway Maintenance,Request for Pothole Repair,PWDx_District 1B: North End,PWDx,https://cityworker.cityofboston.gov:8443/attachments/report/57053ff0d052d8b24256fe6c/photo/Report.jpg,,1 City Hall Plz  Boston  MA  02108,3.0,1B,1.0,A1,Downtown / Financial District,3.0,03,0306,E,1 City Hall Plz,2108.0,Address,32856.0,42.3603,-71.0583,City Worker App,"(42.3603, -71.0583)",-7910173.772635671,5215104.369841154,-7910173.772635671,5215104.369841154
57986,101001141761,08/01/2014 11:29:51 AM,08/05/2014 11:29:51 AM,08/01/2014 04:50:40 PM,ONTIME,Closed,Case Closed Case Resolved went to locatipn nothing was there,Request for Pothole Repair,Public Works Department,Highway Maintenance,Request for Pothole Repair,PWDx_District 1C: Downtown,PWDx,,,INTERSECTION of Columbus Ave & Isabella St  Boston  MA,4.0,1C,2.0,D4,Back Bay,6.0,Ward 5,0501,,INTERSECTION Columbus Ave & Isabella St,,Intersection,3301.0,42.3488,-71.0716,Citizens Connect App,"(42.3488, -71.0716)",-7911654.321863223,5213372.040378293,-7911654.321863223,5213372.040378293
487501,101000477037,09/11/2012 08:17:00 AM,,09/18/2012 09:42:57 PM,ONTIME,Closed,Case Closed Bulk Item Automation,Schedule a Bulk Item Pickup,Public Works Department,Sanitation,Schedule a Bulk Item Pickup,PWDx_Schedule a Bulk Item Pickup,PWDx,,,55-57 Raldne Rd  Hyde Park  MA  02136,12.0,08,5.0,E18,Hyde Park,10.0,Ward 18,1819,R2,55-57 Raldne Rd,2136.0,Address,114472.0,42.2568,-71.1408,Constituent Call,"(42.2568, -71.1408)",-7919357.630626116,5199524.797357488,-7919357.630626116,5199524.797357488
324692,101001955515,11/19/2016 11:40:51 PM,11/29/2016 08:30:00 AM,11/21/2016 01:29:51 AM,ONTIME,Closed,Case Closed. Closed date : 2016-11-21 01:29:51.453 Case Resolved Graffiti removed,PWD Graffiti,Public Works Department,Highway Maintenance,PWD Graffiti,PWDx_District 10A: Roxbury,PWDx,https://mayors24.cityofboston.gov/media/boston/report/photos/5831294e04859c3a5cae5c16/photo_20161119_233959.jpg,https://cityworker.cityofboston.gov:8443/attachments/report/5831299ad052fb55f548b772/closed_photo/Report.jpg,90 Van Ness St  Boston  MA  02215,4.0,10A,8.0,D4,Boston,14.0,05,0502,C,90 Van Ness St,2215.0,Address,170745.0,42.3446,-71.0997,Citizens Connect App,"(42.3446, -71.0997)",-7914782.399554513,5212739.442543181,-7914782.399554513,5212739.442543181
209589,101001127677,07/13/2014 08:37:04 PM,07/15/2014 08:37:03 PM,08/28/2014 08:20:35 AM,OVERDUE,Closed,Case Closed ADCLSD: Administratively Closed,Work w/out Permit,Inspectional Services,Building,Work w/out Permit,ISD_Building (INTERNAL),ISD,,,458 E Third St  South Boston  MA  02127,6.0,05,2.0,C6,South Boston / South Boston Waterfront,5.0,Ward 6,0605,CD,458 E Third St,2127.0,Address,134921.0,42.3365,-71.0417,Constituent Call,"(42.3365, -71.0417)",-7908325.869088504,5211519.551765372,-7908325.869088504,5211519.551765372
737543,101001973548,12/20/2016 09:42:28 AM,12/21/2016 09:42:27 AM,12/20/2016 09:54:37 AM,ONTIME,Closed,Case Closed. Closed date : 2016-12-20 09:54:37.67 Case Resolved mattress picked up,Requests for Street Cleaning,Public Works Department,Street Cleaning,Requests for Street Cleaning,PWDx_District 07: South Dorchester,PWDx,https://cityworker.cityofboston.gov:8443/attachments/report/58594352d05202fe6715234c/photo/Report.jpg,https://cityworker.cityofboston.gov:8443/attachments/report/58594352d05202fe6715234c/closed_photo/Report.jpg,69 Tenean St  Dorchester  MA  02122,8.0,07,3.0,C11,Dorchester,7.0,Ward 16,1610,I,69 Tenean St,2122.0,Address,134378.0,42.2925,-71.0458,City Worker App,"(42.2925, -71.0458)",-7908782.279000755,5204895.7276967885,-7908782.279000755,5204895.7276967885
108016,101000463065,08/10/2012 02:05:17 PM,09/07/2012 02:05:10 PM,08/23/2012 01:55:16 PM,ONTIME,Closed,Case Closed Case Resolved delivered on 8/23 #0712408377,Request for Recycling Cart,Public Works Department,Recycling,Request for Recycling Cart,PWDx_Recycling,PWDx,,,124 Bourne St  Jamaica Plain  MA  02130,12.0,02,6.0,E13,Jamaica Plain,10.0,Ward 19,1907,R1,124 Bourne St,2130.0,Address,17279.0,42.2889,-71.1129,Constituent Call,"(42.2889, -71.1129)",-7916251.816832984,5204353.983312822,-7916251.816832984,5204353.983312822
147116,101000969006,11/20/2013 11:46:14 AM,11/25/2013 11:46:14 AM,12/23/2013 02:01:55 PM,OVERDUE,Closed,Case Closed ADCLSD: Administratively Closed,Building Inspection Request,Inspectional Services,Building,Building Inspection Request,ISD_Building (INTERNAL),ISD,,,5275 Washington St  West Roxbury  MA  02132,12.0,6,6.0,E5,West Roxbury,12.0,20,2015,E,5275 Washington St,2132.0,Address,341136.0,42.26,-71.1596,Self Service,"(42.26, -71.1596)",-7921450.437053029,5200006.101185865,-7921450.437053029,5200006.101185865
716451,101001125294,07/09/2014 06:48:22 PM,,07/10/2014 09:52:34 AM,ONTIME,Closed,Case Closed Case Noted,Fire: Jumper,Mayor's 24 Hour Hotline,Notification,Notification,INFO09_Current Events,INFO,,,15 Scottfield Rd  Allston  MA  02134,11.0,04,9.0,D14,Allston / Brighton,15.0,Ward 21,2108,A,15 Scottfield Rd,2134.0,Address,124009.0,42.3474,-71.1368,Constituent Call,"(42.3474, -71.1368)",-7918912.352662942,5213161.16973717,-7918912.352662942,5213161.16973717
455381,101001249677,01/20/2015 07:17:16 AM,03/25/2015 08:30:00 AM,04/13/2015 12:36:36 PM,OVERDUE,Closed,Case Closed Case Resolved Control box painted.,PWD Graffiti,Public Works Department,Highway Maintenance,PWD Graffiti,PWDx_District 04: Allston/Brighton,PWDx,https://cityworker.cityofboston.gov:8443/attachments/report/54329769d052f1b1cd5b6926/photo/Report.jpg,https://cityworker.cityofboston.gov:8443/attachments/report/54329769d052f1b1cd5b6926/closed_photo/Report.jpg,INTERSECTION of Cambridge St & Sparhawk St  Brighton  MA,11.0,04,9.0,D14,Allston / Brighton,15.0,Ward 21,2109,,INTERSECTION Cambridge St & Sparhawk St,,Intersection,2335.0,42.3501,-71.14699999999999,City Worker App,"(42.3501, -71.147)",-7920047.811469034,5213567.853036073,-7920047.811469034,5213567.853036073
944502,101002017454,02/17/2017 12:28:00 AM,03/06/2017 08:30:00 AM,03/04/2017 06:02:13 AM,ONTIME,Closed,Case Closed. Closed date : 2017-03-04 06:02:13.983 Case Resolved Replaced LED Acorn,PRINTED : JK,Public Works Department,Street Lights,Street Light Outages,PWDx_Street Light Outages,PWDx,https://cityworker.cityofboston.gov:8443/attachments/report/58a689e9d052b69d23ccad4b/photo/Report.jpg,,150 Staniford St  Boston  MA  02114,3.0,1B,8.0,A1,Back Bay,3.0,03,,,150 Staniford St,2114.0,Address,347193.0,42.3645,-71.0639,City Worker App,"(42.3645, -71.0639)",-7910797.161784114,5215737.125727368,-7910797.161784114,5215737.125727368
685398,101001611273,10/13/2015 06:34:00 PM,10/02/2017 06:34:12 PM,02/08/2016 09:38:15 AM,ONTIME,Closed,Case Closed. Closed date : 2016-02-08 09:38:15.347 NOVIO: No Violation Found/No Cause,Working Beyond Hours,Inspectional Services,Building,Working Beyond Hours,ISD_Building (INTERNAL),ISD,,,145-149 Cedar St  Roxbury  MA  02119,9.0,10B,7.0,B2,Roxbury,13.0,11,1101,,145-149 Cedar St,2119.0,Address,354021.0,42.3276,-71.095,Constituent Call,"(42.3276, -71.095)",-7914259.197947785,5210179.3591035195,-7914259.197947785,5210179.3591035195
511428,101001157585,08/26/2014 11:31:54 AM,09/25/2014 11:31:54 AM,10/07/2014 04:00:59 PM,OVERDUE,Closed,Case Closed CORR: Corrected,Rodent Activity,Inspectional Services,Environmental Services,Rodent Activity,ISD_Environmental Services (INTERNAL),ISD,,,69 Quint Ave  Allston  MA  02134,11.0,04,9.0,D14,Allston / Brighton,15.0,Ward 21,2106,CM,69 Quint Ave,2134.0,Address,114228.0,42.3505,-71.1337,Constituent Call,"(42.3505, -71.1337)",-7918567.262241485,5213628.103899366,-7918567.262241485,5213628.103899366
696542,101001365444,04/28/2015 11:45:47 AM,05/12/2015 11:45:47 AM,05/05/2015 02:01:32 PM,ONTIME,Closed,Case Closed. Closed date : 2015-05-05 14:01:32.08 Case Resolved Work completed 5/5/15.,Sign Repair,Transportation - Traffic Division,Signs & Signals,Sign Repair,BTDT_Sign Shop_Sign Installation,BTDT,https://cityworker.cityofboston.gov:8443/attachments/report/553fab25d0526762dacdebc5/photo/Report.jpg,,INTERSECTION of Easton St & Myrick St  Allston  MA,11.0,04,9.0,D14,Allston / Brighton,15.0,Ward 22,2201,,INTERSECTION Easton St & Myrick St,,Intersection,4396.0,42.3596,-71.1313,City Worker App,"(42.3596, -71.1313)",-7918300.09546358,5214998.914638905,-7918300.09546358,5214998.914638905
120215,101000999261,01/06/2014 03:17:10 PM,02/05/2014 03:17:09 PM,,OVERDUE,Open,,No Utilities Residential - Water,Inspectional Services,Housing,No Utilities Residential - Water,ISD_Housing (INTERNAL),ISD,,,30 Michigan Ave  Dorchester  MA  02121,7.0,03,4.0,B3,Greater Mattapan,8.0,Ward 14,1406,R4,30 Michigan Ave,2121.0,Address,275250.0,42.302,-71.0823,Constituent Call,"(42.302, -71.0823)",-7912845.44041471,5206325.479622989,-7912845.44041471,5206325.479622989
303793,101001159591,08/28/2014 04:35:02 PM,11/26/2014 04:35:02 PM,03/06/2015 09:36:19 AM,OVERDUE,Closed,Case Closed :,Chronic Dampness/Mold,Inspectional Services,Housing,Chronic Dampness/Mold,ISD_Housing (INTERNAL),ISD,,,24 Arbutus St  Dorchester  MA  02124,8.0,07,4.0,B3,Greater Mattapan,9.0,Ward 14,1412,R4,24 Arbutus St,2124.0,Address,178859.0,42.2878,-71.089,Constituent Call,"(42.2878, -71.089)",-7913591.281003024,5204188.456482149,-7913591.281003024,5204188.456482149
90260,101001623786,10/29/2015 09:25:00 PM,11/16/2015 08:30:00 AM,11/04/2015 12:12:13 PM,ONTIME,Closed,Case Closed. Closed date : 2015-11-04 12:12:13.063 Case Resolved Repaired a bad connection on LED driver. Ledbetter  Lynch. 11/4/15,EP PRINTED for mark,Public Works Department,Street Lights,Street Light Outages,PWDx_Street Light Outages,PWDx,https://cityworker.cityofboston.gov:8443/attachments/report/5632c701d052f4d9a9ffcaae/photo/Report.jpg,,335 Talbot Ave  Dorchester  MA  02124,8.0,07,4.0,B3,Dorchester,9.0,17,1705,RC,335 Talbot Ave,2124.0,Address,317731.0,42.2902,-71.0725,City Worker App,"(42.2902, -71.0725)",-7911754.509404937,5204549.609657571,-7911754.509404937,5204549.609657571
904142,101001988069,01/13/2017 09:03:51 AM,01/14/2017 09:03:50 AM,01/13/2017 09:37:46 AM,ONTIME,Closed,Case Closed. Closed date : 2017-01-13 09:37:46.233 Duplicate of Existing Case Working on problem,Traffic Signal Inspection,Transportation - Traffic Division,Signs & Signals,Traffic Signal Inspection,BTDT_Traffic Signal_Repair,BTDT,,,INTERSECTION of Brighton Ave & Harvard Ave  Allston  MA,11.0,04,8.0,D14,Allston / Brighton,15.0,21,2105,,INTERSECTION Brighton Ave & Harvard Ave,,Intersection,15593.0,42.3594,-71.0587,Citizens Connect App,"(0, 0)",-7910218.300431989,5214968.784796895,-7910218.300431989,5214968.784796895
339963,101001811645,06/09/2016 06:23:41 PM,06/13/2016 08:30:00 AM,06/10/2016 10:53:15 AM,ONTIME,Closed,Case Closed. Closed date : 2016-06-10 10:53:15.097 Case Resolved deliver recycle sticker on .6/10/16,Sticker Request,Public Works Department,Recycling,Sticker Request,PWDx_Sticker Request,PWDx,,,175 Wachusett St  Jamaica Plain  MA  02130,12.0,02,6.0,E13,Jamaica Plain,10.0,Ward 19,1907,R1,175 Wachusett St,2130.0,Address,141140.0,42.2935,-71.1168,Self Service,"(42.2935, -71.1168)",-7916685.962847077,5205046.2177431015,-7916685.962847077,5205046.2177431015
862217,101001722942,02/23/2016 03:02:00 PM,,02/26/2016 04:32:57 PM,ONTIME,Closed,Case Closed. Closed date : 2016-02-26 16:32:57.317 Bulk Item Automation,Schedule a Bulk Item Pickup,Public Works Department,Sanitation,Schedule a Bulk Item Pickup,PWDx_Schedule a Bulk Item Pickup,PWDx,,,26-28 Westford St  Allston  MA  02134,11.0,04,9.0,D14,Allston / Brighton,15.0,Ward 22,2202,R2,26-28 Westford St,2134.0,Address,148233.0,42.3625,-71.1342,Constituent Call,"(42.3625, -71.1342)",-7918622.921986882,5215435.808125316,-7918622.921986882,5215435.808125316
920874,101002006410,02/09/2017 07:21:22 PM,,02/09/2017 07:22:26 PM,ONTIME,Closed,Case Closed. Closed date : 2017-02-09 19:22:26.04 Case Invalid,Misc. Snow Complaint,Public Works Department,Administrative & General Requests,Misc. Snow Complaint,PWDx_Snow Cases,PWDx,,,INTERSECTION of Albano St & Birch St  Roslindale  MA,12.0,06,5.0,E5,Roslindale,10.0,20,2002,,INTERSECTION Albano St & Birch St,,Intersection,8825.0,42.3594,-71.0587,Constituent Call,"(0, 0)",-7910218.300431989,5214968.784796895,-7910218.300431989,5214968.784796895
377848,101001268249,02/02/2015 06:09:52 PM,02/05/2015 08:30:00 AM,02/05/2015 06:12:11 AM,ONTIME,Closed,Case Closed Case Noted  Trash will be collected on your next scheduled day.,Missed Trash: District 1B,Public Works Department,Sanitation,Missed Trash/Recycling/Yard Waste/Bulk Item,PWDx_Missed Trash\Recycling\Yard Waste\Bulk Item,PWDx,,,24 Stillman St  Boston  MA  02113,3.0,1B,1.0,A1,Downtown / Financial District,3.0,Ward 3,0303,A,24 Stillman St,2113.0,Address,314444.0,42.3638,-71.0567,Self Service,"(42.3638, -71.0567)",-7909995.661450404,5215631.663475561,-7909995.661450404,5215631.663475561
227397,101001527601,08/21/2015 05:10:03 PM,08/25/2015 08:30:00 AM,08/24/2015 08:01:17 AM,ONTIME,Closed,Case Closed. Closed date : 2015-08-24 08:01:17.717 Case Noted in inspection of above address there was no missed rec/trash/YW visable at 8am,Missed Trash/Recycling/Yard Waste/Bulk Item,Public Works Department,Sanitation,Missed Trash/Recycling/Yard Waste/Bulk Item,PWDx_Missed Trash\Recycling\Yard Waste\Bulk Item,PWDx,https://mayors24.cityofboston.gov/media/boston/report/photos/55d793a2048573f2ccf64508/image.jpg,https://cityworker.cityofboston.gov:8443/attachments/report/55d793f5d052ea4bf6ab101c/closed_photo/Report.jpg,54 Baker St  West Roxbury  MA  02132,12.0,06,6.0,E5,West Roxbury,12.0,Ward 20,2016,R1,54 Baker St,2132.0,Address,7774.0,42.2719,-71.1639,Citizens Connect App,"(42.2719, -71.1639)",-7921929.110863442,5201796.164143264,-7921929.110863442,5201796.164143264
891898,101001976313,12/26/2016 11:20:42 AM,12/28/2016 08:30:00 AM,12/26/2016 05:11:27 PM,ONTIME,Closed,Case Closed. Closed date : 2016-12-26 17:11:27.413 Case Resolved Picked up boxes and swept up debris,Requests for Street Cleaning,Public Works Department,Street Cleaning,Requests for Street Cleaning,PWDx_District 1B: North End,PWDx,https://mayors24.cityofboston.gov/media/boston/report/photos/58614356048508c58697ac23/photo_20161226_112017.jpg,https://cityworker.cityofboston.gov:8443/attachments/report/5861439bd052a88adb379b97/closed_photo/Report.jpg,97 Myrtle St  Boston  MA  02114,3.0,1B,8.0,A1,Beacon Hill,14.0,Ward 5,0504,RC,97 Myrtle St,2114.0,Address,280700.0,42.3593,-71.0679,Citizens Connect App,"(42.3593, -71.0679)",-7911242.439747286,5214953.719911855,-7911242.439747286,5214953.719911855
89166,101001277783,02/05/2015 11:42:47 AM,02/09/2015 11:42:47 AM,02/06/2015 08:50:14 AM,ONTIME,Closed,Case Closed Case Noted Street was serviced we will return on next trash day.,Missed Trash: District 07,Public Works Department,Sanitation,Missed Trash/Recycling/Yard Waste/Bulk Item,PWDx_Missed Trash\Recycling\Yard Waste\Bulk Item,PWDx,,,24-26 Regis Rd  Mattapan  MA  02126,8.0,07,5.0,B3,Greater Mattapan,9.0,Ward 18,1821,R2,24-26 Regis Rd,2126.0,Address,115203.0,42.2704,-71.0964,Constituent Call,"(42.2704, -71.0964)",-7914415.045234895,5201570.507342391,-7914415.045234895,5201570.507342391
905201,101001772473,04/20/2016 12:53:37 PM,05/20/2016 12:53:32 PM,01/17/2017 08:00:20 AM,OVERDUE,Closed,Case Closed. Closed date : 2017-01-17 08:00:20.61 VIOCOR: Violation Corrected,Trash on Vacant Lot,Inspectional Services,Environmental Services,Trash on Vacant Lot,ISD_Environmental Services (INTERNAL),ISD,,,1659-1665 Blue Hill Ave  Mattapan  MA  02126,8.0,07,4.0,B3,Greater Mattapan,9.0,Ward 18,1804,C,1659-1665 Blue Hill Ave,2126.0,Address,16346.0,42.2679,-71.0942,Constituent Call,"(42.2679, -71.0942)",-7914170.14235515,5201194.424607255,-7914170.14235515,5201194.424607255
388639,101001928096,10/11/2016 11:13:00 AM,10/14/2016 11:13:36 AM,12/05/2016 09:39:30 AM,OVERDUE,Closed,Case Closed. Closed date : 2016-12-05 09:39:30.503 Case Resolved Dear Constituent     The Boston Public Works Construction Inspection Unit (CIU) Inspector spoke to the contractor onsite and informed him he was not allowed to block the street.      We apologize for not closing the case after speaking with the contractor.    This job has been completed.      Sincerely     Mark Cardarelli  Supervisor of Utility Coordination and Compliance  Boston Public Works Department  617-635-4951 Office,Contractor Complaints,Public Works Department,Highway Maintenance,Contractor Complaints,PWDx_Contractor Complaints,PWDx,,,15 Mallard Ave  Dorchester  MA  02124,8.0,07,4.0,B3,Dorchester,9.0,Ward 17,1705,R3,15 Mallard Ave,2124.0,Address,88768.0,42.2912,-71.077,Constituent Call,"(42.2912, -71.077)",-7912255.447113506,5204700.094208613,-7912255.447113506,5204700.094208613
567427,101001077480,04/29/2014 07:35:07 AM,,04/29/2014 07:35:09 AM,ONTIME,Closed,Case Closed Internal Case,Highway Maintenance,Public Works Department,Highway Maintenance,Highway Maintenance,PWDx_District 03: North Dorchester,PWDx,,,590 Blue Hill Ave  Dorchester  MA  02121,7.0,03,4.0,B2,Greater Mattapan,13.0,Ward 14,1403,R3,590 Blue Hill Ave,2121.0,Address,16515.0,42.303999999999995,-71.0846,Employee Generated,"(42.304, -71.0846)",-7913101.475243535,5206626.507515556,-7913101.475243535,5206626.507515556
810206,101001023478,02/10/2014 06:19:21 PM,02/13/2014 08:30:00 AM,02/11/2014 07:31:25 AM,ONTIME,Closed,Case Closed Case Noted Trash picked up at 7:31 a.m. on 2/11/14.,Missed Trash: District 07,Public Works Department,Sanitation,Missed Trash/Recycling/Yard Waste/Bulk Item,PWDx_Missed Trash\Recycling\Yard Waste\Bulk Item,PWDx,,,45 Jacob St  Dorchester  MA  02124,8.0,07,4.0,B3,Greater Mattapan,9.0,Ward 14,1413,CM,45 Jacob St,2124.0,Address,155402.0,42.2852,-71.0839,Constituent Call,"(42.2852, -71.0839)",-7913023.551599979,5203797.222735626,-7913023.551599979,5203797.222735626
435394,101000371903,01/08/2012 08:54:45 AM,01/10/2012 08:54:44 AM,01/09/2012 07:36:38 AM,ONTIME,Closed,Case Closed Case Resolved,Traffic Signal Repair,Transportation - Traffic Division,Signs & Signals,Traffic Signal Repair,BTDT_Traffic Signal_Repair,BTDT,,,INTERSECTION of Columbia Rd & Massachusetts Ave  Dorchester  MA,7.0,03,2.0,B2,Dorchester,5.0,Ward 7,0709,,INTERSECTION Columbia Rd & Massachusetts Ave,,Intersection,3240.0,42.3204,-71.0618,Constituent Call,"(42.3204, -71.0618)",-7910563.390853449,5209095.297035659,-7910563.390853449,5209095.297035659
619938,101000848569,05/29/2013 11:52:20 AM,05/19/2015 11:52:20 AM,04/17/2014 09:17:54 AM,ONTIME,Closed,Case Closed ADCLSD: Administratively Closed,Egress,Inspectional Services,Building,Egress,ISD_Building (INTERNAL),ISD,,,4164 Washington St  Roslindale  MA  02131,12.0,02,5.0,E5,Roslindale,10.0,Ward 19,1913,C,4164 Washington St,2131.0,Address,145138.0,42.2879,-71.1262,Self Service,"(42.2879, -71.1262)",-7917732.3660605345,5204203.504256407,-7917732.3660605345,5204203.504256407
250195,101001892796,08/28/2016 06:53:51 PM,08/30/2016 08:30:00 AM,08/29/2016 01:21:46 AM,ONTIME,Closed,Case Closed. Closed date : 2016-08-29 01:21:46.683 Case Resolved vehicle tagged,Parking Enforcement,Transportation - Traffic Division,Enforcement & Abandoned Vehicles,Parking Enforcement,BTDT_Parking Enforcement,BTDT,https://mayors24.cityofboston.gov/media/boston/report/photos/57c36b7a0485113b3cca9609/report.jpg,,INTERSECTION of Howell St & Boston St  Dorchester  MA,6.0,03,3.0,C6,Dorchester,5.0,7,0708,,INTERSECTION Howell St & Boston St,,Intersection,11263.0,42.3594,-71.0587,Citizens Connect App,"(0, 0)",-7910218.300431989,5214968.784796895,-7910218.300431989,5214968.784796895
62641,101001229818,12/08/2014 12:41:54 PM,11/27/2016 12:41:54 PM,12/17/2014 08:06:24 AM,ONTIME,Closed,Case Closed NOVIO: No Violation Found/No Cause,Contractors Complaint,Inspectional Services,Building,Contractors Complaint,ISD_Building (INTERNAL),ISD,,,45 Cranston St  Jamaica Plain  MA  02130,9.0,02,6.0,E13,Jamaica Plain,11.0,Ward 19,1901,R1,45 Cranston St,2130.0,Address,44047.0,42.3202,-71.1075,Constituent Call,"(42.3202, -71.1075)",-7915650.691582701,5209065.185971268,-7915650.691582701,5209065.185971268
647968,101001247390,01/14/2015 03:06:24 PM,,01/14/2015 03:06:25 PM,ONTIME,Closed,Case Closed Internal Case Performed by Highway Maintenance crew.,Pothole Repair (Internal),Public Works Department,Highway Maintenance,Pothole Repair (Internal),PWDx_District 09: East Boston,PWDx,,,126 Putnam St  East Boston  MA  02128,1.0,09,1.0,A7,East Boston,1.0,Ward 1,0110,R3,126 Putnam St,2128.0,Address,113617.0,42.3787,-71.032,Employee Generated,"(42.3787, -71.032)",-7907246.070027809,5217876.756589564,-7907246.070027809,5217876.756589564
159785,101001919613,09/28/2016 11:34:22 AM,,09/28/2016 01:52:59 PM,ONTIME,Closed,Case Closed. Closed date : 2016-09-28 13:52:59.753 Case Resolved 1 syringe recovered from 11 Gerard Street  Roxbury,Needle Pickup,Mayor's 24 Hour Hotline,Needle Program,Needle Pickup,GEN_Needle_Pickup,GEN_,https://mayors24.cityofboston.gov/media/boston/report/photos/57ebe2fa6963a1cc488b8a7a/1475076838523.jpg,,11 Gerard St  Roxbury  MA  02119,7.0,10B,7.0,B2,Roxbury,13.0,Ward 8,0803,I,11 Gerard St,2119.0,Address,63523.0,42.3318,-71.0722,Employee Generated,"(42.3318, -71.0722)",-7911721.113557696,5210811.78594304,-7911721.113557696,5210811.78594304
286701,101001276681,02/05/2015 06:27:48 AM,02/09/2015 08:30:00 AM,02/12/2015 05:47:25 PM,OVERDUE,Closed,Case Closed Case Noted Snow has been removed.,Request for Snow Plowing,Public Works Department,Street Cleaning,Request for Snow Plowing,PWDx_District 10B: Roxbury,PWDx,,,1 Putnam Pl  Roxbury  MA  02119,7.0,10B,7.0,B2,Roxbury,13.0,Ward 9,0905,R1,1 Putnam Pl,2119.0,Address,113695.0,42.3302,-71.0879,Constituent Call,"(42.3302, -71.0879)",-7913468.829563153,5210570.8564534765,-7913468.829563153,5210570.8564534765
239504,101001911720,09/18/2016 03:43:15 PM,09/26/2016 08:30:00 AM,09/19/2016 12:49:44 PM,ONTIME,Closed,Case Closed. Closed date : 2016-09-19 12:49:44.307 Case Resolved COMPLETED ALL OVERFLOWING TRASH BARRELS WERE REMOVED FROM RINGGOLD PARK 9/19/2016,Overflowing Trash Can - Ringgold Park (BPRD),Parks & Recreation Department,Park Maintenance & Safety,Ground Maintenance,PARK_Maintenance_Region 5,PARK,https://mayors24.cityofboston.gov/media/boston/report/photos/57deee506963aae66f3608ab/photo_20160918_154251.jpg,,,,,,,,,,,,,,,,42.3594,-71.0587,Citizens Connect App,"(0, 0)",-7910218.300431989,5214968.784796895,-7910218.300431989,5214968.784796895
516465,101001204048,10/24/2014 04:04:32 PM,,10/24/2014 04:05:26 PM,ONTIME,Closed,Case Closed Case Resolved  - returning Metrolist client for new list.,Front Desk Interactions,Civil Rights,Call Inquiry,OCR Front Desk Interactions,HS_OCR_FrontDesk_Interactions,HS_O,,,,,,,,,,,,,,,,,42.3594,-71.0587,Constituent Call,"(0, 0)",-7910218.300431989,5214968.784796895,-7910218.300431989,5214968.784796895
771797,101001010656,01/23/2014 07:51:40 AM,01/27/2014 08:30:00 AM,01/23/2014 11:10:37 AM,ONTIME,Closed,Case Closed Case Resolved picked up,Missed Trash: District 05,Public Works Department,Sanitation,Missed Trash/Recycling/Yard Waste/Bulk Item,PWDx_Missed Trash\Recycling\Yard Waste\Bulk Item,PWDx,,,8 Mohawk St  South Boston  MA  02127,6.0,05,2.0,C6,South Boston,5.0,07,0706,CD,8 Mohawk St,2127.0,Address,96261.0,42.3289,-71.0556,Self Service,"(42.3289, -71.0556)",-7909873.2100105295,5210375.10575577,-7909873.2100105295,5210375.10575577
604773,101000707771,11/17/2012 12:27:40 AM,11/21/2012 08:30:00 AM,11/19/2012 06:02:03 AM,ONTIME,Closed,Case Closed Case Resolved ASSIGNED TO CIU,Utility Call-In,Public Works Department,Highway Maintenance,Utility Call-In,PWDx_Utility Call-In,PWDx,,,260 Franklin St  Boston  MA  02109,3.0,1C,1.0,A1,Downtown / Financial District,3.0,Ward 3,0306,C,260 Franklin St,2109.0,Address,60664.0,42.3569,-71.054,Constituent Call,"(42.3569, -71.054)",-7909695.09882526,5214592.169862997,-7909695.09882526,5214592.169862997
515843,101001939345,10/26/2016 12:19:00 PM,,10/26/2016 07:58:21 PM,ONTIME,Closed,Case Closed. Closed date : 2016-10-26 19:58:21.443 Case Noted An animal control officer has been dispatched to this location.,Animal Generic Request,Animal Control,Animal Issues,Animal Generic Request,INFO01_GenericeFormforOtherServiceRequestTypes,INFO,,,206 Bunker Hill St  Charlestown  MA  02129,3.0,1A,1.0,A15,Charlestown,2.0,Ward 2,0204,CM,206 Bunker Hill St,2129.0,Address,162710.0,42.3788,-71.0625,Constituent Call,"(42.3788, -71.0625)",-7910641.314497003,5217891.826128013,-7910641.314497003,5217891.826128013
124902,101001865032,07/21/2016 08:49:00 PM,,,ONTIME,Open,,Animal Generic Request,Animal Control,Animal Issues,Animal Generic Request,INFO01_GenericeFormforOtherServiceRequestTypes,INFO,,,INTERSECTION of Clinton St & North St  Boston  MA,3.0,1B,1.0,A1,Downtown / Financial District,3.0,3,0306,,INTERSECTION Clinton St & North St,,Intersection,16497.0,42.3594,-71.0587,Constituent Call,"(0, 0)",-7910218.300431989,5214968.784796895,-7910218.300431989,5214968.784796895
942700,101002028790,03/02/2017 09:40:39 AM,03/03/2017 09:40:39 AM,03/02/2017 11:16:09 AM,ONTIME,Closed,Case Closed. Closed date : 2017-03-02 11:16:09.4 Case Resolved,CE Collection,Public Works Department,Street Cleaning,CE Collection,PWDx_District 1B: North End,PWDx,https://cityworker.cityofboston.gov:8443/attachments/report/58b82ee5d052b69d23ce0daf/photo/Report.jpg,https://cityworker.cityofboston.gov:8443/attachments/report/58b82ee5d052b69d23ce0daf/closed_photo/Report.jpg,228 Cambridge St  Boston  MA  02114,3.0,1B,8.0,A1,Beacon Hill,14.0,Ward 5,0504,RC,228 Cambridge St,2114.0,Address,158062.0,42.361000000000004,-71.0666,City Worker App,"(42.361, -71.0666)",-7911097.724409255,5215209.826218224,-7911097.724409255,5215209.826218224
161638,101001879085,08/09/2016 01:28:48 PM,,08/12/2016 04:31:12 PM,ONTIME,Closed,Case Closed. Closed date : 2016-08-12 16:31:12.293 Bulk Item Automation,Schedule Bulk Item Pickup,Public Works Department,Sanitation,Schedule a Bulk Item Pickup SS,PWDx_Schedule a Bulk Item Pickup,PWDx,,,875 Huntington Ave  Boston  MA  02115,4.0,10A,8.0,B2,Mission Hill,14.0,Ward 10,1004,EA,875 Huntington Ave,2115.0,Address,256274.0,42.3328,-71.1112,Self Service,"(42.3328, -71.1112)",-7916062.573698636,5210962.369986333,-7916062.573698636,5210962.369986333
473484,101000444961,07/04/2012 05:13:51 PM,07/09/2012 08:30:00 AM,07/05/2012 07:23:50 AM,ONTIME,Closed,Case Closed Case Resolved 4 recycle stickers del at 7:23. left in foyer at mailbox.,Sticker Request,Public Works Department,Recycling,Sticker Request,PWDx_Sticker Request,PWDx,,,43 Symphony Rd  Boston  MA  02115,4.0,10A,8.0,D4,Fenway / Kenmore / Audubon Circle / Longwood,14.0,Ward 4,0407,A,43 Symphony Rd,2115.0,Address,317375.0,42.3432,-71.0886,Self Service,"(42.3432, -71.0886)",-7913546.753206708,5212528.585989647,-7913546.753206708,5212528.585989647
869788,101001603890,10/02/2015 08:33:51 PM,10/06/2015 08:30:00 AM,10/03/2015 08:00:32 PM,ONTIME,Closed,Case Closed. Closed date : 2015-10-03 20:00:32.317 Case Resolved CLEAR,Parking Enforcement,Transportation - Traffic Division,Enforcement & Abandoned Vehicles,Parking Enforcement,BTDT_Parking Enforcement,BTDT,,,25 P St  South Boston  MA  02127,6.0,05,2.0,C6,South Boston / South Boston Waterfront,5.0,Ward 6,0607,I,25 P St,2127.0,Address,106256.0,42.3594,-71.0587,Citizens Connect App,"(0, 0)",-7910218.300431989,5214968.784796895,-7910218.300431989,5214968.784796895
725410,101000909278,08/23/2013 03:25:51 PM,08/23/2014 03:25:51 PM,10/23/2015 03:07:32 PM,OVERDUE,Closed,Case Closed. Closed date : 2015-10-23 15:07:32.07 Case Resolved Sidewalk repaired 10/2015    If you have any further questions  or feel that this case was closed  or reallocated in error  please do not hesitate to contact me.    Michael Somers  Senior Civil Engineer  Construction Management Division  Boston Public Works  617-635-3831	  Michael.Somers@Boston.gov,Sidewalk Repair,Public Works Department,Highway Maintenance,Sidewalk Repair,PWDx_Sidewalk Repair,PWDx,,,60 Fremont St  Mattapan  MA  02126,8.0,07,4.0,B3,Greater Mattapan,9.0,Ward 18,1804,R1,60 Fremont St,2126.0,Address,60940.0,42.2705,-71.0907,City Worker App,"(42.2705, -71.0907)",-7913780.524137373,5201585.550962046,-7913780.524137373,5201585.550962046
610581,101000420199,05/11/2012 08:42:10 AM,05/15/2012 08:42:09 AM,05/11/2012 09:48:16 AM,ONTIME,Closed,Case Closed Case Resolved tv picked up,Requests for Street Cleaning,Public Works Department,Street Cleaning,Requests for Street Cleaning,PWDx_District 05: South Boston,PWDx,,,237 Dorchester St  South Boston  MA  02127,6.0,05,2.0,C6,South Boston / South Boston Waterfront,5.0,Ward 7,0705,CM,237 Dorchester St,2127.0,Address,48952.0,42.3331,-71.0511,City Worker App,"(42.3331, -71.0511)",-7909372.272301961,5211007.545666194,-7909372.272301961,5211007.545666194
599111,101000866305,06/24/2013 01:37:48 PM,,06/27/2013 09:51:41 PM,ONTIME,Closed,Case Closed Bulk Item Automation,Schedule a Bulk Item Pickup,Public Works Department,Sanitation,Schedule a Bulk Item Pickup,PWDx_Schedule a Bulk Item Pickup,PWDx,,,144 Brayton Rd  Brighton  MA  02135,11.0,04,9.0,D14,Allston / Brighton,15.0,Ward 22,2204,R1,144 Brayton Rd,2135.0,Address,19619.0,42.3493,-71.173,Constituent Call,"(42.3493, -71.173)",-7922942.11822966,5213447.352459726,-7922942.11822966,5213447.352459726
682062,101001599651,09/28/2015 12:50:00 PM,,10/13/2015 11:52:47 AM,ONTIME,Closed,Case Closed. Closed date : 2015-10-13 11:52:47.903 Case Resolved The City engineers have determined your street is a private way.  The PWD cannot perform any patching or resurfacing on a private way.  Any patching or resurfacing to be done on a  private way is the responsibility of the property owners.  Sincerely   Kevin Linskey Senior Civil Engineer Boston Public Works Department 617-635-4951 Office,Roadway Repair,Public Works Department,Highway Maintenance,Roadway Repair,PWDx_Roadway Repair,PWDx,,,55 Cottage Rd  West Roxbury  MA  02132,12.0,06,6.0,E5,West Roxbury,12.0,Ward 20,2015,R1,55 Cottage Rd,2132.0,Address,43316.0,42.2658,-71.1612,Constituent Call,"(42.2658, -71.1612)",-7921628.548238299,5200878.526635818,-7921628.548238299,5200878.526635818
239732,101000397147,03/19/2012 01:43:49 PM,04/02/2012 01:43:49 PM,04/02/2012 08:45:26 AM,ONTIME,Closed,Case Closed Case Resolved,Missing Sign,Transportation - Traffic Division,Signs & Signals,Missing Sign,BTDT_Sign Shop_Sign Installation,BTDT,,,INTERSECTION of Dorchester Ave & Lincoln St  Dorchester  MA,7.0,07,3.0,C11,Dorchester,7.0,Ward 16,1601,,INTERSECTION Dorchester Ave & Lincoln St,,Intersection,4142.0,42.2998,-71.0603,Constituent Call,"(42.2998, -71.0603)",-7910396.411617258,5205994.359985157,-7910396.411617258,5205994.359985157
826369,101001364088,04/26/2015 04:32:10 PM,05/11/2015 08:30:00 AM,04/29/2015 11:49:07 AM,ONTIME,Closed,Case Closed Case Resolved Work completed 4/29/15.,Sign Repair,Transportation - Traffic Division,Signs & Signals,Sign Repair,BTDT_Sign Shop_Sign Installation,BTDT,https://mayors24.cityofboston.gov/media/boston/report/photos/553d4b3a04850d21eb59ff8e/report.jpg,,152 Arlington St  Boston  MA  02116,4.0,1C,2.0,A1,Back Bay,6.0,05,0501,E,152 Arlington St,2116.0,Address,157822.0,42.3484,-71.0691,Citizens Connect App,"(42.3484, -71.0691)",-7911376.0231362395,5213311.791144463,-7911376.0231362395,5213311.791144463
734002,101001135201,07/23/2014 09:11:34 AM,07/30/2014 09:11:34 AM,07/29/2014 08:44:05 AM,ONTIME,Closed,Case Closed Case Resolved Mark Cardarelli called the constituent and explained that the City plans on resurfacing Boston St  but needs to upgrade all of the pedestrian ramps and defective sidewalks first.     Mark will forward the complaint to the engineers and the contractor  and remind them that the subcontractors working for them must be professional and make public safety their number one priority while working.     Sincerely      Mark Cardarelli  Supervisor of Utility Coordination and Compliance  Boston Public Works Department  617-635-4951 Office,Contractor Complaints,Public Works Department,Highway Maintenance,Contractor Complaints,PWDx_Contractor Complaints,PWDx,,,INTERSECTION of Boston St & Rawson St  Dorchester  MA,6.0,03,2.0,C6,Dorchester,5.0,Ward 7,0708,,INTERSECTION Boston St & Rawson St,,Intersection,1669.0,42.3264,-71.0587,Constituent Call,"(42.3264, -71.0587)",-7910218.300431989,5209998.67347647,-7910218.300431989,5209998.67347647
658911,101000499941,10/30/2012 11:21:38 AM,11/01/2012 11:21:37 AM,10/30/2012 12:00:32 PM,ONTIME,Closed,Case Closed Case Noted will send crew to pick up branches    and get sweeper up there thursday on its regular day,Requests for Street Cleaning,Public Works Department,Street Cleaning,Requests for Street Cleaning,PWDx_District 06: West Roxbury and Roslindale,PWDx,,,20 Andover Rd  Roslindale  MA  02132,9.0,06,6.0,E5,West Roxbury,12.0,Ward 20,2006.0,R1,20 Andover Rd,2132.0,Address,3576.0,42.2948,-71.1366,Constituent Call,"(42.2948, -71.1366)",-7918890.088764785,5205241.8583755465,-7918890.088764785,5205241.8583755465
252255,101001061037,04/04/2014 12:21:57 PM,04/09/2014 12:21:56 PM,04/10/2014 01:39:03 PM,OVERDUE,Closed,Case Closed ADCLSD: Administratively Closed,Building Inspection Request,Inspectional Services,Building,Building Inspection Request,ISD_Building (INTERNAL),ISD,,,20 Winter St  Dorchester  MA  02122,7.0,03,3.0,C11,Dorchester,8.0,Ward 15,1504,R3,20 Winter St,2122.0,Address,150902.0,42.3095,-71.0624,Constituent Call,"(42.3095, -71.0624)",-7910630.182547923,5207454.383531786,-7910630.182547923,5207454.383531786
61277,101000327399,09/10/2011 07:31:18 AM,,09/10/2011 07:31:18 AM,ONTIME,Closed,Case Closed Internal Case Performed by Highway Maintenance crew.,Pothole Repair (Internal),Public Works Department,Highway Maintenance,Pothole Repair (Internal),PWDx_District 1B: North End,PWDx,,,1 Bulfinch Pl  Boston  MA  02114,3.0,1B,1.0,A1,Downtown / Financial District,3.0,03,0306,C,1 Bulfinch Pl,2114.0,Address,157444.0,42.3616,-71.0609,Employee Generated,"(42.3616, -71.0609)",-7910463.203311734,5215300.218333665,-7910463.203311734,5215300.218333665
134665,101000443126,06/29/2012 10:38:24 AM,06/29/2013 10:38:24 AM,06/29/2012 10:38:31 AM,ONTIME,Closed,Case Closed Internal Case Performed by Highway Maintenance crew.,Sidewalk Repair (Internal),Public Works Department,Highway Maintenance,Sidewalk Repair (Internal),PWDx_District 02: Jamaica Plain,PWDx,,,18 Holly Rd  Roslindale  MA  02131,12.0,02,5.0,E18,Roslindale,10.0,Ward 18,1807,R1,18 Holly Rd,2131.0,Address,74726.0,42.2847,-71.1168,Employee Generated,"(42.2847, -71.1168)",-7916685.962847077,5203721.987327784,-7916685.962847077,5203721.987327784
279898,101000711180,11/24/2012 09:40:30 PM,11/27/2012 08:30:00 AM,11/24/2012 10:37:18 PM,ONTIME,Closed,Case Closed Case Resolved dead animal removed,Pick up Dead Animal,Public Works Department,Street Cleaning,Pick up Dead Animal,PWDx_District 07: South Dorchester,PWDx,,,267 Talbot Ave  Dorchester  MA  02124,8.0,07,4.0,B3,Dorchester,9.0,Ward 17,1705,R3,267 Talbot Ave,2124.0,Address,133689.0,42.2911,-71.0755,Constituent Call,"(42.2911, -71.0755)",-7912088.467877317,5204685.045645997,-7912088.467877317,5204685.045645997
739706,101001313866,02/24/2015 10:05:49 AM,,02/24/2015 10:05:50 AM,ONTIME,Closed,Case Closed Internal Case Performed by Highway Maintenance crew.,Pothole Repair (Internal),Public Works Department,Highway Maintenance,Pothole Repair (Internal),PWDx_District 10B: Roxbury,PWDx,,,172-176 Seaver St  Dorchester  MA  02121,9.0,10B,7.0,B2,Roxbury,13.0,Ward 12,1207,A,172-176 Seaver St,2121.0,Address,124154.0,42.3086,-71.0897,Employee Generated,"(42.3086, -71.0897)",-7913669.204646579,5207318.907961295,-7913669.204646579,5207318.907961295
486516,101000766989,02/10/2013 01:25:35 PM,02/13/2013 08:30:00 AM,02/13/2013 09:53:14 AM,OVERDUE,Closed,Case Closed Case Resolved,Request for Snow Plowing,Public Works Department,Street Cleaning,Request for Snow Plowing,PWDx_District 08: Hyde Park,PWDx,,,71 Rosewood St  Mattapan  MA  02126,8.0,08,4.0,E18,Greater Mattapan,9.0,Ward 18,1804,R1,71 Rosewood St,2126.0,Address,118574.0,42.2672,-71.0991,Constituent Call,"(42.2672, -71.0991)",-7914715.607860038,5201089.124114194,-7914715.607860038,5201089.124114194
248926,101000965614,11/14/2013 02:57:11 PM,11/18/2013 02:57:11 PM,11/15/2013 07:50:51 AM,ONTIME,Closed,Case Closed Case Resolved DELIVER RECYCLE STICKER ON . 11/15/13 .,Sticker Request,Public Works Department,Recycling,Sticker Request,PWDx_Sticker Request,PWDx,,,184 Cornell St  Roslindale  MA  02131,12.0,06,5.0,E5,Roslindale,10.0,Ward 18,1810,R2,184 Cornell St,2131.0,Address,219154.0,42.2787,-71.1347,Self Service,"(42.2787, -71.1347)",-7918678.581732277,5202819.209002695,-7918678.581732277,5202819.209002695
830479,101001578931,09/15/2015 11:04:00 AM,,09/17/2015 08:22:03 AM,ONTIME,Closed,Case Closed. Closed date : 2015-09-17 08:22:03.6 Case Resolved SEWER LINE D/R ON ARRIVAL   FLUSHED AND DISINFECTED Catch Basin's on 9/15.,General Request,Boston Water & Sewer Commission,Administrative & General Requests,BWSC General Request,BWSC_All Cases,BWSC,,,18 Converse St  Brighton  MA  02135,11.0,04,9.0,D14,Allston / Brighton,15.0,Ward 22,2211,R1,18 Converse St,2135.0,Address,42274.0,42.3567,-71.1558,Constituent Call,"(42.3567, -71.1558)",-7921027.422988015,5214562.041315547,-7921027.422988015,5214562.041315547
542577,101000753975,02/09/2013 03:24:35 PM,02/13/2013 08:30:00 AM,02/10/2013 03:10:55 AM,ONTIME,Closed,Case Closed Case Resolved,Request for Snow Plowing,Public Works Department,Street Cleaning,Request for Snow Plowing,PWDx_District 04: Allston/Brighton,PWDx,,,INTERSECTION of Claymoss Rd & Euston Rd  Brighton  MA,11.0,04,9.0,D14,Allston / Brighton,15.0,Ward 21,2111,,INTERSECTION Claymoss Rd & Euston Rd,,Intersection,3102.0,42.3441,-71.1451,Citizens Connect App,"(42.3441, -71.1451)",-7919836.304436528,5212664.136092194,-7919836.304436528,5212664.136092194
8647,101001894764,08/30/2016 01:39:00 PM,,09/01/2016 04:32:40 PM,ONTIME,Closed,Case Closed. Closed date : 2016-09-01 16:32:40.257 Bulk Item Automation,Schedule a Bulk Item Pickup,Public Works Department,Sanitation,Schedule a Bulk Item Pickup,PWDx_Schedule a Bulk Item Pickup,PWDx,,,29-37 Sleeper St  Boston  MA  02210,6.0,05,2.0,C6,South Boston / South Boston Waterfront,5.0,06,0601,,29-37 Sleeper St,2210.0,Address,343781.0,42.3522,-71.0487,Employee Generated,"(42.3522, -71.0487)",-7909105.105524056,5213884.174346029,-7909105.105524056,5213884.174346029
109556,101001885420,08/18/2016 08:04:00 AM,08/19/2016 08:04:13 AM,11/22/2016 11:10:29 AM,OVERDUE,Closed,Case Closed. Closed date : 2016-11-22 11:10:29.167 Case Resolved Signal timing issues which have affected traffic progression along Summer Street have been resolved.  The signals are currently functioning as designed.,Traffic Signal Inspection,Transportation - Traffic Division,Signs & Signals,Traffic Signal Inspection,BTDT_Engineering_Request for Traffic Signal Study or Review,BTDT,,,1 Summer St  Boston  MA  02111,3.0,1C,2.0,A1,Downtown / Financial District,4.0,Ward 3,0308,EA,1 Summer St,2111.0,Address,131977.0,42.3547,-71.0602,Self Service,"(42.3547, -71.0602)",-7910385.279668178,5214260.761114648,-7910385.279668178,5214260.761114648
3007,101001169413,09/10/2014 06:56:24 PM,,09/17/2014 04:37:13 PM,ONTIME,Closed,Case Closed Bulk Item Automation,Schedule a Bulk Item Pickup,Public Works Department,Sanitation,Schedule a Bulk Item Pickup,PWDx_Schedule a Bulk Item Pickup,PWDx,,,1690 Centre St  West Roxbury  MA  02132,9.0,06,6.0,E5,Roslindale,10.0,Ward 20,2007,CM,1690 Centre St,2132.0,Address,27695.0,42.2873,-71.1468,Constituent Call,"(42.2873, -71.1468)",-7920025.547570875,5204113.217969172,-7920025.547570875,5204113.217969172
126824,101000954159,10/25/2013 01:15:54 PM,11/22/2013 01:15:54 PM,02/06/2014 12:46:47 PM,OVERDUE,Closed,Case Closed Case Resolved  Cart 514-9007490 delivered on 1/31/14,Request for Recycling Cart,Public Works Department,Recycling,Request for Recycling Cart,PWDx_IPL Damaged Cart Replacement,PWDx,,,26 Thurston St  East Boston  MA  02128,1.0,09,1.0,A7,East Boston,1.0,Ward 1,0112,R3,26 Thurston St,2128.0,Address,319411.0,42.3845,-71.0053,City Worker App,"(42.3845, -71.0053)",-7904273.839623628,5218750.829493154,-7904273.839623628,5218750.829493154
475820,101001518399,08/11/2015 03:10:01 PM,,08/13/2015 01:26:03 PM,ONTIME,Closed,Case Closed. Closed date : 2015-08-13 13:26:03.59 Case Resolved,Schedule Bulk Item Pickup,Public Works Department,Sanitation,Schedule a Bulk Item Pickup SS,PWDx_Schedule a Bulk Item Pickup,PWDx,,,34 Stearns Rd  West Roxbury  MA  02132,12.0,06,6.0,E5,West Roxbury,12.0,Ward 20,2005,R1,34 Stearns Rd,2132.0,Address,130450.0,42.2667,-71.154,Self Service,"(42.2667, -71.154)",-7920827.047904588,5201013.910192171,-7920827.047904588,5201013.910192171
180037,101000419654,05/10/2012 09:06:10 AM,05/14/2012 09:06:09 AM,05/10/2012 11:37:59 AM,ONTIME,Closed,Case Closed Case Resolved Location has been made safe. This sidewalk will be referred for permanent repair. See case #101000419757 for status of the permanent repair.,Sidewalk Repair (Make Safe),Public Works Department,Highway Maintenance,Sidewalk Repair (Make Safe),PWDx_District 06: West Roxbury and Roslindale,PWDx,,,7 Highfield Rd  Roslindale  MA  02131,12.0,06,5.0,E5,Roslindale,10.0,Ward 18,1810,R1,7 Highfield Rd,2131.0,Address,73581.0,42.2773,-71.1278,Constituent Call,"(42.2773, -71.1278)",-7917910.477245803,5202608.573095818,-7917910.477245803,5202608.573095818
372370,101000763872,02/10/2013 09:53:24 AM,02/13/2013 08:30:00 AM,02/20/2013 02:51:39 PM,OVERDUE,Closed,Case Closed Case Noted  Thank you for contacting us.  The district yard did receive your request when submitted.  We apologize for the lateness of this response.,Request for Snow Plowing,Public Works Department,Street Cleaning,Request for Snow Plowing,PWDx_District 07: South Dorchester,PWDx,,,40 Mather St  Dorchester  MA  02124,8.0,07,4.0,C11,Dorchester,8.0,Ward 17,1706,R1,40 Mather St,2124.0,Address,92763.0,42.294,-71.0655,Self Service,"(42.294, -71.0655)",-7910975.272969383,5205121.46366229,-7910975.272969383,5205121.46366229
705477,101001209971,11/03/2014 12:05:11 PM,12/03/2014 12:05:10 PM,03/05/2015 11:43:18 AM,OVERDUE,Closed,Case Closed :,Heat - Excessive  Insufficient,Inspectional Services,Housing,Heat - Excessive  Insufficient,ISD_Housing (INTERNAL),ISD,,,19 Lyon St  Dorchester  MA  02122,7.0,03,3.0,C11,Dorchester,8.0,Ward 15,1504,R3,19 Lyon St,2122.0,Address,266879.0,42.3066,-71.0598,Constituent Call,"(42.3066, -71.0598)",-7910340.751871861,5207017.858072586,-7910340.751871861,5207017.858072586
372409,101000834726,05/07/2013 07:31:13 AM,05/21/2013 08:30:00 AM,,OVERDUE,Open,,Other: Complaint,Mayor's 24 Hour Hotline,Employee & General Comments,General Comments For a Program or Policy,INFO_General Comments Complaints Compliments,INFO,,,,,,,,,,,,,,,,,42.3594,-71.0587,Constituent Call,"(0, 0)",-7910218.300431989,5214968.784796895,-7910218.300431989,5214968.784796895
130776,101001790017,05/14/2016 09:04:54 AM,05/18/2016 08:30:00 AM,05/15/2016 09:47:52 AM,ONTIME,Closed,Case Closed. Closed date : 2016-05-15 09:47:52.9 Case Noted No such # as 83 but street clear,Improper Storage of Trash (Barrels),Public Works Department,Code Enforcement,Improper Storage of Trash (Barrels),PWDx_Code Enforcement,PWDx,,https://cityworker.cityofboston.gov:8443/attachments/report/573722d9d05243d389fca3a0/closed_photo/Report.jpg,83 W Springfield St  Roxbury  MA  02118,4.0,1C,7.0,D4,South End,6.0,09,0902,RC,83 W Springfield St,2118.0,Address,130022.0,42.3378,-71.077,Citizens Connect App,"(42.3378, -71.077)",-7912255.447113506,5211715.326118805,-7912255.447113506,5211715.326118805
37366,101001905426,09/11/2016 08:29:46 AM,09/13/2016 08:30:00 AM,09/11/2016 08:49:19 AM,ONTIME,Closed,Case Closed. Closed date : 2016-09-11 08:49:19.993 Case Resolved,CE Collection,Public Works Department,Street Cleaning,CE Collection,PWDx_District 1C: Downtown,PWDx,https://cityworker.cityofboston.gov:8443/attachments/report/57d54e38d0521159b44c445b/photo/Report.jpg,https://cityworker.cityofboston.gov:8443/attachments/report/57d54e38d0521159b44c445b/closed_photo/Report.jpg,INTERSECTION of W Canton St & Columbus Ave  Boston  MA,4.0,1C,2.0,D4,South End,6.0,4,0403,,INTERSECTION W Canton St & Columbus Ave,,Intersection,14429.0,42.3594,-71.0587,City Worker App,"(0, 0)",-7910218.300431989,5214968.784796895,-7910218.300431989,5214968.784796895
85326,101000927806,09/16/2013 09:47:52 AM,,09/19/2013 09:55:06 PM,ONTIME,Closed,Case Closed Bulk Item Automation,Schedule Bulk Item Pickup,Public Works Department,Sanitation,Schedule a Bulk Item Pickup SS,PWDx_Schedule a Bulk Item Pickup,PWDx,,,187 F St  South Boston  MA  02127,6.0,05,2.0,C6,South Boston / South Boston Waterfront,5.0,Ward 6,0604,CD,187 F St,2127.0,Address,55418.0,42.3379,-71.0463,Self Service,"(42.3379, -71.0463)",-7908837.938746152,5211730.38585209,-7908837.938746152,5211730.38585209
123097,101001349548,04/05/2015 11:12:09 AM,04/07/2015 08:30:00 AM,04/06/2015 11:15:50 AM,ONTIME,Closed,Case Closed Case Resolved complete,Request for Pothole Repair,Public Works Department,Highway Maintenance,Request for Pothole Repair,PWDx_District 05: South Boston,PWDx,https://mayors24.cityofboston.gov/media/boston/report/photos/552150c10485b083536d74a6/photo_20150405_111143.jpg,https://cityworker.cityofboston.gov:8443/attachments/report/552150d070b4685d4efcf913/closed_photo/Report.jpg,371-373 Athens St  South Boston  MA  02127,6.0,05,2.0,C6,South Boston / South Boston Waterfront,5.0,Ward 6,0604,,371-373 Athens St,2127.0,Address,161695.0,42.3594,-71.0587,Citizens Connect App,"(0, 0)",-7910218.300431989,5214968.784796895,-7910218.300431989,5214968.784796895
726779,101001547716,09/02/2015 10:46:37 AM,,09/02/2015 10:46:38 AM,ONTIME,Closed,Case Closed. Closed date : 2015-09-02 10:46:38.923 Internal Case Performed by Highway Maintenance crew.,Pothole Repair (Internal),Public Works Department,Highway Maintenance,Pothole Repair (Internal),PWDx_District 1B: North End,PWDx,,,INTERSECTION of Atlantic Ave & Richmond St  Boston  MA,3.0,1B,1.0,A1,Downtown / Financial District,3.0,Ward 3,0301,,INTERSECTION Atlantic Ave & Richmond St,,Intersection,736.0,42.3617,-71.05199999999999,Employee Generated,"(42.3617, -71.052)",-7909472.459843673,5215315.283770158,-7909472.459843673,5215315.283770158
641996,101001374729,05/11/2015 12:50:01 PM,05/12/2015 12:50:02 PM,05/11/2015 03:10:04 PM,ONTIME,Closed,Case Closed. Closed date : 2015-05-11 15:10:04.573 Case Resolved Complete,Requests for Street Cleaning,Public Works Department,Street Cleaning,Requests for Street Cleaning,PWDx_District 1C: Downtown,PWDx,,https://cityworker.cityofboston.gov:8443/attachments/report/5550ddc9d052df0e552d91ff/closed_photo/Report.jpg,88 Saint Botolph St  Boston  MA  02116,4.0,1C,7.0,D4,Back Bay,14.0,Ward 4,0405,CM,88 Saint Botolph St,2116.0,Address,120925.0,42.3451,-71.0803,Citizens Connect App,"(42.3451, -71.0803)",-7912622.801433123,5212814.7495930875,-7912622.801433123,5212814.7495930875
450493,101000846231,05/24/2013 11:45:24 AM,05/28/2013 11:45:24 AM,05/24/2013 11:45:29 AM,ONTIME,Closed,Case Closed,Requests for Street Cleaning,Public Works Department,Street Cleaning,Requests for Street Cleaning,PWDx_District 08: Hyde Park,PWDx,,,24 Alwin St  Hyde Park  MA  02136,12.0,08,5.0,E18,Hyde Park,10.0,Ward 18,1819,R1,24 Alwin St,2136.0,Address,3058.0,42.2535,-71.1416,City Worker App,"(42.2535, -71.1416)",-7919446.68621875,5199028.478363407,-7919446.68621875,5199028.478363407
750183,101001331200,03/12/2015 10:54:30 AM,,03/17/2015 04:34:50 PM,ONTIME,Closed,Case Closed Bulk Item Automation,Schedule Bulk Item Pickup,Public Works Department,Sanitation,Schedule a Bulk Item Pickup SS,PWDx_Schedule a Bulk Item Pickup,PWDx,,,27 Levant St  Dorchester  MA  02122,7.0,03,4.0,C11,Dorchester,8.0,Ward 15,1505,R3,27 Levant St,2122.0,Address,263778.0,42.3034,-71.0689,Self Service,"(42.3034, -71.0689)",-7911353.759238079,5206536.198143726,-7911353.759238079,5206536.198143726
689165,101000952706,10/23/2013 02:39:05 PM,10/25/2013 02:39:05 PM,10/24/2013 07:54:03 AM,ONTIME,Closed,Case Closed Case Noted delivered,Sticker Request,Public Works Department,Recycling,Sticker Request,PWDx_Sticker Request,PWDx,,,209 Bunker Hill St  Charlestown  MA  02129,3.0,1A,1.0,A15,Charlestown,2.0,Ward 2,0204,CD,209 Bunker Hill St,2129.0,Address,23372.0,42.3791,-71.0624,Self Service,"(42.3791, -71.0624)",-7910630.182547923,5217937.0348873595,-7910630.182547923,5217937.0348873595
593807,101001366307,04/29/2015 10:06:39 AM,,05/01/2015 04:40:01 PM,ONTIME,Closed,Case Closed Bulk Item Automation,Schedule a Bulk Item Pickup,Public Works Department,Sanitation,Schedule a Bulk Item Pickup,PWDx_Schedule a Bulk Item Pickup,PWDx,,,234 Lincoln St  Allston  MA  02134,11.0,04,9.0,D14,Allston / Brighton,15.0,Ward 22,2202,R4,234 Lincoln St,2134.0,Address,85979.0,42.3576,-71.1363,Constituent Call,"(42.3576, -71.1363)",-7918856.692917547,5214697.620534184,-7918856.692917547,5214697.620534184
140199,101001321485,03/02/2015 01:53:08 PM,,03/02/2015 01:53:08 PM,ONTIME,Closed,Case Closed Internal Case Performed by Highway Maintenance crew.,Pothole Repair (Internal),Public Works Department,Highway Maintenance,Pothole Repair (Internal),PWDx_District 02: Jamaica Plain,PWDx,,,14 Boylston St  Jamaica Plain  MA  02130,9.0,02,6.0,E13,Jamaica Plain,11.0,Ward 19,1901,CM,14 Boylston St,2130.0,Address,162482.0,42.3191,-71.1107,Employee Generated,"(42.3191, -71.1107)",-7916006.913953238,5208899.57682787,-7916006.913953238,5208899.57682787
457325,101000333704,09/24/2011 06:07:47 PM,11/29/2011 08:30:00 AM,10/07/2011 11:28:48 AM,ONTIME,Closed,Case Closed Case Resolved   THIS REQUEST HAS BEEN COMPLETED AND CALL STREET & WILLIAMS STREET WAS DONE. ALSO  A  CONTROL BOX & SIGN WERE DONE.,Graffiti Removal,Property Management,Graffiti,Graffiti Removal,PROP_GRAF_GraffitiRemoval,PROP,,,6 Williams St  Jamaica Plain  MA  02130,9.0,02,6.0,E13,Jamaica Plain,11.0,Ward 19,1906,E,6 Williams St,2130.0,Address,150084.0,42.3594,-71.0587,Citizens Connect App,"(0, 0)",-7910218.300431989,5214968.784796895,-7910218.300431989,5214968.784796895
329340,101000918497,09/04/2013 04:58:55 PM,10/04/2013 04:58:54 PM,01/15/2014 08:59:48 AM,OVERDUE,Closed,Case Closed VIOCOR: Violation Corrected,Rodent Activity,Inspectional Services,Environmental Services,Rodent Activity,ISD_Environmental Services (INTERNAL),ISD,,,34 Baxter St  South Boston  MA  02127,6.0,05,2.0,C6,South Boston / South Boston Waterfront,5.0,Ward 6,0602,CM,34 Baxter St,2127.0,Address,8836.0,42.3363,-71.0547,Constituent Call,"(42.3363, -71.0547)",-7909773.022468815,5211489.432993284,-7909773.022468815,5211489.432993284
272346,101000466485,08/18/2012 06:11:46 PM,,08/21/2012 09:45:35 PM,ONTIME,Closed,Case Closed Bulk Item Automation,Schedule a Bulk Item Pickup,Public Works Department,Sanitation,Schedule a Bulk Item Pickup,PWDx_Schedule a Bulk Item Pickup,PWDx,,,650 Huntington Ave  Mission Hill  MA  02120,9.0,10A,8.0,B2,Mission Hill,13.0,Ward 10,1001,A,650 Huntington Ave,2120.0,Address,255599.0,42.3353,-71.1004,Self Service,"(42.3353, -71.1004)",-7914860.323198068,5211338.840569625,-7914860.323198068,5211338.840569625
779359,101001763827,04/08/2016 09:23:08 AM,,04/08/2016 09:23:10 AM,ONTIME,Closed,Case Closed. Closed date : 2016-04-08 09:23:10.503 Case Resolved Marked completed at case creation,Catchbasin,Boston Water & Sewer Commission,Catchbasin,Catchbasin,BWSC_All Cases,BWSC,https://cityworker.cityofboston.gov:8443/attachments/report/5707b0bad052d8b24257196d/photo/Report.jpg,,86 Park St  Dorchester  MA  02122,7.0,07,3.0,C11,Dorchester,7.0,Ward 16,1602,R4,86 Park St,2122.0,Address,290000.0,42.2996,-71.0571,City Worker App,"(42.2996, -71.0571)",-7910040.18924672,5205964.258773569,-7910040.18924672,5205964.258773569
442945,101001345993,03/31/2015 02:00:45 PM,04/01/2015 02:00:45 PM,04/03/2015 05:00:04 AM,OVERDUE,Closed,Case Closed Case Resolved Pothole has been filled.,Request for Pothole Repair,Public Works Department,Highway Maintenance,Request for Pothole Repair,PWDx_District 04: Allston/Brighton,PWDx,,,111 Bigelow St  Brighton  MA  02135,11.0,04,9.0,D14,Allston / Brighton,15.0,Ward 22,2207,R1,111 Bigelow St,2135.0,Address,15355.0,42.3556,-71.1668,Constituent Call,"(42.3556, -71.1668)",-7922251.937386741,5214396.336018524,-7922251.937386741,5214396.336018524
314044,101001010968,01/23/2014 12:38:32 PM,05/23/2014 12:38:32 PM,02/04/2014 01:05:59 PM,ONTIME,Closed,Case Closed :,Sewage/Septic Back-Up,Inspectional Services,Housing,Sewage/Septic Back-Up,ISD_Housing (INTERNAL),ISD,,,297 Poplar St  Roslindale  MA  02131,12.0,06,5.0,E5,Roslindale,10.0,Ward 18,1809,R1,297 Poplar St,2131.0,Address,111834.0,42.2801,-71.1249,Constituent Call,"(42.2801, -71.1249)",-7917587.650722504,5203029.849589358,-7917587.650722504,5203029.849589358
569920,101001608882,10/09/2015 11:01:15 AM,,10/09/2015 11:16:40 AM,ONTIME,Closed,Case Closed. Closed date : 2015-10-09 11:16:40.69 Case Resolved Case resolved  information provided.,Call Log,Disability Department,Disability,Call Log,DISB_General_Request,DISB,,,,,,,,,,,,,,,,,42.3594,-71.0587,Constituent Call,"(0, 0)",-7910218.300431989,5214968.784796895,-7910218.300431989,5214968.784796895
632878,101001845834,06/27/2016 12:45:00 PM,,07/06/2016 04:30:16 PM,ONTIME,Closed,Case Closed. Closed date : 2016-07-06 16:30:16.517 Bulk Item Automation,Schedule a Bulk Item Pickup,Public Works Department,Sanitation,Schedule a Bulk Item Pickup,PWDx_Schedule a Bulk Item Pickup,PWDx,,,197 Magnolia St  Dorchester  MA  02121,7.0,03,4.0,B2,Roxbury,13.0,Ward 14,1401,R3,197 Magnolia St,2121.0,Address,88286.0,42.3118,-71.0737,Constituent Call,"(42.3118, -71.0737)",-7911888.092793888,5207800.607679141,-7911888.092793888,5207800.607679141
790422,101001659278,12/06/2015 06:48:00 PM,12/21/2015 08:30:00 AM,,OVERDUE,Open,,printed,Public Works Department,Street Lights,Street Light Outages,INFO01_GenericeFormforOtherServiceRequestTypes,INFO,,,24 Neptune Rd  East Boston  MA  02128,1.0,09,1.0,A7,East Boston,1.0,Ward 1,0110,E,24 Neptune Rd,2128.0,Address,101013.0,42.3594,-71.0587,Citizens Connect App,"(0, 0)",-7910218.300431989,5214968.784796895,-7910218.300431989,5214968.784796895
300835,101000328032,09/12/2011 11:39:30 AM,09/13/2011 11:39:28 AM,09/13/2011 12:28:29 PM,OVERDUE,Closed,Case Closed Case Resolved Tree debris was removed from a City of Boston Street tree was removed from front yard.,Tree Emergencies,Parks & Recreation Department,Trees,Tree Emergencies,PARK_Tree Emergencies,PARK,,,361 Vermont St  West Roxbury  MA  02132,12.0,06,6.0,E5,West Roxbury,12.0,Ward 20,2017,R1,361 Vermont St,2132.0,Address,140037.0,42.2849,-71.1694,Constituent Call,"(42.2849, -71.1694)",-7922541.3680628035,5203752.081419269,-7922541.3680628035,5203752.081419269
589101,101001879284,08/09/2016 04:10:00 PM,08/25/2016 04:10:15 PM,,,Open,,Abandoned Vehicles,Transportation - Traffic Division,Enforcement & Abandoned Vehicles,Abandoned Vehicles,BTDT_AVRS Interface Queue,BTDT,,,86 Dabney St  Roxbury  MA  02119,9.0,10B,7.0,B2,Roxbury,13.0,12,1201,,86 Dabney St,2119.0,Address,355949.0,42.3241,-71.0841,Constituent Call,"(42.3241, -71.0841)",-7913045.815498139,5209652.368991437,-7913045.815498139,5209652.368991437
321176,101001872428,08/01/2016 09:14:00 AM,,08/03/2016 04:31:33 PM,ONTIME,Closed,Case Closed. Closed date : 2016-08-03 16:31:33.857 Bulk Item Automation,Schedule a Bulk Item Pickup,Public Works Department,Sanitation,Schedule a Bulk Item Pickup,PWDx_Schedule a Bulk Item Pickup,PWDx,,,27 Harvard Sq  Charlestown  MA  02129,3.0,1A,1.0,A15,Charlestown,2.0,Ward 2,0201,R1,27 Harvard Sq,2129.0,Address,70437.0,42.3728,-71.0624,Constituent Call,"(42.3728, -71.0624)",-7910630.182547923,5216987.696294005,-7910630.182547923,5216987.696294005
125229,101001340551,03/24/2015 11:01:59 AM,04/14/2015 11:01:59 AM,04/14/2015 01:20:46 PM,OVERDUE,Closed,Case Closed Case Resolved broken cart swapped new cart #07144204076 04/13/2015,Request for Recycling Cart,Public Works Department,Recycling,Request for Recycling Cart,PWDx_Recycling,PWDx,,,35-41 Wilbert Rd  Dorchester  MA  02124,8.0,07,4.0,B3,Greater Mattapan,9.0,Ward 14,1409,A,35-41 Wilbert Rd,2124.0,Address,149651.0,42.2946,-71.0907,Constituent Call,"(42.2946, -71.0907)",-7913780.524137373,5205211.75955386,-7913780.524137373,5205211.75955386
519582,101000750151,02/08/2013 06:26:00 PM,02/13/2013 08:30:00 AM,02/09/2013 10:05:23 AM,ONTIME,Closed,Case Closed Case Resolved,Request for Snow Plowing,Public Works Department,Street Cleaning,Request for Snow Plowing,PWDx_District 09: East Boston,PWDx,,,8 Montmorenci Ave  East Boston  MA  02128,1.0,09,1.0,A7,East Boston,1.0,Ward 1,0114,R1,8 Montmorenci Ave,2128.0,Address,96750.0,42.3917,-71.0094,Constituent Call,"(42.3917, -71.0094)",-7904730.249535881,5219835.997860036,-7904730.249535881,5219835.997860036
801974,101000816276,04/03/2013 12:56:17 PM,,04/09/2013 09:45:36 PM,ONTIME,Closed,Case Closed Bulk Item Automation,Schedule a Bulk Item Pickup,Public Works Department,Sanitation,Schedule a Bulk Item Pickup,PWDx_Schedule a Bulk Item Pickup,PWDx,,,320 Park St  West Roxbury  MA  02132,12.0,06,6.0,E5,West Roxbury,12.0,Ward 20,2011,R1,320 Park St,2132.0,Address,107526.0,42.2801,-71.1472,Constituent Call,"(42.2801, -71.1472)",-7920070.075367193,5203029.849589358,-7920070.075367193,5203029.849589358
388928,101000347432,10/26/2011 03:52:13 PM,12/10/2011 03:52:12 PM,12/13/2011 11:47:23 AM,OVERDUE,Closed,Case Closed Case Resolved,New Sign  Crosswalk or Pavement Marking,Transportation - Traffic Division,Signs & Signals,New Sign  Crosswalk or Pavement Marking,BTDT_Sign Shop_Sign Installation,BTDT,,,700 Boylston St  Boston  MA  02116,4.0,1C,2.0,D4,Boston,6.0,04,0402,E,700 Boylston St,2116.0,Address,156199.0,42.3492,-71.0787,Constituent Call,"(42.3492, -71.0787)",-7912444.690247853,5213432.289995516,-7912444.690247853,5213432.289995516
345625,101001229505,12/07/2014 10:12:12 PM,12/10/2014 08:30:00 AM,12/12/2014 08:57:31 AM,OVERDUE,Closed,Case Closed Case Resolved,Request for Pothole Repair,Public Works Department,Highway Maintenance,Request for Pothole Repair,PWDx_District 1C: Downtown,PWDx,https://mayors24.cityofboston.gov/media/boston/report/photos/548516fc0485bc31fdc738b2/photo_20141207_221016.jpg,https://cityworker.cityofboston.gov:8443/attachments/report/54851718d052445c7ab06fc8/closed_photo/Report.jpg,INTERSECTION of Bowdoin St & New Chardon St  Boston  MA,3.0,1B,1.0,A1,Beacon Hill,3.0,Ward 3,0306,,INTERSECTION Bowdoin St & New Chardon St,,Intersection,1719.0,42.3612,-71.0629,Citizens Connect App,"(42.3612, -71.0629)",-7910685.84229332,5215239.956827463,-7910685.84229332,5215239.956827463
811283,101001858588,07/14/2016 10:09:01 AM,08/04/2016 10:09:01 AM,08/30/2016 09:14:16 AM,OVERDUE,Closed,Case Closed. Closed date : 2016-08-30 09:14:16.28 Case Resolved New cart was dropped off 516#57478,Request for Recycling Cart,Public Works Department,Recycling,Request for Recycling Cart,PWDx_IPL Damaged Cart Replacement,PWDx,https://cityworker.cityofboston.gov:8443/attachments/report/57879cfed052171b9cfc2aad/photo/Report.jpg,,84 Emerson St  South Boston  MA  02127,6.0,05,2.0,C6,South Boston / South Boston Waterfront,5.0,Ward 6,0605,R3,84 Emerson St,2127.0,Address,53676.0,42.3361,-71.0413,City Worker App,"(42.3361, -71.0413)",-7908281.341292187,5211459.314316983,-7908281.341292187,5211459.314316983
461472,101001638195,11/18/2015 06:18:00 PM,12/04/2015 08:30:00 AM,12/17/2015 10:27:05 AM,OVERDUE,Closed,Case Closed. Closed date : 2015-12-17 10:27:05.38 Case Resolved was repaired 12/7/15,contractor light/sent,Public Works Department,Street Lights,Street Light Outages,PWDx_Street Light_Pending_Contractor (Internal),PWDx,https://mayors24.cityofboston.gov/media/boston/report/photos/564d075355a5723671ee1e05/report.jpg,,337 Commonwealth Ave  Boston  MA  02115,4.0,1C,8.0,D4,Back Bay,14.0,Ward 5,0509,CM,337 Commonwealth Ave,2115.0,Address,40256.0,42.3498,-71.0877,Citizens Connect App,"(42.3498, -71.0877)",-7913446.565664993,5213522.66514022,-7913446.565664993,5213522.66514022
729014,101001331880,03/13/2015 06:48:25 AM,03/02/2017 06:48:25 AM,03/26/2015 08:56:16 AM,ONTIME,Closed,Case Closed ADCLSD: Administratively Closed,Working Beyond Hours,Inspectional Services,Building,Working Beyond Hours,ISD_Building (INTERNAL),ISD,,,1486 Tremont St  Mission Hill  MA  02120,9.0,10A,8.0,B2,Mission Hill,14.0,Ward 10,1002,I,1486 Tremont St,2120.0,Address,136853.0,42.3318,-71.0988,Constituent Call,"(42.3318, -71.0988)",-7914682.212012798,5210811.78594304,-7914682.212012798,5210811.78594304
701974,101001579650,09/15/2015 08:14:38 PM,09/17/2015 08:30:00 AM,09/16/2015 06:03:10 AM,ONTIME,Closed,Case Closed. Closed date : 2015-09-16 06:03:10.597 Case Noted material serviced,Missed Trash: District 1C,Public Works Department,Sanitation,Missed Trash/Recycling/Yard Waste/Bulk Item,PWDx_Missed Trash\Recycling\Yard Waste\Bulk Item,PWDx,,https://cityworker.cityofboston.gov:8443/attachments/report/55f8b4b4d05253c83031383e/closed_photo/Report.jpg,95 Waltham St  Roxbury  MA  02118,4.0,1C,2.0,D4,South End,4.0,Ward 3,0307,A,95 Waltham St,2118.0,Address,328051.0,42.3437,-71.0709,Self Service,"(42.3437, -71.0709)",-7911576.3982196655,5212603.891362616,-7911576.3982196655,5212603.891362616
61778,101001836797,06/16/2016 05:37:00 AM,06/17/2016 08:30:00 AM,06/16/2016 08:47:19 AM,ONTIME,Closed,Case Closed. Closed date : 2016-06-16 08:47:19.69 Duplicate of Existing Case duplicate of case #101001836848,Requests for Street Cleaning,Public Works Department,Street Cleaning,Requests for Street Cleaning,PWDx_District 03: North Dorchester,PWDx,,,INTERSECTION of Bellevue St & Columbia Rd  Dorchester  MA,7.0,03,3.0,B2,Dorchester,8.0,15,1501,,INTERSECTION Bellevue St & Columbia Rd,,Intersection,14868.0,42.3594,-71.0587,Constituent Call,"(0, 0)",-7910218.300431989,5214968.784796895,-7910218.300431989,5214968.784796895
864018,101000877288,07/11/2013 10:03:59 AM,11/08/2013 10:03:59 AM,,OVERDUE,Open,,Sewage/Septic Back-Up,Inspectional Services,Housing,Sewage/Septic Back-Up,ISD_Housing (INTERNAL),ISD,,,15 E Springfield St  Roxbury  MA  02118,4.0,1C,2.0,D4,South End,6.0,Ward 8,0802,CD,15 E Springfield St,2118.0,Address,129779.0,42.3364,-71.0759,Self Service,"(42.3364, -71.0759)",-7912132.995673633,5211504.492367354,-7912132.995673633,5211504.492367354
363885,101001330795,03/12/2015 07:40:56 AM,03/16/2015 08:30:00 AM,04/13/2015 05:24:58 PM,OVERDUE,Closed,Case Closed Case Noted Thank you for your request. This service request is now considered closed due to the recent arrival of Spring. The City worked around the clock this winter to address the record-breaking snowfall and we hope that many of your concerns were resolved. We encourage you to let us know of any additional issues and thank you for working with us to make the City a better place. Thank you for your patience and we apologize for any requests that we were not able to get to.,Request for Snow Plowing,Public Works Department,Street Cleaning,Request for Snow Plowing,PWDx_District 1C: Downtown,PWDx,,,84 Appleton St  Boston  MA  02116,4.0,1C,2.0,D4,South End,6.0,Ward 4,0401,CM,84 Appleton St,2116.0,Address,4139.0,42.3454,-71.0733,Constituent Call,"(42.3454, -71.0733)",-7911843.564997571,5212859.934110519,-7911843.564997571,5212859.934110519
400481,101000890910,07/31/2013 09:03:00 AM,,08/01/2013 09:54:17 PM,ONTIME,Closed,Case Closed Bulk Item Automation,Schedule a Bulk Item Pickup,Public Works Department,Sanitation,Schedule a Bulk Item Pickup,PWDx_Schedule a Bulk Item Pickup,PWDx,,,18 Holborn St  Dorchester  MA  02121,9.0,10B,7.0,B2,Roxbury,13.0,Ward 12,1206,R2,18 Holborn St,2121.0,Address,74458.0,42.3151,-71.0818,Constituent Call,"(42.3151, -71.0818)",-7912789.780669313,5208297.386163945,-7912789.780669313,5208297.386163945
551407,101001416425,06/24/2015 10:54:00 AM,07/08/2015 10:54:30 AM,06/29/2015 11:50:43 AM,ONTIME,Closed,Case Closed. Closed date : 2015-06-29 11:50:43.14 Case Resolved Work completed 6/29/15.,Sign Repair,Transportation - Traffic Division,Signs & Signals,Sign Repair,BTDT_Sign Shop_Sign Installation,BTDT,https://mayors24.cityofboston.gov/media/boston/report/photos/558ac49d696360475f9f6dbf/report.jpg,,INTERSECTION of Harrison Ave Ext & Hayward Pl  Boston  MA,3.0,1C,2.0,A1,Downtown / Financial District,4.0,Ward 3,0308,,INTERSECTION Harrison Ave Ext & Hayward Pl,,Intersection,5712.0,42.3531,-71.0614,Citizens Connect App,"(42.3531, -71.0614)",-7910518.863057131,5214019.7438570745,-7910518.863057131,5214019.7438570745
619647,101001092190,05/19/2014 08:14:12 AM,05/08/2016 08:14:12 AM,08/12/2014 09:03:46 AM,ONTIME,Closed,Case Closed Case Resolved The New Tree was planted by Leahy Landscaping in the Spring of 2014 and is under Warranty until the Spring of 2016.,New Tree Requests,Parks & Recreation Department,Trees,New Tree Requests,PARK_New Tree Requests,PARK,,,362 Sumner St  East Boston  MA  02128,1.0,09,1.0,A7,East Boston,1.0,Ward 1,0101,R1,362 Sumner St,2128.0,Address,132424.0,42.3669,-71.0348,Self Service,"(42.3669, -71.0348)",-7907557.76460203,5216098.719511931,-7907557.76460203,5216098.719511931
836571,101001948918,11/09/2016 04:22:36 PM,11/10/2016 04:22:36 PM,11/09/2016 11:47:50 PM,ONTIME,Closed,Case Closed. Closed date : 2016-11-09 23:47:50.477 Case Resolved vehicle tagged,Parking Enforcement,Transportation - Traffic Division,Enforcement & Abandoned Vehicles,Parking Enforcement,BTDT_Parking Enforcement,BTDT,https://mayors24.cityofboston.gov/media/boston/report/photos/582393970485a54f848b3722/report.jpg,,693 Washington St  Brighton  MA  02135,11.0,04,9.0,D14,Allston / Brighton,15.0,Ward 22,2213,R2,693 Washington St,2135.0,Address,143678.0,42.3525,-71.1718,Citizens Connect App,"(42.3525, -71.1718)",-7922808.534840709,5213929.363967346,-7922808.534840709,5213929.363967346
694005,101001968790,12/12/2016 11:45:00 AM,,12/14/2016 04:31:31 PM,ONTIME,Closed,Case Closed. Closed date : 2016-12-14 16:31:31.017 Bulk Item Automation,Schedule a Bulk Item Pickup,Public Works Department,Sanitation,Schedule a Bulk Item Pickup,PWDx_Schedule a Bulk Item Pickup,PWDx,,,114 Fletcher St  Roslindale  MA  02132,9.0,06,6.0,E5,West Roxbury,12.0,Ward 20,2006,R2,114 Fletcher St,2132.0,Address,58713.0,42.2913,-71.14,Employee Generated,"(42.2913, -71.14)",-7919268.575033482,5204715.142795119,-7919268.575033482,5204715.142795119
241135,101001407286,06/11/2015 09:26:47 AM,06/12/2015 09:26:47 AM,06/11/2015 12:50:31 PM,ONTIME,Closed,Case Closed. Closed date : 2015-06-11 12:50:31.077 Case Resolved picked up,Requests for Street Cleaning,Public Works Department,Street Cleaning,Requests for Street Cleaning,PWDx_District 08: Hyde Park,PWDx,https://cityworker.cityofboston.gov:8443/attachments/report/55798ca9d052b8577926e3e7/photo/Report.jpg,,35 Chittick Rd  Hyde Park  MA  02136,12.0,08,5.0,E18,Hyde Park,10.0,Ward 18,1818,R1,35 Chittick Rd,2136.0,Address,32585.0,42.2473,-71.1234,City Worker App,"(42.2473, -71.1234)",-7917420.671486313,5198096.070475885,-7917420.671486313,5198096.070475885
754215,101001297750,02/16/2015 11:01:22 AM,02/19/2015 08:30:00 AM,02/24/2015 01:03:12 PM,OVERDUE,Closed,Case Closed Case Resolved plowed,Request for Snow Plowing,Public Works Department,Street Cleaning,Request for Snow Plowing,PWDx_District 03: North Dorchester,PWDx,,,8 Kevin Rd  Dorchester  MA  02125,7.0,03,3.0,C11,Dorchester,7.0,Ward 13,1306,R3,8 Kevin Rd,2125.0,Address,81504.0,42.3167,-71.0616,Constituent Call,"(42.3167, -71.0616)",-7910541.126955288,5208538.257836288,-7910541.126955288,5208538.257836288
320756,101000482225,09/20/2012 03:03:30 PM,03/19/2014 03:03:29 PM,09/20/2012 03:05:56 PM,ONTIME,Closed,Case Closed Case Resolved  The tree was pruned by Northern Tree Service  to the City of Boston tree pruning specifications.,Tree Maintenance Requests,Parks & Recreation Department,Trees,Tree Maintenance Requests,PARK_Tree Maintenance Request,PARK,,,1618-1634 Blue Hill Ave  Mattapan  MA  02126,8.0,07,4.0,B3,Greater Mattapan,9.0,Ward 18,1804,C,1618-1634 Blue Hill Ave,2126.0,Address,16338.0,42.2688,-71.0933,Employee Generated,"(42.2688, -71.0933)",-7914069.954813436,5201329.812673644,-7914069.954813436,5201329.812673644
503760,101001879644,08/10/2016 08:57:18 AM,08/11/2016 08:57:18 AM,08/10/2016 09:23:10 AM,ONTIME,Closed,Case Closed. Closed date : 2016-08-10 09:23:10.29 Case Resolved area cleaned,Requests for Street Cleaning,Public Works Department,Street Cleaning,Requests for Street Cleaning,PWDx_District 03: North Dorchester,PWDx,https://mayors24.cityofboston.gov/media/boston/report/photos/57ab24a769639ebaf872253e/report.jpg,https://cityworker.cityofboston.gov:8443/attachments/report/57ab24f070b477fe9e391e21/closed_photo/Report.jpg,36 Church St  Dorchester  MA  02122,7.0,03,3.0,C11,Dorchester,8.0,Ward 15,1504,R3,36 Church St,2122.0,Address,32688.0,42.3089,-71.0619,Citizens Connect App,"(42.3089, -71.0619)",-7910574.522802527,5207364.066269572,-7910574.522802527,5207364.066269572
334931,101001126762,07/11/2014 11:32:41 AM,08/10/2014 11:32:41 AM,08/04/2014 03:51:12 PM,ONTIME,Closed,Case Closed CLOSED: Closed/No Permit,Pigeon Infestation,Inspectional Services,Environmental Services,Pigeon Infestation,ISD_Environmental Services (INTERNAL),ISD,,,49 Wentworth St  Dorchester  MA  02124,8.0,07,4.0,B3,Dorchester,9.0,Ward 17,1708,R3,49 Wentworth St,2124.0,Address,147831.0,42.2869,-71.0753,Constituent Call,"(42.2869, -71.0753)",-7912066.203979157,5204053.027588756,-7912066.203979157,5204053.027588756
764087,101001197053,10/15/2014 01:42:20 PM,10/17/2014 01:42:20 PM,10/16/2014 11:41:49 AM,ONTIME,Closed,Case Closed Case Resolved picked up,Missed Leaf or Yard Trash: District 09,Public Works Department,Sanitation,Missed Trash/Recycling/Yard Waste/Bulk Item,PWDx_Missed Trash\Recycling\Yard Waste\Bulk Item,PWDx,,https://cityworker.cityofboston.gov:8443/attachments/report/543eb206d052f360b307317d/closed_photo/Report.jpg,315 Paris St  East Boston  MA  02128,1.0,09,1.0,A7,East Boston,1.0,Ward 1,0105,R2,315 Paris St,2128.0,Address,106562.0,42.376999999999995,-71.032,Constituent Call,"(42.377, -71.032)",-7907246.070027809,5217620.578107553,-7907246.070027809,5217620.578107553
63807,101000499531,10/30/2012 05:41:48 AM,10/31/2012 05:41:47 AM,10/31/2012 07:45:00 AM,OVERDUE,Closed,Case Closed Case Resolved,Traffic Signal Repair,Transportation - Traffic Division,Signs & Signals,Traffic Signal Repair,BTDT_Traffic Signal_Repair,BTDT,,,INTERSECTION of Arlington St & Beacon St  Boston  MA,4.0,1C,8.0,D4,Back Bay,14.0,Ward 5,0505,,INTERSECTION Arlington St & Beacon St,,Intersection,575.0,42.3554,-71.0726,Constituent Call,"(42.3554, -71.0726)",-7911765.641354014,5214366.208094318,-7911765.641354014,5214366.208094318
263612,101000446597,07/08/2012 07:00:50 PM,07/12/2012 08:30:00 AM,07/17/2012 09:50:01 AM,OVERDUE,Closed,Case Closed VIOISS: Violation Filed,Overflowing or Un-kept Dumpster,Inspectional Services,Environmental Services,Overflowing or Un-kept Dumpster,ISD_Environmental Services (INTERNAL),ISD,,,524 Cambridge St  Allston  MA  02134,11.0,04,9.0,D14,Allston / Brighton,15.0,Ward 21,2106,A,524 Cambridge St,2134.0,Address,200936.0,42.3529,-71.1388,Constituent Call,"(42.3529, -71.1388)",-7919134.99164453,5213989.617131298,-7919134.99164453,5213989.617131298
742328,101000450544,07/16/2012 03:35:48 PM,07/30/2012 03:35:48 PM,07/17/2012 01:38:39 PM,ONTIME,Closed,Case Closed Case Resolved,Street Light Outages,Public Works Department,Street Lights,Street Light Outages,BTDT_Traffic Signal_Repair,BTDT,,,INTERSECTION of Congress St & E Service Rd  Boston  MA,6.0,05,2.0,C6,South Boston / South Boston Waterfront,5.0,Ward 6,0601,,INTERSECTION Congress St & E Service Rd,,Intersection,3446.0,42.3488,-71.0459,Citizens Connect App,"(42.3488, -71.0459)",-7908793.410949836,5213372.040378293,-7908793.410949836,5213372.040378293
103388,101001209434,11/01/2014 10:10:44 PM,11/05/2014 08:30:00 AM,11/01/2014 10:10:58 PM,ONTIME,Closed,Case Closed Case Resolved Marked completed at case creation,Requests for Street Cleaning,Public Works Department,Street Cleaning,Requests for Street Cleaning,PWDx_District 1B: North End,PWDx,https://cityworker.cityofboston.gov:8443/attachments/report/5455929fd052f1b1cd5cb23f/photo/Report.jpg,,INTERSECTION of North St & Murphy Ct  Boston  MA,3.0,1B,1.0,A1,Downtown / Financial District,3.0,Ward 3,0301,,INTERSECTION North St & Murphy Ct,,Intersection,7625.0,42.3655,-71.0517,City Worker App,"(42.3655, -71.0517)",-7909439.063996435,5215887.788125495,-7909439.063996435,5215887.788125495
708275,101000360663,12/05/2011 04:20:42 PM,,12/13/2011 09:29:48 AM,ONTIME,Closed,Case Closed Bulk Item Automation,Schedule a Bulk Item Pickup,Public Works Department,Sanitation,Schedule a Bulk Item Pickup,PWDx_Schedule a Bulk Item Pickup,PWDx,,,17 Hunnewell Ave  Brighton  MA  02135,11.0,04,9.0,D14,Allston / Brighton,15.0,Ward 22,2213,R2,17 Hunnewell Ave,2135.0,Address,76099.0,42.3523,-71.1695,Constituent Call,"(42.3523, -71.1695)",-7922552.500011883,5213899.237529169,-7922552.500011883,5213899.237529169
480441,101000485481,09/27/2012 06:35:27 PM,10/27/2012 06:35:26 PM,10/09/2012 11:32:00 AM,ONTIME,Closed,Case Closed VIOISS: Violation Filed,Rodent Activity,Inspectional Services,Environmental Services,Rodent Activity,ISD_Environmental Services (INTERNAL),ISD,,,104 Marlborough St  Boston  MA  02116,4.0,1C,8.0,D4,Back Bay,14.0,Ward 5,0507,CD,104 Marlborough St,2116.0,Address,90305.0,42.3532,-71.0767,Self Service,"(42.3532, -71.0767)",-7912222.051266267,5214034.8072559135,-7912222.051266267,5214034.8072559135
190446,101000898860,08/11/2013 03:38:25 AM,,08/16/2013 09:47:51 PM,ONTIME,Closed,Case Closed Bulk Item Automation,Schedule Bulk Item Pickup,Public Works Department,Sanitation,Schedule a Bulk Item Pickup SS,PWDx_Schedule a Bulk Item Pickup,PWDx,,,25 Westmoor Rd  West Roxbury  MA  02132,12.0,06,6.0,E5,West Roxbury,10.0,Ward 20,2003,R1,25 Westmoor Rd,2132.0,Address,148652.0,42.2636,-71.1515,Self Service,"(42.2636, -71.1515)",-7920548.749177605,5200547.597189968,-7920548.749177605,5200547.597189968
