,CASE_ENQUIRY_ID,OPEN_DT,TARGET_DT,CLOSED_DT,OnTime_Status,CASE_STATUS,CLOSURE_REASON,CASE_TITLE,SUBJECT,REASON,TYPE,QUEUE,Department,SubmittedPhoto,ClosedPhoto,Location,fire_district,pwd_district,city_council_district,police_district,neighborhood,neighborhood_services_district,ward,precinct,land_usage,LOCATION_STREET_NAME,LOCATION_ZIPCODE,Property_Type,Property_ID,LATITUDE,LONGITUDE,Source,Geocoded_Location,lon_wm,lat_wm
87896,101001728973,03/03/2016 08:16:00 AM,03/10/2016 08:30:00 AM,03/09/2016 12:45:28 PM,ONTIME,Closed,Case Closed. Closed date : 2016-03-09 12:45:28.59 Case Noted No broken cart at location left new cart with constituent at 86 gallivan Blvd. Cart 515#0060068 delivered on 3/9/16.,Recycling Cart Return,Public Works Department,Recycling,Recycling Cart Return,PWDx_IPL Damaged Cart Replacement,PWDx,,,86 Gallivan Blvd  Dorchester  MA  02124,8.0,07,4.0,B3,Dorchester,7.0,Ward 17,1704,R2,86 Gallivan Blvd,2124.0,Address,382533.0,42.2784,-71.0745,Constituent Call,"(42.2784, -71.0745)",-7911977.148386522,5202774.072342986
257882,101000860215,06/14/2013 06:04:27 PM,06/19/2013 08:30:00 AM,06/17/2013 06:10:04 AM,ONTIME,Closed,Case Closed Case Resolved ASSIGNED TO CIU,Utility Call-In,Public Works Department,Highway Maintenance,Utility Call-In,PWDx_Utility Call-In,PWDx,,,21 Elder St  Dorchester  MA  02125,7.0,03,7.0,B2,Dorchester,13.0,Ward 7,0710,R1,21 Elder St,2125.0,Address,52587.0,42.3206,-71.0634,Constituent Call,"(42.3206, -71.0634)",-7910741.502038717,5209125.40819576
413365,101000953226,10/24/2013 10:18:17 AM,,10/29/2013 03:44:13 PM,ONTIME,Closed,Case Closed Survey Completed.,Metrolist Survey,Civil Rights,Survey,Metrolist Survey,HS_OCR Metrolist Survey,HS_O,,,,,,,,,,,,,,,,,42.3594,-71.0587,Employee Generated,"(0, 0)",-7910218.300431989,5214968.784796895
554780,101001177327,09/20/2014 02:23:17 PM,09/24/2014 08:30:00 AM,09/22/2014 08:31:42 AM,ONTIME,Closed,Case Closed Duplicate of Existing Case,Requests for Street Cleaning,Public Works Department,Street Cleaning,Requests for Street Cleaning,PWDx_Request for Street Cleaning,PWDx,https://mayors24.cityofboston.gov/media/boston/report/photos/541dc5d469639c44bc48f163/report.jpg,,132 Glenville Ave  Allston  MA  02134,11.0,04,9.0,D14,Allston / Brighton,15.0,Ward 21,2107,R3,132 Glenville Ave,2134.0,Address,241792.0,42.3491,-71.1372,Citizens Connect App,"(42.3491, -71.1372)",-7918956.880459262,5213417.227555266
512875,101001622190,10/28/2015 08:29:16 AM,,10/29/2015 04:35:32 PM,ONTIME,Closed,Case Closed. Closed date : 2015-10-29 16:35:32.257 Bulk Item Automation,Schedule Bulk Item Pickup,Public Works Department,Sanitation,Schedule a Bulk Item Pickup SS,PWDx_Schedule a Bulk Item Pickup,PWDx,,,45 Paine St  Roslindale  MA  02131,12.0,02,5.0,E18,Roslindale,10.0,Ward 18,1807,R1,45 Paine St,2131.0,Address,106367.0,42.2858,-71.1073,Self Service,"(42.2858, -71.1073)",-7915628.427684542,5203887.506013222
230810,101000426753,05/24/2012 08:30:33 AM,07/26/2012 08:30:33 AM,05/25/2012 09:35:06 AM,ONTIME,Closed,Case Closed Case Resolved graffitti removed 05/25/12,Graffiti Removal - paint control cabinet - Dist 10A,Property Management,Graffiti,Graffiti Removal,PWDx_District 10A: Roxbury,PWDx,,,INTERSECTION of Charlesgate East & Newbury St  Boston  MA,4.0,10A,8.0,D4,Fenway / Kenmore / Audubon Circle / Longwood,14.0,Ward 5,0510,,INTERSECTION Charlesgate East & Newbury St,,Intersection,2818.0,42.348,-71.0916,Citizens Connect App,"(42.348, -71.0916)",-7913880.711679087,5213251.542294016
444153,101001109740,06/16/2014 04:29:21 PM,06/17/2014 04:29:21 PM,06/16/2014 08:00:52 PM,ONTIME,Closed,Case Closed Case Resolved picked up,Pick up Dead Animal,Public Works Department,Street Cleaning,Pick up Dead Animal,PWDx_District 03: North Dorchester,PWDx,,,7 Topliff St  Dorchester  MA  02122,7.0,03,4.0,C11,Dorchester,8.0,Ward 15,1502,R3,7 Topliff St,2122.0,Address,136251.0,42.3044,-71.0688,Constituent Call,"(42.3044, -71.0688)",-7911342.627289,5206686.7142415885
698196,101000389613,02/29/2012 02:56:35 PM,,,ONTIME,Open,,Other: Complaint,Mayor's 24 Hour Hotline,Employee & General Comments,General Comments For An Employee,INFO_General Comments Complaints Compliments,INFO,,,5300 Washington St  West Roxbury  MA  02132,12.0,06,6.0,E5,West Roxbury,12.0,Ward 20,2015,E,5300 Washington St,2132.0,Address,145709.0,42.2583,-71.1599,Constituent Call,"(42.2583, -71.1599)",-7921483.832900268,5199750.405485941
433928,101001426002,07/09/2015 10:42:30 AM,07/10/2015 10:42:30 AM,07/09/2015 10:42:32 AM,ONTIME,Closed,Case Closed. Closed date : 2015-07-09 10:42:32.777 Case Resolved Marked completed at case creation,Requests for Street Cleaning,Public Works Department,Street Cleaning,Requests for Street Cleaning,PWDx_District 1B: North End,PWDx,https://cityworker.cityofboston.gov:8443/attachments/report/559e887ad052d9589a752664/photo/Report.jpg,,1 City Hall Plz  Boston  MA  02108,3.0,1B,1.0,A1,Downtown / Financial District,3.0,Ward 3,0306,E,1 City Hall Plz,2108.0,Address,340817.0,42.3594,-71.0587,City Worker App,"(0, 0)",-7910218.300431989,5214968.784796895
853837,101001662156,12/09/2015 11:12:31 PM,12/11/2015 08:30:00 AM,12/09/2015 11:31:57 PM,ONTIME,Closed,Case Closed. Closed date : 2015-12-09 23:31:57.56 Case Resolved tagged,Parking Enforcement,Transportation - Traffic Division,Enforcement & Abandoned Vehicles,Parking Enforcement,BTDT_Parking Enforcement,BTDT,https://mayors24.cityofboston.gov/media/boston/report/photos/5668fba80485da356a9096f7/report.jpg,,INTERSECTION of I St & E Third St  South Boston  MA,6.0,05,2.0,C6,South Boston / South Boston Waterfront,5.0,Ward 6,0605,,INTERSECTION I St & E Third St,,Intersection,6480.0,42.3364,-71.04,Citizens Connect App,"(42.3364, -71.04)",-7908136.625954155,5211504.492367354
181845,101001604865,10/05/2015 10:21:00 AM,,11/23/2015 06:42:14 AM,ONTIME,Closed,Case Closed. Closed date : 2015-11-23 06:42:14.773 Case Resolved No such sigage at location - Field verified,Transportation General Request,Transportation - Traffic Division,Administrative & General Requests,Transportation General Request,BTDT_District 01,BTDT,,,62 Washington St  Brighton  MA  02135,11.0,04,9.0,D14,Allston / Brighton,15.0,Ward 21,2112,C,62 Washington St,2135.0,Address,156364.0,42.3433,-71.1424,Constituent Call,"(42.3433, -71.1424)",-7919535.741811385,5212543.647016329
174331,101001162406,09/02/2014 02:08:13 PM,03/01/2015 02:08:13 PM,09/02/2014 02:10:28 PM,ONTIME,Closed,Case Closed Case Resolved POLE INSTALLED AND SET FOR O/H,Knockdown Replacement,Public Works Department,Street Lights,Knockdown Replacement,PWDx_Street Light Knockdown Replacement,PWDx,,,INTERSECTION of Cambridge St & Seattle St  Allston  MA,11.0,04,9.0,D14,Allston / Brighton,15.0,Ward 22,2201,,INTERSECTION Cambridge St & Seattle St,,Intersection,2357.0,42.3587,-71.1239,Maximo Integration,"(42.3587, -71.1239)",-7917476.3312317105,5214863.331105071
862671,101000395834,03/16/2012 08:09:52 AM,03/30/2012 08:09:52 AM,,OVERDUE,Open,,Other: Complaint,Mayor's 24 Hour Hotline,Employee & General Comments,General Comments For a Program or Policy,INFO_General Comments Complaints Compliments,INFO,,,,,,,,,,,,,,,,,42.3594,-71.0587,Constituent Call,"(0, 0)",-7910218.300431989,5214968.784796895
256388,101000374677,01/17/2012 10:25:39 AM,,01/17/2012 10:25:39 AM,ONTIME,Closed,Case Closed Internal Case Performed by Highway Maintenance crew.,Pothole Repair (Internal),Public Works Department,Highway Maintenance,Pothole Repair (Internal),PWDx_District 04: Allston/Brighton,PWDx,,,187 Kenrick St  Brighton  MA  02135,11.0,04,9.0,D14,Allston / Brighton,15.0,Ward 22,2204,R1,187 Kenrick St,2135.0,Address,81330.0,42.3469,-71.171,Employee Generated,"(42.3469, -71.171)",-7922719.479248074,5213085.859932039
526042,101001694315,01/15/2016 10:50:35 AM,01/19/2016 10:50:35 AM,01/15/2016 10:54:10 AM,ONTIME,Closed,Case Closed. Closed date : 2016-01-15 10:54:10.64 Case Resolved,Requests for Street Cleaning,Public Works Department,Street Cleaning,Requests for Street Cleaning,PWDx_District 03: North Dorchester,PWDx,https://cityworker.cityofboston.gov:8443/attachments/report/5699154970b4ba291a22be77/photo/Report.jpg,https://cityworker.cityofboston.gov:8443/attachments/report/5699154970b4ba291a22be77/closed_photo/Report.jpg,INTERSECTION of Boston St & Harvest St  Dorchester  MA,6.0,03,2.0,C6,Dorchester,5.0,Ward 7,0708,,INTERSECTION Boston St & Harvest St,,Intersection,1664.0,42.3237,-71.0602,City Worker App,"(42.3237, -71.0602)",-7910385.279668178,5209592.143416831
59242,101001729857,03/04/2016 09:35:00 AM,03/09/2016 09:35:58 AM,03/07/2016 08:30:27 AM,ONTIME,Closed,Case Closed. Closed date : 2016-03-07 08:30:27.12 ROA: Refer to Other Agency/Division,Building Inspection Request,Inspectional Services,Building,Building Inspection Request,ISD_Building (INTERNAL),ISD,,,31 Lambert St  Roxbury  MA  02119,9.0,10B,7.0,B2,Roxbury,13.0,Ward 9,0905,A,31 Lambert St,2119.0,Address,375617.0,42.3281,-71.0908,Constituent Call,"(42.3281, -71.0908)",-7913791.656086452,5210254.645798727
876164,101001866041,07/23/2016 12:19:00 PM,08/08/2016 08:30:00 AM,07/27/2016 12:59:36 PM,ONTIME,Closed,Case Closed. Closed date : 2016-07-27 12:59:36.97 Case Resolved,Sign Repair,Transportation - Traffic Division,Signs & Signals,Sign Repair,BTDT_Sign Shop_Sign Installation,BTDT,https://mayors24.cityofboston.gov/media/boston/report/photos/5793990169639670c07b85de/photo_20160723_121753.jpg,,6 General William H Devine Way  South Boston  MA  02127,6.0,05,2.0,C6,South Boston / South Boston Waterfront,5.0,Ward 7,0706,C,6 General William H Devine Way,2127.0,Address,63241.0,42.3287,-71.0565,Citizens Connect App,"(42.3287, -71.0565)",-7909973.397552243,5210344.990622886
469679,101001682375,12/27/2015 07:00:18 PM,,12/31/2015 04:30:59 PM,ONTIME,Closed,Case Closed. Closed date : 2015-12-31 16:30:59.33 Bulk Item Automation,Schedule Bulk Item Pickup,Public Works Department,Sanitation,Schedule a Bulk Item Pickup SS,PWDx_Schedule a Bulk Item Pickup,PWDx,,,45 Pierce Ave  Dorchester  MA  02122,8.0,07,3.0,C11,Dorchester,7.0,Ward 16,1609,R2,45 Pierce Ave,2122.0,Address,293633.0,42.2873,-71.0523,Self Service,"(42.2873, -71.0523)",-7909505.855690912,5204113.217969172
150366,101001342917,03/26/2015 04:11:16 PM,03/27/2015 04:11:16 PM,03/31/2015 03:20:59 PM,OVERDUE,Closed,Case Closed Case Resolved,Space Savers,Public Works Department,Sanitation,Space Savers,PWDx_District 03: North Dorchester,PWDx,,,21 Mount Ida Rd  Dorchester  MA  02122,7.0,03,3.0,C11,Dorchester,8.0,Ward 15,1507,R1,21 Mount Ida Rd,2122.0,Address,98312.0,42.3065,-71.0656,Constituent Call,"(42.3065, -71.0656)",-7910986.404918462,5207002.805829218
833986,101001413075,06/19/2015 08:55:00 AM,07/19/2015 08:55:42 AM,,OVERDUE,Open,,New Sign  Crosswalk or Pavement Marking,Transportation - Traffic Division,Signs & Signals,New Sign  Crosswalk or Pavement Marking,INFO01_GenericeFormforOtherServiceRequestTypes,INFO,,,INTERSECTION of Atlantic Ave & Kneeland St  Boston  MA,4.0,1C,2.0,A1,Downtown / Financial District,4.0,Ward 3,0308,,INTERSECTION Atlantic Ave & Kneeland St,,Intersection,727.0,42.3495,-71.0571,Constituent Call,"(42.3495, -71.0571)",-7910040.18924672,5213477.477460036
886414,101000498763,10/29/2012 03:14:41 PM,,,ONTIME,Open,,Downed Wire,Mayor's 24 Hour Hotline,Programs,Downed Wire,INFO01_GenericeFormforOtherServiceRequestTypes,INFO,,,295 Kittredge St  Roslindale  MA  02131,12.0,06,5.0,E5,Roslindale,10.0,Ward 18,1810,R1,295 Kittredge St,2131.0,Address,82229.0,42.278,-71.1338,Constituent Call,"(42.278, -71.1338)",-7918578.394190562,5202713.890464305
458443,101001793982,05/19/2016 10:15:05 AM,06/10/2016 10:15:05 AM,06/07/2016 02:46:54 PM,ONTIME,Closed,Case Closed. Closed date : 2016-06-07 14:46:54.62 Case Resolved damaged cart swapped new cart #51559745 06/07/2016,Request for Recycling Cart,Public Works Department,Recycling,Request for Recycling Cart,PWDx_IPL Damaged Cart Replacement,PWDx,https://cityworker.cityofboston.gov:8443/attachments/report/573dca69d0524e36626fc227/photo/Report.jpg,,48 Walnut St  Dorchester  MA  02122,8.0,07,3.0,C11,Dorchester,7.0,Ward 16,1610,R3,48 Walnut St,2122.0,Address,379483.0,42.2867,-71.0413,City Worker App,"(42.2867, -71.0413)",-7908281.341292187,5204022.932541867
156942,101000741140,01/23/2013 01:06:56 PM,01/24/2013 01:06:56 PM,01/23/2013 02:30:24 PM,ONTIME,Closed,Case Closed Case Resolved litter basket was changed again,Empty Litter Basket,Public Works Department,Highway Maintenance,Empty Litter Basket,PWDx_District 09: East Boston,PWDx,,,INTERSECTION of Brooks St & Eutaw St  East Boston  MA,1.0,09,1.0,A7,East Boston,1.0,Ward 1,0107,,INTERSECTION Brooks St & Eutaw St,,Intersection,2103.0,42.3799,-71.0358,City Worker App,"(42.3799, -71.0358)",-7907669.084092822,5218057.592634911
48327,101000825453,04/22/2013 09:28:20 AM,,04/26/2013 09:45:23 PM,ONTIME,Closed,Case Closed Bulk Item Automation,Schedule a Bulk Item Pickup,Public Works Department,Sanitation,Schedule a Bulk Item Pickup,PWDx_Schedule a Bulk Item Pickup,PWDx,,,53 Hopedale St  Allston  MA  02134,11.0,04,9.0,D14,Allston / Brighton,15.0,Ward 22,2201,R1,53 Hopedale St,2134.0,Address,75228.0,42.3605,-71.125,Constituent Call,"(42.3605, -71.125)",-7917598.782671583,5215134.500114721
69739,101001794449,05/19/2016 04:04:43 PM,05/24/2016 04:04:43 PM,05/19/2016 05:53:27 PM,ONTIME,Closed,Case Closed. Closed date : 2016-05-19 17:53:27.033 Case Noted no violation found at this time.,Poor Conditions of Property,Public Works Department,Code Enforcement,Poor Conditions of Property,PWDx_Code Enforcement,PWDx,https://mayors24.cityofboston.gov/media/boston/report/photos/573e1c570485273029ed6d7d/photo_20160519_160140.jpg,https://cityworker.cityofboston.gov:8443/attachments/report/573e1ca2d05243d389fdc3b8/closed_photo/Report.jpg,761 Boylston St  Boston  MA  02116,4.0,1C,8.0,D4,Back Bay,14.0,Ward 5,0508,C,761 Boylston St,2116.0,Address,18393.0,42.3494,-71.0812,Citizens Connect App,"(42.3494, -71.0812)",-7912722.988974837,5213462.4149479
555849,101001435136,07/23/2015 12:26:00 PM,07/22/2016 12:26:27 PM,05/03/2016 07:44:40 AM,ONTIME,Closed,Case Closed. Closed date : 2016-05-03 07:44:40.193 Case Resolved Tree was removed by North-Eastern Tree Service. A new tree request case will be made for this location. If you have any questions please call the Park Line at 617-635-7275.,Tree Maintenance Requests,Parks & Recreation Department,Trees,Tree Maintenance Requests,PARK_Tree Maintenance Request,PARK,,,20 Cushing Ave  Dorchester  MA  02125,7.0,03,7.0,C11,Dorchester,13.0,Ward 13,1305,C,20 Cushing Ave,2125.0,Address,45145.0,42.3158,-71.0641,Constituent Call,"(42.3158, -71.0641)",-7910819.425682272,5208402.766767062
841467,101001370772,05/05/2015 03:15:09 PM,05/19/2015 03:15:09 PM,,OVERDUE,Open,,Other: Complaint,Mayor's 24 Hour Hotline,Employee & General Comments,General Comments For a Program or Policy,INFO_General Comments Complaints Compliments,INFO,,,,,,,,,,,,,,,,,42.3594,-71.0587,Constituent Call,"(0, 0)",-7910218.300431989,5214968.784796895
737326,101001729728,03/04/2016 08:38:00 AM,03/18/2016 08:38:00 AM,03/04/2016 08:39:20 AM,ONTIME,Closed,Case Closed. Closed date : 2016-03-04 08:39:20.69 Case Resolved,Sign Repair,Transportation - Traffic Division,Signs & Signals,Sign Repair,BTDT_Sign Shop_Sign Installation,BTDT,,,INTERSECTION of Freeport St & Victory Rd  Dorchester  MA,8.0,07,3.0,C11,Dorchester,7.0,16,1602,,INTERSECTION Freeport St & Victory Rd,,Intersection,17219.0,42.3594,-71.0587,Employee Generated,"(0, 0)",-7910218.300431989,5214968.784796895
457227,101001412069,06/18/2015 03:41:00 AM,07/02/2015 08:30:00 AM,06/18/2015 05:42:16 AM,ONTIME,Closed,Case Closed. Closed date : 2015-06-18 05:42:16.253 Case Resolved Repaired 1 Unit,Street Light Outages,Public Works Department,Street Lights,Street Light Outages,PWDx_Street Light Outages,PWDx,,,,,,,,,,,,,,,,,42.3594,-71.0587,Employee Generated,"(0, 0)",-7910218.300431989,5214968.784796895
671741,101001281957,02/07/2015 05:03:03 PM,02/11/2015 08:30:00 AM,02/09/2015 08:56:06 AM,ONTIME,Closed,Case Closed Case Noted  Collection will return on the next trash  we apologize for any inconvenience. Please make sure all trash and recycling is accessible. Thank you for your patience.,Missed Trash: District 03,Public Works Department,Sanitation,Missed Trash/Recycling/Yard Waste/Bulk Item,PWDx_Missed Trash\Recycling\Yard Waste\Bulk Item,PWDx,,,34 Danube St  Dorchester  MA  02125,7.0,03,7.0,B2,Roxbury,13.0,Ward 13,1301.0,A,34 Danube St,2125.0,Address,46212.0,42.3172,-71.0753,Constituent Call,"(42.3172, -71.0753)",-7912066.203979157,5208613.531489816
478594,101001581495,09/17/2015 01:52:45 PM,09/18/2015 01:52:45 PM,09/17/2015 10:20:32 PM,ONTIME,Closed,Case Closed. Closed date : 2015-09-17 22:20:32.837 Case Resolved some times during emergency work being performed it may take awhile for the detail to show up,Parking Enforcement,Transportation - Traffic Division,Enforcement & Abandoned Vehicles,Parking Enforcement,BTDT_Parking Enforcement,BTDT,,,18 Gibson St  Dorchester  MA  02122,7.0,07,3.0,C11,Dorchester,7.0,Ward 16,1601,R3,18 Gibson St,2122.0,Address,63602.0,42.2976,-71.0602,Citizens Connect App,"(42.2976, -71.0602)",-7910385.279668178,5205663.251915966
48058,101001404247,06/07/2015 11:28:00 PM,06/17/2015 08:30:00 AM,09/09/2015 02:35:48 PM,OVERDUE,Closed,Case Closed. Closed date : 2015-09-09 14:35:48.417 Case Resolved relamped light fixtures,,Parks & Recreation Department,Park Maintenance & Safety,Parks Lighting/Electrical Issues,PARK_Maintenance_Lighting Electrical,PARK,,,INTERSECTION of Washington St & Mcbride St  Jamaica Plain  MA,9.0,02,6.0,E13,Jamaica Plain,11.0,Ward 11,1108,,INTERSECTION Washington St & Mcbride St,,Intersection,6013.0,42.3055,-71.1084,Constituent Call,"(42.3055, -71.1084)",-7915750.879124414,5206852.284710587
681291,101000863361,06/19/2013 03:05:05 PM,08/21/2013 03:05:04 PM,06/24/2013 10:31:13 AM,ONTIME,Closed,Case Closed Case Resolved   This request has been completed.,Graffiti: Ward 11  1103,Property Management,Graffiti,Graffiti Removal,PROP_GRAF_GraffitiRemoval,PROP,,,32 Dennison St  Roxbury  MA  02119,9.0,10B,7.0,B2,Roxbury,13.0,Ward 11,1103,R4,32 Dennison St,2119.0,Address,47298.0,42.3179,-71.0937,Self Service,"(42.3179, -71.0937)",-7914114.4826097535,5208718.915609538
264323,101001528134,08/23/2015 09:49:27 AM,08/25/2015 08:30:00 AM,08/24/2015 07:39:18 AM,ONTIME,Closed,Case Closed. Closed date : 2015-08-24 07:39:18.363 Case Noted Trash collected on 8/24/15.,Missed Trash: District 03,Public Works Department,Sanitation,Missed Trash/Recycling/Yard Waste/Bulk Item,PWDx_Missed Trash\Recycling\Yard Waste\Bulk Item,PWDx,,,196-196A Savin Hill Ave  Dorchester  MA  02125,7.0,03,3.0,C11,Dorchester,7.0,Ward 13,1310,R2,196-196A Savin Hill Ave,2125.0,Address,123257.0,42.3088,-71.0497,Self Service,"(42.3088, -71.0497)",-7909216.42501485,5207349.013476231
794571,101000494951,10/20/2012 01:45:56 PM,,11/05/2012 11:37:31 AM,ONTIME,Closed,Case Closed Case Resolved Unable to identify officer fron info given.,BTDT: Complaint,Mayor's 24 Hour Hotline,Employee & General Comments,General Comments For An Employee,BTDT_Parking Enforcement,BTDT,,,INTERSECTION of Chauncy St & Summer St  Boston  MA,3.0,1C,2.0,A1,Downtown / Financial District,4.0,Ward 3,0308,,INTERSECTION Chauncy St & Summer St,,Intersection,2848.0,42.3546,-71.0593,Constituent Call,"(42.3546, -71.0593)",-7910285.0921264645,5214245.697356286
774148,101001871155,07/29/2016 01:36:53 PM,08/02/2016 01:36:53 PM,07/31/2016 12:55:12 PM,ONTIME,Closed,Case Closed. Closed date : 2016-07-31 12:55:12.823 Case Noted Ticket has been issued  #38,Improper Storage of Trash (Barrels),Public Works Department,Code Enforcement,Improper Storage of Trash (Barrels),PWDx_Code Enforcement,PWDx,https://mayors24.cityofboston.gov/media/boston/report/photos/579b94366963abd93b16c30d/report.jpg,,36 Hanson St  Roxbury  MA  02118,4.0,1C,2.0,D4,South End,4.0,Ward 3,0307,R3,36 Hanson St,2118.0,Address,69311.0,42.3439,-71.0708,Citizens Connect App,"(42.3439, -71.0708)",-7911565.266270587,5212634.013679493
787068,101001847133,06/28/2016 04:41:00 PM,,06/30/2016 04:32:32 PM,ONTIME,Closed,Case Closed. Closed date : 2016-06-30 16:32:32.213 Bulk Item Automation,Schedule a Bulk Item Pickup,Public Works Department,Sanitation,Schedule a Bulk Item Pickup,PWDx_Schedule a Bulk Item Pickup,PWDx,,,340 Hyde Park Ave  Roslindale  MA  02131,12.0,02,6.0,E18,Jamaica Plain,10.0,Ward 19,1912,R3,340 Hyde Park Ave,2131.0,Address,257774.0,42.2893,-71.118,Constituent Call,"(42.2893, -71.118)",-7916819.546236029,5204414.175604271
744939,101001892131,08/27/2016 10:24:31 AM,08/30/2016 08:30:00 AM,08/27/2016 10:57:18 AM,ONTIME,Closed,Case Closed. Closed date : 2016-08-27 10:57:18.657 Case Resolved area mechanically swept,Requests for Street Cleaning,Public Works Department,Street Cleaning,Requests for Street Cleaning,PWDx_District 03: North Dorchester,PWDx,,https://cityworker.cityofboston.gov:8443/attachments/report/57c1a2e7d052c054f29ee6fb/closed_photo/Report.jpg,INTERSECTION of Morse St & Ronald St  Dorchester  MA,7.0,03,4.0,C11,Roxbury,8.0,14,1404,,INTERSECTION Morse St & Ronald St,,Intersection,12019.0,42.3594,-71.0587,Citizens Connect App,"(0, 0)",-7910218.300431989,5214968.784796895
372601,101001878701,08/09/2016 08:21:02 AM,08/10/2016 08:30:00 AM,08/09/2016 08:40:58 AM,ONTIME,Closed,Case Closed. Closed date : 2016-08-09 08:40:58.917 Case Resolved Completed,CE Collection,Public Works Department,Street Cleaning,CE Collection,PWDx_District 1B: North End,PWDx,https://cityworker.cityofboston.gov:8443/attachments/report/57a9caac70b4fc1c6fbd5344/photo/Report.jpg,https://cityworker.cityofboston.gov:8443/attachments/report/57a9caac70b4fc1c6fbd5344/closed_photo/Report.jpg,1 City Hall Plz  Boston  MA  02108,3.0,1B,1.0,A1,Downtown / Financial District,3.0,03,0306,E,1 City Hall Plz,2108.0,Address,32856.0,42.3603,-71.0583,City Worker App,"(42.3603, -71.0583)",-7910173.772635671,5215104.369841154
678122,101001207935,10/30/2014 10:18:47 AM,,10/31/2014 04:39:28 PM,ONTIME,Closed,Case Closed Bulk Item Automation,Schedule a Bulk Item Pickup,Public Works Department,Sanitation,Schedule a Bulk Item Pickup,PWDx_Schedule a Bulk Item Pickup,PWDx,,,76 Easton St  Allston  MA  02134,11.0,04,9.0,D14,Allston / Brighton,15.0,Ward 22,2201,R4,76 Easton St,2134.0,Address,51011.0,42.3592,-71.1317,Constituent Call,"(42.3592, -71.1317)",-7918344.623259897,5214938.655050789
269335,101001427378,07/11/2015 01:27:00 PM,,07/14/2015 04:43:21 PM,ONTIME,Closed,Case Closed. Closed date : 2015-07-14 16:43:21.613 Bulk Item Automation,Schedule a Bulk Item Pickup,Public Works Department,Sanitation,Schedule a Bulk Item Pickup,PWDx_Schedule a Bulk Item Pickup,PWDx,,,1670 Washington St  Roxbury  MA  02118,4.0,1C,2.0,D4,South End,6.0,Ward 8,0802,CM,1670 Washington St,2118.0,Address,144315.0,42.3374,-71.0753,Constituent Call,"(42.3374, -71.0753)",-7912066.203979157,5211655.08742515
694963,101001956816,11/22/2016 08:59:07 AM,11/23/2016 08:59:06 AM,11/22/2016 10:16:43 AM,ONTIME,Closed,Case Closed. Closed date : 2016-11-22 10:16:43.973 Case Noted Posted street cleaning in the north end today,Requests for Street Cleaning,Public Works Department,Street Cleaning,Requests for Street Cleaning,PWDx_District 1B: North End,PWDx,https://mayors24.cityofboston.gov/media/boston/report/photos/58344f2604859c3a5cae7d21/report.jpg,,6A Henchman St  Boston  MA  02113,3.0,1B,1.0,A1,Downtown / Financial District,3.0,Ward 3,0302,CM,6A Henchman St,2113.0,Address,360244.0,42.3671,-71.0539,Citizens Connect App,"(42.3671, -71.0539)",-7909683.966876181,5216128.852950872
802873,101001008371,01/18/2014 09:33:45 AM,,01/22/2014 01:13:27 PM,ONTIME,Closed,Case Closed Case Noted,Notification,Mayor's 24 Hour Hotline,Notification,Notification,INFO09_Current Events,INFO,,,259 Princeton St  East Boston  MA  02128,1.0,09,1.0,A7,East Boston,1.0,Ward 1,0110,RC,259 Princeton St,2128.0,Address,296018.0,42.3796,-71.03,Constituent Call,"(42.3796, -71.03)",-7907023.431046221,5218012.383299583
283713,101001910558,09/16/2016 12:38:48 PM,09/19/2016 12:38:46 PM,09/16/2016 01:09:48 PM,ONTIME,Closed,Case Closed. Closed date : 2016-09-16 13:09:48.153 Case Resolved,Pick up Dead Animal,Public Works Department,Street Cleaning,Pick up Dead Animal,PWDx_District 1B: North End,PWDx,,https://cityworker.cityofboston.gov:8443/attachments/report/57dc205bd052a29008120317/closed_photo/Report.jpg,1 City Hall Plz  Boston  MA  02108,3.0,1B,1.0,A1,Downtown / Financial District,3.0,03,0306,E,1 City Hall Plz,2108.0,Address,32856.0,42.3603,-71.0583,Citizens Connect App,"(42.3603, -71.0583)",-7910173.772635671,5215104.369841154
285620,101001219577,11/18/2014 05:26:18 PM,,11/24/2014 03:38:40 PM,ONTIME,Closed,Case Closed Case Resolved  These restrictions are in place to allow visitors to the local retail shops and resteraunts time to do their business and enjoy the commodities of the neighborhood.,Transportation General Request,Transportation - Traffic Division,Administrative & General Requests,Transportation General Request,BTDT_Administration,BTDT,,,INTERSECTION of Cummins Hwy & River St  Mattapan  MA,8.0,08,4.0,B3,Greater Mattapan,9.0,Ward 18,1804,,INTERSECTION Cummins Hwy & River St,,Intersection,3761.0,42.2675,-71.0942,Constituent Call,"(42.2675, -71.0942)",-7914170.14235515,5201134.252753758
119236,101001042245,03/07/2014 12:31:34 AM,03/10/2014 08:30:00 AM,03/07/2014 12:32:21 AM,ONTIME,Closed,Case Closed Case Invalid,Major System Failure,Public Works Department,Street Lights,Major System Failure,PWDx_Major System Failure,PWDx,,,700 Harrison Ave  Roxbury  MA  02118,4.0,1C,2.0,D4,South End,6.0,08,0801,RC,700 Harrison Ave,2118.0,Address,172286.0,42.3383,-71.0707,Constituent Call,"(42.3383, -71.0707)",-7911554.134321508,5211790.6250247145
308849,101001695690,01/18/2016 03:37:03 PM,01/20/2016 08:30:00 AM,01/19/2016 12:05:21 AM,ONTIME,Closed,Case Closed. Closed date : 2016-01-19 00:05:21.15 Case Noted clear at this time,Parking Enforcement,Transportation - Traffic Division,Enforcement & Abandoned Vehicles,Parking Enforcement,BTDT_Parking Enforcement,BTDT,https://mayors24.cityofboston.gov/media/boston/report/photos/569d4cea0485a1797c8c5e2b/report.jpg,,27 Saranac St  Dorchester  MA  02122,8.0,07,3.0,C11,Dorchester,7.0,Ward 16,1609,R3,27 Saranac St,2122.0,Address,122348.0,42.284,-71.0541,Citizens Connect App,"(42.284, -71.0541)",-7909706.230774341,5203616.658759921
36076,101000328300,09/12/2011 06:10:54 PM,09/15/2011 08:30:00 AM,09/13/2011 06:39:22 AM,ONTIME,Closed,Case Closed Case Scheduled Items have been scheduled for pickup.,Schedule a Bulk Item Pickup,Public Works Department,Sanitation,Schedule a Bulk Item Pickup,PWDx_Schedule a Bulk Item Pickup,PWDx,,,77 Torrey St  Dorchester  MA  02124,8.0,07,4.0,B3,Dorchester,9.0,Ward 17,1708,R3,77 Torrey St,2124.0,Address,136314.0,42.2872,-71.0747,Constituent Call,"(42.2872, -71.0747)",-7911999.412284682,5204098.170338239
788593,101001220656,11/20/2014 09:55:20 AM,11/24/2014 09:55:20 AM,11/20/2014 01:15:30 PM,ONTIME,Closed,Case Closed Case Resolved backfilled. Dist 5 notified to patch,Request for Pothole Repair,Public Works Department,Highway Maintenance,Request for Pothole Repair,PWDx_Highway Construction,PWDx,,https://cityworker.cityofboston.gov:8443/attachments/report/546e00e1d052445c7aaed012/closed_photo/Report.jpg,503 E Second St  South Boston  MA  02127,6.0,05,2.0,C6,South Boston / South Boston Waterfront,5.0,Ward 6,0605,C,503 E Second St,2127.0,Address,164799.0,42.3369,-71.0433,Constituent Call,"(42.3369, -71.0433)",-7908503.980273773,5211579.789596911
413563,101001776983,04/26/2016 07:27:31 PM,04/29/2016 08:30:00 AM,04/26/2016 08:03:47 PM,ONTIME,Closed,Case Closed. Closed date : 2016-04-26 20:03:47.457 Case Noted No violations found,Improper Storage of Trash (Barrels),Public Works Department,Code Enforcement,Improper Storage of Trash (Barrels),PWDx_Code Enforcement,PWDx,https://mayors24.cityofboston.gov/media/boston/report/photos/571ff95f04853126c4dcd01f/report.jpg,,745 Atlantic Ave  Boston  MA  02111,4.0,1C,2.0,A1,Downtown / Financial District,4.0,Ward 3,0308,C,745 Atlantic Ave,2111.0,Address,6354.0,42.3503,-71.0571,Citizens Connect App,"(42.3503, -71.0571)",-7910040.18924672,5213597.978419791
192579,101001770221,04/17/2016 12:52:41 AM,,04/19/2016 04:34:28 PM,ONTIME,Closed,Case Closed. Closed date : 2016-04-19 16:34:28.323 Bulk Item Automation,Schedule Bulk Item Pickup,Public Works Department,Sanitation,Schedule a Bulk Item Pickup SS,PWDx_Schedule a Bulk Item Pickup,PWDx,,,46 Union Park  Roxbury  MA  02118,4.0,1C,2.0,D4,South End,4.0,Ward 3,0307,CD,46 Union Park,2118.0,Address,139195.0,42.3432,-71.0722,Self Service,"(42.3432, -71.0722)",-7911721.113557696,5212528.585989647
269466,101000318320,08/24/2011 10:55:43 AM,12/22/2011 10:55:43 AM,09/30/2011 10:02:49 AM,ONTIME,Closed,Case Closed VIOCOR: Violation Corrected,Pest Infestation - Residential,Inspectional Services,Housing,Pest Infestation - Residential,ISD_Housing (INTERNAL),ISD,,,1 City Hall Plz  Boston  MA  02108,3.0,1B,1.0,A1,Downtown / Financial District,3.0,03,0306,E,1 City Hall Plz,2108.0,Address,32856.0,42.3603,-71.0583,Self Service,"(42.3603, -71.0583)",-7910173.772635671,5215104.369841154
858900,101001214252,11/10/2014 08:24:11 AM,11/13/2014 08:30:00 AM,11/10/2014 08:24:12 AM,ONTIME,Closed,Case Closed Internal Case,Requests for Street Cleaning,Public Works Department,Street Cleaning,Requests for Street Cleaning,PWDx_District 09: East Boston,PWDx,,,INTERSECTION of Chelsea St & Saratoga St  East Boston  MA,1.0,09,1.0,A7,East Boston,1.0,Ward 1,0110,,INTERSECTION Chelsea St & Saratoga St,,Intersection,2877.0,42.3801,-71.027,Employee Generated,"(42.3801, -71.027)",-7906689.472573842,5218087.7323117945
586671,101001688945,01/07/2016 08:35:22 AM,01/08/2016 08:35:21 AM,01/07/2016 10:14:30 AM,ONTIME,Closed,Case Closed. Closed date : 2016-01-07 10:14:30.987 Case Resolved Eleven vehicles ticketed.,Parking Enforcement,Transportation - Traffic Division,Enforcement & Abandoned Vehicles,Parking Enforcement,BTDT_Parking Enforcement,BTDT,https://mayors24.cityofboston.gov/media/boston/report/photos/568e698d696341df31a2df74/report.jpg,,910 E Broadway  South Boston  MA  02127,6.0,05,2.0,C6,South Boston / South Boston Waterfront,5.0,Ward 6,0607,R3,910 E Broadway,2127.0,Address,21325.0,42.336000000000006,-71.0278,Citizens Connect App,"(42.336, -71.0278)",-7906778.528166477,5211444.255014753
100159,101000899166,08/12/2013 08:30:52 AM,,08/13/2013 09:52:17 PM,ONTIME,Closed,Case Closed Bulk Item Automation,Schedule Bulk Item Pickup,Public Works Department,Sanitation,Schedule a Bulk Item Pickup SS,PWDx_Schedule a Bulk Item Pickup,PWDx,,,1 Onslow Ter  South Boston  MA  02127,6.0,05,2.0,C6,South Boston / South Boston Waterfront,5.0,Ward 6,0608,R1,1 Onslow Ter,2127.0,Address,105326.0,42.3337,-71.032,Self Service,"(42.3337, -71.032)",-7907246.070027809,5211097.897672368
918510,101002001051,02/01/2017 02:38:00 PM,,02/06/2017 04:30:56 PM,ONTIME,Closed,Case Closed. Closed date : 2017-02-06 16:30:56.63 Bulk Item Automation,Schedule a Bulk Item Pickup,Public Works Department,Sanitation,Schedule a Bulk Item Pickup,PWDx_Schedule a Bulk Item Pickup,PWDx,,,50 Commonwealth Ave  Boston  MA  02116,4.0,1C,8.0,D4,Back Bay,14.0,Ward 5,0506,CM,50 Commonwealth Ave,2116.0,Address,163709.0,42.3526,-71.074,Constituent Call,"(42.3526, -71.074)",-7911921.488641125,5213944.427222384
94286,101000366477,12/21/2011 07:32:44 AM,,12/21/2011 07:32:44 AM,ONTIME,Closed,Case Closed Internal Case Performed by Highway Maintenance crew.,Pothole Repair (Internal),Public Works Department,Highway Maintenance,Pothole Repair (Internal),PWDx_District 05: South Boston,PWDx,,,INTERSECTION of Frontage Rd & Southampton St  South Boston  MA,6.0,05,2.0,C6,South Boston / South Boston Waterfront,5.0,Ward 7,0705,,INTERSECTION Frontage Rd & Southampton St,,Intersection,5137.0,42.3302,-71.0603,Employee Generated,"(42.3302, -71.0603)",-7910396.411617258,5210570.8564534765
253365,101000740295,01/22/2013 08:41:52 AM,01/24/2013 08:41:52 AM,01/22/2013 08:41:54 AM,ONTIME,Closed,Case Closed,Requests for Street Cleaning,Public Works Department,Street Cleaning,Requests for Street Cleaning,PWDx_District 02: Jamaica Plain,PWDx,,,43 Custer St  Jamaica Plain  MA  02130,9.0,02,6.0,E13,Jamaica Plain,11.0,Ward 19,1909,R1,43 Custer St,2130.0,Address,45286.0,42.3072,-71.1179,City Worker App,"(42.3072, -71.1179)",-7916808.414286952,5207108.1720349165
916880,101001977057,12/27/2016 05:03:39 PM,01/09/2017 08:30:00 AM,02/02/2017 02:21:13 PM,OVERDUE,Closed,Case Closed. Closed date : 2017-02-02 14:21:13.203 Case Resolved Both light fixtures working now,Park Lights - Commonwealth Avenue Mall (BPRD),Parks & Recreation Department,Park Maintenance & Safety,Parks Lighting/Electrical Issues,PARK_Maintenance_Lighting Electrical,PARK,https://mayors24.cityofboston.gov/media/boston/report/photos/5862e535048508c58697bf37/report.jpg,,INTERSECTION of Arlington St & Commonwealth Ave  Boston  MA,4.0,1C,7.0,A1,Beacon Hill,14.0,5,0503,,INTERSECTION Arlington St & Commonwealth Ave,,Intersection,16296.0,42.3594,-71.0587,Citizens Connect App,"(0, 0)",-7910218.300431989,5214968.784796895
183779,101001848880,06/30/2016 02:18:00 PM,07/30/2016 02:18:43 PM,08/26/2016 09:06:10 AM,OVERDUE,Closed,Case Closed. Closed date : 2016-08-26 09:06:10.58 VIOCOR: Violation Corrected,Rodent Activity,Inspectional Services,Environmental Services,Rodent Activity,ISD_Environmental Services (INTERNAL),ISD,,,10 Taft St  Dorchester  MA  02125,7.0,03,3.0,C11,Dorchester,7.0,Ward 13,1308,R3,10 Taft St,2125.0,Address,133577.0,42.317,-71.0573,Constituent Call,"(42.317, -71.0573)",-7910062.453144878,5208583.421956635
500227,101001815478,06/14/2016 06:11:00 PM,06/16/2016 08:30:00 AM,06/15/2016 09:07:48 AM,ONTIME,Closed,Case Closed. Closed date : 2016-06-15 09:07:48.81 Case Resolved,Requests for Street Cleaning,Public Works Department,Street Cleaning,Requests for Street Cleaning,PWDx_District 1B: North End,PWDx,https://mayors24.cityofboston.gov/media/boston/report/photos/576080ff6963421113f1b136/report.jpg,https://cityworker.cityofboston.gov:8443/attachments/report/5760814bd0525fb31f98cfb4/closed_photo/Report.jpg,50 Fleet St  Boston  MA  02109,3.0,1B,1.0,A1,Downtown / Financial District,3.0,Ward 3,0301,CD,50 Fleet St,2109.0,Address,58689.0,42.3642,-71.0514,Citizens Connect App,"(42.3642, -71.0514)",-7909405.6681491975,5215691.927475566
877506,101000426010,05/22/2012 05:42:52 PM,07/25/2012 08:30:00 AM,06/07/2012 02:39:16 PM,ONTIME,Closed,Case Closed Case Resolved   This request has been completed.,Graffiti Removal,Property Management,Graffiti,Graffiti Removal,PROP_GRAF_GraffitiRemoval,PROP,,,104-106 Trenton St  East Boston  MA  02128,1.0,09,1.0,A7,East Boston,1.0,Ward 1,0107,RC,104-106 Trenton St,2128.0,Address,138263.0,42.3794,-71.0356,Citizens Connect App,"(42.3794, -71.0356)",-7907646.820194664,5217982.243862696
895591,101001971458,12/16/2016 11:07:34 AM,01/03/2017 11:07:34 AM,,OVERDUE,Open,,Other: Comment,Mayor's 24 Hour Hotline,Employee & General Comments,General Comments For a Program or Policy,INFO_General Comments Complaints Compliments,INFO,,,,,,,,,,,,,,,,,42.3594,-71.0587,Constituent Call,"(0, 0)",-7910218.300431989,5214968.784796895
556685,101001895626,08/31/2016 09:21:00 AM,09/02/2016 09:21:05 AM,,OVERDUE,Open,,Work w/out Permit,Inspectional Services,Building,Work w/out Permit,ISD_Building (INTERNAL),ISD,,,279 Border St  East Boston  MA  02128,1.0,09,1.0,A7,East Boston,1.0,Ward 1,0107,I,279 Border St,2128.0,Address,392031.0,42.3775,-71.0397,Constituent Call,"(42.3775, -71.0397)",-7908103.230106915,5217695.923999991
335410,101001335396,03/17/2015 04:13:57 PM,03/31/2015 04:13:00 PM,03/30/2015 10:43:40 PM,ONTIME,Closed,Case Closed Case Resolved lamp and tighttened fixture. kelly/buckley,outage////printed,Public Works Department,Street Lights,Street Light Outages,PWDx_Street Light Outages,PWDx,,,0 Sprague St  Hyde Park  MA  02136,12.0,08,5.0,E18,Hyde Park,10.0,Ward 18,1820,E,0 Sprague St,2136.0,Address,129417.0,42.3594,-71.0587,Employee Generated,"(0, 0)",-7910218.300431989,5214968.784796895
774546,101000885228,07/23/2013 10:00:56 AM,07/25/2013 10:00:55 AM,09/13/2013 08:23:16 AM,OVERDUE,Closed,Case Closed NOVIO: No Violation Found/No Cause,Work w/out Permit,Inspectional Services,Building,Work w/out Permit,ISD_Building (INTERNAL),ISD,,,177 Lexington St  East Boston  MA  02128,1.0,09,1.0,A7,East Boston,1.0,Ward 1,0109,R3,177 Lexington St,2128.0,Address,85557.0,42.3791,-71.0333,Constituent Call,"(42.3791, -71.0333)",-7907390.7853658395,5217937.0348873595
452680,101001255754,01/27/2015 05:45:16 PM,01/30/2015 08:30:00 AM,01/31/2015 01:55:18 AM,OVERDUE,Closed,Case Closed Case Resolved,Request for Snow Plowing,Public Works Department,Street Cleaning,Request for Snow Plowing,PWDx_District 08: Hyde Park,PWDx,,,40-42 Rosa St  Hyde Park  MA  02136,12.0,08,5.0,E18,Hyde Park,10.0,Ward 18,1815,R2,40-42 Rosa St,2136.0,Address,118236.0,42.2625,-71.1129,Constituent Call,"(42.2625, -71.1129)",-7916251.816832984,5200382.136797374
152328,101001364816,04/27/2015 02:58:31 PM,,06/03/2015 09:21:46 AM,ONTIME,Closed,Case Closed Case Resolved,Schedule a Bulk Item Pickup,Public Works Department,Sanitation,Schedule a Bulk Item Pickup,PWDx_Schedule a Bulk Item Pickup,PWDx,,,60 Stanton St  Dorchester  MA  02124,8.0,07,4.0,B3,Dorchester,9.0,Ward 17,1707,R2,60 Stanton St,2124.0,Address,130234.0,42.2836,-71.0787,Constituent Call,"(42.2836, -71.0787)",-7912444.690247853,5203556.471532283
823131,101000335798,09/28/2011 07:22:18 PM,09/30/2011 08:30:00 AM,09/28/2011 08:00:10 PM,ONTIME,Closed,Case Closed Duplicate of Existing Case See CRM#335793,Major System Failure,Public Works Department,Street Lights,Major System Failure,PWDx_Major System Failure,PWDx,,,647 Tremont St  Roxbury  MA  02118,4.0,1C,2.0,D4,South End,6.0,Ward 4,0401,RC,647 Tremont St,2118.0,Address,137837.0,42.3422,-71.0754,Constituent Call,"(42.3422, -71.0754)",-7912077.335928236,5212377.977040319
22797,101000339199,10/06/2011 03:02:01 PM,10/13/2011 03:02:01 PM,10/12/2011 08:42:00 AM,ONTIME,Closed,Case Closed Case Resolved BWSC is responsible for permanently repairing the patch at # 52 Burton St /Allston/Brighton    The contractor jack hammered the patch in preparation for the excavation work.      Mark Cardarelli called the constituent and explained above info.. he also provided a number to call BWSC for an accurate repair schedule as well as his number just in case the repair is not made in a timely manner.    Mark Cardarelli  Supervisor of Utility Coordination and Compliance  Boston Public Works Department  617-635-4951 Office  617-438-8517 Cell,Contractor Complaints,Public Works Department,Highway Maintenance,Contractor Complaints,PWDx_Contractor Complaints,PWDx,,,50-52 Burton St  Brighton  MA  02135,,04,9.0,D14,Allston / Brighton,15.0,Ward 22,2213,R2,50-52 Burton St,2135.0,Address,24176.0,42.355,-71.1721,Constituent Call,"(42.355, -71.1721)",-7922841.930687945,5214305.952533545
792486,101001320880,03/02/2015 08:22:07 AM,03/04/2015 08:30:00 AM,04/13/2015 05:23:59 PM,OVERDUE,Closed,Case Closed Case Noted Thank you for your request. This service request is now considered closed due to the recent arrival of Spring. The City worked around the clock this winter to address the record-breaking snowfall and we hope that many of your concerns were resolved. We encourage you to let us know of any additional issues and thank you for working with us to make the City a better place. Thank you for your patience and we apologize for any requests that we were not able to get to.,Request for Snow Plowing,Public Works Department,Street Cleaning,Request for Snow Plowing,PWDx_District 1C: Downtown,PWDx,https://mayors24.cityofboston.gov/media/boston/report/photos/54f463ed04854301ed49030a/photo_20150302_082153.jpg,,INTERSECTION of Kingston St & Summer St  Boston  MA,3.0,1C,2.0,A1,Downtown / Financial District,4.0,Ward 3,0308,,INTERSECTION Kingston St & Summer St,,Intersection,6666.0,42.3541,-71.0586,Citizens Connect App,"(42.3541, -71.0586)",-7910207.16848291,5214170.378924012
789335,101001804063,06/01/2016 10:24:49 AM,06/22/2016 10:24:48 AM,06/07/2016 08:31:24 AM,ONTIME,Closed,Case Closed. Closed date : 2016-06-07 08:31:24.51 Duplicate of Existing Case reference # 101001804056,Damaged Cart - New Request,Public Works Department,Recycling,Request for Recycling Cart,PWDx_Recycling,PWDx,,,88 Howard Ave  Dorchester  MA  02125,7.0,03,7.0,B2,Roxbury,13.0,Ward 13,1304,R2,88 Howard Ave,2125.0,Address,75559.0,42.3175,-71.0742,Employee Generated,"(42.3175, -71.0742)",-7911943.752539285,5208658.69596901
616654,101000365268,12/17/2011 12:16:18 PM,12/21/2011 12:16:17 PM,12/17/2011 01:51:41 PM,ONTIME,Closed,Case Closed Case Resolved,Request for Pothole Repair,Public Works Department,Highway Maintenance,Request for Pothole Repair,PWDx_District 08: Hyde Park,PWDx,,,INTERSECTION of Metropolitan Ave & Poplar St  Roslindale  MA,12.0,08,5.0,E18,Roslindale,10.0,Ward 18,1809,,INTERSECTION Metropolitan Ave & Poplar St,,Intersection,7271.0,42.2759,-71.1257,Citizens Connect App,"(42.2759, -71.1257)",-7917676.706315137,5202397.941868401
573963,101000387205,02/23/2012 09:35:51 AM,02/27/2012 09:35:50 AM,02/23/2012 02:36:03 PM,ONTIME,Closed,Case Closed Case Resolved case exists already; area has been made safe; please follow case #179969,Sidewalk Repair (Make Safe),Public Works Department,Highway Maintenance,Sidewalk Repair (Make Safe),PWDx_District 02: Jamaica Plain,PWDx,,,127 Mount Hope St  Roslindale  MA  02131,12.0,02,5.0,E18,Roslindale,10.0,Ward 18,1807,R1,127 Mount Hope St,2131.0,Address,98249.0,42.2819,-71.1144,City Worker App,"(42.2819, -71.1144)",-7916418.796069175,5203300.680077746
907066,101000413736,04/27/2012 10:19:36 AM,,05/01/2012 09:43:37 PM,ONTIME,Closed,Case Closed Bulk Item Automation,Schedule a Bulk Item Pickup,Public Works Department,Sanitation,Schedule a Bulk Item Pickup,PWDx_Schedule a Bulk Item Pickup,PWDx,,,100 W Dedham St  Roxbury  MA  02118,4.0,1C,2.0,D4,Roxbury,6.0,09,0901,EA,100 W Dedham St,2118.0,Address,46908.0,42.3423,-71.0735,Employee Generated,"(42.3423, -71.0735)",-7911865.828895728,5212393.037827457
732123,101001266432,02/01/2015 12:03:10 PM,02/04/2015 08:30:00 AM,02/12/2015 05:36:29 PM,OVERDUE,Closed,Case Closed Case Noted Snow has been removed.,Request for Snow Plowing,Public Works Department,Street Cleaning,Request for Snow Plowing,PWDx_District 1C: Downtown,PWDx,,,INTERSECTION of Massachusetts Ave & Saint Stephen St  Boston  MA,4.0,1C,7.0,D4,Back Bay,14.0,Ward 4,0405,,INTERSECTION Massachusetts Ave & Saint Stephen St,,Intersection,7139.0,42.3434,-71.0858,Constituent Call,"(42.3434, -71.0858)",-7913235.0586324865,5212558.708066968
199542,101000770769,02/10/2013 06:40:15 PM,02/13/2013 08:30:00 AM,02/12/2013 04:37:44 AM,ONTIME,Closed,Case Closed Case Resolved Roadway plowed / issues resolved.    District 3 Yard: 617-635-7530,Request for Snow Plowing,Public Works Department,Street Cleaning,Request for Snow Plowing,PWDx_District 03: North Dorchester,PWDx,,,16 Fernald Ter  Dorchester  MA  02125,7.0,03,3.0,C11,Dorchester,8.0,Ward 15,1504,R2,16 Fernald Ter,2125.0,Address,234904.0,42.3103,-71.0667,Constituent Call,"(42.3103, -71.0667)",-7911108.856358334,5207574.807887256
372803,101001658750,12/04/2015 11:21:00 PM,03/03/2016 11:21:32 PM,,OVERDUE,Open,,Unsatisfactory Utilities - Electrical  Plumbing,Inspectional Services,Housing,Unsatisfactory Utilities - Electrical  Plumbing,ISD_Housing (INTERNAL),ISD,,,247 Walnut Ave  Roxbury  MA  02119,9.0,10B,7.0,B2,Roxbury,13.0,Ward 11,1103,A,247 Walnut Ave,2119.0,Address,327365.0,42.3181,-71.0913,Constituent Call,"(42.3181, -71.0913)",-7913847.31583185,5208749.025573346
91674,101000825497,04/22/2013 09:52:32 AM,06/24/2013 09:52:32 AM,05/07/2013 01:49:03 PM,ONTIME,Closed,Case Closed Case Resolved   This request has been completed and has been done three times in the past.,Graffiti: Ward 22  2201  Other,Property Management,Graffiti,Graffiti Removal,PROP_GRAF_GraffitiRemoval,PROP,,,241 Cambridge St  Allston  MA  02134,11.0,04,9.0,D14,Allston / Brighton,15.0,Ward 22,2201,R4,241 Cambridge St,2134.0,Address,25097.0,42.3579,-71.1272,Self Service,"(42.3579, -71.1272)",-7917843.685551328,5214742.814038565
488893,101001334240,03/16/2015 03:15:15 PM,,,ONTIME,Open,,Animal Generic Request,Animal Control,Animal Issues,Animal Generic Request,INFO01_GenericeFormforOtherServiceRequestTypes,INFO,,,36 Cleveland St  Hyde Park  MA  02136,12.0,08,5.0,E18,Hyde Park,10.0,Ward 18,1812,R2,36 Cleveland St,2136.0,Address,33861.0,42.2551,-71.131,Constituent Call,"(42.2551, -71.131)",-7918266.699616342,5199269.114632383
622172,101001844483,06/24/2016 08:26:00 PM,07/24/2016 08:26:47 PM,07/07/2016 12:00:30 PM,ONTIME,Closed,Case Closed. Closed date : 2016-07-07 12:00:30.233 VIOCOR: Violation Corrected,Rodent Activity,Inspectional Services,Environmental Services,Rodent Activity,ISD_Environmental Services (INTERNAL),ISD,,,90 Summer St  Hyde Park  MA  02136,12.0,08,5.0,E18,Hyde Park,10.0,Ward 18,1812,R1,90 Summer St,2136.0,Address,131942.0,42.2606,-71.1251,Constituent Call,"(42.2606, -71.1251)",-7917609.914620662,5200096.348372891
789590,101000410600,04/20/2012 08:02:16 AM,04/24/2012 08:02:15 AM,04/20/2012 01:12:15 PM,ONTIME,Closed,Case Closed Case Resolved tire and box blocking sidewalk picked up on 04/20/12,Requests for Street Cleaning,Public Works Department,Street Cleaning,Requests for Street Cleaning,PWDx_District 10B: Roxbury,PWDx,,,INTERSECTION of Washington St & Westminster Ave  Roxbury  MA,9.0,10B,6.0,E13,Roxbury,11.0,Ward 11,1104,,INTERSECTION Washington St & Westminster Ave,,Intersection,6026.0,42.317,-71.0971,City Worker App,"(42.317, -71.0971)",-7914492.968878451,5208583.421956635
743407,101001714774,02/10/2016 05:45:14 PM,02/12/2016 08:30:00 AM,02/11/2016 06:47:47 AM,ONTIME,Closed,Case Closed. Closed date : 2016-02-11 06:47:47.39 Case Resolved,CE Collection,Public Works Department,Street Cleaning,CE Collection,PWDx_District 1C: Downtown,PWDx,https://cityworker.cityofboston.gov:8443/attachments/report/56bbbd76d052af2717aed27b/photo/Report.jpg,https://cityworker.cityofboston.gov:8443/attachments/report/56bbbd76d052af2717aed27b/closed_photo/Report.jpg,1511-1525 Washington St  Roxbury  MA  02118,4.0,1C,2.0,D4,South End,6.0,Ward 9,0901,RC,1511-1525 Washington St,2118.0,Address,144256.0,42.34,-71.0724,City Worker App,"(42.34, -71.0724)",-7911743.377455857,5212046.645783383
945802,101002031573,03/06/2017 06:39:00 PM,03/08/2017 08:30:00 AM,03/06/2017 07:56:29 PM,ONTIME,Closed,Case Closed. Closed date : 2017-03-06 19:56:29.373 Case Resolved Picked up,Requests for Street Cleaning,Public Works Department,Street Cleaning,Requests for Street Cleaning,PWDx_District 10A: Roxbury,PWDx,https://mayors24.cityofboston.gov/media/boston/report/photos/58bdf3140485380cc1777c69/photo_20170306_183835.jpg,https://cityworker.cityofboston.gov:8443/attachments/report/58bdf371d052c51cc8fe1ac6/closed_photo/Report.jpg,INTERSECTION of Commonwealth Ave & Beacon St  Boston  MA,4.0,10A,7.0,D4,Fenway / Kenmore / Audubon Circle / Longwood,14.0,5,0510,,INTERSECTION Commonwealth Ave & Beacon St,,Intersection,17613.0,42.3594,-71.0587,Citizens Connect App,"(0, 0)",-7910218.300431989,5214968.784796895
244169,101000407335,04/11/2012 02:16:28 PM,04/11/2013 02:16:28 PM,,OVERDUE,Open,,Sidewalk Repair,Public Works Department,Highway Maintenance,Sidewalk Repair,PWDx_Sidewalk Repair,PWDx,,,INTERSECTION of Ringgold St & Waltham St  Roxbury  MA,4.0,1C,2.0,D4,South End,4.0,Ward 3,0307,,INTERSECTION Ringgold St & Waltham St,,Intersection,8108.0,42.3429,-71.0703,City Worker App,"(42.3429, -71.0703)",-7911509.606525192,5212483.403053326
186434,101001747971,03/16/2016 03:05:00 PM,,05/12/2016 02:49:56 PM,ONTIME,Closed,Case Closed. Closed date : 2016-05-12 14:49:56.667 Case Noted Move to Investigations -,Housing Discrimination Intake Form,Civil Rights,Investigations and Enforcement,Housing Discrimination Intake Form,HS_OCR_Investigation Enforcement,HS_O,,,,,,,,,,,,,,,,,42.3594,-71.0587,Constituent Call,"(0, 0)",-7910218.300431989,5214968.784796895
588736,101001755599,03/28/2016 05:11:00 PM,04/12/2016 08:30:00 AM,04/05/2016 05:30:14 PM,ONTIME,Closed,Case Closed. Closed date : 2016-04-05 17:30:14.917 Case Resolved replaced lamp,Street Light Outages SLCB#0991 LP#24 250W SV or LED Rect Printed BK,Public Works Department,Street Lights,Street Light Outages,PWDx_Street Light Outages,PWDx,,https://cityworker.cityofboston.gov:8443/attachments/report/56f99e92d052f98a93ac7f24/closed_photo/Report.jpg,39 Mather St  Dorchester  MA  02124,8.0,07,4.0,C11,Dorchester,8.0,Ward 17,1706,R1,39 Mather St,2124.0,Address,92762.0,42.2944,-71.0654,Constituent Call,"(42.2944, -71.0654)",-7910964.141020304,5205181.660827755
429834,101001694054,01/15/2016 08:10:00 AM,02/01/2016 08:30:00 AM,01/15/2016 09:52:40 AM,ONTIME,Closed,Case Closed. Closed date : 2016-01-15 09:52:40.51 Case Resolved Checked photo cell and found unit working properly. Checking the unit next to it.  Webb/Doyle. 1/15/16.,Street Light Outages//printed,Public Works Department,Street Lights,Street Light Outages,PWDx_Street Light Outages,PWDx,,https://cityworker.cityofboston.gov:8443/attachments/report/5698eff370b4c4f343ff8298/closed_photo/Report.jpg,59 Warren St  Charlestown  MA  02129,3.0,1A,1.0,A15,Charlestown,2.0,Ward 2,0203,CM,59 Warren St,2129.0,Address,143168.0,42.373999999999995,-71.0619,Citizens Connect App,"(42.374, -71.0619)",-7910574.522802527,5217168.515350485
151892,101001712423,02/08/2016 01:53:11 PM,,02/08/2016 01:53:04 PM,ONTIME,Closed,Case Closed. Closed date : 2016-02-08 13:53:04.51 Internal Case Performed by Highway Maintenance crew.,Pothole Repair (Internal),Public Works Department,Highway Maintenance,Pothole Repair (Internal),PWDx_District 02: Jamaica Plain,PWDx,,,28 Montebello Rd  Jamaica Plain  MA  02130,9.0,02,6.0,E13,Jamaica Plain,11.0,Ward 11,1106,R3,28 Montebello Rd,2130.0,Address,276651.0,42.3128,-71.102,Employee Generated,"(42.3128, -71.102)",-7915038.434383337,5207951.143863302
368417,101001357263,04/15/2015 03:19:21 PM,04/17/2015 03:19:21 PM,04/22/2015 07:55:14 AM,OVERDUE,Closed,Case Closed NOVIO: No Violation Found/No Cause,Overflowing or Un-kept Dumpster,Inspectional Services,Environmental Services,Overflowing or Un-kept Dumpster,ISD_Environmental Services (INTERNAL),ISD,,,530 Atlantic Ave  Boston  MA  02110,6.0,1C,1.0,A1,Downtown / Financial District,3.0,03,0306,,530 Atlantic Ave,2110.0,Address,350751.0,42.3538,-71.053,Self Service,"(42.3538, -71.053)",-7909583.779334467,5214125.188152268
423145,101000417380,05/04/2012 04:56:19 PM,05/08/2012 04:56:19 PM,05/07/2012 10:28:42 AM,ONTIME,Closed,Case Closed Case Resolved Vehicles gone.,Parking Enforcement,Transportation - Traffic Division,Enforcement & Abandoned Vehicles,Parking Enforcement,BTDT_Parking Enforcement,BTDT,,,INTERSECTION of Columbus Ave & Dimock St  Roxbury  MA,9.0,10B,7.0,B2,Roxbury,13.0,Ward 11,1102,,INTERSECTION Columbus Ave & Dimock St,,Intersection,3275.0,42.3195,-71.0983,Constituent Call,"(42.3195, -71.0983)",-7914626.552267402,5208959.797999593
338899,101001114350,06/23/2014 05:17:12 PM,06/25/2014 08:30:00 AM,06/24/2014 07:20:33 AM,ONTIME,Closed,Case Closed Duplicate of Existing Case  Duplicate of case # 1114284,Tree Emergencies,Parks & Recreation Department,Trees,Tree Emergencies,PARK_Tree Emergencies,PARK,,,12 Curley St  Roslindale  MA  02131,12.0,02,5.0,E18,Roslindale,10.0,Ward 18,1807,R1,12 Curley St,2131.0,Address,45089.0,42.2854,-71.109,Constituent Call,"(42.2854, -71.109)",-7915817.6708188895,5203827.317065952
894684,101001978543,12/29/2016 06:35:00 PM,01/03/2017 08:30:00 AM,12/30/2016 09:03:51 AM,ONTIME,Closed,Case Closed. Closed date : 2016-12-30 09:03:51.947 Case Noted Material was removed as scheduled trucks were running later than usual due to heavy volumes,Missed Recycling: District 08,Public Works Department,Sanitation,Missed Trash/Recycling/Yard Waste/Bulk Item,PWDx_Missed Trash\Recycling\Yard Waste\Bulk Item,PWDx,,,19-21 Gordon Ave  Hyde Park  MA  02136,12.0,08,5.0,E18,Hyde Park,10.0,Ward 18,1812,R2,19-21 Gordon Ave,2136.0,Address,65377.0,42.2564,-71.1258,Constituent Call,"(42.2564, -71.1258)",-7917687.838264217,5199464.636096213
655284,101001286359,02/10/2015 04:43:30 PM,02/25/2015 04:43:29 PM,,OVERDUE,Open,,Other: Complaint,Mayor's 24 Hour Hotline,Employee & General Comments,General Comments For a Program or Policy,INFO_General Comments Complaints Compliments,INFO,,,,,,,,,,,,,,,,,42.3594,-71.0587,Constituent Call,"(0, 0)",-7910218.300431989,5214968.784796895
196065,101001935817,10/21/2016 10:22:00 AM,10/24/2016 10:22:30 AM,10/21/2016 11:41:01 AM,ONTIME,Closed,Case Closed. Closed date : 2016-10-21 11:41:01.457 Case Resolved Serviced this location today at 11:40am October 21st  2016,Missed Recycling: District 03,Public Works Department,Sanitation,Missed Trash/Recycling/Yard Waste/Bulk Item,PWDx_Missed Trash\Recycling\Yard Waste\Bulk Item,PWDx,,https://cityworker.cityofboston.gov:8443/attachments/report/580a24c6d052e4313f7b398d/closed_photo/Report.jpg,29 Thornley St  Dorchester  MA  02125,7.0,03,3.0,C11,Dorchester,7.0,Ward 13,1309,R2,29 Thornley St,2125.0,Address,135807.0,42.3145,-71.0594,Constituent Call,"(42.3145, -71.0594)",-7910296.224075544,5208207.060865616
767550,101001049637,03/19/2014 07:35:54 AM,04/16/2014 08:30:00 AM,04/07/2014 09:09:24 AM,ONTIME,Closed,Case Closed Case Resolved delivered #0713434381,Request for Recycling Cart,Public Works Department,Recycling,Request for Recycling Cart,PWDx_Recycling,PWDx,,,40 Dennison St  Roxbury  MA  02119,9.0,10B,7.0,B2,Roxbury,13.0,11,1103,,40 Dennison St,2119.0,Address,345969.0,42.3182,-71.0936,Self Service,"(42.3182, -71.0936)",-7914103.350660672,5208764.080591135
152326,101000380159,02/02/2012 08:37:05 AM,04/05/2012 08:37:05 AM,02/09/2012 10:49:20 AM,ONTIME,Closed,Case Closed Case Resolved   This request has been completed and 119 Harrishof Street was done.,Graffiti: Ward 12  1202  Other,Property Management,Graffiti,Graffiti Removal,PROP_GRAF_GraffitiRemoval,PROP,,,117 Harrishof St  Dorchester  MA  02121,9.0,10B,7.0,B2,Roxbury,13.0,Ward 12,1202,R3,117 Harrishof St,2121.0,Address,69716.0,42.3171,-71.089,Self Service,"(42.3171, -71.089)",-7913591.281003024,5208598.476711264
669924,101001151118,08/15/2014 12:43:03 PM,08/18/2014 12:43:03 PM,08/15/2014 02:57:02 PM,ONTIME,Closed,Case Closed Case Resolved,Street Light Knock Downs,Public Works Department,Street Lights,Street Light Knock Downs,PWDx_Street Light_General Lighting Request,PWDx,,,INTERSECTION of Eden St & Main St  Charlestown  MA,3.0,1A,1.0,A15,Charlestown,2.0,Ward 2,206.0,,INTERSECTION Eden St & Main St,,Intersection,4399.0,42.3788,-71.0685,Constituent Call,"(42.3788, -71.0685)",-7911309.231441763,5217891.826128013
71741,101001698612,01/22/2016 11:53:00 AM,01/25/2016 11:53:00 AM,01/22/2016 01:23:13 PM,ONTIME,Closed,Case Closed. Closed date : 2016-01-22 13:23:13.367 Case Resolved the pot hole have been patch,Request for Pothole Repair,Public Works Department,Highway Maintenance,Request for Pothole Repair,PWDx_District 04: Allston/Brighton,PWDx,https://mayors24.cityofboston.gov/media/boston/report/photos/56a25e68048563580b316187/report.jpg,https://cityworker.cityofboston.gov:8443/attachments/report/56a25eb470b4028470f8c4ed/closed_photo/Report.jpg,61 Selkirk Rd  Brighton  MA  02135,11.0,04,9.0,D14,Allston / Brighton,15.0,Ward 21,2113,A,61 Selkirk Rd,2135.0,Address,308799.0,42.3396,-71.1495,Citizens Connect App,"(42.3396, -71.1495)",-7920326.110196019,5211986.4049821645
87580,101001913639,09/20/2016 02:46:00 PM,09/23/2016 02:46:06 PM,,OVERDUE,Open,,Building Inspection Request,Inspectional Services,Building,Building Inspection Request,ISD_Building (INTERNAL),ISD,,,958 Centre St  Jamaica Plain  MA  02130,9.0,02,6.0,E13,Jamaica Plain,11.0,Ward 19,1902,CM,958 Centre St,2130.0,Address,397620.0,42.3071,-71.1226,Constituent Call,"(42.3071, -71.1226)",-7917331.61589368,5207093.119648082
126185,101000455076,07/25/2012 11:35:11 AM,08/22/2012 11:35:10 AM,07/30/2012 10:04:46 AM,ONTIME,Closed,Case Closed Case Resolved towed 7/30.,Abandoned Vehicles,Transportation - Traffic Division,Enforcement & Abandoned Vehicles,Abandoned Vehicles,BTDT_AVRS Interface Queue,BTDT,,,INTERSECTION of Carlos St & Woodrow Ave  Dorchester  MA,8.0,07,4.0,B3,Greater Mattapan,9.0,Ward 14,1410,,INTERSECTION Carlos St & Woodrow Ave,,Intersection,2447.0,42.2869,-71.0851,Employee Generated,"(42.2869, -71.0851)",-7913157.13498893,5204053.027588756
825642,101001375850,05/12/2015 02:48:41 PM,05/13/2015 02:48:41 PM,05/12/2015 07:19:11 PM,ONTIME,Closed,Case Closed. Closed date : 2015-05-12 19:19:11.177 Case Resolved it is all set,Empty Litter Basket,Public Works Department,Highway Maintenance,Empty Litter Basket,PWDx_District 07: South Dorchester,PWDx,https://mayors24.cityofboston.gov/media/boston/report/photos/55524af5048548fafa60d7cb/photo_20150512_144337.jpg,https://cityworker.cityofboston.gov:8443/attachments/report/55524b1cd052df0e552dcc90/closed_photo/Report.jpg,INTERSECTION of Welles Ave & Joseph St  Dorchester  MA,8.0,07,3.0,C11,Dorchester,8.0,Ward 16,1603,,INTERSECTION Welles Ave & Joseph St,,Intersection,6200.0,42.2894,-71.0659,Citizens Connect App,"(42.2894, -71.0659)",-7911019.800765701,5204429.223736858
676594,101001259602,01/28/2015 06:18:30 PM,02/02/2015 08:30:00 AM,02/12/2015 05:32:46 PM,OVERDUE,Closed,Case Closed Case Noted Snow has been removed.,Request for Snow Plowing,Public Works Department,Street Cleaning,Request for Snow Plowing,PWDx_District 1C: Downtown,PWDx,,,190 Marlborough St  Boston  MA  02116,4.0,1C,8.0,D4,Back Bay,14.0,Ward 5,0507,CM,190 Marlborough St,2116.0,Address,90571.0,42.3522,-71.0803,Self Service,"(42.3522, -71.0803)",-7912622.801433123,5213884.174346029
775387,101001337602,03/19/2015 03:29:55 PM,03/20/2015 03:29:55 PM,03/20/2015 01:18:33 PM,ONTIME,Closed,Case Closed Case Resolved Material was removed thank you,Missed Trash: District 02,Public Works Department,Sanitation,Missed Trash/Recycling/Yard Waste/Bulk Item,PWDx_Missed Trash\Recycling\Yard Waste\Bulk Item,PWDx,,,40 Iffley Rd  Jamaica Plain  MA  02130,9.0,02,7.0,E13,Jamaica Plain,11.0,Ward 11,1105,CM,40 Iffley Rd,2130.0,Address,77979.0,42.3125,-71.0991,Constituent Call,"(42.3125, -71.0991)",-7914715.607860038,5207905.982756919
18377,101001184161,09/29/2014 09:15:14 AM,12/28/2014 09:15:13 AM,10/28/2014 11:09:29 AM,ONTIME,Closed,Case Closed :,Chronic Dampness/Mold,Inspectional Services,Housing,Chronic Dampness/Mold,ISD_Housing (INTERNAL),ISD,,,105 Archdale Rd  Roslindale  MA  02131,12.0,02,5.0,E5,Roslindale,10.0,Ward 19,1911,E,105 Archdale Rd,2131.0,Address,179039.0,42.2912,-71.1194,Constituent Call,"(42.2912, -71.1194)",-7916975.39352314,5204700.094208613
932681,101002019260,02/18/2017 03:59:46 PM,02/22/2017 08:30:00 AM,02/18/2017 04:56:42 PM,ONTIME,Closed,Case Closed. Closed date : 2017-02-18 16:56:42.513 Duplicate of Existing Case duplicate of case #101020148,Parking Enforcement,Transportation - Traffic Division,Enforcement & Abandoned Vehicles,Parking Enforcement,BTDT_Parking Enforcement,BTDT,https://mayors24.cityofboston.gov/media/boston/report/photos/58a8b5be0485450aec7b493e/report.jpg,,INTERSECTION of Kilmarnock St & Van Ness St  Boston  MA,4.0,10A,7.0,D4,Fenway / Kenmore / Audubon Circle / Longwood,14.0,21,2101,,INTERSECTION Kilmarnock St & Van Ness St,,Intersection,11451.0,42.3594,-71.0587,Citizens Connect App,"(0, 0)",-7910218.300431989,5214968.784796895
383930,101000907175,08/21/2013 09:24:59 AM,08/28/2013 09:24:59 AM,03/18/2014 08:52:20 AM,OVERDUE,Closed,Case Closed TSOP: Stop Work/TSOP/Condemnation,Exceeding Terms of Permit,Inspectional Services,Building,Exceeding Terms of Permit,ISD_Building (INTERNAL),ISD,,,58 Brookley Rd  Jamaica Plain  MA  02130,9.0,02,6.0,E13,Jamaica Plain,11.0,Ward 11,1108,R1,58 Brookley Rd,2130.0,Address,22045.0,42.3036,-71.1067,Constituent Call,"(42.3036, -71.1067)",-7915561.635990066,5206566.301172041
258897,101001325032,03/05/2015 12:56:44 PM,03/09/2015 12:56:44 PM,04/13/2015 05:14:27 PM,OVERDUE,Closed,Case Closed Case Noted Thank you for your request. This service request is now considered closed due to the recent arrival of Spring. The City worked around the clock this winter to address the record-breaking snowfall and we hope that many of your concerns were resolved. We encourage you to let us know of any additional issues and thank you for working with us to make the City a better place. Thank you for your patience and we apologize for any requests that we were not able to get to.,Request for Snow Plowing,Public Works Department,Street Cleaning,Request for Snow Plowing,PWDx_District 08: Hyde Park,PWDx,,,229 Reservation Rd  Hyde Park  MA  02136,12.0,08,5.0,E18,Hyde Park,10.0,Ward 18,1812,R1,229 Reservation Rd,2136.0,Address,115273.0,42.2538,-71.1321,Constituent Call,"(42.2538, -71.1321)",-7918389.151056214,5199073.597198831
796246,101001260949,01/29/2015 09:32:25 AM,02/02/2015 09:32:25 AM,01/31/2015 08:22:34 AM,ONTIME,Closed,Case Closed Case Resolved,Request for Snow Plowing,Public Works Department,Street Cleaning,Request for Snow Plowing,PWDx_District 10B: Roxbury,PWDx,,,46 Hazelwood St  Roxbury  MA  02119,9.0,10B,7.0,B2,Roxbury,13.0,Ward 12,1206,R3,46 Hazelwood St,2119.0,Address,72299.0,42.3175,-71.0846,Constituent Call,"(42.3175, -71.0846)",-7913101.475243535,5208658.69596901
540346,101001408373,06/12/2015 11:02:13 AM,,06/15/2015 04:42:16 PM,ONTIME,Closed,Case Closed. Closed date : 2015-06-15 16:42:16.603 Bulk Item Automation,Schedule Bulk Item Pickup,Public Works Department,Sanitation,Schedule a Bulk Item Pickup SS,PWDx_Schedule a Bulk Item Pickup,PWDx,,,338-342 Warren St  Roxbury  MA  02119,9.0,10B,7.0,B2,Roxbury,13.0,Ward 12,1204,RC,338-342 Warren St,2119.0,Address,143258.0,42.3192,-71.0812,Self Service,"(42.3192, -71.0812)",-7912722.988974837,5208914.632084913
92219,101000874358,07/07/2013 04:28:08 PM,,07/11/2013 09:47:49 PM,ONTIME,Closed,Case Closed Bulk Item Automation,Schedule Bulk Item Pickup,Public Works Department,Sanitation,Schedule a Bulk Item Pickup SS,PWDx_Schedule a Bulk Item Pickup,PWDx,,,125 Marlborough St  Boston  MA  02116,4.0,1C,8.0,D4,Back Bay,14.0,Ward 5,0507,A,125 Marlborough St,2116.0,Address,90384.0,42.3533,-71.0779,Self Service,"(42.3533, -71.0779)",-7912355.6346552195,5214049.870678722
865751,101001625534,11/02/2015 10:04:00 AM,,11/03/2015 04:34:02 PM,ONTIME,Closed,Case Closed. Closed date : 2015-11-03 16:34:02.127 Bulk Item Automation,Schedule a Bulk Item Pickup,Public Works Department,Sanitation,Schedule a Bulk Item Pickup,PWDx_Schedule a Bulk Item Pickup,PWDx,,,27 Landseer St  West Roxbury  MA  02132,12.0,06,6.0,E5,West Roxbury,12.0,Ward 20,2014,R1,27 Landseer St,2132.0,Address,83846.0,42.2799,-71.1543,Constituent Call,"(42.2799, -71.1543)",-7920860.443751826,5202999.757790447
532893,101001113428,06/22/2014 11:39:45 AM,06/24/2014 08:30:00 AM,06/22/2014 02:08:35 PM,ONTIME,Closed,Case Closed Case Invalid No animal found,Pick up Dead Animal,Public Works Department,Street Cleaning,Pick up Dead Animal,PWDx_District 03: North Dorchester,PWDx,,,10 Batchelder St  Dorchester  MA  02125,7.0,03,7.0,B2,Dorchester,13.0,08,0805,E,10 Batchelder St,2125.0,Address,174863.0,42.3211,-71.0695,Constituent Call,"(42.3211, -71.0695)",-7911420.550932556,5209200.686514744
70106,101001051916,03/21/2014 02:59:39 PM,,03/31/2014 04:35:12 PM,ONTIME,Closed,Case Closed Bulk Item Automation,Schedule a Bulk Item Pickup,Public Works Department,Sanitation,Schedule a Bulk Item Pickup,PWDx_Schedule a Bulk Item Pickup,PWDx,,,188 Colorado St  Mattapan  MA  02126,8.0,07,5.0,B3,Greater Mattapan,9.0,Ward 18,1821,R1,188 Colorado St,2126.0,Address,34947.0,42.2742,-71.1026,Constituent Call,"(42.2742, -71.1026)",-7915105.226077813,5202142.181668485
634697,101001925568,10/06/2016 02:28:00 PM,12/13/2016 02:28:33 PM,10/13/2016 10:18:30 AM,ONTIME,Closed,Case Closed. Closed date : 2016-10-13 10:18:30.49 Case Resolved Done,Graffiti Removal,Property Management,Graffiti,Graffiti Removal,PROP_GRAF_GraffitiRemoval,PROP,https://mayors24.cityofboston.gov/media/boston/report/photos/57f697cd696338e4faad738a/report.jpg,https://cityworker.cityofboston.gov:8443/attachments/report/57f69817d052905713a39679/closed_photo/Report.jpg,130 Newbury St  Boston  MA  02116,4.0,1C,8.0,D4,Back Bay,14.0,Ward 5,0507,RC,130 Newbury St,2116.0,Address,101339.0,42.351000000000006,-71.0766,Citizens Connect App,"(42.351, -71.0766)",-7912210.919317188,5213703.418017676
48211,101000790240,02/23/2013 11:39:26 AM,04/09/2013 11:39:26 AM,04/09/2013 01:33:59 PM,OVERDUE,Closed,Case Closed Case Resolved Thank you for the specification and product information - we will look at this product when putting together future contracts.,New Sign  Crosswalk or Pavement Marking,Transportation - Traffic Division,Signs & Signals,New Sign  Crosswalk or Pavement Marking,BTDT_Engineering_New Sign and Pavement Marking Requests,BTDT,,,INTERSECTION of Beacon St & Commonwealth Ave  Boston  MA,4.0,10A,8.0,D4,Fenway / Kenmore / Audubon Circle / Longwood,14.0,Ward 5,0510,,INTERSECTION Beacon St & Commonwealth Ave,,Intersection,1088.0,42.3488,-71.0971,Self Service,"(42.3488, -71.0971)",-7914492.968878451,5213372.040378293
215791,101000417402,05/04/2012 07:49:21 PM,08/02/2012 07:49:20 PM,05/07/2012 11:06:58 AM,ONTIME,Closed,Case Closed ADCLSD: Administratively Closed,Maintenance Complaint - Residential,Inspectional Services,Housing,Maintenance Complaint - Residential,ISD_Housing (INTERNAL),ISD,,,376-380 Centre St  Dorchester  MA  02122,7.0,07,3.0,C11,Dorchester,7.0,16,1604,A,376-380 Centre St,2122.0,Address,28426.0,42.3594,-71.0587,Constituent Call,"(0, 0)",-7910218.300431989,5214968.784796895
437330,101000331696,09/20/2011 11:18:53 AM,09/22/2011 11:18:53 AM,09/20/2011 11:22:00 AM,ONTIME,Closed,Case Closed Case Scheduled Items have been scheduled for pickup.,Schedule a Bulk Item Pickup,Public Works Department,Sanitation,Schedule a Bulk Item Pickup,PWDx_Schedule a Bulk Item Pickup,PWDx,,,9 Sackville St  Charlestown  MA  02129,3.0,1A,1.0,A15,Charlestown,2.0,Ward 2,0205,R1,9 Sackville St,2129.0,Address,120404.0,42.3807,-71.0649,Self Service,"(42.3807, -71.0649)",-7910908.481274907,5218178.151918457
515031,101001793765,05/19/2016 08:21:54 AM,05/23/2016 08:30:00 AM,05/19/2016 09:49:19 AM,ONTIME,Closed,Case Closed. Closed date : 2016-05-19 09:49:19.603 Case Noted cited for trash out early,Improper Storage of Trash (Barrels),Public Works Department,Code Enforcement,Improper Storage of Trash (Barrels),PWDx_Code Enforcement,PWDx,https://mayors24.cityofboston.gov/media/boston/report/photos/573dafdb0485273029ed64b3/photo_20160519_082137.jpg,,42 N Bennet St  Boston  MA  02113,3.0,1B,1.0,A1,Downtown / Financial District,3.0,Ward 3,0303,R4,42 N Bennet St,2113.0,Address,14399.0,42.3656,-71.0549,Citizens Connect App,"(42.3656, -71.0549)",-7909795.286366975,5215902.854497209
382670,101000432181,06/05/2012 09:18:08 AM,06/19/2012 09:18:08 AM,06/13/2012 07:43:39 AM,ONTIME,Closed,Case Closed Case Noted have made copy,Sign Repair,Transportation - Traffic Division,Signs & Signals,Sign Repair,BTDT_Traffic Signal_Repair,BTDT,,,329 Border St  East Boston  MA  02128,1.0,09,1.0,A7,East Boston,1.0,Ward 1,0107,CM,329 Border St,2128.0,Address,17023.0,42.3789,-71.0399,City Worker App,"(42.3789, -71.0399)",-7908125.494005076,5217906.895690465
470150,101001815047,06/14/2016 11:46:13 AM,06/14/2017 11:46:13 AM,11/07/2016 10:45:42 AM,ONTIME,Closed,Case Closed. Closed date : 2016-11-07 10:45:42.587 Case Resolved Tree was removed by North-Eastern Tree Service. A new tree request case will be made for this location. If you have any questions please call the Park Line at 617-635-7275.,Tree Maintenance Requests,Parks & Recreation Department,Trees,Tree Maintenance Requests,PARK_Tree Maintenance Request,PARK,https://cityworker.cityofboston.gov:8443/attachments/report/576026c3d05203d28ce95bae/photo/Report.jpg,,600 Norfolk St  Mattapan  MA  02126,8.0,07,4.0,B3,Greater Mattapan,9.0,Ward 18,1802,R2,600 Norfolk St,2126.0,Address,103393.0,42.2768,-71.092,City Worker App,"(42.2768, -71.092)",-7913925.239475405,5202533.347120292
211867,101001371818,05/06/2015 04:06:00 PM,11/02/2015 04:06:51 PM,,OVERDUE,Open,,Traffic Signal Repair,Transportation - Traffic Division,Signs & Signals,Traffic Signal Repair,INFO01_GenericeFormforOtherServiceRequestTypes,INFO,,,INTERSECTION of Arborway & Washington St  Jamaica Plain  MA,12.0,02,6.0,E13,Jamaica Plain,11.0,Ward 11,1108,,INTERSECTION Arborway & Washington St,,Intersection,514.0,42.3014,-71.1125,Self Service,"(42.3014, -71.1125)",-7916207.289036667,5206235.173119839
89312,101000974219,12/01/2013 02:33:14 PM,12/16/2013 08:30:00 AM,12/02/2013 09:54:18 AM,ONTIME,Closed,Case Closed Case Resolved Sticker on backside of Left lane must turn left sign has been removed by SD-6  12/2/13,Sign Repair,Transportation - Traffic Division,Signs & Signals,Sign Repair,BTDT_District 03,BTDT,,,1365 Boylston St  Boston  MA  02215,4.0,10A,8.0,D4,Fenway / Kenmore / Audubon Circle / Longwood,14.0,21,2101,C,1365 Boylston St,2215.0,Address,162491.0,42.3441,-71.1003,Citizens Connect App,"(42.3441, -71.1003)",-7914849.19124899,5212664.136092194
900509,101001984881,01/09/2017 02:07:00 PM,01/10/2017 02:07:18 PM,01/10/2017 08:46:00 AM,ONTIME,Closed,Case Closed. Closed date : 2017-01-10 08:46:00.91 Case Noted Street timed.,Parking Enforcement,Transportation - Traffic Division,Enforcement & Abandoned Vehicles,Parking Enforcement,BTDT_Parking Enforcement,BTDT,,,299 Maverick St  East Boston  MA  02128,1.0,09,1.0,A7,East Boston,1.0,Ward 1,0102,R3,299 Maverick St,2128.0,Address,93042.0,42.3672,-71.0327,Constituent Call,"(42.3672, -71.0327)",-7907323.993671365,5216143.919706318
171108,101001381901,05/20/2015 04:50:00 PM,05/21/2015 04:50:39 PM,05/21/2015 07:57:39 AM,ONTIME,Closed,Case Closed. Closed date : 2015-05-21 07:57:39.93 Case Noted Trash collected on 5/21/15.,Missed Trash: District 05,Public Works Department,Sanitation,Missed Trash/Recycling/Yard Waste/Bulk Item,PWDx_Missed Trash\Recycling\Yard Waste\Bulk Item,PWDx,,,33 G St  South Boston  MA  02127,6.0,05,2.0,C6,South Boston / South Boston Waterfront,5.0,Ward 6,0604,R1,33 G St,2127.0,Address,61607.0,42.3349,-71.0444,Constituent Call,"(42.3349, -71.0444)",-7908626.431713645,5211278.60427064
950013,101002034699,03/10/2017 01:29:51 PM,03/13/2017 01:29:51 PM,03/10/2017 01:46:46 PM,ONTIME,Closed,Case Closed. Closed date : 2017-03-10 13:46:46.827 Case Noted officer will patrol area,Parking Enforcement,Transportation - Traffic Division,Enforcement & Abandoned Vehicles,Parking Enforcement,BTDT_Parking Enforcement,BTDT,https://mayors24.cityofboston.gov/media/boston/report/photos/58c2f09b0485d8c35d6ed54e/photo_20170310_132628.jpg,,INTERSECTION of School St & Weld Ave  Jamaica Plain  MA,9.0,02,6.0,E13,Jamaica Plain,11.0,11,1105,,INTERSECTION School St & Weld Ave,,Intersection,16888.0,42.3594,-71.0587,Citizens Connect App,"(0, 0)",-7910218.300431989,5214968.784796895
489343,101001800613,05/27/2016 06:39:58 AM,05/31/2016 08:30:00 AM,05/27/2016 07:00:41 AM,ONTIME,Closed,Case Closed. Closed date : 2016-05-27 07:00:41.37 Case Resolved TV removed,Requests for Street Cleaning,Public Works Department,Street Cleaning,Requests for Street Cleaning,PWDx_District 07: South Dorchester,PWDx,https://cityworker.cityofboston.gov:8443/attachments/report/574823fbd05203d28ce82c19/photo/Report.jpg,https://cityworker.cityofboston.gov:8443/attachments/report/574823fbd05203d28ce82c19/closed_photo/Report.jpg,14 Roseland St  Dorchester  MA  02124,8.0,07,3.0,C11,Dorchester,8.0,Ward 16,1603,R1,14 Roseland St,2124.0,Address,118390.0,42.2912,-71.0638,City Worker App,"(42.2912, -71.0638)",-7910786.029835035,5204700.094208613
54932,101001662624,12/10/2015 12:19:00 PM,12/11/2015 12:19:35 PM,12/10/2015 12:34:58 PM,ONTIME,Closed,Case Closed. Closed date : 2015-12-10 12:34:58.507 Case Resolved Case Resolved. Stickers delivered 12/10.,Sticker Request,Public Works Department,Recycling,Sticker Request,PWDx_Sticker Request,PWDx,,https://cityworker.cityofboston.gov:8443/attachments/report/5669b495d052bf0ef15afe30/closed_photo/Report.jpg,25 Ruthven St  Dorchester  MA  02121,9.0,10B,7.0,B2,Roxbury,13.0,Ward 12,1208,R2,25 Ruthven St,2121.0,Address,120012.0,42.3136,-71.0923,Constituent Call,"(42.3136, -71.0923)",-7913958.635322642,5208071.574532718
945417,101002031068,03/06/2017 09:28:47 AM,03/09/2017 09:28:47 AM,03/06/2017 10:25:59 AM,ONTIME,Closed,Case Closed. Closed date : 2017-03-06 10:25:59.16 Case Resolved Cited for loose trash and overloaded barrels,Poor Conditions of Property,Public Works Department,Code Enforcement,Poor Conditions of Property,PWDx_Code Enforcement,PWDx,https://mayors24.cityofboston.gov/media/boston/report/photos/58bd721e0485380cc1777323/photo_20170306_092728.jpg,,14 Ditson St  Dorchester  MA  02122,7.0,03,3.0,C11,Dorchester,8.0,Ward 15,1508,R3,14 Ditson St,2122.0,Address,47808.0,42.3006,-71.0638,Citizens Connect App,"(42.3006, -71.0638)",-7910786.029835035,5206114.765787599
41660,101000444330,07/02/2012 07:53:50 PM,,07/05/2012 09:46:19 PM,ONTIME,Closed,Case Closed Bulk Item Automation,Schedule a Bulk Item Pickup,Public Works Department,Sanitation,Schedule a Bulk Item Pickup,PWDx_Schedule a Bulk Item Pickup,PWDx,,,3 Centre Pl  Roxbury  MA  02119,7.0,10B,7.0,B2,Roxbury,13.0,Ward 11,1101,R3,3 Centre Pl,2119.0,Address,27364.0,42.3294,-71.0948,Constituent Call,"(42.3294, -71.0948)",-7914236.934049626,5210450.394006891
439832,101000383727,02/13/2012 08:19:40 AM,03/12/2012 08:19:40 AM,02/14/2012 11:21:54 AM,ONTIME,Closed,Case Closed Case Closed in AVRS,Abandoned Vehicles,Transportation - Traffic Division,Enforcement & Abandoned Vehicles,Abandoned Vehicles,BTDT_Abandoned Bicycle,BTDT,,,310 Washington St  Boston  MA  02108,3.0,1C,1.0,A1,Downtown / Financial District,3.0,Ward 3,0306,E,310 Washington St,2108.0,Address,171036.0,42.357,-71.0584,Constituent Call,"(42.357, -71.0584)",-7910184.9045847505,5214607.234172679
564717,101001782363,05/04/2016 12:14:00 PM,,05/06/2016 04:32:48 PM,ONTIME,Closed,Case Closed. Closed date : 2016-05-06 16:32:48.437 Bulk Item Automation,Schedule a Bulk Item Pickup,Public Works Department,Sanitation,Schedule a Bulk Item Pickup,PWDx_Schedule a Bulk Item Pickup,PWDx,,,6 Althea St  Dorchester  MA  02122,8.0,07,3.0,C11,Dorchester,7.0,Ward 16,1604,R3,6 Althea St,2122.0,Address,177304.0,42.2941,-71.0589,Constituent Call,"(42.2941, -71.0589)",-7910240.564330147,5205136.512917814
422588,101001503427,08/04/2015 05:23:00 PM,,,ONTIME,Open,,Animal Generic Request,Animal Control,Animal Issues,Animal Generic Request,INFO01_GenericeFormforOtherServiceRequestTypes,INFO,,,35 Kirkwood Rd  Brighton  MA  02135,11.0,04,9.0,D14,Allston / Brighton,15.0,Ward 22,2209,CD,35 Kirkwood Rd,2135.0,Address,82144.0,42.3411,-71.1573,Constituent Call,"(42.3411, -71.1573)",-7921194.402224206,5212212.309962723
479725,101001909133,09/15/2016 12:56:00 AM,09/29/2016 08:30:00 AM,11/03/2016 12:52:04 AM,OVERDUE,Closed,Case Closed. Closed date : 2016-11-03 00:52:04.38 Case Resolved repplaced a ballast and 175 lamp,PRINTED : JK,Public Works Department,Street Lights,Street Light Outages,PWDx_Street Light Outages,PWDx,https://cityworker.cityofboston.gov:8443/attachments/report/57da29e3d0521ab38922fe11/photo/Report.jpg,https://cityworker.cityofboston.gov:8443/attachments/report/57da29e3d0521ab38922fe11/closed_photo/Report.jpg,INTERSECTION of Brattle Way & Cambridge St  Boston  MA,3.0,1B,2.0,A1,Downtown / Financial District,3.0,3,0306,,INTERSECTION Brattle Way & Cambridge St,,Intersection,9423.0,42.3594,-71.0587,City Worker App,"(0, 0)",-7910218.300431989,5214968.784796895
315378,101001116204,06/25/2014 04:43:53 PM,,01/26/2015 10:50:54 AM,ONTIME,Closed,Case Closed Case Resolved Intersection of Blue Hill Ave and Harvard St has been since fixed and roadway issue has been resolved.    Kevin Linskey  Senior Civil Engineer  Boston Public Works Department  617-635-4951 Office,Roadway Repair,Public Works Department,Highway Maintenance,Roadway Repair,PWDx_Roadway Repair,PWDx,,,INTERSECTION of Blue Hill Ave & Harvard St  Dorchester  MA,8.0,07,4.0,B3,Greater Mattapan,9.0,Ward 14,1409,,INTERSECTION Blue Hill Ave & Harvard St,,Intersection,1549.0,42.2948,-71.0881,Constituent Call,"(42.2948, -71.0881)",-7913491.0934613105,5205241.8583755465
821859,101000500903,10/31/2012 01:05:40 PM,11/02/2012 01:05:39 PM,11/01/2012 12:54:28 PM,ONTIME,Closed,Case Closed Case Resolved all set,Requests for Street Cleaning,Public Works Department,Street Cleaning,Requests for Street Cleaning,PWDx_District 09: East Boston,PWDx,,,111 Moore St  East Boston  MA  02128,1.0,09,1.0,A7,East Boston,1.0,Ward 1,0111,R2,111 Moore St,2128.0,Address,97205.0,42.3812,-71.0172,Constituent Call,"(42.3812, -71.0172)",-7905598.541564069,5218253.502250698
839869,101000944427,10/10/2013 11:27:24 AM,,10/11/2013 09:50:22 PM,ONTIME,Closed,Case Closed Bulk Item Automation,Schedule a Bulk Item Pickup,Public Works Department,Sanitation,Schedule a Bulk Item Pickup,PWDx_Schedule a Bulk Item Pickup,PWDx,,,48 Easton St  Allston  MA  02134,11.0,04,9.0,D14,Allston / Brighton,15.0,Ward 22,2201,R3,48 Easton St,2134.0,Address,50999.0,42.3597,-71.1308,Constituent Call,"(42.3597, -71.1308)",-7918244.435718183,5215013.979595871
559491,101000456606,07/27/2012 12:36:10 PM,07/31/2012 12:36:08 PM,07/27/2012 01:07:27 PM,ONTIME,Closed,Case Closed Case Resolved trash p-up i notified brian of placement of trash is against fence. believe it used to be placed where big tree used to be.,Missed Trash: District 1C,Public Works Department,Sanitation,Missed Trash/Recycling/Yard Waste/Bulk Item,PWDx_Missed Trash\Recycling\Yard Waste\Bulk Item,PWDx,,,180 W Canton St  Roxbury  MA  02118,4.0,1C,2.0,D4,South End,6.0,Ward 4,0401,R2,180 W Canton St,2118.0,Address,25598.0,42.3437,-71.07600000000001,Constituent Call,"(42.3437, -71.076)",-7912144.127622712,5212603.891362616
921071,101002002842,02/04/2017 12:55:59 PM,,02/09/2017 04:30:43 PM,ONTIME,Closed,Case Closed. Closed date : 2017-02-09 16:30:43.733 Bulk Item Automation,Schedule Bulk Item Pickup,Public Works Department,Sanitation,Schedule a Bulk Item Pickup SS,PWDx_Schedule a Bulk Item Pickup,PWDx,,,16 Fossdale Rd  Dorchester  MA  02124,8.0,07,3.0,C11,Dorchester,7.0,Ward 16,1608,R2,16 Fossdale Rd,2124.0,Address,59587.0,42.2856,-71.0599,Self Service,"(42.2856, -71.0599)",-7910351.883820941,5203857.411491817
698635,101000381029,02/03/2012 10:56:13 PM,02/20/2012 08:30:00 AM,02/03/2012 10:57:14 PM,ONTIME,Closed,Case Closed Case Resolved Lamp and refractor replaced,Street Light Outages,Public Works Department,Street Lights,Street Light Outages,PWDx_Street Light Outages,PWDx,,,56 Sigourney St  Jamaica Plain  MA  02130,9.0,02,6.0,E13,Jamaica Plain,11.0,Ward 11,1107,R1,56 Sigourney St,2130.0,Address,127362.0,42.3097,-71.0984,Employee Generated,"(42.3097, -71.0984)",-7914637.684216482,5207484.489477165
30757,101001399468,06/01/2015 08:43:15 AM,06/04/2015 08:43:15 AM,06/01/2015 10:11:24 AM,ONTIME,Closed,Case Closed. Closed date : 2015-06-01 10:11:24.103 Case Invalid Case made under wrong department. A new case will be made.,Building Inspection Request,Inspectional Services,Building,Building Inspection Request,ISD_Building (INTERNAL),ISD,,,410 Fenway   Boston  MA  02115,4.0,10A,8.0,B2,Boston,14.0,04,0410,,410 Fenway,2115.0,Address,341086.0,42.3414,-71.1035,Constituent Call,"(42.3414, -71.1035)",-7915205.413619528,5212257.49160554
942174,101002026687,02/27/2017 07:39:13 PM,03/01/2017 08:30:00 AM,03/01/2017 10:08:40 AM,OVERDUE,Closed,Case Closed. Closed date : 2017-03-01 10:08:40.357 Case Resolved Multiple pot holes patched at said location,Request for Pothole Repair,Public Works Department,Highway Maintenance,Request for Pothole Repair,PWDx_District 05: South Boston,PWDx,https://mayors24.cityofboston.gov/media/boston/report/photos/58b4c6b40485bf1c6616fa17/photo_20170227_193838.jpg,https://cityworker.cityofboston.gov:8443/attachments/report/58b4c6f4d052c51cc8fcc746/closed_photo/Report.jpg,306 Northern Ave  Boston  MA  02210,6.0,05,2.0,C6,South Boston / South Boston Waterfront,5.0,Ward 6,0601,,306 Northern Ave,2210.0,Address,156978.0,42.3469,-71.0342,Citizens Connect App,"(42.3469, -71.0342)",-7907490.972907553,5213085.859932039
774274,101000823480,04/17/2013 09:58:57 AM,,04/18/2013 09:46:46 PM,ONTIME,Closed,Case Closed Bulk Item Automation,Schedule a Bulk Item Pickup,Public Works Department,Sanitation,Schedule a Bulk Item Pickup,PWDx_Schedule a Bulk Item Pickup,PWDx,,,679 E Second St  South Boston  MA  02127,6.0,05,2.0,C6,South Boston / South Boston Waterfront,5.0,Ward 6,0605,R2,679 E Second St,2127.0,Address,124432.0,42.3372,-71.0361,Constituent Call,"(42.3372, -71.0361)",-7907702.479940061,5211624.968222012
682168,101001934367,10/19/2016 12:07:00 PM,11/28/2016 12:07:17 PM,,OVERDUE,Open,,Requests for Traffic Signal Studies or Reviews,Transportation - Traffic Division,Traffic Management & Engineering,Requests for Traffic Signal Studies or Reviews,PWDx_Roadway Repair_Reconstruction,PWDx,,,INTERSECTION of Causeway St & Lomasney Way  Boston  MA,3.0,1B,2.0,A1,Downtown / Financial District,3.0,3,0306,,INTERSECTION Causeway St & Lomasney Way,,Intersection,16461.0,42.3594,-71.0587,Constituent Call,"(0, 0)",-7910218.300431989,5214968.784796895
37938,101001796177,05/22/2016 12:03:00 PM,,,ONTIME,Open,,Animal Generic Request,Animal Control,Animal Issues,Animal Generic Request,INFO01_GenericeFormforOtherServiceRequestTypes,INFO,,,66 Whiting St  Roxbury  MA  02119,7.0,10B,7.0,B2,Roxbury,13.0,Ward 12,1201,R2,66 Whiting St,2119.0,Address,171796.0,42.3252,-71.0795,Constituent Call,"(42.3252, -71.0795)",-7912533.745840489,5209817.991295996
263535,101000299683,07/11/2011 11:13:54 AM,07/25/2011 11:13:54 AM,08/07/2011 01:50:05 PM,OVERDUE,Closed,Case Closed Case Resolved work completed by highway construction unit,Graffiti Removal - Paint - light pole - Charlestown,Public Works Department,Street Lights,Street Light Outages,PWDx_Highway Construction,PWDx,,,42 Winthrop St  Charlestown  MA  02129,3.0,1A,1.0,A15,Charlestown,2.0,Ward 2,0203,R3,42 Winthrop St,2129.0,Address,337747.0,42.3745,-71.0608,Self Service,"(42.3745, -71.0608)",-7910452.071362655,5217243.8576436965
451613,101001302996,02/18/2015 06:44:24 AM,02/20/2015 08:30:00 AM,03/10/2015 01:44:18 PM,OVERDUE,Closed,Case Closed Case Resolved,Request for Snow Plowing,Public Works Department,Street Cleaning,Request for Snow Plowing,PWDx_District 07: South Dorchester,PWDx,,,143 Colorado St  Mattapan  MA  02126,8.0,07,5.0,B3,Greater Mattapan,9.0,Ward 18,1803,R1,143 Colorado St,2126.0,Address,34936.0,42.2755,-71.1018,Constituent Call,"(42.2755, -71.1018)",-7915016.170485178,5202337.762377154
211294,101000500896,10/31/2012 12:59:16 PM,,11/06/2012 10:16:38 AM,ONTIME,Closed,Case Closed Bulk Item Automation,Schedule a Bulk Item Pickup,Public Works Department,Sanitation,Schedule a Bulk Item Pickup,PWDx_Schedule a Bulk Item Pickup,PWDx,,,16 Gladstone St  East Boston  MA  02128,1.0,09,1.0,A7,East Boston,1.0,Ward 1,0113,R1,16 Gladstone St,2128.0,Address,63822.0,42.388999999999996,-71.0004,Self Service,"(42.389, -71.0004)",-7903728.374118741,5219429.045136185
737445,101000494102,10/18/2012 01:59:19 PM,,10/26/2012 09:41:37 PM,ONTIME,Closed,Case Closed Bulk Item Automation,Schedule a Bulk Item Pickup,Public Works Department,Sanitation,Schedule a Bulk Item Pickup,PWDx_Schedule a Bulk Item Pickup,PWDx,,,16 Florida St  Dorchester  MA  02124,8.0,07,3.0,C11,Dorchester,7.0,Ward 16,1604,R1,16 Florida St,2124.0,Address,58942.0,42.2919,-71.0599,Self Service,"(42.2919, -71.0599)",-7910351.883820941,5204805.434815889
71507,101001352687,04/09/2015 09:31:09 AM,04/10/2015 09:31:08 AM,04/10/2015 10:26:45 AM,OVERDUE,Closed,Case Closed Case Resolved trash picked up,Requests for Street Cleaning,Public Works Department,Street Cleaning,Requests for Street Cleaning,PWDx_District 1B: North End,PWDx,https://mayors24.cityofboston.gov/media/boston/report/photos/55267f110485b083536d914c/photo_20150409_092840.jpg,https://cityworker.cityofboston.gov:8443/attachments/report/55267f2970b4685d4efd9415/closed_photo/Report.jpg,INTERSECTION of Anderson St & Champney Pl  Boston  MA,3.0,1B,8.0,A1,Beacon Hill,14.0,Ward 5,0504,,INTERSECTION Anderson St & Champney Pl,,Intersection,437.0,42.3599,-71.0678,Citizens Connect App,"(42.3599, -71.0678)",-7911231.307798209,5215044.10958173
879652,101001372272,05/07/2015 09:46:54 AM,05/08/2015 09:46:54 AM,05/07/2015 09:46:55 AM,ONTIME,Closed,Case Closed. Closed date : 2015-05-07 09:46:55.947 Case Resolved Marked completed at case creation,Requests for Street Cleaning,Public Works Department,Street Cleaning,Requests for Street Cleaning,PWDx_District 06: West Roxbury and Roslindale,PWDx,https://cityworker.cityofboston.gov:8443/attachments/report/554b6cced0526762dace4173/photo/Report.jpg,,667 Lagrange St  West Roxbury  MA  02132,12.0,06,6.0,E5,West Roxbury,12.0,Ward 20,2017,R1,667 Lagrange St,2132.0,Address,82866.0,42.2883,-71.1658,City Worker App,"(42.2883, -71.1658)",-7922140.617895949,5204263.695592314
18368,101001328976,03/10/2015 12:04:38 PM,07/08/2015 12:04:37 PM,03/16/2015 03:31:23 PM,ONTIME,Closed,Case Closed :,Unsatisfactory Living Conditions,Inspectional Services,Housing,Unsatisfactory Living Conditions,ISD_Housing (INTERNAL),ISD,,,40 Boutwell St  Dorchester  MA  02122,8.0,07,3.0,C11,Dorchester,7.0,Ward 16,1607,R2,40 Boutwell St,2122.0,Address,191491.0,42.291000000000004,-71.05199999999999,Constituent Call,"(42.291, -71.052)",-7909472.459843673,5204669.997107275
798198,101001547991,09/02/2015 11:57:38 AM,09/03/2015 11:57:38 AM,09/02/2015 11:57:40 AM,ONTIME,Closed,Case Closed. Closed date : 2015-09-02 11:57:40.207 Case Resolved Marked completed at case creation,Requests for Street Cleaning,Public Works Department,Street Cleaning,Requests for Street Cleaning,PWDx_District 1C: Downtown,PWDx,https://cityworker.cityofboston.gov:8443/attachments/report/55e71c94d052f8c25f1ddbe7/photo/Report.jpg,,INTERSECTION of Berkeley St & Chandler St  Boston  MA,4.0,1C,2.0,D4,South End,6.0,Ward 5,0501,,INTERSECTION Berkeley St & Chandler St,,Intersection,1360.0,42.347,-71.071,City Worker App,"(42.347, -71.071)",-7911587.530168747,5213100.9218451455
430969,101001728081,03/02/2016 07:47:00 AM,,,ONTIME,Open,,Animal Generic Request,Animal Control,Animal Issues,Animal Generic Request,INFO01_GenericeFormforOtherServiceRequestTypes,INFO,,,512 E Sixth St  South Boston  MA  02127,6.0,05,2.0,C6,South Boston / South Boston Waterfront,5.0,Ward 6,0606,R1,512 E Sixth St,2127.0,Address,127596.0,42.3332,-71.0401,Constituent Call,"(42.3332, -71.0401)",-7908147.757903233,5211022.604274031
878757,101000338895,10/06/2011 09:52:25 AM,,10/06/2011 09:52:25 AM,ONTIME,Closed,Case Closed Internal Case Performed by Highway Maintenance crew.,Pothole Repair (Internal),Public Works Department,Highway Maintenance,Pothole Repair (Internal),PWDx_District 07: South Dorchester,PWDx,,,449 Norfolk St  Mattapan  MA  02126,8.0,07,4.0,B3,Greater Mattapan,9.0,Ward 14,1405,R3,449 Norfolk St,2126.0,Address,103330.0,42.281000000000006,-71.0879,Employee Generated,"(42.281, -71.0879)",-7913468.829563153,5203165.263866441
354337,101000351618,11/07/2011 02:27:51 PM,11/08/2011 02:27:51 PM,11/07/2011 02:27:59 PM,ONTIME,Closed,Case Closed Internal Case,Pick up Dead Animal,Public Works Department,Street Cleaning,Pick up Dead Animal,PWDx_District 1B: North End,PWDx,,,236-238 Commercial St  Boston  MA  02109,3.0,1B,1.0,A1,Downtown / Financial District,3.0,Ward 3,0301,CM,236-238 Commercial St,2109.0,Address,36249.0,42.3638,-71.0515,Employee Generated,"(42.3638, -71.0515)",-7909416.800098279,5215631.663475561
51639,101000911638,08/27/2013 06:43:16 PM,09/11/2013 08:30:00 AM,09/17/2013 08:16:24 AM,OVERDUE,Closed,Case Closed Case Resolved,Sign Repair,Transportation - Traffic Division,Signs & Signals,Sign Repair,BTDT_Sign Shop_Sign Installation,BTDT,,,165 Dartmouth St  Boston  MA  02116,4.0,1C,2.0,D4,Back Bay,6.0,Ward 4,0402,E,165 Dartmouth St,2116.0,Address,46318.0,42.348,-71.0758,Citizens Connect App,"(42.348, -71.0758)",-7912121.863724554,5213251.542294016
463111,101001667448,12/17/2015 11:04:00 AM,,,ONTIME,Open,,Other: Complaint,Mayor's 24 Hour Hotline,Employee & General Comments,General Comments For An Employee,INFO_General Comments Complaints Compliments,INFO,,,280-282 Hanover St  Boston  MA  02113,3.0,1B,1.0,A1,Downtown / Financial District,3.0,Ward 3,0303,RC,280-282 Hanover St,2113.0,Address,69079.0,42.3639,-71.0546,Constituent Call,"(42.3639, -71.0546)",-7909761.890519735,5215646.729439592
493420,101001517976,08/11/2015 09:34:00 AM,08/12/2015 09:34:34 AM,08/11/2015 09:55:28 AM,ONTIME,Closed,Case Closed. Closed date : 2015-08-11 09:55:28.85 Case Noted on inspection of above address MYW was on private property @ 9:55am,Missed Leaf or Yard Trash: District 08,Public Works Department,Sanitation,Missed Trash/Recycling/Yard Waste/Bulk Item,PWDx_Missed Trash\Recycling\Yard Waste\Bulk Item,PWDx,,https://cityworker.cityofboston.gov:8443/attachments/report/55c9fa2ad052094b35920626/closed_photo/Report.jpg,77 Prospect St  Hyde Park  MA  02136,12.0,08,5.0,E18,Hyde Park,10.0,Ward 18,1816,R1,77 Prospect St,2136.0,Address,113501.0,42.2465,-71.1144,Constituent Call,"(42.2465, -71.1144)",-7916418.796069175,5197975.766456062
694483,101000877679,07/11/2013 03:24:39 PM,,07/19/2013 09:45:46 PM,ONTIME,Closed,Case Closed Bulk Item Automation,Schedule a Bulk Item Pickup,Public Works Department,Sanitation,Schedule a Bulk Item Pickup,PWDx_Schedule a Bulk Item Pickup,PWDx,,,26 Westford St  Allston  MA  02134,11.0,04,9.0,D14,Allston / Brighton,15.0,Ward 22,2202,R2,26 Westford St,2134.0,Address,334612.0,42.3625,-71.1343,Constituent Call,"(42.3625, -71.1343)",-7918634.05393596,5215435.808125316
60377,101001757089,03/30/2016 01:32:00 PM,04/06/2016 01:32:46 PM,03/31/2016 02:23:19 PM,ONTIME,Closed,Case Closed. Closed date : 2016-03-31 14:23:19.873 Case Resolved ball crew scarafied lined & added clay to field done 3-31-16,Ground Maintenance: Olmsted Park,Parks & Recreation Department,Park Maintenance & Safety,Ground Maintenance,PARK_Maintenance_Region 2,PARK,,,217 Jamaicaway  Jamaica Plain  MA  02130,9.0,10A,8.0,E13,Jamaica Plain,11.0,10,1008,E,217 Jamaicaway,2130.0,Address,79404.0,42.3262,-71.1143,Employee Generated,"(42.3262, -71.1143)",-7916407.664120094,5209968.559540384
688815,101000983900,12/16/2013 02:33:11 PM,12/16/2015 02:33:00 PM,02/03/2014 07:36:54 AM,ONTIME,Closed,Case Closed Duplicate of Existing Case duplicate of case 979050,Sidewalk Repair/Red Brick/Beacon Hill,Public Works Department,Highway Maintenance,Sidewalk Repair,PWDx_Highway Construction,PWDx,,,INTERSECTION of Garden St & Revere St  Boston  MA,3.0,1B,8.0,A1,Beacon Hill,14.0,Ward 5,0504,,INTERSECTION Garden St & Revere St,,Intersection,5205.0,42.3596,-71.0668,Employee Generated,"(42.3596, -71.0668)",-7911119.988307414,5214998.914638905
811550,101001620473,10/26/2015 12:19:00 PM,10/28/2015 12:19:24 PM,11/04/2015 03:29:55 PM,OVERDUE,Closed,Case Closed. Closed date : 2015-11-04 15:29:55.423 ADCLSD: Administratively Closed,Work w/out Permit,Inspectional Services,Building,Work w/out Permit,ISD_Building (INTERNAL),ISD,,,INTERSECTION of Greenwich St & Westminster St  Mission Hill  MA,7.0,10B,7.0,D4,Roxbury,13.0,Ward 9,0903,,INTERSECTION Greenwich St & Westminster St,,Intersection,5471.0,42.3353,-71.0831,Constituent Call,"(42.3353, -71.0831)",-7912934.496007345,5211338.840569625
871366,101000483482,09/24/2012 11:15:44 AM,,09/28/2012 09:43:01 PM,ONTIME,Closed,Case Closed Bulk Item Automation,Schedule a Bulk Item Pickup,Public Works Department,Sanitation,Schedule a Bulk Item Pickup,PWDx_Schedule a Bulk Item Pickup,PWDx,,,28R Westford St  Allston  MA  02134,11.0,04,9.0,D14,Allston / Brighton,15.0,Ward 22,2202,R2,28R Westford St,2134.0,Address,171748.0,42.3627,-71.1342,Employee Generated,"(42.3627, -71.1342)",-7918622.921986882,5215465.939453891
930732,101002013425,02/14/2017 04:20:05 PM,02/16/2017 04:20:05 PM,02/16/2017 11:28:35 PM,OVERDUE,Closed,Case Closed. Closed date : 2017-02-16 23:28:35.04 Case Resolved No code violation found sidewalk was shoveled,Unshoveled Sidewalk,Public Works Department,Code Enforcement,Unshoveled Sidewalk,PWDx_Code Enforcement,PWDx,https://mayors24.cityofboston.gov/media/boston/report/photos/58a374800485cf780cfc8484/report.jpg,https://cityworker.cityofboston.gov:8443/attachments/report/58a374e0d052e81b93e5f166/closed_photo/Report.jpg,INTERSECTION of Weld Hill St & Hyde Park Ave  Jamaica Plain  MA,12.0,02,6.0,E13,Jamaica Plain,10.0,19,1907,,INTERSECTION Weld Hill St & Hyde Park Ave,,Intersection,13465.0,42.3594,-71.0587,Citizens Connect App,"(0, 0)",-7910218.300431989,5214968.784796895
747849,101000356511,11/22/2011 10:54:48 AM,11/24/2011 10:54:48 AM,11/23/2011 02:28:03 PM,ONTIME,Closed,Case Closed Case Resolved patched by dist 1,Request for Pothole Repair,Public Works Department,Highway Maintenance,Request for Pothole Repair,PWDx_District 1C: Downtown,PWDx,,,115 Southampton St  Roxbury  MA  02118,6.0,1C,7.0,C6,Roxbury,13.0,8,0806,E,115 Southampton St,2118.0,Address,129060.0,42.3317,-71.0695,Constituent Call,"(42.3317, -71.0695)",-7911420.550932556,5210796.727670389
839942,101001542888,08/28/2015 09:35:33 AM,,09/04/2015 01:26:57 PM,ONTIME,Closed,Case Closed. Closed date : 2015-09-04 13:26:57.15 Bulk Item Automation,Schedule Bulk Item Pickup,Public Works Department,Sanitation,Schedule a Bulk Item Pickup SS,PWDx_Schedule a Bulk Item Pickup,PWDx,,,40 Westford St  Allston  MA  02134,11.0,04,9.0,D14,Allston / Brighton,15.0,Ward 22,2202,R2,40 Westford St,2134.0,Address,148239.0,42.3622,-71.1336,Self Service,"(42.3622, -71.1336)",-7918556.130292404,5215390.611312296
744826,101001763796,04/08/2016 09:11:05 AM,,07/05/2016 11:32:13 AM,ONTIME,Closed,Case Closed. Closed date : 2016-07-05 11:32:13.83 Case Resolved The bike was not found at this location when a team from the Boston Transportation department went to remove it. If the problem persists or if you have any questions  please feel free to contact us through BOS:311.,Abandoned Bicycle,Mayor's 24 Hour Hotline,Abandoned Bicycle,Abandoned Bicycle,BTDT_Abandoned Bicycle,BTDT,https://cityworker.cityofboston.gov:8443/attachments/report/5707ade7d052d8b242571867/photo/Report.jpg,,565 Columbus Ave  Roxbury  MA  02118,4.0,1C,7.0,D4,South End,6.0,Ward 4,0404,CD,565 Columbus Ave,2118.0,Address,35997.0,42.3411,-71.0815,City Worker App,"(42.3411, -71.0815)",-7912756.384822076,5212212.309962723
145576,101000967514,11/18/2013 12:58:31 PM,,11/26/2013 09:45:56 PM,ONTIME,Closed,Case Closed Bulk Item Automation,Schedule a Bulk Item Pickup,Public Works Department,Sanitation,Schedule a Bulk Item Pickup,PWDx_Schedule a Bulk Item Pickup,PWDx,,,54 Colonial Ave  Dorchester  MA  02124,8.0,07,4.0,B3,Dorchester,9.0,Ward 17,1705,R3,54 Colonial Ave,2124.0,Address,34883.0,42.2902,-71.0771,Constituent Call,"(42.2902, -71.0771)",-7912266.579062585,5204549.609657571
339865,101000383749,02/13/2012 08:26:49 AM,,02/13/2012 08:26:49 AM,ONTIME,Closed,Case Closed Internal Case Performed by Highway Maintenance crew.,Pothole Repair (Internal),Public Works Department,Highway Maintenance,Pothole Repair (Internal),PWDx_District 1C: Downtown,PWDx,,,INTERSECTION of Dartmouth St & Newbury St  Boston  MA,4.0,1C,8.0,D4,Back Bay,14.0,Ward 5,0507,,INTERSECTION Dartmouth St & Newbury St,,Intersection,3913.0,42.3509,-71.0777,Employee Generated,"(42.3509, -71.0777)",-7912333.37075706,5213688.355146083
490917,101001559779,09/03/2015 08:40:04 PM,09/08/2015 08:30:00 AM,09/03/2015 09:04:55 PM,ONTIME,Closed,Case Closed. Closed date : 2015-09-03 21:04:55.207 Case Resolved this vehicle has been tagged officer just called it in,Parking Enforcement,Transportation - Traffic Division,Enforcement & Abandoned Vehicles,Parking Enforcement,BTDT_Parking Enforcement,BTDT,https://mayors24.cityofboston.gov/media/boston/report/photos/55e8e86d6963c98f05b56ab0/report.jpg,,9 Buswell St  Boston  MA  02215,4.0,10A,8.0,D4,Fenway / Kenmore / Audubon Circle / Longwood,14.0,Ward 21,2102,A,9 Buswell St,2215.0,Address,24332.0,42.3479,-71.1049,Citizens Connect App,"(42.3479, -71.1049)",-7915361.260906639,5213236.480141306
628291,101001312166,02/23/2015 11:29:34 AM,02/25/2015 11:29:33 AM,04/13/2015 05:12:32 PM,OVERDUE,Closed,Case Closed Case Noted Thank you for your request. This service request is now considered closed due to the recent arrival of Spring. The City worked around the clock this winter to address the record-breaking snowfall and we hope that many of your concerns were resolved. We encourage you to let us know of any additional issues and thank you for working with us to make the City a better place. Thank you for your patience and we apologize for any requests that we were not able to get to.,Request for Snow Plowing,Public Works Department,Street Cleaning,Request for Snow Plowing,PWDx_District 03: North Dorchester,PWDx,,,INTERSECTION of Grant Rd & Rosseter St  Dorchester  MA,7.0,03,4.0,C11,Dorchester,8.0,Ward 14,1404,,INTERSECTION Grant Rd & Rosseter St,,Intersection,5420.0,42.3039,-71.0751,Constituent Call,"(42.3039, -71.0751)",-7912043.940080999,5206611.455893816
419290,101001708273,02/04/2016 07:47:00 AM,04/04/2016 07:47:00 AM,03/04/2016 02:59:29 PM,ONTIME,Closed,"Case Closed. Closed date : 2016-03-04 14:59:29.683 Case Resolved REMOVED OLD CAST IRON BASE SECTION AND REPLACED 14'2"" STEEL ACORN POLE W/SLIP OVER BASE ALL HARDWARE AND L.E.D. FIXTURE AND TIED IN  H.TYRA/ G. Mc CARTHY / J.FELDER",PRINTED,Public Works Department,Street Lights,Knockdown Replacement,PWDx_Street Light Knockdown Replacement,PWDx,,,1277 River St  Hyde Park  MA  02136,12.0,08,5.0,E18,Hyde Park,10.0,Ward 18,1813,C,1277 River St,2136.0,Address,157510.0,42.256,-71.1243,Employee Generated,"(42.256, -71.1243)",-7917520.859028028,5199404.475216528
30918,101001012872,01/27/2014 12:10:49 PM,,01/27/2014 12:10:50 PM,ONTIME,Closed,Case Closed Internal Case Performed by Highway Maintenance crew.,Pothole Repair (Internal),Public Works Department,Highway Maintenance,Pothole Repair (Internal),PWDx_District 02: Jamaica Plain,PWDx,,,INTERSECTION of Centre St & Eliot St  Jamaica Plain  MA,9.0,02,6.0,E13,Jamaica Plain,11.0,Ward 19,1909,,INTERSECTION Centre St & Eliot St,,Intersection,2668.0,42.3097,-71.1155,Employee Generated,"(42.3097, -71.1155)",-7916541.247509046,5207484.489477165
629527,101001216678,11/13/2014 12:50:09 PM,,,ONTIME,Open,,Animal Generic Request,Animal Control,Animal Issues,Animal Generic Request,INFO01_GenericeFormforOtherServiceRequestTypes,INFO,,,67 Sprague St  Hyde Park  MA  02136,12.0,08,5.0,E18,Hyde Park,10.0,Ward 18,1820,I,67 Sprague St,2136.0,Address,129445.0,42.2351,-71.138,Constituent Call,"(42.2351, -71.138)",-7919045.936051896,5196261.599908728
657590,101001410540,06/16/2015 11:12:52 AM,06/30/2015 11:12:52 AM,,OVERDUE,Open,,Other: Complaint,Mayor's 24 Hour Hotline,Employee & General Comments,General Comments For a Program or Policy,INFO_General Comments Complaints Compliments,INFO,,,,,,,,,,,,,,,,,42.3594,-71.0587,Constituent Call,"(0, 0)",-7910218.300431989,5214968.784796895
366340,101001267498,02/02/2015 01:27:53 PM,02/04/2015 01:27:53 PM,02/12/2015 05:37:02 PM,OVERDUE,Closed,Case Closed Case Noted Snow has been removed.,Request for Snow Plowing,Public Works Department,Street Cleaning,Request for Snow Plowing,PWDx_District 08: Hyde Park,PWDx,,,31 Orchard St  Mattapan  MA  02126,8.0,08,5.0,E18,Hyde Park,10.0,Ward 18,1806,R1,31 Orchard St,2126.0,Address,105423.0,42.266999999999996,-71.1084,Constituent Call,"(42.267, -71.1084)",-7915750.879124414,5201059.0384738
189250,101001868412,07/26/2016 01:08:00 PM,08/25/2016 01:08:53 PM,07/27/2016 12:52:30 PM,ONTIME,Closed,Case Closed. Closed date : 2016-07-27 12:52:30.083 VIOCOR: Violation Corrected,Rodent Activity,Inspectional Services,Environmental Services,Rodent Activity,ISD_Environmental Services (INTERNAL),ISD,,,1961 Commonwealth Ave  Brighton  MA  02135,11.0,04,9.0,D14,Brighton,15.0,21,2116,A,1961 Commonwealth Ave,2135.0,Address,216223.0,42.3397,-71.1572,Citizens Connect App,"(42.3397, -71.1572)",-7921183.270275126,5212001.465146543
579941,101001286595,02/10/2015 06:06:20 PM,02/13/2015 08:30:00 AM,02/11/2015 01:31:49 PM,ONTIME,Closed,Case Closed Case Noted Other half of street collected on 2/11/15.,Missed Trash: District 03,Public Works Department,Sanitation,Missed Trash/Recycling/Yard Waste/Bulk Item,PWDx_Missed Trash\Recycling\Yard Waste\Bulk Item,PWDx,,,35 Larchmont St  Dorchester  MA  02124,7.0,03,4.0,C11,Dorchester,8.0,Ward 17,1702,R2,35 Larchmont St,2124.0,Address,84073.0,42.297,-71.0692,Constituent Call,"(42.297, -71.0692)",-7911387.155085318,5205572.951722887
643330,101001782917,05/05/2016 09:28:00 AM,08/03/2016 09:28:52 AM,05/31/2016 10:44:19 AM,ONTIME,Closed,Case Closed. Closed date : 2016-05-31 10:44:19.847 :,Chronic Dampness/Mold,Inspectional Services,Housing,Chronic Dampness/Mold,ISD_Housing (INTERNAL),ISD,,,11 B St  South Boston  MA  02127,6.0,05,2.0,C6,South Boston / South Boston Waterfront,5.0,Ward 6,0601,E,11 B St,2127.0,Address,181055.0,42.3384,-71.0565,Constituent Call,"(42.3384, -71.0565)",-7909973.397552243,5211805.684877746
740869,101001544914,08/31/2015 09:40:00 AM,12/29/2015 09:40:35 AM,,OVERDUE,Open,,Pest Infestation - Residential,Inspectional Services,Housing,Pest Infestation - Residential,ISD_Housing (INTERNAL),ISD,https://mayors24.cityofboston.gov/media/boston/report/photos/55e4596c048566833724d213/report.jpg,,348 Saratoga St  East Boston  MA  02128,1.0,09,1.0,A7,East Boston,1.0,Ward 1,0110,R3,348 Saratoga St,2128.0,Address,122624.0,42.379,-71.0305,Citizens Connect App,"(42.379, -71.0305)",-7907079.090791618,5217921.965276913
667427,101001107116,06/11/2014 09:14:58 AM,06/12/2014 09:14:57 AM,06/27/2014 10:42:53 AM,OVERDUE,Closed,Case Closed VIOISS: Violation Filed,Unsafe/Dangerous Conditions,Inspectional Services,Building,Unsafe Dangerous Conditions,ISD_Building (INTERNAL),ISD,,,75 Homestead St  Dorchester  MA  02121,9.0,10B,7.0,B2,Roxbury,13.0,Ward 12,1209.0,R3,75 Homestead St,2121.0,Address,75138.0,42.3121,-71.0914,Constituent Call,"(42.3121, -71.0914)",-7913858.447780928,5207845.768283258
434174,101000965849,11/15/2013 08:00:52 AM,11/19/2013 08:30:00 AM,11/15/2013 08:06:27 AM,ONTIME,Closed,Case Closed Case Resolved LATE PUT OUT TRASHPICK UP .11/15/13,Missed Trash: District 06,Public Works Department,Sanitation,Missed Trash/Recycling/Yard Waste/Bulk Item,PWDx_Missed Trash\Recycling\Yard Waste\Bulk Item,PWDx,,,903 South St  Roslindale  MA  02131,9.0,06,5.0,E5,Roslindale,10.0,Ward 20,2001,R1,903 South St,2131.0,Address,129000.0,42.2886,-71.1354,Self Service,"(42.2886, -71.1354)",-7918756.505375833,5204308.83934507
819049,101001757237,03/30/2016 04:07:03 PM,03/31/2016 04:07:03 PM,03/30/2016 04:29:42 PM,ONTIME,Closed,Case Closed. Closed date : 2016-03-30 16:29:42.66 Case Resolved officer found no violations,Parking Enforcement,Transportation - Traffic Division,Enforcement & Abandoned Vehicles,Parking Enforcement,BTDT_Parking Enforcement,BTDT,,,34 Isabella St  Boston  MA  02116,4.0,1C,2.0,A1,Back Bay,6.0,Ward 5,0501,A,34 Isabella St,2116.0,Address,79022.0,42.3486,-71.0708,Citizens Connect App,"(42.3486, -71.0708)",-7911565.266270587,5213341.9157134555
291656,101001844399,06/24/2016 05:42:00 PM,06/28/2016 08:30:00 AM,06/26/2016 10:42:30 AM,ONTIME,Closed,Case Closed. Closed date : 2016-06-26 10:42:30.003 Case Noted Cited for loose trash & debris on front lawn,Illegal Dumping,Public Works Department,Code Enforcement,Illegal Dumping,PWDx_Code Enforcement,PWDx,,https://cityworker.cityofboston.gov:8443/attachments/report/576da973d05250cfcde32b0e/closed_photo/Report.jpg,68 Mcbride St  Jamaica Plain  MA  02130,9.0,02,6.0,E13,Jamaica Plain,11.0,Ward 11,1109,R3,68 Mcbride St,2130.0,Address,93412.0,42.3062,-71.1126,Constituent Call,"(42.3062, -71.1126)",-7916218.420985746,5206957.649242574
906272,101001990916,01/18/2017 08:38:27 AM,,01/18/2017 08:41:55 AM,ONTIME,Closed,Case Closed. Closed date : 2017-01-18 08:41:55.88 Case Invalid,Schedule a Bulk Item Pickup,Public Works Department,Sanitation,Schedule a Bulk Item Pickup,PWDx_Schedule a Bulk Item Pickup,PWDx,,,405 E Fifth St  South Boston  MA  02127,6.0,05,2.0,C6,South Boston / South Boston Waterfront,5.0,Ward 7,0703,R2,405 E Fifth St,2127.0,Address,389723.0,42.3337,-71.0434,Constituent Call,"(42.3337, -71.0434)",-7908515.112222852,5211097.897672368
736826,101001213729,11/07/2014 08:26:14 PM,12/22/2014 08:26:14 PM,11/07/2014 10:19:00 PM,ONTIME,Closed,Case Closed Case Resolved no problem found,General Lighting Request,Public Works Department,Street Lights,General Lighting Request,PWDx_Street Light_General Lighting Request,PWDx,,,896 Beacon St  Boston  MA  02215,4.0,10A,8.0,D4,Fenway / Kenmore / Audubon Circle / Longwood,14.0,Ward 21,2101,C,896 Beacon St,2215.0,Address,12368.0,42.347,-71.1056,Maximo Integration,"(42.347, -71.1056)",-7915439.184550193,5213100.9218451455
230558,101000450279,07/16/2012 12:04:42 PM,,07/18/2012 09:47:29 PM,ONTIME,Closed,Case Closed Bulk Item Automation,Schedule a Bulk Item Pickup,Public Works Department,Sanitation,Schedule a Bulk Item Pickup,PWDx_Schedule a Bulk Item Pickup,PWDx,,,31 Standard St  Mattapan  MA  02126,8.0,07,4.0,B3,Greater Mattapan,9.0,Ward 18,1801,R3,31 Standard St,2126.0,Address,313861.0,42.273,-71.0786,Self Service,"(42.273, -71.0786)",-7912433.558298774,5201961.649210367
816309,101001110030,06/17/2014 09:36:08 AM,,06/23/2014 04:37:27 PM,ONTIME,Closed,Case Closed Bulk Item Automation,Schedule a Bulk Item Pickup,Public Works Department,Sanitation,Schedule a Bulk Item Pickup,PWDx_Schedule a Bulk Item Pickup,PWDx,,,11 Hardwick St  Brighton  MA  02135,11.0,04,9.0,D14,Allston / Brighton,15.0,Ward 22,2207,R1,11 Hardwick St,2135.0,Address,69452.0,42.3547,-71.1666,Constituent Call,"(42.3547, -71.1666)",-7922229.673488583,5214260.761114648
532559,101001308499,02/20/2015 11:23:37 AM,02/23/2015 11:23:37 AM,02/20/2015 11:23:38 AM,ONTIME,Closed,Case Closed Case Resolved Marked completed at case creation,Request for Pothole Repair,Public Works Department,Highway Maintenance,Request for Pothole Repair,PWDx_District 04: Allston/Brighton,PWDx,https://cityworker.cityofboston.gov:8443/attachments/report/54e75f87d052841a638fe7e0/photo/Report.jpg,,1955-1975 Beacon St  Brighton  MA  02135,11.0,04,9.0,D14,Allston / Brighton,15.0,Ward 21,2114,C,1955-1975 Beacon St,2135.0,Address,10044.0,42.3358,-71.1499,City Worker App,"(42.3358, -71.1499)",-7920370.6379923355,5211414.136482129
286825,101001542708,08/28/2015 07:31:00 AM,10/12/2015 07:31:00 AM,08/28/2015 02:54:41 PM,ONTIME,Closed,Case Closed. Closed date : 2015-08-28 14:54:41.847 Case Resolved INSTALLED POLE AND FIXTURE AND TIED IN  H.TYRA /G.McCARTHY / J.PETERSON / B.GETCHEL,PRINTED,Public Works Department,Street Lights,General Lighting Request,PWDx_Street Light_General Lighting Request,PWDx,,,INTERSECTION of Farragut Rd & E First St  South Boston  MA,6.0,05,2.0,C6,South Boston / South Boston Waterfront,5.0,Ward 6,0609,,INTERSECTION Farragut Rd & E First St,,Intersection,4812.0,42.3383,-71.0251,Employee Generated,"(42.3383, -71.0251)",-7906477.965541334,5211790.6250247145
53514,101000708548,11/19/2012 10:53:04 AM,11/09/2014 10:51:36 AM,07/25/2013 01:45:42 PM,ONTIME,Closed,Case Closed Case Resolved planted spring 2013,New Tree Requests,Parks & Recreation Department,Trees,New Tree Requests,PARK_New Tree Requests,PARK,,,33 Burgoyne St  Dorchester  MA  02122,8.0,07,3.0,C11,Dorchester,7.0,Ward 16,1608,R2,33 Burgoyne St,2122.0,Address,199579.0,42.2867,-71.0566,Employee Generated,"(42.2867, -71.0566)",-7909984.529501323,5204022.932541867
734538,101000353855,11/14/2011 01:18:13 PM,11/21/2011 01:18:12 PM,02/09/2012 07:12:16 AM,OVERDUE,Closed,Case Closed Case Resolved  Trees were pruned by the Boston Parks Department Tree Crew.,Park Maintenace: Boston Common,Parks & Recreation Department,Park Maintenance & Safety,Park Maintenance Requests,PARK_Tree in Park,PARK,,,,,,,,,,,,,,,,,42.3594,-71.0587,Employee Generated,"(0, 0)",-7910218.300431989,5214968.784796895
253506,101001046642,03/13/2014 09:30:10 PM,03/28/2014 08:30:00 AM,03/18/2014 12:25:37 PM,ONTIME,Closed,Case Closed Case Resolved,Street Light Outages,Public Works Department,Street Lights,Street Light Outages,PWDx_Street Light_Pending_Contractor (Internal),PWDx,,,33 Myopia Rd  Hyde Park  MA  02136,12.0,08,5.0,E18,Roslindale,10.0,Ward 18,1812,R1,33 Myopia Rd,2136.0,Address,99607.0,42.2629,-71.1273,Constituent Call,"(42.2629, -71.1273)",-7917854.817500407,5200442.30387886
694446,101000906168,08/20/2013 10:31:35 AM,09/03/2013 10:31:35 AM,,OVERDUE,Open,,Other: Complaint,Mayor's 24 Hour Hotline,Employee & General Comments,General Comments For a Program or Policy,INFO_General Comments Complaints Compliments,INFO,,,,,,,,,,,,,,,,,42.3594,-71.0587,Constituent Call,"(0, 0)",-7910218.300431989,5214968.784796895
30471,101001855322,07/10/2016 06:34:00 PM,07/12/2016 08:30:00 AM,07/11/2016 01:33:23 PM,ONTIME,Closed,Case Closed. Closed date : 2016-07-11 13:33:23.5 Case Resolved,Request for Pothole Repair,Public Works Department,Highway Maintenance,Request for Pothole Repair,PWDx_Highway Construction,PWDx,https://mayors24.cityofboston.gov/media/boston/report/photos/5782cd570485d9377aa446f6/photo_20160710_183329.jpg,,450-458 Brookline Ave  Boston  MA  02115,9.0,10A,8.0,B2,Fenway / Kenmore / Audubon Circle / Longwood,14.0,04,0410,,450-458 Brookline Ave,2115.0,Address,340805.0,42.3376,-71.1083,Citizens Connect App,"(42.3376, -71.1083)",-7915739.747175335,5211685.206724081
266172,101001228470,12/05/2014 08:07:37 AM,12/08/2014 08:30:00 AM,12/05/2014 02:54:15 PM,ONTIME,Closed,Case Closed Case Noted went to location did not see dead animal. Need better location.,Pick up Dead Animal,Public Works Department,Street Cleaning,Pick up Dead Animal,PWDx_District 10A: Roxbury,PWDx,,,INTERSECTION of Annunciation Rd & Parker St  Mission Hill  MA,9.0,10A,7.0,B2,Mission Hill,13.0,Ward 4,0409,,INTERSECTION Annunciation Rd & Parker St,,Intersection,463.0,42.3352,-71.0948,Constituent Call,"(42.3352, -71.0948)",-7914236.934049626,5211323.781458961
361685,101001611453,10/14/2015 08:16:00 AM,10/21/2015 08:30:00 AM,11/18/2015 08:39:10 AM,OVERDUE,Closed,Case Closed. Closed date : 2015-11-18 08:39:10.52 ADCLSD: Administratively Closed,Electrical,Inspectional Services,Building,Electrical,ISD_Building (INTERNAL),ISD,,,200 Boylston St  Boston  MA  02116,4.0,1C,2.0,A1,Downtown / Financial District,6.0,05,0501,,200 Boylston St,2116.0,Address,162431.0,42.3522,-71.068,Constituent Call,"(42.3522, -71.068)",-7911253.571696366,5213884.174346029
66784,101001111436,06/19/2014 07:06:05 AM,06/20/2014 08:30:00 AM,06/19/2014 08:37:39 AM,ONTIME,Closed,Case Closed Case Resolved picked up,Pick up Dead Animal,Public Works Department,Street Cleaning,Pick up Dead Animal,PWDx_District 06: West Roxbury and Roslindale,PWDx,,,INTERSECTION of Cedarcrest Rd & Woodley Ave  West Roxbury  MA,12.0,06,6.0,E5,West Roxbury,10.0,Ward 20,2003,,INTERSECTION Cedarcrest Rd & Woodley Ave,,Intersection,2573.0,42.2635,-71.1502,Constituent Call,"(42.2635, -71.1502)",-7920404.033839573,5200532.555216809
492111,101000498702,10/29/2012 02:50:06 PM,,,ONTIME,Open,,Downed Wire-NOTIFIED,Mayor's 24 Hour Hotline,Programs,Downed Wire,INFO01_GenericeFormforOtherServiceRequestTypes,INFO,,,3 Wigglesworth St  Mission Hill  MA  02120,9.0,10A,8.0,B2,Mission Hill,14.0,Ward 10,1002,CM,3 Wigglesworth St,2120.0,Address,149626.0,42.333999999999996,-71.1029,Constituent Call,"(42.334, -71.1029)",-7915138.621925052,5211143.0739986915
746907,101000838219,05/13/2013 07:54:55 AM,05/27/2013 08:30:00 AM,06/28/2013 10:18:59 AM,OVERDUE,Closed,Case Closed Case Resolved,Street Light Outages,Public Works Department,Street Lights,Street Light Outages,PWDx_Street Light Outages,PWDx,,,INTERSECTION of Gainsborough St & Saint Stephen St  Boston  MA,4.0,10A,7.0,D4,Fenway / Kenmore / Audubon Circle / Longwood,13.0,Ward 4,0408,,INTERSECTION Gainsborough St & Saint Stephen St,,Intersection,5164.0,42.342,-71.0873,Citizens Connect App,"(42.342, -71.0873)",-7913402.037868677,5212347.8555379035
574039,101001169832,09/11/2014 10:55:02 AM,09/13/2014 10:55:02 AM,09/17/2014 03:16:51 PM,OVERDUE,Closed,Case Closed VIOISS: Violation Filed,Work w/out Permit,Inspectional Services,Building,Work w/out Permit,ISD_Building (INTERNAL),ISD,,,127 Sydney St  Dorchester  MA  02125,7.0,03,3.0,C11,Dorchester,7.0,Ward 13,1310,R3,127 Sydney St,2125.0,Address,317111.0,42.3159,-71.0524,Constituent Call,"(42.3159, -71.0524)",-7909516.987639992,5208417.82123462
878189,101001423905,07/06/2015 03:30:00 PM,,07/10/2015 04:39:27 PM,ONTIME,Closed,Case Closed. Closed date : 2015-07-10 16:39:27.103 Bulk Item Automation,Schedule a Bulk Item Pickup,Public Works Department,Sanitation,Schedule a Bulk Item Pickup,PWDx_Schedule a Bulk Item Pickup,PWDx,,,35 Newport St  Dorchester  MA  02125,7.0,03,3.0,C11,Dorchester,7.0,Ward 13,1307,R3,35 Newport St,2125.0,Address,102196.0,42.3178,-71.0543,Constituent Call,"(42.3178, -71.0543)",-7909728.494672498,5208703.860663519
662316,101000318218,08/24/2011 09:17:09 AM,09/21/2011 09:17:09 AM,09/16/2011 10:35:32 AM,ONTIME,Closed,Case Closed Case Resolved large tow from dpw sent 9/15--dpw states vehicle removed by owner.,Abandoned Vehicles,Transportation - Traffic Division,Enforcement & Abandoned Vehicles,Abandoned Vehicles,BTDT_AVRS Interface Queue,BTDT,,,INTERSECTION of Neponset Ave & Victory Rd  Dorchester  MA,8.0,07,3.0,C11,Dorchester,7.0,Ward 16,1605.0,,INTERSECTION Neponset Ave & Victory Rd,,Intersection,7513.0,42.2959,-71.0545,Self Service,"(42.2959, -71.0545)",-7909750.758570657,5205407.403603426
625606,101000415484,05/01/2012 03:47:42 PM,05/03/2012 03:47:42 PM,05/02/2012 03:06:35 PM,ONTIME,Closed,Case Closed Case Resolved Location has been made safe. This sidewalk will be referred for permanent repair. See case #101000416081 for status of the permanent repair.,Sidewalk Repair (Make Safe),Public Works Department,Highway Maintenance,Sidewalk Repair (Make Safe),PWDx_District 06: West Roxbury and Roslindale,PWDx,,,18 Glenhaven Rd  West Roxbury  MA  02132,12.0,06,6.0,E5,West Roxbury,12.0,Ward 20,2016,R1,18 Glenhaven Rd,2132.0,Address,64415.0,42.2708,-71.1637,Constituent Call,"(42.2708, -71.1637)",-7921906.846965284,5201630.681964212
466579,101001811011,06/09/2016 10:08:32 AM,06/20/2016 10:08:32 AM,06/24/2016 11:38:07 AM,OVERDUE,Closed,Case Closed. Closed date : 2016-06-24 11:38:07.403 Case Noted More information needed,Lighting/Electrical:,Parks & Recreation Department,Park Maintenance & Safety,Parks Lighting/Electrical Issues,INFO_Reallocation From Dept,INFO,,,INTERSECTION of George R. Visconti Rd & Porter St  East Boston  MA,1.0,09,1.0,A7,East Boston,1.0,1,0106,,INTERSECTION George R. Visconti Rd & Porter St,,Intersection,13834.0,42.3594,-71.0587,City Worker App,"(0, 0)",-7910218.300431989,5214968.784796895
658113,101001897191,09/01/2016 10:35:00 AM,10/06/2016 09:07:00 AM,,OVERDUE,Open,Case Closed. Closed date : 2016-09-02 10:29:23.123 Case Resolved A traffic signal is currently being installed at this intersection and is already partially constructed.,New Sign  Crosswalk or Pavement Marking,Transportation - Traffic Division,Signs & Signals,New Sign  Crosswalk or Pavement Marking,BTDT_Engineering_Request for Traffic Signal Study or Review,BTDT,,,INTERSECTION of Walter St & Bussey St  Roslindale  MA,9.0,06,6.0,E13,Roslindale,10.0,20,2001.0,,INTERSECTION Walter St & Bussey St,,Intersection,17307.0,42.3594,-71.0587,Constituent Call,"(0, 0)",-7910218.300431989,5214968.784796895
484121,101001162832,09/03/2014 07:29:18 AM,09/05/2014 08:30:00 AM,09/03/2014 10:32:31 AM,ONTIME,Closed,Case Closed Case Resolved Trash on the sidewalk picked up,Requests for Street Cleaning,Public Works Department,Street Cleaning,Requests for Street Cleaning,PWDx_District 02: Jamaica Plain,PWDx,https://mayors24.cityofboston.gov/media/boston/report/photos/5406fb6c048585f92b963bf9/report.jpg,https://cityworker.cityofboston.gov:8443/attachments/report/5406fb9ad052d6bf0d41d6d4/closed_photo/Report.jpg,49 Woodlawn St  Jamaica Plain  MA  02130,12.0,02,6.0,E13,Jamaica Plain,11.0,Ward 11,1108,R3,49 Woodlawn St,2130.0,Address,338479.0,42.2982,-71.112,Citizens Connect App,"(42.2982, -71.112)",-7916151.62929127,5205753.552969426
419232,101001004431,01/13/2014 03:32:41 PM,01/15/2014 03:32:40 PM,12/17/2015 03:46:16 PM,OVERDUE,Closed,Case Closed. Closed date : 2015-12-17 15:46:16.917 Case Noted Duplicate of Case #101000864321.    Thank you for bringing this matter to our attention.    Staff from the Boston Public Works Department has reviewed the location and we are of the opinion that the location is a candidate for reconstruction.     Your request and location has been added to the master list of future reconstruction projects. Currently  the wait time for a reconstruction project of this nature can be up to five (5) or more years.    If you feel that there is an immediate safety concern at this location  please contact 617-635-4500 so that maintenance can be performed to make the location safer until the reconstruction can be started.    In the meantime  you may contact the Public Works Department Engineering Division at 617-635-4968 for information on your request.  Again  we appreciate and thank you for your interest in public safety and the welfare of your community.,Sidewalk Repair (Make Safe),Public Works Department,Highway Maintenance,Sidewalk Repair (Make Safe),PWDx_Engineering_Design,PWDx,,,INTERSECTION of Boylston St & Tremont St  Boston  MA,4.0,1C,2.0,A1,Downtown / Financial District,4.0,Ward 3,0308,,INTERSECTION Boylston St & Tremont St,,Intersection,1784.0,42.3524,-71.0645,Constituent Call,"(42.3524, -71.0645)",-7910863.95347859,5213914.300736275
669795,101000835725,05/08/2013 10:26:16 AM,05/10/2013 10:26:15 AM,05/08/2013 11:46:53 AM,ONTIME,Closed,Case Closed Case Resolved Location has been made safe. This sidewalk will be referred for permanent repair. See case #101000835831 for status of the permanent repair.,Sidewalk Repair (Make Safe),Public Works Department,Highway Maintenance,Sidewalk Repair (Make Safe),PWDx_District 02: Jamaica Plain,PWDx,,,305 South St  Jamaica Plain  MA  02130,9.0,02,6.0,E13,Jamaica Plain,11.0,Ward 19,1902.0,E,305 South St,2130.0,Address,156065.0,42.3009,-71.1177,Constituent Call,"(42.3009, -71.1177)",-7916786.150388792,5206159.9183579115
479187,101000749458,02/07/2013 11:57:08 AM,,02/07/2013 11:58:58 AM,ONTIME,Closed,Case Closed Case Invalid mistake,Schedule a Bulk Item Pickup,Public Works Department,Sanitation,Schedule a Bulk Item Pickup,PWDx_Schedule a Bulk Item Pickup,PWDx,,,2 Mendum St  Roslindale  MA  02131,9.0,06,5.0,E5,Roslindale,10.0,Ward 20,2004,R1,2 Mendum St,2131.0,Address,94192.0,42.291000000000004,-71.1282,Constituent Call,"(42.291, -71.1282)",-7917955.005042122,5204669.997107275
446175,101000943109,10/08/2013 07:43:21 PM,11/07/2013 07:43:21 PM,10/17/2013 09:45:57 AM,ONTIME,Closed,Case Closed NOVIO: No Violation Found/No Cause,Rodent Activity,Inspectional Services,Environmental Services,Rodent Activity,ISD_Environmental Services (INTERNAL),ISD,,,275 W Broadway  South Boston  MA  02127,6.0,05,2.0,C6,South Boston / South Boston Waterfront,5.0,Ward 6,0602,E,275 W Broadway,2127.0,Address,156158.0,42.339,-71.0515,Constituent Call,"(42.339, -71.0515)",-7909416.800098279,5211896.044498857
7697,101001144589,08/06/2014 11:08:58 AM,08/08/2014 11:08:56 AM,08/07/2014 11:31:48 AM,ONTIME,Closed,Case Closed Case Resolved Sidewalk made safe by dist. 4 patch crew,Sidewalk Repair (Make Safe),Public Works Department,Highway Maintenance,Sidewalk Repair (Make Safe),PWDx_District 04: Allston/Brighton,PWDx,,,49-51 Dustin St  Allston  MA  02134,11.0,04,9.0,D14,Allston / Brighton,15.0,Ward 21,2106,R2,49-51 Dustin St,2134.0,Address,50281.0,42.3522,-71.1455,Constituent Call,"(42.3522, -71.1455)",-7919880.832232844,5213884.174346029
670407,101001345643,03/31/2015 09:43:08 AM,04/30/2015 09:43:08 AM,11/10/2015 08:48:46 AM,OVERDUE,Closed,Case Closed. Closed date : 2015-11-10 08:48:46.103 VIOCOR: Violation Corrected,Rodent Activity,Inspectional Services,Environmental Services,Rodent Activity,ISD_Environmental Services (INTERNAL),ISD,,,198 W Selden St  Mattapan  MA  02126,8.0,07,4.0,B3,Greater Mattapan,9.0,Ward 18,1801.0,R1,198 W Selden St,2126.0,Address,124992.0,42.2745,-71.0883,Constituent Call,"(42.2745, -71.0883)",-7913513.35735947,5202187.315320103
284930,101001221351,11/21/2014 09:50:19 AM,12/22/2014 09:50:19 AM,11/21/2014 02:20:45 PM,ONTIME,Closed,Case Closed Case Resolved  towed 11/21 for parking violation.,Abandoned Vehicles,Transportation - Traffic Division,Enforcement & Abandoned Vehicles,Abandoned Vehicles,BTDT_AVRS Interface Queue,BTDT,,,10 Roseway St  Jamaica Plain  MA  02130,9.0,02,6.0,E13,Jamaica Plain,11.0,Ward 19,1903,R2,10 Roseway St,2130.0,Address,118512.0,42.3189,-71.1113,Constituent Call,"(42.3189, -71.1113)",-7916073.705647715,5208869.466385564
693,101001711761,02/07/2016 07:41:04 PM,02/16/2016 08:30:00 AM,02/08/2016 08:14:59 AM,ONTIME,Closed,Case Closed. Closed date : 2016-02-08 08:14:59.91 Case Resolved cited for unshoveled,Unshoveled Sidewalk,Public Works Department,Code Enforcement,Unshoveled Sidewalk,PWDx_Code Enforcement,PWDx,https://mayors24.cityofboston.gov/media/boston/report/photos/56b7e419048540dfb83fcac7/report.jpg,,457 E Fifth St  South Boston  MA  02127,6.0,05,2.0,C6,South Boston / South Boston Waterfront,5.0,Ward 7,0703,R1,457 E Fifth St,2127.0,Address,57815.0,42.3337,-71.0423,Citizens Connect App,"(42.3337, -71.0423)",-7908392.660782978,5211097.897672368
554103,101000959464,11/04/2013 09:09:31 AM,,11/08/2013 09:45:35 PM,ONTIME,Closed,Case Closed Bulk Item Automation,Schedule a Bulk Item Pickup,Public Works Department,Sanitation,Schedule a Bulk Item Pickup,PWDx_Schedule a Bulk Item Pickup,PWDx,,,1108 Bennington St  East Boston  MA  02128,1.0,09,1.0,A7,East Boston,1.0,Ward 1,0113,RL,1108 Bennington St,2128.0,Address,14568.0,42.3594,-71.0587,Constituent Call,"(0, 0)",-7910218.300431989,5214968.784796895
360909,101001045105,03/11/2014 03:34:14 PM,,03/11/2014 03:34:14 PM,ONTIME,Closed,Case Closed Internal Case Performed by Highway Maintenance crew.,Pothole Repair (Internal),Public Works Department,Highway Maintenance,Pothole Repair (Internal),PWDx_District 06: West Roxbury and Roslindale,PWDx,,,45 Charles Park Rd  West Roxbury  MA  02132,12.0,06,6.0,E5,West Roxbury,12.0,Ward 20,2005,C,45 Charles Park Rd,2132.0,Address,29575.0,42.2781,-71.1743,Employee Generated,"(42.2781, -71.1743)",-7923086.833567692,5202728.935898161
772378,101000426631,05/23/2012 06:29:08 PM,05/25/2012 08:30:00 AM,05/25/2012 07:45:11 AM,ONTIME,Closed,Case Closed Case Resolved 16,Traffic Signal Repair,Transportation - Traffic Division,Signs & Signals,Traffic Signal Repair,BTDT_Traffic Signal_Repair,BTDT,,,INTERSECTION of Forest Hills St & Glen Rd  Jamaica Plain  MA,9.0,02,6.0,E13,Jamaica Plain,11.0,Ward 11,1107,,INTERSECTION Forest Hills St & Glen Rd,,Intersection,4997.0,42.3089,-71.1025,Constituent Call,"(42.3089, -71.1025)",-7915094.094128734,5207364.066269572
245134,101001034067,02/22/2014 06:41:21 PM,03/10/2014 08:30:00 AM,03/06/2014 10:39:58 AM,ONTIME,Closed,Case Closed Case Resolved CASE RESOLVED,Street Light Outages,Public Works Department,Street Lights,Street Light Outages,PWDx_Street Light Outages,PWDx,,,100 H W Springfield St  Roxbury  MA  02118,4.0,1C,7.0,D4,South End,6.0,Ward 9,0902,R1,100 H W Springfield St,2118.0,Address,129909.0,42.3376,-71.0773,Citizens Connect App,"(42.3376, -71.0773)",-7912288.842960742,5211685.206724081
177930,101001420444,06/30/2015 11:56:00 AM,07/03/2015 11:56:37 AM,07/02/2015 09:40:40 AM,ONTIME,Closed,Case Closed. Closed date : 2015-07-02 09:40:40.067 Case Resolved Dear Constituent     The Construction Inspection Unit Inspector went out to this location and couldn't find any recent excavation work.    If you would like to discus this issue further please contact the inspector Mark Lawson at 781-603-7674.    Sincerely     Mark Cardarelli  Supervisor of Utility Coordination and Compliance  Boston Public Works Department  617-635-4951 Office,Work Hours-Loud Noise Complaints,Public Works Department,Highway Maintenance,Work Hours-Loud Noise Complaints,PWDx_Work Hours-Loud Noise Complaints,PWDx,,,42 Park St  Charlestown  MA  02129,3.0,1A,1.0,A15,Charlestown,2.0,02,0201,EA,42 Park St,2129.0,Address,340624.0,42.3735,-71.0608,Constituent Call,"(42.3735, -71.0608)",-7910452.071362655,5217093.173657092
102661,101001404522,06/08/2015 10:11:00 AM,06/09/2015 10:11:56 AM,06/08/2015 11:49:15 AM,ONTIME,Closed,Case Closed. Closed date : 2015-06-08 11:49:15.183 Case Resolved Two vehicles ticketed.,Parking Enforcement,Transportation - Traffic Division,Enforcement & Abandoned Vehicles,Parking Enforcement,BTDT_Parking Enforcement,BTDT,,,83 Whitcomb Ave  Jamaica Plain  MA  02130,9.0,02,6.0,E13,Jamaica Plain,11.0,Ward 19,1902,R1,83 Whitcomb Ave,2130.0,Address,149197.0,42.3035,-71.1299,Constituent Call,"(42.3035, -71.1299)",-7918144.2481764695,5206551.249645931
241032,101001082698,05/06/2014 09:09:10 AM,,05/06/2014 09:09:11 AM,ONTIME,Closed,Case Closed Internal Case Performed by Highway Maintenance crew.,Pothole Repair (Internal),Public Works Department,Highway Maintenance,Pothole Repair (Internal),PWDx_District 06: West Roxbury and Roslindale,PWDx,,,0 Brook Farm Rd  West Roxbury  MA  02132,12.0,06,6.0,E5,West Roxbury,12.0,Ward 20,2015,E,0 Brook Farm Rd,2132.0,Address,21892.0,42.3594,-71.0587,Employee Generated,"(0, 0)",-7910218.300431989,5214968.784796895
475925,101001185232,09/29/2014 04:57:48 PM,10/01/2014 04:57:48 PM,10/02/2014 11:46:40 AM,OVERDUE,Closed,Case Closed Case Resolved done... Checked.... 10/2/14,Request for Pothole Repair,Public Works Department,Highway Maintenance,Request for Pothole Repair,PWDx_District 1B: North End,PWDx,https://cityworker.cityofboston.gov:8443/attachments/report/5429c7cbd0523cd2696e7b55/photo/Report.jpg,https://cityworker.cityofboston.gov:8443/attachments/report/5429c7cbd0523cd2696e7b55/closed_photo/Report.jpg,INTERSECTION of Brattle Way & Hawkins St  Boston  MA,3.0,1B,1.0,A1,Downtown / Financial District,3.0,Ward 3,0306,,INTERSECTION Brattle Way & Hawkins St,,Intersection,1884.0,42.3621,-71.0613,City Worker App,"(42.3621, -71.0613)",-7910507.731108052,5215375.545755913
135226,101000825410,04/22/2013 09:08:30 AM,04/22/2014 09:08:30 AM,04/23/2013 03:15:08 PM,ONTIME,Closed,Case Closed Case Noted The contractor has been notified and will go back and parge the wall    Michael Somers  Senior Civil Engineer  Construction Management Division  Boston Public Works  617-635-3831,Sidewalk Repair,Public Works Department,Highway Maintenance,Sidewalk Repair,PWDx_Sidewalk Repair,PWDx,,,INTERSECTION of Moreland St & Whiting St  Roxbury  MA,7.0,10B,7.0,B2,Roxbury,13.0,Ward 12,1201,,INTERSECTION Moreland St & Whiting St,,Intersection,7394.0,42.3245,-71.0802,Constituent Call,"(42.3245, -71.0802)",-7912611.669484044,5209712.59494895
721554,101001208656,10/31/2014 09:39:22 AM,11/03/2014 09:39:22 AM,11/05/2014 08:47:57 AM,OVERDUE,Closed,Case Closed VIOISS: Violation Filed,Fire in Food Establishment,Inspectional Services,Health,Fire in Food Establishment,ISD_Health (INTERNAL),ISD,,,1 Lincoln St  Boston  MA  02111,3.0,1C,2.0,A1,Downtown / Financial District,4.0,Ward 3,0308,C,1 Lincoln St,2111.0,Address,86009.0,42.3529,-71.0587,Constituent Call,"(42.3529, -71.0587)",-7910218.300431989,5213989.617131298
686614,101000482580,09/21/2012 10:43:49 AM,,09/24/2012 09:47:46 PM,ONTIME,Closed,Case Closed Bulk Item Automation,Schedule a Bulk Item Pickup,Public Works Department,Sanitation,Schedule a Bulk Item Pickup,PWDx_Schedule a Bulk Item Pickup,PWDx,,,16 Chapin Ave  West Roxbury  MA  02132,12.0,06,6.0,E5,West Roxbury,12.0,Ward 20,2013,R1,16 Chapin Ave,2132.0,Address,28990.0,42.2821,-71.1595,Self Service,"(42.2821, -71.1595)",-7921439.30510395,5203330.7728318265
251021,101001665094,12/14/2015 04:45:00 PM,01/23/2016 04:45:54 PM,,OVERDUE,Open,,Requests for Traffic Signal Studies or Reviews,Transportation - Traffic Division,Traffic Management & Engineering,Requests for Traffic Signal Studies or Reviews,INFO01_GenericeFormforOtherServiceRequestTypes,INFO,,,INTERSECTION of Washington St & Ukraine Way  Roslindale  MA,12.0,02,6.0,E5,Jamaica Plain,10.0,Ward 19,1907,,INTERSECTION Washington St & Ukraine Way,,Intersection,6009.0,42.2983,-71.1158,Constituent Call,"(42.2983, -71.1158)",-7916574.643356284,5205768.603228651
895025,101001956900,11/22/2016 10:09:00 AM,01/01/2017 10:09:00 AM,,OVERDUE,Open,,Requests for Traffic Signal Studies or Reviews,Transportation - Traffic Division,Traffic Management & Engineering,Requests for Traffic Signal Studies or Reviews,BTDT_Engineering_Request for Traffic Signal Study or Review,BTDT,,,INTERSECTION of Devonshire St & Franklin St  Boston  MA,3.0,1C,2.0,A1,Downtown / Financial District,3.0,3,0306,,INTERSECTION Devonshire St & Franklin St,,Intersection,16045.0,42.3594,-71.0587,Employee Generated,"(0, 0)",-7910218.300431989,5214968.784796895
172181,101001366765,04/29/2015 04:20:34 PM,05/29/2015 04:20:34 PM,,OVERDUE,Open,,Rodent Activity,Inspectional Services,Environmental Services,Rodent Activity,ISD_Environmental Services (INTERNAL),ISD,,,54 Kenwood St  Dorchester  MA  02124,8.0,07,4.0,C11,Dorchester,8.0,Ward 17,1706,R1,54 Kenwood St,2124.0,Address,81397.0,42.2925,-71.0693,Constituent Call,"(42.2925, -71.0693)",-7911398.287034397,5204895.7276967885
100384,101000921746,09/09/2013 10:14:09 AM,09/11/2013 10:14:09 AM,09/09/2013 01:31:08 PM,ONTIME,Closed,Case Closed Case Resolved pick up,Requests for Street Cleaning,Public Works Department,Street Cleaning,Requests for Street Cleaning,PWDx_District 07: South Dorchester,PWDx,,,67-69 Saint Marks Rd  Dorchester  MA  02124,8.0,07,3.0,C11,Dorchester,7.0,Ward 16,1604,R2,67-69 Saint Marks Rd,2124.0,Address,121390.0,42.2921,-71.0587,City Worker App,"(42.2921, -71.0587)",-7910218.300431989,5204835.532347284
861000,101001060191,04/03/2014 10:13:01 AM,04/10/2014 10:13:01 AM,06/03/2014 08:17:24 AM,OVERDUE,Closed,Case Closed NOVIO: No Violation Found/No Cause,Protection of Adjoining Property,Inspectional Services,Building,Protection of Adjoining Property,ISD_Building (INTERNAL),ISD,,,14 Mallet St  Dorchester  MA  02124,8.0,07,3.0,C11,Dorchester,7.0,Ward 16,1606,CM,14 Mallet St,2124.0,Address,88776.0,42.2904,-71.0573,Constituent Call,"(42.2904, -71.0573)",-7910062.453144878,5204579.706376651
421797,101001352915,04/09/2015 12:30:04 PM,,04/14/2015 04:37:16 PM,ONTIME,Closed,Case Closed Bulk Item Automation,Schedule Bulk Item Pickup,Public Works Department,Sanitation,Schedule a Bulk Item Pickup SS,PWDx_Schedule a Bulk Item Pickup,PWDx,,,38 Stanton St  Dorchester  MA  02124,8.0,07,4.0,B3,Dorchester,9.0,Ward 17,1707,R4,38 Stanton St,2124.0,Address,313987.0,42.2843,-71.0792,Self Service,"(42.2843, -71.0792)",-7912500.34999325,5203661.79943142
27286,101001373614,05/08/2015 03:54:00 PM,05/12/2015 03:54:49 PM,05/13/2015 09:07:00 AM,OVERDUE,Closed,Case Closed. Closed date : 2015-05-13 09:07:00.82 VIOISS: Violation Filed,Food Alert - Unconfirmed,Inspectional Services,Health,Food Alert - Unconfirmed,ISD_Health (INTERNAL),ISD,,,125 South St  Jamaica Plain  MA  02130,9.0,02,6.0,E13,Jamaica Plain,11.0,11,1110,,125 South St,2130.0,Address,344572.0,42.3057,-71.1151,Constituent Call,"(42.3057, -71.1151)",-7916496.71971273,5206882.388743037
781132,101000358887,11/30/2011 01:38:37 PM,12/02/2011 01:38:37 PM,11/30/2011 03:10:28 PM,ONTIME,Closed,Case Closed Case Resolved Location has been made safe. This sidewalk will be referred for permanent repair. See case #101000358964 for status of the permanent repair.,Sidewalk Repair (Make Safe),Public Works Department,Highway Maintenance,Sidewalk Repair (Make Safe),PWDx_District 10B: Roxbury,PWDx,,,45 Centre St  Roxbury  MA  02119,7.0,10B,7.0,B2,Roxbury,13.0,Ward 9,0905,A,45 Centre St,2119.0,Address,28047.0,42.3297,-71.0938,Self Service,"(42.3297, -71.0938)",-7914125.614558833,5210495.567244821
600608,101000313771,08/12/2011 02:50:05 PM,09/11/2011 02:50:04 PM,08/12/2011 03:21:09 PM,ONTIME,Closed,Case Closed Case Invalid Opened in error.,No Utilities Residential - Water,Inspectional Services,Housing,No Utilities Residential - Water,ISD_Housing (INTERNAL),ISD,,,56 Queensberry St  Boston  MA  02215,4.0,10A,8.0,D4,Fenway / Kenmore / Audubon Circle / Longwood,14.0,Ward 5,0502,CD,56 Queensberry St,2215.0,Address,113795.0,42.3425,-71.0975,Constituent Call,"(42.3425, -71.0975)",-7914537.496674767,5212423.159473596
605449,101000842194,05/19/2013 10:16:03 AM,,05/20/2013 10:28:03 AM,ONTIME,Closed,Case Closed Case Noted,Notification,Mayor's 24 Hour Hotline,Notification,Notification,INFO09_Current Events,INFO,,,2400 Washington St  Roxbury  MA  02119,7.0,10B,7.0,B2,Roxbury,13.0,12,1201,E,2400 Washington St,2119.0,Address,341394.0,42.3282,-71.0856,Constituent Call,"(42.3282, -71.0856)",-7913212.794734327,5210269.703209579
107036,101001312148,02/23/2015 11:22:16 AM,02/24/2015 11:22:15 AM,02/23/2015 11:52:17 AM,ONTIME,Closed,Case Closed Case Resolved Both vehicles ticketed and put on tow list.,Parking Enforcement,Transportation - Traffic Division,Enforcement & Abandoned Vehicles,Parking Enforcement,BTDT_Parking Enforcement,BTDT,,,475-477 Columbia Rd  Dorchester  MA  02125,7.0,03,3.0,C11,Dorchester,8.0,Ward 15,1501,A,475-477 Columbia Rd,2125.0,Address,35271.0,42.3137,-71.0675,Constituent Call,"(42.3137, -71.0675)",-7911197.911950969,5208086.628474029
495255,101001196753,10/15/2014 10:52:47 AM,,10/22/2014 04:37:43 PM,ONTIME,Closed,Case Closed Bulk Item Automation,Schedule a Bulk Item Pickup,Public Works Department,Sanitation,Schedule a Bulk Item Pickup,PWDx_Schedule a Bulk Item Pickup,PWDx,,,1378 River St  Hyde Park  MA  02136,12.0,08,5.0,E18,Hyde Park,10.0,Ward 18,1818,R1,1378 River St,2136.0,Address,116379.0,42.2546,-71.1283,Constituent Call,"(42.2546, -71.1283)",-7917966.1369912,5199193.915142536
583401,101001842311,06/22/2016 03:19:06 PM,07/06/2016 03:19:02 PM,07/20/2016 02:34:02 PM,OVERDUE,Closed,Case Closed. Closed date : 2016-07-20 14:34:02.09 Case Resolved,Sign Shop WO,Transportation - Traffic Division,Operations,Sign Shop WO,BTDT_Sign Shop_Sign Installation,BTDT,,,INTERSECTION of Tai Tung St & Tyler St  Boston  MA,4.0,1C,2.0,A1,Downtown / Financial District,4.0,3,0308,,INTERSECTION Tai Tung St & Tyler St,,Intersection,13182.0,42.3594,-71.0587,Employee Generated,"(0, 0)",-7910218.300431989,5214968.784796895
304333,101001898114,09/02/2016 07:43:00 AM,09/07/2016 08:30:00 AM,09/02/2016 03:57:03 PM,ONTIME,Closed,Case Closed. Closed date : 2016-09-02 15:57:03.94 Case Noted no violation,Improper Storage of Trash (Barrels),Public Works Department,Code Enforcement,Improper Storage of Trash (Barrels),PWDx_Code Enforcement,PWDx,,https://cityworker.cityofboston.gov:8443/attachments/report/57c96632d052c054f2a078c6/closed_photo/Report.jpg,86 Undine Rd  Brighton  MA  02135,11.0,04,9.0,D14,Brighton,15.0,22,2208,,86 Undine Rd,2135.0,Address,355263.0,42.3428,-71.1667,Constituent Call,"(42.3428, -71.1667)",-7922240.805437663,5212468.342122461
854996,101001278118,02/05/2015 01:19:44 PM,02/09/2015 01:19:44 PM,02/12/2015 05:48:47 PM,OVERDUE,Closed,Case Closed Case Noted Snow has been removed.,Request for Snow Plowing,Public Works Department,Street Cleaning,Request for Snow Plowing,PWDx_District 03: North Dorchester,PWDx,,,INTERSECTION of Dorchester Ave & Mount Vernon St  Dorchester  MA,6.0,03,2.0,C6,Dorchester,5.0,Ward 7,0708,,INTERSECTION Dorchester Ave & Mount Vernon St,,Intersection,4184.0,42.3216,-71.0568,Constituent Call,"(42.3216, -71.0568)",-7910006.793399481,5209275.965431931
857472,101001037420,02/27/2014 10:36:52 AM,,03/04/2014 03:55:18 PM,ONTIME,Closed,Case Closed Case Noted,Fire,Mayor's 24 Hour Hotline,Notification,Notification,INFO09_Current Events,INFO,,,2 Faulkner Cir  Dorchester  MA  02122,7.0,07,3.0,C11,Dorchester,7.0,Ward 16,1601,R3,2 Faulkner Cir,2122.0,Address,56722.0,42.2997,-71.062,Constituent Call,"(42.2997, -71.062)",-7910585.654751606,5205979.309367413
71216,101000352603,11/09/2011 06:00:01 PM,11/14/2011 08:30:00 AM,11/10/2011 09:30:45 AM,ONTIME,Closed,Case Closed Case Resolved This is swept on wednesday by mechanical sweeper.,Requests for Street Cleaning,Public Works Department,Street Cleaning,Requests for Street Cleaning,PWDx_District 03: North Dorchester,PWDx,,,INTERSECTION of Boston St & Roseclair St  Dorchester  MA,6.0,03,2.0,C6,Dorchester,5.0,Ward 7,0709,,INTERSECTION Boston St & Roseclair St,,Intersection,1657.0,42.3211,-71.0613,Constituent Call,"(42.3211, -71.0613)",-7910507.731108052,5209200.686514744
607364,101001063208,04/08/2014 10:02:20 AM,04/15/2014 10:02:20 AM,08/01/2014 03:36:01 PM,OVERDUE,Closed,Case Closed VIOISS: Violation Filed,Illegal Occupancy,Inspectional Services,Building,Illegal Occupancy,ISD_Building (INTERNAL),ISD,,,968 South St  Roslindale  MA  02131,9.0,06,5.0,E5,Roslindale,10.0,Ward 20,2004,RC,968 South St,2131.0,Address,129029.0,42.2876,-71.1385,Constituent Call,"(42.2876, -71.1385)",-7919101.595797292,5204158.361005296
758114,101001704107,01/29/2016 07:42:33 AM,02/01/2016 08:30:00 AM,01/29/2016 08:19:00 AM,ONTIME,Closed,Case Closed. Closed date : 2016-01-29 08:19:00.227 Case Resolved Street clear now.,Parking Enforcement,Transportation - Traffic Division,Enforcement & Abandoned Vehicles,Parking Enforcement,BTDT_Parking Enforcement,BTDT,https://mayors24.cityofboston.gov/media/boston/report/photos/56ab5e330485cd229efc4e6b/report.jpg,,INTERSECTION of Waltham St & Tremont St  Boston  MA,4.0,1C,2.0,D4,South End,4.0,3,0307,,INTERSECTION Waltham St & Tremont St,,Intersection,17311.0,42.3594,-71.0587,Citizens Connect App,"(0, 0)",-7910218.300431989,5214968.784796895
809018,101001176724,09/19/2014 12:23:44 PM,,09/23/2014 04:38:36 PM,ONTIME,Closed,Case Closed Bulk Item Automation,Schedule a Bulk Item Pickup,Public Works Department,Sanitation,Schedule a Bulk Item Pickup,PWDx_Schedule a Bulk Item Pickup,PWDx,,,42 Dana Rd  West Roxbury  MA  02132,12.0,06,6.0,E5,West Roxbury,12.0,Ward 20,2015,R1,42 Dana Rd,2132.0,Address,46075.0,42.2648,-71.16199999999999,Constituent Call,"(42.2648, -71.162)",-7921717.603830934,5200728.102728862
210865,101001721847,02/22/2016 10:02:00 AM,02/23/2016 10:02:57 AM,02/22/2016 10:45:11 AM,ONTIME,Closed,Case Closed. Closed date : 2016-02-22 10:45:11.037 Case Invalid There is no traffic signal at Termine St & Sheridan St unfortunately  there is also no constituent information.  The picture attached is good and shows the issue but without knowing what the intersection is we can not assist with this issue.,Traffic Signal Inspection,Transportation - Traffic Division,Signs & Signals,Traffic Signal Inspection,BTDT_Engineering_Request for Traffic Signal Study or Review,BTDT,https://mayors24.cityofboston.gov/media/boston/report/photos/56cb231b04852ef1b83fdd6c/photo_20160222_100134.jpg,,INTERSECTION of Sheridan St & Termine Ave  Jamaica Plain  MA,9.0,02,6.0,E13,Jamaica Plain,11.0,19,1901,,INTERSECTION Sheridan St & Termine Ave,,Intersection,12997.0,42.3594,-71.0587,Citizens Connect App,"(0, 0)",-7910218.300431989,5214968.784796895
151756,101001356358,04/14/2015 04:19:29 PM,04/22/2015 04:19:29 PM,09/28/2015 08:57:29 AM,OVERDUE,Closed,Case Closed. Closed date : 2015-09-28 08:57:29.327 Case Resolved Fence was repaired.,Park Maintenance: Iacono/Readville Playground,Parks & Recreation Department,Park Maintenance & Safety,Ground Maintenance,PARK_Maintenance_Trades,PARK,,,146 Readville St  Hyde Park  MA  02136,12.0,08,5.0,E18,Hyde Park,10.0,Ward 18,1820,R4,146 Readville St,2136.0,Address,297646.0,42.2397,-71.1357,Constituent Call,"(42.2397, -71.1357)",-7918789.90122307,5196953.2438770225
548911,101001795743,05/21/2016 12:19:54 PM,05/24/2016 08:30:00 AM,05/21/2016 12:28:49 PM,ONTIME,Closed,Case Closed. Closed date : 2016-05-21 12:28:49.357 Duplicate of Existing Case dup case #101001795740,Parking Enforcement,Transportation - Traffic Division,Enforcement & Abandoned Vehicles,Parking Enforcement,BTDT_Parking Enforcement,BTDT,https://mayors24.cityofboston.gov/media/boston/report/photos/57408aa40485ce7eda83de78/report.jpg,,573 Talbot Ave  Dorchester  MA  02124,8.0,07,4.0,C11,Dorchester,8.0,Ward 17,1709,CC,573 Talbot Ave,2124.0,Address,133775.0,42.2858,-71.0645,Citizens Connect App,"(42.2858, -71.0645)",-7910863.95347859,5203887.506013222
655682,101001358513,04/17/2015 05:48:36 AM,05/04/2015 08:30:00 AM,04/17/2015 06:23:59 AM,ONTIME,Closed,Case Closed Case Resolved Repaired 1 Unit,Street Light Outages,Public Works Department,Street Lights,Street Light Outages,PWDx_Street Light Outages,PWDx,,,,,,,,,,,,,,,,,42.3594,-71.0587,Employee Generated,"(0, 0)",-7910218.300431989,5214968.784796895
322168,101000378251,01/27/2012 11:23:10 AM,05/26/2012 11:23:10 AM,,OVERDUE,Open,,Unsatisfactory Living Conditions,Inspectional Services,Housing,Unsatisfactory Living Conditions,ISD_Housing (INTERNAL),ISD,,,1855 Washington St  Roxbury  MA  02118,7.0,10B,7.0,D4,Roxbury,13.0,Ward 9,0903,EA,1855 Washington St,2118.0,Address,330682.0,42.3353,-71.0789,Constituent Call,"(42.3353, -71.0789)",-7912466.954146014,5211338.840569625
290944,101000751771,02/09/2013 11:30:02 AM,02/13/2013 08:30:00 AM,02/17/2013 01:35:47 PM,OVERDUE,Closed,Case Closed Case Resolved  ADDRESSED,Request for Snow Plowing,Public Works Department,Street Cleaning,Request for Snow Plowing,PWDx_District 1B: North End,PWDx,,,36 Lime St  Boston  MA  02108,3.0,1B,8.0,A1,Beacon Hill,14.0,Ward 5,0505,R1,36 Lime St,2108.0,Address,85949.0,42.357,-71.0715,Constituent Call,"(42.357, -71.0715)",-7911643.189914142,5214607.234172679
77544,101001877895,08/08/2016 10:00:00 AM,,08/23/2016 09:01:59 AM,ONTIME,Closed,Case Closed. Closed date : 2016-08-23 09:01:59.75 Case Resolved All of Alley 101 has been repaved.,Roadway Repair,Public Works Department,Highway Maintenance,Roadway Repair,PWDx_Roadway Repair,PWDx,,,INTERSECTION of Public Alley No. 101 & Cross St  Boston  MA,3.0,1B,1.0,A1,Downtown / Financial District,3.0,3,0301,,INTERSECTION Public Alley No. 101 & Cross St,,Intersection,13946.0,42.3594,-71.0587,Constituent Call,"(0, 0)",-7910218.300431989,5214968.784796895
919690,101002004156,02/07/2017 05:05:23 AM,02/08/2017 08:30:00 AM,02/07/2017 08:50:06 AM,ONTIME,Closed,Case Closed. Closed date : 2017-02-07 08:50:06.073 Case Noted Nothing found at this address address and picture does not match,Requests for Street Cleaning,Public Works Department,Street Cleaning,Requests for Street Cleaning,PWDx_District 10A: Roxbury,PWDx,https://mayors24.cityofboston.gov/media/boston/report/photos/58999bde0485807683d25925/report.jpg,,110-118 Terrace St  Mission Hill  MA  02120,9.0,10A,8.0,B2,Mission Hill,14.0,Ward 10,1005,C,110-118 Terrace St,2120.0,Address,134500.0,42.3283,-71.0982,Citizens Connect App,"(42.3283, -71.0982)",-7914615.420318324,5210284.760644366
362103,101000732770,01/07/2013 03:36:11 PM,01/21/2013 03:36:11 PM,02/07/2013 07:58:44 AM,OVERDUE,Closed,Case Closed Case Resolved Replaced 250MV lamp and refractor,Street Light Outages,Public Works Department,Street Lights,Street Light Outages,PWDx_Street Light Outages,PWDx,,,36 Story St  South Boston  MA  02127,6.0,05,2.0,C6,South Boston / South Boston Waterfront,5.0,Ward 7,0703,R1,36 Story St,2127.0,Address,131050.0,42.3335,-71.0427,Constituent Call,"(42.3335, -71.0427)",-7908437.188579296,5211067.780241204
459370,101001127546,07/13/2014 11:40:13 AM,,07/18/2014 04:38:25 PM,ONTIME,Closed,Case Closed Bulk Item Automation,Schedule Bulk Item Pickup,Public Works Department,Sanitation,Schedule a Bulk Item Pickup SS,PWDx_Schedule a Bulk Item Pickup,PWDx,,,41 Revere St  Boston  MA  02114,3.0,1B,8.0,A1,Beacon Hill,14.0,Ward 5,0504,CD,41 Revere St,2114.0,Address,115380.0,42.3597,-71.0679,Self Service,"(42.3597, -71.0679)",-7911242.439747286,5215013.979595871
369648,101000759452,02/09/2013 09:06:55 PM,02/13/2013 08:30:00 AM,02/17/2013 12:37:46 PM,OVERDUE,Closed,Case Closed Case Resolved  COMPLETED,Request for Snow Plowing,Public Works Department,Street Cleaning,Request for Snow Plowing,PWDx_Requests for Snow Plowing,PWDx,,,,,,,,,,,,,,,,,42.3594,-71.0587,Self Service,"(0, 0)",-7910218.300431989,5214968.784796895
758465,101001841798,06/22/2016 08:43:00 AM,06/23/2016 08:43:43 AM,09/15/2016 10:03:44 AM,OVERDUE,Closed,Case Closed. Closed date : 2016-09-15 10:03:44.33 Case Noted Timings have been updated to better progress the ramp.,Traffic Signal Inspection,Transportation - Traffic Division,Signs & Signals,Traffic Signal Inspection,BTDT_Engineering_Request for Traffic Signal Study or Review,BTDT,,,INTERSECTION of Cross St & North St  Boston  MA,3.0,1B,1.0,A1,Downtown / Financial District,3.0,3,0303,,INTERSECTION Cross St & North St,,Intersection,16516.0,42.3594,-71.0587,Citizens Connect App,"(0, 0)",-7910218.300431989,5214968.784796895
721450,101001933096,10/17/2016 07:46:04 PM,10/21/2016 08:30:00 AM,10/18/2016 11:17:43 AM,ONTIME,Closed,Case Closed. Closed date : 2016-10-18 11:17:43.107 Case Noted cited improper storage,Poor Conditions of Property,Public Works Department,Code Enforcement,Poor Conditions of Property,PWDx_Code Enforcement,PWDx,,,1008-1012 Tremont St  Mission Hill  MA  02120,4.0,10B,7.0,D4,Roxbury,13.0,09,0904,,1008-1012 Tremont St,2120.0,Address,344891.0,42.3367,-71.0847,Citizens Connect App,"(42.3367, -71.0847)",-7913112.607192614,5211549.670633245
908740,101001990822,01/18/2017 03:31:00 AM,03/23/2017 08:30:00 AM,01/21/2017 09:27:17 AM,ONTIME,Closed,Case Closed. Closed date : 2017-01-21 09:27:17.217 Case Resolved Done,Graffiti Removal,Property Management,Graffiti,Graffiti Removal,PROP_GRAF_GraffitiRemoval,PROP,https://mayors24.cityofboston.gov/media/boston/report/photos/587f27dc04854e2a97036861/report.jpg,https://cityworker.cityofboston.gov:8443/attachments/report/587f282570b4b1308fa1bc0a/closed_photo/Report.jpg,3399 Washington St  Jamaica Plain  MA  02130,9.0,02,6.0,E13,Jamaica Plain,11.0,Ward 11,1107,I,3399 Washington St,2130.0,Address,397287.0,42.3085,-71.1058,Citizens Connect App,"(42.3085, -71.1058)",-7915461.448448352,5207303.855239696
638098,101001178075,09/22/2014 11:08:49 AM,09/24/2014 11:08:49 AM,09/22/2014 12:42:49 PM,ONTIME,Closed,Case Closed Case Resolved,Requests for Street Cleaning,Public Works Department,Street Cleaning,Requests for Street Cleaning,PWDx_District 10B: Roxbury,PWDx,,,1965-1967 Columbus Ave  Roxbury  MA  02119,9.0,02,7.0,E13,Jamaica Plain,11.0,Ward 11,1105,C,1965-1967 Columbus Ave,2119.0,Address,163666.0,42.3153,-71.0983,Constituent Call,"(42.3153, -71.0983)",-7914626.552267402,5208327.494788088
495025,101001706730,02/02/2016 10:33:17 AM,02/09/2016 10:33:16 AM,02/02/2016 10:33:22 AM,ONTIME,Closed,Case Closed. Closed date : 2016-02-02 10:33:22.803 Case Resolved Created Request for Recycling Bin,Recycling Cart Return,Public Works Department,Recycling,Recycling Cart Return,PWDx_IPL Damaged Cart Replacement,PWDx,https://cityworker.cityofboston.gov:8443/attachments/report/56b0cc39d052af2717ae3a0c/photo/Report.jpg,,210 Calumet St  Mission Hill  MA  02120,9.0,10A,8.0,B2,Mission Hill,14.0,Ward 10,1005,R2,210 Calumet St,2120.0,Address,24967.0,42.3289,-71.1006,City Worker App,"(42.3289, -71.1006)",-7914882.587096226,5210375.10575577
657534,101001399235,05/31/2015 01:43:00 PM,05/30/2016 01:43:32 PM,05/31/2015 02:15:14 PM,ONTIME,Closed,Case Closed Case Resolved  The tree was pruned by Northern Tree Service  to the City of Boston tree pruning specifications.,Tree Maintenance Requests,Parks & Recreation Department,Trees,Tree Maintenance Requests,PARK_Tree Maintenance Request,PARK,,,INTERSECTION of American Legion Hwy & Walk Hill St  Roslindale  MA,12.0,02,4.0,B3,Roslindale,9.0,Ward 14,1408.0,,INTERSECTION American Legion Hwy & Walk Hill St,,Intersection,395.0,42.2877,-71.1067,Employee Generated,"(42.2877, -71.1067)",-7915561.635990066,5204173.408731778
17366,101001085230,05/08/2014 09:27:08 PM,05/13/2014 08:30:00 AM,05/09/2014 08:50:21 AM,ONTIME,Closed,Case Closed Case Noted Nothing out at location at 8:48 a.m. on 5/9/14. Recycling that was out has been collected by Supervisor Williams. A reminder will be put in for next week. Cars are making it hard for truck to access street.,Missed Recycling: District 03,Public Works Department,Sanitation,Missed Trash/Recycling/Yard Waste/Bulk Item,PWDx_Missed Trash\Recycling\Yard Waste\Bulk Item,PWDx,,,6 Whittemore Ter  Dorchester  MA  02125,7.0,03,3.0,C11,Dorchester,8.0,Ward 15,1501,R3,6 Whittemore Ter,2125.0,Address,149477.0,42.3137,-71.0659,Constituent Call,"(42.3137, -71.0659)",-7911019.800765701,5208086.628474029
678699,101000412028,04/24/2012 08:27:29 AM,06/08/2012 08:27:28 AM,05/08/2012 12:01:33 PM,ONTIME,Closed,"Case Closed Case Noted Field verified: ""STATE LAW  YIELD TO PEDESTRIANS IN CROSSWALK"" signs were already installed at this location.",New Sign  Crosswalk or Pavement Marking,Transportation - Traffic Division,Signs & Signals,New Sign  Crosswalk or Pavement Marking,BTDT_Engineering_New Sign and Pavement Marking Requests,BTDT,,,INTERSECTION of Beacon St & Spruce St  Boston  MA,3.0,1B,8.0,A1,Beacon Hill,14.0,Ward 5,0503,,INTERSECTION Beacon St & Spruce St,,Intersection,1107.0,42.3566,-71.0676,Constituent Call,"(42.3566, -71.0676)",-7911209.043900048,5214546.977077781
755050,101000473360,09/02/2012 06:00:23 PM,09/11/2012 08:30:00 AM,09/04/2012 11:27:44 AM,ONTIME,Closed,Case Closed Case Noted picked up,Student Move-in Issues,Mayor's 24 Hour Hotline,General Request,Student Move-in Issues,"INFO03_Mobile ""Other"" Requests",INFO,,,551 Columbus Ave  Roxbury  MA  02118,4.0,1C,7.0,D4,South End,6.0,Ward 4,0404,R1,551 Columbus Ave,2118.0,Address,35955.0,42.3415,-71.081,Citizens Connect App,"(42.3415, -71.081)",-7912700.725076679,5212272.552201052
152557,101001305828,02/19/2015 08:28:45 AM,02/20/2015 08:30:00 AM,02/23/2015 11:39:47 AM,OVERDUE,Closed,Case Closed Case Noted We will return on next scheduled trash day.,Missed Recycling: District 02,Public Works Department,Sanitation,Missed Trash/Recycling/Yard Waste/Bulk Item,PWDx_Missed Trash\Recycling\Yard Waste\Bulk Item,PWDx,,,10 Ridge St  Roslindale  MA  02131,12.0,02,5.0,E5,Roslindale,10.0,Ward 19,1910,R2,10 Ridge St,2131.0,Address,115893.0,42.2854,-71.1208,Constituent Call,"(42.2854, -71.1208)",-7917131.240810251,5203827.317065952
513636,101001546714,09/01/2015 01:45:25 PM,11/30/2015 01:45:25 PM,,OVERDUE,Open,,Pavement Marking Maintenance,Transportation - Traffic Division,Operations,Pavement Marking Maintenance,BTDT_Pavement Marking_Maintenance,BTDT,,,INTERSECTION of Francis St & Huntington Ave  Boston  MA,4.0,10A,8.0,B2,Mission Hill,14.0,Ward 10,1003,,INTERSECTION Francis St & Huntington Ave,,Intersection,5071.0,42.3342,-71.1049,Constituent Call,"(42.3342, -71.1049)",-7915361.260906639,5211173.191669293
392318,101001133393,07/21/2014 10:36:43 AM,07/23/2014 10:36:43 AM,07/21/2014 11:12:08 AM,ONTIME,Closed,Case Closed Case Resolved,Requests for Street Cleaning,Public Works Department,Street Cleaning,Requests for Street Cleaning,PWDx_District 03: North Dorchester,PWDx,,,26 Taft St  Dorchester  MA  02125,7.0,03,3.0,C11,Dorchester,7.0,Ward 13,1308,R3,26 Taft St,2125.0,Address,317563.0,42.3173,-71.0584,City Worker App,"(42.3173, -71.0584)",-7910184.9045847505,5208628.586292291
333118,101000337355,10/03/2011 09:57:53 AM,10/05/2011 09:57:50 AM,10/03/2011 09:59:22 AM,ONTIME,Closed,Case Closed Case Scheduled Items have been scheduled for pickup.,Schedule a Bulk Item Pickup,Public Works Department,Sanitation,Schedule a Bulk Item Pickup,PWDx_Schedule a Bulk Item Pickup,PWDx,,,6 Codman Park  Roxbury  MA  02119,9.0,10B,7.0,B2,Roxbury,13.0,Ward 11,1103,R4,6 Codman Park,2119.0,Address,34110.0,42.3201,-71.0927,Employee Generated,"(42.3201, -71.0927)",-7914003.163118959,5209050.130474963
820392,101000919051,09/05/2013 08:24:37 AM,09/09/2013 08:30:00 AM,,OVERDUE,Open,,Unsanitary Conditions - Establishment,Inspectional Services,Health,Unsanitary Conditions - Establishment,ISD_Health (INTERNAL),ISD,,,2101 Washington St  Roxbury  MA  02119,7.0,10B,7.0,B2,Roxbury,13.0,Ward 9,0904,C,2101 Washington St,2119.0,Address,330766.0,42.3323,-71.0818,Constituent Call,"(42.3323, -71.0818)",-7912789.780669313,5210887.077665415
514948,101001578701,09/15/2015 09:25:35 AM,,09/15/2015 09:25:36 AM,ONTIME,Closed,Case Closed. Closed date : 2015-09-15 09:25:36.72 Internal Case Performed by Highway Maintenance crew.,Pothole Repair (Internal),Public Works Department,Highway Maintenance,Pothole Repair (Internal),PWDx_District 06: West Roxbury and Roslindale,PWDx,,,3 Caspar St  West Roxbury  MA  02132,12.0,06,6.0,E5,West Roxbury,12.0,Ward 20,2017,R1,3 Caspar St,2132.0,Address,26222.0,42.2898,-71.1648,Employee Generated,"(42.2898, -71.1648)",-7922029.298405155,5204489.416506094
488481,101001400906,06/02/2015 03:55:00 PM,06/09/2015 03:55:40 PM,06/05/2015 08:52:23 AM,ONTIME,Closed,Case Closed. Closed date : 2015-06-05 08:52:23.053 ADCLSD: Administratively Closed,Electrical,Inspectional Services,Building,Electrical,ISD_Building (INTERNAL),ISD,,,1481-1491 Tremont St  Mission Hill  MA  02120,9.0,10A,8.0,B2,Mission Hill,14.0,Ward 10,1002,E,1481-1491 Tremont St,2120.0,Address,136852.0,42.3322,-71.0981,Constituent Call,"(42.3322, -71.0981)",-7914604.288369243,5210872.019273057
583231,101001872017,07/31/2016 02:30:09 PM,08/02/2016 08:30:00 AM,08/01/2016 06:46:31 AM,ONTIME,Closed,Case Closed. Closed date : 2016-08-01 06:46:31.02 Case Resolved Cloths on private property,Requests for Street Cleaning,Public Works Department,Street Cleaning,Requests for Street Cleaning,PWDx_District 09: East Boston,PWDx,https://mayors24.cityofboston.gov/media/boston/report/photos/579e43af6963abd93b16dfbe/report.jpg,,32 Trenton St  East Boston  MA  02128,1.0,09,1.0,A7,East Boston,1.0,Ward 1,0107,R2,32 Trenton St,2128.0,Address,393232.0,42.3784,-71.0381,Citizens Connect App,"(42.3784, -71.0381)",-7907925.118921648,5217831.548118197
566996,101000320349,08/28/2011 01:43:09 PM,08/30/2011 01:43:08 PM,08/29/2011 02:06:35 PM,ONTIME,Closed,Case Closed Case Noted Nothing found at the time of inspection.,Tree Emergencies,Parks & Recreation Department,Trees,Tree Emergencies,PARK_Tree Emergencies,PARK,,,30 Wadsworth St  Allston  MA  02134,11.0,04,9.0,D14,Allston / Brighton,15.0,Ward 21,2104,R1,30 Wadsworth St,2134.0,Address,141286.0,42.3551,-71.1253,Constituent Call,"(42.3551, -71.1253)",-7917632.17851882,5214321.016387785
232144,101001225699,12/01/2014 10:50:18 AM,12/02/2014 10:50:18 AM,12/01/2014 02:27:20 PM,ONTIME,Closed,Case Closed Case Resolved,Empty Litter Basket,Public Works Department,Highway Maintenance,Empty Litter Basket,PWDx_District 1C: Downtown,PWDx,https://mayors24.cityofboston.gov/media/boston/report/photos/547c8e2f04859d46f76153cd/report.jpg,,65B-69 Warren Ave  Boston  MA  02116,4.0,1C,2.0,D4,South End,6.0,Ward 4,0401,,65B-69 Warren Ave,2116.0,Address,171000.0,42.3594,-71.0587,Citizens Connect App,"(0, 0)",-7910218.300431989,5214968.784796895
897556,101001980112,01/03/2017 07:38:00 AM,01/04/2017 08:30:00 AM,01/05/2017 09:00:05 AM,OVERDUE,Closed,Case Closed. Closed date : 2017-01-05 09:00:05.5 Case Resolved Dear Constituent     The Boston Public Works Construction Inspection Unit (CIU) Inspector states that this is a newly paved intersection.      If this is still an issue  please contact the inspector David Noonan at 781-351-0006 with more information.    For any other questions or concerns  please contact the number listed below    Sincerely     Mark Cardarelli  Supervisor of Utility Coordination and Compliance  Boston Public Works Department  617-635-4951 Office,Request for Pothole Repair,Public Works Department,Highway Maintenance,Request for Pothole Repair,PWDx_Contractor Complaints,PWDx,,,INTERSECTION of Lancaster St & Causeway St  Boston  MA,3.0,1B,2.0,A1,Downtown / Financial District,3.0,3,0306,,INTERSECTION Lancaster St & Causeway St,,Intersection,15704.0,42.3594,-71.0587,Citizens Connect App,"(0, 0)",-7910218.300431989,5214968.784796895
175328,101001340563,03/24/2015 11:11:59 AM,07/22/2015 11:11:59 AM,03/24/2015 03:48:16 PM,ONTIME,Closed,Case Closed Case Invalid,Unsatisfactory Living Conditions,Inspectional Services,Housing,Unsatisfactory Living Conditions,ISD_Housing (INTERNAL),ISD,,,363 Massachusetts Ave  Boston  MA  02115,9.0,10A,7.0,D4,Boston,13.0,04,0408,EA,363 Massachusetts Ave,2115.0,Address,271672.0,42.3417,-71.0838,Constituent Call,"(42.3417, -71.0838)",-7913012.419650899,5212302.673463934
575445,101000764527,02/10/2013 10:31:59 AM,02/13/2013 08:30:00 AM,02/13/2013 10:16:06 AM,OVERDUE,Closed,Case Closed Case Resolved,Request for Snow Plowing,Public Works Department,Street Cleaning,Request for Snow Plowing,PWDx_District 08: Hyde Park,PWDx,,,18 Mason St  Hyde Park  MA  02136,12.0,08,5.0,E18,Hyde Park,10.0,Ward 18,1818,R2,18 Mason St,2136.0,Address,270526.0,42.2477,-71.1264,Self Service,"(42.2477, -71.1264)",-7917754.629958694,5198156.223057912
194992,101000451304,07/18/2012 08:35:09 AM,08/15/2012 08:35:08 AM,07/28/2012 01:53:18 PM,ONTIME,Closed,Case Closed Case Resolved  alex delivered serial #0512410528,Request for Recycling Cart,Public Works Department,Recycling,Request for Recycling Cart,PWDx_Recycling,PWDx,,,6 Woodville St  Roxbury  MA  02119,7.0,03,7.0,B2,Roxbury,13.0,Ward 8,0807,R3,6 Woodville St,2119.0,Address,152017.0,42.321000000000005,-71.0757,Constituent Call,"(42.321, -71.0757)",-7912110.731775475,5209185.630803093
79365,101001900500,09/05/2016 12:32:25 PM,09/07/2016 08:30:00 AM,09/05/2016 12:32:35 PM,ONTIME,Closed,Case Closed. Closed date : 2016-09-05 12:32:35.843 Case Invalid Case opened in error,Missed Trash/Recycling/Yard Waste/Bulk Item,Public Works Department,Sanitation,Missed Trash/Recycling/Yard Waste/Bulk Item,PWDx_Missed Trash\Recycling\Yard Waste\Bulk Item,PWDx,,,18 Wardman Rd  Roxbury  MA  02119,9.0,10B,7.0,E13,Roxbury,13.0,Ward 11,1103,R3,18 Wardman Rd,2119.0,Address,142731.0,42.315,-71.095,Constituent Call,"(42.315, -71.095)",-7914259.197947785,5208282.3318877565
386875,101001034736,02/24/2014 09:42:14 AM,02/25/2014 09:42:13 AM,02/24/2014 12:09:03 PM,ONTIME,Closed,Case Closed Case Resolved picked up dead animal,Pick up Dead Animal,Public Works Department,Street Cleaning,Pick up Dead Animal,PWDx_District 03: North Dorchester,PWDx,,,49 Stoughton St  Dorchester  MA  02125,7.0,03,7.0,C11,Dorchester,13.0,13,1305,EA,49 Stoughton St,2125.0,Address,314691.0,42.3162,-71.0636,Constituent Call,"(42.3162, -71.0636)",-7910763.765936875,5208462.984780829
807250,101001044370,03/10/2014 06:30:58 PM,,03/12/2014 12:26:45 PM,ONTIME,Closed,Case Closed Case Noted,Traffic Signal Repair Problem,Mayor's 24 Hour Hotline,Notification,Notification,INFO09_Current Events,INFO,,,INTERSECTION of Berkeley St & Marlborough St  Boston  MA,4.0,1C,8.0,D4,Back Bay,14.0,Ward 5,0506,,INTERSECTION Berkeley St & Marlborough St,,Intersection,1347.0,42.354,-71.0744,Constituent Call,"(42.354, -71.0744)",-7911966.016437443,5214155.315309461
787375,101000360528,12/05/2011 01:01:22 PM,01/04/2012 01:01:22 PM,,OVERDUE,Open,,Heat - Excessive  Insufficient,Inspectional Services,Housing,Heat - Excessive  Insufficient,ISD_Housing (INTERNAL),ISD,,,14 Pearl St  Dorchester  MA  02125,7.0,03,3.0,C11,Dorchester,7.0,Ward 13,1309,A,14 Pearl St,2125.0,Address,291713.0,42.3146,-71.0579,Constituent Call,"(42.3146, -71.0579)",-7910129.2448393535,5208222.115022204
684409,101000304363,07/20/2011 08:15:15 PM,07/25/2011 08:30:00 AM,07/21/2011 07:27:20 AM,ONTIME,Closed,Case Closed Case Scheduled Items have been scheduled for pickup.,Schedule a Bulk Item Pickup,Public Works Department,Sanitation,Schedule a Bulk Item Pickup,PWDx_Schedule a Bulk Item Pickup,PWDx,,,13 Mount Pleasant St  Hyde Park  MA  02136,12.0,08,5.0,E18,Hyde Park,10.0,Ward 18,1816,R1,13 Mount Pleasant St,2136.0,Address,98437.0,42.2489,-71.1165,Self Service,"(42.2489, -71.1165)",-7916652.566999841,5198336.6830925485
18340,101001301346,02/17/2015 01:16:43 PM,02/18/2015 01:16:43 PM,05/04/2015 04:37:20 PM,OVERDUE,Closed,Case Closed. Closed date : 2015-05-04 16:37:20.33 Case Noted,Parking Enforcement,Transportation - Traffic Division,Enforcement & Abandoned Vehicles,Parking Enforcement,INFO_Reallocation From Dept,INFO,,,1595 Centre St  West Roxbury  MA  02132,9.0,06,6.0,E5,West Roxbury,12.0,Ward 20,2006,R2,1595 Centre St,2132.0,Address,27669.0,42.2887,-71.1437,Constituent Call,"(42.2887, -71.1437)",-7919680.457149417,5204323.887310432
749082,101001252738,01/23/2015 02:10:24 PM,03/30/2015 02:10:24 PM,04/14/2015 08:27:04 AM,OVERDUE,Closed,Case Closed Case Resolved Graffiti case has been completed and closed.,Graffiti: Ward 5  0501,Property Management,Graffiti,Graffiti Removal,PROP_GRAF_GraffitiRemoval,PROP,https://mayors24.cityofboston.gov/media/boston/report/photos/54c29c8d6963753f0d6c3e52/report.jpg,,100-98 Chandler St  Boston  MA  02116,4.0,1C,2.0,D4,South End,6.0,Ward 5,0501,CM,100-98 Chandler St,2116.0,Address,28615.0,42.3463,-71.0729,Citizens Connect App,"(42.3463, -71.0729)",-7911799.037201255,5212995.488956545
23601,101001046496,03/13/2014 02:52:30 PM,04/10/2014 02:52:30 PM,04/04/2014 01:38:47 PM,ONTIME,Closed,Case Closed Case Resolved delivered #0713434426,Request for Recycling Cart,Public Works Department,Recycling,Request for Recycling Cart,PWDx_Recycling,PWDx,,,27 Worcester St  Roxbury  MA  02118,4.0,1C,7.0,D4,South End,6.0,Ward 9,0902,CD,27 Worcester St,2118.0,Address,152427.0,42.3383,-71.0763,Constituent Call,"(42.3383, -71.0763)",-7912177.523469951,5211790.6250247145
541529,101000412811,04/25/2012 11:52:30 AM,04/27/2012 11:52:30 AM,04/26/2012 03:03:55 PM,ONTIME,Closed,Case Closed VIOISS: Violation Filed,Unsanitary Conditions - Establishment,Inspectional Services,Health,Unsanitary Conditions - Establishment,ISD_Health (INTERNAL),ISD,,,1508 Dorchester Ave  Dorchester  MA  02122,7.0,07,3.0,C11,Dorchester,7.0,Ward 16,1601,C,1508 Dorchester Ave,2122.0,Address,156760.0,42.2993,-71.0603,Constituent Call,"(42.2993, -71.0603)",-7910396.411617258,5205919.107135456
902929,101001983096,01/06/2017 12:26:00 PM,01/23/2017 12:26:14 PM,01/12/2017 11:20:22 AM,ONTIME,Closed,Case Closed. Closed date : 2017-01-12 11:20:22.01 Case Resolved,Sign Repair,Transportation - Traffic Division,Signs & Signals,Sign Repair,BTDT_Sign Shop_Sign Installation,BTDT,,,1220-1226 Hyde Park Ave  Hyde Park  MA  02136,12.0,08,5.0,E18,Hyde Park,10.0,Ward 18,1813,C,1220-1226 Hyde Park Ave,2136.0,Address,77085.0,42.257,-71.1236,City Worker App,"(42.257, -71.1236)",-7917442.935384472,5199554.878131226
428109,101001639490,11/20/2015 10:32:00 AM,11/19/2016 10:32:01 AM,11/07/2016 10:40:28 AM,ONTIME,Closed,Case Closed. Closed date : 2016-11-07 10:40:28.493 Case Resolved Tree was removed by North-Eastern Tree Service. A new tree request case will be made for this location. If you have any questions please call the Park Line at 617-635-7275.,Tree Maintenance Requests,Parks & Recreation Department,Trees,Tree Maintenance Requests,PARK_Tree Maintenance Request,PARK,,,175 Callender St  Dorchester  MA  02124,8.0,07,4.0,B3,Greater Mattapan,9.0,Ward 14,1410,R3,175 Callender St,2124.0,Address,24810.0,42.2879,-71.0865,Constituent Call,"(42.2879, -71.0865)",-7913312.982276042,5204203.504256407
701738,101000491840,10/13/2012 09:09:37 PM,10/30/2012 08:30:00 AM,10/22/2012 11:01:08 AM,ONTIME,Closed,Case Closed Case Resolved Work completed 10/22/12.,Sign Repair,Transportation - Traffic Division,Signs & Signals,Sign Repair,BTDT_Sign Shop_Sign Installation,BTDT,,,35-45 Peterborough St  Boston  MA  02215,4.0,10A,8.0,D4,Fenway / Kenmore / Audubon Circle / Longwood,14.0,Ward 5,0502,EA,35-45 Peterborough St,2215.0,Address,168716.0,42.3442,-71.0966,Citizens Connect App,"(42.3442, -71.0966)",-7914437.309133053,5212679.19733448
54491,101001640564,11/22/2015 01:27:00 PM,11/24/2015 01:27:32 PM,11/27/2015 08:54:00 AM,OVERDUE,Closed,Case Closed. Closed date : 2015-11-27 08:54:00.377 NOBASE: No Basis,Work w/out Permit,Inspectional Services,Building,Work w/out Permit,ISD_Building (INTERNAL),ISD,,,INTERSECTION of Lawton St & Lawton Ter  Hyde Park  MA,12.0,08,5.0,E18,Hyde Park,10.0,Ward 18,1820,,INTERSECTION Lawton St & Lawton Ter,,Intersection,6799.0,42.2349,-71.1281,Constituent Call,"(42.2349, -71.1281)",-7917943.8730930425,5196231.529575461
668317,101001238401,12/26/2014 01:33:50 PM,,12/26/2014 01:33:51 PM,ONTIME,Closed,Case Closed Internal Case Performed by Highway Maintenance crew.,Pothole Repair (Internal),Public Works Department,Highway Maintenance,Pothole Repair (Internal),PWDx_District 02: Jamaica Plain,PWDx,,,61 Stella Rd  Roslindale  MA  02131,12.0,02,5.0,E18,Roslindale,10.0,Ward 18,1807.0,R1,61 Stella Rd,2131.0,Address,130494.0,42.2809,-71.117,Employee Generated,"(42.2809, -71.117)",-7916708.226745238,5203150.21774014
759564,101001272044,02/03/2015 06:55:25 PM,02/06/2015 08:30:00 AM,02/12/2015 05:42:54 PM,OVERDUE,Closed,Case Closed Case Noted Snow has been removed.,Request for Snow Plowing,Public Works Department,Street Cleaning,Request for Snow Plowing,PWDx_District 03: North Dorchester,PWDx,,,INTERSECTION of Intervale St & Magnolia St  Dorchester  MA,7.0,03,4.0,B2,Roxbury,13.0,Ward 14,1401,,INTERSECTION Intervale St & Magnolia St,,Intersection,6501.0,42.3097,-71.0752,Citizens Connect App,"(42.3097, -71.0752)",-7912055.072030077,5207484.489477165
21263,101001920988,09/30/2016 05:29:00 AM,12/07/2016 08:30:00 AM,10/06/2016 02:41:08 PM,ONTIME,Closed,Case Closed. Closed date : 2016-10-06 14:41:08.683 Case Resolved done,Graffiti Removal,Property Management,Graffiti,Graffiti Removal,PROP_GRAF_GraffitiRemoval,PROP,https://mayors24.cityofboston.gov/media/boston/report/photos/57ee30846963a1cc488bacda/photo_20160930_052935.jpg,https://cityworker.cityofboston.gov:8443/attachments/report/57ee30c5d052905713a24e32/closed_photo/Report.jpg,67 Bennington St  East Boston  MA  02128,1.0,09,1.0,A7,East Boston,1.0,Ward 1,0106,C,67 Bennington St,2128.0,Address,14867.0,42.3757,-71.0365,Citizens Connect App,"(42.3757, -71.0365)",-7907747.007736379,5217424.681594754
648822,101000361088,12/06/2011 06:00:14 PM,12/08/2011 06:00:14 PM,12/22/2011 03:08:39 PM,OVERDUE,Closed,Case Closed NOVIO: No Violation Found/No Cause,Work w/out Permit,Inspectional Services,Building,Work w/out Permit,ISD_Building (INTERNAL),ISD,,,96 Glendower Rd  Roslindale  MA  02131,12.0,06,5.0,E5,Roslindale,10.0,Ward 18,1810,R1,96 Glendower Rd,2131.0,Address,64296.0,42.2761,-71.1325,Self Service,"(42.2761, -71.1325)",-7918433.678852531,5202428.031757262
599145,101001782611,05/04/2016 04:31:00 PM,07/08/2016 04:31:35 PM,05/10/2016 10:45:02 AM,ONTIME,Closed,Case Closed. Closed date : 2016-05-10 10:45:02.157 Case Resolved graffiti removed. Done,Graffiti Removal,Property Management,Graffiti,Graffiti Removal,PROP_GRAF_GraffitiRemoval,PROP,https://mayors24.cityofboston.gov/media/boston/report/photos/572a5c2a04859952567003bb/report.jpg,https://cityworker.cityofboston.gov:8443/attachments/report/572a5c68d05243d389fac3ed/closed_photo/Report.jpg,449 Cambridge St  Allston  MA  02134,11.0,04,9.0,D14,Allston / Brighton,15.0,Ward 22,2202,C,449 Cambridge St,2134.0,Address,25132.0,42.3545,-71.1357,Citizens Connect App,"(42.3545, -71.1357)",-7918789.90122307,5214230.633621893
732648,101001134039,07/21/2014 09:31:45 PM,07/24/2014 08:30:00 AM,07/22/2014 08:19:18 AM,ONTIME,Closed,Case Closed Case Noted Trash picked up at 8:19 a.m. on 7/22/14.,Missed Trash: District 02,Public Works Department,Sanitation,Missed Trash/Recycling/Yard Waste/Bulk Item,PWDx_Missed Trash\Recycling\Yard Waste\Bulk Item,PWDx,,,9 Brownson Ter  Roslindale  MA  02131,9.0,02,6.0,E5,West Roxbury,12.0,Ward 20,2006,R1,9 Brownson Ter,2131.0,Address,22819.0,42.2999,-71.1291,Constituent Call,"(42.2999, -71.1291)",-7918055.192583835,5206009.4106268035
602462,101000991977,12/27/2013 11:53:37 AM,12/17/2015 11:53:37 AM,08/13/2014 10:44:32 AM,ONTIME,Closed,Case Closed Case Resolved The New Tree was planted by Leahy Landscaping in the Spring of 2014 and is under Warranty until the Spring of 2016.,New Tree Requests,Parks & Recreation Department,Trees,New Tree Requests,PARK_New Tree Requests,PARK,,,43 Rexhame St  Roslindale  MA  02131,12.0,06,5.0,E5,Roslindale,10.0,Ward 20,2008,R1,43 Rexhame St,2131.0,Address,115575.0,42.2849,-71.1421,Constituent Call,"(42.2849, -71.1421)",-7919502.345964148,5203752.081419269
735640,101001932303,10/17/2016 08:36:33 AM,10/18/2016 08:36:33 AM,10/17/2016 03:07:23 PM,ONTIME,Closed,Case Closed. Closed date : 2016-10-17 15:07:23.947 Case Resolved Repaired problem back to normal operation,Traffic Signal Inspection,Transportation - Traffic Division,Signs & Signals,Traffic Signal Inspection,BTDT_Traffic Signal_Repair,BTDT,https://mayors24.cityofboston.gov/media/boston/report/photos/5804c5ca696338e4faae211d/report.jpg,,INTERSECTION of Arthur St & N Beacon St  Allston  MA,11.0,04,8.0,D14,Allston / Brighton,15.0,22,2205,,INTERSECTION Arthur St & N Beacon St,,Intersection,15958.0,42.3594,-71.0587,Citizens Connect App,"(0, 0)",-7910218.300431989,5214968.784796895
707511,101001708278,02/04/2016 07:51:22 AM,05/04/2016 07:51:21 AM,,OVERDUE,Open,,Pavement Marking Maintenance,Transportation - Traffic Division,Operations,Pavement Marking Maintenance,BTDT_Pavement Marking_Maintenance,BTDT,,,INTERSECTION of Austin St & New Rutherford Ave  Charlestown  MA,3.0,1A,1.0,A15,Charlestown,2.0,Ward 2,0201,,INTERSECTION Austin St & New Rutherford Ave,,Intersection,784.0,42.3742,-71.068,Employee Generated,"(42.3742, -71.068)",-7911253.571696366,5217198.652195793
861654,101000378955,01/30/2012 10:18:19 AM,07/28/2013 10:18:13 AM,05/14/2013 02:52:30 PM,ONTIME,Closed,Case Closed Case Resolved Tree was removed by Royer Tree Service. A new tree request case will be made for this location. If you have any questions please call the Park Line at 617-635-7275.,Tree Maintenance Requests,Parks & Recreation Department,Trees,Tree Maintenance Requests,PARK_Tree Maintenance Request,PARK,,,70 Phillips St  Boston  MA  02114,3.0,1B,8.0,A1,Beacon Hill,14.0,Ward 5,0504,CD,70 Phillips St,2114.0,Address,110107.0,42.3602,-71.0692,Employee Generated,"(42.3602, -71.0692)",-7911387.155085318,5215089.304740333
356469,101000815906,04/03/2013 07:03:19 AM,04/05/2013 08:30:00 AM,04/03/2013 12:11:48 PM,ONTIME,Closed,Case Closed Case Resolved hydrant clear,Parking Enforcement,Transportation - Traffic Division,Enforcement & Abandoned Vehicles,Parking Enforcement,BTDT_Parking Enforcement,BTDT,,,65 Chandler St  Boston  MA  02116,4.0,1C,2.0,D4,South End,6.0,Ward 5,0501,RC,65 Chandler St,2116.0,Address,28774.0,42.3469,-71.072,Constituent Call,"(42.3469, -71.072)",-7911698.849659539,5213085.859932039
147666,101001110319,06/17/2014 02:34:40 PM,12/14/2015 02:34:40 PM,06/18/2014 12:41:13 PM,ONTIME,Closed,Case Closed Case Invalid  No eform or case description,Tree Maintenance Requests,Parks & Recreation Department,Trees,Tree Maintenance Requests,PARK_Tree Maintenance Request,PARK,,,INTERSECTION of Thoreau Path & William Cardinal O'Connell Way  Boston  MA,3.0,1B,8.0,A1,Back Bay,3.0,Ward 3,0305,,INTERSECTION Thoreau Path & William Cardinal O'Connell Way,,Intersection,8514.0,42.3632,-71.0651,Constituent Call,"(42.3632, -71.0651)",-7910930.745173066,5215541.268194956
39916,101000447398,07/10/2012 10:25:47 AM,,07/10/2012 10:25:48 AM,ONTIME,Closed,Case Closed Internal Case Performed by Highway Maintenance crew.,Pothole Repair (Internal),Public Works Department,Highway Maintenance,Pothole Repair (Internal),PWDx_District 02: Jamaica Plain,PWDx,,,9-11 Kenton Rd  Jamaica Plain  MA  02130,9.0,02,6.0,E13,Jamaica Plain,11.0,Ward 11,1107,R2,9-11 Kenton Rd,2130.0,Address,81379.0,42.3069,-71.1063,Employee Generated,"(42.3069, -71.1063)",-7915517.108193749,5207063.0149461515
550930,101000854958,06/07/2013 07:18:51 AM,05/28/2015 07:18:51 AM,07/17/2013 08:48:45 AM,ONTIME,Closed,Case Closed CLOSED: Closed/No Permit,Contractors Complaint,Inspectional Services,Building,Contractors Complaint,ISD_Building (INTERNAL),ISD,,,1672-1672R Washington St  Roxbury  MA  02118,4.0,1C,2.0,D4,South End,6.0,08,0802,,1672-1672R Washington St,2118.0,Address,343880.0,42.3373,-71.0753,Constituent Call,"(42.3373, -71.0753)",-7912066.203979157,5211640.027811607
699730,101000324129,09/02/2011 09:59:30 AM,09/06/2011 09:59:25 AM,09/02/2011 10:00:18 AM,ONTIME,Closed,Case Closed Case Scheduled Items have been scheduled for pickup.,Schedule a Bulk Item Pickup,Public Works Department,Sanitation,Schedule a Bulk Item Pickup,PWDx_Schedule a Bulk Item Pickup,PWDx,,,3 School St  Dorchester  MA  02124,8.0,03,4.0,B3,Dorchester,9.0,Ward 17,1701,R1,3 School St,2124.0,Address,123925.0,42.2968,-71.0727,Employee Generated,"(42.2968, -71.0727)",-7911776.773303094,5205542.85184972
924042,101001988027,01/13/2017 08:25:32 AM,02/12/2017 08:25:32 AM,,OVERDUE,Open,,Rodent Activity,Inspectional Services,Environmental Services,Rodent Activity,ISD_Environmental Services (INTERNAL),ISD,,,103 Intervale St  Dorchester  MA  02121,7.0,03,4.0,B2,Roxbury,13.0,Ward 14,1401,R3,103 Intervale St,2121.0,Address,78700.0,42.3102,-71.0769,Constituent Call,"(42.3102, -71.0769)",-7912244.315164426,5207559.754759122
351902,101001078324,04/29/2014 08:40:53 PM,,,ONTIME,Open,,Animal Generic Request,Animal Control,Animal Issues,Animal Generic Request,INFO01_GenericeFormforOtherServiceRequestTypes,INFO,,,67 Oakcrest Rd  Mattapan  MA  02126,8.0,08,5.0,E18,Hyde Park,9.0,Ward 18,1805,R1,67 Oakcrest Rd,2126.0,Address,104684.0,42.2654,-71.1032,Constituent Call,"(42.2654, -71.1032)",-7915172.017772289,5200818.356786713
589150,101001889772,08/24/2016 10:00:00 AM,08/29/2016 10:00:00 AM,09/13/2016 10:59:03 AM,OVERDUE,Closed,Case Closed. Closed date : 2016-09-13 10:59:03.587 ADCLSD: Administratively Closed,Building Inspection Request,Inspectional Services,Building,Building Inspection Request,ISD_Building (INTERNAL),ISD,,,10 Hartland St  Dorchester  MA  02125,7.0,03,3.0,C11,Dorchester,7.0,Ward 13,1308,R3,10 Hartland St,2125.0,Address,70256.0,42.3153,-71.0533,Constituent Call,"(42.3153, -71.0533)",-7909617.175181704,5208327.494788088
778800,101000837725,05/11/2013 09:20:47 AM,11/07/2013 09:20:47 AM,09/10/2014 02:17:20 PM,OVERDUE,Closed,Case Closed Case Resolved INSTALLED AND TIED IN 24'POLE W/ L.E.D.REC.,Knockdown Replacement,Public Works Department,Street Lights,Knockdown Replacement,PWDx_Street Light Knockdown Replacement,PWDx,,,109 Norfolk Ave  Roxbury  MA  02119,7.0,10B,7.0,B2,Roxbury,13.0,Ward 8,0803,R2,109 Norfolk Ave,2119.0,Address,103089.0,42.3269,-71.0721,Maximo Integration,"(42.3269, -71.0721)",-7911709.981608619,5210073.9587355405
584667,101001323634,03/04/2015 10:07:52 AM,03/05/2015 10:07:52 AM,03/04/2015 10:11:41 AM,ONTIME,Closed,Case Closed Case Noted Trash trucks are not in the area yet. Please leave out for collection.,Missed Trash: District 07,Public Works Department,Sanitation,Missed Trash/Recycling/Yard Waste/Bulk Item,PWDx_Missed Trash\Recycling\Yard Waste\Bulk Item,PWDx,,,7 Old Morton St  Mattapan  MA  02126,8.0,07,3.0,B3,Dorchester,7.0,Ward 17,1714,R2,7 Old Morton St,2126.0,Address,105204.0,42.2746,-71.0723,Self Service,"(42.2746, -71.0723)",-7911732.245506777,5202202.359918384
529533,101000793698,02/28/2013 03:24:47 PM,03/14/2013 03:24:47 PM,03/01/2013 12:16:38 PM,ONTIME,Closed,Case Closed Case Noted sign shop has been notified thank you,Sign Repair,Transportation - Traffic Division,Signs & Signals,Sign Repair,BTDT_District 02,BTDT,,,INTERSECTION of Fairmount Ave & Highland St  Hyde Park  MA,12.0,08,5.0,E18,Hyde Park,10.0,Ward 18,1816,,INTERSECTION Fairmount Ave & Highland St,,Intersection,4763.0,42.2509,-71.1166,Self Service,"(42.2509, -71.1166)",-7916663.69894892,5198637.457445933
933392,101002017890,02/17/2017 10:06:00 AM,02/21/2017 10:06:57 AM,02/20/2017 07:27:28 AM,ONTIME,Closed,Case Closed. Closed date : 2017-02-20 07:27:28.83 Case Resolved,Missed Recycling: District 1C,Public Works Department,Sanitation,Missed Trash/Recycling/Yard Waste/Bulk Item,PWDx_Missed Trash\Recycling\Yard Waste\Bulk Item,PWDx,,https://cityworker.cityofboston.gov:8443/attachments/report/58a7137dd052c51cc8fa9643/closed_photo/Report.jpg,2 Cumston St  Roxbury  MA  02118,4.0,1C,7.0,D4,South End,6.0,Ward 9,0902,CM,2 Cumston St,2118.0,Address,372428.0,42.3387,-71.075,Constituent Call,"(42.3387, -71.075)",-7912032.808131919,5211850.864580528
386878,101001613915,10/16/2015 01:38:25 PM,,10/16/2015 01:40:50 PM,ONTIME,Closed,Case Closed. Closed date : 2015-10-16 13:40:50.177 Case Resolved Case resolved  information provided.,Call Log,Disability Department,Disability,Call Log,DISB_General_Request,DISB,,,,,,,,,,,,,,,,,42.3594,-71.0587,Constituent Call,"(0, 0)",-7910218.300431989,5214968.784796895
428959,101001705125,01/31/2016 11:53:57 AM,02/02/2016 08:30:00 AM,02/01/2016 01:25:38 AM,ONTIME,Closed,Case Closed. Closed date : 2016-02-01 01:25:38.797 Case Resolved tagged,Parking Enforcement,Transportation - Traffic Division,Enforcement & Abandoned Vehicles,Parking Enforcement,BTDT_Parking Enforcement,BTDT,https://mayors24.cityofboston.gov/media/boston/report/photos/56ae3c200485cd229efc688c/report.jpg,,863 South St  Roslindale  MA  02131,9.0,06,5.0,E5,Roslindale,10.0,Ward 20,2004,R1,863 South St,2131.0,Address,128987.0,42.2889,-71.1332,Citizens Connect App,"(42.2889, -71.1332)",-7918511.602496088,5204353.983312822
896052,101001977545,12/28/2016 12:35:00 PM,01/03/2017 12:35:05 PM,,OVERDUE,Open,,Building Inspection Request,Inspectional Services,Building,Building Inspection Request,ISD_Building (INTERNAL),ISD,,,20 Saunders St  Allston  MA  02134,11.0,04,9.0,D14,Allston / Brighton,15.0,Ward 21,2106,R1,20 Saunders St,2134.0,Address,122971.0,42.3527,-71.1421,Constituent Call,"(42.3527, -71.1421)",-7919502.345964148,5213959.490501389
394929,101001921306,09/30/2016 10:45:29 AM,10/05/2016 10:45:29 AM,09/30/2016 11:40:56 AM,ONTIME,Closed,Case Closed. Closed date : 2016-09-30 11:40:56.7 Case Noted cited 66 milton av for improper storage of trash at side of property,Poor Conditions of Property,Public Works Department,Code Enforcement,Poor Conditions of Property,PWDx_Code Enforcement,PWDx,,https://cityworker.cityofboston.gov:8443/attachments/report/57ee7accd052905713a26af5/closed_photo/Report.jpg,66 Milton Ave  Dorchester  MA  02124,8.0,07,4.0,B3,Dorchester,9.0,Ward 17,1708,CM,66 Milton Ave,2124.0,Address,95744.0,42.2843,-71.0768,Citizens Connect App,"(42.2843, -71.0768)",-7912233.183215348,5203661.79943142
586365,101000343073,10/17/2011 09:42:08 AM,10/19/2011 09:42:08 AM,10/17/2011 09:49:04 AM,ONTIME,Closed,Case Closed Case Scheduled Items have been scheduled for pickup.,Schedule a Bulk Item Pickup,Public Works Department,Sanitation,Schedule a Bulk Item Pickup,PWDx_Schedule a Bulk Item Pickup,PWDx,,,210 W Eighth St  South Boston  MA  02127,6.0,05,2.0,C6,South Boston / South Boston Waterfront,5.0,Ward 7,0705,R1,210 W Eighth St,2127.0,Address,52556.0,42.3332,-71.0513,Self Service,"(42.3332, -71.0513)",-7909394.536200118,5211022.604274031
239449,101001252729,01/23/2015 01:50:22 PM,01/27/2015 01:50:22 PM,01/29/2015 08:52:41 AM,OVERDUE,Closed,Case Closed NOVIO: No Violation Found/No Cause,Unsanitary Conditions - Establishment,Inspectional Services,Health,Unsanitary Conditions - Establishment,ISD_Health (INTERNAL),ISD,,,60 Everett St  Brighton  MA  02135,11.0,04,9.0,D14,Allston / Brighton,15.0,Ward 22,2205,C,60 Everett St,2135.0,Address,158333.0,42.3566,-71.1392,Constituent Call,"(42.3566, -71.1392)",-7919179.519440847,5214546.977077781
926653,101002011582,02/13/2017 04:38:39 PM,02/14/2017 04:38:40 PM,02/14/2017 08:28:07 AM,ONTIME,Closed,Case Closed. Closed date : 2017-02-14 08:28:07.317 Case Resolved Cited 518  530  and 532 for sidewalks not shoveled,Illegal Dumping,Public Works Department,Code Enforcement,Illegal Dumping,PWDx_Code Enforcement,PWDx,,,518 Beacon St  Boston  MA  02215,4.0,10A,8.0,D4,Back Bay,14.0,Ward 5,0509,A,518 Beacon St,2215.0,Address,11864.0,42.3508,-71.0905,Self Service,"(42.3508, -71.0905)",-7913758.260239216,5213673.292298458
92519,101001229208,12/06/2014 02:51:42 PM,12/22/2014 08:30:00 AM,12/11/2014 01:14:50 PM,ONTIME,Closed,Case Closed Case Resolved Work completed 12/11/14.,Sign Repair,Transportation - Traffic Division,Signs & Signals,Sign Repair,BTDT_Sign Shop_Sign Installation,BTDT,https://mayors24.cityofboston.gov/media/boston/report/photos/54835e410485bc31fdc73203/report.jpg,,INTERSECTION of A St & Richards St  Boston  MA,6.0,05,2.0,C6,South Boston / South Boston Waterfront,5.0,Ward 6,0601,,INTERSECTION A St & Richards St,,Intersection,12.0,42.3444,-71.0531,Citizens Connect App,"(42.3444, -71.0531)",-7909594.911283546,5212709.319890917
918512,101002001435,02/02/2017 09:12:46 AM,02/03/2017 09:12:46 AM,02/02/2017 10:47:34 AM,ONTIME,Closed,Case Closed. Closed date : 2017-02-02 10:47:34.26 Case Resolved Pothole repaired,Request for Pothole Repair,Public Works Department,Highway Maintenance,Request for Pothole Repair,PWDx_District 07: South Dorchester,PWDx,https://cityworker.cityofboston.gov:8443/attachments/report/58933e59d05264983c8ab3e1/photo/Report.jpg,https://cityworker.cityofboston.gov:8443/attachments/report/58933e59d05264983c8ab3e1/closed_photo/Report.jpg,552 Park St  Dorchester  MA  02124,8.0,07,4.0,B3,Dorchester,9.0,Ward 17,1703,R3,552 Park St,2124.0,Address,107390.0,42.2948,-71.0754,City Worker App,"(42.2948, -71.0754)",-7912077.335928236,5205241.8583755465
129804,101001799739,05/26/2016 09:28:00 AM,06/03/2016 09:28:01 AM,,OVERDUE,Open,,Exceeding Terms of Permit,Inspectional Services,Building,Exceeding Terms of Permit,ISD_Building (INTERNAL),ISD,,,16 Saint Andrew Rd  East Boston  MA  02128,1.0,09,1.0,A7,East Boston,1.0,Ward 1,0112,R2,16 Saint Andrew Rd,2128.0,Address,391415.0,42.3854,-71.0046,Constituent Call,"(42.3854, -71.0046)",-7904195.915980072,5218886.468732503
315132,101001053181,03/24/2014 02:48:31 PM,,03/24/2014 02:48:31 PM,ONTIME,Closed,Case Closed Internal Case Performed by Highway Maintenance crew.,Pothole Repair (Internal),Public Works Department,Highway Maintenance,Pothole Repair (Internal),PWDx_District 02: Jamaica Plain,PWDx,,,455 Arborway  Jamaica Plain  MA  02130,9.0,02,6.0,E13,Jamaica Plain,11.0,Ward 11,1108,E,455 Arborway,2130.0,Address,4412.0,42.3009,-71.1095,Employee Generated,"(42.3009, -71.1095)",-7915873.330564287,5206159.9183579115
900979,101001985374,01/10/2017 07:44:05 AM,01/12/2017 07:44:04 AM,01/10/2017 12:15:53 PM,ONTIME,Closed,Case Closed. Closed date : 2017-01-10 12:15:53.307 Case Resolved sidewalk shoveled,Unshoveled Sidewalk,Public Works Department,Code Enforcement,Unshoveled Sidewalk,PWDx_Code Enforcement,PWDx,https://mayors24.cityofboston.gov/media/boston/report/photos/5874d71104856ca33640772d/report.jpg,https://cityworker.cityofboston.gov:8443/attachments/report/5874d75d70b4b1308fa045e4/closed_photo/Report.jpg,172 Orleans St  East Boston  MA  02128,1.0,09,1.0,A7,East Boston,1.0,Ward 1,0103,I,172 Orleans St,2128.0,Address,105950.0,42.3713,-71.0348,Citizens Connect App,"(42.3713, -71.0348)",-7907557.76460203,5216761.677331604
803119,101000739286,01/18/2013 12:39:05 PM,01/22/2013 12:39:05 PM,01/21/2013 09:05:15 AM,ONTIME,Closed,Case Closed Case Referred to External Agency DCR jurisdiction. Information forwarded to DCR.,Request for Pothole Repair,Public Works Department,Highway Maintenance,Request for Pothole Repair,INFO_Reallocation From Dept,INFO,,,INTERSECTION of Morton St & Wildwood St  Mattapan  MA,8.0,07,4.0,B3,Greater Mattapan,9.0,Ward 14,1405,,INTERSECTION Morton St & Wildwood St,,Intersection,7410.0,42.283,-71.089,City Worker App,"(42.283, -71.089)",-7913591.281003024,5203466.191407298
817345,101000334668,09/26/2011 09:35:36 PM,09/29/2011 08:30:00 AM,09/27/2011 08:05:13 AM,ONTIME,Closed,Case Closed Case Resolved Vehicle moved before officer could ticket.,Parking Enforcement,Transportation - Traffic Division,Enforcement & Abandoned Vehicles,Parking Enforcement,BTDT_Parking Enforcement,BTDT,,,1340 Commonwealth Ave  Allston  MA  02134,11.0,04,9.0,D14,Allston / Brighton,15.0,Ward 21,2108,RC,1340 Commonwealth Ave,2134.0,Address,37414.0,42.3478,-71.1355,Self Service,"(42.3478, -71.1355)",-7918767.637324912,5213221.4180125585
812954,101000481272,09/19/2012 09:06:56 AM,03/18/2014 09:06:47 AM,10/02/2012 07:45:40 AM,ONTIME,Closed,Case Closed Case Noted Whole tree fell on 9/18/12.,Tree Maintenance Requests,Parks & Recreation Department,Trees,Tree Maintenance Requests,PARK_Tree Maintenance Request,PARK,,,105 Safford St  Hyde Park  MA  02136,12.0,08,5.0,E18,Hyde Park,10.0,Ward 18,1808,R1,105 Safford St,2136.0,Address,120427.0,42.2668,-71.1131,Employee Generated,"(42.2668, -71.1131)",-7916274.080731144,5201028.952928852
40507,101000825703,04/22/2013 01:00:54 PM,04/25/2013 01:00:54 PM,05/14/2013 08:22:19 AM,OVERDUE,Closed,Case Closed VIOCOR: Violation Corrected,Building Inspection Request,Inspectional Services,Building,Building Inspection Request,ISD_Building (INTERNAL),ISD,,,10 Fendale Ave  Dorchester  MA  02124,8.0,07,3.0,B3,Dorchester,7.0,Ward 17,1704,R2,10 Fendale Ave,2124.0,Address,57330.0,42.278999999999996,-71.0705,Constituent Call,"(42.279, -71.0705)",-7911531.870423349,5202864.345877293
597146,101001075607,04/25/2014 01:35:49 PM,04/29/2014 01:35:49 PM,04/25/2014 01:43:02 PM,ONTIME,Closed,Case Closed Case Resolved picked up all set,Requests for Street Cleaning,Public Works Department,Street Cleaning,Requests for Street Cleaning,PWDx_District 07: South Dorchester,PWDx,,,864 Cummins Hwy  Mattapan  MA  02126,8.0,07,5.0,B3,Greater Mattapan,9.0,Ward 18,1821,R3,864 Cummins Hwy,2126.0,Address,45022.0,42.2694,-71.0964,City Worker App,"(42.2694, -71.0964)",-7914415.045234895,5201420.072458465
137733,101001137108,07/25/2014 01:02:01 PM,,07/31/2014 04:39:38 PM,ONTIME,Closed,Case Closed Bulk Item Automation,Schedule a Bulk Item Pickup,Public Works Department,Sanitation,Schedule a Bulk Item Pickup,PWDx_Schedule a Bulk Item Pickup,PWDx,,,5-7 Bancroft St  Roxbury  MA  02119,9.0,10B,6.0,E13,Jamaica Plain,11.0,11,1104,,5-7 Bancroft St,2119.0,Address,345079.0,42.318000000000005,-71.0987,Constituent Call,"(42.318, -71.0987)",-7914671.080063718,5208733.970579479
894284,101001978751,12/30/2016 09:18:32 AM,01/03/2017 09:18:32 AM,12/30/2016 09:31:37 AM,ONTIME,Closed,Case Closed. Closed date : 2016-12-30 09:31:37.243 Case Noted BTD does not enforce idle laws. Will have officer check area for illegally vehicles.,Parking Enforcement,Transportation - Traffic Division,Enforcement & Abandoned Vehicles,Parking Enforcement,BTDT_Parking Enforcement,BTDT,,,INTERSECTION of Kelley Ct & Medford St  Charlestown  MA,3.0,1A,1.0,A15,Charlestown,2.0,2,0205,,INTERSECTION Kelley Ct & Medford St,,Intersection,13869.0,42.3594,-71.0587,Citizens Connect App,"(0, 0)",-7910218.300431989,5214968.784796895
278636,101001165498,09/05/2014 01:04:22 PM,09/09/2014 01:04:22 PM,09/05/2014 02:20:19 PM,ONTIME,Closed,Case Closed Case Resolved,Requests for Street Cleaning,Public Works Department,Street Cleaning,Requests for Street Cleaning,PWDx_District 08: Hyde Park,PWDx,https://cityworker.cityofboston.gov:8443/attachments/report/5409ed10d0524737c7ddbe74/photo/Report.jpg,,6 Beacon St  Hyde Park  MA  02136,12.0,08,5.0,E18,Hyde Park,10.0,Ward 18,1816,R3,6 Beacon St,2136.0,Address,185267.0,42.2528,-71.1178,City Worker App,"(42.2528, -71.1178)",-7916797.282337871,5198923.20191535
509692,101001169508,09/11/2014 07:21:14 AM,09/15/2014 08:30:00 AM,09/11/2014 09:23:25 AM,ONTIME,Closed,Case Closed Case Resolved made safe neefs to go to sidewalk repair,Sidewalk Repair (Make Safe),Public Works Department,Highway Maintenance,Sidewalk Repair (Make Safe),PWDx_District 05: South Boston,PWDx,,https://cityworker.cityofboston.gov:8443/attachments/report/541185b6d052715ac256b79e/closed_photo/Report.jpg,INTERSECTION of D St & Gold St  South Boston  MA,6.0,05,2.0,C6,South Boston / South Boston Waterfront,5.0,Ward 6,0603,,INTERSECTION D St & Gold St,,Intersection,3809.0,42.3378,-71.05199999999999,Constituent Call,"(42.3378, -71.052)",-7909472.459843673,5211715.326118805
207003,101000296669,07/05/2011 11:12:38 AM,07/07/2011 11:12:35 AM,07/05/2011 11:13:19 AM,ONTIME,Closed,Case Closed Case Scheduled Items have been scheduled for pickup.,Schedule a Bulk Item Pickup,Public Works Department,Sanitation,Schedule a Bulk Item Pickup,PWDx_Schedule a Bulk Item Pickup,PWDx,,,89 Rockland St  West Roxbury  MA  02132,12.0,06,6.0,E5,West Roxbury,12.0,Ward 20,2015,R1,89 Rockland St,2132.0,Address,117743.0,42.2564,-71.1572,Employee Generated,"(42.2564, -71.1572)",-7921183.270275126,5199464.636096213
681219,101000494763,10/19/2012 04:53:23 PM,10/23/2012 04:53:22 PM,10/20/2012 08:39:45 AM,ONTIME,Closed,Case Closed Case Resolved PWD Highway crews removed all trash from Wyman Street.,Missed Trash: District 02,Public Works Department,Sanitation,Missed Trash/Recycling/Yard Waste/Bulk Item,PWDx_Missed Trash\Recycling\Yard Waste\Bulk Item,PWDx,,,25 Wyman St  Jamaica Plain  MA  02130,9.0,02,6.0,E13,Jamaica Plain,11.0,Ward 10,1009,R3,25 Wyman St,2130.0,Address,153073.0,42.3216,-71.1064,Constituent Call,"(42.3216, -71.1064)",-7915528.240142827,5209275.965431931
733602,101000472509,08/31/2012 11:16:37 AM,09/04/2012 11:16:37 AM,08/31/2012 11:39:00 AM,ONTIME,Closed,Case Closed Case Noted  this is student move in w/ean  please be patient trucks have not made their way here yet.,Missed Trash: District 1B,Public Works Department,Sanitation,Missed Trash/Recycling/Yard Waste/Bulk Item,PWDx_Missed Trash\Recycling\Yard Waste\Bulk Item,PWDx,,,8 Garden Court St  Boston  MA  02113,3.0,1B,1.0,A1,Downtown / Financial District,3.0,Ward 3,0303,CM,8 Garden Court St,2113.0,Address,62547.0,42.3644,-71.0532,Constituent Call,"(42.3644, -71.0532)",-7909606.043232625,5215722.059619454
612172,101001097284,05/26/2014 09:32:36 AM,09/23/2014 09:32:35 AM,,OVERDUE,Open,,Unsatisfactory Living Conditions,Inspectional Services,Housing,Unsatisfactory Living Conditions,ISD_Housing (INTERNAL),ISD,,,460 Beacon St  Boston  MA  02115,4.0,1C,8.0,D4,Back Bay,14.0,Ward 5,0509,A,460 Beacon St,2115.0,Address,11519.0,42.3516,-71.0879,Constituent Call,"(42.3516, -71.0879)",-7913468.829563153,5213793.795750475
38275,101000993654,12/31/2013 09:33:51 AM,01/03/2014 09:33:51 AM,12/31/2013 03:23:36 PM,ONTIME,Closed,Case Closed Case Resolved,Request for Pothole Repair,Public Works Department,Highway Maintenance,Request for Pothole Repair,PWDx_District 03: North Dorchester,PWDx,,,INTERSECTION of Blue Hill Ave & Georgia St  Dorchester  MA,9.0,03,7.0,B2,Roxbury,13.0,Ward 12,1202,,INTERSECTION Blue Hill Ave & Georgia St,,Intersection,1572.0,42.3093,-71.0828,City Worker App,"(42.3093, -71.0828)",-7912901.100160107,5207424.277682059
193797,101000735322,01/11/2013 11:05:44 AM,,01/17/2013 09:45:55 PM,ONTIME,Closed,Case Closed Bulk Item Automation,Schedule Bulk Item Pickup,Public Works Department,Sanitation,Schedule a Bulk Item Pickup SS,PWDx_Schedule a Bulk Item Pickup,PWDx,,,13 Glenley Ter  Brighton  MA  02135,11.0,04,9.0,D14,Allston / Brighton,15.0,Ward 22,2204,R2,13 Glenley Ter,2135.0,Address,241634.0,42.3485,-71.1709,Self Service,"(42.3485, -71.1709)",-7922708.347298995,5213326.853416979
619534,101001436844,07/26/2015 01:12:15 PM,07/28/2015 08:30:00 AM,07/27/2015 08:07:45 AM,ONTIME,Closed,Case Closed. Closed date : 2015-07-27 08:07:45.75 Case Resolved removed.,Requests for Street Cleaning,Public Works Department,Street Cleaning,Requests for Street Cleaning,PWDx_District 10A: Roxbury,PWDx,https://mayors24.cityofboston.gov/media/boston/report/photos/55b515066963856559d2d02f/report.jpg,https://cityworker.cityofboston.gov:8443/attachments/report/55b5153ad0529cc65361436a/closed_photo/Report.jpg,108 Kilmarnock St  Boston  MA  02215,4.0,10A,8.0,D4,Fenway / Kenmore / Audubon Circle / Longwood,14.0,Ward 5,0502,A,108 Kilmarnock St,2215.0,Address,81578.0,42.3419,-71.0988,Citizens Connect App,"(42.3419, -71.0988)",-7914682.212012798,5212332.794822628
127078,101001700371,01/25/2016 06:52:00 AM,01/27/2016 08:30:00 AM,01/25/2016 01:46:51 PM,ONTIME,Closed,Case Closed. Closed date : 2016-01-25 13:46:51.22 Case Resolved snow plowed on 1-25-16,Ground Maintenance: Franklin Park  Franklin Park Playstead,Public Works Department,Street Cleaning,Request for Snow Plowing,PARK_Maintenance_Region 3,PARK,,,25 Pierpont Rd  Jamaica Plain  MA  02130,9.0,02,7.0,B2,Greater Mattapan,13.0,12,1207,,25 Pierpont Rd,2130.0,Address,342449.0,42.3079,-71.0921,Constituent Call,"(42.3079, -71.0921)",-7913936.371424484,5207213.539412262
772320,101001702130,01/26/2016 11:20:41 AM,01/27/2016 11:20:39 AM,01/26/2016 11:20:41 AM,ONTIME,Closed,Case Closed. Closed date : 2016-01-26 11:20:41.783 Case Resolved Marked completed at case creation,Requests for Street Cleaning,Public Works Department,Street Cleaning,Requests for Street Cleaning,PWDx_District 1A: Charlestown,PWDx,https://cityworker.cityofboston.gov:8443/attachments/report/56a79cd470b4ba291a234a12/photo/Report.jpg,,32 Spice St  Charlestown  MA  02129,3.0,1A,1.0,A15,Charlestown,2.0,Ward 2,0207,I,32 Spice St,2129.0,Address,129394.0,42.3827,-71.0744,City Worker App,"(42.3827, -71.0744)",-7911966.016437443,5218479.55684771
340552,101000976535,12/04/2013 02:46:04 PM,06/02/2015 02:46:02 PM,05/07/2014 08:18:09 AM,ONTIME,Closed,Case Closed Case Resolved The tree was pruned by Northern Tree Service  to the City of Boston tree pruning specifications.,Tree Maintenance Requests,Parks & Recreation Department,Trees,Tree Maintenance Requests,PARK_Tree Maintenance Request,PARK,,,52 Eastbourne St  Roslindale  MA  02131,12.0,06,5.0,E5,Roslindale,10.0,Ward 20,2009,R1,52 Eastbourne St,2131.0,Address,50858.0,42.2823,-71.1406,Constituent Call,"(42.2823, -71.1406)",-7919335.366727958,5203360.86568143
700263,101000344871,10/20/2011 10:56:37 AM,10/24/2011 10:56:36 AM,10/20/2011 02:06:40 PM,ONTIME,Closed,Case Closed Case Resolved paved,Request for Pothole Repair,Public Works Department,Highway Maintenance,Request for Pothole Repair,PWDx_District 07: South Dorchester,PWDx,,,22 Freeman St  Dorchester  MA  02122,7.0,07,3.0,C11,Dorchester,7.0,Ward 16,1601,RL,22 Freeman St,2122.0,Address,60823.0,42.3594,-71.0587,Constituent Call,"(0, 0)",-7910218.300431989,5214968.784796895
809433,101000299939,07/11/2011 04:47:58 PM,07/25/2011 04:47:57 PM,,OVERDUE,Open,,Other: Comment,Mayor's 24 Hour Hotline,Employee & General Comments,General Comments For a Program or Policy,INFO_General Comments Complaints Compliments,INFO,,,,,,,,,,,,,,,,,42.3594,-71.0587,Constituent Call,"(0, 0)",-7910218.300431989,5214968.784796895
412048,101000330531,09/16/2011 08:44:55 PM,11/21/2011 08:30:00 AM,09/20/2011 06:55:03 PM,ONTIME,Closed,Case Closed Case Resolved Graffiti Removal,Graffiti Removal,Property Management,Graffiti,Graffiti Removal,PWDx_Highway Construction,PWDx,,,INTERSECTION of Washington St & Boylston Sq  Boston  MA,4.0,1C,2.0,A1,Downtown / Financial District,4.0,Ward 3,0308,,INTERSECTION Washington St & Boylston Sq,,Intersection,6069.0,42.3519,-71.0627,Citizens Connect App,"(42.3519, -71.0627)",-7910663.578395163,5213838.984940407
548013,101001889251,08/23/2016 04:34:40 PM,,08/23/2016 04:47:39 PM,ONTIME,Closed,Case Closed. Closed date : 2016-08-23 16:47:39.24 Case Invalid Refer to 101001889262,Animal Generic Request,Animal Control,Animal Issues,Animal Generic Request,INFO01_GenericeFormforOtherServiceRequestTypes,INFO,,,1 City Hall Plz  Boston  MA  02108,3.0,1B,1.0,A1,Downtown / Financial District,3.0,03,0306,E,1 City Hall Plz,2108.0,Address,32856.0,42.3603,-71.0583,Constituent Call,"(42.3603, -71.0583)",-7910173.772635671,5215104.369841154
943891,101002028462,03/01/2017 07:26:00 PM,03/16/2017 08:30:00 AM,03/03/2017 02:42:24 PM,ONTIME,Closed,Case Closed. Closed date : 2017-03-03 14:42:24.15 Case Resolved 6 mantels 1 battery 2 light poles,gas outage/printed,Public Works Department,Street Lights,Street Light Outages,PWDx_Street Light Outages - Gas,PWDx,,,INTERSECTION of Church Ct & Dexter Row  Charlestown  MA,3.0,1A,1.0,A15,Charlestown,2.0,2,0201,,INTERSECTION Church Ct & Dexter Row,,Intersection,9801.0,42.3594,-71.0587,City Worker App,"(0, 0)",-7910218.300431989,5214968.784796895
691260,101001123111,07/07/2014 05:29:34 PM,07/10/2014 08:30:00 AM,07/07/2014 07:17:29 PM,ONTIME,Closed,Case Closed Case Resolved Capital serviced above address at 7:15 pm,Missed Trash: District 07,Public Works Department,Sanitation,Missed Trash/Recycling/Yard Waste/Bulk Item,PWDx_Missed Trash\Recycling\Yard Waste\Bulk Item,PWDx,,,11 Harwood St  Dorchester  MA  02124,8.0,07,4.0,B3,Greater Mattapan,9.0,Ward 14,1412,R2,11 Harwood St,2124.0,Address,71046.0,42.2861,-71.0869,Constituent Call,"(42.2861, -71.0869)",-7913357.510072359,5203932.647974466
780568,101000311032,08/05/2011 07:26:35 PM,08/25/2011 08:30:00 AM,08/15/2011 10:32:12 AM,ONTIME,Closed,Case Closed Case Resolved Vehicle gone.,Parking Enforcement,Transportation - Traffic Division,Enforcement & Abandoned Vehicles,Parking Enforcement,BTDT_Parking Enforcement,BTDT,,,8 Glenham St  West Roxbury  MA  02132,12.0,06,6.0,E5,West Roxbury,12.0,Ward 20,2017,R1,8 Glenham St,2132.0,Address,64407.0,42.2897,-71.168,Self Service,"(42.2897, -71.168)",-7922385.520775694,5204474.36827795
296361,101001154720,08/21/2014 10:13:00 AM,,04/11/2016 10:41:51 AM,ONTIME,Closed,Case Closed. Closed date : 2016-04-11 10:41:51.283 Case Resolved bike sinage has been installed done 4-9-16,Equipment Repair: Public Garden,Parks & Recreation Department,Park Maintenance & Safety,Equipment Repair,PARK_Maintenance_Trades,PARK,,,,,,,,,,,,,,,,,42.3594,-71.0587,Self Service,"(0, 0)",-7910218.300431989,5214968.784796895
547657,101001599809,09/28/2015 02:26:00 PM,10/05/2015 02:27:13 PM,09/28/2015 02:34:08 PM,ONTIME,Closed,Case Closed. Closed date : 2015-09-28 14:34:08.74 Case Resolved done 9-16-15,Equipment Repair,Parks & Recreation Department,Park Maintenance & Safety,Equipment Repair,PARK_Maintenance_Trades,PARK,,,,,,,,,,,,,,,,,42.3594,-71.0587,Employee Generated,"(0, 0)",-7910218.300431989,5214968.784796895
493095,101000406847,04/10/2012 02:45:49 PM,,04/12/2012 09:45:48 PM,ONTIME,Closed,Case Closed Bulk Item Automation,Schedule a Bulk Item Pickup,Public Works Department,Sanitation,Schedule a Bulk Item Pickup,PWDx_Schedule a Bulk Item Pickup,PWDx,,,45 Seymour St  Roslindale  MA  02131,12.0,06,5.0,E5,Roslindale,10.0,Ward 19,1910,R3,45 Seymour St,2131.0,Address,309392.0,42.2797,-71.122,Employee Generated,"(42.2797, -71.122)",-7917264.8241992025,5202969.666087048
96264,101000799389,03/08/2013 01:41:20 PM,03/12/2013 01:41:20 PM,03/09/2013 04:46:08 AM,ONTIME,Closed,Case Closed Case Resolved,Request for Snow Plowing,Public Works Department,Street Cleaning,Request for Snow Plowing,PWDx_District 10B: Roxbury,PWDx,,,15-17 Crestwood Park  Dorchester  MA  02121,9.0,10B,7.0,B2,Roxbury,13.0,12,1202,,15-17 Crestwood Park,2121.0,Address,343522.0,42.3178,-71.0883,Constituent Call,"(42.3178, -71.0883)",-7913513.35735947,5208703.860663519
235420,101000456132,07/26/2012 03:25:43 PM,07/30/2012 03:25:43 PM,07/27/2012 01:26:14 PM,ONTIME,Closed,Case Closed Case Resolved A BWSC crew backfilled and patched on 7/26.,Request for Pothole Repair,Public Works Department,Highway Maintenance,Request for Pothole Repair,BWSC_Pothole,BWSC,,,153-153A Salem St  Boston  MA  02113,3.0,1B,1.0,A1,Downtown / Financial District,3.0,Ward 3,0303,A,153-153A Salem St,2113.0,Address,121769.0,42.3654,-71.0552,Constituent Call,"(42.3654, -71.0552)",-7909828.682214212,5215872.721777765
723222,101000896697,08/07/2013 03:23:11 PM,,08/07/2013 03:23:12 PM,ONTIME,Closed,Case Closed Internal Case Performed by Highway Maintenance crew.,Pothole Repair (Internal),Public Works Department,Highway Maintenance,Pothole Repair (Internal),PWDx_District 1C: Downtown,PWDx,,,699 Boylston St  Boston  MA  02116,4.0,1C,8.0,D4,Back Bay,14.0,05,0507,C,699 Boylston St,2116.0,Address,193420.0,42.3499,-71.0792,Employee Generated,"(42.3499, -71.0792)",-7912500.34999325,5213537.727748206
499023,101000938931,10/02/2013 12:42:03 PM,10/02/2014 12:42:03 PM,04/08/2014 10:32:22 AM,ONTIME,Closed,Case Closed Duplicate of Existing Case Duplicate of case 101000504898    Michael Somers  Senior Civil Engineer  Construction Management Division  Boston Public Works  617-635-3831  Michael.Somers@Boston.gov,Sidewalk Repair,Public Works Department,Highway Maintenance,Sidewalk Repair,PWDx_Sidewalk Repair,PWDx,,,14 Temple Ter  West Roxbury  MA  02132,12.0,06,6.0,E5,West Roxbury,12.0,Ward 20,2017,R1,14 Temple Ter,2132.0,Address,134353.0,42.2876,-71.1701,Employee Generated,"(42.2876, -71.1701)",-7922619.291706359,5204158.361005296
687271,101001665649,12/15/2015 11:43:00 AM,12/30/2015 11:43:40 AM,01/04/2016 08:49:04 AM,OVERDUE,Closed,Case Closed. Closed date : 2016-01-04 08:49:04.887 Case Resolved Work completed 12/30/15,Sign Repair,Transportation - Traffic Division,Signs & Signals,Sign Repair,BTDT_Sign Shop_Sign Installation,BTDT,https://cityworker.cityofboston.gov:8443/attachments/report/56704337d05237c5e70163a6/photo/Report.jpg,,1925 Commonwealth Ave  Brighton  MA  02135,11.0,04,9.0,D14,Allston / Brighton,15.0,Ward 21,2116,,1925 Commonwealth Ave,2135.0,Address,215814.0,42.3594,-71.0587,City Worker App,"(0, 0)",-7910218.300431989,5214968.784796895
75012,101001230306,12/09/2014 11:23:59 AM,12/12/2014 11:23:59 AM,12/11/2014 08:31:13 AM,ONTIME,Closed,Case Closed REINSP: Issues Found  Re-Inspection,Building Inspection Request,Inspectional Services,Building,Building Inspection Request,ISD_Building (INTERNAL),ISD,,,9 W Hill Pl  Boston  MA  02114,3.0,1B,8.0,A1,Beacon Hill,14.0,Ward 5,0511,R1,9 W Hill Pl,2114.0,Address,73956.0,42.3601,-71.0715,Constituent Call,"(42.3601, -71.0715)",-7911643.189914142,5215074.23966349
880778,101001138629,07/28/2014 03:04:25 PM,08/04/2014 03:04:25 PM,07/31/2014 02:04:50 PM,ONTIME,Closed,Case Closed Case Noted Sidewalk has been permanently repaired with concrete and asphalt due to large tree roots.    Contractor has been informed to place loam in tree pit.    If you have any further questions  or feel that this case was closed in error  please do not hesitate to contact me.    Michael Somers  Senior Civil Engineer  Construction Management Division  Boston Public Works  617-635-3831  Michael.Somers@Boston.gov,Contractor Complaints,Public Works Department,Highway Maintenance,Contractor Complaints,PWDx_Sidewalk Repair,PWDx,,,120 Manthorne Rd  West Roxbury  MA  02132,12.0,06,6.0,E5,West Roxbury,12.0,Ward 20,2020,CM,120 Manthorne Rd,2132.0,Address,89086.0,42.2911,-71.1531,Constituent Call,"(42.2911, -71.1531)",-7920726.860362873,5204685.045645997
267831,101000397917,03/20/2012 04:17:25 PM,,03/29/2012 01:03:14 PM,ONTIME,Closed,Case Closed Bulk Item Automation,Schedule a Bulk Item Pickup,Public Works Department,Sanitation,Schedule a Bulk Item Pickup,PWDx_Schedule a Bulk Item Pickup,PWDx,,,8 Paulman Cir  West Roxbury  MA  02132,9.0,06,6.0,E5,West Roxbury,12.0,Ward 20,2006,R1,8 Paulman Cir,2132.0,Address,108655.0,42.288999999999994,-71.145,Constituent Call,"(42.289, -71.145)",-7919825.172487448,5204369.031349849
843090,101001606640,10/07/2015 06:50:00 AM,10/08/2015 06:50:51 AM,10/07/2015 02:31:42 PM,ONTIME,Closed,Case Closed. Closed date : 2015-10-07 14:31:42.437 Case Resolved This signal was repaired by the Connect Historic Boston contractor.,Traffic Signal Inspection,Transportation - Traffic Division,Signs & Signals,Traffic Signal Inspection,BTDT_Engineering_Request for Traffic Signal Study or Review,BTDT,,,INTERSECTION of Causeway St & Staniford St  Boston  MA,3.0,1B,8.0,A1,Back Bay,3.0,Ward 3,0305,,INTERSECTION Causeway St & Staniford St,,Intersection,2516.0,42.364,-71.0634,Constituent Call,"(42.364, -71.0634)",-7910741.502038717,5215661.795427603
599534,101001730798,03/06/2016 02:55:00 PM,03/21/2016 08:30:00 AM,03/09/2016 07:11:48 AM,ONTIME,Closed,Case Closed. Closed date : 2016-03-09 07:11:48.617 Case Resolved Refaced housing,Sign Repair,Transportation - Traffic Division,Signs & Signals,Sign Repair,BTDT_Traffic Signal_Repair,BTDT,,,INTERSECTION of Washington St & Glen Rd  Jamaica Plain  MA,9.0,02,6.0,E13,Jamaica Plain,11.0,11,1106,,INTERSECTION Washington St & Glen Rd,,Intersection,17060.0,42.3594,-71.0587,Citizens Connect App,"(0, 0)",-7910218.300431989,5214968.784796895
61488,101001003820,01/13/2014 10:55:06 AM,01/15/2014 10:55:06 AM,01/13/2014 10:55:08 AM,ONTIME,Closed,Case Closed Case Resolved Marked completed at case creation,Request for Pothole Repair,Public Works Department,Highway Maintenance,Request for Pothole Repair,PWDx_District 05: South Boston,PWDx,,,INTERSECTION of W Broadway & Sherman Ct  South Boston  MA,6.0,05,2.0,C6,South Boston / South Boston Waterfront,5.0,Ward 6,0603,,INTERSECTION W Broadway & Sherman Ct,,Intersection,2001.0,42.3382,-71.0499,City Worker App,"(42.3382, -71.0499)",-7909238.688913007,5211775.565195636
437769,101001631998,11/10/2015 10:16:00 AM,12/10/2015 10:16:25 AM,12/03/2015 10:00:24 AM,ONTIME,Closed,Case Closed. Closed date : 2015-12-03 10:00:24.517 Case Noted BTD does not post signs for driveways. The driveway apron is sufficiently large enough to accommodate vehicles into and out of the driveway. This apron is already non-compliant (too wide) as it is according to current City standards.,New Sign  Crosswalk or Pavement Marking,Transportation - Traffic Division,Signs & Signals,New Sign  Crosswalk or Pavement Marking,BTDT_Engineering_New Sign and Pavement Marking Requests,BTDT,,,21-23 Trapelo St  Brighton  MA  02135,11.0,04,9.0,D14,Allston / Brighton,15.0,Ward 22,2208,R2,21-23 Trapelo St,2135.0,Address,136594.0,42.3465,-71.1606,Constituent Call,"(42.3465, -71.1606)",-7921561.7565438235,5213025.6125192065
796498,101001549319,09/03/2015 12:42:00 PM,10/03/2015 12:42:46 PM,09/17/2015 02:17:37 PM,ONTIME,Closed,Case Closed. Closed date : 2015-09-17 14:17:37.037 VIOCOR: Violation Corrected,Rodent Activity,Inspectional Services,Environmental Services,Rodent Activity,ISD_Environmental Services (INTERNAL),ISD,,,397 Marlborough St  Boston  MA  02115,4.0,1C,8.0,D4,Back Bay,14.0,Ward 5,0509,CM,397 Marlborough St,2115.0,Address,91218.0,42.3505,-71.0883,Citizens Connect App,"(42.3505, -71.0883)",-7913513.35735947,5213628.103899366
670797,101001265655,01/31/2015 09:11:32 AM,02/17/2015 08:30:00 AM,02/01/2015 12:27:32 AM,ONTIME,Closed,Case Closed Case Resolved plowed,PublicWorks: Complaint,Mayor's 24 Hour Hotline,Employee & General Comments,General Comments For a Program or Policy,PWDx_District 06: West Roxbury and Roslindale,PWDx,,,15 Welton Rd  West Roxbury  MA  02132,12.0,06,6.0,E5,West Roxbury,12.0,Ward 20,2013.0,R1,15 Welton Rd,2132.0,Address,147624.0,42.2829,-71.1621,Constituent Call,"(42.2829, -71.1621)",-7921728.735780013,5203451.144803386
120904,101000766151,02/10/2013 12:19:25 PM,02/13/2013 08:30:00 AM,02/20/2013 10:20:17 AM,OVERDUE,Closed,Case Closed Case Noted,Request for Snow Plowing,Public Works Department,Street Cleaning,Request for Snow Plowing,PWDx_District 1C: Downtown,PWDx,,,18 Wellington St  Roxbury  MA  02118,4.0,1C,7.0,D4,South End,6.0,Ward 4,0404,CM,18 Wellington St,2118.0,Address,147417.0,42.3416,-71.0821,Self Service,"(42.3416, -71.0821)",-7912823.1765165515,5212287.612820516
928511,101002011829,02/13/2017 07:06:12 PM,02/15/2017 08:30:00 AM,02/15/2017 07:07:20 AM,ONTIME,Closed,Case Closed. Closed date : 2017-02-15 07:07:20.627 Case Resolved recycle pick up .,Missed Recycling: District 02,Public Works Department,Sanitation,Missed Trash/Recycling/Yard Waste/Bulk Item,PWDx_Missed Trash\Recycling\Yard Waste\Bulk Item,PWDx,,,1 Jamaica Pl  Jamaica Plain  MA  02130,9.0,02,6.0,E13,Jamaica Plain,11.0,Ward 11,1109,R1,1 Jamaica Pl,2130.0,Address,79343.0,42.3055,-71.119,Self Service,"(42.3055, -71.119)",-7916930.865726824,5206852.284710587
25920,101000340546,10/11/2011 10:56:12 AM,10/25/2011 10:56:12 AM,10/21/2011 02:16:52 PM,ONTIME,Closed,Case Closed Case Resolved completed,Street Light Outages,Public Works Department,Street Lights,Street Light Outages,PWDx_Street Light_Pending_Contractor (Internal),PWDx,,,40 Redgate Rd  West Roxbury  MA  02132,12.0,06,6.0,E5,West Roxbury,12.0,Ward 20,2014,R1,40 Redgate Rd,2132.0,Address,115012.0,42.2769,-71.1541,Constituent Call,"(42.2769, -71.1541)",-7920838.1798536675,5202548.392267646
476174,101001722008,02/22/2016 12:06:00 PM,02/24/2016 12:06:03 PM,02/22/2016 12:47:11 PM,ONTIME,Closed,Case Closed. Closed date : 2016-02-22 12:47:11.247 Case Noted no citation able to be issued.No evidence found inside trash of neighbors dumping trash at front of 55 waverly.,Improper Storage of Trash (Barrels),Public Works Department,Code Enforcement,Improper Storage of Trash (Barrels),PWDx_Code Enforcement,PWDx,,https://cityworker.cityofboston.gov:8443/attachments/report/56cb4074d0528f73f5285757/closed_photo/Report.jpg,55 Waverly St  Roxbury  MA  02119,7.0,10B,7.0,B2,Roxbury,13.0,Ward 12,1204,R1,55 Waverly St,2119.0,Address,146551.0,42.3204,-71.0794,Constituent Call,"(42.3204, -71.0794)",-7912522.613891411,5209095.297035659
570956,101000453981,07/23/2012 02:55:50 PM,07/13/2014 02:55:49 PM,12/05/2012 10:18:48 AM,ONTIME,Closed,Case Closed Case Resolved tree planted fall 2012,New Tree Requests,Parks & Recreation Department,Trees,New Tree Requests,PARK_New Tree Requests,PARK,,,7 Schuyler St  Dorchester  MA  02121,9.0,10B,7.0,B2,Roxbury,13.0,Ward 12,1207,RL,7 Schuyler St,2121.0,Address,123977.0,42.3081,-71.0847,Employee Generated,"(42.3081, -71.0847)",-7913112.607192614,5207243.644592423
699019,101001863619,07/20/2016 12:04:00 PM,,07/20/2016 02:44:35 PM,ONTIME,Closed,Case Closed. Closed date : 2016-07-20 14:44:35.28 Case Resolved After a thorough search of the area we were unable to locate a syringe at the corner of Harrison Ave and Massachusetts Ave  Roxbury,Needle Pickup,Mayor's 24 Hour Hotline,Needle Program,Needle Pickup,GEN_Needle_Pickup,GEN_,,,INTERSECTION of Massachusetts Ave & Harrison Ave  Roxbury  MA,7.0,10B,3.0,D4,Roxbury,6.0,8,0802,,INTERSECTION Massachusetts Ave & Harrison Ave,,Intersection,14825.0,42.3594,-71.0587,Constituent Call,"(0, 0)",-7910218.300431989,5214968.784796895
214488,101001891009,08/25/2016 02:58:00 PM,09/09/2016 02:58:48 PM,08/26/2016 08:09:34 AM,ONTIME,Closed,Case Closed Case Noted  case noted needs new recycling cart not missed.,PublicWorks: Comment,Mayor's 24 Hour Hotline,Employee & General Comments,General Comments For a Program or Policy,PWDx_Missed Trash\Recycling\Yard Waste\Bulk Item,PWDx,,,69 Kittredge St  Roslindale  MA  02131,12.0,06,5.0,E5,Roslindale,10.0,Ward 18,1810,R1,69 Kittredge St,2131.0,Address,82259.0,42.2826,-71.1291,Constituent Call,"(42.2826, -71.1291)",-7918055.192583835,5203406.005134944
934408,101002019988,02/20/2017 07:31:06 AM,02/22/2017 08:30:00 AM,02/21/2017 10:02:38 AM,ONTIME,Closed,Case Closed. Closed date : 2017-02-21 10:02:38.543 Case Resolved Picked up,Space Savers,Public Works Department,Sanitation,Space Savers,PWDx_District 06: West Roxbury and Roslindale,PWDx,,,60 Walworth St  Roslindale  MA  02131,12.0,06,5.0,E5,Roslindale,10.0,Ward 20,2002,R1,60 Walworth St,2131.0,Address,142627.0,42.2856,-71.1374,Citizens Connect App,"(42.2856, -71.1374)",-7918979.14435742,5203857.411491817
657118,101000709374,11/20/2012 11:09:48 AM,12/04/2012 11:09:48 AM,11/20/2012 11:10:19 AM,ONTIME,Closed,Case Closed Case Resolved,Street Light Outages,Public Works Department,Street Lights,Street Light Outages,PWDx_Street Light Outages,PWDx,,,5 Willow Ter  West Roxbury  MA  02132,12.0,06,6.0,E5,West Roxbury,12.0,Ward 20,2018.0,R1,5 Willow Ter,2132.0,Address,150325.0,42.2904,-71.1554,Maximo Integration,"(42.2904, -71.1554)",-7920982.895191698,5204579.706376651
870591,101001434286,07/21/2015 02:33:00 PM,,08/20/2015 02:19:13 PM,ONTIME,Closed,Case Closed. Closed date : 2015-08-20 14:19:13.05 Case Noted Thank you for bringing this matter to our attention.  Staff from the Boston Public Works Department has reviewed the location and we are of the opinion that the location is a candidate for reconstruction.     Your request and location has been added to the master list of future reconstruction projects. Currently  the wait time for a reconstruction project of this nature can be up to five (5) years.     If you feel that there is an immediate safety concern at this location  please contact 617-635-4500 so that maintenance can be performed to make the location safer until the reconstruction can be started.    In the meantime  you may contact the Public Works Department Engineering Division at 617-635-4968 for information on your request.  Again  we appreciate and thank you for your interest in public safety and the welfare of your community.,Roadway Repair,Public Works Department,Highway Maintenance,Roadway Repair,PWDx_Engineering_Design,PWDx,,,325 Reservoir Rd  Brighton  MA  02135,11.0,04,9.0,D14,Allston / Brighton,15.0,Ward 21,2116,R1,325 Reservoir Rd,2135.0,Address,115287.0,42.3312,-71.1564,Constituent Call,"(42.3312, -71.1564)",-7921094.2146824915,5210721.436666247
676316,101001275396,02/04/2015 03:31:28 PM,,02/12/2015 04:31:53 PM,ONTIME,Closed,Case Closed Bulk Item Automation,Schedule Bulk Item Pickup,Public Works Department,Sanitation,Schedule a Bulk Item Pickup SS,PWDx_Schedule a Bulk Item Pickup,PWDx,,,16 Fossdale Rd  Dorchester  MA  02124,8.0,07,3.0,C11,Dorchester,7.0,Ward 16,1608,R2,16 Fossdale Rd,2124.0,Address,59587.0,42.2856,-71.0599,Self Service,"(42.2856, -71.0599)",-7910351.883820941,5203857.411491817
679602,101000874606,07/08/2013 09:21:58 AM,07/10/2013 09:21:58 AM,07/12/2013 08:16:01 AM,OVERDUE,Closed,Case Closed Case Resolved The CIU inspector went to the location and found that the following location is a bad patch from utility work.    The owner of the bad patch has been contacted and has 14 days to repair it.    Kevin Donahue  CIU supervisor,Request for Pothole Repair,Public Works Department,Highway Maintenance,Request for Pothole Repair,PWDx_Contractor Complaints,PWDx,,,147 Pearl St  Boston  MA  02110,6.0,1C,1.0,A1,Downtown / Financial District,3.0,Ward 3,0306,RC,147 Pearl St,2110.0,Address,158265.0,42.3546,-71.0537,Self Service,"(42.3546, -71.0537)",-7909661.702978023,5214245.697356286
500406,101000802588,03/12/2013 03:34:26 PM,03/14/2013 03:34:26 PM,03/13/2013 01:29:59 PM,ONTIME,Closed,Case Closed Case Resolved Picked up,Sticker Request,Public Works Department,Recycling,Sticker Request,PWDx_Sticker Request,PWDx,,,261 Cornell St  Roslindale  MA  02131,12.0,06,5.0,E5,Roslindale,10.0,Ward 20,2009,R1,261 Cornell St,2131.0,Address,42994.0,42.2807,-71.137,Self Service,"(42.2807, -71.137)",-7918934.616561102,5203120.125559173
685693,101001680773,12/23/2015 06:57:32 AM,12/24/2015 08:30:00 AM,12/23/2015 10:06:36 AM,ONTIME,Closed,Case Closed. Closed date : 2015-12-23 10:06:36.723 Case Resolved Removed all set,CE Collection,Public Works Department,Street Cleaning,CE Collection,PWDx_District 10B: Roxbury,PWDx,https://cityworker.cityofboston.gov:8443/attachments/report/567a8c2c70b480b2278e2396/photo/Report.jpg,https://cityworker.cityofboston.gov:8443/attachments/report/567a8c2c70b480b2278e2396/closed_photo/Report.jpg,2 Chesterton St  Roxbury  MA  02119,7.0,10B,7.0,B2,Roxbury,13.0,Ward 8,0806,R3,2 Chesterton St,2119.0,Address,30999.0,42.3302,-71.0704,City Worker App,"(42.3302, -71.0704)",-7911520.738474271,5210570.8564534765
68582,101001162781,09/02/2014 09:35:30 PM,09/05/2014 08:30:00 AM,09/15/2014 02:29:29 PM,OVERDUE,Closed,Case Closed Case Resolved CONTRACTOR REPAIRED CB 9/15,Request for Pothole Repair,Public Works Department,Highway Maintenance,Request for Pothole Repair,BWSC_All Cases,BWSC,,,0 Cedrus Ave  Roslindale  MA  02131,12.0,06,5.0,E5,Roslindale,10.0,Ward 18,1810,CL,0 Cedrus Ave,2131.0,Address,27214.0,42.3594,-71.0587,Citizens Connect App,"(0, 0)",-7910218.300431989,5214968.784796895
589895,101001023423,02/10/2014 04:41:55 PM,,02/13/2014 04:33:52 PM,ONTIME,Closed,Case Closed Bulk Item Automation,Schedule a Bulk Item Pickup,Public Works Department,Sanitation,Schedule a Bulk Item Pickup,PWDx_Schedule a Bulk Item Pickup,PWDx,,,330 Beacon St  Boston  MA  02116,4.0,1C,8.0,D4,Back Bay,14.0,05,0508,,330 Beacon St,2116.0,Address,161905.0,42.3529,-71.0834,Constituent Call,"(42.3529, -71.0834)",-7912967.891854582,5213989.617131298
808452,101000789296,02/22/2013 09:39:17 AM,02/26/2013 09:39:17 AM,02/26/2013 10:03:02 AM,OVERDUE,Closed,Case Closed Case Noted no ice,Request for Snow Plowing,Public Works Department,Street Cleaning,Request for Snow Plowing,PWDx_District 10A: Roxbury,PWDx,,,364 Brookline Ave  Boston  MA  02115,4.0,10A,8.0,B2,Fenway / Kenmore / Audubon Circle / Longwood,14.0,Ward 4,0410,E,364 Brookline Ave,2115.0,Address,158379.0,42.339,-71.1064,Constituent Call,"(42.339, -71.1064)",-7915528.240142827,5211896.044498857
68613,101000776798,02/11/2013 07:09:47 PM,02/14/2013 08:30:00 AM,02/17/2013 02:34:59 PM,OVERDUE,Closed,Case Closed Case Resolved  ADDRESSED,Request for Snow Plowing,Public Works Department,Street Cleaning,Request for Snow Plowing,PWDx_District 1A: Charlestown,PWDx,,,12 Summer St  Charlestown  MA  02129,3.0,1A,1.0,A15,Charlestown,2.0,Ward 2,0205,R3,12 Summer St,2129.0,Address,131873.0,42.3775,-71.0644,Constituent Call,"(42.3775, -71.0644)",-7910852.821529511,5217695.923999991
396486,101001788522,05/12/2016 11:30:29 AM,,05/18/2016 04:32:18 PM,ONTIME,Closed,Case Closed. Closed date : 2016-05-18 16:32:18.1 Bulk Item Automation,Schedule Bulk Item Pickup,Public Works Department,Sanitation,Schedule a Bulk Item Pickup SS,PWDx_Schedule a Bulk Item Pickup,PWDx,,,551 Norfolk St  Mattapan  MA  02126,8.0,07,4.0,B3,Greater Mattapan,9.0,Ward 18,1802,R3,551 Norfolk St,2126.0,Address,283900.0,42.2783,-71.0909,Self Service,"(42.2783, -71.0909)",-7913802.788035532,5202759.026837501
933040,101002017696,02/17/2017 08:38:40 AM,02/19/2017 08:38:40 AM,02/19/2017 10:27:59 AM,OVERDUE,Closed,Case Closed. Closed date : 2017-02-19 10:27:59.957 Case Noted No violation found at this time. Sidewalk is treated with sand,Unshoveled Sidewalk,Public Works Department,Code Enforcement,Unshoveled Sidewalk,PWDx_Code Enforcement,PWDx,,https://cityworker.cityofboston.gov:8443/attachments/report/58a6fcecd052c51cc8fa8680/closed_photo/Report.jpg,52 S Russell St  Boston  MA  02114,3.0,1B,1.0,A1,Beacon Hill,3.0,Ward 3,0306,A,52 S Russell St,2114.0,Address,119792.0,42.3598,-71.0658,Constituent Call,"(42.3598, -71.0658)",-7911008.668816621,5215029.0445768135
717211,101000334895,09/27/2011 10:52:00 AM,,09/28/2011 05:07:43 PM,ONTIME,Closed,Case Closed Case Noted,Notification,Mayor's 24 Hour Hotline,Notification,Notification,INFO09_Current Events,INFO,,,INTERSECTION of Commonwealth Ave & Fairfield St  Boston  MA,4.0,1C,8.0,D4,Back Bay,14.0,Ward 5,0508,,INTERSECTION Commonwealth Ave & Fairfield St,,Intersection,3395.0,42.3505,-71.0826,Constituent Call,"(42.3505, -71.0826)",-7912878.836261949,5213628.103899366
794018,101001134173,07/22/2014 08:29:07 AM,07/24/2014 08:30:00 AM,07/22/2014 10:55:51 AM,ONTIME,Closed,Case Closed Case Resolved,Request for Pothole Repair,Public Works Department,Highway Maintenance,Request for Pothole Repair,PWDx_District 1B: North End,PWDx,,,1 Lathrop Pl  Boston  MA  02113,3.0,1B,1.0,A1,Downtown / Financial District,3.0,Ward 3,0303,RC,1 Lathrop Pl,2113.0,Address,167189.0,42.3639,-71.0542,City Worker App,"(42.3639, -71.0542)",-7909717.3627234185,5215646.729439592
775897,101001093278,05/20/2014 08:20:06 AM,11/16/2015 08:20:05 AM,05/20/2014 08:26:09 AM,ONTIME,Closed,Case Closed Case Resolved 5/1/14 - Tree pruned by tree crew.,Tree Maintenance Requests,Parks & Recreation Department,Trees,Tree Maintenance Requests,PARK_Tree Maintenance Request,PARK,,,31 Wellington Hill St  Mattapan  MA  02126,8.0,07,4.0,B3,Greater Mattapan,9.0,Ward 14,1408,CM,31 Wellington Hill St,2126.0,Address,147515.0,42.2803,-71.0942,Employee Generated,"(42.2803, -71.0942)",-7914170.14235515,5203059.941483782
700733,101000813186,03/28/2013 03:57:54 PM,04/11/2013 03:57:54 PM,04/02/2013 10:19:27 AM,ONTIME,Closed,Case Closed Case Resolved,Street Light Outages,Public Works Department,Street Lights,Street Light Outages,PWDx_Street Light_Pending_Contractor (Internal),PWDx,,,499 E Sixth St  South Boston  MA  02127,6.0,05,2.0,C6,South Boston / South Boston Waterfront,5.0,Ward 7,0702,R2,499 E Sixth St,2127.0,Address,127582.0,42.3329,-71.0407,Constituent Call,"(42.3329, -71.0407)",-7908214.54959771,5210977.428522346
393469,101001895012,08/30/2016 04:50:00 PM,08/31/2016 04:50:30 PM,08/30/2016 06:13:20 PM,ONTIME,Closed,Case Closed. Closed date : 2016-08-30 18:13:20.0 Case Noted will have a.m. officers check this and overtime this area is 2 hour  parking.,Parking Enforcement,Transportation - Traffic Division,Enforcement & Abandoned Vehicles,Parking Enforcement,BTDT_Parking Enforcement,BTDT,,,11 Gordon St  Allston  MA  02134,11.0,04,9.0,D14,Allston / Brighton,15.0,Ward 21,2106,R1,11 Gordon St,2134.0,Address,65409.0,42.3536,-71.1409,Constituent Call,"(42.3536, -71.1409)",-7919368.762575195,5214095.061090947
652717,101001811886,06/10/2016 08:14:00 AM,06/10/2017 08:14:55 AM,10/24/2016 01:09:22 PM,ONTIME,Closed,Case Closed. Closed date : 2016-10-24 13:09:22.44 Case Noted There are no empty tree pits at this location.,New Tree Requests,Parks & Recreation Department,Trees,New Tree Requests,PARK_New Tree Requests,PARK,,,4 Walnut St  Boston  MA  02108,3.0,1B,8.0,A1,Beacon Hill,14.0,Ward 5,0503,CM,4 Walnut St,2108.0,Address,142057.0,42.3575,-71.0658,Constituent Call,"(42.3575, -71.0658)",-7911008.668816621,5214682.556080669
370348,101001134515,07/22/2014 12:03:13 PM,,07/30/2014 04:36:30 PM,ONTIME,Closed,Case Closed Bulk Item Automation,Schedule a Bulk Item Pickup,Public Works Department,Sanitation,Schedule a Bulk Item Pickup,PWDx_Schedule a Bulk Item Pickup,PWDx,,,24 Colgate Rd  Roslindale  MA  02131,12.0,02,5.0,E5,Roslindale,10.0,Ward 19,1911,A,24 Colgate Rd,2131.0,Address,34767.0,42.2937,-71.1218,Constituent Call,"(42.2937, -71.1218)",-7917242.560301044,5205076.316039093
813252,101001785940,05/09/2016 06:31:00 PM,05/11/2016 08:30:00 AM,05/09/2016 06:38:11 PM,ONTIME,Closed,Case Closed. Closed date : 2016-05-09 18:38:11.053 Case Resolved Car gone,Parking Enforcement,Transportation - Traffic Division,Enforcement & Abandoned Vehicles,Parking Enforcement,BTDT_Parking Enforcement,BTDT,,,4 Summer St  Hyde Park  MA  02136,12.0,08,5.0,E18,Hyde Park,10.0,Ward 18,1812,R4,4 Summer St,2136.0,Address,131919.0,42.2566,-71.1261,Constituent Call,"(42.2566, -71.1261)",-7917721.234111454,5199494.716679152
761659,101000882624,07/18/2013 09:49:40 PM,08/02/2013 08:30:00 AM,07/31/2013 11:55:59 AM,ONTIME,Closed,Case Closed Case Resolved,Street Light Outages,Public Works Department,Street Lights,Street Light Outages,PWDx_Street Light Outages,PWDx,,,7 Moultrie St  Dorchester  MA  02124,8.0,07,4.0,C11,Dorchester,8.0,Ward 17,1706,CM,7 Moultrie St,2124.0,Address,98068.0,42.2922,-71.0679,Self Service,"(42.2922, -71.0679)",-7911242.439747286,5204850.581148822
304390,101001086879,05/12/2014 09:17:07 AM,,05/19/2014 04:34:35 PM,ONTIME,Closed,Case Closed Bulk Item Automation,Schedule a Bulk Item Pickup,Public Works Department,Sanitation,Schedule a Bulk Item Pickup,PWDx_Schedule a Bulk Item Pickup,PWDx,,,41 Supple Rd  Dorchester  MA  02121,7.0,03,4.0,B2,Roxbury,13.0,Ward 14,1403,R2,41 Supple Rd,2121.0,Address,132788.0,42.3063,-71.0828,Constituent Call,"(42.3063, -71.0828)",-7912901.100160107,5206972.7014142135
559500,101000501166,10/31/2012 06:53:29 PM,11/15/2012 08:30:00 AM,11/26/2012 01:37:36 PM,OVERDUE,Closed,Case Closed Case Resolved,Street Light Outages,Public Works Department,Street Lights,Street Light Outages,PWDx_Street Light_Pending_Contractor (Internal),PWDx,,,12 Woodbrier Rd  West Roxbury  MA  02132,12.0,06,6.0,E5,West Roxbury,12.0,Ward 20,2005,R1,12 Woodbrier Rd,2132.0,Address,151439.0,42.2724,-71.1605,Constituent Call,"(42.2724, -71.1605)",-7921550.624594744,5201871.384270278
205762,101000408112,04/13/2012 09:47:56 AM,04/16/2012 09:47:56 AM,04/13/2012 11:47:32 AM,ONTIME,Closed,Case Closed Case Resolved installed new battery belly up and running,Empty Litter Basket,Public Works Department,Highway Maintenance,Empty Litter Basket,PWDx_Empty Litter Basket,PWDx,,,52 Hereford St  Boston  MA  02115,4.0,1C,8.0,D4,Back Bay,14.0,Ward 5,0509,RC,52 Hereford St,2115.0,Address,166192.0,42.349,-71.0855,City Worker App,"(42.349, -71.0855)",-7913201.662785248,5213402.165138979
854979,101001085477,05/09/2014 09:50:18 AM,05/13/2014 09:50:18 AM,05/09/2014 12:15:14 PM,ONTIME,Closed,Case Closed Case Resolved Capital came back and serviced above address at 12:15pm,Missed Trash: District 04,Public Works Department,Sanitation,Missed Trash/Recycling/Yard Waste/Bulk Item,PWDx_Missed Trash\Recycling\Yard Waste\Bulk Item,PWDx,,,570-580 Washington St  Brighton  MA  02135,11.0,04,9.0,D14,Allston / Brighton,15.0,22,2207,CM,570-580 Washington St,2135.0,Address,143628.0,42.3499,-71.1651,Self Service,"(42.3499, -71.1651)",-7922062.694252393,5213537.727748206
845073,101001239780,12/30/2014 09:58:35 AM,01/29/2015 09:58:34 AM,01/26/2015 09:22:02 PM,ONTIME,Closed,Case Closed Case Resolved  moved to 53 parsons st 1/26.,Abandoned Vehicles,Transportation - Traffic Division,Enforcement & Abandoned Vehicles,Abandoned Vehicles,BTDT_AVRS Interface Queue,BTDT,,,47 Arlington St  Brighton  MA  02135,11.0,04,9.0,D14,Allston / Brighton,15.0,Ward 22,2212,R1,47 Arlington St,2135.0,Address,4782.0,42.3524,-71.1539,Constituent Call,"(42.3524, -71.1539)",-7920815.915955507,5213914.300736275
882221,101001874701,08/03/2016 11:52:00 AM,08/03/2017 11:52:28 AM,09/19/2016 09:20:56 AM,ONTIME,Closed,Case Closed. Closed date : 2016-09-19 09:20:56.68 Case Resolved The tree was pruned by Northern Tree Service  to the City of Boston tree pruning specifications.,Tree Maintenance Requests,Parks & Recreation Department,Trees,Tree Maintenance Requests,PARK_Tree Maintenance Request,PARK,,,1648 Dorchester Ave  Dorchester  MA  02122,7.0,07,3.0,C11,Dorchester,7.0,Ward 16,1604,R3,1648 Dorchester Ave,2122.0,Address,48378.0,42.2943,-71.0617,Constituent Call,"(42.2943, -71.0617)",-7910552.258904369,5205166.611500545
44150,101001959791,11/28/2016 12:03:39 PM,11/30/2016 12:03:39 PM,11/28/2016 02:41:06 PM,ONTIME,Closed,Case Closed. Closed date : 2016-11-28 14:41:06.23 Case Noted no violation found,Improper Storage of Trash (Barrels),Public Works Department,Code Enforcement,Improper Storage of Trash (Barrels),PWDx_Code Enforcement,PWDx,https://mayors24.cityofboston.gov/media/boston/report/photos/583c636804852d4ae2f2b2f1/report.jpg,https://cityworker.cityofboston.gov:8443/attachments/report/583c63b2d0521e12073b39a7/closed_photo/Report.jpg,531 Newbury St  Boston  MA  02215,4.0,10A,8.0,D4,Fenway / Kenmore / Audubon Circle / Longwood,14.0,Ward 5,0510,CM,531 Newbury St,2215.0,Address,101976.0,42.3482,-71.0938,Citizens Connect App,"(42.3482, -71.0938)",-7914125.614558833,5213281.666671318
871795,101001780305,05/02/2016 08:26:00 AM,05/05/2016 08:30:00 AM,,OVERDUE,Open,,Building Inspection Request,Inspectional Services,Building,Building Inspection Request,ISD_Building (INTERNAL),ISD,,,8 Saint Mary's St  Boston  MA  02215,,10A,8.0,D4,Boston,14.0,21,2102,,8 Saint Mary's St,2215.0,Address,351646.0,42.3493,-71.1065,Constituent Call,"(42.3493, -71.1065)",-7915539.372091906,5213447.352459726
228443,101001970608,12/15/2016 07:38:00 AM,12/16/2016 08:30:00 AM,12/15/2016 09:20:19 AM,ONTIME,Closed,Case Closed. Closed date : 2016-12-15 09:20:19.36 Case Resolved area checked all clear,Parking Enforcement,Transportation - Traffic Division,Enforcement & Abandoned Vehicles,Parking Enforcement,BTDT_Parking Enforcement,BTDT,,,10 Somerset St  Boston  MA  02108,3.0,1B,1.0,A1,Boston,3.0,03,0306,E,10 Somerset St,2108.0,Address,128377.0,42.3588,-71.0618,Constituent Call,"(42.3588, -71.0618)",-7910563.390853449,5214878.395846266
245596,101000397675,03/20/2012 11:33:35 AM,05/22/2012 11:33:35 AM,04/10/2012 11:25:21 AM,ONTIME,Closed,Case Closed Case Resolved   This request has been compleetd and has been done in the past.,Graffiti Removal,Property Management,Graffiti,Graffiti Removal,PROP_GRAF_GraffitiRemoval,PROP,,,216 Newbury St  Boston  MA  02116,4.0,1C,8.0,D4,Back Bay,14.0,Ward 5,0508,RC,216 Newbury St,2116.0,Address,101433.0,42.3498,-71.0808,Citizens Connect App,"(42.3498, -71.0808)",-7912678.46117852,5213522.66514022
214252,101000408973,04/17/2012 09:03:18 AM,05/17/2012 09:03:18 AM,04/17/2012 02:43:03 PM,ONTIME,Closed,Case Closed :,Heat - Excessive  Insufficient,Inspectional Services,Housing,Heat - Excessive  Insufficient,ISD_Housing (INTERNAL),ISD,,,26 Mallon Rd  Dorchester  MA  02121,7.0,03,4.0,C11,Dorchester,8.0,Ward 14,1404,R2,26 Mallon Rd,2121.0,Address,88808.0,42.3022,-71.0747,Constituent Call,"(42.3022, -71.0747)",-7911999.412284682,5206355.581981942
672524,101000304469,07/21/2011 08:37:53 AM,11/18/2011 08:37:53 AM,12/07/2011 10:20:48 AM,OVERDUE,Closed,Case Closed VIOCOR: Violation Corrected,Unsatisfactory Living Conditions,Inspectional Services,Housing,Unsatisfactory Living Conditions,ISD_Housing (INTERNAL),ISD,,,191 Faywood Ave  East Boston  MA  02128,1.0,09,1.0,A7,East Boston,1.0,Ward 1,0113,E,191 Faywood Ave,2128.0,Address,234236.0,42.3923,-71.0085,Constituent Call,"(42.3923, -71.0085)",-7904630.061994166,5219926.434176006
225435,101001083264,05/06/2014 04:34:48 PM,,05/06/2014 04:38:13 PM,ONTIME,Closed,Case Closed Case Resolved done 5-2-14,Equipment Repair,Parks & Recreation Department,Park Maintenance & Safety,Equipment Repair,PARK_Maintenance_Trades,PARK,,,,,,,,,,,,,,,,,42.3594,-71.0587,Employee Generated,"(0, 0)",-7910218.300431989,5214968.784796895
841383,101001847836,06/29/2016 12:40:00 PM,07/01/2016 12:40:33 PM,06/29/2016 07:09:58 PM,ONTIME,Closed,Case Closed. Closed date : 2016-06-29 19:09:58.7 Case Noted No violation found at this time.,Improper Storage of Trash (Barrels),Public Works Department,Code Enforcement,Improper Storage of Trash (Barrels),PWDx_Code Enforcement,PWDx,,https://cityworker.cityofboston.gov:8443/attachments/report/5773fa31d052f42207eb338c/closed_photo/Report.jpg,97 Walford Way  Charlestown  MA  02129,3.0,1A,1.0,A15,Charlestown,2.0,Ward 2,0202,E,97 Walford Way,2129.0,Address,173583.0,42.3786,-71.0579,Constituent Call,"(42.3786, -71.0579)",-7910129.2448393535,5217861.687075109
692879,101000740589,01/22/2013 01:07:43 PM,03/08/2013 01:07:43 PM,02/15/2013 09:22:31 AM,ONTIME,Closed,Case Closed Case Noted BTD does not sign driveways. It is a general traffic regualtion that can be enforced by both BPD and BTD if the driveway is blocked.,New Sign  Crosswalk or Pavement Marking,Transportation - Traffic Division,Signs & Signals,New Sign  Crosswalk or Pavement Marking,BTDT_Engineering_New Sign and Pavement Marking Requests,BTDT,,,11 Woodbine St  Roxbury  MA  02119,9.0,10B,7.0,B2,Roxbury,13.0,Ward 12,1204,R2,11 Woodbine St,2119.0,Address,151377.0,42.3192,-71.0806,Constituent Call,"(42.3192, -71.0806)",-7912656.197280361,5208914.632084913
12744,101000906022,08/20/2013 09:12:07 AM,09/19/2013 09:12:07 AM,11/12/2013 04:55:08 PM,OVERDUE,Closed,Case Closed VIOCOR: Violation Corrected,Rodent Activity,Inspectional Services,Environmental Services,Rodent Activity,ISD_Environmental Services (INTERNAL),ISD,,,8 Parkton Rd  Jamaica Plain  MA  02130,9.0,02,6.0,E13,Jamaica Plain,11.0,Ward 10,1009,R3,8 Parkton Rd,2130.0,Address,108209.0,42.3216,-71.1141,Constituent Call,"(42.3216, -71.1141)",-7916385.4002219355,5209275.965431931
796698,101001420385,06/30/2015 11:13:00 AM,,07/02/2015 04:42:52 PM,ONTIME,Closed,Case Closed. Closed date : 2015-07-02 16:42:52.613 Bulk Item Automation,Schedule a Bulk Item Pickup,Public Works Department,Sanitation,Schedule a Bulk Item Pickup,PWDx_Schedule a Bulk Item Pickup,PWDx,,,112 Pierce Ave  Dorchester  MA  02122,8.0,07,3.0,C11,Dorchester,7.0,Ward 16,1610,R1,112 Pierce Ave,2122.0,Address,110199.0,42.2883,-71.0489,Constituent Call,"(42.2883, -71.0489)",-7909127.369422216,5204263.695592314
941805,101002027692,03/01/2017 06:12:01 AM,03/02/2017 08:30:00 AM,03/01/2017 07:22:07 AM,ONTIME,Closed,Case Closed. Closed date : 2017-03-01 07:22:07.043 Case Resolved Ticket issued.,Parking Enforcement,Transportation - Traffic Division,Enforcement & Abandoned Vehicles,Parking Enforcement,BTDT_Parking Enforcement,BTDT,https://mayors24.cityofboston.gov/media/boston/report/photos/58b6ac7a0485380cc177165a/photo_20170301_061109.jpg,,18 Stellman Rd  Roslindale  MA  02131,12.0,02,5.0,E5,Roslindale,10.0,Ward 19,1913,R3,18 Stellman Rd,2131.0,Address,130504.0,42.2895,-71.1238,Citizens Connect App,"(42.2895, -71.1238)",-7917465.199282631,5204444.271893332
635633,101001417999,06/26/2015 10:49:00 AM,06/30/2015 10:49:55 AM,07/01/2015 03:09:26 PM,OVERDUE,Closed,Case Closed. Closed date : 2015-07-01 15:09:26.437 NOVIO: No Violation Found/No Cause,Unsanitary Conditions - Establishment,Inspectional Services,Health,Unsanitary Conditions - Establishment,ISD_Health (INTERNAL),ISD,,,14 Corinth St  Roslindale  MA  02131,12.0,06,5.0,E5,Roslindale,10.0,20,2002,,14 Corinth St,2131.0,Address,351676.0,42.2866,-71.1302,Constituent Call,"(42.2866, -71.1302)",-7918177.644023708,5204007.885054252
556793,101000753974,02/09/2013 03:24:31 PM,02/13/2013 08:30:00 AM,02/14/2013 06:45:13 AM,OVERDUE,Closed,Case Closed Case Resolved  all roads treated with salt and opened by plow; any snow bank impedeing public safety will be scheduled for removal.,Request for Snow Plowing,Public Works Department,Street Cleaning,Request for Snow Plowing,PWDx_District 03: North Dorchester,PWDx,,,350 Seaver St  Dorchester  MA  02121,7.0,03,4.0,B2,Roxbury,13.0,Ward 14,1403,R3,350 Seaver St,2121.0,Address,124178.0,42.3049,-71.0831,Constituent Call,"(42.3049, -71.0831)",-7912934.496007345,5206761.973187054
595218,101000949538,10/19/2013 09:57:43 AM,12/23/2013 08:30:00 AM,10/22/2013 02:59:47 PM,ONTIME,Closed,Case Closed Case Resolved at that location grafitti spray painted by DIST#4,Graffiti Removal,Property Management,Graffiti,Graffiti Removal,PWDx_District 04: Allston/Brighton,PWDx,,,INTERSECTION of Commonwealth Ave & Harvard Ave  Allston  MA,11.0,04,9.0,D14,Allston / Brighton,14.0,Ward 21,2103,,INTERSECTION Commonwealth Ave & Harvard Ave,,Intersection,3370.0,42.3501,-71.1309,Citizens Connect App,"(42.3501, -71.1309)",-7918255.567667263,5213567.853036073
732838,101001622835,10/28/2015 05:17:39 PM,11/13/2015 08:30:00 AM,10/28/2015 05:24:16 PM,ONTIME,Closed,Case Closed. Closed date : 2015-10-28 17:24:16.81 Case Invalid Wrong eform  see case 1622836,General Comments For a Program or Policy,Mayor's 24 Hour Hotline,Employee & General Comments,General Comments For a Program or Policy,INFO_General Comments Complaints Compliments,INFO,,,,,,,,,,,,,,,,,42.3594,-71.0587,Constituent Call,"(0, 0)",-7910218.300431989,5214968.784796895
879006,101000985757,12/17/2013 06:43:17 PM,12/20/2013 08:30:00 AM,12/17/2013 08:53:26 PM,ONTIME,Closed,Case Closed Case Resolved,Request for Snow Plowing,Public Works Department,Street Cleaning,Request for Snow Plowing,PWDx_District 1A: Charlestown,PWDx,,,19 Wesley St  Charlestown  MA  02129,3.0,1A,1.0,A15,Charlestown,2.0,02,0206,,19 Wesley St,2129.0,Address,347489.0,42.3784,-71.0655,Constituent Call,"(42.3784, -71.0655)",-7910975.272969383,5217831.548118197
458717,101000982965,12/16/2013 08:33:43 AM,12/17/2013 08:33:39 AM,12/18/2013 08:48:29 AM,OVERDUE,Closed,Case Closed Case Resolved,Space Savers,Public Works Department,Sanitation,Space Savers,PWDx_District 05: South Boston,PWDx,,,1 Thomas Park  South Boston  MA  02127,6.0,05,2.0,C6,South Boston / South Boston Waterfront,5.0,Ward 7,0703,RC,1 Thomas Park,2127.0,Address,319213.0,42.3335,-71.0444,Constituent Call,"(42.3335, -71.0444)",-7908626.431713645,5211067.780241204
663077,101000448181,07/11/2012 10:28:44 AM,09/12/2012 10:28:44 AM,08/01/2012 10:29:43 AM,ONTIME,Closed,Case Closed Case Resolved   This request has been completed and was a large task to finish.,Graffiti Removal,Property Management,Graffiti,Graffiti Removal,PROP_GRAF_GraffitiRemoval,PROP,,,INTERSECTION of Columbus Ave & Newcastle Ct  Roxbury  MA,9.0,10B,7.0,D4,Roxbury,13.0,Ward 9,903.0,,INTERSECTION Columbus Ave & Newcastle Ct,,Intersection,3291.0,42.3403,-71.0821,Citizens Connect App,"(42.3403, -71.0821)",-7912823.1765165515,5212091.826635783
855173,101001030615,02/19/2014 01:44:26 PM,02/21/2014 01:44:26 PM,02/19/2014 01:44:28 PM,ONTIME,Closed,Case Closed Case Resolved Marked completed at case creation,Request for Pothole Repair,Public Works Department,Highway Maintenance,Request for Pothole Repair,PWDx_District 10A: Roxbury,PWDx,,,1310 Boylston St  Boston  MA  02215,4.0,10A,8.0,D4,Fenway / Kenmore / Audubon Circle / Longwood,14.0,Ward 5,0502,RC,1310 Boylston St,2215.0,Address,162466.0,42.3442,-71.098,City Worker App,"(42.3442, -71.098)",-7914593.156420164,5212679.19733448
874350,101001932629,10/17/2016 12:01:00 PM,10/18/2016 12:01:13 PM,10/17/2016 12:44:27 PM,ONTIME,Closed,Case Closed. Closed date : 2016-10-17 12:44:27.23 Case Resolved Location has been made safe. This sidewalk will be referred for permanent repair. See case #101001932687 for status of the permanent repair.,Sidewalk Repair (Make Safe),Public Works Department,Highway Maintenance,Sidewalk Repair (Make Safe),PWDx_District 08: Hyde Park,PWDx,https://cityworker.cityofboston.gov:8443/attachments/report/5804f5c9d052b9b00b425c1d/photo/Report.jpg,,15 Tacoma St  Hyde Park  MA  02136,12.0,08,5.0,E18,Hyde Park,10.0,Ward 18,1808,R1,15 Tacoma St,2136.0,Address,133540.0,42.269,-71.1118,City Worker App,"(42.269, -71.1118)",-7916129.365393112,5201359.899173125
213232,101001347292,04/01/2015 06:32:17 PM,05/28/2015 08:30:00 AM,06/19/2015 08:22:32 AM,OVERDUE,Closed,Case Closed. Closed date : 2015-06-19 08:22:32.857 Case Resolved cart requested filled new cart #,Request for Recycling Cart,Public Works Department,Recycling,Request for Recycling Cart,PWDx_Recycling,PWDx,,,166 Amory St  Roxbury  MA  02119,9.0,02,6.0,E13,Jamaica Plain,11.0,11,1104,,166 Amory St,2119.0,Address,346485.0,42.318000000000005,-71.1012,Constituent Call,"(42.318, -71.1012)",-7914949.378790704,5208733.970579479
598439,101001845217,06/26/2016 08:46:23 PM,,06/29/2016 04:31:31 PM,ONTIME,Closed,Case Closed. Closed date : 2016-06-29 16:31:31.997 Bulk Item Automation,Schedule a Bulk Item Pickup,Public Works Department,Sanitation,Schedule a Bulk Item Pickup,PWDx_Schedule a Bulk Item Pickup,PWDx,,,71 W Selden St  Mattapan  MA  02126,8.0,07,4.0,B3,Greater Mattapan,9.0,Ward 18,1802,CM,71 W Selden St,2126.0,Address,125046.0,42.2784,-71.0853,Constituent Call,"(42.2784, -71.0853)",-7913179.39888709,5202774.072342986
522696,101001127652,07/13/2014 06:31:40 PM,07/28/2014 08:30:00 AM,07/14/2014 12:30:14 PM,ONTIME,Closed,Case Closed Case Noted i am very sorry i could not locate problem is it possable u can send a picture thank you,Sign Repair,Transportation - Traffic Division,Signs & Signals,Sign Repair,BTDT_District 02,BTDT,,,170 Morton St  Jamaica Plain  MA  02130,9.0,2,7.0,B2,Jamaica Plain,13.0,12,1207,E,170 Morton St,2130.0,Address,341854.0,42.2996,-71.1019,Citizens Connect App,"(42.2996, -71.1019)",-7915027.302434258,5205964.258773569
395431,101001044973,03/11/2014 02:07:49 PM,03/25/2014 02:07:48 PM,,OVERDUE,Open,,Other: Complaint,Mayor's 24 Hour Hotline,Employee & General Comments,General Comments For a Program or Policy,INFO_General Comments Complaints Compliments,INFO,,,,,,,,,,,,,,,,,42.3594,-71.0587,Constituent Call,"(0, 0)",-7910218.300431989,5214968.784796895
487920,101000929346,09/18/2013 08:49:23 AM,09/20/2013 08:49:23 AM,09/18/2013 12:04:22 PM,ONTIME,Closed,Case Closed Case Resolved,Sidewalk Repair (Make Safe),Public Works Department,Highway Maintenance,Sidewalk Repair (Make Safe),PWDx_District 08: Hyde Park,PWDx,,,42 Lodgehill Rd  Hyde Park  MA  02136,12.0,08,5.0,E18,Hyde Park,10.0,Ward 18,1822,R1,42 Lodgehill Rd,2136.0,Address,86918.0,42.2667,-71.1279,City Worker App,"(42.2667, -71.1279)",-7917921.609194882,5201013.910192171
567,101000872059,07/02/2013 02:54:07 PM,,07/02/2013 02:54:07 PM,ONTIME,Closed,Case Closed Internal Case Performed by Highway Maintenance crew.,Pothole Repair (Internal),Public Works Department,Highway Maintenance,Pothole Repair (Internal),PWDx_District 03: North Dorchester,PWDx,,,INTERSECTION of Charles St & Freeman St  Dorchester  MA,7.0,03,3.0,C11,Dorchester,8.0,Ward 15,1508,,INTERSECTION Charles St & Freeman St,,Intersection,2801.0,42.3003,-71.0628,Employee Generated,"(42.3003, -71.0628)",-7910674.710344241,5206069.613432412
213528,101001079873,05/02/2014 07:49:24 AM,05/06/2014 08:30:00 AM,05/07/2014 02:15:22 PM,OVERDUE,Closed,Case Closed Case Resolved,Request for Pothole Repair,Public Works Department,Highway Maintenance,Request for Pothole Repair,PWDx_District 1C: Downtown,PWDx,,,687-691 Washington St  Boston  MA  02116,4.0,1C,2.0,A1,Downtown / Financial District,4.0,03,0308,,687-691 Washington St,2116.0,Address,343264.0,42.3514,-71.0631,City Worker App,"(42.3514, -71.0631)",-7910708.1061914805,5213763.669743681
925008,101002010698,02/13/2017 08:08:00 AM,02/14/2017 08:30:00 AM,02/13/2017 09:59:49 AM,ONTIME,Closed,Case Closed. Closed date : 2017-02-13 09:59:49.697 Case Resolved mattress is to heavy wet due to snow .2/13/17,Missed Trash: District 04,Public Works Department,Sanitation,Missed Trash/Recycling/Yard Waste/Bulk Item,PWDx_Missed Trash\Recycling\Yard Waste\Bulk Item,PWDx,,https://cityworker.cityofboston.gov:8443/attachments/report/58a1b020d052e81b93e55953/closed_photo/Report.jpg,48 Gerrish St  Brighton  MA  02135,11.0,04,9.0,D14,Allston / Brighton,15.0,Ward 22,2211,R1,48 Gerrish St,2135.0,Address,165637.0,42.3565,-71.1652,Constituent Call,"(42.3565, -71.1652)",-7922073.826201472,5214531.912863986
464541,101000391590,03/07/2012 10:47:38 AM,03/09/2012 10:47:37 AM,04/13/2012 03:51:05 PM,OVERDUE,Closed,Case Closed VIOISS: Violation Filed,Work w/out Permit,Inspectional Services,Building,Work w/out Permit,ISD_Building (INTERNAL),ISD,,,82 Thompson St  Hyde Park  MA  02136,12.0,08,5.0,E18,Hyde Park,10.0,Ward 18,1819,R1,82 Thompson St,2136.0,Address,135752.0,42.2508,-71.135,Constituent Call,"(42.2508, -71.135)",-7918711.977579515,5198622.418501765
115459,101001518091,08/11/2015 11:14:00 AM,08/25/2015 11:14:25 AM,10/06/2015 10:04:28 AM,OVERDUE,Closed,Case Closed. Closed date : 2015-10-06 10:04:28.043 Case Resolved,Street Light Outages  // SENT TO MAVERICK //,Public Works Department,Street Lights,Street Light Outages,PWDx_Street Light_Pending_Contractor (Internal),PWDx,,,25 Edison Grn  Dorchester  MA  02125,7.0,03,2.0,C11,Dorchester,5.0,Ward 7,0709,R2,25 Edison Grn,2125.0,Address,51270.0,42.3196,-71.058,Constituent Call,"(42.3196, -71.058)",-7910140.376788435,5208974.85335234
413094,101001643232,11/27/2015 07:14:00 AM,12/02/2015 08:30:00 AM,11/30/2015 11:50:38 AM,ONTIME,Closed,Case Closed. Closed date : 2015-11-30 11:50:38.507 Duplicate of Existing Case case entered in ISD for insepction 1654700,Contractor Complaints,Public Works Department,Highway Maintenance,Contractor Complaints,ISD_Administrative,ISD,,,35 N Bennet St  Boston  MA  02113,3.0,1B,1.0,A1,Downtown / Financial District,3.0,Ward 3,0302,R4,35 N Bennet St,2113.0,Address,14389.0,42.3657,-71.0546,Constituent Call,"(42.3657, -71.0546)",-7909761.890519735,5215917.920892905
279885,101000905840,08/20/2013 07:24:56 AM,02/16/2015 07:24:56 AM,08/20/2013 07:35:24 AM,ONTIME,Closed,Case Closed Case Resolved  The tree was pruned by Northern Tree Service  to the City of Boston tree pruning specifications.,Tree Maintenance Requests,Parks & Recreation Department,Trees,Tree Maintenance Requests,PARK_Tree Maintenance Request,PARK,,,3240 Washington St  Jamaica Plain  MA  02130,9.0,02,7.0,E13,Jamaica Plain,11.0,Ward 11,1105,R3,3240 Washington St,2130.0,Address,331139.0,42.3115,-71.1022,Employee Generated,"(42.3115, -71.1022)",-7915060.698281496,5207755.447290276
795774,101001654954,11/30/2015 02:31:00 PM,12/03/2015 02:31:36 PM,12/01/2015 07:28:25 AM,ONTIME,Closed,Case Closed. Closed date : 2015-12-01 07:28:25.963 REINSP: Issues Found  Re-Inspection,Building Inspection Request,Inspectional Services,Building,Building Inspection Request,ISD_Building (INTERNAL),ISD,,,10 Keenan Rd  Brighton  MA  02135,11.0,04,9.0,D14,Allston / Brighton,15.0,Ward 22,2212,R1,10 Keenan Rd,2135.0,Address,80761.0,42.3536,-71.1515,Constituent Call,"(42.3536, -71.1515)",-7920548.749177605,5214095.061090947
684259,101000706515,11/15/2012 09:17:57 AM,11/19/2012 09:17:56 AM,11/15/2012 09:46:00 AM,ONTIME,Closed,Case Closed Case Resolved lvs p-up at 9:46.,Missed Leaf or Yard Trash: District 07,Public Works Department,Sanitation,Missed Trash/Recycling/Yard Waste/Bulk Item,PWDx_Missed Trash\Recycling\Yard Waste\Bulk Item,PWDx,,,74 Kenwood St  Dorchester  MA  02124,8.0,07,4.0,C11,Dorchester,8.0,Ward 17,1706,R2,74 Kenwood St,2124.0,Address,81406.0,42.2927,-71.0685,Constituent Call,"(42.2927, -71.0685)",-7911309.231441763,5204925.825514903
771873,101001710491,02/06/2016 09:59:00 AM,02/10/2016 08:30:00 AM,02/06/2016 05:30:05 PM,ONTIME,Closed,Case Closed. Closed date : 2016-02-06 17:30:05.987 Case Resolved Nothing there at this time.,Space Savers,Public Works Department,Street Cleaning,Request for Snow Plowing,PWDx_District 05: South Boston,PWDx,,,12 Gates St  South Boston  MA  02127,6.0,05,2.0,C6,South Boston / South Boston Waterfront,5.0,Ward 7,0704,CM,12 Gates St,2127.0,Address,63026.0,42.3337,-71.0481,Citizens Connect App,"(42.3337, -71.0481)",-7909038.31382958,5211097.897672368
440677,101000814876,04/01/2013 02:33:40 PM,,04/01/2013 02:33:41 PM,ONTIME,Closed,Case Closed Internal Case Performed by Highway Maintenance crew.,Pothole Repair (Internal),Public Works Department,Highway Maintenance,Pothole Repair (Internal),PWDx_District 03: North Dorchester,PWDx,,,INTERSECTION of Dudley St & Magazine St  Roxbury  MA,7.0,03,7.0,B2,Roxbury,13.0,Ward 8,0805,,INTERSECTION Dudley St & Magazine St,,Intersection,4278.0,42.3252,-71.0749,Employee Generated,"(42.3252, -71.0749)",-7912021.67618284,5209817.991295996
147309,101001059883,04/02/2014 05:06:37 PM,07/01/2014 05:06:36 PM,04/02/2014 05:10:05 PM,ONTIME,Closed,Case Closed Case Invalid Caller will call back later if needed.,Unsatisfactory Utilities - Electrical  Plumbing,Inspectional Services,Housing,Unsatisfactory Utilities - Electrical  Plumbing,ISD_Housing (INTERNAL),ISD,,,3 Monsignor Dennis F O'Callaghan Way  South Boston  MA  02127,6.0,05,2.0,C6,South Boston / South Boston Waterfront,5.0,07,0707,,3 Monsignor Dennis F O'Callaghan Way,2127.0,Address,173926.0,42.3245,-71.0527,Constituent Call,"(42.3245, -71.0527)",-7909550.383487228,5209712.59494895
941614,101002027442,02/28/2017 03:07:00 PM,,03/01/2017 01:59:42 PM,ONTIME,Closed,Case Closed Case Noted  Thank you for the call  we will reprimand driver.,PublicWorks: Complaint,Mayor's 24 Hour Hotline,Employee & General Comments,General Comments For An Employee,PWDx_General Comments,PWDx,,,147-151 Massachusetts Ave  Boston  MA  02115,4.0,10A,8.0,D4,Back Bay,14.0,04,0406,RC,147-151 Massachusetts Ave,2115.0,Address,91973.0,42.3467,-71.0878,Twitter,"(42.3467, -71.0878)",-7913457.697614074,5213055.736177702
525895,101001502385,08/03/2015 03:00:00 PM,10/06/2015 03:00:38 PM,10/08/2015 12:24:30 PM,OVERDUE,Closed,Case Closed. Closed date : 2015-10-08 12:24:30.97 Case Resolved The graffiti tag at this location has been removed by the City of Boston Property Management Department. This case number has been resolved and is closed.,Graffiti Removal,Property Management,Graffiti,Graffiti Removal,PROP_GRAF_GraffitiRemoval,PROP,https://mayors24.cityofboston.gov/media/boston/report/photos/55bfba806963856559d311a5/1438628126648.jpg,,INTERSECTION of Market St & Vineland St  Brighton  MA,11.0,04,9.0,D14,Allston / Brighton,15.0,Ward 22,2205,,INTERSECTION Market St & Vineland St,,Intersection,7102.0,42.357,-71.1486,Citizens Connect App,"(42.357, -71.1486)",-7920225.922654304,5214607.234172679
591763,101001162587,09/02/2014 04:04:56 PM,09/04/2014 04:04:56 PM,09/02/2014 04:58:55 PM,ONTIME,Closed,Case Closed Case Noted Nothing at location at 4:58 p.m. on 9/2/14. Truck just left from location.,Missed Trash: District 04,Public Works Department,Sanitation,Missed Trash/Recycling/Yard Waste/Bulk Item,PWDx_Missed Trash\Recycling\Yard Waste\Bulk Item,PWDx,,,18 Bennett St  Brighton  MA  02135,11.0,04,9.0,D14,Allston / Brighton,15.0,Ward 22,2203,R2,18 Bennett St,2135.0,Address,14438.0,42.351000000000006,-71.1535,Self Service,"(42.351, -71.1535)",-7920771.38815919,5213703.418017676
37514,101000316978,08/21/2011 03:51:43 PM,10/24/2011 03:51:43 PM,09/20/2011 06:50:51 PM,ONTIME,Closed,Case Closed Case Resolved Paint - control cabinet,Graffiti Removal - Paint - control cabinet - Dist 2,Property Management,Graffiti,Graffiti Removal,PWDx_Graffiti,PWDx,,,117 Green St  Jamaica Plain  MA  02130,9.0,02,6.0,E13,Jamaica Plain,11.0,Ward 19,1906,A,117 Green St,2130.0,Address,66330.0,42.31100000000001,-71.1084,Citizens Connect App,"(42.311, -71.1084)",-7915750.879124414,5207680.180453827
850488,101001241692,01/03/2015 02:59:09 PM,03/11/2015 08:30:00 AM,01/07/2015 01:48:41 PM,ONTIME,Closed,Case Closed Case Resolved removed grafitti,Graffiti Removal,Property Management,Graffiti,Graffiti Removal,PWDx_District 10A: Roxbury,PWDx,https://mayors24.cityofboston.gov/media/boston/report/photos/54a849f904855a39b2f895c7/photo_20150103_145823.jpg,,INTERSECTION of Brookline Ave & Fenway  Boston  MA,4.0,10A,8.0,B2,Fenway / Kenmore / Audubon Circle / Longwood,14.0,Ward 4,0410,,INTERSECTION Brookline Ave & Fenway,,Intersection,2068.0,42.3427,-71.1032,Citizens Connect App,"(42.3427, -71.1032)",-7915172.017772289,5212453.281215551
761550,101001700067,01/24/2016 02:57:00 PM,02/01/2016 08:30:00 AM,01/24/2016 10:55:40 PM,ONTIME,Closed,Case Closed. Closed date : 2016-01-24 22:55:40.66 Case Noted no violations found at this time. sidewalk clear,Unshoveled Sidewalk,Public Works Department,Code Enforcement,Unshoveled Sidewalk,PWDx_Code Enforcement,PWDx,,,11 Johnson Ter  Dorchester  MA  02124,8.0,07,4.0,B3,Greater Mattapan,9.0,Ward 14,1410,R2,11 Johnson Ter,2124.0,Address,79932.0,42.2878,-71.0797,Constituent Call,"(42.2878, -71.0797)",-7912556.009738647,5204188.456482149
607892,101000411553,04/23/2012 10:32:21 AM,,04/26/2012 09:44:40 PM,ONTIME,Closed,Case Closed Bulk Item Automation,Schedule a Bulk Item Pickup,Public Works Department,Sanitation,Schedule a Bulk Item Pickup,PWDx_Schedule a Bulk Item Pickup,PWDx,,,254 Warren St  Roxbury  MA  02119,7.0,10B,7.0,B2,Roxbury,13.0,Ward 12,1201,A,254 Warren St,2119.0,Address,328717.0,42.3221,-71.0818,Constituent Call,"(42.3221, -71.0818)",-7912789.780669313,5209351.244947336
215681,101000855250,06/07/2013 12:05:01 PM,,06/07/2013 12:05:02 PM,ONTIME,Closed,Case Closed Internal Case Performed by Highway Maintenance crew.,Pothole Repair (Internal),Public Works Department,Highway Maintenance,Pothole Repair (Internal),PWDx_District 06: West Roxbury and Roslindale,PWDx,,,INTERSECTION of Washington St & Maplewood St  Hyde Park  MA,12.0,06,6.0,E18,West Roxbury,10.0,Ward 20,2003,,INTERSECTION Washington St & Maplewood St,,Intersection,5988.0,42.27,-71.1473,Employee Generated,"(42.27, -71.1473)",-7920081.207316273,5201510.33310243
106796,101001523397,08/17/2015 04:04:00 PM,08/18/2015 04:04:14 PM,08/20/2015 04:06:32 PM,OVERDUE,Closed,Case Closed. Closed date : 2015-08-20 16:06:32.947 Case Invalid Bike appears to be attached to private property.,Requests for Street Cleaning,Public Works Department,Street Cleaning,Requests for Street Cleaning,BTDT_Abandoned Bicycle,BTDT,https://mayors24.cityofboston.gov/media/boston/report/photos/55d23e3d04858b6818a11fcf/report.jpg,,3 N Hudson St  Boston  MA  02113,3.0,1B,1.0,A1,Downtown / Financial District,3.0,Ward 3,0302,R4,3 N Hudson St,2113.0,Address,75890.0,42.3675,-71.0567,Citizens Connect App,"(42.3675, -71.0567)",-7909995.661450404,5216189.120116564
356121,101001857906,07/13/2016 12:54:00 PM,07/18/2016 12:54:03 PM,,OVERDUE,Open,,Illegal Auto Body Shop,Inspectional Services,Environmental Services,Illegal Auto Body Shop,ISD_Environmental Services (INTERNAL),ISD,,,682-686 Cummins Hwy  Mattapan  MA  02126,8.0,07,5.0,B3,Greater Mattapan,9.0,Ward 18,1821,C,682-686 Cummins Hwy,2126.0,Address,44947.0,42.2714,-71.1043,Constituent Call,"(42.2714, -71.1043)",-7915294.469212161,5201720.944612954
135418,101000879028,07/14/2013 12:11:19 PM,07/16/2013 08:30:00 AM,07/14/2013 12:57:04 PM,ONTIME,Closed,Case Closed Case Resolved at that location did not find any dead rats check by CITY WIDE S. FOTADIS,Pick up Dead Animal,Public Works Department,Street Cleaning,Pick up Dead Animal,PWDx_District 1C: Downtown,PWDx,,,46 Gloucester St  Boston  MA  02115,4.0,1C,8.0,D4,Back Bay,14.0,Ward 5,0509,RC,46 Gloucester St,2115.0,Address,64953.0,42.3488,-71.0842,Constituent Call,"(42.3488, -71.0842)",-7913056.947447217,5213372.040378293
827308,101001106522,06/10/2014 12:01:39 PM,10/08/2014 12:01:38 PM,,OVERDUE,Open,,Unsatisfactory Living Conditions,Inspectional Services,Housing,Unsatisfactory Living Conditions,ISD_Housing (INTERNAL),ISD,,,6 Humboldt Ave  Roxbury  MA  02119,9.0,10B,7.0,B2,Roxbury,13.0,Ward 12,1203,R3,6 Humboldt Ave,2119.0,Address,76020.0,42.3204,-71.0857,Constituent Call,"(42.3204, -71.0857)",-7913223.926683407,5209095.297035659
799658,101001872299,08/01/2016 07:42:00 AM,,08/08/2016 04:30:37 PM,ONTIME,Closed,Case Closed. Closed date : 2016-08-08 16:30:37.693 Bulk Item Automation,Schedule a Bulk Item Pickup,Public Works Department,Sanitation,Schedule a Bulk Item Pickup,PWDx_Schedule a Bulk Item Pickup,PWDx,,,741 Lagrange St  West Roxbury  MA  02132,12.0,06,6.0,E5,West Roxbury,12.0,Ward 20,2017,R1,741 Lagrange St,2132.0,Address,82896.0,42.2902,-71.1676,Constituent Call,"(42.2902, -71.1676)",-7922340.992979375,5204549.609657571
774976,101001969097,12/12/2016 08:06:00 PM,12/15/2016 08:30:00 AM,12/13/2016 02:19:55 AM,ONTIME,Closed,Case Closed. Closed date : 2016-12-13 02:19:55.663 Case Noted Drove down Eleanor St. from Ridgemont St. road conditions are fine. No ice found.,Request for Snow Plowing,Public Works Department,Street Cleaning,Request for Snow Plowing,PWDx_District 04: Allston/Brighton,PWDx,,,6 Eleanor St  Allston  MA  02134,11.0,04,9.0,D14,Allston / Brighton,15.0,Ward 21,2106,R2,6 Eleanor St,2134.0,Address,404139.0,42.3512,-71.1427,Constituent Call,"(42.3512, -71.1427)",-7919569.137658624,5213733.543832747
186577,101001639288,11/20/2015 08:10:00 AM,11/23/2015 08:30:00 AM,11/20/2015 08:31:25 AM,ONTIME,Closed,Case Closed. Closed date : 2015-11-20 08:31:25.867 Case Invalid Nothing found.,Tree Emergencies,Parks & Recreation Department,Trees,Tree Emergencies,PARK_Tree Emergencies,PARK,,,245 Princeton St  East Boston  MA  02128,1.0,09,1.0,A7,East Boston,1.0,Ward 1,0110,RL,245 Princeton St,2128.0,Address,113257.0,42.3792,-71.0306,Constituent Call,"(42.3792, -71.0306)",-7907090.222740698,5217952.1045218045
351390,101000360829,12/06/2011 08:43:42 AM,01/05/2012 08:43:42 AM,01/04/2012 12:09:50 PM,ONTIME,Closed,Case Closed VIOCOR: Violation Corrected,Rodent Activity,Inspectional Services,Environmental Services,Rodent Activity,ISD_Environmental Services (INTERNAL),ISD,,,,,,,,,,,,,,,,,42.3594,-71.0587,Constituent Call,"(0, 0)",-7910218.300431989,5214968.784796895
689793,101001035723,02/25/2014 09:32:00 AM,02/27/2014 09:32:00 AM,02/25/2014 10:52:58 AM,ONTIME,Closed,Case Closed Case Resolved Roadway hot patched,Request for Pothole Repair,Public Works Department,Highway Maintenance,Request for Pothole Repair,PWDx_District 02: Jamaica Plain,PWDx,,,295 Forest Hills St  Jamaica Plain  MA  02130,9.0,02,6.0,E13,Jamaica Plain,11.0,Ward 11,1108,R3,295 Forest Hills St,2130.0,Address,236797.0,42.3026,-71.1049,City Worker App,"(42.3026, -71.1049)",-7915361.260906639,5206415.786986711
311075,101001810832,06/09/2016 08:02:36 AM,06/10/2016 08:30:00 AM,06/09/2016 08:23:32 AM,ONTIME,Closed,Case Closed. Closed date : 2016-06-09 08:23:32.09 Case Resolved shopping cart picked up,Requests for Street Cleaning,Public Works Department,Street Cleaning,Requests for Street Cleaning,PWDx_District 07: South Dorchester,PWDx,https://cityworker.cityofboston.gov:8443/attachments/report/57595ad7d05203d28ce9074c/photo/Report.jpg,https://cityworker.cityofboston.gov:8443/attachments/report/57595ad7d05203d28ce9074c/closed_photo/Report.jpg,INTERSECTION of Centre St & Adams St  Dorchester  MA,8.0,07,3.0,C11,Dorchester,7.0,16,1605,,INTERSECTION Centre St & Adams St,,Intersection,16473.0,42.3594,-71.0587,City Worker App,"(0, 0)",-7910218.300431989,5214968.784796895
617850,101001789529,05/13/2016 11:56:00 AM,05/14/2016 11:56:38 AM,05/13/2016 03:22:24 PM,ONTIME,Closed,Case Closed. Closed date : 2016-05-13 15:22:24.287 Duplicate of Existing Case made safe,Traffic Signal Inspection,Transportation - Traffic Division,Signs & Signals,Traffic Signal Inspection,BTDT_Traffic Signal_Knock Downs/Contractor,BTDT,,,INTERSECTION of Washington St & Enneking Pkwy  West Roxbury  MA,12.0,06,6.0,E5,West Roxbury,10.0,20,2009,,INTERSECTION Washington St & Enneking Pkwy,,Intersection,17054.0,42.3594,-71.0587,Constituent Call,"(0, 0)",-7910218.300431989,5214968.784796895
793599,101001149023,08/12/2014 07:31:21 PM,08/15/2014 08:30:00 AM,08/13/2014 07:55:05 AM,ONTIME,Closed,Case Closed Case Resolved On inspection of above property there was no dresser @7:54am,Missed Trash: District 06,Public Works Department,Sanitation,Missed Trash/Recycling/Yard Waste/Bulk Item,PWDx_Missed Trash\Recycling\Yard Waste\Bulk Item,PWDx,,,254 Belgrade Ave  Roslindale  MA  02131,12.0,06,5.0,E5,Roslindale,10.0,Ward 20,2008,R4,254 Belgrade Ave,2131.0,Address,13621.0,42.2859,-71.1417,Constituent Call,"(42.2859, -71.1417)",-7919457.818167831,5203902.553309751
111479,101000445994,07/06/2012 01:49:02 PM,07/10/2012 01:49:02 PM,07/27/2012 01:24:18 PM,OVERDUE,Closed,Case Closed Case Noted  This has been taken care of  street was power washed  litter baskets were installed.  BTD is going to repost so that street will contue to be swept every night  and we will be able to get to the curb.,Requests for Street Cleaning,Public Works Department,Street Cleaning,Requests for Street Cleaning,PWDx_Graffiti,PWDx,,,INTERSECTION of Boylston St & Dartmouth St  Boston  MA,4.0,1C,2.0,D4,Back Bay,6.0,Ward 4,0402,,INTERSECTION Boylston St & Dartmouth St,,Intersection,1778.0,42.3501,-71.0773,Constituent Call,"(42.3501, -71.0773)",-7912288.842960742,5213567.853036073
851696,101001269993,02/03/2015 11:06:49 AM,02/05/2015 11:06:48 AM,02/04/2015 04:27:52 AM,ONTIME,Closed,Case Closed Case Resolved,Request for Snow Plowing,Public Works Department,Street Cleaning,Request for Snow Plowing,PWDx_District 08: Hyde Park,PWDx,,,70 Osceola St  Mattapan  MA  02126,8.0,08,5.0,E18,Hyde Park,9.0,Ward 18,1805,R1,70 Osceola St,2126.0,Address,106060.0,42.261,-71.1015,Constituent Call,"(42.261, -71.1015)",-7914982.774637941,5200156.513641331
319550,101000358409,11/29/2011 02:14:27 PM,12/13/2011 02:14:27 PM,12/02/2011 01:56:38 PM,ONTIME,Closed,Case Closed Case Resolved completed 12/02/11,Street Light Outages,Public Works Department,Street Lights,Street Light Outages,PWDx_Street Light Outages,PWDx,,,24 Laurel St  Roxbury  MA  02119,9.0,10B,7.0,B2,Roxbury,13.0,Ward 12,1205,R2,24 Laurel St,2119.0,Address,262951.0,42.32,-71.085,Self Service,"(42.32, -71.085)",-7913146.003039851,5209035.075002586
220819,101001632070,11/10/2015 11:03:00 AM,,11/17/2015 04:31:00 PM,ONTIME,Closed,Case Closed. Closed date : 2015-11-17 16:31:00.45 Bulk Item Automation,Schedule a Bulk Item Pickup,Public Works Department,Sanitation,Schedule a Bulk Item Pickup,PWDx_Schedule a Bulk Item Pickup,PWDx,,,100 Paris St  East Boston  MA  02128,1.0,09,1.0,A7,East Boston,1.0,Ward 1,0104,R3,100 Paris St,2128.0,Address,106460.0,42.3724,-71.0379,Constituent Call,"(42.3724, -71.0379)",-7907902.855023488,5216927.424042908
104208,101000396590,03/18/2012 02:29:15 PM,,03/23/2012 09:42:01 PM,ONTIME,Closed,Case Closed Bulk Item Automation,Schedule a Bulk Item Pickup,Public Works Department,Sanitation,Schedule a Bulk Item Pickup,PWDx_Schedule a Bulk Item Pickup,PWDx,,,225 Baker St  West Roxbury  MA  02132,12.0,06,6.0,E5,West Roxbury,12.0,Ward 20,2005,CD,225 Baker St,2132.0,Address,7682.0,42.2769,-71.1668,Self Service,"(42.2769, -71.1668)",-7922251.937386741,5202548.392267646
125062,101001805982,06/03/2016 09:51:00 AM,06/08/2016 09:51:46 AM,06/03/2016 11:49:22 AM,ONTIME,Closed,Case Closed. Closed date : 2016-06-03 11:49:22.95 Duplicate of Existing Case case entered in ISD for inspection 1805982,Parking on Front/Back Yards (Illegal Parking),Public Works Department,Code Enforcement,Parking on Front/Back Yards (Illegal Parking),ISD_Administrative,ISD,,,INTERSECTION of Crowell St & Matthew St  Dorchester  MA,8.0,07,4.0,B3,Greater Mattapan,9.0,17,1710,,INTERSECTION Crowell St & Matthew St,,Intersection,10055.0,42.3594,-71.0587,Constituent Call,"(0, 0)",-7910218.300431989,5214968.784796895
587234,101001154511,08/21/2014 07:14:35 AM,08/22/2014 08:30:00 AM,08/22/2014 06:16:30 AM,ONTIME,Closed,Case Closed Case Resolved,Empty Litter Basket,Public Works Department,Highway Maintenance,Empty Litter Basket,PWDx_District 1C: Downtown,PWDx,https://mayors24.cityofboston.gov/media/boston/report/photos/53f5d488048593c1d57a2886/report.jpg,,INTERSECTION of Temple Pl & Tremont St  Boston  MA,3.0,1C,8.0,A1,Beacon Hill,14.0,Ward 5,0503,,INTERSECTION Temple Pl & Tremont St,,Intersection,8497.0,42.3556,-71.0629,Citizens Connect App,"(42.3556, -71.0629)",-7910685.84229332,5214396.336018524
280955,101000406271,04/09/2012 02:51:54 PM,,04/13/2012 09:42:52 PM,ONTIME,Closed,Case Closed Bulk Item Automation,Schedule a Bulk Item Pickup,Public Works Department,Sanitation,Schedule a Bulk Item Pickup,PWDx_Schedule a Bulk Item Pickup,PWDx,,,5 Appleton St  Boston  MA  02116,4.0,1C,2.0,D4,South End,6.0,Ward 5,0501,CD,5 Appleton St,2116.0,Address,4038.0,42.3467,-71.0698,Self Service,"(42.3467, -71.0698)",-7911453.946779794,5213055.736177702
291801,101000841847,05/17/2013 09:14:36 PM,05/21/2013 08:30:00 AM,05/17/2013 10:23:14 PM,ONTIME,Closed,Case Closed Case Resolved pick up,Pick up Dead Animal,Public Works Department,Street Cleaning,Pick up Dead Animal,PWDx_District 08: Hyde Park,PWDx,,,75 Readville St  Hyde Park  MA  02136,12.0,08,5.0,E18,Hyde Park,10.0,Ward 18,1820,R3,75 Readville St,2136.0,Address,114919.0,42.2434,-71.1342,Constituent Call,"(42.2434, -71.1342)",-7918622.921986882,5197509.602788369
281896,101001586221,09/23/2015 01:08:00 PM,10/07/2015 01:08:48 PM,10/26/2015 01:16:52 PM,OVERDUE,Closed,Case Closed. Closed date : 2015-10-26 13:16:52.62 Case Resolved,Sign Repair,Transportation - Traffic Division,Signs & Signals,Sign Repair,BTDT_Sign Shop_Sign Installation,BTDT,https://cityworker.cityofboston.gov:8443/attachments/report/5602dcacd052f4d9a9fdf71e/photo/Report.jpg,,INTERSECTION of Ball St & Shawmut Ave  Mission Hill  MA,7.0,10B,7.0,D4,Roxbury,13.0,Ward 9,0904,,INTERSECTION Ball St & Shawmut Ave,,Intersection,931.0,42.3343,-71.082,City Worker App,"(42.3343, -71.082)",-7912812.044567472,5211188.250540508
199733,101000479029,09/14/2012 10:12:31 AM,09/18/2012 10:12:30 AM,09/18/2012 08:04:14 AM,ONTIME,Closed,Case Closed Case Resolved,Requests for Street Cleaning,Public Works Department,Street Cleaning,Requests for Street Cleaning,PWDx_District 05: South Boston,PWDx,,,852 E Broadway  South Boston  MA  02127,6.0,05,2.0,C6,South Boston / South Boston Waterfront,5.0,Ward 6,0607,CM,852 E Broadway,2127.0,Address,21265.0,42.3359,-71.0302,Constituent Call,"(42.3359, -71.0302)",-7907045.69494438,5211429.195736468
862004,101001355582,04/14/2015 08:11:23 AM,04/17/2015 08:30:00 AM,04/15/2015 08:05:42 AM,ONTIME,Closed,Case Closed CORR: Corrected,Building Inspection Request,Inspectional Services,Building,Building Inspection Request,ISD_Building (INTERNAL),ISD,,,566 Commonwealth Ave  Boston  MA  02215,4.0,10A,8.0,D4,Fenway / Kenmore / Audubon Circle / Longwood,14.0,Ward 5,0510,RC,566 Commonwealth Ave,2215.0,Address,217374.0,42.3488,-71.0988,Constituent Call,"(42.3488, -71.0988)",-7914682.212012798,5213372.040378293
14366,101001229524,12/08/2014 06:48:08 AM,12/08/2015 06:48:08 AM,12/11/2014 01:57:14 PM,ONTIME,Closed,Case Closed Case Invalid,Sidewalk Repair,Public Works Department,Highway Maintenance,Sidewalk Repair,PWDx_Highway Construction,PWDx,,,130 Old Colony Ave  South Boston  MA  02127,6.0,05,2.0,C6,South Boston / South Boston Waterfront,5.0,06,0602,,130 Old Colony Ave,2127.0,Address,343875.0,42.3353,-71.0552,City Worker App,"(42.3353, -71.0552)",-7909828.682214212,5211338.840569625
475890,101000848351,05/29/2013 09:07:01 AM,06/05/2013 09:07:01 AM,04/30/2014 10:59:48 AM,OVERDUE,Closed,Case Closed NOVIO: No Violation Found/No Cause,Maintenance - Homeowner,Inspectional Services,Building,Maintenance - Homeowner,ISD_Building (INTERNAL),ISD,,,1258 Commonwealth Ave  Allston  MA  02134,11.0,04,9.0,D14,Allston,15.0,21,2105,,1258 Commonwealth Ave,2134.0,Address,163755.0,42.3493,-71.1322,Self Service,"(42.3493, -71.1322)",-7918400.283005294,5213447.352459726
189989,101000341368,10/12/2011 01:51:42 PM,12/14/2011 01:51:41 PM,10/13/2011 09:47:23 AM,ONTIME,Closed,Case Closed Case Resolved,Graffiti Removal,Property Management,Graffiti,Graffiti Removal,INFO_Reallocation From Dept,INFO,,,2 Brooks St  East Boston  MA  02128,1.0,09,1.0,A7,East Boston,1.0,Ward 1,0105,RC,2 Brooks St,2128.0,Address,198252.0,42.3757,-71.0316,Citizens Connect App,"(42.3757, -71.0316)",-7907201.542231491,5217424.681594754
114067,101001605195,10/05/2015 01:55:00 PM,10/08/2015 01:55:19 PM,10/16/2015 08:55:29 AM,OVERDUE,Closed,Case Closed. Closed date : 2015-10-16 08:55:29.903 CORR: Corrected,Building Inspection Request,Inspectional Services,Building,Building Inspection Request,ISD_Building (INTERNAL),ISD,,,150 Mount Vernon St  Boston  MA  02108,3.0,1B,8.0,A1,Beacon Hill,14.0,Ward 5,0505,R1,150 Mount Vernon St,2108.0,Address,98532.0,42.3574,-71.0715,Constituent Call,"(42.3574, -71.0715)",-7911643.189914142,5214667.491651126
420157,101001732842,03/09/2016 10:07:05 AM,03/23/2016 10:07:05 AM,03/10/2016 06:51:02 PM,ONTIME,Closed,Case Closed. Closed date : 2016-03-10 18:51:02.747 Case Noted opposition noted,Other: Comment,Mayor's 24 Hour Hotline,Employee & General Comments,General Comments For a Program or Policy,INFO_General Comments Complaints Compliments,INFO,,,,,,,,,,,,,,,,,42.3594,-71.0587,Constituent Call,"(0, 0)",-7910218.300431989,5214968.784796895
65684,101000711564,11/26/2012 09:37:32 AM,12/26/2012 09:37:32 AM,11/29/2012 12:28:50 PM,ONTIME,Closed,Case Closed NOVIO: No Violation Found/No Cause,Rodent Activity,Inspectional Services,Environmental Services,Rodent Activity,ISD_Environmental Services (INTERNAL),ISD,,,128 Commonwealth Ave  Boston  MA  02116,4.0,1C,8.0,D4,Boston,14.0,05,0507,CM,128 Commonwealth Ave,2116.0,Address,37259.0,42.3518,-71.0772,Constituent Call,"(42.3518, -71.0772)",-7912277.711011664,5213823.921853131
847462,101001958536,11/25/2016 04:11:14 PM,11/28/2016 04:11:14 PM,11/25/2016 05:09:23 PM,ONTIME,Closed,Case Closed. Closed date : 2016-11-25 17:09:23.33 Case Noted area clear at this time,Parking Enforcement,Transportation - Traffic Division,Enforcement & Abandoned Vehicles,Parking Enforcement,BTDT_Parking Enforcement,BTDT,,,94 Tyler St  Boston  MA  02111,4.0,1C,2.0,A1,Downtown / Financial District,4.0,Ward 3,0308,A,94 Tyler St,2111.0,Address,358960.0,42.3487,-71.0614,Citizens Connect App,"(42.3487, -71.0614)",-7910518.863057131,5213356.978033894
45836,101001861282,07/18/2016 12:55:00 PM,07/18/2017 12:55:09 PM,09/29/2016 10:42:00 AM,ONTIME,Closed,Case Closed. Closed date : 2016-09-29 10:42:00.607 Case Resolved Unfortunately  the sidewalk at the address provided does not meet the minimum width requirements per ADA   preventing the Parks Dept. from planting any trees.,New Tree Requests,Parks & Recreation Department,Trees,New Tree Requests,PARK_New Tree Requests,PARK,,,12-14 Quincefield St  Dorchester  MA  02125,7.0,03,7.0,B2,Dorchester,13.0,Ward 7,0710,R4,12-14 Quincefield St,2125.0,Address,113962.0,42.3188,-71.0664,Constituent Call,"(42.3188, -71.0664)",-7911075.460511098,5208854.4112003
540,101000455121,07/25/2012 12:46:05 PM,,08/02/2012 09:43:01 PM,ONTIME,Closed,Case Closed Bulk Item Automation,Schedule a Bulk Item Pickup,Public Works Department,Sanitation,Schedule a Bulk Item Pickup,PWDx_Schedule a Bulk Item Pickup,PWDx,,,20-22 Wyvern St  Roslindale  MA  02131,12.0,02,6.0,E18,Jamaica Plain,10.0,Ward 19,1912,R2,20-22 Wyvern St,2131.0,Address,153192.0,42.2885,-71.117,Employee Generated,"(42.2885, -71.117)",-7916708.226745238,5204293.791403597
669920,101000954281,10/25/2013 04:02:56 PM,10/28/2013 04:02:56 PM,10/25/2013 06:53:36 PM,ONTIME,Closed,Case Closed Case Resolved picked up,Pick up Dead Animal,Public Works Department,Street Cleaning,Pick up Dead Animal,PWDx_District 04: Allston/Brighton,PWDx,,,INTERSECTION of N Beacon St & Etna St  Brighton  MA,11.0,04,9.0,D14,Allston / Brighton,15.0,Ward 22,2206.0,,INTERSECTION N Beacon St & Etna St,,Intersection,1132.0,42.3555,-71.1463,Constituent Call,"(42.3555, -71.1463)",-7919969.88782548,5214381.272044434
236323,101000842584,05/20/2013 09:24:34 AM,06/17/2013 09:24:34 AM,05/23/2013 08:29:14 AM,ONTIME,Closed,Case Closed Case Resolved Deliver new cart #0513426810 .,Damaged Cart - New Request,Public Works Department,Recycling,Request for Recycling Cart,PWDx_Recycling,PWDx,,,94 Lake St  Brighton  MA  02135,11.0,04,9.0,D14,Allston / Brighton,15.0,Ward 22,2208,R1,94 Lake St,2135.0,Address,83041.0,42.3438,-71.1646,Employee Generated,"(42.3438, -71.1646)",-7922007.034506996,5212618.952509077
493023,101001871962,07/31/2016 11:54:00 AM,08/02/2016 08:30:00 AM,07/31/2016 05:03:52 PM,ONTIME,Closed,Case Closed. Closed date : 2016-07-31 17:03:52.537 Case Resolved Nothing here,CE Collection,Public Works Department,Street Cleaning,CE Collection,PWDx_District 07: South Dorchester,PWDx,https://cityworker.cityofboston.gov:8443/attachments/report/579e1f1c70b46e3f75700c54/photo/Report.jpg,https://cityworker.cityofboston.gov:8443/attachments/report/579e1f1c70b46e3f75700c54/closed_photo/Report.jpg,790-798 Washington St  Dorchester  MA  02124,8.0,07,4.0,C11,Dorchester,8.0,Ward 17,1709,C,790-798 Washington St,2124.0,Address,146182.0,42.2838,-71.0713,City Worker App,"(42.2838, -71.0713)",-7911620.926015983,5203586.565098337
448737,101001116754,06/26/2014 12:30:00 PM,12/23/2015 12:30:00 PM,06/27/2014 08:37:17 AM,ONTIME,Closed,Case Closed Case Resolved nothing found tree crew,Tree Maintenance Requests,Parks & Recreation Department,Trees,Tree Maintenance Requests,PARK_Tree Emergencies,PARK,,,53 Bradlee St  Hyde Park  MA  02136,12.0,08,5.0,E18,Hyde Park,10.0,Ward 18,1808,R1,53 Bradlee St,2136.0,Address,19060.0,42.2688,-71.1166,City Worker App,"(42.2688, -71.1166)",-7916663.69894892,5201329.812673644
630782,101000359252,12/01/2011 10:22:01 AM,12/05/2011 10:22:00 AM,12/01/2011 10:49:51 AM,ONTIME,Closed,Case Closed Case Resolved  DELIVERED 12/1/11  (MB),Sticker Request,Public Works Department,Recycling,Sticker Request,PWDx_Sticker Request,PWDx,,,64 Parkton Rd  Jamaica Plain  MA  02130,9.0,02,6.0,E13,Jamaica Plain,11.0,Ward 10,1009,R3,64 Parkton Rd,2130.0,Address,290987.0,42.321999999999996,-71.1145,Self Service,"(42.322, -71.1145)",-7916429.928018254,5209336.188996396
498959,101000317308,08/22/2011 11:35:18 AM,,08/22/2011 11:35:21 AM,ONTIME,Closed,Case Closed Internal Case,Highway Maintenance,Public Works Department,Highway Maintenance,Highway Maintenance,PWDx_District 10B: Roxbury,PWDx,,,19-35 Lenox St  Roxbury  MA  02118,7.0,10B,7.0,D4,Roxbury,13.0,Ward 9,0903,E,19-35 Lenox St,2118.0,Address,85061.0,42.3357,-71.0793,Employee Generated,"(42.3357, -71.0793)",-7912511.48194233,5211399.077251736
373377,101001710119,02/05/2016 06:10:00 PM,02/10/2016 08:30:00 AM,02/06/2016 08:33:25 AM,ONTIME,Closed,Case Closed. Closed date : 2016-02-06 08:33:25.237 Case Resolved no violation  sidewalk is shoveled,Request for Snow Plowing,Public Works Department,Street Cleaning,Request for Snow Plowing,PWDx_Code Enforcement,PWDx,https://mayors24.cityofboston.gov/media/boston/report/photos/56b52be90485ea5eec23f04a/photo_20160205_180959.jpg,https://cityworker.cityofboston.gov:8443/attachments/report/56b52c32d0523dfc52f45199/closed_photo/Report.jpg,123 Sutherland Rd  Brighton  MA  02135,11.0,04,9.0,D14,Allston / Brighton,15.0,Ward 21,2114,A,123 Sutherland Rd,2135.0,Address,410686.0,42.3402,-71.1478,Citizens Connect App,"(42.3402, -71.1478)",-7920136.86706167,5212076.766327697
736995,101000403855,04/03/2012 02:00:14 PM,,04/06/2012 09:44:07 PM,ONTIME,Closed,Case Closed Bulk Item Automation,Schedule a Bulk Item Pickup,Public Works Department,Sanitation,Schedule a Bulk Item Pickup,PWDx_Schedule a Bulk Item Pickup,PWDx,,,47 Pinckney St  Boston  MA  02114,3.0,1B,8.0,A1,Beacon Hill,14.0,Ward 5,0503,R1,47 Pinckney St,2114.0,Address,110689.0,42.358999999999995,-71.0669,Employee Generated,"(42.359, -71.0669)",-7911131.120256494,5214908.525400578
289092,101001886325,08/19/2016 09:09:11 AM,08/22/2016 09:09:10 AM,08/19/2016 09:41:50 AM,ONTIME,Closed,Case Closed. Closed date : 2016-08-19 09:41:50.567 Case Resolved Ticket issued and put on tow list.,Parking Enforcement,Transportation - Traffic Division,Enforcement & Abandoned Vehicles,Parking Enforcement,BTDT_Parking Enforcement,BTDT,https://mayors24.cityofboston.gov/media/boston/report/photos/57b704ef6963211276257e1d/report.jpg,,199 Strathmore Rd  Brighton  MA  02135,11.0,04,9.0,D14,Allston / Brighton,15.0,Ward 21,2115,A,199 Strathmore Rd,2135.0,Address,131371.0,42.3405,-71.1547,Citizens Connect App,"(42.3405, -71.1547)",-7920904.971548144,5212121.947323806
303766,101001928234,10/11/2016 01:16:00 PM,11/10/2016 01:16:41 PM,10/12/2016 09:46:55 AM,ONTIME,Closed,Case Closed. Closed date : 2016-10-12 09:46:55.003 :,No Utilities Residential - Electricity,Inspectional Services,Housing,No Utilities Residential - Electricity,ISD_Housing (INTERNAL),ISD,,,221 Dudley St  Roxbury  MA  02119,7.0,10B,7.0,B2,Roxbury,13.0,Ward 8,0804,RC,221 Dudley St,2119.0,Address,226509.0,42.3284,-71.0806,Constituent Call,"(42.3284, -71.0806)",-7912656.197280361,5210299.818103092
249544,101001695609,01/18/2016 01:35:00 PM,01/19/2016 01:35:26 PM,01/19/2016 07:10:17 AM,ONTIME,Closed,Case Closed. Closed date : 2016-01-19 07:10:17.183 Case Resolved,Traffic Signal Inspection,Transportation - Traffic Division,Signs & Signals,Traffic Signal Inspection,BTDT_Traffic Signal_Repair,BTDT,,,INTERSECTION of Dorchester Ave & Milhender Pl  South Boston  MA,6.0,05,2.0,C6,South Boston / South Boston Waterfront,5.0,Ward 7,0705,,INTERSECTION Dorchester Ave & Milhender Pl,,Intersection,4166.0,42.3379,-71.0571,Constituent Call,"(42.3379, -71.0571)",-7910040.18924672,5211730.38585209
284557,101001752573,03/23/2016 06:15:46 PM,03/25/2016 08:30:00 AM,03/23/2016 08:19:03 PM,ONTIME,Closed,Case Closed. Closed date : 2016-03-23 20:19:03.56 Case Resolved picked up,Pick up Dead Animal,Public Works Department,Street Cleaning,Pick up Dead Animal,PWDx_District 05: South Boston,PWDx,https://mayors24.cityofboston.gov/media/boston/report/photos/56f3158e0485e8a9393d93c0/report.jpg,,649 Summer St  Boston  MA  02210,6.0,05,2.0,C6,South Boston / South Boston Waterfront,5.0,Ward 6,0604,I,649 Summer St,2210.0,Address,132038.0,42.3397,-71.0425,Citizens Connect App,"(42.3397, -71.0425)",-7908414.924681138,5212001.465146543
14752,101001079227,05/01/2014 10:02:41 AM,05/05/2014 10:02:41 AM,05/01/2014 10:02:43 AM,ONTIME,Closed,Case Closed Internal Case,Requests for Street Cleaning,Public Works Department,Street Cleaning,Requests for Street Cleaning,PWDx_District 09: East Boston,PWDx,,,132-134 Princeton St  East Boston  MA  02128,1.0,09,1.0,A7,East Boston,1.0,Ward 1,0107,R4,132-134 Princeton St,2128.0,Address,168931.0,42.3781,-71.0347,Employee Generated,"(42.3781, -71.0347)",-7907546.6326529505,5217786.339862818
16407,101001199169,10/18/2014 08:08:45 AM,10/21/2014 08:30:00 AM,10/18/2014 08:48:06 AM,ONTIME,Closed,Case Closed Case Resolved,Pick up Dead Animal,Public Works Department,Street Cleaning,Pick up Dead Animal,PWDx_District 02: Jamaica Plain,PWDx,,,19 Firth Rd  Roslindale  MA  02131,12.0,02,5.0,E5,Roslindale,10.0,Ward 19,1913,R3,19 Firth Rd,2131.0,Address,58491.0,42.288000000000004,-71.1251,Constituent Call,"(42.288, -71.1251)",-7917609.914620662,5204218.552054551
775452,101001921992,10/01/2016 06:13:40 PM,10/05/2016 08:30:00 AM,10/02/2016 08:03:06 AM,ONTIME,Closed,Case Closed. Closed date : 2016-10-02 08:03:06.94 Case Noted Trash has been sent in for collection,Improper Storage of Trash (Barrels),Public Works Department,Code Enforcement,Improper Storage of Trash (Barrels),PWDx_Code Enforcement,PWDx,,,INTERSECTION of Garden St & Phillips St  Boston  MA,3.0,1B,7.0,A1,Beacon Hill,14.0,5,0504,,INTERSECTION Garden St & Phillips St,,Intersection,14761.0,42.3594,-71.0587,Citizens Connect App,"(0, 0)",-7910218.300431989,5214968.784796895
167517,101001933037,10/17/2016 06:20:52 PM,10/19/2016 08:30:00 AM,10/18/2016 10:38:22 AM,ONTIME,Closed,Case Closed. Closed date : 2016-10-18 10:38:22.3 Case Resolved Filled all set,Request for Pothole Repair,Public Works Department,Highway Maintenance,Request for Pothole Repair,PWDx_District 10A: Roxbury,PWDx,https://mayors24.cityofboston.gov/media/boston/report/photos/58054ebc696338e4faae2e3b/report.jpg,https://cityworker.cityofboston.gov:8443/attachments/report/58054f0cd052e4313f7a68b2/closed_photo/Report.jpg,483 Commonwealth Ave  Boston  MA  02215,4.0,10A,8.0,D4,Fenway / Kenmore / Audubon Circle / Longwood,14.0,Ward 5,0510,E,483 Commonwealth Ave,2215.0,Address,40996.0,42.3494,-71.094,Citizens Connect App,"(42.3494, -71.094)",-7914147.87845699,5213462.4149479
216993,101001903776,09/08/2016 09:59:23 PM,09/12/2016 08:30:00 AM,09/09/2016 10:17:45 AM,ONTIME,Closed,Case Closed. Closed date : 2016-09-09 10:17:45.163 Case Resolved completed,Requests for Street Cleaning,Public Works Department,Street Cleaning,Requests for Street Cleaning,PWDx_District 1C: Downtown,PWDx,https://mayors24.cityofboston.gov/media/boston/report/photos/57d2177869635ac1c42234af/report.jpg,https://cityworker.cityofboston.gov:8443/attachments/report/57d217bdd052411055bfa82b/closed_photo/Report.jpg,118 Newbury St  Boston  MA  02116,4.0,1C,8.0,D4,Back Bay,14.0,Ward 5,0507,RC,118 Newbury St,2116.0,Address,101330.0,42.3511,-71.0761,Citizens Connect App,"(42.3511, -71.0761)",-7912155.259571791,5213718.480913229
680619,101000374648,01/17/2012 10:10:52 AM,,01/18/2012 11:44:23 PM,ONTIME,Closed,Case Closed Bulk Item Automation,Schedule a Bulk Item Pickup,Public Works Department,Sanitation,Schedule a Bulk Item Pickup,PWDx_Schedule a Bulk Item Pickup,PWDx,,,30 Pinckney St  Boston  MA  02108,3.0,1B,8.0,A1,Beacon Hill,14.0,Ward 5,0503,CD,30 Pinckney St,2108.0,Address,110658.0,42.3588,-71.0665,Self Service,"(42.3588, -71.0665)",-7911086.592460177,5214878.395846266
338311,101000867218,06/25/2013 02:15:38 PM,,07/01/2013 09:47:22 PM,ONTIME,Closed,Case Closed Bulk Item Automation,Schedule a Bulk Item Pickup,Public Works Department,Sanitation,Schedule a Bulk Item Pickup,PWDx_Schedule a Bulk Item Pickup,PWDx,,,100C Allandale St  Roslindale  MA  02131,9.0,02,6.0,E13,West Roxbury,12.0,Ward 20,2006,R1,100C Allandale St,2131.0,Address,2149.0,42.3012,-71.1336,Constituent Call,"(42.3012, -71.1336)",-7918556.130292404,5206205.071143357
117022,101001024863,02/12/2014 12:38:29 PM,03/14/2014 12:38:29 PM,08/27/2014 03:04:32 PM,OVERDUE,Closed,Case Closed CORR: Corrected,Rodent Activity,Inspectional Services,Environmental Services,Rodent Activity,ISD_Environmental Services (INTERNAL),ISD,,,36-38 Harrison Ave  Boston  MA  02111,4.0,1C,2.0,A1,Downtown / Financial District,4.0,Ward 3,0308,RC,36-38 Harrison Ave,2111.0,Address,69829.0,42.3518,-71.061,Constituent Call,"(42.3518, -71.061)",-7910474.335260814,5213823.921853131
714691,101001855878,07/11/2016 01:01:44 PM,07/25/2016 01:01:44 PM,07/12/2016 02:58:16 PM,ONTIME,Closed,Case Closed. Closed date : 2016-07-12 14:58:16.793 Case Noted Opinion recorded,Other: Comment,Mayor's 24 Hour Hotline,Employee & General Comments,General Comments For a Program or Policy,INFO_General Comments Complaints Compliments,INFO,,,,,,,,,,,,,,,,,42.3594,-71.0587,Constituent Call,"(0, 0)",-7910218.300431989,5214968.784796895
763420,101000955515,10/28/2013 01:58:58 PM,10/29/2013 01:58:58 PM,01/14/2014 08:18:48 AM,OVERDUE,Closed,Case Closed ROA: Refer to Other Agency/Division,Unsafe/Dangerous Conditions,Inspectional Services,Building,Unsafe Dangerous Conditions,ISD_Building (INTERNAL),ISD,,,569 Tremont St  Roxbury  MA  02118,4.0,1C,2.0,D4,South End,6.0,Ward 4,0401,CM,569 Tremont St,2118.0,Address,157437.0,42.3438,-71.0724,Constituent Call,"(42.3438, -71.0724)",-7911743.377455857,5212618.952509077
697853,101001716267,02/12/2016 05:49:00 PM,02/23/2016 08:30:00 AM,02/12/2016 07:30:51 PM,ONTIME,Closed,Case Closed. Closed date : 2016-02-12 19:30:51.887 Case Noted vendors were removed from area.,Illegal Vending,Public Works Department,Code Enforcement,Illegal Vending,PWDx_Code Enforcement,PWDx,,,14 Maverick St  East Boston  MA  02128,1.0,09,1.0,A7,East Boston,1.0,Ward 1,0103,C,14 Maverick St,2128.0,Address,156090.0,42.3694,-71.0398,Constituent Call,"(42.3694, -71.0398)",-7908114.362055996,5216475.394394417
407305,101000916314,09/02/2013 07:29:28 PM,,09/03/2013 08:23:59 AM,ONTIME,Closed,Case Closed Case Noted This is not a Park Dept. issue .,Parks General Request,Parks & Recreation Department,Administrative & General Requests,Parks General Request,PARK_Administration,PARK,,,341-341A E St  South Boston  MA  02127,6.0,05,2.0,C6,South Boston / South Boston Waterfront,5.0,Ward 6,0603,RL,341-341A E St,2127.0,Address,50630.0,42.3594,-71.0587,Constituent Call,"(0, 0)",-7910218.300431989,5214968.784796895
887046,101001094042,05/20/2014 05:53:19 PM,,,ONTIME,Open,,Animal Generic Request,Animal Control,Animal Issues,Animal Generic Request,INFO01_GenericeFormforOtherServiceRequestTypes,INFO,,,49-51 Creighton St  Jamaica Plain  MA  02130,9.0,10A,6.0,E13,Jamaica Plain,11.0,Ward 10,1006,CM,49-51 Creighton St,2130.0,Address,44179.0,42.3243,-71.1073,Constituent Call,"(42.3243, -71.1073)",-7915628.427684542,5209682.481922329
126826,101000296772,07/05/2011 01:29:32 PM,,07/05/2011 02:51:23 PM,ONTIME,Closed,Case Closed Case Resolved,Highway Maintenance,Public Works Department,Highway Maintenance,Highway Maintenance,PWDx_District 05: South Boston,PWDx,,,INTERSECTION of Seaport Blvd & Sleeper St  Boston  MA,6.0,05,2.0,C6,South Boston / South Boston Waterfront,5.0,Ward 6,0601,,INTERSECTION Seaport Blvd & Sleeper St,,Intersection,8312.0,42.3532,-71.0485,Constituent Call,"(42.3532, -71.0485)",-7909082.841625898,5214034.8072559135
601372,101001373057,05/08/2015 07:43:00 AM,06/17/2015 07:43:38 AM,07/09/2015 11:44:01 AM,OVERDUE,Closed,Case Closed. Closed date : 2015-07-09 11:44:01.563 Case Noted Traffic signal has been checked and is operating properly.,Requests for Traffic Signal Studies or Reviews,Transportation - Traffic Division,Traffic Management & Engineering,Requests for Traffic Signal Studies or Reviews,BTDT_Engineering_Request for Traffic Signal Study or Review,BTDT,,,INTERSECTION of Humboldt Ave & Martin Luther King Jr Blvd  Roxbury  MA,9.0,10B,7.0,B2,Roxbury,13.0,Ward 12,1205,,INTERSECTION Humboldt Ave & Martin Luther King Jr Blvd,,Intersection,6407.0,42.318999999999996,-71.086,Constituent Call,"(42.319, -71.086)",-7913257.322530645,5208884.521594755
741103,101001959505,11/28/2016 08:19:00 AM,,11/29/2016 04:31:28 PM,ONTIME,Closed,Case Closed. Closed date : 2016-11-29 16:31:28.06 Bulk Item Automation,Schedule a Bulk Item Pickup,Public Works Department,Sanitation,Schedule a Bulk Item Pickup,PWDx_Schedule a Bulk Item Pickup,PWDx,,,17 Whitman St  Dorchester  MA  02124,8.0,07,4.0,B3,Dorchester,9.0,Ward 17,1708,R2,17 Whitman St,2124.0,Address,149424.0,42.2868,-71.0772,Constituent Call,"(42.2868, -71.0772)",-7912277.711011664,5204037.980053368
444054,101001634370,11/13/2015 01:10:09 PM,11/16/2015 01:10:09 PM,11/16/2015 07:08:51 AM,ONTIME,Closed,Case Closed. Closed date : 2015-11-16 07:08:51.627 Case Noted Clear now.,Parking Enforcement,Transportation - Traffic Division,Enforcement & Abandoned Vehicles,Parking Enforcement,BTDT_Parking Enforcement,BTDT,,,175 Webster St  East Boston  MA  02128,1.0,09,1.0,A7,East Boston,1.0,Ward 1,0101,E,175 Webster St,2128.0,Address,146788.0,42.3656,-71.0349,Citizens Connect App,"(42.3656, -71.0349)",-7907568.896551108,5215902.854497209
408909,101000437036,06/15/2012 09:32:55 AM,12/12/2013 09:32:55 AM,07/26/2012 08:20:26 AM,ONTIME,Closed,Case Closed Case Noted Boston Parks & Recreation Tree Maintenance division is not responsible for weed maintenance on public sidewalks. Tree pit maintenance should be done by residents similar to the snow removal ordinance. The tree maintenance division is only responsible for the tree it self.,Tree Maintenance Requests,Parks & Recreation Department,Trees,Tree Maintenance Requests,PARK_Tree Maintenance Request,PARK,,,686A-686 Tremont St  Roxbury  MA  02118,4.0,1C,2.0,D4,South End,6.0,Ward 9,0901,R4,686A-686 Tremont St,2118.0,Address,170465.0,42.3409,-71.0768,Constituent Call,"(42.3409, -71.0768)",-7912233.183215348,5212182.1889872765
577814,101001157359,08/26/2014 08:57:38 AM,08/28/2014 08:57:37 AM,09/02/2014 11:25:31 AM,OVERDUE,Closed,Case Closed NOBASE: No Basis,Work w/out Permit,Inspectional Services,Building,Work w/out Permit,ISD_Building (INTERNAL),ISD,,,9 Glenellen Rd  West Roxbury  MA  02132,12.0,06,6.0,E5,West Roxbury,12.0,Ward 20,2016,R1,9 Glenellen Rd,2132.0,Address,64385.0,42.2703,-71.1633,Constituent Call,"(42.2703, -71.1633)",-7921862.319168966,5201555.463746601
379919,101001090123,05/15/2014 10:38:17 AM,,05/19/2014 03:39:57 PM,ONTIME,Closed,Case Closed Case Resolved TOOK PICTURE NOTHING WRONG WITH CB HERE 5/17,Roadway Repair,Public Works Department,Highway Maintenance,Roadway Repair,BWSC_All Cases,BWSC,,,23 Bilodeau Rd  Dorchester  MA  02121,7.0,03,4.0,B2,Roxbury,13.0,Ward 14,1403,R2,23 Bilodeau Rd,2121.0,Address,15502.0,42.3077,-71.0815,Constituent Call,"(42.3077, -71.0815)",-7912756.384822076,5207183.434327747
689855,101001623091,10/29/2015 08:30:26 AM,10/30/2015 08:30:00 AM,10/29/2015 09:23:44 AM,ONTIME,Closed,Case Closed. Closed date : 2015-10-29 09:23:44.943 Case Noted upon inspection  Trash serviced,Missed Trash: District 06,Public Works Department,Sanitation,Missed Trash/Recycling/Yard Waste/Bulk Item,PWDx_Missed Trash\Recycling\Yard Waste\Bulk Item,PWDx,,https://cityworker.cityofboston.gov:8443/attachments/report/563211a1d052cda8c3960d58/closed_photo/Report.jpg,36 Chisholm Rd  Roslindale  MA  02131,12.0,06,5.0,E5,Roslindale,10.0,Ward 18,1810,R1,36 Chisholm Rd,2131.0,Address,32276.0,42.2753,-71.1279,Self Service,"(42.2753, -71.1279)",-7917921.609194882,5202307.6727747675
424539,101000914918,08/31/2013 11:20:29 AM,09/04/2013 08:30:00 AM,11/12/2013 04:56:41 PM,OVERDUE,Closed,Case Closed VIOCOR: Violation Corrected,Overflowing or Un-kept Dumpster,Inspectional Services,Environmental Services,Overflowing or Un-kept Dumpster,ISD_Environmental Services (INTERNAL),ISD,,,51-53 Calumet St  Mission Hill  MA  02120,9.0,10A,8.0,B2,Mission Hill,14.0,Ward 10,1003,R3,51-53 Calumet St,2120.0,Address,24987.0,42.3321,-71.1054,Constituent Call,"(42.3321, -71.1054)",-7915416.920652036,5210856.96090464
680273,101001422781,07/03/2015 05:44:00 PM,07/07/2015 08:30:00 AM,07/09/2015 09:12:17 PM,OVERDUE,Closed,Case Closed. Closed date : 2015-07-09 21:12:17.473 Case Referred to External Agency Brookline; town notified,Request for Pothole Repair,Public Works Department,Highway Maintenance,Request for Pothole Repair,INFO_Reallocation From Dept,INFO,,,INTERSECTION of Huntington Ave & Jamaicaway  Jamaica Plain  MA,,,8.0,B2,Mission Hill,14.0,Ward 10,1004,,INTERSECTION Huntington Ave & Jamaicaway,,Intersection,6416.0,42.3319,-71.113,Citizens Connect App,"(42.3319, -71.113)",-7916262.948782063,5210826.844239633
123256,101001640580,11/22/2015 02:31:58 PM,11/24/2015 08:30:00 AM,11/23/2015 12:47:41 PM,ONTIME,Closed,Case Closed. Closed date : 2015-11-23 12:47:41.35 Case Resolved tv.pick up on.11/23/15,Missed Bulk Item Pickup: District 04,Public Works Department,Sanitation,Missed Trash/Recycling/Yard Waste/Bulk Item,PWDx_Missed Trash\Recycling\Yard Waste\Bulk Item,PWDx,,,31 Justin Rd  Brighton  MA  02135,11.0,04,9.0,D14,Allston / Brighton,15.0,Ward 22,2213,R2,31 Justin Rd,2135.0,Address,80433.0,42.3532,-71.1691,Self Service,"(42.3532, -71.1691)",-7922507.972215567,5214034.8072559135
449334,101001727742,03/01/2016 03:11:00 PM,,03/09/2016 04:30:51 PM,ONTIME,Closed,Case Closed. Closed date : 2016-03-09 16:30:51.983 Bulk Item Automation,Schedule a Bulk Item Pickup,Public Works Department,Sanitation,Schedule a Bulk Item Pickup,PWDx_Schedule a Bulk Item Pickup,PWDx,,,27 Peak Hill Rd  Roslindale  MA  02132,9.0,06,6.0,E5,West Roxbury,12.0,Ward 20,2006,R1,27 Peak Hill Rd,2132.0,Address,108773.0,42.2918,-71.1452,Constituent Call,"(42.2918, -71.1452)",-7919847.436385607,5204790.38608603
185738,101001794823,05/20/2016 08:43:51 AM,05/23/2016 08:43:51 AM,05/20/2016 10:32:13 AM,ONTIME,Closed,Case Closed. Closed date : 2016-05-20 10:32:13.867 Case Resolved Vehicle ticketed and put on tow list.,Parking Enforcement,Transportation - Traffic Division,Enforcement & Abandoned Vehicles,Parking Enforcement,BTDT_Parking Enforcement,BTDT,https://mayors24.cityofboston.gov/media/boston/report/photos/573f06830485cfb92d23cfc5/report.jpg,,INTERSECTION of Everett St & Elm St  Dorchester  MA,7.0,07,3.0,C11,Dorchester,7.0,16,1602,,INTERSECTION Everett St & Elm St,,Intersection,10551.0,42.3594,-71.0587,Citizens Connect App,"(0, 0)",-7910218.300431989,5214968.784796895
6276,101001501791,08/02/2015 08:55:00 PM,08/17/2015 08:30:00 AM,08/05/2015 04:33:00 PM,ONTIME,Closed,Case Closed. Closed date : 2015-08-05 16:33:00.383 Case Resolved replaced button eye with direction photo eye. jmc/vm,PRINTED,Public Works Department,Street Lights,Street Light Outages,PWDx_Street Light Outages,PWDx,,,INTERSECTION of E Brookline St & W Brookline St  Roxbury  MA,4.0,1C,2.0,D4,South End,6.0,Ward 8,0802,,INTERSECTION E Brookline St & W Brookline St,,Intersection,2077.0,42.3396,-71.0725,Citizens Connect App,"(42.3396, -71.0725)",-7911754.509404937,5211986.4049821645
793114,101001061325,04/04/2014 04:38:42 PM,05/05/2014 04:38:41 PM,04/28/2014 09:37:12 AM,ONTIME,Closed,Case Closed Case Resolved not at location 4/25.,Abandoned Vehicles,Transportation - Traffic Division,Enforcement & Abandoned Vehicles,Abandoned Vehicles,BTDT_AVRS Interface Queue,BTDT,,,26 S Walter St  Roslindale  MA  02131,9.0,06,5.0,E5,Roslindale,10.0,Ward 20,2004,R2,26 S Walter St,2131.0,Address,142334.0,42.2877,-71.1337,Constituent Call,"(42.2877, -71.1337)",-7918567.262241485,5204173.408731778
217402,101001297326,02/16/2015 09:01:59 AM,02/19/2015 08:30:00 AM,04/14/2015 10:48:30 AM,OVERDUE,Closed,Case Closed Case Noted,Request for Snow Plowing,Public Works Department,Street Cleaning,Request for Snow Plowing,PWDx_District 07: South Dorchester,PWDx,,,16 Saco St  Dorchester  MA  02122,7.0,07,3.0,C11,Dorchester,7.0,Ward 16,1602,CM,16 Saco St,2122.0,Address,120414.0,42.2974,-71.0552,Constituent Call,"(42.2974, -71.0552)",-7909828.682214212,5205633.15175601
558717,101001691574,01/11/2016 06:17:00 PM,01/12/2016 06:17:10 PM,01/13/2016 12:43:58 PM,OVERDUE,Closed,Case Closed. Closed date : 2016-01-13 12:43:58.407 Case Referred to External Agency MassDOT,Traffic Signal Inspection,Transportation - Traffic Division,Signs & Signals,Traffic Signal Inspection,INFO01_GenericeFormforOtherServiceRequestTypes,INFO,,,764 Morton St  Dorchester  MA  02124,8.0,07,4.0,B3,Greater Mattapan,9.0,Ward 14,1405,A,764 Morton St,2124.0,Address,97789.0,42.2834,-71.0888,Constituent Call,"(42.2834, -71.0888)",-7913569.017104867,5203526.37806176
649065,101001614298,10/16/2015 10:38:00 PM,10/20/2015 08:30:00 AM,10/17/2015 01:32:08 AM,ONTIME,Closed,Case Closed. Closed date : 2015-10-17 01:32:08.167 Case Resolved empty belly,Empty Litter Basket,Public Works Department,Highway Maintenance,Empty Litter Basket,PWDx_District 10A: Roxbury,PWDx,,,INTERSECTION of Fenway & Louis Prang St  Boston  MA,4.0,10A,8.0,B2,Fenway / Kenmore / Audubon Circle / Longwood,14.0,Ward 4,0410,,INTERSECTION Fenway & Louis Prang St,,Intersection,4871.0,42.3387,-71.0979,Citizens Connect App,"(42.3387, -71.0979)",-7914582.024471085,5211850.864580528
411602,101000756925,02/09/2013 06:23:24 PM,02/13/2013 08:30:00 AM,02/20/2013 03:07:52 PM,OVERDUE,Closed,Case Closed Case Noted  Thank you for contacting us.  The district yard did receive your response when submitted.  We apologize for the lateness of this response.,Request for Snow Plowing,Public Works Department,Street Cleaning,Request for Snow Plowing,PWDx_District 07: South Dorchester,PWDx,,,127 King St  Dorchester  MA  02122,8.0,07,3.0,C11,Dorchester,7.0,Ward 16,1605,R3,127 King St,2122.0,Address,81786.0,42.2937,-71.054,Constituent Call,"(42.2937, -71.054)",-7909695.09882526,5205076.316039093
500978,101000764994,02/10/2013 11:01:00 AM,02/13/2013 08:30:00 AM,02/10/2013 05:20:50 PM,ONTIME,Closed,Case Closed Case Resolved  Street has been plowed.,Request for Snow Plowing,Public Works Department,Street Cleaning,Request for Snow Plowing,PWDx_District 04: Allston/Brighton,PWDx,,,16 Shanley St  Brighton  MA  02135,11.0,04,9.0,D14,Allston / Brighton,15.0,Ward 22,2210,R4,16 Shanley St,2135.0,Address,309595.0,42.3484,-71.158,Self Service,"(42.3484, -71.158)",-7921272.325867761,5213311.791144463
18960,101000498723,10/29/2012 02:59:19 PM,10/30/2012 02:59:18 PM,10/29/2012 03:04:59 PM,ONTIME,Closed,Case Closed Duplicate of Existing Case duplicate of case # 498685,Tree Emergencies,Parks & Recreation Department,Trees,Tree Emergencies,PARK_Tree Emergencies,PARK,,,190 Bremen St  East Boston  MA  02128,1.0,09,1.0,A7,East Boston,1.0,Ward 1,0105,R3,190 Bremen St,2128.0,Address,19804.0,42.3731,-71.0342,Constituent Call,"(42.3731, -71.0342)",-7907490.972907553,5217032.9007342355
722735,101000431455,06/03/2012 02:01:33 PM,07/02/2012 02:01:32 PM,06/07/2012 11:46:43 AM,ONTIME,Closed,Case Closed Case Resolved  not at location 6/7.,Abandoned Vehicles,Transportation - Traffic Division,Enforcement & Abandoned Vehicles,Abandoned Vehicles,BTDT_AVRS Interface Queue,BTDT,,,39 Pilgrim Rd  Boston  MA  02215,9.0,10A,8.0,B2,Boston,14.0,04,0410,,39 Pilgrim Rd,2215.0,Address,168758.0,42.3425,-71.1054,Constituent Call,"(42.3425, -71.1054)",-7915416.920652036,5212423.159473596
803138,101000766911,02/10/2013 01:19:39 PM,02/13/2013 08:30:00 AM,02/20/2013 12:03:53 PM,OVERDUE,Closed,Case Closed Case Noted,Request for Snow Plowing,Public Works Department,Street Cleaning,Request for Snow Plowing,PWDx_District 02: Jamaica Plain,PWDx,,,36 Robinwood Ave  Jamaica Plain  MA  02130,9.0,02,6.0,E13,Jamaica Plain,11.0,Ward 19,1904,CD,36 Robinwood Ave,2130.0,Address,117441.0,42.3164,-71.1117,Self Service,"(42.3164, -71.1117)",-7916118.233444031,5208493.093931247
357550,101000419040,05/08/2012 11:01:01 PM,,05/09/2012 05:49:07 AM,ONTIME,Closed,Case Closed Duplicate of Existing Case,Schedule a Bulk Item Pickup,Public Works Department,Sanitation,Schedule a Bulk Item Pickup,PWDx_Schedule a Bulk Item Pickup,PWDx,,,75 Bradfield Ave  Roslindale  MA  02131,9.0,06,6.0,E5,Roslindale,10.0,Ward 20,2007,R3,75 Bradfield Ave,2131.0,Address,194916.0,42.2901,-71.1405,Self Service,"(42.2901, -71.1405)",-7919324.234778879,5204534.561333866
906077,101001989708,01/16/2017 04:02:00 PM,01/31/2017 08:30:00 AM,01/18/2017 10:00:52 AM,ONTIME,Closed,Case Closed. Closed date : 2017-01-18 10:00:52.59 Case Noted Timing adjustments have been made.,Street Light Outages,Public Works Department,Street Lights,Street Light Outages,BTDT_Engineering_Request for Traffic Signal Study or Review,BTDT,,,INTERSECTION of Warren St & Chelsea St  Charlestown  MA,3.0,1A,1.0,A15,Charlestown,2.0,2,0201,,INTERSECTION Warren St & Chelsea St,,Intersection,17665.0,42.3594,-71.0587,Citizens Connect App,"(0, 0)",-7910218.300431989,5214968.784796895
44619,101000451701,07/18/2012 05:07:48 PM,,07/19/2012 09:48:22 AM,ONTIME,Closed,Case Closed Case Noted,Notification,Mayor's 24 Hour Hotline,Notification,Notification,INFO09_Current Events,INFO,,,34 Averton St  Roslindale  MA  02131,12.0,06,5.0,E5,Roslindale,10.0,Ward 20,2009,R3,34 Averton St,2131.0,Address,6867.0,42.2815,-71.1359,Constituent Call,"(42.2815, -71.1359)",-7918812.16512123,5203240.494856145
501130,101001229017,12/05/2014 06:19:55 PM,04/04/2015 06:19:55 PM,,OVERDUE,Open,,Unsatisfactory Living Conditions,Inspectional Services,Housing,Unsatisfactory Living Conditions,ISD_Housing (INTERNAL),ISD,,,47 E Springfield St  Roxbury  MA  02118,4.0,1C,2.0,D4,South End,6.0,Ward 8,0802,R4,47 E Springfield St,2118.0,Address,313523.0,42.3357,-71.0751,Constituent Call,"(42.3357, -71.0751)",-7912043.940080999,5211399.077251736
668613,101001074169,04/23/2014 05:16:01 PM,04/25/2014 08:30:00 AM,04/24/2014 09:05:41 AM,ONTIME,Closed,Case Closed Case Resolved done tree crew,Tree Emergencies,Parks & Recreation Department,Trees,Tree Emergencies,PARK_Tree Emergencies,PARK,,,63 Crosstown Ave  West Roxbury  MA  02132,12.0,06,6.0,E5,West Roxbury,12.0,Ward 20,2015.0,R1,63 Crosstown Ave,2132.0,Address,44585.0,42.2617,-71.1666,Constituent Call,"(42.2617, -71.1666)",-7922229.673488583,5200261.80377952
680841,101001275970,02/04/2015 05:53:10 PM,02/20/2015 08:30:00 AM,04/14/2015 08:48:16 AM,OVERDUE,Closed,Case Closed Case Noted,PublicWorks: Complaint,Mayor's 24 Hour Hotline,Employee & General Comments,General Comments For a Program or Policy,PWDx_District 1A: Charlestown,PWDx,,,,,,,,,,,,,,,,,42.3594,-71.0587,Constituent Call,"(0, 0)",-7910218.300431989,5214968.784796895
469300,101001871542,07/30/2016 08:31:00 AM,08/08/2016 08:30:00 AM,07/31/2016 11:59:04 AM,ONTIME,Closed,Case Closed. Closed date : 2016-07-31 11:59:04.857 Case Noted no violation found,Illegal Vending,Public Works Department,Code Enforcement,Illegal Vending,PWDx_Code Enforcement,PWDx,,https://cityworker.cityofboston.gov:8443/attachments/report/579c9e7f70b477fe9e36dd2f/closed_photo/Report.jpg,685 Tremont St  Roxbury  MA  02118,4.0,1C,7.0,D4,Roxbury,6.0,04,0404,,685 Tremont St,2118.0,Address,342641.0,42.3414,-71.077,Constituent Call,"(42.3414, -71.077)",-7912255.447113506,5212257.49160554
449338,101000386581,02/21/2012 04:56:32 PM,02/23/2012 04:56:32 PM,02/22/2012 07:25:31 AM,ONTIME,Closed,Case Closed Case Invalid went out to that location and did not finde a pothole or a depression,Request for Pothole Repair,Public Works Department,Highway Maintenance,Request for Pothole Repair,PWDx_District 10B: Roxbury,PWDx,,,INTERSECTION of Warren St & Townsend St  Boston  MA,9.0,10B,7.0,B2,Roxbury,13.0,Ward 12,1206,,INTERSECTION Warren St & Townsend St,,Intersection,5938.0,42.3164,-71.0829,Citizens Connect App,"(42.3164, -71.0829)",-7912912.232109185,5208493.093931247
554631,101001280641,02/06/2015 03:10:55 PM,02/23/2015 03:10:55 PM,02/08/2015 01:55:07 AM,ONTIME,Closed,Case Closed Case Noted,PublicWorks: Complaint,Mayor's 24 Hour Hotline,Employee & General Comments,General Comments For a Program or Policy,PWDx_General Comments,PWDx,,,,,,,,,,,,,,,,,42.3594,-71.0587,Constituent Call,"(0, 0)",-7910218.300431989,5214968.784796895
1983,101000459058,08/02/2012 07:56:37 AM,08/06/2012 07:56:36 AM,08/02/2012 08:39:31 AM,ONTIME,Closed,Case Closed Case Noted sent inspection and found nothing out of place other than it is trash day and will monitor the situation,Requests for Street Cleaning,Public Works Department,Street Cleaning,Requests for Street Cleaning,PWDx_District 1C: Downtown,PWDx,,,INTERSECTION of Berkeley St & Public Alley No. 420  Boston  MA,4.0,1C,8.0,D4,Back Bay,14.0,Ward 5,0506,,INTERSECTION Berkeley St & Public Alley No. 420,,Intersection,1346.0,42.3544,-71.0746,Constituent Call,"(42.3544, -71.0746)",-7911988.280335601,5214215.56991147
893371,101001975113,12/22/2016 11:41:00 AM,01/09/2017 11:41:44 AM,12/28/2016 07:21:02 AM,ONTIME,Closed,Case Closed. Closed date : 2016-12-28 07:21:02.743 Case Resolved,Sign Repair,Transportation - Traffic Division,Signs & Signals,Sign Repair,BTDT_Sign Shop_Sign Installation,BTDT,,,INTERSECTION of Winter St & Tremont St  Boston  MA,3.0,1C,2.0,A1,Beacon Hill,14.0,5,0503,,INTERSECTION Winter St & Tremont St,,Intersection,14982.0,42.3594,-71.0587,City Worker App,"(0, 0)",-7910218.300431989,5214968.784796895
300735,101000432588,06/05/2012 05:52:28 PM,06/08/2012 08:30:00 AM,06/06/2012 09:55:02 AM,ONTIME,Closed,Case Closed Case Resolved pick up and clean up debris in area,Requests for Street Cleaning,Public Works Department,Street Cleaning,Requests for Street Cleaning,PWDx_District 03: North Dorchester,PWDx,,,6 Arcadia St  Dorchester  MA  02122,7.0,03,3.0,C11,Dorchester,8.0,Ward 15,1508,R3,6 Arcadia St,2122.0,Address,4539.0,42.3018,-71.0605,Constituent Call,"(42.3018, -71.0605)",-7910418.675515416,5206295.377359654
803643,101001427614,07/12/2015 10:35:42 AM,,07/14/2015 04:43:30 PM,ONTIME,Closed,Case Closed. Closed date : 2015-07-14 16:43:30.847 Bulk Item Automation,Schedule Bulk Item Pickup,Public Works Department,Sanitation,Schedule a Bulk Item Pickup SS,PWDx_Schedule a Bulk Item Pickup,PWDx,,,52 Como Rd  Hyde Park  MA  02136,12.0,08,5.0,E18,Hyde Park,10.0,Ward 18,1820,R1,52 Como Rd,2136.0,Address,41524.0,42.2406,-71.1396,Self Service,"(42.2406, -71.1396)",-7919224.047237164,5197088.571420323
223844,101001437857,07/27/2015 04:32:00 PM,,07/27/2015 04:33:11 PM,ONTIME,Closed,Case Closed. Closed date : 2015-07-27 16:33:11.317 Case Invalid,Schedule a Bulk Item Pickup,Public Works Department,Sanitation,Schedule a Bulk Item Pickup,PWDx_Schedule a Bulk Item Pickup,PWDx,,,38 Windham Rd  Hyde Park  MA  02136,12.0,08,5.0,E18,Hyde Park,10.0,Ward 18,1822,R1,38 Windham Rd,2136.0,Address,150673.0,42.2712,-71.1255,Constituent Call,"(42.2712, -71.1255)",-7917654.44241698,5201690.856967906
276274,101001189082,10/04/2014 02:25:22 PM,10/08/2014 08:30:00 AM,10/06/2014 09:56:57 AM,ONTIME,Closed,Case Closed Case Resolved filled by c lnch,Request for Pothole Repair,Public Works Department,Highway Maintenance,Request for Pothole Repair,PWDx_District 05: South Boston,PWDx,https://cityworker.cityofboston.gov:8443/attachments/report/54303b8ed052f1b1cd5b5e91/photo/Report.jpg,,INTERSECTION of Emerson St & E Fourth St  South Boston  MA,6.0,05,2.0,C6,South Boston / South Boston Waterfront,5.0,Ward 6,0606,,INTERSECTION Emerson St & E Fourth St,,Intersection,4569.0,42.3347,-71.0372,City Worker App,"(42.3347, -71.0372)",-7907824.931379934,5211248.486264818
513166,101001955650,11/20/2016 12:01:01 PM,11/22/2016 08:30:00 AM,11/21/2016 01:15:52 AM,ONTIME,Closed,Case Closed. Closed date : 2016-11-21 01:15:52.653 Case Resolved vehicle tagged and called bpd 911 for a tow,Parking Enforcement,Transportation - Traffic Division,Enforcement & Abandoned Vehicles,Parking Enforcement,BTDT_Parking Enforcement,BTDT,,,11 Edwin St  Dorchester  MA  02124,8.0,07,3.0,C11,Dorchester,7.0,Ward 16,1606,R2,11 Edwin St,2124.0,Address,228413.0,42.2888,-71.0625,Citizens Connect App,"(42.2888, -71.0625)",-7910641.314497003,5204338.935299684
163317,101000318144,08/24/2011 07:20:45 AM,08/26/2011 07:20:45 AM,08/24/2011 10:19:34 AM,ONTIME,Closed,Case Closed Case Resolved  all set  am,Missed Trash: District 05,Public Works Department,Sanitation,Missed Trash/Recycling/Yard Waste/Bulk Item,PWDx_Missed Trash\Recycling\Yard Waste\Bulk Item,PWDx,,,670 E Eighth St  South Boston  MA  02127,6.0,05,2.0,C6,South Boston / South Boston Waterfront,5.0,Ward 7,0701,R3,670 E Eighth St,2127.0,Address,52375.0,42.3316,-71.0345,Self Service,"(42.3316, -71.0345)",-7907524.36875479,5210781.669421678
637770,101000884840,07/22/2013 04:28:53 PM,07/23/2013 04:28:51 PM,07/22/2013 08:48:08 PM,ONTIME,Closed,Case Closed Case Resolved done tree crew,Tree Emergencies,Parks & Recreation Department,Trees,Tree Emergencies,PARK_Tree Emergencies,PARK,,,5 Metcalf St  Roslindale  MA  02131,12.0,06,5.0,E5,Roslindale,10.0,Ward 20,2002,R1,5 Metcalf St,2131.0,Address,94752.0,42.2857,-71.1355,Constituent Call,"(42.2857, -71.1355)",-7918767.637324912,5203872.458740576
311792,101000347883,10/27/2011 04:47:53 PM,11/26/2011 04:47:53 PM,10/28/2011 10:00:22 AM,ONTIME,Closed,Case Closed ADCLSD: Administratively Closed,No Utilities Residential - Gas,Inspectional Services,Housing,No Utilities Residential - Gas,ISD_Housing (INTERNAL),ISD,,,30 Ridgewood St  Dorchester  MA  02122,7.0,03,3.0,C11,Dorchester,8.0,Ward 15,1507,R3,30 Ridgewood St,2122.0,Address,116007.0,42.3021,-71.0664,Constituent Call,"(42.3021, -71.0664)",-7911075.460511098,5206340.530790513
67352,101000851518,06/03/2013 08:43:37 AM,06/05/2013 08:43:37 AM,06/03/2013 10:27:04 AM,ONTIME,Closed,Case Closed Case Resolved Vehicle ticketed.,Parking Enforcement,Transportation - Traffic Division,Enforcement & Abandoned Vehicles,Parking Enforcement,BTDT_Parking Enforcement,BTDT,,,40 Saint John St  Jamaica Plain  MA  02130,9.0,02,6.0,E13,Jamaica Plain,11.0,Ward 19,1905,R2,40 Saint John St,2130.0,Address,121244.0,42.3138,-71.1115,Constituent Call,"(42.3138, -71.1115)",-7916095.969545874,5208101.68243926
606445,101000442518,06/28/2012 09:30:47 AM,,06/29/2012 09:48:05 PM,ONTIME,Closed,Case Closed Bulk Item Automation,Schedule a Bulk Item Pickup,Public Works Department,Sanitation,Schedule a Bulk Item Pickup,PWDx_Schedule a Bulk Item Pickup,PWDx,,,364 Columbus Ave  Boston  MA  02116,4.0,1C,2.0,D4,South End,6.0,Ward 4,0401,R4,364 Columbus Ave,2116.0,Address,211829.0,42.3453,-71.0756,Self Service,"(42.3453, -71.0756)",-7912099.599826395,5212844.872580751
256935,101000868027,06/26/2013 01:05:54 PM,12/23/2014 01:05:36 PM,09/27/2013 01:35:18 PM,ONTIME,Closed,Case Closed Case Resolved The tree was pruned by Northern Tree Service  to the City of Boston tree pruning specifications.,Tree Maintenance Requests,Parks & Recreation Department,Trees,Tree Maintenance Requests,PARK_Tree Maintenance Request,PARK,,,242 Everett St  East Boston  MA  02128,1.0,09,1.0,A7,East Boston,1.0,Ward 1,0101,R1,242 Everett St,2128.0,Address,55122.0,42.3656,-71.03,Constituent Call,"(42.3656, -71.03)",-7907023.431046221,5215902.854497209
660547,101001727236,03/01/2016 08:46:00 AM,03/15/2016 08:46:08 AM,03/03/2016 01:06:16 PM,ONTIME,Closed,Case Closed. Closed date : 2016-03-03 13:06:16.367 Case Resolved,Sign Repair,Transportation - Traffic Division,Signs & Signals,Sign Repair,BTDT_Sign Shop_Sign Installation,BTDT,,,INTERSECTION of Ashton St & Livingstone St  Dorchester  MA,8.0,07,4.0,B3,Greater Mattapan,9.0,14,1412.0,,INTERSECTION Ashton St & Livingstone St,,Intersection,9030.0,42.3594,-71.0587,Twitter,"(0, 0)",-7910218.300431989,5214968.784796895
735449,101001718913,02/17/2016 01:09:19 PM,03/02/2016 01:09:19 PM,,OVERDUE,Open,,Other: Comment,Mayor's 24 Hour Hotline,Employee & General Comments,General Comments For a Program or Policy,INFO_General Comments Complaints Compliments,INFO,,,,,,,,,,,,,,,,,42.3594,-71.0587,Constituent Call,"(0, 0)",-7910218.300431989,5214968.784796895
549776,101000379718,02/01/2012 09:00:43 AM,,02/01/2012 09:00:44 AM,ONTIME,Closed,Case Closed Internal Case Performed by Highway Maintenance crew.,Pothole Repair (Internal),Public Works Department,Highway Maintenance,Pothole Repair (Internal),PWDx_District 1C: Downtown,PWDx,,,293-295 Commonwealth Ave  Boston  MA  02115,4.0,1C,8.0,D4,Back Bay,14.0,Ward 5,0509,CM,293-295 Commonwealth Ave,2115.0,Address,40003.0,42.3503,-71.0855,Employee Generated,"(42.3503, -71.0855)",-7913201.662785248,5213597.978419791
719774,101001759741,04/03/2016 07:46:30 AM,04/05/2016 08:30:00 AM,04/03/2016 03:16:36 PM,ONTIME,Closed,Case Closed. Closed date : 2016-04-03 15:16:36.843 Case Resolved Barrel emptied,CE Collection,Public Works Department,Street Cleaning,CE Collection,PWDx_District 1B: North End,PWDx,https://cityworker.cityofboston.gov:8443/attachments/report/57010296d052d8b24256bc28/photo/Report.jpg,https://cityworker.cityofboston.gov:8443/attachments/report/57010296d052d8b24256bc28/closed_photo/Report.jpg,INTERSECTION of Causeway St & Interstate 93 N  Boston  MA,3.0,1B,1.0,A1,Downtown / Financial District,3.0,3,0305,,INTERSECTION Causeway St & Interstate 93 N,,Intersection,16468.0,42.3594,-71.0587,City Worker App,"(0, 0)",-7910218.300431989,5214968.784796895
777488,101001205916,10/28/2014 09:11:54 AM,10/30/2014 09:11:54 AM,10/28/2014 09:47:51 AM,ONTIME,Closed,Case Closed Case Noted Trash picked up at 9:47 a.m. on 10/28/14.,Missed Trash: District 1B,Public Works Department,Sanitation,Missed Trash/Recycling/Yard Waste/Bulk Item,PWDx_Missed Trash\Recycling\Yard Waste\Bulk Item,PWDx,,,53 Chestnut St  Boston  MA  02108,3.0,1B,8.0,A1,Beacon Hill,14.0,Ward 5,0503,R1,53 Chestnut St,2108.0,Address,31436.0,42.3574,-71.0689,Constituent Call,"(42.3574, -71.0689)",-7911353.759238079,5214667.491651126
328434,101000735154,01/11/2013 07:35:39 AM,01/15/2013 08:30:00 AM,01/11/2013 07:35:43 AM,ONTIME,Closed,Case Closed,Requests for Street Cleaning,Public Works Department,Street Cleaning,Requests for Street Cleaning,PWDx_District 10B: Roxbury,PWDx,,,74 Perrin St  Roxbury  MA  02119,7.0,10B,7.0,B2,Roxbury,13.0,Ward 12,1204,R2,74 Perrin St,2119.0,Address,109598.0,42.3211,-71.0798,City Worker App,"(42.3211, -71.0798)",-7912567.141687727,5209200.686514744
154344,101001901013,09/06/2016 09:24:52 AM,01/04/2017 09:24:52 AM,09/06/2016 09:25:10 AM,ONTIME,Closed,Case Closed. Closed date : 2016-09-06 09:25:10.003 :,Unsatisfactory Living Conditions,Inspectional Services,Housing,Unsatisfactory Living Conditions,ISD_Housing (INTERNAL),ISD,,,27 Lorne St  Dorchester  MA  02124,8.0,07,4.0,B3,Greater Mattapan,9.0,Ward 14,1409,R3,27 Lorne St,2124.0,Address,266407.0,42.2938,-71.0905,Constituent Call,"(42.2938, -71.0905)",-7913758.260239216,5205091.365222931
450995,101001292640,02/13/2015 07:48:34 AM,02/18/2015 08:30:00 AM,02/17/2015 06:17:22 AM,ONTIME,Closed,Case Closed Case Noted,Request for Snow Plowing,Public Works Department,Street Cleaning,Request for Snow Plowing,PWDx_District 07: South Dorchester,PWDx,,,17 Hill Top St  Dorchester  MA  02124,8.0,07,3.0,C11,Dorchester,7.0,Ward 16,1612,R1,17 Hill Top St,2124.0,Address,73967.0,42.2807,-71.04899999999999,Constituent Call,"(42.2807, -71.049)",-7909138.501371293,5203120.125559173
626232,101001173654,09/16/2014 01:17:41 PM,09/18/2014 01:17:41 PM,09/19/2014 10:27:54 AM,OVERDUE,Closed,Case Closed ROA: Refer to Other Agency/Division,Work w/out Permit,Inspectional Services,Building,Work w/out Permit,ISD_Building (INTERNAL),ISD,,,49-51 Litchfield St  Brighton  MA  02135,11.0,04,9.0,D14,Allston / Brighton,15.0,Ward 22,2205,CM,49-51 Litchfield St,2135.0,Address,86725.0,42.3598,-71.1407,Constituent Call,"(42.3598, -71.1407)",-7919346.498677037,5215029.0445768135
627274,101001698952,01/22/2016 06:48:29 PM,01/26/2016 08:30:00 AM,01/22/2016 09:24:28 PM,ONTIME,Closed,Case Closed. Closed date : 2016-01-22 21:24:28.393 Case Resolved everything is in compliance at this location at this time.,Parking Enforcement,Transportation - Traffic Division,Enforcement & Abandoned Vehicles,Parking Enforcement,BTDT_Parking Enforcement,BTDT,https://mayors24.cityofboston.gov/media/boston/report/photos/56a2bfcb048563580b31670f/report.jpg,,24-26 Armington St  Allston  MA  02134,11.0,04,9.0,D14,Allston / Brighton,15.0,Ward 21,2106,R4,24-26 Armington St,2134.0,Address,4999.0,42.3524,-71.137,Citizens Connect App,"(42.3524, -71.137)",-7918934.616561102,5213914.300736275
713768,101000965403,11/14/2013 11:22:21 AM,03/14/2014 11:22:21 AM,05/23/2014 02:23:30 PM,OVERDUE,Closed,Case Closed VIOCOR: Violation Corrected,Unsatisfactory Living Conditions,Inspectional Services,Housing,Unsatisfactory Living Conditions,ISD_Housing (INTERNAL),ISD,,,24 Richfield St  Dorchester  MA  02125,7.0,03,3.0,C11,Dorchester,8.0,Ward 15,1501,R2,24 Richfield St,2125.0,Address,298270.0,42.3082,-71.0714,Constituent Call,"(42.3082, -71.0714)",-7911632.057965063,5207258.6972183725
915863,101002003520,02/06/2017 08:54:00 AM,02/13/2017 08:54:09 AM,02/06/2017 03:05:20 PM,ONTIME,Closed,Case Closed. Closed date : 2017-02-06 15:05:20.813 ADCLSD: Administratively Closed,Plumbing,Inspectional Services,Building,Plumbing,ISD_Building (INTERNAL),ISD,,,982-984 Hyde Park Ave  Hyde Park  MA  02136,12.0,08,5.0,E18,Hyde Park,10.0,Ward 18,1814,RC,982-984 Hyde Park Ave,2136.0,Address,166486.0,42.2662,-71.1208,Constituent Call,"(42.2662, -71.1208)",-7917131.240810251,5200938.696866695
650102,101001958913,11/26/2016 02:35:24 PM,11/29/2016 08:30:00 AM,11/26/2016 08:26:03 PM,ONTIME,Closed,Case Closed. Closed date : 2016-11-26 20:26:03.16 Case Noted Upon arrival no dead animal was found,Pick up Dead Animal,Public Works Department,Street Cleaning,Pick up Dead Animal,PWDx_District 05: South Boston,PWDx,,https://cityworker.cityofboston.gov:8443/attachments/report/5839e445d0521e12073af3ed/closed_photo/Report.jpg,647B Summer St  Boston  MA  02210,6.0,05,2.0,C6,South Boston / South Boston Waterfront,5.0,Ward 6,0604,I,647B Summer St,2210.0,Address,132037.0,42.3406,-71.042,Citizens Connect App,"(42.3406, -71.042)",-7908359.264935741,5212137.007703746
458083,101001256999,01/28/2015 08:34:44 AM,,03/27/2015 08:42:21 AM,ONTIME,Closed,Case Closed Case Resolved completed,Misc. Snow Complaint,Public Works Department,Administrative & General Requests,Misc. Snow Complaint,PWDx_District 1C: Downtown,PWDx,,https://cityworker.cityofboston.gov:8443/attachments/report/54c8e579d0527116877cd65e/closed_photo/Report.jpg,167 W Newton St  Roxbury  MA  02118,4.0,1C,2.0,D4,South End,6.0,Ward 4,0403,R2,167 W Newton St,2118.0,Address,102438.0,42.3429,-71.0778,Constituent Call,"(42.3429, -71.0778)",-7912344.502706139,5212483.403053326
38119,101001758317,03/31/2016 06:29:41 PM,04/04/2016 08:30:00 AM,04/01/2016 02:22:06 AM,ONTIME,Closed,Case Closed. Closed date : 2016-04-01 02:22:06.753 Case Resolved area checked all clear,Parking Enforcement,Transportation - Traffic Division,Enforcement & Abandoned Vehicles,Parking Enforcement,BTDT_Parking Enforcement,BTDT,https://mayors24.cityofboston.gov/media/boston/report/photos/56fda4d10485e8a9393e0853/report.jpg,,20 Jamaicaway  Jamaica Plain  MA  02130,9.0,10A,8.0,E13,Mission Hill,11.0,Ward 10,1008,CM,20 Jamaicaway,2130.0,Address,79389.0,42.331,-71.1124,Citizens Connect App,"(42.331, -71.1124)",-7916196.157087586,5210691.320432174
725929,101001014476,01/29/2014 03:09:27 PM,,01/30/2014 09:35:41 AM,ONTIME,Closed,Case Closed Case Resolved Completed survey submitted by Martha Abrams.,Metrolist Survey,Civil Rights,Survey,Metrolist Survey,HS_OCR Metrolist Survey,HS_O,,,,,,,,,,,,,,,,,42.3594,-71.0587,Employee Generated,"(0, 0)",-7910218.300431989,5214968.784796895
157191,101000923932,09/11/2013 10:23:54 AM,01/09/2014 10:23:54 AM,11/07/2013 10:46:41 AM,ONTIME,Closed,Case Closed VIOCOR: Violation Corrected,Unsatisfactory Living Conditions,Inspectional Services,Housing,Unsatisfactory Living Conditions,ISD_Housing (INTERNAL),ISD,,,495 Columbia Rd  Dorchester  MA  02125,7.0,03,3.0,C11,Dorchester,8.0,Ward 15,1501,R3,495 Columbia Rd,2125.0,Address,211033.0,42.3144,-71.0671,Constituent Call,"(42.3144, -71.0671)",-7911153.384154652,5208192.00673295
772545,101000959521,11/04/2013 09:52:07 AM,11/18/2013 09:52:07 AM,11/04/2013 09:52:18 AM,ONTIME,Closed,Case Closed Case Resolved Created Request for Recycling Bin,Recycling Cart Return,Public Works Department,Recycling,Recycling Cart Return,PWDx_Recycling,PWDx,,,103 Saint Rose St  Jamaica Plain  MA  02130,9.0,02,6.0,E13,Jamaica Plain,11.0,Ward 11,1109,R2,103 Saint Rose St,2130.0,Address,121497.0,42.305,-71.1185,City Worker App,"(42.305, -71.1185)",-7916875.205981427,5206777.02504787
609740,101000804816,03/15/2013 10:06:10 AM,,03/20/2013 09:44:03 PM,ONTIME,Closed,Case Closed Bulk Item Automation,Schedule a Bulk Item Pickup,Public Works Department,Sanitation,Schedule a Bulk Item Pickup,PWDx_Schedule a Bulk Item Pickup,PWDx,,,459 Columbia Rd  Dorchester  MA  02125,7.0,03,3.0,C11,Dorchester,8.0,Ward 15,1501,CM,459 Columbia Rd,2125.0,Address,35257.0,42.3131,-71.0678,Constituent Call,"(42.3131, -71.0678)",-7911231.307798209,5207996.3051849445
708335,101000383921,02/13/2012 01:21:31 PM,02/14/2012 01:21:30 PM,05/02/2012 02:47:22 PM,OVERDUE,Closed,Case Closed ADCLSD: Administratively Closed,Unsafe/Dangerous Conditions,Inspectional Services,Building,Unsafe Dangerous Conditions,ISD_Building (INTERNAL),ISD,,,65 Gardner St  Allston  MA  02134,11.0,04,9.0,D14,Allston / Brighton,14.0,Ward 21,2103,R2,65 Gardner St,2134.0,Address,62621.0,42.3535,-71.1279,Constituent Call,"(42.3535, -71.1279)",-7917921.609194882,5214079.997596236
567982,101001014434,01/29/2014 02:12:27 PM,04/29/2014 02:12:27 PM,,OVERDUE,Open,,Maintenance Complaint - Residential,Inspectional Services,Housing,Maintenance Complaint - Residential,ISD_Housing (INTERNAL),ISD,,,35 Waverly St  Brighton  MA  02135,11.0,04,9.0,D14,Allston / Brighton,15.0,Ward 22,2205,R3,35 Waverly St,2135.0,Address,146503.0,42.3606,-71.1435,Self Service,"(42.3606, -71.1435)",-7919658.193251258,5215149.565287469
82001,101001571773,09/08/2015 07:14:58 AM,09/09/2015 08:30:00 AM,09/08/2015 07:22:09 AM,ONTIME,Closed,Case Closed. Closed date : 2015-09-08 07:22:09.65 Case Noted Temp. plates good for thirty days from date. Not expired.,Parking Enforcement,Transportation - Traffic Division,Enforcement & Abandoned Vehicles,Parking Enforcement,BTDT_Parking Enforcement,BTDT,https://mayors24.cityofboston.gov/media/boston/report/photos/55eec3646963c98f05b5a198/report.jpg,,35 Mckone St  Dorchester  MA  02122,8.0,07,3.0,C11,Dorchester,7.0,Ward 16,1610,R2,35 Mckone St,2122.0,Address,93460.0,42.2905,-71.0471,Citizens Connect App,"(42.2905, -71.0471)",-7908926.994338787,5204594.754772028
814494,101000917319,09/03/2013 04:54:51 PM,,09/06/2013 09:55:23 PM,ONTIME,Closed,Case Closed Bulk Item Automation,Schedule Bulk Item Pickup,Public Works Department,Sanitation,Schedule a Bulk Item Pickup SS,PWDx_Schedule a Bulk Item Pickup,PWDx,,,28 Victoria Heights Rd  Hyde Park  MA  02136,12.0,08,5.0,E18,Hyde Park,10.0,18,1808,CD,28 Victoria Heights Rd,2136.0,Address,140496.0,42.3594,-71.0587,Self Service,"(0, 0)",-7910218.300431989,5214968.784796895
210614,101001721908,02/22/2016 10:32:00 AM,02/29/2016 10:32:28 AM,02/24/2016 07:32:17 AM,ONTIME,Closed,Case Closed. Closed date : 2016-02-24 07:32:17.447 Case Resolved fix swing,Equipment Repair,Parks & Recreation Department,Park Maintenance & Safety,Equipment Repair,PARK_Maintenance_Trades,PARK,,,56 Dunbar Ave  Dorchester  MA  02124,8.0,7,4.0,B3,Dorchester,9.0,17,1708,,56 Dunbar Ave,2124.0,Address,342601.0,42.2865,-71.0734,Employee Generated,"(42.2865, -71.0734)",-7911854.69694665,5203992.837590523
396092,101001925945,10/07/2016 07:38:00 AM,10/08/2016 07:38:12 AM,10/07/2016 10:38:29 AM,ONTIME,Closed,Case Closed. Closed date : 2016-10-07 10:38:29.177 Case Noted The traffic signal contractor has responded and the traffic signals are now on stop & go,Traffic Signal Inspection,Transportation - Traffic Division,Signs & Signals,Traffic Signal Inspection,BTDT_Engineering_Request for Traffic Signal Study or Review,BTDT,,,INTERSECTION of Seaver St & Maple St  Dorchester  MA,9.0,10B,9.0,B2,Roxbury,13.0,12,1207,,INTERSECTION Seaver St & Maple St,,Intersection,14968.0,42.3594,-71.0587,Constituent Call,"(0, 0)",-7910218.300431989,5214968.784796895
307443,101001769410,04/15/2016 12:23:00 PM,05/02/2016 12:23:43 PM,04/18/2016 12:53:45 PM,ONTIME,Closed,Case Closed. Closed date : 2016-04-18 12:53:45.537 Case Noted We are in receipt of your request  however during inspection this morning materials were removed as scheduled.  We will continue to monitor this address thank you for contacting our office.,PublicWorks: Complaint,Mayor's 24 Hour Hotline,Employee & General Comments,General Comments For a Program or Policy,PWDx_Missed Trash\Recycling\Yard Waste\Bulk Item,PWDx,,https://cityworker.cityofboston.gov:8443/attachments/report/571115d0d052f1f6cc349a93/closed_photo/Report.jpg,100 Pinckney St  Boston  MA  02108,3.0,1B,8.0,A1,Back Bay,14.0,Ward 5,0505,R2,100 Pinckney St,2108.0,Address,110338.0,42.3586,-71.0714,Constituent Call,"(42.3586, -71.0714)",-7911632.057965063,5214848.266387851
870431,101000374891,01/17/2012 01:26:12 PM,02/07/2012 01:44:00 PM,06/13/2012 12:32:03 PM,OVERDUE,Closed,Case Closed Duplicate of Existing Case MAX # 257758,Street Light Outages,Public Works Department,Street Lights,Street Light Outages,PWDx_Street Light Knockdown Replacement,PWDx,,,1717-1725 Hyde Park Ave  Hyde Park  MA  02136,12.0,08,5.0,E18,Hyde Park,10.0,Ward 18,1818,I,1717-1725 Hyde Park Ave,2136.0,Address,77202.0,42.2405,-71.1315,Self Service,"(42.2405, -71.1315)",-7918322.35936174,5197073.534931305
225055,101001583891,09/21/2015 10:03:00 AM,11/05/2015 10:03:05 AM,04/26/2016 08:07:19 AM,OVERDUE,Closed,Case Closed. Closed date : 2016-04-26 08:07:19.94 Case Resolved This was an old job. It has since been repaired.,PRINTED,Public Works Department,Street Lights,General Lighting Request,PWDx_Street Light_General Lighting Request,PWDx,,,INTERSECTION of Bowdoin St & New Chardon St  Boston  MA,3.0,1B,1.0,A1,Beacon Hill,3.0,Ward 3,0306,,INTERSECTION Bowdoin St & New Chardon St,,Intersection,1719.0,42.3612,-71.0629,Constituent Call,"(42.3612, -71.0629)",-7910685.84229332,5215239.956827463
112433,101001901151,09/06/2016 10:40:50 AM,09/13/2016 10:40:49 AM,09/06/2016 10:40:55 AM,ONTIME,Closed,Case Closed. Closed date : 2016-09-06 10:40:55.353 Case Resolved Created Request for Recycling Bin,Recycling Cart Return,Public Works Department,Recycling,Recycling Cart Return,PWDx_IPL Damaged Cart Replacement,PWDx,https://cityworker.cityofboston.gov:8443/attachments/report/57ced56fd052aa2125634c81/photo/Report.jpg,,617 E Fifth St  South Boston  MA  02127,6.0,05,2.0,C6,South Boston / South Boston Waterfront,5.0,Ward 6,0606,R2,617 E Fifth St,2127.0,Address,57935.0,42.3338,-71.0358,City Worker App,"(42.3338, -71.0358)",-7907669.084092822,5211112.956423865
698587,101001236092,12/19/2014 12:45:33 PM,12/08/2016 12:45:32 PM,04/13/2015 02:40:31 PM,ONTIME,Closed,Case Closed Case Noted None of the sites listed meet the city of Boston tree planting specifications. for multiple reasons  sidewalks are not wide enough  private tree canopy overhang  crosswalks  telephone and cable lines too low.,New Tree Requests,Parks & Recreation Department,Trees,New Tree Requests,PARK_New Tree Requests,PARK,,,235 Baker St  West Roxbury  MA  02132,12.0,06,6.0,E5,West Roxbury,12.0,20,2005,E,235 Baker St,2132.0,Address,158133.0,42.2778,-71.1664,Constituent Call,"(42.2778, -71.1664)",-7922207.409590424,5202683.799668218
106463,101000432318,06/05/2012 12:12:21 PM,,06/05/2012 12:12:21 PM,ONTIME,Closed,Case Closed Internal Case Performed by Highway Maintenance crew.,Pothole Repair (Internal),Public Works Department,Highway Maintenance,Pothole Repair (Internal),PWDx_District 1C: Downtown,PWDx,,,INTERSECTION of Commonwealth Ave & Massachusetts Ave  Boston  MA,4.0,1C,8.0,D4,Back Bay,14.0,Ward 5,0509,,INTERSECTION Commonwealth Ave & Massachusetts Ave,,Intersection,3392.0,42.3489,-71.0885,Employee Generated,"(42.3489, -71.0885)",-7913535.621257628,5213387.102746655
504121,101001953828,11/17/2016 11:40:18 AM,03/17/2017 11:40:17 AM,11/17/2016 03:38:57 PM,ONTIME,Closed,Case Closed. Closed date : 2016-11-17 15:38:57.717 :,Unsatisfactory Living Conditions,Inspectional Services,Housing,Unsatisfactory Living Conditions,ISD_Housing (INTERNAL),ISD,,,247 Chestnut Hill Ave  Brighton  MA  02135,11.0,04,9.0,D14,Allston / Brighton,15.0,Ward 21,2116,CD,247 Chestnut Hill Ave,2135.0,Address,31761.0,42.3394,-71.1551,Constituent Call,"(42.3394, -71.1551)",-7920949.499344461,5211956.28472526
31770,101001412955,06/19/2015 06:29:53 AM,06/22/2015 08:30:00 AM,06/19/2015 07:34:04 AM,ONTIME,Closed,Case Closed. Closed date : 2015-06-19 07:34:04.097 Case Resolved Picked Up & Made Safe,Street Light Knock Downs,Public Works Department,Street Lights,Street Light Knock Downs,PWDx_Street Light Knock Downs,PWDx,,,INTERSECTION of Magazine St & Norfolk Ave  Roxbury  MA,7.0,03,7.0,B2,Roxbury,13.0,Ward 8,0806,,INTERSECTION Magazine St & Norfolk Ave,,Intersection,6980.0,42.3267,-71.0715,Constituent Call,"(42.3267, -71.0715)",-7911643.189914142,5210043.844560107
950468,101002035115,03/11/2017 01:56:30 PM,03/14/2017 08:30:00 AM,03/11/2017 01:59:21 PM,ONTIME,Closed,Case Closed. Closed date : 2017-03-11 13:59:21.25 Case Noted Officer will check area.,Parking Enforcement,Transportation - Traffic Division,Enforcement & Abandoned Vehicles,Parking Enforcement,BTDT_Parking Enforcement,BTDT,,,1615 Commonwealth Ave  Brighton  MA  02135,11.0,04,9.0,D14,Allston / Brighton,15.0,Ward 21,2110,A,1615 Commonwealth Ave,2135.0,Address,38074.0,42.3437,-71.1436,Citizens Connect App,"(42.3437, -71.1436)",-7919669.325200339,5212603.891362616
549338,101000434755,06/10/2012 08:35:09 PM,06/13/2012 08:30:00 AM,06/13/2012 07:27:01 AM,ONTIME,Closed,Case Closed Case Noted case noted not closed,Traffic Signal Repair,Transportation - Traffic Division,Signs & Signals,Traffic Signal Repair,BTDT_Traffic Signal_Repair,BTDT,,,INTERSECTION of Albano St & Washington St  Roslindale  MA,12.0,06,5.0,E5,Roslindale,10.0,Ward 18,1810,,INTERSECTION Albano St & Washington St,,Intersection,188.0,42.2834,-71.1314,Self Service,"(42.2834, -71.1314)",-7918311.22741266,5203526.37806176
720660,101000893909,08/04/2013 04:23:40 PM,08/19/2013 08:30:00 AM,08/19/2013 02:24:12 PM,OVERDUE,Closed,Case Closed Case Resolved,Street Light Outages,Public Works Department,Street Lights,Street Light Outages,PWDx_Street Light_Pending_Contractor (Internal),PWDx,,,27 Lakeville Rd  Jamaica Plain  MA  02130,9.0,02,6.0,E13,Jamaica Plain,11.0,19,1905,CM,27 Lakeville Rd,2130.0,Address,166913.0,42.3166,-71.1153,Constituent Call,"(42.3166, -71.1153)",-7916518.983610889,5208523.203177351
894561,101001978817,12/30/2016 10:19:07 AM,01/03/2017 10:19:06 AM,12/30/2016 10:35:36 AM,ONTIME,Closed,Case Closed. Closed date : 2016-12-30 10:35:36.233 Case Noted Vehicle is on the abandoned vehicle list.,Parking Enforcement,Transportation - Traffic Division,Enforcement & Abandoned Vehicles,Parking Enforcement,BTDT_Parking Enforcement,BTDT,https://mayors24.cityofboston.gov/media/boston/report/photos/58667ae70485c84fc38738f7/report.jpg,,65 Waverly St  Brighton  MA  02135,11.0,04,9.0,D14,Allston / Brighton,15.0,Ward 22,2205,R3,65 Waverly St,2135.0,Address,146528.0,42.3613,-71.141,Citizens Connect App,"(42.3613, -71.141)",-7919379.894524276,5215255.022168046
18528,101000486217,09/30/2012 02:34:51 PM,10/01/2012 02:34:51 PM,,OVERDUE,Open,,Unsafe/Dangerous Conditions,Inspectional Services,Building,Unsafe Dangerous Conditions,ISD_Building (INTERNAL),ISD,,,17 Highgate St  Allston  MA  02134,11.0,04,9.0,D14,Allston / Brighton,15.0,Ward 21,2104,A,17 Highgate St,2134.0,Address,251734.0,42.3552,-71.132,Self Service,"(42.3552, -71.132)",-7918378.019107137,5214336.080265994
294859,101001934727,10/19/2016 07:55:42 PM,10/21/2016 08:30:00 AM,10/19/2016 09:27:03 PM,ONTIME,Closed,Case Closed. Closed date : 2016-10-19 21:27:03.773 Case Resolved clear at this time,Parking Enforcement,Transportation - Traffic Division,Enforcement & Abandoned Vehicles,Parking Enforcement,BTDT_Parking Enforcement,BTDT,https://mayors24.cityofboston.gov/media/boston/report/photos/580807fa696338e4faae5957/report.jpg,,24 Rutland St  Roxbury  MA  02118,4.0,1C,7.0,D4,South End,6.0,Ward 9,0902,R1,24 Rutland St,2118.0,Address,120171.0,42.339,-71.0752,Citizens Connect App,"(42.339, -71.0752)",-7912055.072030077,5211896.044498857
265424,101001171530,09/14/2014 07:29:04 AM,01/12/2015 07:29:03 AM,09/17/2014 02:36:13 PM,ONTIME,Closed,Case Closed :,Unsatisfactory Living Conditions,Inspectional Services,Housing,Unsatisfactory Living Conditions,ISD_Housing (INTERNAL),ISD,,,9 Hannon St  Dorchester  MA  02124,8.0,07,4.0,B3,Greater Mattapan,9.0,Ward 14,1405,A,9 Hannon St,2124.0,Address,246136.0,42.2815,-71.0855,Constituent Call,"(42.2815, -71.0855)",-7913201.662785248,5203240.494856145
211502,101001081592,05/05/2014 08:58:14 AM,05/07/2014 08:58:14 AM,05/05/2014 11:39:34 AM,ONTIME,Closed,Case Closed Case Resolved,Request for Pothole Repair,Public Works Department,Highway Maintenance,Request for Pothole Repair,PWDx_District 08: Hyde Park,PWDx,,,0 River St  Hyde Park  MA  02136,12.0,08,5.0,E18,Hyde Park,10.0,Ward 18,1818,E,0 River St,2136.0,Address,116219.0,42.3594,-71.0587,City Worker App,"(0, 0)",-7910218.300431989,5214968.784796895
383086,101001804034,06/01/2016 10:13:00 AM,06/08/2016 10:13:47 AM,,OVERDUE,Open,,Protection of Adjoining Property,Inspectional Services,Building,Protection of Adjoining Property,ISD_Building (INTERNAL),ISD,,,16 Circuit St  Roxbury  MA  02119,7.0,10B,7.0,B2,Roxbury,13.0,Ward 12,1203,R1,16 Circuit St,2119.0,Address,32805.0,42.3235,-71.0852,Constituent Call,"(42.3235, -71.0852)",-7913168.266938011,5209562.030773118
81529,101000824848,04/20/2013 10:05:15 AM,,04/29/2013 09:43:36 PM,ONTIME,Closed,Case Closed Bulk Item Automation,Schedule a Bulk Item Pickup,Public Works Department,Sanitation,Schedule a Bulk Item Pickup,PWDx_Schedule a Bulk Item Pickup,PWDx,,,153 Ormond St  Mattapan  MA  02126,8.0,07,4.0,B3,Greater Mattapan,9.0,Ward 14,1414,R1,153 Ormond St,2126.0,Address,105990.0,42.284,-71.0952,Constituent Call,"(42.284, -71.0952)",-7914281.461845944,5203616.658759921
434038,101000897130,08/08/2013 09:43:12 AM,08/12/2013 09:43:12 AM,08/08/2013 09:43:13 AM,ONTIME,Closed,Case Closed Case Resolved Marked completed at case creation,Sidewalk Repair (Make Safe),Public Works Department,Highway Maintenance,Sidewalk Repair (Make Safe),PWDx_District 04: Allston/Brighton,PWDx,,,INTERSECTION of Washington St & Shepard St  Brighton  MA,11.0,04,9.0,D14,Allston / Brighton,15.0,Ward 21,2109,,INTERSECTION Washington St & Shepard St,,Intersection,5970.0,42.3482,-71.1497,City Worker App,"(42.3482, -71.1497)",-7920348.374094176,5213281.666671318
481172,101001744127,03/10/2016 04:46:00 PM,,03/28/2016 08:25:01 AM,ONTIME,Closed,Case Closed. Closed date : 2016-03-28 08:25:01.25 Case Resolved This request has been approved. Request for Recycling Cart has been created. See case #101001754977 for status of the request.,Recycling Cart Inquiry,Public Works Department,Recycling,Recycling Cart Inquiry,PWDx_Recycling Cart Inquiry,PWDx,,,278 E Eagle St  East Boston  MA  02128,1.0,09,1.0,A7,East Boston,1.0,Ward 1,0109,R3,278 E Eagle St,2128.0,Address,50711.0,42.3815,-71.0305,Constituent Call,"(42.3815, -71.0305)",-7907079.090791618,5218298.712738061
680775,101001261641,01/29/2015 12:01:30 PM,02/02/2015 12:01:30 PM,02/12/2015 05:34:10 PM,OVERDUE,Closed,Case Closed Case Noted Snow has been removed.,Request for Snow Plowing,Public Works Department,Street Cleaning,Request for Snow Plowing,PWDx_District 04: Allston/Brighton,PWDx,,,INTERSECTION of Atkins St & Justin Rd  Brighton  MA,11.0,04,9.0,D14,Allston / Brighton,15.0,Ward 22,2213,,INTERSECTION Atkins St & Justin Rd,,Intersection,723.0,42.3532,-71.1696,Self Service,"(42.3532, -71.1696)",-7922563.631960964,5214034.8072559135
36645,101001199720,10/20/2014 08:42:15 AM,10/22/2014 08:42:15 AM,10/20/2014 09:03:11 AM,ONTIME,Closed,Case Closed Case Noted Yardwaste picked up at 9:02 a.m. on 10/20/14.,Missed Leaf or Yard Trash: District 03,Public Works Department,Sanitation,Missed Trash/Recycling/Yard Waste/Bulk Item,PWDx_Missed Trash\Recycling\Yard Waste\Bulk Item,PWDx,,,33-35 Howell St  Dorchester  MA  02125,6.0,03,2.0,C6,Dorchester,5.0,Ward 7,0708,R3,33-35 Howell St,2125.0,Address,75655.0,42.3254,-71.0584,Constituent Call,"(42.3254, -71.0584)",-7910184.9045847505,5209848.104753405
702165,101001276023,02/04/2015 06:10:03 PM,02/09/2015 08:30:00 AM,02/12/2015 05:46:50 PM,OVERDUE,Closed,Case Closed Case Noted Snow has been removed.,Request for Snow Plowing,Public Works Department,Street Cleaning,Request for Snow Plowing,PWDx_District 05: South Boston,PWDx,,,490 E Seventh St  South Boston  MA  02127,6.0,05,2.0,C6,South Boston,5.0,07,0702,R1,490 E Seventh St,2127.0,Address,125336.0,42.3594,-71.0587,Citizens Connect App,"(0, 0)",-7910218.300431989,5214968.784796895
221479,101000813458,03/29/2013 09:53:40 AM,07/27/2013 09:53:40 AM,08/22/2013 09:58:10 AM,OVERDUE,Closed,Case Closed NOACC: Closed-No Access,Unsatisfactory Living Conditions,Inspectional Services,Housing,Unsatisfactory Living Conditions,ISD_Housing (INTERNAL),ISD,,,30 Creighton St  Jamaica Plain  MA  02130,9.0,10A,8.0,E13,Jamaica Plain,11.0,Ward 10,1008,R2,30 Creighton St,2130.0,Address,220391.0,42.3235,-71.1084,Constituent Call,"(42.3235, -71.1084)",-7915750.879124414,5209562.030773118
309846,101001695257,01/17/2016 01:36:03 PM,01/20/2016 08:30:00 AM,01/19/2016 01:09:54 AM,ONTIME,Closed,Case Closed. Closed date : 2016-01-19 01:09:54.717 Case Resolved tagged and called 911 for a tow,Parking Enforcement,Transportation - Traffic Division,Enforcement & Abandoned Vehicles,Parking Enforcement,BTDT_Parking Enforcement,BTDT,https://mayors24.cityofboston.gov/media/boston/report/photos/569bdf0d0485a1797c8c50be/photo_20160117_133537.jpg,,INTERSECTION of Holborn Park & Holborn St  Dorchester  MA,9.0,10B,7.0,B2,Roxbury,13.0,Ward 12,1206,,INTERSECTION Holborn Park & Holborn St,,Intersection,6323.0,42.3147,-71.0812,Citizens Connect App,"(42.3147, -71.0812)",-7912722.988974837,5208237.169202712
842590,101000469219,08/24/2012 09:17:39 AM,08/28/2012 09:17:39 AM,08/24/2012 09:17:43 AM,ONTIME,Closed,Case Closed,Request for Pothole Repair,Public Works Department,Highway Maintenance,Request for Pothole Repair,PWDx_District 04: Allston/Brighton,PWDx,,,41 Blenford Rd  Brighton  MA  02135,11.0,04,9.0,D14,Allston / Brighton,15.0,Ward 21,2113,R2,41 Blenford Rd,2135.0,Address,189310.0,42.3447,-71.1506,City Worker App,"(42.3447, -71.1506)",-7920448.56163589,5212754.503905248
453453,101000731556,01/04/2013 12:00:11 PM,01/18/2013 12:00:11 PM,01/07/2013 03:13:49 PM,ONTIME,Closed,Case Closed Case Resolved,Street Light Outages,Public Works Department,Street Lights,Street Light Outages,PWDx_Street Light Outages,PWDx,,,43-53 Trustman Ter  East Boston  MA  02128,1.0,09,1.0,A7,East Boston,1.0,01,0111,,43-53 Trustman Ter,2128.0,Address,342715.0,42.387,-71.0142,Constituent Call,"(42.387, -71.0142)",-7905264.583091688,5219127.609959403
477042,101001218841,11/17/2014 06:01:23 PM,11/20/2014 08:30:00 AM,11/18/2014 07:34:29 AM,ONTIME,Closed,Case Closed Case Noted upon inspection no recycle out for collection,Sticker Request,Public Works Department,Recycling,Sticker Request,PWDx_Sticker Request,PWDx,,,4 W Cedar St  Boston  MA  02108,3.0,1B,8.0,A1,Beacon Hill,14.0,Ward 5,0511,R1,4 W Cedar St,2108.0,Address,26928.0,42.3574,-71.0694,Self Service,"(42.3574, -71.0694)",-7911409.418983476,5214667.491651126
50659,101000797512,03/07/2013 07:37:42 AM,03/11/2013 08:30:00 AM,03/11/2013 01:43:07 PM,OVERDUE,Closed,Case Closed Case Resolved Location has been made safe. This sidewalk will be referred for permanent repair. See case #101000801658 for status of the permanent repair.,Sidewalk Repair (Make Safe),Public Works Department,Highway Maintenance,Sidewalk Repair (Make Safe),PWDx_District 10A: Roxbury,PWDx,,,319 Longwood Ave  Boston  MA  02115,4.0,10A,8.0,B2,Fenway / Kenmore / Audubon Circle / Longwood,14.0,Ward 4,0410,C,319 Longwood Ave,2115.0,Address,87174.0,42.338,-71.1053,Constituent Call,"(42.338, -71.1053)",-7915405.788702955,5211745.445609323
43987,101000891123,07/31/2013 10:52:55 AM,11/28/2013 10:52:55 AM,,OVERDUE,Open,,Bed Bugs,Inspectional Services,Housing,Bed Bugs,ISD_Housing (INTERNAL),ISD,,,80 Orleans St  East Boston  MA  02128,1.0,09,1.0,A7,East Boston,1.0,Ward 1,0103,A,80 Orleans St,2128.0,Address,287680.0,42.3692,-71.0374,Constituent Call,"(42.3692, -71.0374)",-7907847.195278092,5216445.259852141
553734,101000708621,11/19/2012 11:37:29 AM,,11/21/2012 01:18:42 AM,ONTIME,Closed,Case Closed Bulk Item Automation,Schedule a Bulk Item Pickup,Public Works Department,Sanitation,Schedule a Bulk Item Pickup,PWDx_Schedule a Bulk Item Pickup,PWDx,,,505 Massachusetts Ave  Roxbury  MA  02118,7.0,10B,7.0,D4,Roxbury,13.0,Ward 9,0903,RC,505 Massachusetts Ave,2118.0,Address,271947.0,42.339,-71.0804,Self Service,"(42.339, -71.0804)",-7912633.933382202,5211896.044498857
284381,101001655604,12/01/2015 09:35:05 AM,12/02/2015 09:35:05 AM,12/01/2015 09:53:04 AM,ONTIME,Closed,Case Closed. Closed date : 2015-12-01 09:53:04.78 Case Resolved,Pick up Dead Animal,Public Works Department,Street Cleaning,Pick up Dead Animal,PWDx_District 1B: North End,PWDx,,https://cityworker.cityofboston.gov:8443/attachments/report/565db059d052fa972b39dbba/closed_photo/Report.jpg,39 S Russell St  Boston  MA  02114,3.0,1B,1.0,A1,Beacon Hill,3.0,Ward 3,0306,R1,39 S Russell St,2114.0,Address,119776.0,42.3601,-71.0661,Citizens Connect App,"(42.3601, -71.0661)",-7911042.064663859,5215074.23966349
72061,101000817435,04/05/2013 10:33:16 AM,06/07/2013 10:33:15 AM,05/02/2013 10:49:08 AM,ONTIME,Closed,Case Closed Case Resolved all set painted,PWD Graffiti,Public Works Department,Highway Maintenance,PWD Graffiti,PWDx_District 09: East Boston,PWDx,,,INTERSECTION of Bennington St & Havre St  East Boston  MA,1.0,09,1.0,A7,East Boston,1.0,Ward 1,0106,,INTERSECTION Bennington St & Havre St,,Intersection,1314.0,42.3768,-71.0337,City Worker App,"(42.3768, -71.0337)",-7907435.313162156,5217590.439918553
633735,101000320184,08/28/2011 12:46:31 PM,08/30/2011 12:46:30 PM,08/31/2011 07:59:22 AM,OVERDUE,Closed,Case Closed Case Resolved debris removed,Tree Emergencies,Parks & Recreation Department,Trees,Tree Emergencies,PARK_Tree Emergencies,PARK,,,216 Almont St  Mattapan  MA  02126,8.0,07,5.0,B3,Greater Mattapan,9.0,Ward 18,1803,R1,216 Almont St,2126.0,Address,2784.0,42.2802,-71.0985,Constituent Call,"(42.2802, -71.0985)",-7914648.816165561,5203044.895524631
646720,101001784393,05/07/2016 11:31:30 AM,05/10/2016 08:30:00 AM,05/09/2016 03:43:39 AM,ONTIME,Closed,Case Closed. Closed date : 2016-05-09 03:43:39.243 Case Resolved area checked all clear,Parking Enforcement,Transportation - Traffic Division,Enforcement & Abandoned Vehicles,Parking Enforcement,BTDT_Parking Enforcement,BTDT,https://mayors24.cityofboston.gov/media/boston/report/photos/572e0a4e048599525670290e/photo_20160507_113041.jpg,,1937 Dorchester Ave  Dorchester  MA  02124,8.0,07,4.0,C11,Dorchester,8.0,Ward 17,1711,R3,1937 Dorchester Ave,2124.0,Address,48450.0,42.2846,-71.0649,Citizens Connect App,"(42.2846, -71.0649)",-7910908.481274907,5203706.940317867
619150,101001396596,05/28/2015 08:52:00 AM,,05/30/2015 04:36:40 PM,ONTIME,Closed,Case Closed. Closed date : 2015-05-30 16:36:40.42 Bulk Item Automation,Schedule a Bulk Item Pickup,Public Works Department,Sanitation,Schedule a Bulk Item Pickup,PWDx_Schedule a Bulk Item Pickup,PWDx,,,40 Mallet St  Dorchester  MA  02124,8.0,07,3.0,C11,Dorchester,7.0,Ward 16,1606,R1,40 Mallet St,2124.0,Address,88790.0,42.2902,-71.0582,Constituent Call,"(42.2902, -71.0582)",-7910162.640686592,5204549.609657571
275999,101001945814,11/04/2016 07:15:00 PM,11/08/2016 08:30:00 AM,11/07/2016 11:42:48 AM,ONTIME,Closed,Case Closed. Closed date : 2016-11-07 11:42:48.187 Case Resolved Inspected this location and found no trash or recyclables or yard waste out curbside at this time. Recycle bin inspected no damage found.,Sticker Request,Public Works Department,Recycling,Sticker Request,PWDx_Sticker Request,PWDx,,https://cityworker.cityofboston.gov:8443/attachments/report/581d16f9d0526e981e6312ee/closed_photo/Report.jpg,22 Dacia St  Dorchester  MA  02125,7.0,03,7.0,B2,Roxbury,13.0,Ward 13,1301,R1,22 Dacia St,2125.0,Address,45577.0,42.3148,-71.0775,Constituent Call,"(42.3148, -71.0775)",-7912311.106858903,5208252.223407139
415348,101000322517,08/30/2011 05:18:21 PM,02/25/2013 05:18:19 PM,07/25/2012 07:27:20 AM,ONTIME,Closed,Case Closed Case Resolved The stump was removed by Maltby Tree Service. A new tree request case will be made for this location. If you have any questions please call the Park Line at 617-635-7275.,Tree Maintenance Requests,Parks & Recreation Department,Trees,Tree Maintenance Requests,PARK_Tree Maintenance Request,PARK,,,INTERSECTION of G St & E Seventh St  South Boston  MA,6.0,05,2.0,C6,South Boston / South Boston Waterfront,5.0,Ward 7,0703,,INTERSECTION G St & E Seventh St,,Intersection,5159.0,42.3321,-71.0441,Employee Generated,"(42.3321, -71.0441)",-7908593.035866407,5210856.96090464
329940,101001500425,07/30/2015 04:53:55 PM,07/31/2015 04:53:54 PM,07/30/2015 08:02:51 PM,ONTIME,Closed,Case Closed. Closed date : 2015-07-30 20:02:51.603 Case Resolved pick up,Requests for Street Cleaning,Public Works Department,Street Cleaning,Requests for Street Cleaning,PWDx_District 07: South Dorchester,PWDx,https://mayors24.cityofboston.gov/media/boston/report/photos/55ba8f036963856559d2f60d/report.jpg,https://cityworker.cityofboston.gov:8443/attachments/report/55ba8f2cd052dbe591aeb944/closed_photo/Report.jpg,8 Hallet St  Dorchester  MA  02122,8.0,07,3.0,C11,Dorchester,7.0,16,1610,,8 Hallet St,2122.0,Address,245250.0,42.2855,-71.0466,Citizens Connect App,"(42.2855, -71.0466)",-7908871.33459339,5203842.364266941
325534,101000468474,08/22/2012 07:06:37 PM,,08/29/2012 09:43:05 PM,ONTIME,Closed,Case Closed Bulk Item Automation,Schedule a Bulk Item Pickup,Public Works Department,Sanitation,Schedule a Bulk Item Pickup,PWDx_Schedule a Bulk Item Pickup,PWDx,,,500 E Fourth St  South Boston  MA  02127,6.0,05,2.0,C6,South Boston / South Boston Waterfront,5.0,Ward 6,0604,CM,500 E Fourth St,2127.0,Address,59780.0,42.3347,-71.0452,Self Service,"(42.3347, -71.0452)",-7908715.487306279,5211248.486264818
896250,101001981727,01/04/2017 03:40:00 PM,01/06/2017 03:40:12 PM,01/04/2017 05:36:58 PM,ONTIME,Closed,Case Closed. Closed date : 2017-01-04 17:36:58.203 Case Noted no violation found at this.time,Improper Storage of Trash (Barrels),Public Works Department,Code Enforcement,Improper Storage of Trash (Barrels),PWDx_Code Enforcement,PWDx,,https://cityworker.cityofboston.gov:8443/attachments/report/586d5e03d052a4b587525f84/closed_photo/Report.jpg,88 Auckland St  Dorchester  MA  02125,7.0,03,3.0,C11,Dorchester,8.0,Ward 15,1506,R3,88 Auckland St,2125.0,Address,6543.0,42.3117,-71.0562,Constituent Call,"(42.3117, -71.0562)",-7909940.001705006,5207785.554192268
349587,101001795871,05/21/2016 04:56:00 PM,05/26/2016 08:30:00 AM,05/22/2016 10:43:36 AM,ONTIME,Closed,Case Closed. Closed date : 2016-05-22 10:43:36.143 Case Noted No violation written. Lots sweeped,Poor Conditions of Property,Public Works Department,Code Enforcement,Poor Conditions of Property,PWDx_Code Enforcement,PWDx,,https://cityworker.cityofboston.gov:8443/attachments/report/5740cbb8d05243d389fe1c92/closed_photo/Report.jpg,1030 William T Morrissey Blvd  Dorchester  MA  02122,8.0,07,3.0,C11,Dorchester,7.0,Ward 16,1610,C,1030 William T Morrissey Blvd,2122.0,Address,149905.0,42.2902,-71.0442,Constituent Call,"(42.2902, -71.0442)",-7908604.167815486,5204549.609657571
900773,101001915728,09/22/2016 04:03:00 PM,09/27/2016 04:03:03 PM,01/10/2017 08:29:32 AM,OVERDUE,Closed,Case Closed. Closed date : 2017-01-10 08:29:32.757 ADCLSD: Administratively Closed,Building Inspection Request,Inspectional Services,Building,Building Inspection Request,ISD_Building (INTERNAL),ISD,,,229 Minot St  Dorchester  MA  02124,8.0,07,3.0,C11,Dorchester,7.0,Ward 16,1608,R1,229 Minot St,2124.0,Address,96110.0,42.2837,-71.0567,Constituent Call,"(42.2837, -71.0567)",-7909995.661450404,5203571.51830337
436372,101001177869,09/22/2014 09:27:08 AM,,09/24/2014 04:37:49 PM,ONTIME,Closed,Case Closed Bulk Item Automation,Schedule a Bulk Item Pickup,Public Works Department,Sanitation,Schedule a Bulk Item Pickup,PWDx_Schedule a Bulk Item Pickup,PWDx,,,14 Harlow St  Dorchester  MA  02125,7.0,03,7.0,B2,Roxbury,13.0,Ward 13,1302,R3,14 Harlow St,2125.0,Address,69522.0,42.3191,-71.0721,Constituent Call,"(42.3191, -71.0721)",-7911709.981608619,5208899.57682787
110920,101000812021,03/27/2013 10:21:19 AM,04/10/2013 10:21:18 AM,04/03/2013 11:25:04 AM,ONTIME,Closed,Case Closed Case Resolved no problems found,Street Light Outages,Public Works Department,Street Lights,Street Light Outages,PWDx_Street Light_Pending_Contractor (Internal),PWDx,,,3 Camp Rd  West Roxbury  MA  02132,12.0,06,6.0,E5,West Roxbury,12.0,Ward 20,2015,R1,3 Camp Rd,2132.0,Address,25392.0,42.2624,-71.1591,Constituent Call,"(42.2624, -71.1591)",-7921394.777307632,5200367.095086644
555827,101001339438,03/23/2015 09:09:55 AM,03/24/2015 09:09:55 AM,03/23/2015 09:09:57 AM,ONTIME,Closed,Case Closed Case Resolved Marked completed at case creation,Request for Pothole Repair,Public Works Department,Highway Maintenance,Request for Pothole Repair,PWDx_District 10B: Roxbury,PWDx,https://cityworker.cityofboston.gov:8443/attachments/report/5510109dd052dab9f2a8ed90/photo/Report.jpg,,97 Dale St  Roxbury  MA  02119,7.0,10B,7.0,B2,Roxbury,13.0,Ward 12,1203,R2,97 Dale St,2119.0,Address,45764.0,42.3223,-71.0877,City Worker App,"(42.3223, -71.0877)",-7913446.565664993,5209381.356921002
513377,101000366512,12/21/2011 07:41:21 AM,,12/21/2011 07:41:21 AM,ONTIME,Closed,Case Closed Internal Case Performed by Highway Maintenance crew.,Pothole Repair (Internal),Public Works Department,Highway Maintenance,Pothole Repair (Internal),PWDx_District 08: Hyde Park,PWDx,,,50 Sanford St  Hyde Park  MA  02136,12.0,08,5.0,E18,Hyde Park,10.0,Ward 18,1820,R1,50 Sanford St,2136.0,Address,122283.0,42.242,-71.1428,Employee Generated,"(42.242, -71.1428)",-7919580.269607702,5197299.084768822
560817,101000903220,08/16/2013 09:03:14 AM,,08/16/2013 09:03:14 AM,ONTIME,Closed,Case Closed Internal Case Performed by Highway Maintenance crew.,Pothole Repair (Internal),Public Works Department,Highway Maintenance,Pothole Repair (Internal),PWDx_District 10B: Roxbury,PWDx,,,30-32 George St  Roxbury  MA  02119,7.0,10B,7.0,B2,Roxbury,13.0,Ward 8,0803,I,30-32 George St,2119.0,Address,63456.0,42.3273,-71.0739,Employee Generated,"(42.3273, -71.0739)",-7911910.356692046,5210134.187373629
300347,101001939646,10/26/2016 06:03:45 PM,10/28/2016 08:30:00 AM,10/26/2016 06:31:02 PM,ONTIME,Closed,Case Closed. Closed date : 2016-10-26 18:31:02.717 Case Resolved vehicle has a rental permit,Parking Enforcement,Transportation - Traffic Division,Enforcement & Abandoned Vehicles,Parking Enforcement,BTDT_Parking Enforcement,BTDT,,,21 Telegraph St  South Boston  MA  02127,6.0,05,2.0,C6,South Boston / South Boston Waterfront,5.0,Ward 7,0705,R3,21 Telegraph St,2127.0,Address,133979.0,42.3328,-71.05,Citizens Connect App,"(42.3328, -71.05)",-7909249.8208620865,5210962.369986333
739809,101000707035,11/15/2012 04:48:31 PM,12/13/2012 04:48:31 PM,11/21/2012 12:11:04 PM,ONTIME,Closed,Case Closed Case Resolved not at location 11/21.,Abandoned Vehicles,Transportation - Traffic Division,Enforcement & Abandoned Vehicles,Abandoned Vehicles,BTDT_AVRS Interface Queue,BTDT,,,40 Spencer St  Dorchester  MA  02124,8.0,03,4.0,B3,Dorchester,9.0,Ward 17,1701,R3,40 Spencer St,2124.0,Address,129358.0,42.2957,-71.0765,Constituent Call,"(42.2957, -71.0765)",-7912199.7873681085,5205377.304256011
68510,101001196154,10/14/2014 03:33:39 PM,,10/22/2014 08:45:16 AM,ONTIME,Closed,Case Closed Case Resolved LIFTED METER PIT FRAME & COVER.  SEALED WITH RUBBER GASKET & PATCHED. METER PIT ALL SET. 10/20,Utility Casting Repair,Public Works Department,Highway Maintenance,Utility Casting Repair,BWSC_All Cases,BWSC,https://cityworker.cityofboston.gov:8443/attachments/report/543d7a8ed052f1b1cd5beb3d/photo/Report.jpg,,INTERSECTION of Harmony St & Horace St  East Boston  MA,1.0,09,1.0,A7,East Boston,1.0,Ward 1,0111,,INTERSECTION Harmony St & Horace St,,Intersection,5645.0,42.3811,-71.0201,City Worker App,"(42.3811, -71.0201)",-7905921.368087368,5218238.432136247
262584,101000473877,09/04/2012 11:00:13 AM,09/18/2012 11:00:12 AM,09/11/2012 08:29:47 AM,ONTIME,Closed,Case Closed Case Resolved replaced lamp and ballast,Street Light Outages,Public Works Department,Street Lights,Street Light Outages,PWDx_Street Light Outages,PWDx,,,29 Oak St  Boston  MA  02111,4.0,1C,2.0,A1,Downtown / Financial District,4.0,Ward 3,0308,R3,29 Oak St,2111.0,Address,104571.0,42.3482,-71.0632,Constituent Call,"(42.3482, -71.0632)",-7910719.238140559,5213281.666671318
85977,101001347124,04/01/2015 03:50:35 PM,,04/02/2015 03:31:51 PM,ONTIME,Closed,Case Closed Case Resolved  We are very proud to have Brian as a member of our team. Thank you!,BTDT: Compliment,Mayor's 24 Hour Hotline,Employee & General Comments,General Comments For An Employee,BTDT_General Comments,BTDT,,,,,,,,,,,,,,,,,42.3594,-71.0587,Constituent Call,"(0, 0)",-7910218.300431989,5214968.784796895
87181,101001344267,03/29/2015 10:41:21 AM,06/03/2015 08:30:00 AM,,OVERDUE,Open,,Graffiti Removal,Property Management,Graffiti,Graffiti Removal,INFO01_GenericeFormforOtherServiceRequestTypes,INFO,https://mayors24.cityofboston.gov/media/boston/report/photos/55180f0a0485b083536d340d/report.jpg,,21-25 Chandler St  Boston  MA  02116,4.0,1C,2.0,D4,South End,6.0,Ward 5,0501,E,21-25 Chandler St,2116.0,Address,28727.0,42.3473,-71.0708,Citizens Connect App,"(42.3473, -71.0708)",-7911565.266270587,5213146.107728223
545440,101001242181,01/05/2015 09:21:02 AM,,01/08/2015 04:38:44 PM,ONTIME,Closed,Case Closed Bulk Item Automation,Schedule Bulk Item Pickup,Public Works Department,Sanitation,Schedule a Bulk Item Pickup SS,PWDx_Schedule a Bulk Item Pickup,PWDx,,,27 Portina Rd  Brighton  MA  02135,11.0,04,9.0,D14,Allston / Brighton,15.0,Ward 22,2209,R2,27 Portina Rd,2135.0,Address,294897.0,42.3433,-71.1562,Self Service,"(42.3433, -71.1562)",-7921071.950784333,5212543.647016329
205981,101000804950,03/15/2013 12:35:43 PM,,03/19/2013 09:45:13 PM,ONTIME,Closed,Case Closed Bulk Item Automation,Schedule a Bulk Item Pickup,Public Works Department,Sanitation,Schedule a Bulk Item Pickup,PWDx_Schedule a Bulk Item Pickup,PWDx,,,260 Belgrade Ave  Roslindale  MA  02131,12.0,06,5.0,E5,Roslindale,10.0,Ward 20,2008,A,260 Belgrade Ave,2131.0,Address,13623.0,42.2859,-71.1421,Constituent Call,"(42.2859, -71.1421)",-7919502.345964148,5203902.553309751
58395,101001042350,03/07/2014 08:24:46 AM,03/11/2014 08:30:00 AM,03/07/2014 08:30:29 AM,ONTIME,Closed,Case Closed Case Resolved picked up,Requests for Street Cleaning,Public Works Department,Street Cleaning,Requests for Street Cleaning,PWDx_District 09: East Boston,PWDx,,,INTERSECTION of Princeton St & Shelby St  East Boston  MA,1.0,09,1.0,A7,East Boston,1.0,Ward 1,0109,,INTERSECTION Princeton St & Shelby St,,Intersection,7974.0,42.3806,-71.0277,City Worker App,"(42.3806, -71.0277)",-7906767.3962173965,5218163.081924011
743068,101000398820,03/22/2012 12:25:09 PM,04/05/2012 12:25:08 PM,03/28/2012 07:30:54 AM,ONTIME,Closed,Case Closed Case Resolved Replaced burnt 250 SV lamp,Street Light Outages,Public Works Department,Street Lights,Street Light Outages,PWDx_Street Light Outages,PWDx,,,89 Brunswick St  Dorchester  MA  02121,7.0,03,4.0,B2,Roxbury,13.0,Ward 14,1401,R3,89 Brunswick St,2121.0,Address,198933.0,42.3109,-71.0805,Self Service,"(42.3109, -71.0805)",-7912645.065331282,5207665.127158283
667796,101001206709,10/28/2014 07:34:18 PM,10/31/2014 08:30:00 AM,10/28/2014 10:58:49 PM,ONTIME,Closed,Case Closed Case Resolved area checked all clear,Parking Enforcement,Transportation - Traffic Division,Enforcement & Abandoned Vehicles,Parking Enforcement,BTDT_Parking Enforcement,BTDT,,,20-22 Lee Hill Rd  Roslindale  MA  02131,9.0,02,5.0,E5,Roslindale,10.0,Ward 20,2002.0,R2,20-22 Lee Hill Rd,2131.0,Address,84859.0,42.2889,-71.127,Self Service,"(42.2889, -71.127)",-7917821.421653169,5204353.983312822
47528,101001407394,06/11/2015 10:35:00 AM,06/25/2015 10:35:11 AM,06/16/2015 10:28:24 AM,ONTIME,Closed,Case Closed. Closed date : 2015-06-16 10:28:24.777 Case Resolved,Street Light Outages///sent to contractor,Public Works Department,Street Lights,Street Light Outages,PWDx_Street Light_Pending_Contractor (Internal),PWDx,https://mayors24.cityofboston.gov/media/boston/report/photos/55799cb06963b056927cf341/photo_20150611_103502.jpg,,407 Newbury St  Boston  MA  02215,4.0,10A,8.0,D4,Back Bay,14.0,Ward 5,0510,,407 Newbury St,2215.0,Address,157400.0,42.3594,-71.0587,Citizens Connect App,"(0, 0)",-7910218.300431989,5214968.784796895
899364,101001984316,01/08/2017 11:45:00 PM,01/10/2017 08:30:00 AM,01/09/2017 12:43:44 AM,ONTIME,Closed,Case Closed. Closed date : 2017-01-09 00:43:44.927 Case Resolved Accident cleaned up,Requests for Street Cleaning,Public Works Department,Street Cleaning,Requests for Street Cleaning,PWDx_District 1C: Downtown,PWDx,,,INTERSECTION of Kneeland St & Lincoln St  Boston  MA,4.0,1C,2.0,A1,Downtown / Financial District,4.0,3,0308,,INTERSECTION Kneeland St & Lincoln St,,Intersection,17235.0,42.3594,-71.0587,Constituent Call,"(0, 0)",-7910218.300431989,5214968.784796895
75504,101001350254,04/06/2015 01:45:37 PM,,04/09/2015 04:40:50 PM,ONTIME,Closed,Case Closed Bulk Item Automation,Schedule Bulk Item Pickup,Public Works Department,Sanitation,Schedule a Bulk Item Pickup SS,PWDx_Schedule a Bulk Item Pickup,PWDx,,,111 W Third St  South Boston  MA  02127,6.0,05,2.0,C6,South Boston / South Boston Waterfront,5.0,Ward 6,0601,R3,111 W Third St,2127.0,Address,135212.0,42.3411,-71.0526,Self Service,"(42.3411, -71.0526)",-7909539.251538149,5212212.309962723
251708,101000951598,10/22/2013 01:46:57 PM,12/24/2013 01:46:57 PM,,OVERDUE,Open,,PWD Graffiti,Public Works Department,Highway Maintenance,PWD Graffiti,INFO01_GenericeFormforOtherServiceRequestTypes,INFO,,,56 Bowdoin St  Dorchester  MA  02121,7.0,03,4.0,C11,Dorchester,8.0,Ward 14,1404,R1,56 Bowdoin St,2121.0,Address,17771.0,42.3011,-71.0723,City Worker App,"(42.3011, -71.0723)",-7911732.245506777,5206190.020190971
267647,101001117897,06/28/2014 08:48:54 PM,,07/02/2014 04:39:06 PM,ONTIME,Closed,Case Closed Bulk Item Automation,Schedule Bulk Item Pickup,Public Works Department,Sanitation,Schedule a Bulk Item Pickup SS,PWDx_Schedule a Bulk Item Pickup,PWDx,,,20 Imrie Rd  Allston  MA  02134,11.0,04,9.0,D14,Allston / Brighton,15.0,Ward 21,2106,R3,20 Imrie Rd,2134.0,Address,258454.0,42.3519,-71.1387,Self Service,"(42.3519, -71.1387)",-7919123.85969545,5213838.984940407
308083,101000435209,06/11/2012 08:23:48 PM,12/08/2013 08:23:48 PM,06/18/2013 02:33:25 PM,ONTIME,Closed,Case Closed Case Resolved The tree was pruned by Northern Tree Service  to the City of Boston tree pruning specifications.,Tree Maintenance Requests,Parks & Recreation Department,Trees,Tree Maintenance Requests,PARK_Tree Maintenance Request,PARK,,,66 Chestnut St  Charlestown  MA  02129,3.0,1A,1.0,A15,Charlestown,2.0,Ward 2,0203,R3,66 Chestnut St,2129.0,Address,163300.0,42.3758,-71.0596,Self Service,"(42.3758, -71.0596)",-7910318.487973703,5217439.750413303
341928,101001041658,03/06/2014 10:09:45 AM,,03/07/2014 04:38:59 PM,ONTIME,Closed,Case Closed Bulk Item Automation,Schedule a Bulk Item Pickup,Public Works Department,Sanitation,Schedule a Bulk Item Pickup,PWDx_Schedule a Bulk Item Pickup,PWDx,,,31 Raven St  Dorchester  MA  02125,7.0,03,3.0,C11,Dorchester,7.0,Ward 13,1307,R3,31 Raven St,2125.0,Address,114748.0,42.3179,-71.055,Constituent Call,"(42.3179, -71.055)",-7909806.418316054,5208718.915609538
652644,101001361389,04/22/2015 12:26:19 PM,04/23/2015 12:26:19 PM,04/23/2015 10:03:13 AM,ONTIME,Closed,Case Closed Case Noted No trucks in the area. A reminder will be placed on location to make sure collected this week.,Missed Recycling: District 07,Public Works Department,Sanitation,Missed Trash/Recycling/Yard Waste/Bulk Item,PWDx_Missed Trash\Recycling\Yard Waste\Bulk Item,PWDx,,,9 Greenwood Park  Dorchester  MA  02122,7.0,07,3.0,C11,Dorchester,7.0,Ward 16,1601,R3,9 Greenwood Park,2122.0,Address,66948.0,42.2994,-71.0596,Constituent Call,"(42.2994, -71.0596)",-7910318.487973703,5205934.157657592
313935,101001543082,08/28/2015 11:22:31 AM,08/31/2015 11:22:31 AM,08/28/2015 12:43:05 PM,ONTIME,Closed,Case Closed. Closed date : 2015-08-28 12:43:05.563 Case Resolved furniture removed,CE Collection,Public Works Department,Street Cleaning,CE Collection,PWDx_District 04: Allston/Brighton,PWDx,https://cityworker.cityofboston.gov:8443/attachments/report/55e07cc9d052f8c25f1d5b32/photo/Report.jpg,https://cityworker.cityofboston.gov:8443/attachments/report/55e07cc9d052f8c25f1d5b32/closed_photo/Report.jpg,42 Hobson St  Brighton  MA  02135,11.0,04,9.0,D14,Allston / Brighton,15.0,Ward 22,2207,R2,42 Hobson St,2135.0,Address,74402.0,42.354,-71.1622,City Worker App,"(42.354, -71.1622)",-7921739.867729092,5214155.315309461
624240,101000384345,02/14/2012 03:11:59 PM,02/16/2012 03:11:59 PM,02/15/2012 08:49:32 AM,ONTIME,Closed,Case Closed Case Resolved  picked up,Missed Recycling: District 10B,Public Works Department,Sanitation,Missed Trash/Recycling/Yard Waste/Bulk Item,PWDx_Missed Trash\Recycling\Yard Waste\Bulk Item,PWDx,,,691 Massachusetts Ave  Roxbury  MA  02118,7.0,10B,2.0,D4,Roxbury,6.0,Ward 8,0802,CL,691 Massachusetts Ave,2118.0,Address,92600.0,42.3594,-71.0587,Constituent Call,"(0, 0)",-7910218.300431989,5214968.784796895
875317,101001969004,12/12/2016 04:06:36 PM,12/15/2016 04:06:35 PM,12/12/2016 05:29:36 PM,ONTIME,Closed,Case Closed. Closed date : 2016-12-12 17:29:36.423 Case Noted property cited,Poor Conditions of Property,Public Works Department,Code Enforcement,Poor Conditions of Property,PWDx_Code Enforcement,PWDx,https://mayors24.cityofboston.gov/media/boston/report/photos/584f115704859247212f7a9f/photo_20161212_160441.jpg,https://cityworker.cityofboston.gov:8443/attachments/report/584f11d2d0521e12073db8a1/closed_photo/Report.jpg,17 Linden St  Allston  MA  02134,11.0,04,9.0,D14,Allston / Brighton,15.0,Ward 21,2104,R3,17 Linden St,2134.0,Address,86416.0,42.3552,-71.131,Citizens Connect App,"(42.3552, -71.131)",-7918266.699616342,5214336.080265994
467679,101001424157,07/07/2015 07:23:30 AM,07/08/2015 08:30:00 AM,07/07/2015 11:32:46 AM,ONTIME,Closed,Case Closed. Closed date : 2015-07-07 11:32:46.767 Case Noted TV picked up,CE Collection,Public Works Department,Street Cleaning,CE Collection,PWDx_District 1C: Downtown,PWDx,https://cityworker.cityofboston.gov:8443/attachments/report/559bb6d2d0528e43ce38f227/photo/Report.jpg,,1 City Hall Plz  Boston  MA  02108,3.0,1B,1.0,A1,Downtown / Financial District,3.0,Ward 3,0306,E,1 City Hall Plz,2108.0,Address,340817.0,42.3594,-71.0587,City Worker App,"(0, 0)",-7910218.300431989,5214968.784796895
336481,101001681973,12/26/2015 08:38:42 AM,12/29/2015 08:30:00 AM,12/26/2015 09:16:26 AM,ONTIME,Closed,Case Closed. Closed date : 2015-12-26 09:16:26.76 Case Resolved Trash bags picked up,CE Collection,Public Works Department,Street Cleaning,CE Collection,PWDx_District 1B: North End,PWDx,https://cityworker.cityofboston.gov:8443/attachments/report/567e986070b480b2278e3d02/photo/Report.jpg,https://cityworker.cityofboston.gov:8443/attachments/report/567e986070b480b2278e3d02/closed_photo/Report.jpg,18 Pinckney St  Boston  MA  02108,3.0,1B,8.0,A1,Beacon Hill,14.0,Ward 5,0503,R4,18 Pinckney St,2108.0,Address,293800.0,42.3588,-71.0659,City Worker App,"(42.3588, -71.0659)",-7911019.800765701,5214878.395846266
129364,101001207920,10/30/2014 10:05:55 AM,10/31/2014 10:05:55 AM,10/30/2014 11:36:26 AM,ONTIME,Closed,Case Closed Case Resolved emptied,Empty Litter Basket,Public Works Department,Highway Maintenance,Empty Litter Basket,PWDx_Empty Litter Basket,PWDx,https://mayors24.cityofboston.gov/media/boston/report/photos/545245b469635788b66a7fc3/report.jpg,https://cityworker.cityofboston.gov:8443/attachments/report/545245ddd052264dec562886/closed_photo/Report.jpg,INTERSECTION of Arlington St & Isabella St  Boston  MA,4.0,1C,2.0,A1,Back Bay,6.0,Ward 5,0501,,INTERSECTION Arlington St & Isabella St,,Intersection,589.0,42.3487,-71.0694,Citizens Connect App,"(42.3487, -71.0694)",-7911409.418983476,5213356.978033894
986,101000450908,07/17/2012 12:18:19 PM,07/24/2012 12:18:19 PM,09/12/2012 07:31:26 AM,OVERDUE,Closed,Case Closed NOVIO: No Violation Found/No Cause,Exceeding Terms of Permit,Inspectional Services,Building,Exceeding Terms of Permit,ISD_Building (INTERNAL),ISD,,,20 Zamora St  Jamaica Plain  MA  02130,9.0,02,6.0,E13,Jamaica Plain,11.0,10,1009,R1,20 Zamora St,2130.0,Address,153323.0,42.3594,-71.0587,Constituent Call,"(0, 0)",-7910218.300431989,5214968.784796895
926286,101002012752,02/14/2017 10:25:00 AM,02/15/2017 10:25:04 AM,02/14/2017 11:54:35 AM,ONTIME,Closed,Case Closed. Closed date : 2017-02-14 11:54:35.65 Case Resolved Cited for ice on sidewalk,Parking Enforcement,Transportation - Traffic Division,Enforcement & Abandoned Vehicles,Parking Enforcement,PWDx_Code Enforcement,PWDx,,,96 G St  South Boston  MA  02127,6.0,05,2.0,C6,South Boston / South Boston Waterfront,5.0,Ward 7,0703,CM,96 G St,2127.0,Address,61700.0,42.3326,-71.044,Citizens Connect App,"(42.3326, -71.044)",-7908581.9039173275,5210932.252986141
164028,101000734558,01/10/2013 09:08:14 AM,,01/10/2013 09:08:14 AM,ONTIME,Closed,Case Closed Internal Case Performed by Highway Maintenance crew.,Pothole Repair (Internal),Public Works Department,Highway Maintenance,Pothole Repair (Internal),PWDx_District 06: West Roxbury and Roslindale,PWDx,,,INTERSECTION of Birchwood St & Washington St  West Roxbury  MA,12.0,06,6.0,E5,West Roxbury,12.0,Ward 20,2015,,INTERSECTION Birchwood St & Washington St,,Intersection,1446.0,42.2594,-71.1594,Employee Generated,"(42.2594, -71.1594)",-7921428.173154872,5199915.854857571
830233,101001718290,02/16/2016 09:02:58 PM,03/04/2016 08:30:00 AM,02/17/2016 07:12:20 AM,ONTIME,Closed,Case Closed. Closed date : 2016-02-17 07:12:20.627 Duplicate of Existing Case 101001717677,Abandoned Vehicles,Transportation - Traffic Division,Enforcement & Abandoned Vehicles,Abandoned Vehicles,BTDT_AVRS Interface Queue,BTDT,,,23 East St  Boston  MA  02111,4.0,1C,2.0,A1,Downtown / Financial District,4.0,Ward 3,0308,C,23 East St,2111.0,Address,359428.0,42.3512,-71.0566,Citizens Connect App,"(42.3512, -71.0566)",-7909984.529501323,5213733.543832747
804931,101001421784,07/01/2015 08:44:46 PM,07/03/2015 08:30:00 AM,07/02/2015 03:03:33 AM,ONTIME,Closed,Case Closed. Closed date : 2015-07-02 03:03:33.257 Case Resolved clear,Parking Enforcement,Transportation - Traffic Division,Enforcement & Abandoned Vehicles,Parking Enforcement,BTDT_Parking Enforcement,BTDT,,,INTERSECTION of Atlantic Ave & Richmond St  Boston  MA,3.0,1B,1.0,A1,Downtown / Financial District,3.0,Ward 3,0301,,INTERSECTION Atlantic Ave & Richmond St,,Intersection,736.0,42.3617,-71.05199999999999,Self Service,"(42.3617, -71.052)",-7909472.459843673,5215315.283770158
853631,101001938395,10/25/2016 09:14:48 AM,10/26/2016 09:14:48 AM,10/25/2016 11:33:46 AM,ONTIME,Closed,Case Closed. Closed date : 2016-10-25 11:33:46.483 Case Resolved Delivered,Sticker Request,Public Works Department,Recycling,Sticker Request,PWDx_Sticker Request,PWDx,,,29 Robken Rd  Roslindale  MA  02131,9.0,06,5.0,E5,Roslindale,10.0,Ward 20,2001,R1,29 Robken Rd,2131.0,Address,117520.0,42.2938,-71.1343,Self Service,"(42.2938, -71.1343)",-7918634.05393596,5205091.365222931
441377,101000401525,03/28/2012 02:24:43 PM,03/28/2013 02:24:43 PM,11/11/2015 03:39:21 PM,OVERDUE,Closed,Case Closed. Closed date : 2015-11-11 15:39:21.717 Case Noted This location has been inspected and no damage was noted.    If you have any further questions  or feel that this case was closed  or reallocated in error  please do not hesitate to contact me.    Michael Somers  Senior Civil Engineer  Construction Management Division  Boston Public Works  617-635-3831	  Michael.Somers@Boston.gov,Sidewalk Repair,Public Works Department,Highway Maintenance,Sidewalk Repair,PWDx_Sidewalk Repair,PWDx,,,196 Commonwealth Ave  Boston  MA  02116,4.0,1C,8.0,D4,Back Bay,14.0,Ward 5,0508,R1,196 Commonwealth Ave,2116.0,Address,39106.0,42.3508,-71.0804,Constituent Call,"(42.3508, -71.0804)",-7912633.933382202,5213673.292298458
171504,101000359339,12/01/2011 12:42:57 PM,12/15/2011 12:42:56 PM,12/22/2011 09:48:38 AM,OVERDUE,Closed,Case Closed Case Resolved completed,Street Light Outages,Public Works Department,Street Lights,Street Light Outages,PWDx_Street Light_Pending_Contractor (Internal),PWDx,,,32 Prairie St  Mattapan  MA  02126,8.0,07,5.0,B3,Greater Mattapan,9.0,Ward 18,1803,R1,32 Prairie St,2126.0,Address,112485.0,42.2804,-71.0995,Employee Generated,"(42.2804, -71.0995)",-7914760.135656356,5203074.98746681
462676,101001764180,04/08/2016 02:56:00 PM,04/08/2017 02:56:36 PM,05/27/2016 07:41:24 AM,ONTIME,Closed,Case Closed. Closed date : 2016-05-27 07:41:24.073 Case Resolved The tree was pruned by Northern Tree Service  to the City of Boston tree pruning specifications.,Tree Maintenance Requests,Parks & Recreation Department,Trees,Tree Maintenance Requests,PARK_Tree Maintenance Request,PARK,https://mayors24.cityofboston.gov/media/boston/report/photos/5707fee20485c52e7782bada/photo_20160408_145509.jpg,,19 Monsignor Patrick J Lydon Way  Dorchester  MA  02124,8.0,07,3.0,C11,Dorchester,7.0,16,1606,R3,19 Monsignor Patrick J Lydon Way,2124.0,Address,99251.0,42.2881,-71.0628,Citizens Connect App,"(42.2881, -71.0628)",-7910674.710344241,5204233.5998765845
326172,101000429245,05/30/2012 09:25:02 AM,06/27/2012 09:25:01 AM,06/01/2012 10:02:09 AM,ONTIME,Closed,Case Closed Case Resolved not at location 5/31.,Abandoned Vehicles,Transportation - Traffic Division,Enforcement & Abandoned Vehicles,Abandoned Vehicles,BTDT_AVRS Interface Queue,BTDT,,,INTERSECTION of Ferndale St & Norfolk St  Dorchester  MA,8.0,07,4.0,B3,Dorchester,9.0,Ward 17,1705,,INTERSECTION Ferndale St & Norfolk St,,Intersection,4887.0,42.2882,-71.0771,Employee Generated,"(42.2882, -71.0771)",-7912266.579062585,5204248.647722506
918959,101002002999,02/04/2017 07:34:00 PM,02/07/2017 08:30:00 AM,02/05/2017 08:28:25 AM,ONTIME,Closed,Case Closed. Closed date : 2017-02-05 08:28:25.257 Case Resolved Trash removed,Empty Litter Basket,Public Works Department,Highway Maintenance,Empty Litter Basket,PWDx_Administration,PWDx,https://mayors24.cityofboston.gov/media/boston/report/photos/589673130485807683d2378f/report.jpg,,INTERSECTION of Meridian St & London St  East Boston  MA,1.0,09,1.0,A7,East Boston,1.0,1,0104,,INTERSECTION Meridian St & London St,,Intersection,17251.0,42.3594,-71.0587,Citizens Connect App,"(0, 0)",-7910218.300431989,5214968.784796895
220006,101001900412,09/05/2016 11:15:46 AM,09/07/2016 08:30:00 AM,09/05/2016 11:49:00 AM,ONTIME,Closed,Case Closed. Closed date : 2016-09-05 11:49:00.5 Case Resolved,Requests for Street Cleaning,Public Works Department,Street Cleaning,Requests for Street Cleaning,PWDx_District 1A: Charlestown,PWDx,https://mayors24.cityofboston.gov/media/boston/report/photos/57cd8c1a048541918da8088c/report.jpg,,INTERSECTION of Salem Hill Ct & Pearl St  Charlestown  MA,3.0,1A,1.0,A15,Charlestown,2.0,2,0205,,INTERSECTION Salem Hill Ct & Pearl St,,Intersection,12877.0,42.3594,-71.0587,Citizens Connect App,"(0, 0)",-7910218.300431989,5214968.784796895
806005,101000355603,11/18/2011 03:52:11 PM,11/22/2011 03:52:11 PM,11/21/2011 08:04:56 AM,ONTIME,Closed,Case Closed Case Noted  NOTHING OUT AT THIS LOCATION 11/21/11  8AM,Missed Trash: District 08,Public Works Department,Sanitation,Missed Trash/Recycling/Yard Waste/Bulk Item,PWDx_Missed Trash\Recycling\Yard Waste\Bulk Item,PWDx,,,60 Wood Ave  Mattapan  MA  02126,8.0,08,5.0,E18,Hyde Park,10.0,Ward 18,1806,R1,60 Wood Ave,2126.0,Address,151303.0,42.2724,-71.1101,Constituent Call,"(42.2724, -71.1101)",-7915940.122258764,5201871.384270278
86993,101001784390,05/07/2016 11:28:00 AM,,05/10/2016 04:33:11 PM,ONTIME,Closed,Case Closed. Closed date : 2016-05-10 16:33:11.55 Bulk Item Automation,Schedule a Bulk Item Pickup,Public Works Department,Sanitation,Schedule a Bulk Item Pickup,PWDx_Schedule a Bulk Item Pickup,PWDx,,,9 Brinsley St  Dorchester  MA  02121,7.0,03,4.0,C11,Roxbury,8.0,Ward 14,1404,R2,9 Brinsley St,2121.0,Address,20438.0,42.3047,-71.0786,Constituent Call,"(42.3047, -71.0786)",-7912433.558298774,5206731.869537142
420956,101000342084,10/13/2011 08:12:48 PM,10/18/2011 08:30:00 AM,10/18/2011 09:58:34 AM,OVERDUE,Closed,Case Closed Case Referred to External Agency State jurisdiction.  Details forwarded.,Request for Pothole Repair,Public Works Department,Highway Maintenance,Request for Pothole Repair,PWDx_District 03: North Dorchester,PWDx,,,875 Columbia Rd  Dorchester  MA  02125,7.0,03,3.0,C11,Dorchester,7.0,Ward 13,1310,E,875 Columbia Rd,2125.0,Address,35448.0,42.3206,-71.0524,Citizens Connect App,"(42.3206, -71.0524)",-7909516.987639992,5209125.40819576
102128,101000741449,01/24/2013 08:10:56 AM,02/23/2013 08:10:56 AM,01/31/2013 08:31:26 AM,ONTIME,Closed,Case Closed :,Heat - Excessive  Insufficient,Inspectional Services,Housing,Heat - Excessive  Insufficient,ISD_Housing (INTERNAL),ISD,,,,,,,,,,,,,,,,,42.3594,-71.0587,Constituent Call,"(0, 0)",-7910218.300431989,5214968.784796895
641052,101001031728,02/20/2014 11:50:30 AM,02/24/2014 11:50:30 AM,02/21/2014 10:32:07 AM,ONTIME,Closed,Case Closed Case Resolved patched by dist. 4 crew,Request for Pothole Repair,Public Works Department,Highway Maintenance,Request for Pothole Repair,PWDx_District 04: Allston/Brighton,PWDx,,,35 Chiswick Rd  Brighton  MA  02135,11.0,04,9.0,D14,Allston / Brighton,15.0,Ward 21,2115,CM,35 Chiswick Rd,2135.0,Address,32434.0,42.3386,-71.1503,Constituent Call,"(42.3386, -71.1503)",-7920415.165788653,5211835.80465565
547575,101000919529,09/05/2013 01:53:56 PM,,09/12/2013 09:51:19 PM,ONTIME,Closed,Case Closed Bulk Item Automation,Schedule a Bulk Item Pickup,Public Works Department,Sanitation,Schedule a Bulk Item Pickup,PWDx_Schedule a Bulk Item Pickup,PWDx,,,9 Ashford St  Allston  MA  02134,11.0,04,9.0,D14,Allston / Brighton,15.0,Ward 21,2104,R2,9 Ashford St,2134.0,Address,5189.0,42.3541,-71.1295,Constituent Call,"(42.3541, -71.1295)",-7918099.720380152,5214170.378924012
650267,101000323474,09/01/2011 09:45:35 AM,02/27/2013 09:45:34 AM,09/06/2011 03:42:43 PM,ONTIME,Closed,Case Closed Case Resolved City Tree debris was cleared from the roadway by Northern Tree Service.,Tree Maintenance Requests,Parks & Recreation Department,Trees,Tree Maintenance Requests,PARK_Tree Emergencies,PARK,,,119 Bartlett St  Charlestown  MA  02129,3.0,1A,1.0,A15,Charlestown,2.0,Ward 2,0206,R1,119 Bartlett St,2129.0,Address,8421.0,42.3793,-71.0663,Constituent Call,"(42.3793, -71.0663)",-7911064.328562017,5217967.174180252
74489,101001134833,07/22/2014 03:54:00 PM,,07/24/2014 04:40:48 PM,ONTIME,Closed,Case Closed Bulk Item Automation,Schedule a Bulk Item Pickup,Public Works Department,Sanitation,Schedule a Bulk Item Pickup,PWDx_Schedule a Bulk Item Pickup,PWDx,,,26 Osceola St  Mattapan  MA  02126,8.0,08,5.0,E18,Hyde Park,9.0,Ward 18,1805,R2,26 Osceola St,2126.0,Address,287910.0,42.2623,-71.1024,Constituent Call,"(42.2623, -71.1024)",-7915082.962179655,5200352.053399772
531460,101000296100,07/02/2011 11:59:39 AM,10/30/2011 11:59:38 AM,07/05/2011 09:26:28 AM,ONTIME,Closed,Case Closed ADCLSD: Administratively Closed,Unsatisfactory Living Conditions,Inspectional Services,Housing,Unsatisfactory Living Conditions,ISD_Housing (INTERNAL),ISD,,,594 Cambridge St  Allston  MA  02134,11.0,04,9.0,D14,Allston / Brighton,15.0,Ward 21,2106,R3,594 Cambridge St,2134.0,Address,200997.0,42.3518,-71.1415,Constituent Call,"(42.3518, -71.1415)",-7919435.5542696705,5213823.921853131
261938,101001062793,04/07/2014 03:46:33 PM,04/14/2014 03:46:32 PM,04/09/2014 08:29:28 AM,ONTIME,Closed,Case Closed ADCLSD: Administratively Closed,Zoning,Inspectional Services,Building,Zoning,ISD_Building (INTERNAL),ISD,,,710 Gallivan Blvd  Dorchester  MA  02122,8.0,07,3.0,C11,Dorchester,7.0,16,1609,C,710 Gallivan Blvd,2122.0,Address,62394.0,42.284,-71.0481,Constituent Call,"(42.284, -71.0481)",-7909038.31382958,5203616.658759921
503447,101001379623,05/18/2015 10:43:00 AM,05/19/2015 10:43:58 AM,05/19/2015 07:23:44 AM,ONTIME,Closed,Case Closed. Closed date : 2015-05-19 07:23:44.88 Case Noted Stickers delivered at 7:23 a.m. on 5/19/15. Left in mailslot.,Sticker Request,Public Works Department,Recycling,Sticker Request,PWDx_Sticker Request,PWDx,,,129 Draper St  Dorchester  MA  02122,7.0,03,3.0,C11,Dorchester,8.0,Ward 15,1507,R2,129 Draper St,2122.0,Address,226211.0,42.3059,-71.0655,Constituent Call,"(42.3059, -71.0655)",-7910975.272969383,5206912.492871123
554086,101001921390,09/30/2016 12:09:00 PM,10/03/2016 12:09:07 PM,10/03/2016 03:05:27 PM,OVERDUE,Closed,Case Closed. Closed date : 2016-10-03 15:05:27.603 Case Resolved we went and checked this out all clean and this doea not belong to BPW it belongs to DOT.  23-5 RUBBISH DISPOSAL.   The owner or person in control of any premises within the City shall at all times maintain the sidewal ks   alleys  streets  and places adjoining the premises free of trash  refuse  rubbish  or debris; provided  however  that this subsection shall not prohibit the storage of litter in the manner and at the times prescribed by the Commissioner of Public Works for purposes of collection.,Requests for Street Cleaning,Public Works Department,Street Cleaning,Requests for Street Cleaning,PWDx_District 09: East Boston,PWDx,,https://cityworker.cityofboston.gov:8443/attachments/report/57ee8e6bd052905713a27287/closed_photo/Report.jpg,175 William F McClellan Hwy  East Boston  MA  02128,1.0,09,1.0,A7,East Boston,1.0,01,0111,,175 William F McClellan Hwy,2128.0,Address,351843.0,42.3859,-71.0172,Constituent Call,"(42.3859, -71.0172)",-7905598.541564069,5218961.824705703
910112,101001995488,01/24/2017 12:53:20 PM,02/07/2017 12:53:20 PM,01/24/2017 01:35:46 PM,ONTIME,Closed,Case Closed. Closed date : 2017-01-24 13:35:46.657 Case Noted Duplicate of a previously submitted crm; work order for replacement has been issued,Sign Repair,Transportation - Traffic Division,Signs & Signals,Sign Repair,BTDT_District 06,BTDT,,,INTERSECTION of Sullivan Sq & Rutherford Ave  Charlestown  MA,3.0,1A,1.0,A15,Charlestown,2.0,2,0207,,INTERSECTION Sullivan Sq & Rutherford Ave,,Intersection,17125.0,42.3594,-71.0587,Citizens Connect App,"(0, 0)",-7910218.300431989,5214968.784796895
521977,101001054246,03/25/2014 06:24:58 PM,,03/27/2014 04:39:19 PM,ONTIME,Closed,Case Closed Bulk Item Automation,Schedule Bulk Item Pickup,Public Works Department,Sanitation,Schedule a Bulk Item Pickup SS,PWDx_Schedule a Bulk Item Pickup,PWDx,,,257 Metropolitan Ave  Roslindale  MA  02131,12.0,06,5.0,E5,Roslindale,10.0,Ward 18,1810,R1,257 Metropolitan Ave,2131.0,Address,94850.0,42.2761,-71.1262,Self Service,"(42.2761, -71.1262)",-7917732.3660605345,5202428.031757262
701637,101001632310,11/10/2015 01:13:00 PM,11/19/2015 01:13:00 PM,11/17/2015 09:51:26 AM,ONTIME,Closed,Case Closed. Closed date : 2015-11-17 09:51:26.597 Case Resolved Location has been made safe. This sidewalk will be referred for permanent repair. See case #101001636634 for status of the permanent repair.,Sidewalk Repair (Make Safe),Public Works Department,Highway Maintenance,Sidewalk Repair (Make Safe),PWDx_District 07: South Dorchester,PWDx,,,82 Callender St  Dorchester  MA  02124,8.0,07,4.0,B3,Greater Mattapan,9.0,Ward 14,1410,R2,82 Callender St,2124.0,Address,24868.0,42.2884,-71.0821,Constituent Call,"(42.2884, -71.0821)",-7912823.1765165515,5204278.743486012
404176,101001299222,02/16/2015 05:25:44 PM,02/19/2015 08:30:00 AM,04/14/2015 08:10:18 AM,OVERDUE,Closed,Case Closed Case Noted,Request for Snow Plowing,Public Works Department,Street Cleaning,Request for Snow Plowing,PWDx_District 04: Allston/Brighton,PWDx,,,1992 Commonwealth Ave  Brighton  MA  02135,11.0,04,9.0,D14,Allston / Brighton,15.0,Ward 21,2116,CD,1992 Commonwealth Ave,2135.0,Address,39159.0,42.3394,-71.158,Citizens Connect App,"(42.3394, -71.158)",-7921272.325867761,5211956.28472526
397642,101000905000,08/19/2013 11:48:04 AM,08/09/2015 11:48:03 AM,01/15/2014 02:46:10 PM,ONTIME,Closed,Case Closed Case Resolved The New Tree was planted by Leahy Landscaping and is under Warrantee until the fall of 2016.,New Tree Requests,Parks & Recreation Department,Trees,New Tree Requests,PARK_New Tree Requests,PARK,,,1197 Commonwealth Ave  Allston  MA  02134,11.0,04,9.0,D14,Allston / Brighton,14.0,Ward 21,2103,A,1197 Commonwealth Ave,2134.0,Address,213806.0,42.351000000000006,-71.1296,Employee Generated,"(42.351, -71.1296)",-7918110.852329232,5213703.418017676
216149,101001520740,08/13/2015 05:08:00 PM,08/17/2015 08:30:00 AM,08/18/2015 06:43:34 AM,OVERDUE,Closed,Case Closed. Closed date : 2015-08-18 06:43:34.51 Case Noted Leaves collected on 8/18/15.,Missed Leaf or Yard Trash: District 03,Public Works Department,Sanitation,Missed Trash/Recycling/Yard Waste/Bulk Item,PWDx_Missed Trash\Recycling\Yard Waste\Bulk Item,PWDx,,https://cityworker.cityofboston.gov:8443/attachments/report/55cd0c38d052094b3592acb9/closed_photo/Report.jpg,5 Chamblet St  Dorchester  MA  02125,7.0,03,7.0,B2,Roxbury,13.0,Ward 13,1304,R2,5 Chamblet St,2125.0,Address,28566.0,42.3159,-71.0717,Constituent Call,"(42.3159, -71.0717)",-7911665.453812302,5208417.82123462
201277,101000856557,06/10/2013 10:30:00 AM,06/24/2013 10:29:59 AM,06/20/2013 02:00:18 PM,ONTIME,Closed,Case Closed Case Resolved Work completed 6/20/13.,Sign Repair,Transportation - Traffic Division,Signs & Signals,Sign Repair,BTDT_Sign Shop_Sign Installation,BTDT,,,INTERSECTION of Dale St & Mills St  Roxbury  MA,9.0,10B,7.0,B2,Roxbury,13.0,Ward 12,1203,,INTERSECTION Dale St & Mills St,,Intersection,3851.0,42.3207,-71.0836,Constituent Call,"(42.3207, -71.0836)",-7912990.155752742,5209140.463811702
548267,101001002490,01/10/2014 02:51:38 PM,01/14/2014 02:51:38 PM,,OVERDUE,Open,,Food Alert - Unconfirmed,Inspectional Services,Health,Food Alert - Unconfirmed,ISD_Health (INTERNAL),ISD,,,516 Gallivan Blvd  Dorchester  MA  02122,8.0,07,3.0,C11,Dorchester,7.0,Ward 16,1609,C,516 Gallivan Blvd,2122.0,Address,156552.0,42.2829,-71.0556,Constituent Call,"(42.2829, -71.0556)",-7909873.2100105295,5203451.144803386
710763,101000871031,07/01/2013 12:25:54 PM,09/02/2013 12:25:54 PM,07/01/2013 01:45:11 PM,ONTIME,Closed,Case Closed Case Resolved removed poster and painted control box,PWD Graffiti,Public Works Department,Highway Maintenance,PWD Graffiti,PWDx_District 03: North Dorchester,PWDx,,,INTERSECTION of Blue Hill Ave & Columbia Rd  Dorchester  MA,7.0,03,4.0,B2,Greater Mattapan,13.0,Ward 14,1403,,INTERSECTION Blue Hill Ave & Columbia Rd,,Intersection,1561.0,42.3035,-71.0851,City Worker App,"(42.3035, -71.0851)",-7913157.13498893,5206551.249645931
766227,101000409747,04/18/2012 12:50:23 PM,06/02/2012 12:50:23 PM,04/20/2012 12:29:07 PM,ONTIME,Closed,Case Closed Case Resolved pulled new wire from pb on bay street to pb on aukland st  spliced both pb's  spliced cable at pole door  secured overhead cable,General Lighting Request,Public Works Department,Street Lights,General Lighting Request,PWDx_Street Light_General Lighting Request,PWDx,,,INTERSECTION of Auckland St & Bay St  Dorchester  MA,7.0,03,3.0,C11,Dorchester,8.0,Ward 15,1506,,INTERSECTION Auckland St & Bay St,,Intersection,764.0,42.3112,-71.0566,Maximo Integration,"(42.3112, -71.0566)",-7909984.529501323,5207710.287116657
688875,101000801083,03/10/2013 05:47:42 PM,03/13/2013 08:30:00 AM,03/15/2013 12:24:28 PM,OVERDUE,Closed,Case Closed Case Referred to External Agency DCR jurisdiction.  Details forwarded,Sidewalk Repair (Make Safe),Public Works Department,Highway Maintenance,Sidewalk Repair (Make Safe),INFO_Reallocation From Dept,INFO,,,440 Park Dr  Boston  MA  02215,4.0,10A,8.0,D4,Fenway / Kenmore / Audubon Circle / Longwood,14.0,04,0410,,440 Park Dr,2215.0,Address,342051.0,42.3449,-71.1045,Citizens Connect App,"(42.3449, -71.1045)",-7915316.733110321,5212784.626701254
789681,101000405884,04/09/2012 07:37:12 AM,,04/12/2012 09:44:12 PM,ONTIME,Closed,Case Closed Bulk Item Automation,Schedule a Bulk Item Pickup,Public Works Department,Sanitation,Schedule a Bulk Item Pickup,PWDx_Schedule a Bulk Item Pickup,PWDx,,,52 Sawyer Ave  Dorchester  MA  02125,7.0,03,3.0,C11,Dorchester,7.0,Ward 13,1309,R2,52 Sawyer Ave,2125.0,Address,306859.0,42.3119,-71.0607,Self Service,"(42.3119, -71.0607)",-7910440.939413575,5207815.66118993
782994,101001412574,06/18/2015 01:15:00 PM,07/02/2015 01:15:00 PM,06/19/2015 09:14:03 AM,ONTIME,Closed,Case Closed. Closed date : 2015-06-19 09:14:03.42 Case Resolved CLEANED GLOBE AND REPLACED MANTLES  D.WEBB / J.PETERSON,PRINTED,Public Works Department,Street Lights,Street Light Outages,PWDx_Street Light Outages,PWDx,,,3 Essex St  Charlestown  MA  02129,3.0,1A,1.0,A15,Charlestown,2.0,02,0206,,3 Essex St,2129.0,Address,355212.0,42.3791,-71.0691,Employee Generated,"(42.3791, -71.0691)",-7911376.0231362395,5217937.0348873595
567758,101000932507,09/23/2013 12:36:41 PM,09/25/2013 12:36:41 PM,09/23/2013 01:27:09 PM,ONTIME,Closed,Case Closed Case Resolved Delivered (MD).,Sticker Request,Public Works Department,Recycling,Sticker Request,PWDx_Sticker Request,PWDx,,,846-848 E Broadway  South Boston  MA  02127,6.0,05,2.0,C6,South Boston / South Boston Waterfront,5.0,Ward 6,0607,R2,846-848 E Broadway,2127.0,Address,21258.0,42.3359,-71.0305,Constituent Call,"(42.3359, -71.0305)",-7907079.090791618,5211429.195736468
184855,101000828815,04/26/2013 10:17:26 PM,04/30/2013 08:30:00 AM,04/27/2013 07:12:44 AM,ONTIME,Closed,Case Closed Case Resolved,Traffic Signal Repair,Transportation - Traffic Division,Signs & Signals,Traffic Signal Repair,BTDT_Traffic Signal_Repair,BTDT,,,INTERSECTION of Dearborn St & Dudley St  Roxbury  MA,7.0,10B,7.0,B2,Roxbury,13.0,Ward 8,0804,,INTERSECTION Dearborn St & Dudley St,,Intersection,3961.0,42.3286,-71.0793,Constituent Call,"(42.3286, -71.0793)",-7912511.48194233,5210329.93309235
418528,101000736486,01/14/2013 09:19:58 AM,01/16/2013 09:19:58 AM,01/14/2013 09:52:08 AM,ONTIME,Closed,Case Closed Case Noted  duplicates to case 736480,Sidewalk Repair (Make Safe),Public Works Department,Highway Maintenance,Sidewalk Repair (Make Safe),PWDx_District 08: Hyde Park,PWDx,,,INTERSECTION of Caton St & Hollingsworth St  Mattapan  MA,8.0,08,5.0,E18,Hyde Park,9.0,Ward 18,1805,,INTERSECTION Caton St & Hollingsworth St,,Intersection,2514.0,42.2659,-71.1015,City Worker App,"(42.2659, -71.1015)",-7914982.774637941,5200893.569157746
940751,101002025793,02/26/2017 07:05:32 PM,02/28/2017 08:30:00 AM,02/28/2017 07:57:25 AM,ONTIME,Closed,Case Closed. Closed date : 2017-02-28 07:57:25.053 Case Noted,Parking Enforcement,Transportation - Traffic Division,Enforcement & Abandoned Vehicles,Parking Enforcement,BTDT_Parking Enforcement,BTDT,https://mayors24.cityofboston.gov/media/boston/report/photos/58b36d4f0485bf1c6616e43e/report.jpg,,26 Navarre St  Roslindale  MA  02131,12.0,08,5.0,E18,Roslindale,10.0,Ward 18,1808,R1,26 Navarre St,2131.0,Address,100411.0,42.278,-71.1175,Citizens Connect App,"(42.278, -71.1175)",-7916763.886490634,5202713.890464305
418738,101001939839,10/27/2016 08:11:18 AM,10/28/2016 08:30:00 AM,10/27/2016 01:44:44 PM,ONTIME,Closed,Case Closed. Closed date : 2016-10-27 13:44:44.87 Case Resolved Hand crew swept area,Requests for Street Cleaning,Public Works Department,Street Cleaning,Requests for Street Cleaning,PWDx_District 1B: North End,PWDx,https://mayors24.cityofboston.gov/media/boston/report/photos/5811eee304855157e6c6a067/report.jpg,,INTERSECTION of Causeway St & Friend St  Boston  MA,3.0,1B,2.0,A1,Downtown / Financial District,3.0,3,0306,,INTERSECTION Causeway St & Friend St,,Intersection,16457.0,42.3594,-71.0587,Citizens Connect App,"(0, 0)",-7910218.300431989,5214968.784796895
896909,101001978841,12/30/2016 10:49:37 AM,,01/04/2017 04:31:23 PM,ONTIME,Closed,Case Closed. Closed date : 2017-01-04 16:31:23.717 Bulk Item Automation,Schedule Bulk Item Pickup,Public Works Department,Sanitation,Schedule a Bulk Item Pickup SS,PWDx_Schedule a Bulk Item Pickup,PWDx,,,20 Violet St  Mattapan  MA  02126,8.0,07,4.0,B3,Greater Mattapan,9.0,Ward 18,1802,R1,20 Violet St,2126.0,Address,140866.0,42.2742,-71.0897,Self Service,"(42.2742, -71.0897)",-7913669.204646579,5202142.181668485
170404,101001802214,05/30/2016 11:45:00 AM,06/29/2016 11:45:47 AM,05/30/2016 12:10:50 PM,ONTIME,Closed,Case Closed. Closed date : 2016-05-30 12:10:50.523 Case Resolved caller cancelled the call,Heat - Excessive  Insufficient,Inspectional Services,Housing,Heat - Excessive  Insufficient,ISD_Housing (INTERNAL),ISD,,,30 Wallingford Rd  Brighton  MA  02135,11.0,04,9.0,D14,Allston / Brighton,15.0,21,2113,EA,30 Wallingford Rd,2135.0,Address,326748.0,42.3422,-71.152,Constituent Call,"(42.3422, -71.152)",-7920604.408923001,5212377.977040319
711757,101001003980,01/13/2014 12:31:10 PM,01/13/2016 12:31:00 PM,08/25/2014 12:39:45 PM,ONTIME,Closed,Case Closed Case Resolved Sidewalk repaired 07/2014    If you have any further questions  or feel that this case was closed in error  please do not hesitate to contact me.    Michael Somers  Senior Civil Engineer  Construction Management Division  Boston Public Works  617-635-3831  Michael.Somers@Boston.gov,Sidewalk Repair/Concrete/Dist 3,Public Works Department,Highway Maintenance,Sidewalk Repair,PWDx_Highway Construction,PWDx,,,172 Boston St  Dorchester  MA  02125,6.0,03,2.0,C6,Dorchester,5.0,Ward 7,0708,R3,172 Boston St,2125.0,Address,17116.0,42.3238,-71.0599,City Worker App,"(42.3238, -71.0599)",-7910351.883820941,5209607.199774586
79520,101001899923,09/04/2016 12:53:00 PM,09/20/2016 08:30:00 AM,09/06/2016 11:11:29 AM,ONTIME,Closed,Case Closed. Closed date : 2016-09-06 11:11:29.22 Case Noted Wrote work order last week tu,Sign Repair,Transportation - Traffic Division,Signs & Signals,Sign Repair,BTDT_District 02,BTDT,,,297 Lamartine St  Jamaica Plain  MA  02130,9.0,02,6.0,E13,Jamaica Plain,11.0,Ward 19,1906,CM,297 Lamartine St,2130.0,Address,396956.0,42.3129,-71.1081,Citizens Connect App,"(42.3129, -71.1081)",-7915717.483277176,5207966.197613264
321455,101000401884,03/29/2012 09:30:50 AM,,04/02/2012 09:44:24 PM,ONTIME,Closed,Case Closed Bulk Item Automation,Schedule a Bulk Item Pickup,Public Works Department,Sanitation,Schedule a Bulk Item Pickup,PWDx_Schedule a Bulk Item Pickup,PWDx,,,30 Lila Rd  Jamaica Plain  MA  02130,9.0,02,6.0,E13,Jamaica Plain,11.0,Ward 19,1902,R1,30 Lila Rd,2130.0,Address,85908.0,42.3046,-71.1298,Self Service,"(42.3046, -71.1298)",-7918133.11622739,5206716.817748051
634324,101000792937,02/27/2013 05:33:57 PM,03/04/2013 08:30:00 AM,02/28/2013 04:45:38 AM,ONTIME,Closed,Case Closed Case Resolved all clear will monitor,Parking Enforcement,Transportation - Traffic Division,Enforcement & Abandoned Vehicles,Parking Enforcement,BTDT_Parking Enforcement,BTDT,,,4 Walnut Ct  Dorchester  MA  02122,8.0,07,3.0,C11,Dorchester,7.0,Ward 16,1610,R1,4 Walnut Ct,2122.0,Address,154915.0,42.288999999999994,-71.0395,Constituent Call,"(42.289, -71.0395)",-7908080.966208758,5204369.031349849
638322,101000467962,08/22/2012 08:37:50 AM,,08/22/2012 08:37:50 AM,ONTIME,Closed,Case Closed Internal Case Performed by Highway Maintenance crew.,Pothole Repair (Internal),Public Works Department,Highway Maintenance,Pothole Repair (Internal),PWDx_District 06: West Roxbury and Roslindale,PWDx,,,45 Charles Park Rd  West Roxbury  MA  02132,12.0,06,6.0,E5,West Roxbury,12.0,Ward 20,2005,C,45 Charles Park Rd,2132.0,Address,29575.0,42.2781,-71.1743,Employee Generated,"(42.2781, -71.1743)",-7923086.833567692,5202728.935898161
809928,101000946071,10/14/2013 10:13:28 AM,10/16/2013 10:13:28 AM,10/15/2013 11:41:37 AM,ONTIME,Closed,Case Closed Case Resolved Two vehicles without stickers over timed and officer will return in two hours to ticket if they are still there,Parking Enforcement,Transportation - Traffic Division,Enforcement & Abandoned Vehicles,Parking Enforcement,BTDT_Parking Enforcement,BTDT,,,INTERSECTION of Bennington St & Harmony St  East Boston  MA,1.0,09,1.0,A7,East Boston,1.0,Ward 1,0111,,INTERSECTION Bennington St & Harmony St,,Intersection,1326.0,42.3818,-71.0205,Constituent Call,"(42.3818, -71.0205)",-7905965.895883686,5218343.923441438
88569,101001212725,11/06/2014 02:05:00 PM,,11/14/2014 04:05:08 PM,ONTIME,Closed,Case Closed Case Resolved Someone took the TV.,Schedule a Bulk Item Pickup,Public Works Department,Sanitation,Schedule a Bulk Item Pickup,PWDx_Schedule a Bulk Item Pickup,PWDx,,,536 Bennington St  East Boston  MA  02128,1.0,09,1.0,A7,East Boston,1.0,Ward 1,0111,R3,536 Bennington St,2128.0,Address,14772.0,42.3823,-71.0199,Constituent Call,"(42.3823, -71.0199)",-7905899.104189211,5218419.275093784
53239,101001772110,04/20/2016 08:50:38 AM,04/21/2016 08:50:34 AM,04/20/2016 09:44:02 AM,ONTIME,Closed,Case Closed Case Noted  This TV has been scheudled for pick up on Friday April 22  2016. Items such as TV  Ac's and refrigerators need to be scheduled for separate pick up. Items must be placed out by trash out before 7am the day of collection or anytime after 5pm the night before. Thanks,Missed Bulk Item Pickup: District 1B,Public Works Department,Sanitation,Missed Trash/Recycling/Yard Waste/Bulk Item,PWDx_Missed Trash\Recycling\Yard Waste\Bulk Item,PWDx,,,2-4 Moon St  Boston  MA  02113,3.0,1B,1.0,A1,Downtown / Financial District,3.0,Ward 3,0303,RC,2-4 Moon St,2113.0,Address,97176.0,42.364,-71.0531,Self Service,"(42.364, -71.0531)",-7909594.911283546,5215661.795427603
261804,101001319296,02/27/2015 02:21:47 PM,06/27/2015 02:21:47 PM,03/14/2015 01:37:19 PM,ONTIME,Closed,Case Closed :,Unsatisfactory Living Conditions,Inspectional Services,Housing,Unsatisfactory Living Conditions,ISD_Housing (INTERNAL),ISD,,,1045 River St  Hyde Park  MA  02136,12.0,08,5.0,E18,Hyde Park,10.0,18,1815,,1045 River St,2136.0,Address,344143.0,42.2597,-71.1174,Constituent Call,"(42.2597, -71.1174)",-7916752.754541554,5199960.977914379
759114,101001319322,02/27/2015 02:39:00 PM,03/02/2015 02:38:59 PM,04/08/2015 04:48:34 PM,OVERDUE,Closed,Case Closed Case Resolved Completed a long time ago.,Requests for Street Cleaning,Public Works Department,Street Cleaning,Requests for Street Cleaning,PWDx_District 1B: North End,PWDx,,,15 Irving St  Boston  MA  02114,3.0,1B,8.0,A1,Beacon Hill,14.0,Ward 5,0504,R4,15 Irving St,2114.0,Address,78911.0,42.3607,-71.0665,Citizens Connect App,"(42.3607, -71.0665)",-7911086.592460177,5215164.630484193
159606,101000384984,02/16/2012 10:16:51 AM,06/15/2012 10:16:51 AM,02/16/2012 10:17:35 AM,ONTIME,Closed,Case Closed :,Unsatisfactory Living Conditions,Inspectional Services,Housing,Unsatisfactory Living Conditions,ISD_Housing (INTERNAL),ISD,,,33 Hamilton St  Dorchester  MA  02125,7.0,03,3.0,C11,Dorchester,8.0,Ward 15,1501,R2,33 Hamilton St,2125.0,Address,68470.0,42.309,-71.0712,Constituent Call,"(42.309, -71.0712)",-7911609.794066905,5207379.1190868225
649990,101001238584,12/27/2014 09:44:36 AM,12/31/2014 08:30:00 AM,12/27/2014 10:18:05 AM,ONTIME,Closed,Case Closed Case Resolved Case resolved. Recycle was collected 12/27,Missed Trash: District 03,Public Works Department,Sanitation,Missed Trash/Recycling/Yard Waste/Bulk Item,PWDx_Missed Trash\Recycling\Yard Waste\Bulk Item,PWDx,,,72 Tuttle St  Dorchester  MA  02125,7.0,03,3.0,C11,Dorchester,7.0,Ward 13,1310,CM,72 Tuttle St,2125.0,Address,138744.0,42.3145,-71.0535,Constituent Call,"(42.3145, -71.0535)",-7909639.439079864,5208207.060865616
233385,101001223989,11/25/2014 07:54:14 PM,11/28/2014 08:30:00 AM,11/26/2014 07:21:11 AM,ONTIME,Closed,Case Closed Case Resolved made safe back to normal operation,Traffic Signal Repair,Transportation - Traffic Division,Signs & Signals,Traffic Signal Repair,BTDT_Traffic Signal_Repair,BTDT,,,INTERSECTION of W Broadway & Dorchester Ave  South Boston  MA,6.0,05,2.0,C6,South Boston / South Boston Waterfront,5.0,Ward 6,0601,,INTERSECTION W Broadway & Dorchester Ave,,Intersection,1992.0,42.343,-71.0572,Constituent Call,"(42.343, -71.0572)",-7910051.321195798,5212498.464008145
56208,101001284478,02/10/2015 01:09:09 AM,02/12/2015 08:30:00 AM,02/12/2015 06:07:20 PM,OVERDUE,Closed,Case Closed Case Noted Snow has been removed.,Request for Snow Plowing,Public Works Department,Street Cleaning,Request for Snow Plowing,PWDx_District 08: Hyde Park,PWDx,,,8 Friendship Rd  Mattapan  MA  02126,8.0,08,5.0,E18,Hyde Park,9.0,Ward 18,1805,R1,8 Friendship Rd,2126.0,Address,61008.0,42.262,-71.1031,Constituent Call,"(42.262, -71.1031)",-7915160.88582321,5200306.928482294
282746,101000889781,07/30/2013 07:59:26 AM,08/13/2013 08:30:00 AM,07/31/2013 08:33:54 AM,ONTIME,Closed,Case Closed Case Resolved Mark Cardarelli called the constituent and informed her that this is a PWD paving contract.    Mark provided her the contractor's name and contract number and also told her to calll the city clerk; to put a claim in using the information that he provided.    Mark Cardarelli  Supervisor of Utility Coordination and Compliance  Boston Public Works Department  617-635-4951 Office,PublicWorks: Complaint,Mayor's 24 Hour Hotline,Employee & General Comments,General Comments For a Program or Policy,PWDx_Contractor Complaints,PWDx,,,,,,,,,,,,,,,,,42.3594,-71.0587,Constituent Call,"(0, 0)",-7910218.300431989,5214968.784796895
657885,101001216891,11/13/2014 04:27:59 PM,,11/14/2014 08:55:22 AM,ONTIME,Closed,Case Closed Case Resolved the leaves were picked up today,Ground Maintenance: Puddingstone Park,Parks & Recreation Department,Park Maintenance & Safety,Ground Maintenance,PARK_Maintenance_Region 2,PARK,,,,,,,,,,,,,,,,,42.3594,-71.0587,Employee Generated,"(0, 0)",-7910218.300431989,5214968.784796895
559566,101001881762,08/12/2016 07:11:00 PM,,08/22/2016 04:30:32 PM,ONTIME,Closed,Case Closed. Closed date : 2016-08-22 16:30:32.133 Bulk Item Automation,Schedule a Bulk Item Pickup,Public Works Department,Sanitation,Schedule a Bulk Item Pickup,PWDx_Schedule a Bulk Item Pickup,PWDx,,,20 Duncklee St  Brighton  MA  02135,11.0,04,9.0,D14,Allston / Brighton,15.0,Ward 22,2211,R2,20 Duncklee St,2135.0,Address,49947.0,42.3541,-71.1568,Constituent Call,"(42.3541, -71.1568)",-7921138.742478809,5214170.378924012
233019,101000740487,01/22/2013 11:07:11 AM,,01/23/2013 09:47:29 PM,ONTIME,Closed,Case Closed Bulk Item Automation,Schedule a Bulk Item Pickup,Public Works Department,Sanitation,Schedule a Bulk Item Pickup,PWDx_Schedule a Bulk Item Pickup,PWDx,,,417 E Eighth St  South Boston  MA  02127,6.0,05,2.0,C6,South Boston / South Boston Waterfront,5.0,Ward 7,0703,R2,417 E Eighth St,2127.0,Address,52151.0,42.3312,-71.0444,Constituent Call,"(42.3312, -71.0444)",-7908626.431713645,5210721.436666247
836144,101000967257,11/18/2013 09:31:50 AM,12/02/2013 09:31:50 AM,11/20/2013 01:53:04 PM,ONTIME,Closed,Case Closed Case Resolved Work completed 11/20/13.,Sign Repair,Transportation - Traffic Division,Signs & Signals,Sign Repair,BTDT_Sign Shop_Sign Installation,BTDT,,,INTERSECTION of Beryl St & Hillock St  Roslindale  MA,12.0,06,5.0,E5,Roslindale,10.0,Ward 20,2002,,INTERSECTION Beryl St & Hillock St,,Intersection,1387.0,42.2836,-71.1394,Citizens Connect App,"(42.2836, -71.1394)",-7919201.783339005,5203556.471532283
343618,101000381143,02/04/2012 07:46:47 PM,02/08/2012 08:30:00 AM,02/06/2012 09:30:20 AM,ONTIME,Closed,Case Closed Case Resolved Completed 02/04/12,Major System Failure,Public Works Department,Street Lights,Major System Failure,PWDx_Major System Failure,PWDx,,,INTERSECTION of Boston St & Howell St  Dorchester  MA,6.0,03,2.0,C6,Dorchester,5.0,Ward 7,0708,,INTERSECTION Boston St & Howell St,,Intersection,1667.0,42.3254,-71.0591,Constituent Call,"(42.3254, -71.0591)",-7910262.828228306,5209848.104753405
839524,101000328148,09/12/2011 01:45:32 PM,09/26/2011 01:45:32 PM,09/12/2011 03:10:15 PM,ONTIME,Closed,Case Closed Duplicate of Existing Case CRM 325389,Street Light Outages,Public Works Department,Street Lights,Street Light Outages,PWDx_Street Light Outages,PWDx,,,80 Marlborough St  Boston  MA  02116,4.0,1C,8.0,D4,Back Bay,14.0,Ward 5,0506,CM,80 Marlborough St,2116.0,Address,91558.0,42.3535,-71.0756,Self Service,"(42.3535, -71.0756)",-7912099.599826395,5214079.997596236
87161,101001700185,01/24/2016 05:38:00 PM,02/08/2016 08:30:00 AM,01/28/2016 12:23:54 PM,ONTIME,Closed,Case Closed. Closed date : 2016-01-28 12:23:54.717 Case Resolved Work completed 1/28/16.,Sign Repair,Transportation - Traffic Division,Signs & Signals,Sign Repair,BTDT_Sign Shop_Sign Installation,BTDT,,,63 Gove St  East Boston  MA  02128,1.0,09,1.0,A7,East Boston,1.0,Ward 1,0103,R3,63 Gove St,2128.0,Address,65626.0,42.3709,-71.0368,Citizens Connect App,"(42.3709, -71.0368)",-7907780.403583616,5216701.40651991
731383,101001036974,02/26/2014 03:24:27 PM,,10/27/2014 09:58:42 AM,ONTIME,Closed,Case Closed Case Invalid No eform,Dumpster & Loading Noise Disturbances,Neighborhood Services,Neighborhood Services Issues,Dumpster & Loading Noise Disturbances,INFO01_GenericeFormforOtherServiceRequestTypes,INFO,,,,,,,,,,,,,,,,,42.3594,-71.0587,Employee Generated,"(0, 0)",-7910218.300431989,5214968.784796895
40312,101001084952,05/08/2014 03:19:35 PM,,05/08/2014 03:19:35 PM,ONTIME,Closed,Case Closed Internal Case Performed by Highway Maintenance crew.,Pothole Repair (Internal),Public Works Department,Highway Maintenance,Pothole Repair (Internal),PWDx_District 02: Jamaica Plain,PWDx,,,3992-3996 Washington St  Roslindale  MA  02131,12.0,02,5.0,E5,Roslindale,10.0,Ward 19,1911,C,3992-3996 Washington St,2131.0,Address,145051.0,42.2925,-71.1213,Employee Generated,"(42.2925, -71.1213)",-7917186.900555648,5204895.7276967885
273115,101001874575,08/03/2016 10:16:00 AM,08/17/2016 10:16:00 AM,08/03/2016 10:22:53 AM,ONTIME,Closed,Case Closed. Closed date : 2016-08-03 10:22:53.293 Case Resolved installed lum  globe  CFL  and leads,Street Light Outages,Public Works Department,Street Lights,Street Light Outages,PWDx_Street Light Outages,PWDx,,,98 Brandywyne Dr  East Boston  MA  02128,1.0,09,1.0,A7,East Boston,1.0,Ward 1,0113,A,98 Brandywyne Dr,2128.0,Address,391074.0,42.3869,-71.0135,Employee Generated,"(42.3869, -71.0135)",-7905186.659448132,5219112.5384526625
734109,101001317487,02/26/2015 10:54:55 AM,03/02/2015 10:54:55 AM,03/03/2015 10:23:47 PM,OVERDUE,Closed,Case Closed Case Noted noted,Request for Snow Plowing,Public Works Department,Street Cleaning,Request for Snow Plowing,PWDx_District 05: South Boston,PWDx,,,280 W Fifth St  South Boston  MA  02127,6.0,05,2.0,C6,South Boston,5.0,07,0704,R1,280 W Fifth St,2127.0,Address,58285.0,42.3351,-71.0484,Constituent Call,"(42.3351, -71.0484)",-7909071.709676818,5211308.722372242
839087,101001840164,06/20/2016 02:27:00 PM,07/05/2016 02:27:00 PM,06/20/2016 02:28:43 PM,ONTIME,Closed,Case Closed. Closed date : 2016-06-20 14:28:43.733 Case Resolved installed CFL - light is on,Street Light Outages,Public Works Department,Street Lights,Street Light Outages,PWDx_Street Light Outages,PWDx,,,41 Brooksdale Rd  Brighton  MA  02135,11.0,04,9.0,D14,Allston / Brighton,15.0,Ward 22,2211,R2,41 Brooksdale Rd,2135.0,Address,405873.0,42.3567,-71.1593,Employee Generated,"(42.3567, -71.1593)",-7921417.041205793,5214562.041315547
700682,101001929962,10/13/2016 11:07:55 AM,10/14/2016 11:07:54 AM,10/13/2016 11:48:48 AM,ONTIME,Closed,Case Closed. Closed date : 2016-10-13 11:48:48.423 Case Noted Clear now.,Parking Enforcement,Transportation - Traffic Division,Enforcement & Abandoned Vehicles,Parking Enforcement,BTDT_Parking Enforcement,BTDT,https://mayors24.cityofboston.gov/media/boston/report/photos/57ffa334696338e4faaddfde/report.jpg,,235 Boston St  Dorchester  MA  02125,6.0,03,2.0,C6,Dorchester,5.0,Ward 7,0709,CM,235 Boston St,2125.0,Address,17139.0,42.3218,-71.0615,Citizens Connect App,"(42.3218, -71.0615)",-7910529.995006209,5209306.077166308
933138,101001956278,11/21/2016 12:42:00 PM,02/19/2017 12:42:24 PM,,OVERDUE,Open,,Unsatisfactory Utilities - Electrical  Plumbing,Inspectional Services,Housing,Unsatisfactory Utilities - Electrical  Plumbing,ISD_Housing (INTERNAL),ISD,,,46-48 Millet St  Dorchester  MA  02124,8.0,03,4.0,B3,Dorchester,9.0,Ward 17,1701,R3,46-48 Millet St,2124.0,Address,95534.0,42.2951,-71.0772,Constituent Call,"(42.2951, -71.0772)",-7912277.711011664,5205287.006787298
315288,101001516689,08/09/2015 06:01:00 PM,10/14/2015 08:30:00 AM,08/27/2015 10:17:43 AM,ONTIME,Closed,Case Closed. Closed date : 2015-08-27 10:17:43.857 Case Resolved The graffiti tag at this location has been removed by the City of Boston Property Management Department. This case number has been resolved and is closed.,Graffiti Removal,Property Management,Graffiti,Graffiti Removal,PROP_GRAF_GraffitiRemoval,PROP,https://mayors24.cityofboston.gov/media/boston/report/photos/55c7cd9e696353739589a68c/report.jpg,,371 S Huntington Ave  Jamaica Plain  MA  02130,9.0,02,6.0,E13,Jamaica Plain,11.0,Ward 10,1009,R1,371 S Huntington Ave,2130.0,Address,76783.0,42.321999999999996,-71.1123,Citizens Connect App,"(42.322, -71.1123)",-7916185.0251385085,5209336.188996396
792483,101001936545,10/22/2016 08:10:00 AM,11/21/2016 08:10:24 AM,10/24/2016 08:12:27 AM,ONTIME,Closed,Case Closed. Closed date : 2016-10-24 08:12:27.23 ADCLSD: Administratively Closed,Rodent Activity,Inspectional Services,Environmental Services,Rodent Activity,ISD_Environmental Services (INTERNAL),ISD,,,45 Shattuck St  Boston  MA  02115,9.0,10A,8.0,B2,Boston,14.0,04,0410,E,45 Shattuck St,2115.0,Address,169609.0,42.3361,-71.1051,Citizens Connect App,"(42.3361, -71.1051)",-7915383.524804796,5211459.314316983
927483,101002013988,02/15/2017 02:04:00 AM,02/16/2017 08:30:00 AM,02/15/2017 08:02:00 AM,ONTIME,Closed,Case Closed. Closed date : 2017-02-15 08:02:00.44 Case Resolved Space saver picked up,Space Savers,Public Works Department,Sanitation,Space Savers,PWDx_District 07: South Dorchester,PWDx,https://mayors24.cityofboston.gov/media/boston/report/photos/58a3fd5b0485cf780cfc97fa/report.jpg,,25 Stratton St  Dorchester  MA  02124,8.0,07,4.0,B3,Greater Mattapan,9.0,Ward 14,1412,R2,25 Stratton St,2124.0,Address,131607.0,42.29,-71.0883,Citizens Connect App,"(42.29, -71.0883)",-7913513.35735947,5204519.513034051
648243,101001547212,09/01/2015 07:06:34 PM,09/03/2015 08:30:00 AM,09/01/2015 07:51:32 PM,ONTIME,Closed,Case Closed. Closed date : 2015-09-01 19:51:32.29 Case Resolved officer tagged,Parking Enforcement,Transportation - Traffic Division,Enforcement & Abandoned Vehicles,Parking Enforcement,BTDT_Parking Enforcement,BTDT,,,589 E Second St  South Boston  MA  02127,6.0,05,2.0,C6,South Boston / South Boston Waterfront,5.0,Ward 6,0605,R3,589 E Second St,2127.0,Address,124365.0,42.3371,-71.0397,Citizens Connect App,"(42.3371, -71.0397)",-7908103.230106915,5211609.908656363
370740,101001304677,02/18/2015 03:14:06 PM,02/20/2015 03:14:05 PM,03/17/2015 08:15:11 AM,OVERDUE,Closed,Case Closed Case Noted case noted,Request for Snow Plowing,Public Works Department,Street Cleaning,Request for Snow Plowing,PWDx_District 02: Jamaica Plain,PWDx,,,INTERSECTION of Centre St & Robinwood Ave  Jamaica Plain  MA,9.0,02,6.0,E13,Jamaica Plain,11.0,Ward 19,1905,,INTERSECTION Centre St & Robinwood Ave,,Intersection,2682.0,42.317,-71.1134,Self Service,"(42.317, -71.1134)",-7916307.476578381,5208583.421956635
524163,101001053879,03/25/2014 12:40:12 PM,09/21/2015 12:40:09 PM,12/22/2014 07:59:23 AM,ONTIME,Closed,Case Closed Case Resolved The tree was pruned by Northern Tree Service  to the City of Boston tree pruning specifications.,Tree Maintenance Requests,Parks & Recreation Department,Trees,Tree Maintenance Requests,PARK_Tree Maintenance Request,PARK,,,1518 Columbia Rd  South Boston  MA  02127,6.0,05,2.0,C6,South Boston / South Boston Waterfront,5.0,Ward 7,0702,R3,1518 Columbia Rd,2127.0,Address,35082.0,42.3307,-71.0401,Constituent Call,"(42.3307, -71.0401)",-7908147.757903233,5210646.146260614
763109,101000735569,01/11/2013 04:16:42 PM,01/13/2013 04:16:42 PM,01/30/2013 08:59:45 AM,OVERDUE,Closed,Case Closed ROA: Refer to Other Agency/Division,Work w/out Permit,Inspectional Services,Building,Work w/out Permit,ISD_Building (INTERNAL),ISD,,,716 E Sixth St  South Boston  MA  02127,6.0,05,2.0,C6,South Boston / South Boston Waterfront,5.0,Ward 6,0608,R3,716 E Sixth St,2127.0,Address,127784.0,42.3333,-71.0316,Constituent Call,"(42.3333, -71.0316)",-7907201.542231491,5211037.662905813
564609,101001302222,02/17/2015 05:20:21 PM,02/19/2015 08:30:00 AM,02/19/2015 02:50:00 PM,OVERDUE,Closed,Case Closed Case Noted  Contractors serviced your area. We apologize for any inconvenience this may cause. Please make sure your trash and recycling is out by 7 am and that it is accessible for pickup  there must be a clear path to the refuse.  We will return on next scheduled pickup  day. Thank you for your patience,Missed Trash: District 07,Public Works Department,Sanitation,Missed Trash/Recycling/Yard Waste/Bulk Item,PWDx_Missed Trash\Recycling\Yard Waste\Bulk Item,PWDx,,,34 Greendale Rd  Mattapan  MA  02126,8.0,07,4.0,B3,Greater Mattapan,9.0,Ward 14,1414,R3,34 Greendale Rd,2126.0,Address,66522.0,42.2856,-71.0948,Constituent Call,"(42.2856, -71.0948)",-7914236.934049626,5203857.411491817
830497,101001877296,08/07/2016 05:41:00 AM,08/22/2016 08:30:00 AM,11/06/2016 01:22:20 AM,OVERDUE,Closed,Case Closed. Closed date : 2016-11-06 01:22:20.567 Case Resolved Repaired 1 Unit,PRINTED : JK,Public Works Department,Street Lights,Street Light Outages,PWDx_Street Light Outages,PWDx,,,,,,,,,,,,,,,,,42.3594,-71.0587,Employee Generated,"(0, 0)",-7910218.300431989,5214968.784796895
693024,101001116890,06/26/2014 03:34:58 PM,06/30/2014 03:34:58 PM,06/26/2014 06:37:00 PM,ONTIME,Closed,Case Closed Case Resolved street is a private way ...the hole street need to be pave,Request for Pothole Repair,Public Works Department,Highway Maintenance,Request for Pothole Repair,PWDx_District 04: Allston/Brighton,PWDx,,,14-6 Radcliffe Rd  Allston  MA  02134,11.0,04,9.0,D14,Allston,15.0,21,2107,CM,14-6 Radcliffe Rd,2134.0,Address,114255.0,42.3508,-71.1345,Citizens Connect App,"(42.3508, -71.1345)",-7918656.31783412,5213673.292298458
868650,101000496260,10/23/2012 03:51:33 PM,10/24/2012 03:51:33 PM,10/23/2012 06:28:10 PM,ONTIME,Closed,Case Closed Case Resolved pick up,Pick up Dead Animal,Public Works Department,Street Cleaning,Pick up Dead Animal,PWDx_District 10B: Roxbury,PWDx,,,23 Wabon St  Dorchester  MA  02121,9.0,10B,7.0,B2,Roxbury,13.0,Ward 12,1202,R2,23 Wabon St,2121.0,Address,141063.0,42.3147,-71.086,Constituent Call,"(42.3147, -71.086)",-7913257.322530645,5208237.169202712
255441,101001525697,08/19/2015 07:46:40 PM,09/03/2015 08:30:00 AM,,OVERDUE,Open,,Other: Complaint,Mayor's 24 Hour Hotline,Employee & General Comments,General Comments For a Program or Policy,INFO_General Comments Complaints Compliments,INFO,,,,,,,,,,,,,,,,,42.3594,-71.0587,Constituent Call,"(0, 0)",-7910218.300431989,5214968.784796895
786523,101000447768,07/10/2012 04:27:59 PM,,07/18/2012 09:43:23 PM,ONTIME,Closed,Case Closed Bulk Item Automation,Schedule a Bulk Item Pickup,Public Works Department,Sanitation,Schedule a Bulk Item Pickup,PWDx_Schedule a Bulk Item Pickup,PWDx,,,132 Wilmington Ave  Dorchester  MA  02124,8.0,07,3.0,B3,Dorchester,7.0,Ward 17,1704,R2,132 Wilmington Ave,2124.0,Address,150422.0,42.2802,-71.0738,Constituent Call,"(42.2802, -71.0738)",-7911899.224742968,5203044.895524631
64377,101001129077,07/15/2014 10:05:59 AM,07/17/2014 10:05:59 AM,07/15/2014 10:13:12 AM,ONTIME,Closed,Case Closed Case Resolved raked  off  by  worker  removed  by  sweeper,Requests for Street Cleaning,Public Works Department,Street Cleaning,Requests for Street Cleaning,PWDx_District 07: South Dorchester,PWDx,,,INTERSECTION of Wellington Hill St & Hillsboro Rd  Mattapan  MA,8.0,07,4.0,B3,Greater Mattapan,9.0,Ward 14,1414,,INTERSECTION Wellington Hill St & Hillsboro Rd,,Intersection,6207.0,42.2826,-71.0965,City Worker App,"(42.2826, -71.0965)",-7914426.177183975,5203406.005134944
340008,101000366223,12/20/2011 12:02:50 PM,12/09/2013 12:02:36 PM,12/20/2011 12:04:10 PM,ONTIME,Closed,Case Closed Case Resolved Planted by central nurseries Fall 2011,New Tree Requests,Parks & Recreation Department,Trees,New Tree Requests,PARK_New Tree Requests,PARK,,,311 Forest Hills St  Jamaica Plain  MA  02130,9.0,02,6.0,E13,Jamaica Plain,11.0,Ward 11,1108,R1,311 Forest Hills St,2130.0,Address,59434.0,42.3021,-71.1054,Employee Generated,"(42.3021, -71.1054)",-7915416.920652036,5206340.530790513
648519,101001066856,04/13/2014 06:07:17 PM,05/28/2014 06:07:17 PM,11/03/2014 02:46:18 PM,OVERDUE,Closed,Case Closed Case Resolved Pole Inspected and found no issues 12/13/13.  Case closed in Maximo but failed to close in Lagan,General Lighting Request,Public Works Department,Street Lights,General Lighting Request,PWDx_Street Light_General Lighting Request,PWDx,,,INTERSECTION of Congress St & E Service Rd  Boston  MA,6.0,05,2.0,C6,South Boston / South Boston Waterfront,5.0,Ward 6,0601,,INTERSECTION Congress St & E Service Rd,,Intersection,3446.0,42.3488,-71.0459,Maximo Integration,"(42.3488, -71.0459)",-7908793.410949836,5213372.040378293
241772,101000453571,07/23/2012 08:51:43 AM,07/25/2012 08:51:43 AM,07/23/2012 02:29:03 PM,ONTIME,Closed,Case Closed Case Resolved patched,Request for Pothole Repair,Public Works Department,Highway Maintenance,Request for Pothole Repair,PWDx_District 1C: Downtown,PWDx,,,335 Newbury St  Boston  MA  02115,4.0,1C,8.0,D4,Back Bay,14.0,Ward 5,0509,C,335 Newbury St,2115.0,Address,101557.0,42.3487,-71.0866,City Worker App,"(42.3487, -71.0866)",-7913324.114225122,5213356.978033894
937836,101002023774,02/23/2017 07:45:00 PM,02/28/2017 08:30:00 AM,02/24/2017 06:28:40 AM,ONTIME,Closed,Case Closed. Closed date : 2017-02-24 06:28:40.427 Case Noted no violation found at this time today is trash day,Improper Storage of Trash (Barrels),Public Works Department,Code Enforcement,Improper Storage of Trash (Barrels),PWDx_Code Enforcement,PWDx,,,71-73 Broad St  Boston  MA  02109,3.0,1C,1.0,A1,Downtown / Financial District,3.0,Ward 3,0306,C,71-73 Broad St,2109.0,Address,20483.0,42.3577,-71.0538,Constituent Call,"(42.3577, -71.0538)",-7909672.834927101,5214712.685011671
42385,101000928905,09/17/2013 01:08:20 PM,09/19/2013 01:08:19 PM,09/17/2013 01:15:38 PM,ONTIME,Closed,Case Closed Case Noted  Flooring is not considered household trash  we do not accept this material.  Resident will have to hire a private hauler to take away. Sorry for any inconvenience.,Missed Trash: District 03,Public Works Department,Sanitation,Missed Trash/Recycling/Yard Waste/Bulk Item,PWDx_Missed Trash\Recycling\Yard Waste\Bulk Item,PWDx,,,31 Josephine St  Dorchester  MA  02122,7.0,03,3.0,C11,Dorchester,8.0,Ward 15,1508,R3,31 Josephine St,2122.0,Address,80069.0,42.3006,-71.064,Self Service,"(42.3006, -71.064)",-7910808.293733193,5206114.765787599
239073,101001424241,07/07/2015 08:54:00 AM,07/14/2015 08:54:49 AM,07/08/2015 06:25:11 AM,ONTIME,Closed,Case Closed Case Noted  Location is residential. We no longer place LBs in residential areas.,Request for Litter Basket Installation,Public Works Department,Street Cleaning,Request for Litter Basket Installation,PWDx_Request for Litter Basket Installation,PWDx,,,12 Gardner St  Roxbury  MA  02119,7.0,10B,7.0,B2,Roxbury,13.0,Ward 11,1101,R2,12 Gardner St,2119.0,Address,239844.0,42.3298,-71.0944,Constituent Call,"(42.3298, -71.0944)",-7914192.406253308,5210510.625038675
660320,101001606436,10/06/2015 05:13:34 PM,10/08/2015 08:30:00 AM,10/07/2015 08:30:45 AM,ONTIME,Closed,Case Closed. Closed date : 2015-10-07 08:30:45.09 Case Resolved Case resolved. Sticker delivered 10/7.,Sticker Request,Public Works Department,Recycling,Sticker Request,PWDx_Sticker Request,PWDx,,,20 Ruthven St  Dorchester  MA  02121,9.0,10B,7.0,B2,Roxbury,13.0,Ward 12,1208.0,R2,20 Ruthven St,2121.0,Address,302567.0,42.3139,-71.0922,Self Service,"(42.3139, -71.0922)",-7913947.503373563,5208116.73642841
159082,101001056669,03/29/2014 08:16:57 AM,04/14/2014 08:30:00 AM,04/02/2014 01:39:25 PM,ONTIME,Closed,Case Closed Case Resolved Work completed 4/2/14.,Sign Repair,Transportation - Traffic Division,Signs & Signals,Sign Repair,BTDT_Sign Shop_Sign Installation,BTDT,,,15-19 Kneeland St  Boston  MA  02111,4.0,1C,2.0,A1,Downtown / Financial District,4.0,Ward 3,0308,C,15-19 Kneeland St,2111.0,Address,82304.0,42.3507,-71.0625,Citizens Connect App,"(42.3507, -71.0625)",-7910641.314497003,5213658.229474797
681503,101000946455,10/15/2013 09:34:51 AM,10/17/2013 09:34:51 AM,10/15/2013 09:34:53 AM,ONTIME,Closed,Case Closed Case Resolved Marked completed at case creation,Requests for Street Cleaning,Public Works Department,Street Cleaning,Requests for Street Cleaning,PWDx_District 08: Hyde Park,PWDx,,,9 Caton St  Mattapan  MA  02126,8.0,08,5.0,E18,Hyde Park,9.0,Ward 18,1805,R3,9 Caton St,2126.0,Address,202621.0,42.2653,-71.1001,City Worker App,"(42.2653, -71.1001)",-7914826.927350829,5200803.314384087
69839,101001643510,11/27/2015 12:15:00 PM,12/11/2015 12:15:39 PM,11/30/2015 04:33:16 PM,ONTIME,Closed,Case Closed. Closed date : 2015-11-30 16:33:16.017 Case Resolved secured globe. kb/jd,hanging globe////printed,Public Works Department,Street Lights,Street Light Outages,PWDx_Street Light Outages,PWDx,https://mayors24.cityofboston.gov/media/boston/report/photos/56588fb50485bf432c10d263/report.jpg,,129 Tremont St  Boston  MA  02108,3.0,1C,1.0,A1,Downtown / Financial District,3.0,03,0306,C,129 Tremont St,2108.0,Address,170408.0,42.3563,-71.062,Citizens Connect App,"(42.3563, -71.062)",-7910585.654751606,5214501.784508309
741230,101000826591,04/23/2013 05:05:01 PM,04/26/2013 08:30:00 AM,04/24/2013 09:04:21 AM,ONTIME,Closed,Case Closed Case Resolved  picked up,Missed Trash: District 08,Public Works Department,Sanitation,Missed Trash/Recycling/Yard Waste/Bulk Item,PWDx_Missed Trash\Recycling\Yard Waste\Bulk Item,PWDx,,,9 Waterloo St  Hyde Park  MA  02136,12.0,08,5.0,E18,Hyde Park,10.0,Ward 18,1820,R1,9 Waterloo St,2136.0,Address,146317.0,42.2433,-71.1333,Constituent Call,"(42.2433, -71.1333)",-7918522.734445168,5197494.565632059
744522,101001637365,11/18/2015 07:28:07 AM,11/19/2015 08:30:00 AM,11/18/2015 08:38:56 AM,ONTIME,Closed,Case Closed. Closed date : 2015-11-18 08:38:56.987 Case Resolved,CE Collection,Public Works Department,Street Cleaning,CE Collection,PWDx_District 1C: Downtown,PWDx,https://cityworker.cityofboston.gov:8443/attachments/report/564c6ed6d052f4d9aa00bbdf/photo/Report.jpg,https://cityworker.cityofboston.gov:8443/attachments/report/564c6ed6d052f4d9aa00bbdf/closed_photo/Report.jpg,INTERSECTION of Boylston St & Dartmouth St  Boston  MA,4.0,1C,2.0,D4,Back Bay,6.0,Ward 4,0402,,INTERSECTION Boylston St & Dartmouth St,,Intersection,1778.0,42.3501,-71.0773,City Worker App,"(42.3501, -71.0773)",-7912288.842960742,5213567.853036073
936721,101002023481,02/23/2017 01:48:59 PM,06/23/2017 01:49:00 PM,02/23/2017 01:49:20 PM,ONTIME,Closed,Case Closed. Closed date : 2017-02-23 13:49:20.84 :,Unsatisfactory Living Conditions,Inspectional Services,Housing,Unsatisfactory Living Conditions,ISD_Housing (INTERNAL),ISD,,,117 Howland St  Dorchester  MA  02121,9.0,10B,7.0,B2,Roxbury,13.0,Ward 12,1208,R3,117 Howland St,2121.0,Address,253845.0,42.3147,-71.09,Constituent Call,"(42.3147, -71.09)",-7913702.6004938185,5208237.169202712
301254,101000344103,10/18/2011 07:45:51 PM,10/21/2011 08:30:00 AM,10/18/2011 07:54:20 PM,ONTIME,Closed,Case Closed Case Resolved Caller will take bags back in and place out once again next week.,Missed Leaf or Yard Trash: District 09,Public Works Department,Sanitation,Missed Trash/Recycling/Yard Waste/Bulk Item,PWDx_Missed Trash\Recycling\Yard Waste\Bulk Item,PWDx,,,331 Saratoga St  East Boston  MA  02128,1.0,09,1.0,A7,East Boston,1.0,Ward 1,0110,R1,331 Saratoga St,2128.0,Address,122617.0,42.3785,-71.0308,Self Service,"(42.3785, -71.0308)",-7907112.486638857,5217846.617584654
47121,101001658933,12/05/2015 03:00:00 PM,,12/09/2015 04:47:27 PM,ONTIME,Closed,Case Closed. Closed date : 2015-12-09 16:47:27.963 Case Resolved The dog was returned to its owner.,Animal Generic Request,Animal Control,Animal Issues,Animal Generic Request,INFO01_GenericeFormforOtherServiceRequestTypes,INFO,,,33 Fowler St  Dorchester  MA  02121,7.0,03,4.0,B3,Greater Mattapan,8.0,Ward 14,1402,R2,33 Fowler St,2121.0,Address,165399.0,42.3004,-71.0825,Constituent Call,"(42.3004, -71.0825)",-7912867.7043128675,5206084.6641935725
511912,101001217588,11/14/2014 03:56:53 PM,,11/24/2014 04:34:26 PM,ONTIME,Closed,Case Closed Bulk Item Automation,Schedule a Bulk Item Pickup,Public Works Department,Sanitation,Schedule a Bulk Item Pickup,PWDx_Schedule a Bulk Item Pickup,PWDx,,,68 Radcliffe St  Dorchester  MA  02121,7.0,03,4.0,B3,Dorchester,8.0,Ward 14,1402,R2,68 Radcliffe St,2121.0,Address,114386.0,42.2993,-71.0781,Constituent Call,"(42.2993, -71.0781)",-7912377.89855338,5205919.107135456
333443,101000483404,09/24/2012 10:03:24 AM,11/08/2012 10:03:24 AM,09/24/2012 10:26:39 PM,ONTIME,Closed,Case Closed Case Resolved Replaced  3 150W lamps  and 2 refractors,General Lighting Request,Public Works Department,Street Lights,General Lighting Request,PWDx_Street Light_General Lighting Request,PWDx,,,INTERSECTION of Bernard St & Browning Ave  Dorchester  MA,8.0,03,4.0,B3,Greater Mattapan,8.0,Ward 14,1402,,INTERSECTION Bernard St & Browning Ave,,Intersection,1375.0,42.2944,-71.0803,Constituent Call,"(42.2944, -71.0803)",-7912622.801433123,5205181.660827755
69595,101001581123,09/17/2015 09:38:00 AM,01/15/2016 09:38:07 AM,,OVERDUE,Open,,Unsatisfactory Living Conditions,Inspectional Services,Housing,Unsatisfactory Living Conditions,ISD_Housing (INTERNAL),ISD,,,1241-1251 Adams St  Mattapan  MA  02124,,,0.0,,Dorchester,0.0,17,,,1241-1251 Adams St,2124.0,Address,350066.0,42.2713,-71.0694,Constituent Call,"(42.2713, -71.0694)",-7911409.418983476,5201705.900778496
110505,101001659152,12/06/2015 11:06:10 AM,12/08/2015 08:30:00 AM,12/06/2015 12:12:39 PM,ONTIME,Closed,Case Closed. Closed date : 2015-12-06 12:12:39.527 Case Noted This is on private property,Requests for Street Cleaning,Public Works Department,Street Cleaning,Requests for Street Cleaning,PWDx_District 1C: Downtown,PWDx,,https://cityworker.cityofboston.gov:8443/attachments/report/56645d32d052df0bae25a3f2/closed_photo/Report.jpg,58 E Springfield St  Roxbury  MA  02118,4.0,1C,2.0,D4,South End,6.0,Ward 8,0802,R4,58 E Springfield St,2118.0,Address,164878.0,42.3357,-71.0745,Citizens Connect App,"(42.3357, -71.0745)",-7911977.148386522,5211399.077251736
259292,101001187816,10/02/2014 04:16:11 PM,10/06/2014 04:16:11 PM,10/06/2014 02:50:44 PM,ONTIME,Closed,Case Closed Case Resolved Location has been made safe. This sidewalk will be referred for permanent repair. See case #101001190248 for status of the permanent repair.,Sidewalk Repair (Make Safe),Public Works Department,Highway Maintenance,Sidewalk Repair (Make Safe),PWDx_District 07: South Dorchester,PWDx,https://cityworker.cityofboston.gov:8443/attachments/report/542db287d052f1b1cd5b4a51/photo/Report.jpg,,35-37 Franconia St  Dorchester  MA  02122,8.0,07,3.0,C11,Dorchester,7.0,Ward 16,1609,R2,35-37 Franconia St,2122.0,Address,60471.0,42.2853,-71.0533,City Worker App,"(42.2853, -71.0533)",-7909617.175181704,5203812.269888846
439765,101001377183,05/14/2015 07:56:01 AM,07/17/2015 08:30:00 AM,05/20/2015 07:31:38 AM,ONTIME,Closed,Case Closed. Closed date : 2015-05-20 07:31:38.377 Duplicate of Existing Case,Big Buildings Recycling (INTERNAL),Public Works Department,Recycling,Big Buildings Recycling (INTERNAL),PWDx_Recycling_BigBuildings,PWDx,https://cityworker.cityofboston.gov:8443/attachments/report/55548d59d05256bfb76db798/photo/Report.jpg,,616 E Fourth St  South Boston  MA  02127,6.0,05,2.0,C6,South Boston / South Boston Waterfront,5.0,Ward 6,0604,E,616 E Fourth St,2127.0,Address,59901.0,42.3349,-71.0402,City Worker App,"(42.3349, -71.0402)",-7908158.889852312,5211278.60427064
614952,101001687703,01/05/2016 02:22:19 PM,,01/05/2016 02:22:20 PM,ONTIME,Closed,Case Closed. Closed date : 2016-01-05 14:22:20.507 Internal Case Performed by Highway Maintenance crew.,Pothole Repair (Internal),Public Works Department,Highway Maintenance,Pothole Repair (Internal),PWDx_District 06: West Roxbury and Roslindale,PWDx,,,34 Pleasantdale Rd  West Roxbury  MA  02132,12.0,06,6.0,E5,West Roxbury,12.0,Ward 20,2015,R1,34 Pleasantdale Rd,2132.0,Address,111343.0,42.261,-71.16199999999999,Employee Generated,"(42.261, -71.162)",-7921717.603830934,5200156.513641331
492909,101001925743,10/06/2016 05:35:01 PM,10/11/2016 08:30:00 AM,10/06/2016 05:35:45 PM,ONTIME,Closed,Case Closed. Closed date : 2016-10-06 17:35:45.34 Case Invalid,Parking Enforcement,Transportation - Traffic Division,Enforcement & Abandoned Vehicles,Parking Enforcement,BTDT_Parking Enforcement,BTDT,,,3 North Sq  Boston  MA  02113,3.0,1B,1.0,A1,Downtown / Financial District,3.0,Ward 3,0303,C,3 North Sq,2113.0,Address,103517.0,42.3641,-71.0533,Constituent Call,"(42.3641, -71.0533)",-7909617.175181704,5215676.861439596
740084,101001545678,08/31/2015 06:22:47 PM,09/02/2015 08:30:00 AM,09/01/2015 09:16:51 AM,ONTIME,Closed,Case Closed. Closed date : 2015-09-01 09:16:51.49 Case Resolved debri cleaned up,Requests for Street Cleaning,Public Works Department,Street Cleaning,Requests for Street Cleaning,PWDx_District 03: North Dorchester,PWDx,https://mayors24.cityofboston.gov/media/boston/report/photos/55e4d3b0048566833724ddb4/report.jpg,https://cityworker.cityofboston.gov:8443/attachments/report/55e4d3e4d05220b9f82be6d6/closed_photo/Report.jpg,77 Mount Ida Rd  Dorchester  MA  02122,7.0,03,3.0,C11,Dorchester,8.0,Ward 15,1507,R3,77 Mount Ida Rd,2122.0,Address,98352.0,42.3044,-71.0642,Citizens Connect App,"(42.3044, -71.0642)",-7910830.557631351,5206686.7142415885
584646,101001868867,07/27/2016 07:37:25 AM,07/28/2016 08:30:00 AM,07/27/2016 08:26:17 PM,ONTIME,Closed,Case Closed. Closed date : 2016-07-27 20:26:17.747 Case Resolved officers patrolling area and will tag anything in vioaltion,Parking Enforcement,Transportation - Traffic Division,Enforcement & Abandoned Vehicles,Parking Enforcement,BTDT_Parking Enforcement,BTDT,,,442-450 Bennington St  East Boston  MA  02128,1.0,09,1.0,A7,East Boston,1.0,Ward 1,0110,C,442-450 Bennington St,2128.0,Address,14734.0,42.3811,-71.0232,Citizens Connect App,"(42.3811, -71.0232)",-7906266.458508828,5218238.432136247
593504,101001311949,02/23/2015 10:08:29 AM,03/09/2015 10:08:28 AM,02/27/2015 09:59:53 AM,ONTIME,Closed,Case Closed Case Noted  no address  no contact info,PublicWorks: Complaint,Mayor's 24 Hour Hotline,Employee & General Comments,General Comments For a Program or Policy,PWDx_General Comments,PWDx,,,,,,,,,,,,,,,,,42.3594,-71.0587,Constituent Call,"(0, 0)",-7910218.300431989,5214968.784796895
14023,101001521951,08/15/2015 11:18:10 AM,,,ONTIME,Open,,Animal Generic Request,Animal Control,Animal Issues,Animal Generic Request,INFO01_GenericeFormforOtherServiceRequestTypes,INFO,,,10 Chandler St  Boston  MA  02116,4.0,1C,2.0,D4,South End,6.0,Ward 5,0501,E,10 Chandler St,2116.0,Address,163124.0,42.3471,-71.0696,Constituent Call,"(42.3471, -71.0696)",-7911431.682881634,5213115.983782211
461149,101001248380,01/16/2015 10:29:12 AM,02/02/2015 10:29:12 AM,,OVERDUE,Open,,Other: Complaint,Mayor's 24 Hour Hotline,Employee & General Comments,General Comments For a Program or Policy,INFO_General Comments Complaints Compliments,INFO,,,,,,,,,,,,,,,,,42.3594,-71.0587,Constituent Call,"(0, 0)",-7910218.300431989,5214968.784796895
761186,101001639100,11/19/2015 06:09:41 PM,11/23/2015 08:30:00 AM,11/23/2015 02:52:54 PM,OVERDUE,Closed,Case Closed. Closed date : 2015-11-23 14:52:54.913 Case Resolved Location has been made safe. This sidewalk will be referred for permanent repair. See case #101001641303 for status of the permanent repair.,Sidewalk Repair (Make Safe),Public Works Department,Highway Maintenance,Sidewalk Repair (Make Safe),PWDx_District 07: South Dorchester,PWDx,,,67 Semont Rd  Dorchester  MA  02124,8.0,07,3.0,C11,Dorchester,7.0,Ward 16,1604,R3,67 Semont Rd,2124.0,Address,125207.0,42.2912,-71.0604,Citizens Connect App,"(42.2912, -71.0604)",-7910407.543566337,5204700.094208613
572762,101000322922,08/31/2011 11:51:42 AM,09/02/2011 11:51:38 AM,09/06/2011 12:19:53 PM,OVERDUE,Closed,Case Closed Case Scheduled Items have been scheduled for pickup.,Schedule a Bulk Item Pickup,Public Works Department,Sanitation,Schedule a Bulk Item Pickup,PWDx_Schedule a Bulk Item Pickup,PWDx,,,75 George St  Roxbury  MA  02119,7.0,10B,7.0,B2,Roxbury,13.0,Ward 8,0803,RC,75 George St,2119.0,Address,240861.0,42.326,-71.0729,Employee Generated,"(42.326, -71.0729)",-7911799.037201255,5209938.445700035
730410,101000864978,06/21/2013 04:02:39 PM,07/05/2013 04:02:38 PM,06/27/2013 02:52:42 PM,ONTIME,Closed,Case Closed Case Resolved Work completed 6/27/13.,Sign Repair,Transportation - Traffic Division,Signs & Signals,Sign Repair,BTDT_Sign Shop_Sign Installation,BTDT,,,INTERSECTION of Church St & Winter St  Dorchester  MA,7.0,03,3.0,C11,Dorchester,8.0,Ward 15,1504,,INTERSECTION Church St & Winter St,,Intersection,3018.0,42.3086,-71.0626,Citizens Connect App,"(42.3086, -71.0626)",-7910652.4464460835,5207318.907961295
380108,101001201924,10/22/2014 03:05:49 PM,04/19/2016 03:05:48 PM,10/22/2014 03:10:16 PM,ONTIME,Closed,Case Closed Case Resolved  The tree was pruned by Northern Tree Service  to the City of Boston tree pruning specifications.,Tree Maintenance Requests,Parks & Recreation Department,Trees,Tree Maintenance Requests,PARK_Tree Maintenance Request,PARK,,,19 Cowing St  West Roxbury  MA  02132,12.0,06,6.0,E5,West Roxbury,12.0,Ward 20,2010,R3,19 Cowing St,2132.0,Address,43890.0,42.2725,-71.1458,Employee Generated,"(42.2725, -71.1458)",-7919914.228080083,5201886.428367288
115221,101001298186,02/16/2015 12:52:09 PM,02/19/2015 08:30:00 AM,03/01/2015 11:38:51 PM,OVERDUE,Closed,Case Closed Case Noted,Request for Snow Plowing,Public Works Department,Street Cleaning,Request for Snow Plowing,PWDx_District 1A: Charlestown,PWDx,,,74 Tremont St  Charlestown  MA  02129,3.0,1A,1.0,A15,Charlestown,2.0,Ward 2,0202,R1,74 Tremont St,2129.0,Address,136752.0,42.3756,-71.0568,Constituent Call,"(42.3756, -71.0568)",-7910006.793399481,5217409.612800196
369100,101001323504,03/04/2015 09:13:27 AM,08/31/2015 09:13:27 AM,03/05/2015 02:54:18 PM,ONTIME,Closed,Case Closed Case Resolved,Traffic Signal Repair,Transportation - Traffic Division,Signs & Signals,Traffic Signal Repair,BTDT_Traffic Signal_Repair,BTDT,,,100 City Hall Plz  Boston  MA  02108,3.0,1B,1.0,A1,Downtown / Financial District,3.0,Ward 3,0306,C,100 City Hall Plz,2108.0,Address,207940.0,42.3595,-71.0588,Self Service,"(42.3595, -71.0588)",-7910229.432381068,5214983.849705914
660539,101000375344,01/18/2012 02:32:55 PM,02/01/2012 02:32:53 PM,02/02/2012 03:08:58 PM,OVERDUE,Closed,Case Closed Case Resolved completed 02/02/12,Street Light Outages,Public Works Department,Street Lights,Street Light Outages,PWDx_Street Light Outages,PWDx,,,331 Chelsea St  East Boston  MA  02128,1.0,09,1.0,A7,East Boston,1.0,Ward 1,110.0,R2,331 Chelsea St,2128.0,Address,30504.0,42.3777,-71.0294,Constituent Call,"(42.3777, -71.0294)",-7906956.639351744,5217726.062524944
709237,101001605504,10/05/2015 08:12:00 PM,10/21/2015 08:30:00 AM,10/08/2015 09:42:37 PM,ONTIME,Closed,Case Closed. Closed date : 2015-10-08 21:42:37.437 Case Resolved Replaced 62W LED rect style fixture J Michel C Thompson,outage////printed,Public Works Department,Street Lights,Street Light Outages,PWDx_Street Light Outages,PWDx,https://mayors24.cityofboston.gov/media/boston/report/photos/5613122b0485fc2cfab0b992/report.jpg,,INTERSECTION of Brooks St & Paris St  East Boston  MA,1.0,09,1.0,A7,East Boston,1.0,Ward 1,0105,,INTERSECTION Brooks St & Paris St,,Intersection,2108.0,42.3764,-71.033,Citizens Connect App,"(42.3764, -71.033)",-7907357.389518602,5217530.163828506
378470,101000898019,08/09/2013 10:41:50 AM,,08/09/2013 10:41:50 AM,ONTIME,Closed,Case Closed Internal Case Performed by Highway Maintenance crew.,Pothole Repair (Internal),Public Works Department,Highway Maintenance,Pothole Repair (Internal),PWDx_District 02: Jamaica Plain,PWDx,,,27 Bradstreet Ave  Roslindale  MA  02131,12.0,02,5.0,E18,Roslindale,10.0,Ward 18,1807,R2,27 Bradstreet Ave,2131.0,Address,19132.0,42.2826,-71.1175,Employee Generated,"(42.2826, -71.1175)",-7916763.886490634,5203406.005134944
230657,101001155324,08/22/2014 08:35:40 AM,09/21/2014 08:35:40 AM,08/26/2014 08:28:27 AM,ONTIME,Closed,Case Closed ADCLSD: Administratively Closed,Rodent Activity,Inspectional Services,Environmental Services,Rodent Activity,ISD_Environmental Services (INTERNAL),ISD,,,,,,,,,,,,,,,,,42.3594,-71.0587,Constituent Call,"(0, 0)",-7910218.300431989,5214968.784796895
222674,101000359707,12/02/2011 10:41:27 AM,12/16/2011 10:41:27 AM,,OVERDUE,Open,,Other: Comment,Mayor's 24 Hour Hotline,Employee & General Comments,General Comments For a Program or Policy,INFO_General Comments Complaints Compliments,INFO,,,,,,,,,,,,,,,,,42.3594,-71.0587,Constituent Call,"(0, 0)",-7910218.300431989,5214968.784796895
273558,101001415647,06/23/2015 11:11:00 AM,07/07/2015 11:11:06 AM,07/24/2015 11:11:24 AM,OVERDUE,Closed,Case Closed. Closed date : 2015-07-24 11:11:24.183 Case Resolved,Sign Repair,Transportation - Traffic Division,Signs & Signals,Sign Repair,BTDT_Sign Shop_Sign Installation,BTDT,,,56 W Walnut Park  Roxbury  MA  02119,9.0,10B,6.0,E13,Jamaica Plain,11.0,Ward 11,1104,R2,56 W Walnut Park,2119.0,Address,327878.0,42.3176,-71.0996,City Worker App,"(42.3176, -71.0996)",-7914771.267605433,5208673.750843256
153172,101000501628,11/01/2012 02:09:17 PM,11/05/2012 02:09:17 PM,11/01/2012 02:09:21 PM,ONTIME,Closed,Case Closed,Requests for Street Cleaning,Public Works Department,Street Cleaning,Requests for Street Cleaning,PWDx_District 09: East Boston,PWDx,,,192 Gladstone St  East Boston  MA  02128,1.0,09,1.0,A7,East Boston,1.0,Ward 1,0113,R1,192 Gladstone St,2128.0,Address,63840.0,42.3898,-71.0084,City Worker App,"(42.3898, -71.0084)",-7904618.930045086,5219549.621896081
581976,101000493781,10/17/2012 08:39:42 PM,,10/22/2012 06:35:18 PM,ONTIME,Closed,Case Closed Case Resolved cancel case. TVs were taken when placed on the sidewalk.,Schedule a Bulk Item Pickup,Public Works Department,Sanitation,Schedule a Bulk Item Pickup,PWDx_Schedule a Bulk Item Pickup,PWDx,,,20-22 Green St  Jamaica Plain  MA  02130,9.0,02,6.0,E13,Jamaica Plain,11.0,Ward 19,1906,R2,20-22 Green St,2130.0,Address,66366.0,42.3132,-71.1128,Self Service,"(42.3132, -71.1128)",-7916240.684883904,5208011.359006662
33147,101001096191,05/23/2014 10:43:04 AM,05/28/2014 10:43:04 AM,05/23/2014 10:44:37 AM,ONTIME,Closed,Case Closed Case Invalid test,Requests for Street Cleaning,Public Works Department,Street Cleaning,Requests for Street Cleaning,PWDx_District 09: East Boston,PWDx,,,INTERSECTION of E Eagle St & Lexington St  East Boston  MA,1.0,09,1.0,A7,East Boston,1.0,Ward 1,0109,,INTERSECTION E Eagle St & Lexington St,,Intersection,4374.0,42.3813,-71.0278,City Worker App,"(42.3813, -71.0278)",-7906778.528166477,5218268.57238915
906420,101001991398,01/18/2017 06:24:49 PM,01/20/2017 08:30:00 AM,01/18/2017 07:00:46 PM,ONTIME,Closed,Case Closed. Closed date : 2017-01-18 19:00:46.3 Case Resolved clear at this time,Parking Enforcement,Transportation - Traffic Division,Enforcement & Abandoned Vehicles,Parking Enforcement,BTDT_Parking Enforcement,BTDT,,,INTERSECTION of Johnny Ct & Maple Pl  Boston  MA,4.0,1C,2.0,A1,Downtown / Financial District,4.0,3,0308,,INTERSECTION Johnny Ct & Maple Pl,,Intersection,11368.0,42.3594,-71.0587,Citizens Connect App,"(0, 0)",-7910218.300431989,5214968.784796895
687040,101001352972,04/09/2015 01:15:49 PM,04/10/2015 01:15:49 PM,04/09/2015 01:23:43 PM,ONTIME,Closed,Case Closed Case Resolved called inspector and there cleanining it as i answer this crm.,Requests for Street Cleaning,Public Works Department,Street Cleaning,Requests for Street Cleaning,PWDx_District 03: North Dorchester,PWDx,,,34 Danube St  Dorchester  MA  02125,7.0,03,7.0,B2,Roxbury,13.0,Ward 13,1301,A,34 Danube St,2125.0,Address,46212.0,42.3172,-71.0753,Constituent Call,"(42.3172, -71.0753)",-7912066.203979157,5208613.531489816
497032,101001659743,12/07/2015 11:45:00 AM,12/21/2015 11:45:57 AM,12/09/2015 01:04:55 PM,ONTIME,Closed,Case Closed. Closed date : 2015-12-09 13:04:55.55 Case Resolved Work completed 12/9/15.,Sign Repair,Transportation - Traffic Division,Signs & Signals,Sign Repair,BTDT_Sign Shop_Sign Installation,BTDT,,,INTERSECTION of Sunset Hill Rd & Sunset Hill Path  Roslindale  MA,9.0,06,6.0,E5,West Roxbury,12.0,Ward 20,2006,,INTERSECTION Sunset Hill Rd & Sunset Hill Path,,Intersection,8479.0,42.2893,-71.1435,City Worker App,"(42.2893, -71.1435)",-7919658.193251258,5204414.175604271
397204,101001376779,05/13/2015 02:18:06 PM,05/14/2015 02:18:06 PM,05/13/2015 02:18:42 PM,ONTIME,Closed,Case Closed. Closed date : 2015-05-13 14:18:42.08 Case Invalid LAGAN ERROR,Parking Enforcement,Transportation - Traffic Division,Enforcement & Abandoned Vehicles,Parking Enforcement,BTDT_Parking Enforcement,BTDT,,,INTERSECTION of Merrimac St & New Chardon St  Boston  MA,3.0,1B,1.0,A1,Downtown / Financial District,3.0,Ward 3,0306,,INTERSECTION Merrimac St & New Chardon St,,Intersection,7265.0,42.363,-71.0597,Constituent Call,"(42.363, -71.0597)",-7910329.619922782,5215511.136626592
184569,101001310978,02/22/2015 01:39:47 PM,02/25/2015 08:30:00 AM,03/13/2015 11:53:18 AM,OVERDUE,Closed,Case Closed Case Noted snow removed,Request for Snow Plowing,Public Works Department,Street Cleaning,Request for Snow Plowing,PWDx_District 02: Jamaica Plain,PWDx,https://mayors24.cityofboston.gov/media/boston/report/photos/54ea226904859c1f0a33c79f/report.jpg,,INTERSECTION of Colgate Rd & Washington St  Roslindale  MA,12.0,02,5.0,E5,Roslindale,10.0,Ward 19,1911,,INTERSECTION Colgate Rd & Washington St,,Intersection,3198.0,42.2933,-71.1208,Citizens Connect App,"(42.2933, -71.1208)",-7917131.240810251,5205016.119542688
824399,101001139779,07/30/2014 08:42:20 AM,01/26/2016 08:42:12 AM,05/31/2015 09:28:11 AM,ONTIME,Closed,Case Closed. Closed date : 2015-05-31 09:28:11.69 Case Resolved Tree was removed by North-Eastern Tree Service. A new tree request case will be made for this location. If you have any questions please call the Park Line at 617-635-7275.,Tree Maintenance Requests,Parks & Recreation Department,Trees,Tree Maintenance Requests,PARK_Tree Maintenance Request,PARK,,,620-622 E Eighth St  South Boston  MA  02127,6.0,05,2.0,C6,South Boston / South Boston Waterfront,5.0,Ward 7,0702,R2,620-622 E Eighth St,2127.0,Address,52338.0,42.3316,-71.0364,Employee Generated,"(42.3316, -71.0364)",-7907735.875787298,5210781.669421678
802706,101001174449,09/17/2014 10:08:48 AM,03/15/2016 10:08:44 AM,11/18/2014 08:31:13 AM,ONTIME,Closed,Case Closed Case Resolved Sign cleared by the BPRD tree crew.,Tree in Park,Parks & Recreation Department,Trees,Tree in Park,PARK_Tree in Park,PARK,,,,,,,,,,,,,,,,,42.3594,-71.0587,Constituent Call,"(0, 0)",-7910218.300431989,5214968.784796895
550337,101001571308,09/06/2015 08:23:00 PM,01/04/2016 08:23:20 PM,,OVERDUE,Open,,Unsatisfactory Living Conditions,Inspectional Services,Housing,Unsatisfactory Living Conditions,ISD_Housing (INTERNAL),ISD,,,155-157 Washington St  Dorchester  MA  02121,7.0,03,4.0,C11,Dorchester,8.0,14,1404,I,155-157 Washington St,2121.0,Address,145961.0,42.303999999999995,-71.0795,Constituent Call,"(42.304, -71.0795)",-7912533.745840489,5206626.507515556
87515,101001634639,11/13/2015 05:18:00 PM,11/18/2015 08:30:00 AM,11/14/2015 06:11:08 AM,ONTIME,Closed,Case Closed. Closed date : 2015-11-14 06:11:08.6 Case Resolved Assigned CIU,Utility Call-In,Public Works Department,Highway Maintenance,Utility Call-In,PWDx_Utility Call-In,PWDx,,,48 Brooks St  East Boston  MA  02128,1.0,09,1.0,A7,East Boston,1.0,Ward 1,0105,R3,48 Brooks St,2128.0,Address,22491.0,42.3762,-71.0328,Constituent Call,"(42.3762, -71.0328)",-7907335.125620442,5217500.025927457
807843,101001126892,07/11/2014 01:26:39 PM,07/15/2014 01:26:39 PM,08/22/2014 10:10:11 AM,OVERDUE,Closed,Case Closed Case Resolved Location has been made safe. This sidewalk will be referred for permanent repair. See case #101001155438 for status of the permanent repair.,Sidewalk Repair (Make Safe),Public Works Department,Highway Maintenance,Sidewalk Repair (Make Safe),INFO_Reallocation From Dept,INFO,,,12 Monument Ct  Charlestown  MA  02129,3.0,1A,1.0,A15,Charlestown,2.0,Ward 2,0203,R3,12 Monument Ct,2129.0,Address,96918.0,42.3749,-71.0606,Constituent Call,"(42.3749, -71.0606)",-7910429.807464496,5217304.131910144
548683,101001854535,07/08/2016 06:39:31 PM,07/12/2016 08:30:00 AM,07/08/2016 06:48:26 PM,ONTIME,Closed,Case Closed. Closed date : 2016-07-08 18:48:26.933 Case Noted more info needed,Parking Enforcement,Transportation - Traffic Division,Enforcement & Abandoned Vehicles,Parking Enforcement,BTDT_Parking Enforcement,BTDT,https://mayors24.cityofboston.gov/media/boston/report/photos/57802b9c0485d9377aa42cba/report.jpg,,238 Warren St  Roxbury  MA  02119,7.0,10B,7.0,B2,Roxbury,13.0,Ward 12,1201,A,238 Warren St,2119.0,Address,328638.0,42.3226,-71.0819,Citizens Connect App,"(42.3226, -71.0819)",-7912800.912618392,5209426.525060974
784656,101001868639,07/26/2016 05:51:00 PM,,07/27/2016 10:20:31 AM,ONTIME,Closed,Case Closed. Closed date : 2016-07-27 10:20:31.223 Case Noted Hydrant OFF ON ARRIVAL 7/27,Fire Hydrant,Boston Water & Sewer Commission,Fire Hydrant,Fire Hydrant,BWSC_All Cases,BWSC,,,INTERSECTION of Homestead St & Humboldt Ave  Dorchester  MA,9.0,10B,9.0,B2,Roxbury,13.0,12,1209,,INTERSECTION Homestead St & Humboldt Ave,,Intersection,11231.0,42.3594,-71.0587,Constituent Call,"(0, 0)",-7910218.300431989,5214968.784796895
796515,101000338162,10/04/2011 03:33:14 PM,10/06/2011 03:33:12 PM,10/04/2011 03:33:42 PM,ONTIME,Closed,Case Closed Case Scheduled Items have been scheduled for pickup.,Schedule a Bulk Item Pickup,Public Works Department,Sanitation,Schedule a Bulk Item Pickup,PWDx_Schedule a Bulk Item Pickup,PWDx,,,60 Metropolitan Ave  Roslindale  MA  02131,12.0,06,5.0,E5,Roslindale,10.0,Ward 18,1810,R3,60 Metropolitan Ave,2131.0,Address,94968.0,42.2808,-71.1322,Employee Generated,"(42.2808, -71.1322)",-7918400.283005294,5203135.171637715
8972,101001628897,11/05/2015 02:50:00 PM,11/13/2015 02:51:01 PM,11/06/2015 10:15:44 AM,ONTIME,Closed,Case Closed. Closed date : 2015-11-06 10:15:44.19 Case Resolved Gate opened Nov 6  2015.,Ground Maintenance: Smith Playground  Smith Playground,Parks & Recreation Department,Park Maintenance & Safety,Ground Maintenance,PARK_Maintenance_Region 4,PARK,,,235 Western Ave  Allston  MA  02134,11.0,4,9.0,D14,Allston,15.0,22,2201,,235 Western Ave,2134.0,Address,342636.0,42.3637,-71.1318,Constituent Call,"(42.3637, -71.1318)",-7918355.755208977,5215616.5975355115
583155,101000947033,10/15/2013 07:07:16 PM,10/30/2013 08:30:00 AM,01/07/2016 10:50:12 AM,OVERDUE,Closed,Case Closed. Closed date : 2016-01-07 10:50:12.81 Duplicate of Existing Case,Street Light Outages,Public Works Department,Street Lights,Street Light Outages,PARK_Park Improvement Requests,PARK,,,INTERSECTION of Commonwealth Ave & Massachusetts Ave  Boston  MA,4.0,1C,8.0,D4,Back Bay,14.0,Ward 5,0509,,INTERSECTION Commonwealth Ave & Massachusetts Ave,,Intersection,3392.0,42.3489,-71.0885,Citizens Connect App,"(42.3489, -71.0885)",-7913535.621257628,5213387.102746655
622678,101000465075,08/15/2012 12:05:35 PM,08/29/2012 12:05:35 PM,08/15/2012 12:22:32 PM,ONTIME,Closed,Case Closed Case Noted  case has been noted  no contact informatin available.,PublicWorks: Complaint,Mayor's 24 Hour Hotline,Employee & General Comments,General Comments For a Program or Policy,PWDx_General Comments,PWDx,,,,,,,,,,,,,,,,,42.3594,-71.0587,Constituent Call,"(0, 0)",-7910218.300431989,5214968.784796895
369316,101001666881,12/16/2015 02:01:00 PM,01/05/2016 02:01:43 PM,12/30/2015 08:55:42 PM,ONTIME,Closed,Case Closed. Closed date : 2015-12-30 20:55:42.37 Case Resolved e18 officer reports vehicle not at location 12/29.,Abandoned Vehicles,Transportation - Traffic Division,Enforcement & Abandoned Vehicles,Abandoned Vehicles,BTDT_AVRS Interface Queue,BTDT,,,INTERSECTION of Annafran St & Roanoke Rd  Mattapan  MA,12.0,08,5.0,E18,Hyde Park,10.0,Ward 18,1808,,INTERSECTION Annafran St & Roanoke Rd,,Intersection,456.0,42.2715,-71.1116,Constituent Call,"(42.2715, -71.1116)",-7916107.101494952,5201735.988471283
950415,101002005830,02/09/2017 10:56:00 AM,03/11/2017 10:56:39 AM,,OVERDUE,Open,,Heat - Excessive  Insufficient,Inspectional Services,Housing,Heat - Excessive  Insufficient,ISD_Housing (INTERNAL),ISD,,,83 Fairmount Ave  Hyde Park  MA  02136,12.0,08,5.0,E18,Hyde Park,10.0,Ward 18,1818,CL,83 Fairmount Ave,2136.0,Address,55755.0,42.2544,-71.1203,Constituent Call,"(42.2544, -71.1203)",-7917075.581064855,5199163.835513529
711614,101000969986,11/21/2013 06:36:01 PM,11/26/2013 08:30:00 AM,11/22/2013 11:53:58 AM,ONTIME,Closed,Case Closed Case Resolved All of Homestead st was swept with a contract street sweeper. Job complete.,Requests for Street Cleaning,Public Works Department,Street Cleaning,Requests for Street Cleaning,PWDx_District 10B: Roxbury,PWDx,,,120-122 Homestead St  Dorchester  MA  02121,9.0,10B,7.0,B2,Roxbury,13.0,Ward 12,1209,R3,120-122 Homestead St,2121.0,Address,75090.0,42.3115,-71.089,Constituent Call,"(42.3115, -71.089)",-7913591.281003024,5207755.447290276
790942,101000325845,09/07/2011 09:25:22 AM,09/09/2011 09:25:16 AM,09/07/2011 09:26:19 AM,ONTIME,Closed,Case Closed Case Scheduled Items have been scheduled for pickup.,Schedule a Bulk Item Pickup,Public Works Department,Sanitation,Schedule a Bulk Item Pickup,PWDx_Schedule a Bulk Item Pickup,PWDx,,,272 E St  South Boston  MA  02127,6.0,05,2.0,C6,South Boston / South Boston Waterfront,5.0,Ward 6,0602,CD,272 E St,2127.0,Address,50581.0,42.3365,-71.0511,Employee Generated,"(42.3365, -71.0511)",-7909372.272301961,5211519.551765372
4987,101000504650,11/08/2012 09:35:05 AM,,11/08/2012 09:35:06 AM,ONTIME,Closed,Case Closed Internal Case Performed by Highway Maintenance crew.,Pothole Repair (Internal),Public Works Department,Highway Maintenance,Pothole Repair (Internal),PWDx_District 10B: Roxbury,PWDx,,,4 Circuit Sq  Roxbury  MA  02119,7.0,10B,7.0,B2,Roxbury,13.0,Ward 12,1203,R3,4 Circuit Sq,2119.0,Address,154035.0,42.3233,-71.0868,Employee Generated,"(42.3233, -71.0868)",-7913346.37812328,5209531.918225126
324237,101000829219,04/28/2013 01:31:09 PM,05/01/2015 08:30:00 AM,10/07/2014 08:16:36 AM,ONTIME,Closed,Case Closed Case Resolved 2 flag reset job complete will snd crew for brick work.,Sidewalk Repair/Concrete/Dist 10,Public Works Department,Highway Maintenance,Sidewalk Repair (Make Safe),PWDx_Highway Construction,PWDx,,https://cityworker.cityofboston.gov:8443/attachments/report/517d5d232deb3b4e37fb4ec8/closed_photo/Report.jpg,29 Centre St  Roxbury  MA  02119,7.0,10B,7.0,B2,Roxbury,13.0,Ward 9,0905,A,29 Centre St,2119.0,Address,27959.0,42.3298,-71.0934,Citizens Connect App,"(42.3298, -71.0934)",-7914081.086762515,5210510.625038675
258586,101000340897,10/11/2011 05:27:20 PM,10/26/2011 08:30:00 AM,11/29/2011 01:00:31 PM,OVERDUE,Closed,Case Closed Duplicate of Existing Case,Street Light Outages,Public Works Department,Street Lights,Street Light Outages,PWDx_Street Light Outages,PWDx,,,16 Mamelon Cir  Mattapan  MA  02126,8.0,07,4.0,B3,Greater Mattapan,9.0,Ward 18,1804,R2,16 Mamelon Cir,2126.0,Address,88849.0,42.271,-71.0897,Constituent Call,"(42.271, -71.0897)",-7913669.204646579,5201660.769418323
760210,101001664100,12/13/2015 10:53:00 AM,12/21/2015 08:30:00 AM,12/14/2015 06:47:29 AM,ONTIME,Closed,Case Closed. Closed date : 2015-12-14 06:47:29.013 Case Resolved not  parks area.,Ground Maintenance: Jefferson Playground,Parks & Recreation Department,Park Maintenance & Safety,Ground Maintenance,PARK_Maintenance_Region 3,PARK,,,INTERSECTION of Washington St & School St  Jamaica Plain  MA,9.0,02,7.0,E13,Jamaica Plain,11.0,Ward 11,1105,,INTERSECTION Washington St & School St,,Intersection,6024.0,42.3146,-71.0995,Constituent Call,"(42.3146, -71.0995)",-7914760.135656356,5208222.115022204
479831,101000737845,01/16/2013 07:25:33 AM,01/17/2013 08:30:00 AM,01/16/2013 10:41:05 AM,ONTIME,Closed,Case Closed Case Resolved,Traffic Signal Repair,Transportation - Traffic Division,Signs & Signals,Traffic Signal Repair,BTDT_Traffic Signal_Repair,BTDT,,,INTERSECTION of American Legion Hwy & Mount Hope St  Roslindale  MA,12.0,02,5.0,E18,Roslindale,10.0,Ward 18,1807,,INTERSECTION American Legion Hwy & Mount Hope St,,Intersection,393.0,42.2824,-71.1149,Constituent Call,"(42.2824, -71.1149)",-7916474.455814571,5203375.912142054
939037,101002021125,02/21/2017 12:17:00 PM,04/26/2017 12:17:05 PM,02/25/2017 08:53:13 AM,ONTIME,Closed,Case Closed. Closed date : 2017-02-25 08:53:13.627 Duplicate of Existing Case The graffiti tag at this location is a duplicate of the original existing case number 1977262.  This case number has been closed.,Graffiti: Ward 19  1906  Other,Property Management,Graffiti,Graffiti Removal,PROP_GRAF_GraffitiRemoval,PROP,,,666 Centre St  Jamaica Plain  MA  02130,9.0,02,6.0,E13,Jamaica Plain,11.0,Ward 19,1906,C,666 Centre St,2130.0,Address,156275.0,42.3125,-71.1139,Constituent Call,"(42.3125, -71.1139)",-7916363.136323778,5207905.982756919
890964,101001962613,12/02/2016 06:40:00 AM,12/16/2016 08:30:00 AM,12/22/2016 02:22:00 PM,OVERDUE,Closed,Case Closed. Closed date : 2016-12-22 14:22:00.633 Case Resolved replaced glass 3 mantels,Printed - Gas Light Outages RT,Public Works Department,Street Lights,Street Light Outages,PWDx_Street Light Outages - Gas,PWDx,https://mayors24.cityofboston.gov/media/boston/report/photos/58415d9f04852d4ae2f2f22e/1480678575427.jpg,,33 Pinckney St  Boston  MA  02114,3.0,1B,8.0,A1,Beacon Hill,14.0,Ward 5,0503,R1,33 Pinckney St,2114.0,Address,110667.0,42.3589,-71.0664,Employee Generated,"(42.3589, -71.0664)",-7911075.460511098,5214893.460611436
835221,101000795099,03/03/2013 09:57:56 PM,04/02/2013 09:57:56 PM,03/04/2013 11:37:41 AM,ONTIME,Closed,Case Closed :,Heat - Excessive  Insufficient,Inspectional Services,Housing,Heat - Excessive  Insufficient,ISD_Housing (INTERNAL),ISD,,,97 Norfolk St  Dorchester  MA  02124,8.0,07,4.0,B3,Dorchester,9.0,Ward 17,1705,R3,97 Norfolk St,2124.0,Address,103411.0,42.2886,-71.07600000000001,Self Service,"(42.2886, -71.076)",-7912144.127622712,5204308.83934507
386634,101001144129,08/05/2014 05:22:48 PM,,,ONTIME,Open,,Animal Generic Request,Animal Control,Animal Issues,Animal Generic Request,INFO01_GenericeFormforOtherServiceRequestTypes,INFO,,,780 William T Morrissey Blvd  Dorchester  MA  02122,8.0,07,3.0,C11,Dorchester,7.0,Ward 16,1602,C,780 William T Morrissey Blvd,2122.0,Address,149932.0,42.2955,-71.0472,Constituent Call,"(42.2955, -71.0472)",-7908938.126287866,5205347.205004185
732262,101001764591,04/09/2016 11:25:00 AM,04/09/2017 11:25:09 AM,06/15/2016 08:36:50 AM,ONTIME,Closed,Case Closed. Closed date : 2016-06-15 08:36:50.223 Case Resolved The tree was pruned by Northern Tree Service  to the City of Boston tree pruning specifications.,Tree Maintenance Requests,Parks & Recreation Department,Trees,Tree Maintenance Requests,PARK_Tree Maintenance Request,PARK,https://mayors24.cityofboston.gov/media/boston/report/photos/57091ecf0485c52e7782c8f5/report.jpg,,17 Melrose St  Boston  MA  02116,4.0,1C,2.0,A1,Back Bay,6.0,Ward 5,0501,R3,17 Melrose St,2116.0,Address,93942.0,42.3492,-71.0677,Citizens Connect App,"(42.3492, -71.0677)",-7911220.175849129,5213432.289995516
174014,101001576025,09/11/2015 12:50:11 PM,09/14/2015 12:50:11 PM,09/11/2015 02:48:41 PM,ONTIME,Closed,Case Closed. Closed date : 2015-09-11 14:48:41.793 Case Resolved Location has been made safe. This sidewalk will be referred for permanent repair. See case #101001576223 for status of the permanent repair.,Sidewalk Repair (Make Safe),Public Works Department,Highway Maintenance,Sidewalk Repair (Make Safe),PWDx_District 06: West Roxbury and Roslindale,PWDx,https://cityworker.cityofboston.gov:8443/attachments/report/55f30647d052f8c25f1e804e/photo/Report.jpg,,16 Chisholm Rd  Roslindale  MA  02131,12.0,06,5.0,E5,Roslindale,10.0,Ward 18,1810,R1,16 Chisholm Rd,2131.0,Address,32267.0,42.2757,-71.1274,City Worker App,"(42.2757, -71.1274)",-7917865.949449485,5202367.852075031
293822,101001706446,02/02/2016 05:47:34 AM,02/03/2016 08:30:00 AM,02/02/2016 05:54:09 AM,ONTIME,Closed,Case Closed. Closed date : 2016-02-02 05:54:09.913 Duplicate of Existing Case Case # 1706444,Parking Enforcement,Transportation - Traffic Division,Enforcement & Abandoned Vehicles,Parking Enforcement,BTDT_Parking Enforcement,BTDT,https://mayors24.cityofboston.gov/media/boston/report/photos/56b089400485b6d1b7f71150/report.jpg,,102 Buttonwood St  Dorchester  MA  02125,6.0,03,2.0,C6,Dorchester,5.0,Ward 7,0708,R3,102 Buttonwood St,2125.0,Address,24382.0,42.3221,-71.0561,Citizens Connect App,"(42.3221, -71.0561)",-7909928.869755927,5209351.244947336
496582,101000937662,09/30/2013 08:55:18 PM,10/15/2013 08:30:00 AM,10/02/2013 01:27:59 PM,ONTIME,Closed,Case Closed Case Resolved,Street Light Outages,Public Works Department,Street Lights,Street Light Outages,PWDx_Street Light Outages,PWDx,,,314-316 W Fourth St  South Boston  MA  02127,6.0,05,2.0,C6,South Boston / South Boston Waterfront,5.0,Ward 6,0603,CM,314-316 W Fourth St,2127.0,Address,60159.0,42.3381,-71.0513,Citizens Connect App,"(42.3381, -71.0513)",-7909394.536200118,5211760.505390504
93708,101001883409,08/15/2016 05:26:00 PM,08/19/2016 08:30:00 AM,,OVERDUE,Open,,Building Inspection Request,Inspectional Services,Building,Building Inspection Request,ISD_Building (INTERNAL),ISD,,,8 Mount Cushing Ter  Dorchester  MA  02125,7.0,03,7.0,C11,Dorchester,13.0,Ward 13,1305,CM,8 Mount Cushing Ter,2125.0,Address,98141.0,42.3157,-71.0635,Constituent Call,"(42.3157, -71.0635)",-7910752.6339877965,5208387.712323424
267244,101000406509,04/10/2012 09:27:59 AM,05/08/2012 09:27:58 AM,04/17/2012 01:38:13 PM,ONTIME,Closed,Case Closed Case Resolved not at location 4/17.,Abandoned Vehicles,Transportation - Traffic Division,Enforcement & Abandoned Vehicles,Abandoned Vehicles,BTDT_AVRS Interface Queue,BTDT,,,25 W Fifth St  South Boston  MA  02127,6.0,05,2.0,C6,South Boston / South Boston Waterfront,5.0,Ward 6,0601,R3,25 W Fifth St,2127.0,Address,58252.0,42.3399,-71.0565,Employee Generated,"(42.3399, -71.0565)",-7909973.397552243,5212031.585547151
387890,101001275414,02/04/2015 03:36:43 PM,02/06/2015 03:36:42 PM,02/05/2015 11:36:40 AM,ONTIME,Closed,Case Closed Case Resolved plowed sanded,Request for Snow Plowing,Public Works Department,Street Cleaning,Request for Snow Plowing,PWDx_District 03: North Dorchester,PWDx,,,24 Grant St  Dorchester  MA  02125,7.0,03,3.0,C11,Dorchester,7.0,Ward 13,1307,R2,24 Grant St,2125.0,Address,65942.0,42.3178,-71.0553,Constituent Call,"(42.3178, -71.0553)",-7909839.814163291,5208703.860663519
715570,101001816510,06/15/2016 03:55:32 PM,,06/20/2016 04:31:31 PM,ONTIME,Closed,Case Closed. Closed date : 2016-06-20 16:31:31.06 Bulk Item Automation,Schedule Bulk Item Pickup,Public Works Department,Sanitation,Schedule a Bulk Item Pickup SS,PWDx_Schedule a Bulk Item Pickup,PWDx,,,7 Priesing St  Jamaica Plain  MA  02130,9.0,10A,6.0,E13,Jamaica Plain,11.0,Ward 10,1007,R3,7 Priesing St,2130.0,Address,112759.0,42.3217,-71.1043,Self Service,"(42.3217, -71.1043)",-7915294.469212161,5209291.021287154
557254,101001844316,06/24/2016 04:05:00 PM,06/24/2017 04:05:25 PM,10/25/2016 07:49:10 AM,ONTIME,Closed,Case Closed. Closed date : 2016-10-25 07:49:10.933 Case Resolved The tree was pruned by Northern Tree Service  to the City of Boston tree pruning specifications.,Tree Maintenance Requests,Parks & Recreation Department,Trees,Tree Maintenance Requests,PARK_Tree Maintenance Request,PARK,,,31 Prince St  Jamaica Plain  MA  02130,9.0,02,6.0,E13,Jamaica Plain,11.0,Ward 19,1909,R1,31 Prince St,2130.0,Address,113077.0,42.3102,-71.1207,Constituent Call,"(42.3102, -71.1207)",-7917120.108861172,5207559.754759122
749882,101000715353,12/03/2012 09:41:28 AM,12/05/2012 09:41:28 AM,12/03/2012 09:41:30 AM,ONTIME,Closed,Case Closed,Requests for Street Cleaning,Public Works Department,Street Cleaning,Requests for Street Cleaning,PWDx_District 03: North Dorchester,PWDx,,,530 Blue Hill Ave  Dorchester  MA  02121,7.0,03,4.0,B2,Greater Mattapan,13.0,Ward 14,1403,RC,530 Blue Hill Ave,2121.0,Address,156988.0,42.3051,-71.0843,City Worker App,"(42.3051, -71.0843)",-7913068.079396296,5206792.076932596
780038,101000995336,01/03/2014 09:14:06 AM,01/07/2014 09:14:06 AM,01/05/2014 12:28:54 PM,ONTIME,Closed,Case Closed Case Resolved,Snow/Ice Control Internal,Public Works Department,Street Cleaning,Snow/Ice Control,PWDx_District 1C: Downtown,PWDx,,,31 Worcester Sq  Roxbury  MA  02118,4.0,1C,2.0,D4,South End,6.0,Ward 8,0802,R1,31 Worcester Sq,2118.0,Address,152285.0,42.3362,-71.0745,City Worker App,"(42.3362, -71.0745)",-7911977.148386522,5211474.37364316
864467,101000297256,07/06/2011 11:14:18 AM,11/03/2011 11:14:18 AM,,OVERDUE,Open,,Unsatisfactory Living Conditions,Inspectional Services,Housing,Unsatisfactory Living Conditions,ISD_Housing (INTERNAL),ISD,,,24 Mallard Ave  Dorchester  MA  02124,8.0,07,4.0,B3,Dorchester,9.0,Ward 17,1705,R3,24 Mallard Ave,2124.0,Address,267537.0,42.2908,-71.0772,Constituent Call,"(42.2908, -71.0772)",-7912277.711011664,5204639.900101502
639931,101000473764,09/04/2012 09:27:42 AM,09/06/2012 09:27:42 AM,09/13/2012 08:02:31 AM,OVERDUE,Closed,Case Closed NOVIO: No Violation Found/No Cause,Unsanitary Conditions - Establishment,Inspectional Services,Health,Unsanitary Conditions - Establishment,ISD_Health (INTERNAL),ISD,,,140 Northern Ave  Boston  MA  02210,6.0,05,2.0,C6,South Boston / South Boston Waterfront,5.0,Ward 6,0601,RC,140 Northern Ave,2210.0,Address,103864.0,42.3534,-71.0415,Constituent Call,"(42.3534, -71.0415)",-7908303.605190344,5214064.934125496
920153,101001960478,11/29/2016 10:05:00 AM,12/13/2016 10:05:04 AM,02/08/2017 08:57:15 AM,OVERDUE,Closed,Case Closed. Closed date : 2017-02-08 08:57:15.017 Case Resolved Street has been converted to LEDs,PRINTED :  Street Light Outage (ML),Public Works Department,Street Lights,Street Light Outages,PWDx_Street Light Outages,PWDx,,,339 Norfolk St  Dorchester  MA  02124,8.0,07,4.0,B3,Greater Mattapan,9.0,Ward 14,1413,R3,339 Norfolk St,2124.0,Address,103284.0,42.2832,-71.0844,Constituent Call,"(42.2832, -71.0844)",-7913079.2113453755,5203496.284686766
760229,101000354776,11/16/2011 01:09:49 PM,11/30/2011 01:09:43 PM,,OVERDUE,Open,,Other: Comment,Mayor's 24 Hour Hotline,Employee & General Comments,General Comments For a Program or Policy,INFO_General Comments Complaints Compliments,INFO,,,,,,,,,,,,,,,,,42.3594,-71.0587,Constituent Call,"(0, 0)",-7910218.300431989,5214968.784796895
364388,101001957516,11/23/2016 08:05:24 AM,11/25/2016 08:30:00 AM,11/23/2016 08:36:31 AM,ONTIME,Closed,Case Closed. Closed date : 2016-11-23 08:36:31.763 Case Resolved Two tickets issued.,Parking Enforcement,Transportation - Traffic Division,Enforcement & Abandoned Vehicles,Parking Enforcement,BTDT_Parking Enforcement,BTDT,https://mayors24.cityofboston.gov/media/boston/report/photos/5835940c04859c3a5cae8d67/image.jpeg,,909 E Broadway  South Boston  MA  02127,6.0,05,2.0,C6,South Boston / South Boston Waterfront,5.0,Ward 6,0609,R3,909 E Broadway,2127.0,Address,21324.0,42.3356,-71.0276,Citizens Connect App,"(42.3356, -71.0276)",-7906756.264268319,5211384.018045289
168280,101000812807,03/28/2013 10:33:21 AM,04/01/2013 10:33:21 AM,03/28/2013 01:15:43 PM,ONTIME,Closed,Case Closed Case Noted no tire found ................,Requests for Street Cleaning,Public Works Department,Street Cleaning,Requests for Street Cleaning,PWDx_District 07: South Dorchester,PWDx,,,INTERSECTION of Babson St & Blue Hill Ave  Mattapan  MA,8.0,07,4.0,B3,Greater Mattapan,9.0,Ward 18,1804,,INTERSECTION Babson St & Blue Hill Ave,,Intersection,852.0,42.2701,-71.0936,Constituent Call,"(42.2701, -71.0936)",-7914103.350660672,5201525.37662662
932934,101002019708,02/19/2017 02:32:27 PM,,02/19/2017 03:01:32 PM,ONTIME,Closed,Case Closed. Closed date : 2017-02-19 15:01:32.947 Case Resolved 1 syringe recovered from 29 Trull St  Dorchester,Needle Pickup,Mayor's 24 Hour Hotline,Needle Program,Needle Pickup,GEN_Needle_Pickup,GEN_,https://mayors24.cityofboston.gov/media/boston/report/photos/58a9f2c30485450aec7b5c6e/needle.jpg,,29 Trull St  Dorchester  MA  02125,7.0,03,3.0,C11,Dorchester,8.0,Ward 15,1501,R1,29 Trull St,2125.0,Address,170564.0,42.3118,-71.0676,Citizens Connect App,"(42.3118, -71.0676)",-7911209.043900048,5207800.607679141
214704,101001339263,03/22/2015 07:50:44 PM,03/24/2015 08:30:00 AM,03/23/2015 01:44:27 PM,ONTIME,Closed,Case Closed Case Resolved ON CALL CREW CHECKED LOCATION FOUND (6) GAS LIGHTS WERE OUT REPLACED MANTELS  SECURED GAS NOZZELES REPAIRED (5) LIGHTS WILL NEED TO REPLACE BURNER B.LYNCH  K.HOGE  .,Major System Failure  // PRINTED //,Public Works Department,Street Lights,Major System Failure,PWDx_Major System Failure,PWDx,,,INTERSECTION of Devens St & Main St  Charlestown  MA,3.0,1A,1.0,A15,Charlestown,2.0,Ward 2,0201,,INTERSECTION Devens St & Main St,,Intersection,4048.0,42.373999999999995,-71.0632,Constituent Call,"(42.374, -71.0632)",-7910719.238140559,5217168.515350485
582355,101001884712,08/17/2016 09:24:00 AM,08/18/2016 09:24:40 AM,,OVERDUE,Open,,Traffic Signal Inspection,Transportation - Traffic Division,Signs & Signals,Traffic Signal Inspection,INFO_Mass DOT,INFO,,,INTERSECTION of Washington St & South St  Roslindale  MA,12.0,06,5.0,E5,Roslindale,10.0,20,2002,,INTERSECTION Washington St & South St,,Intersection,17078.0,42.3594,-71.0587,Constituent Call,"(0, 0)",-7910218.300431989,5214968.784796895
803369,101001659626,12/07/2015 10:32:00 AM,,12/10/2015 04:32:56 PM,ONTIME,Closed,Case Closed. Closed date : 2015-12-10 16:32:56.837 Bulk Item Automation,Schedule a Bulk Item Pickup,Public Works Department,Sanitation,Schedule a Bulk Item Pickup,PWDx_Schedule a Bulk Item Pickup,PWDx,,,141-143 Walworth St  Roslindale  MA  02131,12.0,06,5.0,E5,Roslindale,10.0,Ward 20,2009,R2,141-143 Walworth St,2131.0,Address,142596.0,42.2821,-71.1376,Constituent Call,"(42.2821, -71.1376)",-7919001.408255578,5203330.7728318265
431407,101000856985,06/10/2013 03:15:55 PM,,06/17/2013 09:48:34 PM,ONTIME,Closed,Case Closed Bulk Item Automation,Schedule Bulk Item Pickup,Public Works Department,Sanitation,Schedule a Bulk Item Pickup SS,PWDx_Schedule a Bulk Item Pickup,PWDx,,,30 Bigelow St  Brighton  MA  02135,11.0,04,9.0,D14,Allston / Brighton,15.0,Ward 22,2213,R2,30 Bigelow St,2135.0,Address,188706.0,42.3527,-71.168,Self Service,"(42.3527, -71.168)",-7922385.520775694,5213959.490501389
490600,101001723063,02/23/2016 05:23:00 PM,02/24/2016 05:23:16 PM,02/25/2016 02:51:52 PM,OVERDUE,Closed,Case Closed. Closed date : 2016-02-25 14:51:52.39 Case Resolved Resolved issue running normal operation,Traffic Signal Inspection,Transportation - Traffic Division,Signs & Signals,Traffic Signal Inspection,BTDT_Traffic Signal_Repair,BTDT,,,INTERSECTION of Marginal Rd & Washington St  Boston  MA,4.0,1C,2.0,A1,Downtown / Financial District,4.0,3,0308,,INTERSECTION Marginal Rd & Washington St,,Intersection,15879.0,42.3594,-71.0587,Constituent Call,"(0, 0)",-7910218.300431989,5214968.784796895
86947,101001577265,09/13/2015 09:15:00 PM,09/15/2015 08:30:00 AM,09/15/2015 11:27:57 AM,OVERDUE,Closed,Case Closed. Closed date : 2015-09-15 11:27:57.13 Case Resolved Location has been made safe. This sidewalk will be referred for permanent repair. See case #101001578961 for status of the permanent repair.,Sidewalk Repair (Make Safe),Public Works Department,Highway Maintenance,Sidewalk Repair (Make Safe),PWDx_District 1C: Downtown,PWDx,,,130 Dartmouth St  Boston  MA  02116,4.0,1C,2.0,D4,South End,6.0,Ward 4,0402,E,130 Dartmouth St,2116.0,Address,158249.0,42.3468,-71.0761,Constituent Call,"(42.3468, -71.0761)",-7912155.259571791,5213070.7980428925
285381,101001624785,10/31/2015 12:16:28 PM,11/09/2015 08:30:00 AM,11/02/2015 12:10:48 PM,ONTIME,Closed,Case Closed. Closed date : 2015-11-02 12:10:48.093 Case Resolved removed grafitti,PWD Graffiti,Public Works Department,Highway Maintenance,PWD Graffiti,PWDx_District 10A: Roxbury,PWDx,https://mayors24.cityofboston.gov/media/boston/report/photos/5634e956048589d564922437/photo_20151031_121459.jpg,https://cityworker.cityofboston.gov:8443/attachments/report/5634e999d052cda8c3966cff/closed_photo/Report.jpg,155-201 Brookline Ave  Boston  MA  02215,4.0,10A,8.0,D4,Fenway / Kenmore / Audubon Circle / Longwood,14.0,Ward 21,2101,EA,155-201 Brookline Ave,2215.0,Address,22089.0,42.3449,-71.1014,Citizens Connect App,"(42.3449, -71.1014)",-7914971.64268886,5212784.626701254
430593,101001779561,04/30/2016 02:14:00 AM,05/30/2016 02:14:27 AM,05/26/2016 09:08:34 AM,ONTIME,Closed,Case Closed. Closed date : 2016-05-26 09:08:34.297 VIOCOR: Violation Corrected,Rodent Activity,Inspectional Services,Environmental Services,Rodent Activity,ISD_Environmental Services (INTERNAL),ISD,,,1724 Centre St  West Roxbury  MA  02132,9.0,06,6.0,E5,West Roxbury,10.0,Ward 20,2007,C,1724 Centre St,2132.0,Address,401381.0,42.2871,-71.1495,Constituent Call,"(42.2871, -71.1495)",-7920326.110196019,5204083.122731191
867477,101000316183,08/19/2011 08:13:06 AM,,08/19/2011 09:06:42 AM,ONTIME,Closed,Case Closed Case Resolved pothole patched 08/18/11,Highway Maintenance,Public Works Department,Highway Maintenance,Highway Maintenance,PWDx_District 02: Jamaica Plain,PWDx,,,71 Weld Hill St  Jamaica Plain  MA  02130,12.0,02,6.0,E13,Jamaica Plain,11.0,Ward 11,1108,CM,71 Weld Hill St,2130.0,Address,147276.0,42.2972,-71.1117,Employee Generated,"(42.2972, -71.1117)",-7916118.233444031,5205603.051691651
660219,101001744894,03/11/2016 04:49:00 PM,03/14/2016 04:49:16 PM,03/14/2016 10:53:45 AM,ONTIME,Closed,Case Closed. Closed date : 2016-03-14 10:53:45.563 Case Resolved during my inspection no trash or recycle on curb .3/14/16,Missed Trash: District 02,Public Works Department,Sanitation,Missed Trash/Recycling/Yard Waste/Bulk Item,PWDx_Missed Trash\Recycling\Yard Waste\Bulk Item,PWDx,,https://cityworker.cityofboston.gov:8443/attachments/report/56e33da2d052649456b81bcf/closed_photo/Report.jpg,107-109 Sheridan St  Jamaica Plain  MA  02130,9.0,02,6.0,E13,Jamaica Plain,11.0,Ward 19,1901.0,R2,107-109 Sheridan St,2130.0,Address,169695.0,42.3192,-71.1063,Constituent Call,"(42.3192, -71.1063)",-7915517.108193749,5208914.632084913
905495,101001990590,01/17/2017 04:29:00 PM,04/17/2017 04:29:47 PM,,ONTIME,Open,,Cross Metering - Sub-Metering,Inspectional Services,Housing,Cross Metering - Sub-Metering,ISD_Housing (INTERNAL),ISD,,,38 Fordham Rd  Allston  MA  02134,11.0,04,9.0,D14,Allston / Brighton,14.0,Ward 21,2103,R3,38 Fordham Rd,2134.0,Address,59257.0,42.3511,-71.1278,Constituent Call,"(42.3511, -71.1278)",-7917910.477245803,5213718.480913229
530687,101001920693,09/29/2016 03:11:00 PM,09/30/2016 03:11:35 PM,09/30/2016 11:00:15 AM,ONTIME,Closed,Case Closed. Closed date : 2016-09-30 11:00:15.97 Case Referred to External Agency This was sent to the City of Cambridge.,Requests for Street Cleaning,Public Works Department,Street Cleaning,Requests for Street Cleaning,INFO_Reallocation From Dept,INFO,,,1 Science Park  Boston  MA  02114,3.0,1B,8.0,A1,Boston,3.0,03,,,1 Science Park,2114.0,Address,351500.0,42.3674,-71.0706,Citizens Connect App,"(42.3674, -71.0706)",-7911543.002372429,5216174.053289166
560559,101000397312,03/19/2012 05:09:22 PM,04/03/2012 08:30:00 AM,03/21/2012 03:09:19 PM,ONTIME,Closed,Case Closed Case Resolved Replaced burnt 150 SV lamp,Street Light Outages,Public Works Department,Street Lights,Street Light Outages,PWDx_Street Light Outages,PWDx,,,20 Goodrich Rd  Jamaica Plain  MA  02130,9.0,02,6.0,E13,Jamaica Plain,11.0,Ward 19,1905,R1,20 Goodrich Rd,2130.0,Address,65266.0,42.3157,-71.1152,Constituent Call,"(42.3157, -71.1152)",-7916507.851661809,5208387.712323424
171630,101001080491,05/02/2014 02:18:53 PM,05/05/2014 02:18:48 PM,05/05/2014 08:38:41 AM,ONTIME,Closed,Case Closed Case Resolved done tree crew,Tree Emergencies,Parks & Recreation Department,Trees,Tree Emergencies,PARK_Tree Emergencies,PARK,,,244 Stratford St  West Roxbury  MA  02132,12.0,06,6.0,E5,West Roxbury,12.0,Ward 20,2010,R1,244 Stratford St,2132.0,Address,131207.0,42.2791,-71.1441,Constituent Call,"(42.2791, -71.1441)",-7919724.984945733,5202879.391549912
471824,101000787172,02/19/2013 09:26:15 PM,,02/21/2013 09:47:14 PM,ONTIME,Closed,Case Closed Bulk Item Automation,Schedule Bulk Item Pickup,Public Works Department,Sanitation,Schedule a Bulk Item Pickup SS,PWDx_Schedule a Bulk Item Pickup,PWDx,,,213 Newbury St  Boston  MA  02116,4.0,1C,8.0,D4,Back Bay,14.0,Ward 5,0508,RC,213 Newbury St,2116.0,Address,282049.0,42.3502,-71.0812,Self Service,"(42.3502, -71.0812)",-7912722.988974837,5213582.91571595
788199,101000940193,10/04/2013 08:42:18 AM,10/08/2013 08:42:18 AM,10/04/2013 03:16:22 PM,ONTIME,Closed,Case Closed Case Resolved,Requests for Street Cleaning,Public Works Department,Street Cleaning,Requests for Street Cleaning,PWDx_District 03: North Dorchester,PWDx,,,151 Hancock St  Dorchester  MA  02125,7.0,03,3.0,C11,Dorchester,8.0,Ward 15,1504,R3,151 Hancock St,2125.0,Address,68890.0,42.3109,-71.0627,City Worker App,"(42.3109, -71.0627)",-7910663.578395163,5207665.127158283
74833,101001048936,03/18/2014 09:08:13 AM,03/20/2014 09:08:13 AM,03/18/2014 02:44:09 PM,ONTIME,Closed,Case Closed Case Resolved potholes patched,Request for Pothole Repair,Public Works Department,Highway Maintenance,Request for Pothole Repair,PWDx_District 02: Jamaica Plain,PWDx,,,107 Chestnut Ave  Jamaica Plain  MA  02130,9.0,02,6.0,E13,Jamaica Plain,11.0,Ward 10,1009,R1,107 Chestnut Ave,2130.0,Address,31021.0,42.3194,-71.1052,City Worker App,"(42.3194, -71.1052)",-7915394.656753875,5208944.742670774
890239,101000790507,02/24/2013 01:53:15 AM,02/26/2013 08:30:00 AM,02/25/2013 03:07:55 PM,ONTIME,Closed,Case Closed Case Resolved,Traffic Signal Repair,Transportation - Traffic Division,Signs & Signals,Traffic Signal Repair,BTDT_Traffic Signal_Repair,BTDT,,,INTERSECTION of Boylston St & Hemenway St  Boston  MA,4.0,10A,8.0,D4,Back Bay,14.0,Ward 4,0407,,INTERSECTION Boylston St & Hemenway St,,Intersection,1769.0,42.3469,-71.0891,Constituent Call,"(42.3469, -71.0891)",-7913602.4129521055,5213085.859932039
604260,101000333962,09/25/2011 09:09:52 PM,11/29/2011 08:30:00 AM,10/12/2011 10:09:46 AM,ONTIME,Closed,Case Closed Case Resolved   THIS REQUEST HAS BEEN COMPLETED,Graffiti Removal,Property Management,Graffiti,Graffiti Removal,PROP_GRAF_GraffitiRemoval,PROP,,,163 Devon St  Dorchester  MA  02121,7.0,03,4.0,C11,Roxbury,13.0,Ward 14,1401,R3,163 Devon St,2121.0,Address,47561.0,42.306999999999995,-71.0755,Citizens Connect App,"(42.307, -71.0755)",-7912088.467877317,5207078.067285161
689286,101001158190,08/27/2014 08:27:49 AM,09/25/2014 08:30:00 AM,09/08/2014 08:07:18 AM,ONTIME,Closed,Case Closed Case Resolved cart # 0614402164 dropped off on 9-4-14,Request for Recycling Cart,Public Works Department,Recycling,Request for Recycling Cart,PWDx_Recycling,PWDx,,,581 Cambridge St  Allston  MA  02134,11.0,04,9.0,D14,Allston / Brighton,15.0,Ward 21,2106,R1,581 Cambridge St,2134.0,Address,25164.0,42.3525,-71.1413,Self Service,"(42.3525, -71.1413)",-7919413.290371513,5213929.363967346
733432,101000330992,09/19/2011 09:51:30 AM,09/21/2011 09:51:30 AM,09/19/2011 09:52:30 AM,ONTIME,Closed,Case Closed Case Scheduled Items have been scheduled for pickup.,Schedule a Bulk Item Pickup,Public Works Department,Sanitation,Schedule a Bulk Item Pickup,PWDx_Schedule a Bulk Item Pickup,PWDx,,,15 Beckler Ave  South Boston  MA  02127,6.0,05,2.0,C6,South Boston / South Boston Waterfront,5.0,Ward 6,0606,R2,15 Beckler Ave,2127.0,Address,185782.0,42.3334,-71.0365,Self Service,"(42.3334, -71.0365)",-7907747.007736379,5211052.721561536
31612,101001912864,09/19/2016 08:23:55 PM,09/21/2016 08:30:00 AM,09/19/2016 08:52:35 PM,ONTIME,Closed,Case Closed. Closed date : 2016-09-19 20:52:35.21 Case Noted all in compliance at this time,Parking Enforcement,Transportation - Traffic Division,Enforcement & Abandoned Vehicles,Parking Enforcement,BTDT_Parking Enforcement,BTDT,https://mayors24.cityofboston.gov/media/boston/report/photos/57e081976963aae66f362436/report.jpg,,159 Beacon St  Boston  MA  02116,4.0,1C,8.0,D4,Back Bay,14.0,Ward 5,0506,R1,159 Beacon St,2116.0,Address,9699.0,42.3544,-71.0752,Citizens Connect App,"(42.3544, -71.0752)",-7912055.072030077,5214215.56991147
479873,101001660362,12/08/2015 08:45:00 AM,12/22/2015 08:45:27 AM,12/08/2015 10:34:49 AM,ONTIME,Closed,Case Closed. Closed date : 2015-12-08 10:34:49.83 Case Noted I sent constituent an e-mail in regards to her issue with recycle collection. We will monitor locaton .,PublicWorks: Complaint,Mayor's 24 Hour Hotline,Employee & General Comments,General Comments For a Program or Policy,PWDx_Missed Trash\Recycling\Yard Waste\Bulk Item,PWDx,,,15 Aspinwall Rd  Dorchester  MA  02124,8.0,07,4.0,B3,Dorchester,9.0,Ward 17,1703,R2,15 Aspinwall Rd,2124.0,Address,5577.0,42.2919,-71.0728,Constituent Call,"(42.2919, -71.0728)",-7911787.905252174,5204805.434815889
934260,101002017981,02/17/2017 11:04:38 AM,02/21/2017 11:04:37 AM,02/21/2017 10:06:30 AM,ONTIME,Closed,Case Closed. Closed date : 2017-02-21 10:06:30.0 Case Resolved Completed,Request for Pothole Repair,Public Works Department,Highway Maintenance,Request for Pothole Repair,PWDx_District 1C: Downtown,PWDx,,https://cityworker.cityofboston.gov:8443/attachments/report/58a71f59d052c51cc8fa9c2c/closed_photo/Report.jpg,INTERSECTION of Massachusetts Ave & Newbury St  Boston  MA,4.0,1C,7.0,D4,Back Bay,14.0,5,0509,,INTERSECTION Massachusetts Ave & Newbury St,,Intersection,14826.0,42.3594,-71.0587,Citizens Connect App,"(0, 0)",-7910218.300431989,5214968.784796895
595755,101001285495,02/10/2015 12:55:56 PM,02/12/2015 12:55:56 PM,02/12/2015 06:09:33 PM,OVERDUE,Closed,Case Closed Case Noted Snow has been removed.,Request for Snow Plowing,Public Works Department,Street Cleaning,Request for Snow Plowing,PWDx_District 07: South Dorchester,PWDx,,,INTERSECTION of Grace St & Roslin St  Dorchester  MA,8.0,07,4.0,C11,Dorchester,8.0,Ward 17,1709,,INTERSECTION Grace St & Roslin St,,Intersection,5407.0,42.2863,-71.0703,Constituent Call,"(42.2863, -71.0703)",-7911509.606525192,5203962.742734722
825231,101001663376,12/11/2015 12:45:55 PM,01/04/2016 12:46:00 PM,12/14/2015 07:01:42 AM,ONTIME,Closed,Case Closed. Closed date : 2015-12-14 07:01:42.98 Case Noted Removed broken cart r9#0045322 and replaced with cart 515#0029264 on 12/14/15.,Request for Recycling Cart,Public Works Department,Recycling,Request for Recycling Cart,PWDx_IPL Damaged Cart Replacement,PWDx,https://cityworker.cityofboston.gov:8443/attachments/report/566b0bd8d052b1c79cef530e/photo/Report.jpg,,51 Manor St  Dorchester  MA  02122,8.0,07,3.0,C11,Dorchester,7.0,Ward 16,1607,R1,51 Manor St,2122.0,Address,88999.0,42.2911,-71.0541,City Worker App,"(42.2911, -71.0541)",-7909706.230774341,5204685.045645997
194034,101001638786,11/19/2015 01:02:00 PM,12/04/2015 01:02:10 PM,11/20/2015 12:55:14 PM,ONTIME,Closed,Case Closed. Closed date : 2015-11-20 12:55:14.503 Case Resolved Work complete 11/20/15.,Sign Repair,Transportation - Traffic Division,Signs & Signals,Sign Repair,BTDT_Sign Shop_Sign Installation,BTDT,,,4 Prescott St  Hyde Park  MA  02136,12.0,08,5.0,E18,Hyde Park,10.0,Ward 18,1820,RC,4 Prescott St,2136.0,Address,112649.0,42.2372,-71.1326,City Worker App,"(42.2372, -71.1326)",-7918444.810801612,5196577.344161608
789090,101000874451,07/07/2013 11:09:33 PM,10/05/2013 11:09:32 PM,,OVERDUE,Open,,Chronic Dampness/Mold,Inspectional Services,Housing,Chronic Dampness/Mold,ISD_Housing (INTERNAL),ISD,,,19 Peterborough St  Boston  MA  02215,4.0,10A,8.0,D4,Fenway / Kenmore / Audubon Circle / Longwood,14.0,Ward 5,0502,A,19 Peterborough St,2215.0,Address,292936.0,42.3443,-71.096,Self Service,"(42.3443, -71.096)",-7914370.5174385775,5212694.258600719
694291,101001781482,05/03/2016 11:55:00 AM,,05/04/2016 04:33:26 PM,ONTIME,Closed,Case Closed. Closed date : 2016-05-04 16:33:26.353 Bulk Item Automation,Schedule a Bulk Item Pickup,Public Works Department,Sanitation,Schedule a Bulk Item Pickup,PWDx_Schedule a Bulk Item Pickup,PWDx,,,1455 Commonwealth Ave  Brighton  MA  02135,11.0,04,9.0,D14,Allston / Brighton,15.0,Ward 21,2109,A,1455 Commonwealth Ave,2135.0,Address,215025.0,42.3487,-71.1412,Constituent Call,"(42.3487, -71.1412)",-7919402.158422434,5213356.978033894
927450,101002014388,02/15/2017 09:10:27 AM,02/16/2017 09:10:27 AM,02/15/2017 10:09:21 AM,ONTIME,Closed,Case Closed. Closed date : 2017-02-15 10:09:21.643 Case Resolved space savers removed,Space Savers,Public Works Department,Sanitation,Space Savers,PWDx_District 03: North Dorchester,PWDx,https://mayors24.cityofboston.gov/media/boston/report/photos/58a46148048583265fdde01f/1487166119102.jpg,https://cityworker.cityofboston.gov:8443/attachments/report/58a461a2d052e81b93e62a94/closed_photo/Report.jpg,98 Auckland St  Dorchester  MA  02125,7.0,03,3.0,C11,Dorchester,8.0,Ward 15,1506,CM,98 Auckland St,2125.0,Address,6551.0,42.3112,-71.0564,Employee Generated,"(42.3112, -71.0564)",-7909962.265603163,5207710.287116657
559956,101001284355,02/09/2015 08:59:49 PM,02/12/2015 08:30:00 AM,02/12/2015 06:07:00 PM,OVERDUE,Closed,Case Closed Case Noted Snow has been removed.,Request for Snow Plowing,Public Works Department,Street Cleaning,Request for Snow Plowing,PWDx_District 02: Jamaica Plain,PWDx,,,7 Glade Ave  Jamaica Plain  MA  02130,9.0,02,6.0,E13,Jamaica Plain,11.0,Ward 11,1107,R3,7 Glade Ave,2130.0,Address,63731.0,42.308,-71.1008,Constituent Call,"(42.308, -71.1008)",-7914904.850994387,5207228.591990385
726765,101001790476,05/15/2016 12:18:20 PM,05/18/2016 08:30:00 AM,05/15/2016 01:44:35 PM,ONTIME,Closed,Case Closed. Closed date : 2016-05-15 13:44:35.967 Case Noted Cited 75 Fulton for trash out early,Improper Storage of Trash (Barrels),Public Works Department,Code Enforcement,Improper Storage of Trash (Barrels),PWDx_Code Enforcement,PWDx,https://mayors24.cityofboston.gov/media/boston/report/photos/5738a14a04856979b5488159/report.jpg,https://cityworker.cityofboston.gov:8443/attachments/report/5738a197d05243d389fcbd62/closed_photo/Report.jpg,77-79 Fulton St  Boston  MA  02109,3.0,1B,1.0,A1,Downtown / Financial District,3.0,Ward 3,0301,R4,77-79 Fulton St,2109.0,Address,61457.0,42.3619,-71.0533,Citizens Connect App,"(42.3619, -71.0533)",-7909617.175181704,5215345.41471508
213034,101000364271,12/14/2011 01:12:21 PM,12/28/2011 01:12:21 PM,,OVERDUE,Open,,Other: Compliment,Mayor's 24 Hour Hotline,Employee & General Comments,General Comments For a Program or Policy,INFO_General Comments Complaints Compliments,INFO,,,,,,,,,,,,,,,,,42.3594,-71.0587,Constituent Call,"(0, 0)",-7910218.300431989,5214968.784796895
882575,101001774019,04/22/2016 12:34:37 PM,04/25/2016 12:34:35 PM,04/22/2016 12:54:50 PM,ONTIME,Closed,Case Closed. Closed date : 2016-04-22 12:54:50.237 Case Noted Trash collected on 4/22/16.,Missed Trash: District 07,Public Works Department,Sanitation,Missed Trash/Recycling/Yard Waste/Bulk Item,PWDx_Missed Trash\Recycling\Yard Waste\Bulk Item,PWDx,,,43A Carruth St  Dorchester  MA  02124,8.0,07,3.0,C11,Dorchester,7.0,Ward 16,1611,R3,43A Carruth St,2124.0,Address,26118.0,42.2831,-71.0608,Self Service,"(42.2831, -71.0608)",-7910452.071362655,5203481.238035089
100311,101001222626,11/24/2014 10:07:12 AM,,11/24/2014 10:08:10 AM,ONTIME,Closed,Case Closed Case Resolved Case resolved  information provided.,Call Log,Disability Department,Disability,Call Log,DISB_General_Request,DISB,,,,,,,,,,,,,,,,,42.3594,-71.0587,Constituent Call,"(0, 0)",-7910218.300431989,5214968.784796895
832054,101001409458,06/15/2015 07:59:00 AM,06/17/2015 07:59:57 AM,06/18/2015 03:37:48 PM,OVERDUE,Closed,Case Closed. Closed date : 2015-06-18 15:37:48.637 NOACC: Closed-No Access,Work w/out Permit,Inspectional Services,Building,Work w/out Permit,ISD_Building (INTERNAL),ISD,,,27 Beryl St  Roslindale  MA  02131,12.0,06,5.0,E5,Roslindale,10.0,20,2009,R2,27 Beryl St,2131.0,Address,15223.0,42.2827,-71.1391,Constituent Call,"(42.2827, -71.1391)",-7919168.387491768,5203421.051667211
907930,101001992273,01/19/2017 06:56:00 PM,02/07/2017 08:30:00 AM,01/20/2017 07:48:27 AM,ONTIME,Closed,Case Closed. Closed date : 2017-01-20 07:48:27.897 Case Noted Will check area.,Abandoned Vehicles,Transportation - Traffic Division,Enforcement & Abandoned Vehicles,Abandoned Vehicles,BTDT_Parking Enforcement,BTDT,https://mayors24.cityofboston.gov/media/boston/report/photos/5881520a04854e2a97038cdb/report.jpg,,INTERSECTION of Winchester St & Church St  Boston  MA,4.0,1C,2.0,A1,Back Bay,6.0,5,0501,,INTERSECTION Winchester St & Church St,,Intersection,15547.0,42.3594,-71.0587,Citizens Connect App,"(0, 0)",-7910218.300431989,5214968.784796895
879459,101001295821,02/15/2015 01:08:46 PM,02/19/2015 08:30:00 AM,02/20/2015 01:00:42 AM,OVERDUE,Closed,Case Closed Case Resolved,Request for Snow Plowing,Public Works Department,Street Cleaning,Request for Snow Plowing,PWDx_District 08: Hyde Park,PWDx,,,94 Chesterfield St  Hyde Park  MA  02136,12.0,08,5.0,E18,Hyde Park,10.0,Ward 18,1820,R1,94 Chesterfield St,2136.0,Address,30986.0,42.2421,-71.1388,Constituent Call,"(42.2421, -71.1388)",-7919134.99164453,5197314.1216153065
411011,101000448752,07/12/2012 10:07:29 AM,08/09/2012 10:07:29 AM,07/28/2012 01:51:27 PM,ONTIME,Closed,Case Closed Case Resolved  alex delivered serial #0512410510,Request for Recycling Cart,Public Works Department,Recycling,Request for Recycling Cart,PWDx_Recycling,PWDx,,,14-24 Huckins St  Roxbury  MA  02119,7.0,03,7.0,B2,Roxbury,13.0,Ward 8,0805,EA,14-24 Huckins St,2119.0,Address,166360.0,42.3239,-71.0753,Constituent Call,"(42.3239, -71.0753)",-7912066.203979157,5209622.256156272
627354,101001272621,02/04/2015 01:15:07 AM,02/06/2015 08:30:00 AM,02/12/2015 05:43:33 PM,OVERDUE,Closed,Case Closed Case Noted Snow has been removed.,Request for Snow Plowing,Public Works Department,Street Cleaning,Request for Snow Plowing,PWDx_District 02: Jamaica Plain,PWDx,,,INTERSECTION of Florence St & Harrison St  Roslindale  MA,12.0,02,5.0,E5,Roslindale,10.0,Ward 19,1913,,INTERSECTION Florence St & Harrison St,,Intersection,4961.0,42.2872,-71.1214,Citizens Connect App,"(42.2872, -71.1214)",-7917198.032504726,5204098.170338239
188347,101000304938,07/22/2011 07:58:33 AM,07/21/2012 07:58:32 AM,01/20/2012 09:04:51 AM,ONTIME,Closed,Case Closed Case Noted Sidewalk was inspected and not in need of repair.,Sidewalk Repair/Concrete/Dist 7,Public Works Department,Highway Maintenance,Sidewalk Repair,PWDx_Highway Construction,PWDx,,,27 Whitridge St  Dorchester  MA  02124,8.0,07,3.0,C11,Dorchester,7.0,Ward 16,1612,R1,27 Whitridge St,2124.0,Address,149460.0,42.2809,-71.0501,Constituent Call,"(42.2809, -71.0501)",-7909260.952811166,5203150.21774014
40004,101001047434,03/14/2014 04:47:27 PM,,03/14/2014 04:51:47 PM,ONTIME,Closed,Case Closed Case Invalid opened in error,General Comments For An Employee,Mayor's 24 Hour Hotline,Employee & General Comments,General Comments For An Employee,INFO_General Comments Complaints Compliments,INFO,,,,,,,,,,,,,,,,,42.3594,-71.0587,Constituent Call,"(0, 0)",-7910218.300431989,5214968.784796895
415051,101001743669,03/10/2016 09:36:00 AM,03/24/2016 09:36:00 AM,03/10/2016 09:38:17 AM,ONTIME,Closed,Case Closed. Closed date : 2016-03-10 09:38:17.533 Case Resolved,Sign Repair,Transportation - Traffic Division,Signs & Signals,Sign Repair,BTDT_Sign Shop_Sign Installation,BTDT,,,INTERSECTION of Moore St & Bennington St  East Boston  MA,1.0,09,1.0,A7,East Boston,1.0,1,0111,,INTERSECTION Moore St & Bennington St,,Intersection,16143.0,42.3594,-71.0587,Employee Generated,"(0, 0)",-7910218.300431989,5214968.784796895
827829,101000849571,05/30/2013 02:57:31 PM,,06/07/2013 09:48:18 PM,ONTIME,Closed,Case Closed Bulk Item Automation,Schedule Bulk Item Pickup,Public Works Department,Sanitation,Schedule a Bulk Item Pickup SS,PWDx_Schedule a Bulk Item Pickup,PWDx,,,5300 Washington St  West Roxbury  MA  02132,12.0,06,6.0,E5,West Roxbury,12.0,Ward 20,2015,E,5300 Washington St,2132.0,Address,145709.0,42.2583,-71.1599,Self Service,"(42.2583, -71.1599)",-7921483.832900268,5199750.405485941
659016,101001783608,05/06/2016 08:34:29 AM,05/09/2016 08:34:29 AM,05/06/2016 09:11:29 AM,ONTIME,Closed,Case Closed. Closed date : 2016-05-06 09:11:29.763 Case Noted Clear now.,Parking Enforcement,Transportation - Traffic Division,Enforcement & Abandoned Vehicles,Parking Enforcement,BTDT_Parking Enforcement,BTDT,https://mayors24.cityofboston.gov/media/boston/report/photos/572c8f5204859952567018d9/report.jpg,,333-345 W First St  South Boston  MA  02127,6.0,05,2.0,C6,South Boston,5.0,06,604.0,I,333-345 W First St,2127.0,Address,58454.0,42.3388,-71.046,Citizens Connect App,"(42.3388, -71.046)",-7908804.542898915,5211865.924529353
126294,101000354613,11/16/2011 09:37:59 AM,11/17/2011 09:37:58 AM,11/18/2011 08:47:39 AM,OVERDUE,Closed,Case Closed NOVIO: No Violation Found/No Cause,Scanning Overcharge,Inspectional Services,Weights and Measures,Scanning Overcharge,ISD_Weights and Measures (INTERNAL),ISD,,,231 Massachusetts Ave  Boston  MA  02115,4.0,10A,7.0,D4,Back Bay,14.0,Ward 4,0405,RC,231 Massachusetts Ave,2115.0,Address,155784.0,42.3443,-71.0867,Constituent Call,"(42.3443, -71.0867)",-7913335.2461741995,5212694.258600719
662655,101001397239,05/28/2015 03:45:00 PM,06/02/2015 03:45:20 PM,06/03/2015 08:17:26 AM,OVERDUE,Closed,Case Closed. Closed date : 2015-06-03 08:17:26.283 CORR: Corrected,Building Inspection Request,Inspectional Services,Building,Building Inspection Request,ISD_Building (INTERNAL),ISD,,,59 Elm St  Charlestown  MA  02129,3.0,1A,1.0,A15,Charlestown,2.0,Ward 2,204.0,CM,59 Elm St,2129.0,Address,53108.0,42.3785,-71.0628,Constituent Call,"(42.3785, -71.0628)",-7910674.710344241,5217846.617584654
882663,101001795004,05/20/2016 10:43:43 AM,09/17/2016 10:43:43 AM,05/20/2016 10:44:05 AM,ONTIME,Closed,Case Closed. Closed date : 2016-05-20 10:44:05.43 :,Unsatisfactory Living Conditions,Inspectional Services,Housing,Unsatisfactory Living Conditions,ISD_Housing (INTERNAL),ISD,,,96 Woodledge St  Dorchester  MA  02125,7.0,03,7.0,B2,Roxbury,13.0,Ward 13,1304,R4,96 Woodledge St,2125.0,Address,338525.0,42.315,-71.0744,Constituent Call,"(42.315, -71.0744)",-7911966.016437443,5208282.3318877565
162383,101000745515,01/31/2013 11:11:28 AM,02/01/2013 11:11:28 AM,01/31/2013 11:11:52 AM,ONTIME,Closed,Case Closed Case Invalid,Tree Emergencies,Parks & Recreation Department,Trees,Tree Emergencies,PARK_Tree Emergencies,PARK,,,9 Alhambra Rd  West Roxbury  MA  02132,12.0,06,6.0,E5,West Roxbury,12.0,Ward 20,2018,R2,9 Alhambra Rd,2132.0,Address,2093.0,42.2889,-71.154,Constituent Call,"(42.2889, -71.154)",-7920827.047904588,5204353.983312822
581698,101001807110,06/04/2016 07:10:34 PM,06/20/2016 08:30:00 AM,06/06/2016 09:06:49 AM,ONTIME,Closed,Case Closed. Closed date : 2016-06-06 09:06:49.477 Case Resolved Sticker removed by SD-6,Sign Repair,Transportation - Traffic Division,Signs & Signals,Sign Repair,BTDT_District 03,BTDT,https://mayors24.cityofboston.gov/media/boston/report/photos/57535fe169634c08271dd0e8/photo_20160604_190802.jpg,,108 Peterborough St  Boston  MA  02215,4.0,10A,8.0,D4,Fenway / Kenmore / Audubon Circle / Longwood,14.0,Ward 21,2101,CD,108 Peterborough St,2215.0,Address,109708.0,42.3429,-71.0998,Citizens Connect App,"(42.3429, -71.0998)",-7914793.531503593,5212483.403053326
327538,101000383100,02/10/2012 09:06:12 AM,,02/10/2012 09:06:13 AM,ONTIME,Closed,Case Closed Internal Case Performed by Highway Maintenance crew.,Pothole Repair (Internal),Public Works Department,Highway Maintenance,Pothole Repair (Internal),PWDx_District 1B: North End,PWDx,,,63 Atlantic Ave  Boston  MA  02110,3.0,1B,1.0,A1,Boston,3.0,03,0301,CD,63 Atlantic Ave,2110.0,Address,6316.0,42.3594,-71.0587,Employee Generated,"(0, 0)",-7910218.300431989,5214968.784796895
346163,101001274101,02/04/2015 10:53:33 AM,02/06/2015 10:53:33 AM,02/12/2015 05:45:08 PM,OVERDUE,Closed,Case Closed Case Noted Snow has been removed.,Request for Snow Plowing,Public Works Department,Street Cleaning,Request for Snow Plowing,PWDx_District 07: South Dorchester,PWDx,https://mayors24.cityofboston.gov/media/boston/report/photos/54d24060696360a7216ac0cd/report.jpg,,INTERSECTION of Darlington St & Wentworth St  Dorchester  MA,8.0,07,4.0,B3,Dorchester,9.0,Ward 17,1708,,INTERSECTION Darlington St & Wentworth St,,Intersection,3906.0,42.2886,-71.0756,Citizens Connect App,"(42.2886, -71.0756)",-7912099.599826395,5204308.83934507
733188,101001750080,03/20/2016 10:18:00 AM,03/24/2016 08:30:00 AM,03/22/2016 08:18:42 AM,ONTIME,Closed,Case Closed. Closed date : 2016-03-22 08:18:42.533 ROA: Refer to Other Agency/Division,Illegal Auto Body Shop,Inspectional Services,Environmental Services,Illegal Auto Body Shop,ISD_Environmental Services (INTERNAL),ISD,,,27 Oakridge St  Mattapan  MA  02126,8.0,07,3.0,B3,Dorchester,7.0,Ward 17,1712,R2,27 Oakridge St,2126.0,Address,104865.0,42.2772,-71.0747,Constituent Call,"(42.2772, -71.0747)",-7911999.412284682,5202593.5278529655
54112,101001433860,07/21/2015 09:34:00 AM,07/20/2016 09:34:20 AM,12/30/2015 02:57:46 PM,ONTIME,Closed,Case Closed. Closed date : 2015-12-30 14:57:46.06 Case Resolved Tree was removed by North-Eastern Tree Service. A new tree request case will be made for this location. If you have any questions please call the Park Line at 617-635-7275.,Tree Maintenance Requests,Parks & Recreation Department,Trees,Tree Maintenance Requests,PARK_Tree Maintenance Request,PARK,,,43 Hano St  Allston  MA  02134,11.0,04,9.0,D14,Allston / Brighton,15.0,Ward 22,2202,R1,43 Hano St,2134.0,Address,68998.0,42.3558,-71.1374,Self Service,"(42.3558, -71.1374)",-7918979.14435742,5214426.46403861
223744,101000862299,06/18/2013 01:08:56 PM,,06/24/2013 03:09:24 PM,ONTIME,Closed,Case Closed Case Resolved THIS IS NOT A HYDRANT  IT IS AN ABANDONED FIRE ALARM BOX 6/20,Catchbasin,Boston Water & Sewer Commission,Catchbasin,Catchbasin,BWSC_All Cases,BWSC,,,102 Talbot Ave  Dorchester  MA  02124,8.0,03,4.0,B3,Greater Mattapan,8.0,Ward 14,1402,A,102 Talbot Ave,2124.0,Address,133655.0,42.2936,-71.0829,City Worker App,"(42.2936, -71.0829)",-7912912.232109185,5205061.266879149
456946,101001396541,05/28/2015 08:18:27 AM,05/29/2015 08:30:00 AM,05/29/2015 03:28:15 PM,OVERDUE,Closed,Case Closed. Closed date : 2015-05-29 15:28:15.087 Case Resolved,Sidewalk Repair (Make Safe),Public Works Department,Highway Maintenance,Sidewalk Repair (Make Safe),PWDx_District 1C: Downtown,PWDx,https://mayors24.cityofboston.gov/media/boston/report/photos/5567079c6963fceae0f1ce13/report.jpg,,190 Commonwealth Ave  Boston  MA  02116,4.0,1C,8.0,D4,Boston,14.0,05,0507,,190 Commonwealth Ave,2116.0,Address,344932.0,42.3511,-71.08,Citizens Connect App,"(42.3511, -71.08)",-7912589.405585884,5213718.480913229
193495,101000999812,01/07/2014 10:21:14 AM,05/07/2014 10:21:14 AM,02/07/2014 09:08:50 AM,ONTIME,Closed,Case Closed :,Unsatisfactory Living Conditions,Inspectional Services,Housing,Unsatisfactory Living Conditions,ISD_Housing (INTERNAL),ISD,,,18 Greenwood St  Dorchester  MA  02121,7.0,03,4.0,B3,Greater Mattapan,8.0,Ward 14,1402,R3,18 Greenwood St,2121.0,Address,244047.0,42.3015,-71.0795,Constituent Call,"(42.3015, -71.0795)",-7912533.745840489,5206250.224143935
535251,101001172314,09/15/2014 12:50:18 PM,09/17/2014 12:50:18 PM,09/19/2014 11:21:57 AM,OVERDUE,Closed,Case Closed Case Noted no work needed at the time of inspection. The tree pit at this location is level. The BPRD only removes cobble stones if and when the tree is removed.,Sidewalk Repair (Make Safe),Public Works Department,Highway Maintenance,Sidewalk Repair (Make Safe),PARK_Tree Maintenance Request,PARK,https://cityworker.cityofboston.gov:8443/attachments/report/541718c7d052095ae48cb097/photo/Report.jpg,https://cityworker.cityofboston.gov:8443/attachments/report/541718c7d052095ae48cb097/closed_photo/Report.jpg,180 W Brookline St  Roxbury  MA  02118,4.0,1C,2.0,D4,South End,6.0,Ward 4,0403,R2,180 W Brookline St,2118.0,Address,22303.0,42.3428,-71.0764,City Worker App,"(42.3428, -71.0764)",-7912188.65541903,5212468.342122461
455797,101000351856,11/08/2011 09:16:54 AM,11/15/2011 09:16:54 AM,02/09/2012 05:57:01 PM,OVERDUE,Closed,Case Closed NOVIO: No Violation Found/No Cause,Plumbing,Inspectional Services,Building,Plumbing,ISD_Building (INTERNAL),ISD,,,627 Lagrange St  West Roxbury  MA  02132,12.0,06,6.0,E5,West Roxbury,12.0,Ward 20,2012,R1,627 Lagrange St,2132.0,Address,82849.0,42.2867,-71.1643,Constituent Call,"(42.2867, -71.1643)",-7921973.638659758,5204022.932541867
894983,101001979652,01/01/2017 04:28:00 PM,01/04/2017 08:30:00 AM,01/01/2017 11:50:23 PM,ONTIME,Closed,Case Closed. Closed date : 2017-01-01 23:50:23.687 Case Resolved TV picked up,Requests for Street Cleaning,Public Works Department,Street Cleaning,Requests for Street Cleaning,PWDx_District 10B: Roxbury,PWDx,https://mayors24.cityofboston.gov/media/boston/report/photos/5869747b04859492d2c16a89/report.jpg,,103 Townsend St  Dorchester  MA  02121,9.0,10B,7.0,B2,Roxbury,13.0,Ward 12,1208,R3,103 Townsend St,2121.0,Address,136401.0,42.3179,-71.0903,Citizens Connect App,"(42.3179, -71.0903)",-7913735.996341055,5208718.915609538
497057,101001959055,11/26/2016 09:37:00 PM,11/26/2017 09:37:19 PM,11/28/2016 10:56:46 AM,ONTIME,Closed,Case Closed. Closed date : 2016-11-28 10:56:46.83 Case Resolved no code voilation found,Tree Maintenance Requests,Parks & Recreation Department,Trees,Tree Maintenance Requests,PWDx_Code Enforcement,PWDx,https://mayors24.cityofboston.gov/media/boston/report/photos/583a46da04859c3a5caec089/photo_20161126_213657.jpg,https://cityworker.cityofboston.gov:8443/attachments/report/583a472ed0521e12073afcc6/closed_photo/Report.jpg,814 South St  Roslindale  MA  02131,9.0,06,5.0,E5,Roslindale,10.0,Ward 20,2004,C,814 South St,2131.0,Address,128955.0,42.2878,-71.1313,Citizens Connect App,"(42.2878, -71.1313)",-7918300.09546358,5204188.456482149
801281,101000949017,10/18/2013 02:38:28 PM,,10/18/2013 02:38:29 PM,ONTIME,Closed,Case Closed Internal Case Performed by Highway Maintenance crew.,Pothole Repair (Internal),Public Works Department,Highway Maintenance,Pothole Repair (Internal),PWDx_District 03: North Dorchester,PWDx,,,52 Harvard St  Dorchester  MA  02124,8.0,03,4.0,B3,Dorchester,9.0,Ward 17,1701,R1,52 Harvard St,2124.0,Address,70900.0,42.2979,-71.0757,Employee Generated,"(42.2979, -71.0757)",-7912110.731775475,5205708.402335147
658422,101001626774,11/03/2015 12:10:00 PM,11/18/2015 12:10:55 PM,11/06/2015 12:56:20 PM,ONTIME,Closed,Case Closed. Closed date : 2015-11-06 12:56:20.653 Case Resolved Work completed 11/6/15.,Sign Repair,Transportation - Traffic Division,Signs & Signals,Sign Repair,BTDT_Sign Shop_Sign Installation,BTDT,,,INTERSECTION of Central Ave & Webster St  Hyde Park  MA,12.0,08,5.0,E18,Hyde Park,10.0,Ward 18,1813.0,,INTERSECTION Central Ave & Webster St,,Intersection,2590.0,42.2581,-71.12100000000001,City Worker App,"(42.2581, -71.121)",-7917153.504708411,5199720.324092084
635320,101001241668,01/03/2015 01:03:48 PM,01/07/2015 08:30:00 AM,01/03/2015 01:57:14 PM,ONTIME,Closed,Case Closed Case Resolved Area swept,Requests for Street Cleaning,Public Works Department,Street Cleaning,Requests for Street Cleaning,PWDx_District 10B: Roxbury,PWDx,https://mayors24.cityofboston.gov/media/boston/report/photos/54a82eda04855a39b2f89534/photo_20150103_130214.jpg,,883 Harrison Ave  Roxbury  MA  02118,7.0,10B,7.0,D4,Roxbury,13.0,Ward 8,0803,CM,883 Harrison Ave,2118.0,Address,70088.0,42.3342,-71.0765,Citizens Connect App,"(42.3342, -71.0765)",-7912199.7873681085,5211173.191669293
89326,101001214386,11/10/2014 09:42:35 AM,11/13/2014 09:42:35 AM,11/10/2014 12:47:21 PM,ONTIME,Closed,Case Closed Case Resolved deliver recycle sticker on .11/10/14.,Sticker Request,Public Works Department,Recycling,Sticker Request,PWDx_Sticker Request,PWDx,,,52 Paul Gore St  Jamaica Plain  MA  02130,9.0,02,6.0,E13,Jamaica Plain,11.0,Ward 19,1901,R3,52 Paul Gore St,2130.0,Address,108584.0,42.32,-71.1084,Constituent Call,"(42.32, -71.1084)",-7915750.879124414,5209035.075002586
407860,101000817475,04/05/2013 11:00:52 AM,04/09/2013 11:00:52 AM,04/05/2013 12:17:06 PM,ONTIME,Closed,Case Closed Case Noted trashed picked up by Capitol. on 4/5/13@12:17pm,Missed Trash: District 10B,Public Works Department,Sanitation,Missed Trash/Recycling/Yard Waste/Bulk Item,PWDx_Missed Trash\Recycling\Yard Waste\Bulk Item,PWDx,,,3 Holborn Park  Dorchester  MA  02121,9.0,10B,7.0,B2,Roxbury,13.0,Ward 12,1206,R1,3 Holborn Park,2121.0,Address,74447.0,42.3149,-71.0808,Constituent Call,"(42.3149, -71.0808)",-7912678.46117852,5208267.277635488
699623,101000939013,10/02/2013 01:41:39 PM,10/04/2013 01:41:39 PM,10/02/2013 01:41:41 PM,ONTIME,Closed,Case Closed Case Resolved Marked completed at case creation,Requests for Street Cleaning,Public Works Department,Street Cleaning,Requests for Street Cleaning,PWDx_District 06: West Roxbury and Roslindale,PWDx,,,305 Cornell St  Roslindale  MA  02131,12.0,06,5.0,E5,Roslindale,10.0,Ward 20,2009,R2,305 Cornell St,2131.0,Address,43011.0,42.2816,-71.1384,City Worker App,"(42.2816, -71.1384)",-7919090.463848214,5203255.541125724
462535,101001336704,03/18/2015 07:02:18 PM,04/02/2015 08:30:00 AM,04/13/2015 08:53:55 AM,OVERDUE,Closed,Case Closed Case Noted,Parking Meter Repairs,Transportation - Traffic Division,Operations,Parking Meter Repairs,BTDT_Broken Meter Complaints,BTDT,,,179 Newbury St  Boston  MA  02116,4.0,1C,8.0,D4,Back Bay,14.0,Ward 5,0507,RC,179 Newbury St,2116.0,Address,101384.0,42.3507,-71.0795,Constituent Call,"(42.3507, -71.0795)",-7912533.745840489,5213658.229474797
421507,101000895182,08/06/2013 08:20:54 AM,,08/06/2013 08:20:55 AM,ONTIME,Closed,Case Closed Internal Case Performed by Highway Maintenance crew.,Pothole Repair (Internal),Public Works Department,Highway Maintenance,Pothole Repair (Internal),PWDx_District 09: East Boston,PWDx,,,115 Boardman St  East Boston  MA  02128,1.0,09,1.0,A7,East Boston,1.0,Ward 1,0113,CM,115 Boardman St,2128.0,Address,16669.0,42.3905,-71.0118,Employee Generated,"(42.3905, -71.0118)",-7904997.416313783,5219655.12782162
414678,101001711834,02/08/2016 06:02:00 AM,,02/16/2016 02:11:50 PM,ONTIME,Closed,Case Closed. Closed date : 2016-02-16 14:11:50.99 Case Noted,Power Outage,Mayor's 24 Hour Hotline,Notification,Notification,INFO09_Current Events,INFO,,,61-67 Shirley St  Roxbury  MA  02119,7.0,03,7.0,B2,Roxbury,13.0,Ward 8,0806,I,61-67 Shirley St,2119.0,Address,127213.0,42.3239,-71.0706,Constituent Call,"(42.3239, -71.0706)",-7911543.002372429,5209622.256156272
209087,101000930104,09/19/2013 08:32:53 AM,,09/23/2013 09:49:34 PM,ONTIME,Closed,Case Closed Bulk Item Automation,Schedule a Bulk Item Pickup,Public Works Department,Sanitation,Schedule a Bulk Item Pickup,PWDx_Schedule a Bulk Item Pickup,PWDx,,,327 Faneuil St  Brighton  MA  02135,11.0,04,9.0,D14,Allston / Brighton,15.0,Ward 22,2207,A,327 Faneuil St,2135.0,Address,233368.0,42.3525,-71.164,Constituent Call,"(42.3525, -71.164)",-7921940.242812521,5213929.363967346
408091,101000779162,02/12/2013 04:10:21 PM,02/14/2013 04:10:20 PM,02/16/2013 12:10:11 PM,OVERDUE,Closed,Case Closed Case Resolved at that location snow removed,Request for Snow Plowing,Public Works Department,Street Cleaning,Request for Snow Plowing,PWDx_District 04: Allston/Brighton,PWDx,,,54 Dighton St  Brighton  MA  02135,11.0,04,9.0,D14,Allston / Brighton,15.0,22,2209,E,54 Dighton St,2135.0,Address,156277.0,42.3476,-71.1553,Constituent Call,"(42.3476, -71.1553)",-7920971.763242619,5213191.293826943
189592,101000351798,11/08/2011 07:38:02 AM,11/10/2011 07:38:02 AM,11/08/2011 11:01:07 AM,ONTIME,Closed,Case Closed Case Resolved  this has been collected.,Missed Recycling: District 10B,Public Works Department,Sanitation,Missed Trash/Recycling/Yard Waste/Bulk Item,PWDx_Missed Trash\Recycling\Yard Waste\Bulk Item,PWDx,,,1 Beech Glen St  Roxbury  MA  02119,9.0,10B,7.0,B2,Roxbury,13.0,Ward 11,1101,,1 Beech Glen St,2119.0,Address,155318.0,42.3594,-71.0587,Self Service,"(0, 0)",-7910218.300431989,5214968.784796895
275257,101001315931,02/25/2015 11:51:15 AM,02/26/2015 11:51:14 AM,03/23/2015 02:56:24 PM,OVERDUE,Closed,Case Closed Case Resolved street swept by sweeper,Requests for Street Cleaning,Public Works Department,Street Cleaning,Requests for Street Cleaning,PWDx_District 03: North Dorchester,PWDx,https://mayors24.cityofboston.gov/media/boston/report/photos/54edfd7904859c1f0a33ffe2/photo_20150225_114910.jpg,,INTERSECTION of Bay St & Maryland St  Dorchester  MA,7.0,03,3.0,C11,Dorchester,8.0,Ward 15,1506,,INTERSECTION Bay St & Maryland St,,Intersection,1032.0,42.31100000000001,-71.0556,Citizens Connect App,"(42.311, -71.0556)",-7909873.2100105295,5207680.180453827
900207,101001958622,11/25/2016 08:05:00 PM,12/12/2016 08:30:00 AM,,OVERDUE,Open,,PRINTED : Street Light Outage. - NO Power - Maverick states NO Eversource power SENT,Public Works Department,Street Lights,Street Light Outages,PWDx_Street Light Outages - Long-Term Repair,PWDx,,,INTERSECTION of Merchants Row & State St  Boston  MA,3.0,1B,2.0,A1,Downtown / Financial District,3.0,3,0306,,INTERSECTION Merchants Row & State St,,Intersection,14086.0,42.3594,-71.0587,Citizens Connect App,"(0, 0)",-7910218.300431989,5214968.784796895
205534,101001890163,08/24/2016 02:57:00 PM,08/25/2016 02:58:06 PM,08/25/2016 08:58:06 AM,ONTIME,Closed,Case Closed. Closed date : 2016-08-25 08:58:06.657 Case Resolved pick up one barrel of trash and tag one bag of yard waste  left a calendar .7/25/16,Missed Trash: District 02,Public Works Department,Sanitation,Missed Trash/Recycling/Yard Waste/Bulk Item,PWDx_Missed Trash\Recycling\Yard Waste\Bulk Item,PWDx,,,15 Lindall St  Roslindale  MA  02131,12.0,02,5.0,E5,Roslindale,10.0,Ward 19,1913,R1,15 Lindall St,2131.0,Address,86315.0,42.2859,-71.1259,Employee Generated,"(42.2859, -71.1259)",-7917698.970213297,5203902.553309751
588665,101000784093,02/15/2013 02:11:47 PM,02/05/2015 02:11:46 PM,07/08/2013 11:05:38 AM,ONTIME,Closed,Case Closed Case Resolved planted spring 2013,New Tree Requests,Parks & Recreation Department,Trees,New Tree Requests,PARK_New Tree Requests,PARK,,,92 Church St  West Roxbury  MA  02132,9.0,06,6.0,E5,West Roxbury,12.0,Ward 20,2019,R1,92 Church St,2132.0,Address,32787.0,42.2908,-71.1482,Employee Generated,"(42.2908, -71.1482)",-7920181.394857988,5204639.900101502
258162,101001719650,02/18/2016 10:57:00 AM,03/03/2016 10:57:24 AM,02/23/2016 11:55:08 AM,ONTIME,Closed,Case Closed. Closed date : 2016-02-23 11:55:08.57 Case Resolved Work completed 2/23/16.,Sign Repair,Transportation - Traffic Division,Signs & Signals,Sign Repair,BTDT_Sign Shop_Sign Installation,BTDT,,,27-29 Ivory St  West Roxbury  MA  02132,12.0,06,6.0,E5,West Roxbury,12.0,20,2013,,27-29 Ivory St,2132.0,Address,419286.0,42.2811,-71.1627,City Worker App,"(42.2811, -71.1627)",-7921795.527474489,5203180.310016623
613277,101001107756,06/12/2014 09:10:12 AM,07/11/2014 09:10:11 AM,06/19/2014 08:36:22 AM,ONTIME,Closed,Case Closed Case Resolved not at location 6/17.,Abandoned Vehicles,Transportation - Traffic Division,Enforcement & Abandoned Vehicles,Abandoned Vehicles,BTDT_AVRS Interface Queue,BTDT,,,291-293 Wood Ave  Hyde Park  MA  02136,12.0,08,5.0,E18,Hyde Park,10.0,Ward 18,1815,R2,291-293 Wood Ave,2136.0,Address,151274.0,42.263999999999996,-71.1097,Employee Generated,"(42.264, -71.1097)",-7915895.594462446,5200607.765321191
604908,101001232632,12/13/2014 08:33:04 AM,12/17/2014 08:30:00 AM,12/15/2014 09:49:20 AM,ONTIME,Closed,Case Closed Case Noted need better location......,Request for Pothole Repair,Public Works Department,Highway Maintenance,Request for Pothole Repair,PWDx_District 10A: Roxbury,PWDx,https://mayors24.cityofboston.gov/media/boston/report/photos/548c400a696308df59b3daea/photo_20141213_083208.jpg,,497 Commonwealth Ave  Boston  MA  02215,4.0,10A,8.0,D4,Fenway / Kenmore / Audubon Circle / Longwood,14.0,Ward 5,0510,C,497 Commonwealth Ave,2215.0,Address,41011.0,42.3493,-71.0947,Citizens Connect App,"(42.3493, -71.0947)",-7914225.802100547,5213447.352459726
241616,101001623725,10/29/2015 05:55:00 PM,11/02/2015 08:30:00 AM,10/30/2015 09:31:45 AM,ONTIME,Closed,Case Closed. Closed date : 2015-10-30 09:31:45.1 Case Noted material serviced,Missed Leaf or Yard Trash: District 08,Public Works Department,Sanitation,Missed Trash/Recycling/Yard Waste/Bulk Item,PWDx_Missed Trash\Recycling\Yard Waste\Bulk Item,PWDx,,https://cityworker.cityofboston.gov:8443/attachments/report/56329627d052cda8c396345f/closed_photo/Report.jpg,16 Hilton St  Hyde Park  MA  02136,12.0,08,5.0,E18,Hyde Park,10.0,Ward 18,1814,R2,16 Hilton St,2136.0,Address,74312.0,42.2617,-71.1205,Constituent Call,"(42.2617, -71.1205)",-7917097.844963014,5200261.80377952
698180,101001729683,03/04/2016 08:01:00 AM,04/18/2016 08:01:00 AM,03/17/2016 04:16:34 AM,ONTIME,Closed,Case Closed. Closed date : 2016-03-17 04:16:34.093 Case Resolved Work Completed Last week,PRINTED,Public Works Department,Street Lights,General Lighting Request,PWDx_Street Light_General Lighting Request,PWDx,,,355 Commonwealth Ave  Boston  MA  02115,4.0,1C,8.0,D4,Back Bay,14.0,Ward 5,0509,RC,355 Commonwealth Ave,2115.0,Address,40360.0,42.3496,-71.0885,Employee Generated,"(42.3496, -71.0885)",-7913535.621257628,5213492.539996134
794846,101001345153,03/30/2015 03:35:05 PM,,03/30/2015 03:35:06 PM,ONTIME,Closed,Case Closed Internal Case Performed by Highway Maintenance crew.,Pothole Repair (Internal),Public Works Department,Highway Maintenance,Pothole Repair (Internal),PWDx_District 06: West Roxbury and Roslindale,PWDx,,,23 Willers St  West Roxbury  MA  02132,12.0,06,6.0,E5,West Roxbury,10.0,Ward 20,2003,R2,23 Willers St,2132.0,Address,149775.0,42.2595,-71.1503,Employee Generated,"(42.2595, -71.1503)",-7920415.165788653,5199930.895852654
9182,101001234319,12/16/2014 04:39:08 PM,,12/16/2014 04:39:46 PM,ONTIME,Closed,Case Closed Case Resolved  - call transferred to Chardline for getting listing,Front Desk Interactions,Civil Rights,Call Inquiry,OCR Front Desk Interactions,HS_OCR_FrontDesk_Interactions,HS_O,,,,,,,,,,,,,,,,,42.3594,-71.0587,Constituent Call,"(0, 0)",-7910218.300431989,5214968.784796895
